Pilgrimanto de la Jarmilo
[2014-01-03]
https://pola-retradio.org/2014/01/pilgrimanto-de-la-jarmilo/

Ĝis la 20-a de januaro 2014 en Lodzo – la centra Pollando –  daŭras unika laŭ la monda skalo ekspozicio de fotoj de Johano Paŭlo la 2-a „Pilgrimanto de la Jarmilio”.  La kolekto konsistas el 300 fotoj de Papo-polo en plimulto ĝis nun neniam publikigitaj. Johano Paŭlo la 2-a ĉiam alte taksis kontaktojn kun homoj, estis homo karisma, energia kaj aktiva.  La prezentataj fotoj devenas el la riĉega kolekto de Servizio Fotografico [servicjo fotografiko] de „L’ Osservatore Romano” kaj atestas pri la eksterordinara pontifikado de Johano Paŭlo la 2-a. Ili prezentas la papon laŭ diversaj aspektoj. Kiel moralan aŭtoritatulon, kiu disvastigadis universalajn valorojn al ĉiuj homoj sendepende al ilia mondkoncepto, konfesio aŭ raso. Kiel­ politikiston, kiu dank’ al sia sindediĉo, humileco kaj amo en enorma maniero influis la formon de la hodiaŭa mondo. Kiel la  homon, kiu spertante penon kaj solecon dediĉis sian vivon al aliaj homoj. La ekspozicio konsistanta el 21 partoj – pro la temamplekso – rolas kiel eksterordinara dokumenta veturo tra la unuopaj etapoj de la pontifikado kaj agado de Johano Paŭlo la 2-a.

El la elsendo 03.01.2014. Legas Gabi

La ekspozicio pri la Pilgrimanto de la Jarmilo en Lodzo

--------------------------------------------------------------------------------

Koninda polo: pastro profesoro Michał Heller
[2014-01-03]
https://pola-retradio.org/2014/01/koninda-polo-pastro-profesoro-michal-heller/

Ĝis nun en niaj felietonoj pri konindaj poloj ni parolis pri personoj, kiuj ne plu estas inter ni. Ĉi-foje la heroo de nia felietono troviĝas inter ni, laboras, kreas kaj ankaŭ aktivas por la ministerojn de la vivo kaj la Universo proksimigi al meze inteligenta homo. Tia estas pastro profesoro Michał Heller teologo,  mondfama kosmologo kaj filozofo, profesoro de la filozofiaj sciencoj specialist­iĝanta pri natur­filozofio, fiziko, relativisma kosmologio kaj rilatoj inter la scienco kaj la religio. Ĝis nun aperis ĉirkaŭ 40 liaj libroj dediĉitaj al la temoj, estantaj la objekto de lia interesiĝo.  En 2008 pastro Heller kiel la unua polo fariĝis la laŭreato de Templeton-Premio atribuata pro la superado de barieroj inter la scienco kaj religio. La tutan premion en la alteco de unu miliono 600 mil dolaroj li destinis por establi Kopernik-Centron en Krakovo, kiu okupiĝas i.a. pri esploroj kaj klerigado koncerne sciencojn, filozofion kaj teologion, pri esplorado de la rilatoj inter scienco, filozofio kaj teologio, pri la esplorado de la influo  de la scienco, filozofio kaj teologio je kulturo, pri filozofio de la naturo kaj kosmologio. Michał Heller naskiĝis en la 1936-a jaro. Post la eksplodo de la 2-a mondmilito en 1940 li estis ekzilita al Siberio, kaj en 1944  transloĝig­ita al la loko Urbach en la regiono de Saratovo. Reveninte al Pollando en 1946 en Tarnów (la suda Pollando) li faris la abiturientan ekzamenon, tie li diplom­itiĝis en la sacerdotiga seminario,  kie li poste laboris kiel lekcianto. Li estis ankaŭ en Tarnów la unua dekano de la Teologia Fakultato. Pliajn studojn Michał Heller daŭrigis en la Fakultato pri Filozofio de la Katolika Lublina Universitato, kie en 1966 li doktoriĝis per disetaĵo pri relativisma kosmologio. Ekde 1990-a jaro li estis investita kiel ordinara profesoro de la Papa Teologia Akademio transformita en 2009 en Papan Universitaton de Johano Paŭlo la 2-a en Krakovo. En  metodologio de la scienco Heller – simile kiel aliaj filozofoj kaj fizikistoj antaŭaj kaj nunaj konsideras  “neimageblan efikecon de matematiko en natursciencoj cele la mondo­priskribon”, kiel tion vortumis Eugene Wigner. Heller premisas, ke la mondo sur la fundamenta nivelo  posedas strukturon, kiun matematiko komprenata kiel scienco pri strukturoj kapablas priskribi kaj krome certa matematika strukturo identas kun la strukturo de konkreta natur­fenomeno.  Necesas aldoni, ke matematika strukturo en tiu kompreno signifas la reton de  dependiĝoj inter certaj matematikaj estoj. Samtempe  esencaj estas la dependiĝoj kaj ne estoj. Liaopinie fiziko konsistas en rilatigo de matematikaj strukturoj al konkretaj strukturoj de la mondo.  Citante profesoron Heller  eblas diri, ke “matematiko estas Absoluto, la unusola sfero de la homa agado, kiu restis ne damaĝita per la origina peko”. En sia filozofio de hazardo Heller proponis starpunkton peran inter la interpreto de la mondo kiel sekvo de hazardaj eventoj [ekzemple en la koncepto de Blinda Horloĝisto de Richard Dawkins] kaj la t.n. Inteligenta Projekto, laŭ kiu ne ekzistas hazardo, kaj la tuta mondo estas fakte gvidata en determinita maniero de Dio. Heller anstataŭe proponas propran koncepton de Granda Matrico aŭ  reference al Einstein La Dia Plano. Liaopinie hazardo kiel fenomeno kun tre malalta verŝajno aperas kiel integra parto de la mondo­strukturo, kiun eblas percepti teoisme (La Dia Plano],  kiel ankaŭ en la maniero malpligrade identiĝanta kun la kristana religio. Laŭ Heller hazardoj estas nepre necesa parto de  matrico, kies konsiston formas natur­reguloj. Hazardoj determinas komencajn kondiĉojn, kiuj difinas la evoluvojojn de natur­sistemoj, kiuj sekve evoluas strikte konforme al la naturreguloj. Tiamaniere same hazardo, kiel malhazardo havas sian lokon en la strukturo de la fenomenoj. En siaj laboroj pastro Heller esploras ankaŭ laŭ la matematika konsidero la tiel nomatan Gravitan singular­econ. Temas pri stato, ekde kiu konforme al la teorio de Granda Eksplodo la Universo komencis sian ekziston. Li proponis krome kaj daŭre evoluigas certan matematikan modelon, kiu en originala maniero ligas la du plej grandajn  kaj samtempe ne kongruajn teoriojn de la nuntempa fiziko, la ĝeneralan realtivecon de  Einstein kaj kvantuman mekanikon. Pri ĉi tiu demandoj profesoro Heller kunlaboras kun matematikistoj kiel  prof. Wiesław Sasin, kiel doktoroj Leszek Pysiak kaj Zdzisław Odrzygóźdź. En pli vasta grupo de kunlaborantoj aktivas ankaŭ nia kolego, Tomek Miller – doktoriĝ­anto de la Varsovia Politekniko kaj stipendiito de Kopernik Centro en Krakovo, kiu aliĝis al la kunlaboro pri la menciita modelo.

El la elsendo 03.01.2014. Legas Barbara/Tomek

--------------------------------------------------------------------------------

E_elsendo el la 03.01.2014
[2014-01-03]
https://pola-retradio.org/2014/01/e_elsendo-el-la-03-01-2014/

Podkasto: Ludu en nova fenestro | Elŝutu

Frank Selten el Germanio estas la antaŭ­mikrofona gasto de la unua E-elsendo de la Pola RetRadio en 2014. Kvankam ni memorigas kelkajn E-rilatajn biografiajn informojn de nia gasto ni ĉefe koncentriĝas pri lia kariero de ĵaz­muzikisto de la bando Barrelhouse aŭdigante specimene fragmentojn el ĝia plej lasta KD Creole Spirit. Komence de la 296-a programo ĉe www.pola-retradio.org ni informas pri interesa ekspozicio pri Pilgrimanto de la Jarmilio en Lodzo. Nian felietonon pri koninda polo ni dediĉas al pastro profesoro Michał Heller. La E-informo rilatas al la antaŭnelonge aperintaj E-lingvaj lernolibroj pri fiziko. Kelkaj tekstoj kiel kutime estas paralalele aŭdeblaj kaj legeblaj en la rilataj paĝo­rubrikoj.

--------------------------------------------------------------------------------

Interparolo kun Frank Selten dum la UK en Rejkjaviko (2013)
[2014-01-03]
https://pola-retradio.org/2014/01/interparolo-kun-frank-selten-dum-la-uk-en-rejkjaviko-2013/

Frank Selten el Germanio al multaj aŭskultanoj de niaj elsendoj estas jam iom konata i.a. pro la pli frue aŭdiĝintaj interparoloj. En la lasta, registrita en Rejkjaviko  kvankam ni memorigas kelkajn rilatajn E-informojn el lia biografio ni koncentriĝas pri lia kariero de ĵazmuzikisto, kiu en 2013 solenis sian 50-jariĝon tiuterene dum la bando kun kiu li estas ligita de la komenco Barrelhouse solenis samjare sian 60-jariĝon. El la elsendo 03.01.2014 .

--------------------------------------------------------------------------------

Ĉinio, atrakcia laborloko
[2014-01-07]
https://pola-retradio.org/2014/01/cinio-atrakcia-laborloko/

Ne Kajmana Insularo, nek Aŭstralio – sed Ĉino estas la plej ofte elektata de eksterlandanoj loko por vivi kaj labori. Laŭ ekspertoj de la banko HSBC eksterlandajn al Azio logas unuavice altaj salajroj. Meze dum la jaro eblas gajni 74 mil dolarojn, tio estas je 10 mil pli ol ekvivalentas la meza salajro sur aliaj kontinentoj. Al la malavantaĝoj apartenas polucio en la ĉinaj metropoloj. HSBC enketis pli ol 7 mil personojn en 37 landoj. Post Ĉinio, kiel atrakcia laborloko,  viciĝis Germanio, Singapuro, Kajmana Insularo kaj Aŭstralio.

El la elsendo 07.01.2014. Legas Zbyszek

Cxinio, atrakcia laborloko

--------------------------------------------------------------------------------

Stabila nombro de la polaj retuzantoj
[2014-01-07]
https://pola-retradio.org/2014/01/stabila-nombro-de-la-polaj-retuzantoj/

La nombro de poloj utiligantaj la Interreton en la lastaj jaroj stabiliĝis. Temas pri 62 procentoj da poloj super la 15-a vivojaro. Laŭ la kvara eldono de Monda Interreta Raporto tiu ĉi grupo de la pola socio ne estas kohera kaj ĝiaj ciferecaj kapabloj ligiĝas unuavice kun aĝo. Inter 15-24 jaruloj eĉ 94 procentoj deklaras almenaŭ foj-fojan utiligadon de la Interreto. Inter personoj pli ol 60-jaraj nur 17 procentoj prezentis similan deklaron. Alia faktoro laŭ kiu eblus karakterizi la polan interretan populacion estas klereco. Ju pli kleraj estas poloj des pli ofte ili uzas la reton. Tiu elcento inter personoj kun universitata klereco egalas al 80 procentoj, dum nur al 20 procentoj inter homoj kun elementa edukiteco.  Preskaŭ 100-procente la reton utiligas lernantoj kaj studentoj. Kreskis elcento de la internaŭtoj inter senlaboruloj. La unuan fojon oni notis personojn, kiuj iam uzis interreton – sed nun pro manko de komputilo, altaj kostoj de la retuzo, ĝia senutileco rezignis pri tio.

El la elsendo 07.01.2014. Legas Milada

--------------------------------------------------------------------------------

E_elsendo el la 07.01.2014
[2014-01-07]
https://pola-retradio.org/2014/01/e_elsendo-el-la-07-01-2014/

Podkasto: Ludu en nova fenestro | Elŝutu

Birute Rozenfelde el Latvio, unu el la plej novaj Honoraj Membroj de UEA rakontas antaŭ nia mikrofono pri sia esperantisteco, aparte komencoj de la famaj Baltiaj E-Tagoj. En la informa parto de la 297-a E-elsendo ĉe www.pola-retradio.org ni parolas pri Ĉinio kiel atrakcia laborloko, pri stabila grupo de polaj internaŭtoj. Dank’ al temo el la pola gazetaro ni informas pri grandaj inform­kampanjo lige kun eksporto de polaj fruktoj. En la scienca bulteno ni informas pri sukceso de polaj esploristoj, kiuj troviĝas en la libro de TIME kaj pri esplorado de makakoj helpe de…. tabletoj. Muzike akompanas nin ĉina kantistino Ling Phang plenumante popularan polan popolan kanton.

--------------------------------------------------------------------------------

Interparolo kun Birute Rozenfelde dum la Universala Kongreso en Rejkjaviko
[2014-01-07]
https://pola-retradio.org/2014/01/interparolo-kun-birute-rozenfelde-dum-la-universala-kongreso-en-rejkjaviko/

Birute Rozenfelde el Latvio estas unu el la  plej novaj Honoraj Membroj de UEA. La antaŭmikrofona renkontiĝo dum la Universala Kongreso en Rejkjaviko estis la okazo gratuli pro ĉi tiu distingo kaj ekscii pri la komenco kaj la nuno de la Baltiaj E-Tagoj, iam Baltaj E-Tendaroj, pri la E-agado de nia interparolantino. El la elsendo 07.01.2014 .

--------------------------------------------------------------------------------

Festivalo de la Kristnaskaj Kantoj
[2014-01-10]
https://pola-retradio.org/2014/01/festivalo-de-la-kristnaskaj-kantoj/

Ĝis la 26-a de novembro eblis aliĝi al la 20-a Internacia Festivalo de la Kristnaskaj Kantoj kaj Pastoraloj en Będzin en la sudo de Pollando. La finalo de ĉi tiu plej granda evento en Pollando okazos inter la 16-a kaj 19-a de januaro 2014. Antaŭas ĝin la eliminadoj daŭrantaj inter la 8-a kaj la 20-a de januaro en 38 lokoj de la tuta lando. En 2012 la eliminadojn frontis 20 mil personoj. La Festivalon rajtas partopreni amatoroj inkluzive de lernantoj kaj diplomitoj de la muzikaj lernejoj de la 1-a grado, solistoj, duetoj,  krome korusoj, preĝejaj kantgrupoj, voĉistaj kaj voĉ-instrumentaj ensembloj, ankaŭ popolaj kanttrupoj en diversaj aĝgrupoj. Będzin merite portas la nomon de la Ĉefurbo de la Pola Kristnaska Arto venigante tien la plej bonajn muzikajn ekspertojn. La jubilean eldonon de la Festivalo akompanos simpozio titolita „La kristnaskaj kantoj kaj pastoraloj en la pola kulturo”. Ĝi celas reliefigi kiom gravaj por la pola identeco, kulturo kaj religiemo estas ĉi tiuj komponaĵoj. La festivalo elkreskis ĝis la rango de la plej prestiĝa ĉi-speca aranĝo en Pollando el la regiona muzika evento en Będzin.

El la elsendo 10.01.2014. Legas Barbara / Gabi

--------------------------------------------------------------------------------

E_elsendo el la 10.01.2014
[2014-01-10]
https://pola-retradio.org/2014/01/e_elsendo-el-la-10-01-2014/

Podkasto: Ludu en nova fenestro | Elŝutu

Fragmenta sonsceno el la renkontiĝo de AERA, tio estas amikoj de la E-lingva Radiofonio dum la Rejkjavika UK aŭdiĝas kadre de la nunsemajna Leterkesto. Komence de la 298-a E-elsendo ĉe www.pola-retradio.org aŭdiĝas kultura informo pri Festivalo de la kristnaskaj kantoj kaj daŭrantaj al ĝi eliminadoj kaj tiukuntekste fragmente aŭdiĝas du polaj kristnaskaj kantoj en la plenumo de Remigiusz Kossakowski kaj la grupo Muzilo. Hodiaŭ ni felietonas krome pri la vizitinda urbo Wałcz kaj pri novaj eldonaĵoj rilataj al Oomoto.

--------------------------------------------------------------------------------

Eksterlandaj Studentoj en Pollando (2014)
[2014-01-14]
https://pola-retradio.org/2014/01/eksterlandaj-studentoj-en-pollando-2014/

En Pollando studas gejunuloj el 142 landoj. Preskaŭ unu trionon de ili konsistigas ukrainanoj. Plej ofte ukrainaj gejunuloj elektas medicinajn fakultatojn. En la antaŭa akademia jaro temis pri 29 mil eksterlandanoj, inter ili 9747 ukrainanoj. Laŭ la vidpunkto de la nombro de la ukrainaj studentoj Pollando antaŭis Germanion kaj prenis la 2-an lokon post Rusio. Plej multaj ukrainanoj elektas privatajn alt­lernejojn. Ekde 2005 triobliĝis la nombro de studentoj el Bjelorusio, entute temas pri pli ol 3 mil personoj. Ĉiam malpli multaj estas eksterlandaj studentoj poldevenaj. Inter eksterlandanoj multnombre estas reprezent­itaj studentoj norvegaj (1553) kaj svedaj (1160). Tre rapide kreskas la nombro de la studantaj en Pollando hispanoj. En la akademia jaro 2012/13 temis pri 1327personoj. En 2005 estis da ili nur trideko. Kompare kun la mondaj statistik­aĵoj en Pollando studas malmultaj azianoj. La nombro de la eksterlandaj studentoj kreskas, sed daŭre temas nur pri 1,74 procentoj de la tuto de la gejunuloj studantaj en Pollando.

El la elsendo 14.01.2014. Legas Gabi

--------------------------------------------------------------------------------

Ĉiam pli da laborofertoj en la reto
[2014-01-14]
https://pola-retradio.org/2014/01/ciam-pli-da-laborofertoj-en-la-reto/

Daŭre kreskas la nombro de labor­ofertoj en la Interreto. En oktobro aperis ĉirkaŭ 145 mil. Plej multaj rilatis al la Poznana Regiono en la okcidenta Pollando. Kreskas interesiĝo pri ekonomi­kiistoj, en oktobro temis aparte pri librotenistoj kaj specialistoj pri impostoj. Daŭre alta estas interesiĝo pri inĝenieroj. Aperis novaj laborofertoj en eduka kaj farmacia sektoroj. En la dua duono de 2013 kreskis laborofertoj por personoj profesie okupiĝantaj pri infanoj kaj grizaĝuloj, kaj okupiĝantaj pri aliaj hejmlaboroj. Laŭ specialistoj kaŭzas tion longdaŭraj demografiaj transformiĝoj.

El la elsendo 14.01.2014. Legas Zbyszek

Kreskas laborofertoj en la Interreto

--------------------------------------------------------------------------------

Emocioj ligitaj kun matematiko
[2014-01-14]
https://pola-retradio.org/2014/01/emocioj-ligitaj-kun-matematiko/

Maltrankvilo ligita kun la solvado de matematikaj taskoj aktivigas la samajn cerbo­sferojn, kiel la fizika doloro.  La esploristoj el la ĉikaga universitato pruvis, ke ju pli grandan timon sentas homoj lige kun la matematikaj taskoj des pli forte estas stimulitaj cerbo­regionoj respondecaj pro instinkta malkovrado de danĝero kaj pro la sperto de fizika doloro. Ĉe la testitaj personoj timo estis aperanta ne nur dum la solvado de matematikaj taskoj, sed ankaŭ dum kuntuŝigo kun la matematikaj lernolibroj kaj enpaŝado en la matematikajn klasojn. Maltrankvilo estis aperanta ankaŭ, kiam testatoj  havis la konscion, ke por fini la studojn necesos ekzameni iliajn sciojn pri matematiko.  La testitaj personoj tute ne estis timemaj en la normalaj viv­cirkonstancoj. La maltrakvilo estis aperata en situacioj, kiuj vekis asociaciojn kun matematiko.

El la elsendo 14.01.2014. Legas Tomek

--------------------------------------------------------------------------------

E_elsendo el la 14.01.2014
[2014-01-14]
https://pola-retradio.org/2014/01/e_elsendo-el-la-14-01-2013/

Podkasto: Ludu en nova fenestro | Elŝutu

Konrad Andrzejczuk oratoris dum la Rejkjavika UK pri la kongresa temo. Ni prezentas en nia 299-a elsendo ĉe www.pola-retradio.org la rilatan sonscenon, per kiu li venkis en la Oratora Konkurso destinita por junaj esperantistoj. En la komenca parto de la elsendo ni informas pri kreskantaj labor­ofertoj en la Interreto, pri eksterlandaj studentoj en Pollando. El pola gazetaro ni eksciis, ke polojn atendas san­pasportoj, ke ĉinoj atendas polan pulvorig­itan lakton. Nia scienca temo eksplikas ŝanĝojn en nia cerbo lige kun matematiko. Elektitaj informoj estas paralele legeblaj kaj aŭskult­eblaj en la koncernaj rubrikoj de nia paĝo. La kanto „Junaj Idealistoj devenas” el la KD de Vinilkosmo Elektronika Kompilo; „Jam temp’ esta” estas kanto el la KD Simbiozo.

--------------------------------------------------------------------------------

La bildstrio “Jan Karski – la homo, kiu malkaŝis holokaŭston”
[2014-01-17]
https://pola-retradio.org/2014/01/la-bildstrio-jan-karski-la-homo-kiu-malkasis-holokauston/

La 15-an de januaro en la eldonejo Rizzoli Lizard en Italio aperis la bildstrio titolita “Jan Karski – la homo, kiu malkaŝis holokaŭston”. Sur ĝiaj 160 koloraj paĝoj la leganto konatiĝas kun eksterordinara historio de homo, kiu dum la 2-a mondmilito kiel la unua rimarkis kaj kondamnis la teruraĵojn de la holokaŭsto, sed estis ignorita de la aliancanoj. La bildstrion aŭtoras Marco Rizzo  kaj Lelio Bonaccorso. La milittemaro, la holokaŭsto kaj la historio de Pollando okupaciita de germanoj interplektiĝas kun la historio de la homo, kiu senĉese akuzas tiujn, kiuj kvankam vidis ne volis kredi kaj restis indiferentaj.  Lige kun la eldono de la bildstrio pri Jan Karski, kies 100-a naskiĝdatreveno proksimiĝas oni parolis ankaŭ dum speciala konferenco en la Eŭropa Parlamento. Estis tie pretigita la 22-panela ekspozicio prezentanta la figuron de la heroa polo.

El la elsendo 17.01.2014. Legas Milada

--------------------------------------------------------------------------------

La semajnfinaj koncertoj omaĝe al Wojciech Kilar
[2014-01-17]
https://pola-retradio.org/2014/01/la-semajnfinaj-koncertoj-omage-al-wojciech-kilar/

Per la semajnfinaj koncertoj la Nacia Filharmonio  en Varsovio omaĝas la memoron de la antaŭnelonge forpasinta elstara pola komponisto Wojciech Kilar. La muzik­kolektivoj de la filharmonio dum jaroj plenumadis kaj registradis plurajn komponaĵojn de Kilar. En la programo de la koncertoj aŭdiĝos ankaŭ Springfield Sonnet, kiun praplenumis  la Simfonia Orkestro de la Nacia Filharmonio. La monda premiero de tiu komponaĵo de Kilar okazis dum la turneo de la Nacia Filharmonio en Svedio kadre de la 13-a Festivalo “Nutida Music”. Krome en la semajnfinaj koncertoj aŭdiĝos Meso opuso 68 de Krzysztof Meyer kaj Stabat Mater de Dvořák. La tuton gvidos la arta direktoro de la Filharmonio, Jacek Kasprzyk.

El la elsendo 17.01.2014. Legas Krystyna

Semajnfinaj koncertoj omagxe al Wojciech Kilar

--------------------------------------------------------------------------------

Stefanos Korkolis koncertas en Varsovio
[2014-01-17]
https://pola-retradio.org/2014/01/stefanos-korkolis-koncertas-en-varsovio/

En la Muzika Universitato de Frederiko Chopin en Varsovio ĉi-vendrede koncertas konata greka komponisto kaj pianisto Stefanos Korkolis. La koncerto estas organizita de la Greka Ambasado en Pollando kaj ligiĝas kun la inaŭguro de la greka prezidanteco en la Eŭropa Unio. Stefanos Korkolis estas artisto eŭrop­dimensia. Li loĝis la studis en Greklando kaj en Francio. La pianludon li komencis lerni havante 5 jarojn tuj rekonita kiel mirakla infano. Sekve li perfektigis sian talenton ĉe tiaj majstroj kiel Vladimir Horowitz kaj Yvonne Lefebure. Dum siaj multaj fortepianaj recitaloj en Greklando kaj eksterlando li logis ĉirkaŭe de si fidelajn muzik­ŝatantojn. Stefanos Korkolis komponis en 1997 Himnon de Specialaj Olimpikoj, kies unua publika plenumo okazis en 1999 en Usono dum la Somera Ĉamionado de Specialaj Olimpikoj en la Norda Karolino.

El la elsendo 17.01.2014. Legas Milada

La varsovia koncerto de Stefanos Korkolis

--------------------------------------------------------------------------------

Koninda polo: Krzysztof Arciszewski
[2014-01-17]
https://pola-retradio.org/2014/01/koninda-polo-krzysztof-arciszewski/

Krzysztof Arciszewski estas figuro kolora, sed en Pollando malmulte konata, kvankam li estis la unua, eble eĉ la unusola pola konkerinto de la nova mondo. Tiu ĉi maristo, mondvaganto, profesia soldato naskiĝis en plurkultura kaj religie tolerema Pola Respubliko en la urbo Rogalin (la okcidenta Pollando) en 1592. Li devenis  el nobela familio de polaj protestantoj. Lerninte en ilia lernejo li komence soldat­servis en la kortego de la hetmano Krzysztof Radziwiłł. Lia ekscita, aventuro­plena vivo komenciĝis, kiam tiu ĉi 31-jaraĝa viro estis kondamnita je la forpelo el la lando pro la murdo de famili­juristo, kiu alkondukis ĝin al kolapso sekve de ekonomiaj trompoj. Persekut­sekvata Kazimierz Arciszewski tra Gdansko fuĝis al Hago, Nederlando. Dank’ al la sekreta subteno de Radziwiłł Arciszewski studis en la fama universitato en Lejdeno milit­inĝenierion kaj artilerian arton. Li distingiĝis per braveco dum la 30-jara milito partopreninte i.a. legendecan sieĝon de Bredo defende kontraŭ hispanoj. Poste li direktiĝis al Francio kaj servis en la kortego de la franca reĝo. Siajn batal­talentojn li manifestis sekve en la sieĝo de la protestanta fortreso “La Rochelle” sub la komando de kardinalo Richelieu. Ĉio ĉi kaŭzis, ke la Nederlanda Okcidenhindia Kompanio  dungis Arciszewski kiel kapitanon defende por siaj konkeraĵoj en Brazilo. Mia ĵus finiĝinta vizito tie spronas la hodiaŭan felietonon, pri tiu kolorfigura polo dank’ al kiu la ŝanco, ke en Brazilo oni parolu ne portugale sed nederlande estis signifa.

En 1630-a jaro la nederlanda armeo kun ĉirkaŭ 7 mil soldatoj ankris ĉe la brazila marbordo. Kuraĝe kaj aŭdace batalante Arciszewski partoprenis la konkeradon de la portugalaj fortresoj Olinda kaj Recife. Kiel komandanto de eta nederlanda trupo per surpriza atako li konkeris la insulon Itamarika, dank’ al kio li avancis ĝis la grado de majoro kaj sekve kolonelo. Nomumita generalo kaj sekve admiralo li famiĝis per konkero de la fortresoj Arrayal kaj Porto Calvo kaj sieĝo de la haveno Nazareth. La bravagoj de Arciszewski, aparte venko de hororigaj kaj kruelaj infanteriaj hispanaj trupoj la t.n. “tercios” fruktis per la omaĝa al li monumento en Pernambuco, ora honora ĉeno kaj omaĝa medalo speciale emisiita por li en Nederlando “Akceptu la venkolaŭron”. En 1638-a jaro Arciszewski estis nomumita admiralo, sed lia kariero baldaŭ fiaskis post la konflikto kun la ĝenerala gubernatoro de Brazilo, princo Nassau-Siegen,  kiu volis senĝene administri la novajn nederlandajn teritoriojn, ne ekskludante la militarajn demandojn. Arciszewski demisiis, sed lia reveno al Eŭropo signifis ankaŭ finon de la nederlanda ĉeesto ĉe la brazila marbordo. Sen militista sperto von Nassau ne povis kontraŭstari portugalojn kaj Nederlando iom post iom perdis siajn teritoriojn en la nova mondo kaj post la fina malvenko en 1654 forlasis Brazilon.

Sed Krzysztof Arciszewski estis ne sole brava soldato en la servo de Nederlando. Li estis ankaŭ poeto kaj verkisto. Dum sia tuta estado en Brazilo Arciszewski verkis siajn geografiajn-kartografiajn rimarkojn, li estis notanta siajn observojn pri la indianaj triboj. Multajn li adresis al sia amiko,  nederlanda sciencisto Gerard Voss, kiu en sia verko aperigita en 1642 citis ampleksajn fragentojn de liaj raportoj. Entute la 17-jarcentaj nederlandaj sciencistoj kun granda atento rilatis al liaj observoj. En la haga arkivejo ĝis nun troviĝas centoj de liaj raportoj kaj leteroj, en kiuj li i.a. priskribis la vivon de hommanĝantaj indianoj Tapuya, kies trupoj helpis al la nederlandaj soldatoj. Ĉar baldaŭ tiuj triboj malaperis la raportoj de Arciszewski konsistigas valorege unikan font­materialon por la eŭropaj sciencistoj.

Kazimierz Arciszewski revenis al Pollando en 1646 kaj akceptis de la reĝo Vladislavo la 4-a Vasa komandadon de la ĉeval­artilerio. Dum la regado de la reĝo Johano la 2-a Kazimiro Vasa Arciszewski batalis en militoj kontraŭ kozakoj kaj tataroj. Utiligante siajn brazilajn spertojn li enkondukis multajn reformojn kaj modernigojn rilate la artilerion kaj konstruadon de fortikaĵoj. Li modernigis arsenalojn en la urboj Malbork, Puck, Varsovio, Lvovo, Bar kaj Kamień Podolski, laŭ la reĝa komisio li konstruis boatpontojn servontajn kaze de milito kun Turkio sur la riveroj Dnestro, Prut kaj Dunajo.

En 1650-a jaro Arciszewski definitive rezignis pri ĉiuj postenoj kaj retiriĝis en la hejman intimejon. 6 jarojn poste li mortis kaj estis entombigita en la kalvinista preĝejo de Leszno (la suda Pollando). Ĝi ne transdaŭris forbrulig­ita kun la tuta urbo pro la perfida helpo al svedoj atakintaj Pollandon dum la 17-jarcentaj invadoj.

El la elsendo 17.01.2014. Legas Barbara

--------------------------------------------------------------------------------

E_elsendo el la 17.01.2014
[2014-01-17]
https://pola-retradio.org/2014/01/e_elsendo-el-la-17-01-2014/

Podkasto: Ludu en nova fenestro | Elŝutu

La 300-a E-elsendo el Varsovio per la felietono pri Krzysztof Arciszewski,  la 17-jarcenta pola konkerinto de la Nova Mondo serve al nederlandanoj malkaŝas i.a. la sekreton, kial Nederlando malgajnis la rivalaldon establiĝi en Brazilo. “Melankolio” el la KD >Tom Jobim en Esperanto< en la plenumo de Alejandro Cosavella kompletigas tem­segmenton ligitan kun Brazilo, kiun en la lastaj semajnoj vizitis Barbara. La jubileo de la Pola RetRadio en Esperanto speguliĝas en nia Leterkesta Rendevuo. Komence la kultur­bulteno informas pri la itala bildstrio dediĉita al Jan Karski, la semajnfinaj koncertoj de la Varsovia Filharmonio omaĝe al Wojciech Kilar kaj la Varsovia koncerto de Stefanos Korkolis lige kun la inaŭguro de la greka prezidanteco en EU.

--------------------------------------------------------------------------------

Pollando avancis en la Rangolisto de Ekonomia Libereco
[2014-01-21]
https://pola-retradio.org/2014/01/pollando-avancis-en-la-rangolisto-de-ekonomia-libereco/

Pollando okupis la 50-an lokon inter 178 ŝtatoj  en la Rangolisto de Ekonomia Libereco, prilaborita de la vaŝingtona Hertige Foudation kaj Wall Street Journal. Pollando avancis je 7 lokoj kompare kun 2013 plibonig­inte siajn rezultojn en 6 je 10 ekzamenataj sferoj de la ekonomia vivo i.a. merkatista libereco, investado kaj komerco. En Eŭropo temas pri ĝia 23-a loko inter 43 aliaj landoj. Ekde kiam estas prilaborata la rangolisto de ekonomia libereco, do ekde 20 jaroj la rezultoj de Pollando kreskis je 16 poentoj kaj ĝi troviĝas inter la unua dudeko da ŝtatoj plej rapide avancantaj en ĉi tiu listo. Pollando antaŭas Hungarion kaj sekvas Hispanion. Inter la eŭropaj landoj avanas Svislando, Irlando, Danlando kaj Estonio. En la monda skalo gvidas Honkongo, Singapuro kaj Aŭstralio.

El la elsendo 21.01.2014. Legas Barbara

Pollando avancis en la rangolisto de Ekonomia Libereco

--------------------------------------------------------------------------------

Interparolo kun Ursula Grattapaglia el Bona Espero (2014) – unua parto
[2014-01-21]
https://pola-retradio.org/2014/01/interparolo-kun-ursula-grattapaglia-el-bona-espero-2014-unua-parto/

La renkontiĝo de Barbara kun Ursula Grattapaglia jarŝanĝe en Bona Espero, Brazilo estis la okazo ne sole gratuli pro laŭvicaj distingoj, kiujn ge-roj Grattapaglia ricevis pro sia grava socia, ekologia laboro pere de Esperanto, sed ankaŭ ekscii pri novaj planoj. Temas pri la unua parto de iom ampleksa interparolo. El la elsendo 21.01.2014 .

--------------------------------------------------------------------------------

La maniero reagi je streso grava en la sanprognozado
[2014-01-21]
https://pola-retradio.org/2014/01/la-maniero-reagi-je-streso-grava-en-la-sanprognozado/

La maniero reagi je streso influas la homan sanon. Ĝi ankaŭ permesas antaŭvidi,  kian sanstaton havos koncerna persono post la paso de 10 jaroj. 10 jarojn dediĉis specialistoj el la Ŝtata Universitato en Pensinvalio al siaj esploroj ekzameninte du mil personojn, 8 fojojn tage alvokante ilin kaj pridemand­ante pri la trapaso de ilia tago, animstato, san­problemoj kaj aperantaj stresigaj situacioj. Kvar fojojn esplorantoj prenis testoprovaĵojn de ilia salivo por ekzameni la nivelon de kortizolo – la stresohormono. Post la paso de 10 jaro ili ripetis la ekzamenadon kaj sekvis donitaĵojn pri la vivo kaj sanstato de la testataj personoj baze de la usonaj naciaj ekzamenadoj MIDUS. La rezultoj ne estis aparte surprizaj, ĉar delonge estas konata dependeco inter streso kaj sanstato. Tiel do, se homo malbone toleras streson, daŭre estas ekscitita kaj nervoza post la paso de kelkaj jaroj povos suferi kronikajn malsanojn pri la sangocirkulado aŭ artikdoloroj. Laŭ David Almeida, unu el la esploristoj respondecaj pro analizoj, homoj apartenas al du kategorioj. Al gluhomoj streso kateniĝas kaj eĉ fine de la tago tiuj homoj estas malgajaj kaj koleraj. De la alia kategorio, la t.n.  homoj-teflonoj streso forglitiĝas. La problemo ligiĝas ne sole kun la homa karakero. Iuj homoj spertas pli da stresigaj fenomenoj dumtage ol la aliaj. Plej multe endanĝerigitaj je stresaj situacioj estas junaj personoj, tre aktivaj kun altgrada klereco. Temas krome pri grizaĝuloj, aparte personoj pli ol 65-jaraĝaj, kiuj ne tiom sukcese frontas stresojn. Laŭ sciencistoj la solvo ne estas redukti streson, sed ellerni la manieron ĝin sukcese fronti.

El la elsendo 21.01.2014. Legas Zbyszek

--------------------------------------------------------------------------------

E_elsendo el la 21.01.2014
[2014-01-21]
https://pola-retradio.org/2014/01/e_elsendo-el-la-21-01-2014/

Podkasto: Ludu en nova fenestro | Elŝutu

Ursula Grattapaglia el Bona Espero, Brazilo estas la antaŭ­mikrofona gasto de nia 301-a E-elsendo el Varsovio – www.pola-retradio.org. La temo de la inter­parolo registrita antaŭnelonge en Bona Espero estas ne sole la distingoj de ge-roj Grattapaglia pro ilia socia kaj ekologia laboro, sed ankaŭ kelkaj ŝanĝoj en la funkciado de ĉi tiu grava centro, utiliganta Esperanton. Komencaj aktualaĵoj rilatas al avanco de Pollando en la Rangolisto de Ekonomia Libereco kaj al la plej nova raporto de Oxfam „Laborante por malmultaj”. La scienca informo traktas la manieron reagi je streso en la perspektivo de niaj estontaj san­problemoj. Muzike akompanas en nia marda elsendo Flavio Fonseca kantante la poeziaĵon de Geraldo Mattos „En mia ĝardeno” el ilia komuna KD „Simbiozo”. Novaĵoj, scienca informo estas paralele legeblaj kaj aŭskulteblaj en koncernaj rubrikoj. Ankaŭ la interparolo kun Ursula Grattapaglia estas aŭskultebla en la rubriko “Antaŭ la mikrofono”.

--------------------------------------------------------------------------------

Bitigataj kolektoj de la Vatikana kaj Oksforda bibliotekoj
[2014-01-24]
https://pola-retradio.org/2014/01/bitigataj-kolektoj-de-la-vatikana-kaj-oksforda-bibliotekoj/

Du el la plej gravaj bibliotekoj de la mondo – la Vatikana kaj la Oksforda liveris en la Interreto la unuajn enorme valorajn volumojn. En la bita formo eblas foliumi kaj legi la ne­pritakseble valoran verkon la Biblion de Gutenberg, la unuan en la mondo presitan libregon.  Krome estis disponigita elektronike la 15-jarcenta germana Biblio mane kolorigita kaj ornamita per lignogravuraĵoj. Bitigon atendas pliaj verkoj. La Vatikana Apostola Biblioteko establita en 1451 de papo Nikolao la 5-a estas unu el la plej gravaj sciencaj bibliotekoj de la mondo. La Oksforda Biblioteko Bodleian el 1610 estas la plej granda universitata biblioteko de Britio. Ambaŭ havas en siaj kolektoj la unuajn presaĵojn, la antikvajn grekajn manuskiptojn. La bit­igoprojekto de la kolektoj el ambaŭ bibliotekoj daŭros 4 jarojn. Ĝia kosto egalas al 3 milionoj 300 mil dolaroj.

El la elsendo 24.01.2014. Legas Milada

--------------------------------------------------------------------------------

Interparolo kun Ursula Grattapaglia el Bona Espero (2014) – dua parto
[2014-01-24]
https://pola-retradio.org/2014/01/interparolo-kun-ursula-grattapaglia-el-bona-espero-2014-dua-parto/

Ursula Grattapaglia el Bona Espero daŭrigas en nia antaŭmikrofona renkontiĝo dividi esperojn kaj planojn pri la nuna funkciado de ĉi tiu legendeca centro en Brazilo. El la elsendo 24.01.2014 .

--------------------------------------------------------------------------------

La dua poezivolumo de Szymborska en la ĉina lingvo
[2014-01-24]
https://pola-retradio.org/2014/01/la-dua-poezivolumo-de-szymborska-en-la-cina-lingvo/

Post la sukcesa prezento de la poezivolumo de Wisława Szymborska en la ĉina lingvo “La sorĉita trankvilo de la mondo” en 2012, fine de  la 2013-a en la ĉinaj librovendejoj aperis la dua volumeto de ŝiaj poeziaĵoj “Iam mi vivis tiom solece”. La lanĉo de la volumeto okazis lige kun la Pekina Eldonfoiro, dum kiu okazis renkontiĝo popularig­anta la figuron kaj la verkadon de la pola Nobel-premiitino. Pliaj renkontiĝoj kaj poezi­vesperoj dediĉitaj al Szymborska estis planitaj i.a. en Pekino, Ŝanghajo kaj Kantono. En la 2014-a jaro en Ĉinio okazos pliaj libroeldon­oj de polaj aŭtoroj. Interalie aperos poezi­volumeto de Adam Zagajewski, libro de Ryszard Kapuściński, biografio de Karol Szymanowski kaj porjunulara libro de Andrzej Maleszka.

El la elsendo 24.01.2014. Legas Krystyna

--------------------------------------------------------------------------------

E_elsendo el la 24.01.2014
[2014-01-24]
https://pola-retradio.org/2014/01/e_elsendo-el-la-24-01-2014/

Podkasto: Ludu en nova fenestro | Elŝutu

Ursula Grattapaglia el Bona Espero, Brazilo – konforme al la antaŭanonco – en la dua antaŭ­mikrofona renkontiĝo daŭrigas prezenti informojn pri la  aktuala stato, funkciado kaj planoj de la legendeca Bona Espero. Komence de nia 302-a E-elsendo aŭdiĝas kultur­kroniko, en kiu ni i.a. informas pri elstaraj poloj, kiujn en 2014 oni honoras lige kun iliaj rondciferaj naskiĝdatrevenoj, kaj pri laŭvica – aperinta en Ĉinio – poezivolumeto de Wisława Szymborska, pola literatura Nobel-premiitino. Nia Leterkesto gravaparte estas dediĉita al la venintaj reagoj je la 300-a elsendo de Pola RetRadio en Esperanto. La informoj de la kulturkroniko kaj la 2-a parto de interparolo kun nia antaŭmikrofona gasto estas jam aŭdeblaj ĉe unuopaj rubrikoj de nia paĝo: www.pola-retradio.org.

--------------------------------------------------------------------------------

Omaĝaj solenaĵoj en Auschwitz-Birkenau
[2014-01-28]
https://pola-retradio.org/2014/01/omagaj-solenajoj-en-auschwitz-birkenau/

Lunde okazis solenaĵoj lige kun la Internacia Memortago pri la Viktimoj de Holokaŭsto. Ĝi estas solenata en la datreveno de la liberigo de la koncentrejo Auschwitz-Birkenau. La ĉefa datrevena solenaĵo kun partopreno de eksaj malliberigitoj, saviĝintaj judoj, rabenoj kaj katolikaj religiuloj, politikistoj, inkluzive de parlamentanoj el Eŭropo, Usono kaj Kanado okazis frumatene en la eksa koncentrejo Birkenau. Germanoj establis la koncentrejon Auschwitz por poloj en 1940. Auschwitz II-Bierkenau kreiĝis du jarojn poste kaj fariĝis loko de la ekstermado de judoj.  En Auschwitz germanoj mortigis almenaŭ unu milionon 100 mil homojn, ĉefe judojn, sed ankaŭ polojn, ciganojn, sovetajn ostaĝojn kaj personojn de aliaj naciecoj. La koncentrejo estis liberigita la 27-an de januaro 1945 fare de la soldatoj de la 100-a Lvova Infanteria Divizio.  Estis liberigitaj ĉ. 7 mil malliberigitoj, pereis 231 sovetaj soldatoj. Hieraŭ komencis funkcii la dulingva – pola-angla – paĝo de la Instutito pri la Nacia Memoro pri la germanaj morto­tendaroj kaj koncentrejoj sur la tereno de la okupaciita Pollando: www.truthaboutcamps.eu.

El la elsendo 28.01.2014. Legas Krystyna

Omagxaj solenajxoj en Auschwitz-Birkeu

--------------------------------------------------------------------------------

E_elsendo el la 28.01.2014
[2014-01-28]
https://pola-retradio.org/2014/01/e_elsendo-el-la-28-01-2014/

Podkasto: Ludu en nova fenestro | Elŝutu

„Ĉiamen plu” de Perdita Generacio estas unu el la KD-oj kunproduktita kun Vinilkosmo, per kiu en 2013 riĉiĝis nia muzika E-kulturo. Al ĝi kaj al LPG estas dediĉita la nunsemajna muzika elsendo. Komence aŭdiĝas aktualaĵoj, en kiuj ni referencas i.a. al la situacio en Ukrainio kaj la lastlunda omaĝo al la viktimoj de la holokaŭsto. Ni krome informas i.a. pri nova dulingva paĝo de la Instituto pri la Nacia Memoro: www.truthaboutcamps.eu kaj  pri nova Centro de la Pola Lingvo kaj Kulturo funkciigita en Rumanio. En scienca bulteno de la 303-a E-elsendo ĉe www.pola-retradio.org ni informas pri la unua pola glacivino kaj pri la ŝanĝiĝanta dieto de polusaj ursoj. Aktualaĵoj kaj sciencaj informoj estas paralele legeblaj kaj aŭdeblaj en la unuopaj rubrikoj de nia paĝo.

--------------------------------------------------------------------------------

La blankaj ursoj manĝas ne sole fokojn
[2014-01-28]
https://pola-retradio.org/2014/01/la-blankaj-ursoj-mangas-ne-sole-fokojn/

Ekspertoj de la usona televiidstacio NBC malkovris, ke la polusaj ursoj kaze de neceso kapablas ŝanĝi sian dieton. Ili ekzamenis la ekstrem­entojn de la blankaj ursoj, kiuj ektroviĝis en Manitoba, Kanado. Evidentiĝis, ke la polusaj ursoj, kies dieton konsistigas grandparte fokoj povas konsumi ankaŭ birdoovojn, rangiferojn, berojn kaj herbo­grajnojn. Serĉante nutraĵon ili ne tiom gvidas sin per instinkto, kiom laŭ provo­maniero, tial foj-foje ili klopodas gustumi aŭtomobilan akumulaton aŭ sidilon de la neĝskotero. Antaŭ unu jaro la usona Centro de Donitaĵoj pri Neĝo kaj Glacio informis, ke la glacikrusto sur Arkto egalas al 3, 41 milionoj da kvadrataj kilometroj, atestante ke ekde la inaŭguro de la mezurado, t.e. ekde la 1979-a jaro okazas ĝia drasta ŝrumpo. Laŭ parto de ekspertoj ankoraŭ antaŭ la fino de la jardeko dum iu varma somero la arkta glacio povas tutece malaperi. Kiel kaŭzon de ĉi tiu fenomeno oni konsideras la klimatajn ŝanĝojn.

El la elsendo 28.01.2014. Legas Barbara

--------------------------------------------------------------------------------

La unua pola vino el frostintaj survite vinberoj
[2014-01-28]
https://pola-retradio.org/2014/01/la-unua-pola-vino-el-frostintaj-survite-vinberoj/

La unua en Pollando vino el la frostintaj survite vinberoj kreiĝis en la vitejo de la Jagelona Universitato en Krakovo “Apud la Nobelbiena Rojo”. La maloftan drinkaĵon povas gustumi nur malmultaj personoj, ĉar oni produktis sole 20 litrojn, alivorte 30 botelojn. La kvalito de la vino produkita el vinberoj 2012 en la loko Łazy apud Bochnia en la krakova regiono laŭ la postulema Vinkapitulo de la Jagelona Universitato estas bona. Laŭ enologoj kaj vin­ekspertoj ĝi distingiĝas per koncentrita aromo de freŝaj fruktoj kaj havas guston karakterizan por la vinber­specio “hibernal”, el kiuj ĝi estis produtita. La frostiĝ­intajn survite helverdajn vinberojn oni plukis nokte komence de decembro 2012 dum favora frosta aŭro de preskaŭ minus 12 gradoj. La kolektado estis fulmrapida, ĝi daŭris nur unu horon. La mosto fermentis dum duona jaro kaj poste la vino maturiĝis. Glacivino estas drinkaĵo malofta. El 100 kilogramoj da premitaj vinberoj antaŭ la degelo kreiĝas 10-15 litoj da mosto. Per la glacivino de la  Jagelona Universitato oni tostos la 650-jariĝon solenatan en 2014. La lulilo de la vino de la vinberoj frostiĝintaj estas Frankonio en Germanio. Nun la plej grandan produktadon oni notas en Germanio kaj en Kanado.

El la elsendo 28.01.2014. Legas Barbara

--------------------------------------------------------------------------------

Nova Centro de la Pola Lingvo kaj Kulturo en Rumanio
[2014-01-28]
https://pola-retradio.org/2014/01/nova-centro-de-la-pola-lingvo-kaj-kulturo-en-rumanio/

Nova Centro de la Pola Lingvo kaj Kulturo komencis funkcii ĉe la rumana universitato en Krajowa.  Ĝi estas adresita al studentoj, merkatistoj kaj ĉiuj interesiĝantoj dezirantaj pli proksime konatiĝi kun Pollando. En la agadproramo de la centro, funkciigita la 22-an de januaro,  troviĝos ekspozicioj, film­prezentoj kaj koncertoj. Ĝi helpos al rumanaj merkatistoj ligi kunlaboron kun polaj firmaoj. Laŭ la donitaĵoj de la rumana klerig-ministerio jam 40 superaj instru­institutoj subskribis kun polaj partneroj duflankajn interkonsentojn pri kunlaboro.

El la elsendo 28.01.2014. Legas Krystyna

--------------------------------------------------------------------------------

Trzebiatów
[2014-01-31]
https://pola-retradio.org/2014/01/trzebiatow/

Ĉi-semajne gesinjoroj ni revenu al la nordokcidenta Pollando por viziti la urbon Trzbiatów [prononcu t-ŝebjatuv],  situanta laŭ la rekta linio nur 7 kaj duonan kilometrojn for de Baltiko. Ĝia origino radikas en la 9-a jarcento, kiam oni konstruis tiu ĉi loke fortreson kun setlejo,  kiu ekde la komenco estis ligita kun la pomeria dinastio Grifidoj – la samaj kiuj dum jarcentoj regis sur la insulo Wolin – situanta iom okcidente for de la urbo. La foslaboroj pruvas, ke tiam Trzebiatów estas grava kultoloko de la pagana Perun kaj tute proksime oni praktikis la kulton de alia pagana adoratulo difinata “Blanka Dio”. La unua skriba informo pri Trzebiatów devenas el la 1170-a jaro,  kiam la pomeria princo Kasimiro la 1-a transdonis 11 ĉirkaŭajn vilaĝojn al norbetanoj. La venintaj el la sveda Lund monakoj establis tie sian klostron. La 12-a jarcento estis la periodo de intensa kristanig­ado de la Okcidenta Pomerio, aparte de la regionoj ĉe la riverbuŝo de Rega ĉe kiu etendiĝas Trzebiatów. La urborajtojn ĝi ricevis fine de la 13-a jarcento kaj verŝajne el tiu periodo devenas la blazono de la urbo, prezentanta Grifon kun la kruco. Fino de la 13-a jarcento signas ankaŭ la komencon de la ĝenerala prospero kaj disfloro de la urbo pro vico da atribuitaj al ĝi privilegioj i.a. libera navigado laŭ la rivero Rega kaj ekposedo de la haveno. Tiuj ĉi kaj pluraj sekvaj privilegioj kaŭzis, ke Trzebiatów fariĝis unu el la plej gravaj ekonomiaj centroj en Pomerio. Dum jarcent­duono – apud la plej grandaj potencoj de Eŭropo ĝi estis membro de la Hansa Ligo. Ekde la 14-a jarcento ekzistis en la urbo mezlernejo kun riĉa instru­programo. En la 16-a jarcento ĝuste en Trzebiatów oni proklamis protestantismon la reganta religio de Pomerio. Bedaŭrinde la 30-jara milito finis la disfloron de Trzebiatów. Detrufrapaj evidentiĝis grandaj incendioj kaj fine likvido de la haveno. Trzebiatów ĝis la 17-a jarcento troviĝanta kadre de la Pomeria Princolando estis enkorpigita en Brandenburgion kaj unu jarcenton pli poste fariĝis prusa urbo. Marĝene ni menciu, ke en la 2-a duono de la 18-jarcento ĝi estis la propraĵo de virtemberga princo Frederiko Eŭgeno. Dank’ al lia pola edzino princino Maria Anna familie Czartoryski okazis kultura vigliĝo de la urbo. Dank’ al ŝiaj klopodoj la iama monakinejo estis transformita en klasik­stilan palacon, lokon de vigla societa vivo.  Tamen post kiam ŝia edzo perfidis la Respublikon – kiel komandanto de la litovaj trupoj aktivante favore al Prusujo kaj Rusujo la geprincioj divorcis.  Anna Maria revenis al Pollando, plej ofte gastante en Varsovio, kie ŝi gvidis literaturan salonon, vintrumante en Vieno kaj somerumante en Puławy – fama,  romantika pola rezidejo kies kun­kreintino ŝi estis. Sed ni revenu al Trzebiatów por almenaŭ mencii, ke en ĝi naskiĝis reĝo Frederiko la 1-a Virtemberga kaj Sofia Dorotea, estonta edzino de la rusa caro Paŭlo la 1-a.

Tamen la urbo neniam reakiris la iaman mezepokan signifon, aliflanke ĝi utiligis la ŝancon renaskiĝi,  kiam estis funkciigita la fervojlinio inter Szczecin kaj Ko?obrzeg, kondukanta tra Trzebiatow. Fine de la 19-a jarcento kreiĝis tie agronomia lernejo, unu el malmultaj en Pomerio. Tie havis sian sidejon la firmao Felisch&Kirchheim produktanta la arĝentan pladaron por la sveda reĝa kortego.

Dum la 2-a mondmilito Trzebiatów ne estis detruita, sed signife damaĝita. Transdaŭris do la mezepoka urboplano, historiaj konstruaĵoj kaj urba konstru­substanco. Ili – rekonstru­istaj kun pietismo atestas pri la glora pasinteco de Trzebiatów. De jarcentoj super la urbo dominas la 90-metra turo de la preĝejo devenanta al la 14-a jarcento. Ĝis nun ĝi estas grava orientiga punkto, sed iam ĝi rolis ankaŭ kiel lanterno. De sur ĝia supro videbliĝas iom distanca maro kaj la lanterno en la loko Niechorz

Atenton meritas pulvo­bastiono – nomata “la gria”, kiu kreiĝis dum la konstruado de defendo­muregoj kaj servis kiel pulvo­staplejo. Konstruita sur la plano de cirklo kun la 4-metra diametro ĝi estas kovrita per tegola tegmento. Cetere kun ĝi ligiĝas unusola legendo, kiun mi trovis pri la urbo kaj kiu klarigas la difinon de la bastiono “la gria”.  Nome Trzebiatów en la mezepoko, kiel komerca urbo ofte interbatalis kun la najbaraj rivaloj. Okazis, ke al la deĵoranta sur la urbomurego  soldato servo­junulino alportis  bovlon kun varma grio. Gejunuloj komencis iom petoli kaj dum la petolado iu el ili mispuŝis la bovlon, kiu falis  de sur la muroj sur la kapon  de iu el la atakpretaj rivaloj. Lia krio avertis  la deĵorantan soldaton, kiu alarmis siajn kamaradojn. Tiel li sukcesis  forpuŝi la malamikan atakon.  Memore al ĉi tiu evento dum la lasta semajnfino de julio la urbestro mem regalas vizitantojn de Trzebiatów per bongustega grio.

Sed fine ni diru pri iu kroma kuriozaĵo de Trzebiatów, nome troviĝanta sur la muro de iu brikdomo pentraĵo el la 18-a jarcento. Onidire ĝi prezentas elefanton. Pastoro el la proksima vilaĝo Sarbia, kiu ekzistas ĝis hodiaŭ,  en la paroĥa libro sub la dato la 1639-a jaro notis: “Aŭtune de la nuna jaro en la ĉirkaŭaĵo oni demonstris enorme grandan beston – elefanton, kiu estis vidita en Trzebiatow [..] Ho, Dio, ke tiu eksterordinara besto nenion malbonan faru al la patrujo nia”.

El la elsendo 31.01.2014. Legas Barbara

--------------------------------------------------------------------------------

E_elsendo el la 31.01.2014
[2014-01-31]
https://pola-retradio.org/2014/01/e-elsendo-el-la-31-01-2014/

Podkasto: Ludu en nova fenestro | Elŝutu

Unu el la vizitindaj urboj de Pollando estas Trzebiatów. En la 304-a E-elsendo ĉe la adreso www.pola-retradio.org ni memorigas nian felietonon al ĝi dediĉitan.  Komence en nia kulturkroniko ni informas pri Grammy-Premio por pola ĵazmuzikisto kaj pri la kultura evento, kiu inaŭguris la 600-jariĝon de la polaj-turkaj diplomatiaj rilatoj, kiu pasas en 2014. Per E-informo ni memorigas pri la nova limdato por IKU-2014 okazonta dum la Bonaera UK, reference al la Gazetaraj Komunikoj de UEA.  Fine de la elsendo tradicie aŭdiĝas la leterkesta programo. En la rubriko “Novaĵoj” estas paralele aŭsulteblaj kaj legeblaj informoj de nia kulturkroniko kaj la felietono pri Trzebiatów.

--------------------------------------------------------------------------------

Kultura evento inaŭgure de la 600-jariĝo de la polaj-turkaj diplomatiaj rilatoj
[2014-01-31]
https://pola-retradio.org/2014/01/kultura-evento-inaugure-de-la-600-jarigo-de-la-polaj-turkaj-diplomatiaj-rilatoj/

La ekspozicio de grafikajoj de pola artistino Agnieszka Cieślińska inaŭguris en Turkio kulturajn solenadojn de la pasanta en 2014 600-jariĝo de la ligo de la diplomatiaj rilatoj inter Pollando kaj Turkio. Dum la tuta januaro ŝian ekspozicion „Agnieszka Cieślińska – FIGURATIO [figuracjo]”, eblis rigardi en la istambula artgalerio Işık Teşvikiye [yŝk teŝvkje – wg google-translatora]. Al la ekspozicio de la grafikaĵoj de profesorino de la varsovia Belarta Akademio akompanis akademia laborstaĝo por turkaj studentoj kun­organizita de la Fondaĵo Feyziye Mektepleri [fejzjemetekplure], Işık-Universitato kaj la Ĝenerala Konsulejo de Pollando en Istambulo. La aŭtoran elekton de la grafikaĵoj de Agnieszka Cieślińska faris la poldevena profesoro Yurdaer Altintas [jurda eraltintas], avana turka grafikisto, animanto de multaj kulturprezentoj en Turkio.

El la elsendo 31.01.2014. Legas Gabi

--------------------------------------------------------------------------------

Grammy-premio por Władek Pawlik
[2014-01-31]
https://pola-retradio.org/2014/01/grammy-premio-por-wladek-pawlik/

Władek Pawlik estas la unua pola ĵaz­muzikisto distingita per Grammy-statueto. La disko “Night in Calisia” surbendig­ita komune kun Randy Brecker kaj Filharmonio de Kalisz estis agnoskita kiel la plej bona disko de granda ĵazensemblo. La laboroj pri “Night in Calisia” komenciĝis antaŭ 4 jaroj. Tiam la trio de Włodek Pawlik, la usona trumpetisto Randy Brecker kaj la Filharmonio de Kalisz direktita de Adam Klocek prezentiĝis en Kalisz okaze de la 1850-jariĝo (mil-okcent-kvindek­jariĝo) de la urbo. La koncerto tiom plaĉis al la publiko, ke la artistoj renkontiĝis du jarojn poste en la studiaj kondiĉoj kaj surbendigis “Night in Calisia”. Unue la disko aperis en Pollando, pasintjare ĝi estis eldonita sur la usona merkato de Summit Records, akirinte popularecon inter la tieaj ĵazŝatantoj.  Grammy-statueto por la 55-jara pola pianisto estas la plej alta rekono por lia kreado. Ĝi tuj elvokis plian interesiĝon pri la komponaĵoj de Włodek Pawlik.

El la elsendo 31.01.2014. Legas Gabi

--------------------------------------------------------------------------------

Nova sezono de Veturilo komenciĝas
[2014-02-02]
https://pola-retradio.org/2014/02/nova-sezono-de-veturilo-komencigas/

Ekde la plej proksima sabato denove eblas lui la ĉefurbajn biciklojn Veturilo. Ili aperis sur la varsoviaj stratoj komence de aŭgusto 2012. Ekde tiam kreiĝis en la tuta urbo 173 lustacioj de Veturilo kun pli ol 2 mil 600 bicikloj. Nunjare aldoniĝos novaj lustacioj kaj biciklaj vojetoj. En 2013 la bicikloj Veturilo estis luitaj pli ol unu milionon 800 mil fojojn. Rekorda luinto faris tion 1400 fojojn – 507 fojojn en la 2012-a jaro kaj 893 pasintjare. Veturilo estas la 8-a laŭ grandeco eŭropa biciklo­sistemo kaj la plej granda en la Centra kaj Orienta Eŭropo. Laŭ „USA Today” ĝi estas la 10-a plej bona  bicikla sistemo en la mondo. En la publika informo pri la inaŭguro de la nova sezono oni memorigas, ke la nomo Veturilo devenas el la lingvo Esperanto kaj oni klarigas la signifon de la vorto.

El la elsendo 28.02.2014. Legas Barbara / Tomek

Nova sezono de la varsovia Veturilo

--------------------------------------------------------------------------------

2013 – laŭvica rekorda jaro de Veturilo
[2014-02-04]
https://pola-retradio.org/2014/02/2013-lauvica-rekorda-jaro-de-veturilo/

En la dua jaro de la publikaj biciklo­luejoj Veturilo en la pola ĉefurbo oni pruntis biciklojn preskaŭ unu milionon 800 mil fojojn. En 2013 aldoniĝis 173 biciklaj staciluejoj, kiujn utiligis 150 mil personoj. Grandiĝis la longeco de la biciklaj vojetoj.  En la 2014 kreiĝos pliaj. Daŭras laboroj pri plukonstruo de la bicikla infrastrukturo. La utiligantoj de Veturilo estas kontentaj pri la funkciado de la sistemo. Pli ol 90 procentoj de la enketitoj taksis ĝin kiel bonan aŭ tre bonan. La sistemo Vetruilo estis funkciigita la 1-an de aŭgusto 2012, ĝia E-nomo Veturilo proponita de Marek Kempisty gajnis en la publika plebiscito i.a. dank’ al la subteno de esperantistoj ne nur el Pollando, sed ankaŭ el aliaj landoj.

El la elsendo 04.02.2014. Legas Gabi

La bicikloluejoj Veturilo en 2013

--------------------------------------------------------------------------------

Polino distingita de la brita reĝino Elizabeta la 2-a
[2014-02-04]
https://pola-retradio.org/2014/02/polino-distingita-de-la-brita-regino-elizabeta-la-2-a/

La 62-jaraĝa Elżbieta Wanda Piotrowska, la direktorino de Morley College en Londono estis distingita de la reĝino Elizabeta la 2-a per medalo de la Oficiro de la Ordeno de la Brita Imperio – OBE pro la meritoj en la edukado de plenkreskuloj. Piotrowska naskiĝis en Britio en la familio de la polaj milit­rifuĝintoj – ŝia patrino estis malliberigit­ino de Oberlangen, la patro estis soldato de generalo Stanisław Maczek. Ekde 2008 ŝi estas direktorino de la funkcianta ekde la 80-aj jaroj de la 19-a jarcento koleĝo specialist­iĝanta pri la edukado de la plenkreskuloj. diplo­mitiĝinte pri sociologio en la universitato de Kent ŝi pli frue laboris en la kleriga inspektor­aro Ofsted, ŝi estis instruistino kaj manaĝero. En MorleyCollege en la sud-orienta Londono edukiĝas ĉ. 11 mil plenkreskuloj jare. Ĝi specialist­iĝas pri la sociaj sciencaj kaj artaj studdirektoj: pentroarto, muziko, aktorado, danco k.s. Kun la lernejo estis ligitaj konataj komponistoj Gustaw Holst kaj Ralph Vaugham Williams, nun kunlaboras konata pentristo David Hockney. MorleyCollege havas riĉan programon de ekspozicioj, lekcioj kaj koncertoj.

El la elsendo 04.02.2014. Legas Gabi

Elzbieta W. Piotrowska distingita de la brita regxino

--------------------------------------------------------------------------------

Interparolo kun Birke kaj Bertilo Wennergren dum Arkones (2013)
[2014-02-04]
https://pola-retradio.org/2014/02/interparolo-kun-birke-kaj-bertilo-wennergren-dum-arkones-2013/

Birke kaj Bertilo Wennergren post 10-jara foresto koncertis kadre de la riĉa kultura programo de Arkones 2013. Tio estis ankaŭ la okazo renkontiĝi antaŭ nia mikrofono por paroli pri ilia kelkjara estado en Koreio, la laboro de Bertilo pri reeldono de POMEGO kaj lia aktivado en la Akademio de Esperanto, krome  pri ilia komuna muzikado kaj koncertado. Ne mirige,  ke fragmente du kanzonoj el ilia Arkones-koncerto aŭdiĝas komence kaj fine de nia interparolo. El la elsendo 04.02.2014 .

--------------------------------------------------------------------------------

E_elsendo el la 04.02.2014
[2014-02-04]
https://pola-retradio.org/2014/02/e_elsendo-el-la-04-02-2014/

Podkasto: Ludu en nova fenestro | Elŝutu

Birke kaj Bertilo Wennergren post 10-jara foresto koncertis kadre de la riĉa kultura programo de Arkones 2013. Tio estis ankaŭ la okazo renkontiĝi antaŭ nia mikrofono por paroli pri ilia kelkjara estado en Koreio, la laboro de Bertilo pri reeldono de POMEGO kaj lia aktivado en la Akademio de Esperanto, krome pri ilia komuna muzikado kaj koncertado. Specimenoj de ilia komuna koncerto aŭdiĝas en la 305-a E-elsendo ĉe www.pola-retradio.org. Komence ni informas pri distingo de meritiĝinta polino fare de la brita edzino kaj jarrezultoj de la publika biciklo-luejo Veturilo en 2013. En la temoj el la pola gazetaro i.a. ni parolas pri restriktoj kontraŭ la tabakfumado laborloke. Nia scienca bulteno notas sukceson de pola studentino projektinta aviadilon kaj informas pri spuroj de tiom ekzotikaj rabobestoj kiel – jaguaroj kaj lampartoj sur la tereno de la nuna Pollando. Aktualaĵoj kaj informoj de la scienca bulteno estas paralele legeblaj kaj aŭskulteblaj en koncernaj rubrikoj. Ankaŭ interparolo kun niaj antaŭmikrofonaj gastoj en la akompano de du kantoj el ilia Arkones-koncerto troviĝas en la rubriko “Antaŭ la mikrofono”.

--------------------------------------------------------------------------------

Spuroj de ekzotikaj rabobestoj en Pollando
[2014-02-04]
https://pola-retradio.org/2014/02/spuroj-de-ekzotikaj-rabobestoj-en-pollando/

Jaguaroj, lampartoj (leopardoj) kaj plejstocenaj leonoj vivis iam en la suda Pollando, en la regiono de la nuna Silezio. Tion ni scias dank’ al. sciencistoj el la Vroclava Universitato, kiuj en la kaverno Biśnik retrovis la restaĵojn de la prahistoriaj rabobestoj. Tio pruvas, ke la daŭro kaj flaŭro sur la tereno de Pollando estis pli abunda ol antaŭe oni asertis. Regis nome la opinio, ke tiu tereno pro la klimataj kondiĉoj ne estis vivoriĉa. Ekzistas tamen malaj pruvoj. Jaguaro povis vivi tie antaŭ ĉ. 2 milionoj da jaroj veninte el Afriko kaj Azio. Lampartoj kaj plejstocenaj leonoj vivis  antaŭ ĉ. 600 mil jaroj. La tiamaj jaguaroj pezis ĉ. 150-200 kilogramojn kaj memorigis la besto­ekzemplerojn nun vivantajn en la Centra kaj Suda Ameriko. La pli posta apero de plejstocenaj leonoj, la rabobesto pezanta ĉ. 350-500 kilogramojn forpuŝis jaguarojn de ĉi tiu tereno. Jam pli frue eblis trovi la spurojn de plejstocenaj leonoj, tamen la malkovro de jaguaroj kaj lampartoj postulis konfirmon kaj komparon de la kolektita arkeologia materialo kun eksponaĵoj en aliaj muzeoj. La arkeologiaj esploroj en la kaverno Biśniak estas gvidataj de 1991. Ili liveris tre riĉan arkeologian kaj paleontologian materialon, kiu dokumentas la historion de la homo sur la fono de la naturaj transformiĝoj en la lastaj 350-300 mil jaroj. La analizo de la besto­restaĵoj ebligis identigi pli ol 100 speciojn de mamuloj.

El la elsendo 04.02.2014. Legas Barbara

--------------------------------------------------------------------------------

Aviadilo projektita de pola 21-jarulino
[2014-02-04]
https://pola-retradio.org/2014/02/aviadilo-projektita-de-pola-21-jarulino/

La 21-jaraĝa Natalia Kubiak, studentino de la teknika fakultato de la Teknologia Universitato en Szczecin (la nord-okcidenta Pollando) en la daŭro d unu jaro projektis pasaĝeran aviadilon, kiu havas ŝancon esti produktata. La ideo de la aviadilo kreiĝis sub la influo de artikolo pri aviadilo kun t.n. kanalaj flugiloj. Ŝia projekto­postulis profundigon de specializaj konoj kaj prenis multajn horojn. Tiel kreiĝis Goldcrest, en la pola lingvo Mysikrólik kaj en Esperanto Orverta Regolo. Temas pri eksterordinara kombino de helikoptero kun klasika aeroplano, kalkulebla al. la klaso >malgranda merkatista firmo< kun lokoj por du pilotoj kaj 4 pasaĝeroj. La projekto de la 21-jaraĝa pola studentino estas eŭropskala evento. Ĝi akiris la 2-an lokon en la studenta konkurso SolidWorks.

El la elsendo 04.02.2014. Legas Barbara

--------------------------------------------------------------------------------

Prof. Humphrey Tonkin pri ĉeĥa versio de “Maskerado ĉirkaŭ la morto”
[2014-02-07]
https://pola-retradio.org/2014/02/prof-humphrey-tonkin-pri-ceha-versio-de-maskerado-cirkau-la-morto/

Humphrey Tonkin estas la tradukinto en la anglan el la E-originalo de la libro de Teodoro S. Ŝvarc, Tivadar Soros “Maskerado ĉirkaŭ la morto”. Pri tiu ĉi traduko kaj alilingvaj tradukoj ni interparolas kun nia antaŭmikrofona gasto antaŭ la lanĉo de la ĉeĥa versio de ĉi tiu libro  en Prago, Ĉeĥio. El la elsendo 07.02.2014 .

--------------------------------------------------------------------------------

E_elsendo el la 07.02.2014
[2014-02-07]
https://pola-retradio.org/2014/02/e_elsendo-el-la-07-02-2014/

Podkasto: Ludu en nova fenestro | Elŝutu

Prof. Humphrey Tonkin estas nia antaŭ­mikrofona gasto en la kunteksto de tre baldaŭ lanĉota ĉeĥa traduko de “Maskerado ĉirkaŭ la morto” de  Teodoro S. Ŝvarc, alivorte Tivadar Soros. En la 306-a E-elsendo ĉe la adreso www.pola-retradio.org ni komence prezentas kultur­kronikon informante pri la 100-jara jubileo de la ne plu vivanta pola komponisto Andrzej Panufnik kaj pri israelaj koncertoj omaĝe al la 80-jariĝo de Krzysztof Penderecki. Nia felietono ĉi-semajne estas dediĉita al Henryk Sławik, unu el polaj Justuloj inter la Nacioj de la Mondo, kiu dum sia dummilita estado en Hungario savis ĉ. 30 mil polojn kaj 5 mil judojn. La nunsemajna leterkesta programero havas simbolan dimension kaj finas ĝin E-kanto de Esperanto Desperado de sur ilia KD “Brokantaĵoj” eldonita de Vinilkomso “Espo Despo”. Kulturaj informoj kaj la felietono estas paralele legeblaj kaj aŭdeblaj en apartaj rubrikoj. Ankaŭ interparolo kun prof. Humphrey Tonkin estas prezentata aparte en la rubriko “Antaŭ la mikrofono”.

--------------------------------------------------------------------------------

Omaĝaj koncertoj lige kun 80-jariĝo de K. Penderecki en Israelo
[2014-02-07]
https://pola-retradio.org/2014/02/omagaj-koncertoj-lige-kun-80-jarigo-de-k-penderecki-en-israelo/

Israela Filharmonia Orkestro kunlabre kun la Pola Instituto en Telavivo omaĝos la 80-jariĝon de Krzysztof Penderecki per serio de koncertoj en Hajfa, Telavivo kaj Jerusalemo, kie la renoma pola komponisto estados inter la 10-a kaj 18-a de februaro. Muzikistoj, The Gary Bertini Israeli Choir  kaj solartistoj Melanie Diener – sopranulino, Agnieszka Rehlis (mezo­sopranulino), Rafał Bartmiński (tenorulo) kaj Robert Jezierski (basulo) prezentos al la israela publiko “Polan Rekviemon”, komponaĵon de Penderecki el la 1981-a jaro. Direktos la komponisto mem. La plej frue komponita parto de la “Pola Rekviemo” estas “Lacrimosa”, baziĝanta sur la sekvenco “Dies Irae”. Ĝi estas dediĉita al Lech Wałęsa, Solidareco kaj omaĝas la memoron de la perintaj ŝipfaristoj en decembro 1970. Lacrimosa estis plenumita dum  la senvulao de dediĉitaj al ili Tri Krucoj en Gdansko, la 16-an de decembro 1980.

El la elsendo 07.02.2014. Legas Milada

--------------------------------------------------------------------------------

100-jariĝo de Andrzej Panufnik
[2014-02-07]
https://pola-retradio.org/2014/02/100-jarigo-de-andrzej-panufnik/

Last­merkrede, t.e. la 5-an de februaro per koncerto en la londona Barbican Hall komenciĝis la solenaĵoj de la 100-a naskiĝ­datreveno de Andrzej Panufnik. La Londona Simfonia Orkestro sub la direkto de Michael Francis plenumis du liajn komponaĵojn – la 3-an Simfonion “Sinfonia Sacra” el 1963 kaj Lulkanton por 29 arĉ­instrumentoj kaj du harpoj el 1947. Panufnik plimulton de sia vivo pasigis en Britio. Lia “Sinfonia Sacra” komponita por la miljariĝo de la pola ŝtato enhavas citaĵojn el la plej malnova konserviĝ­inta religia pola kanto kaj poezia teksto “Dipatrino”, kiu en la Mezepoko rolis kiel –  laŭ nunaj konceptoj – ŝtata himno. Krome ĝi citas la favorpetan liturgian preĝon al Dipatrino. La Sinfonio Sacra entute emfazas la patriotajn kaj religiajn sentojn de komponisto.  En “Lulkanto” Panufnik kombinis siajn du tendencojn al eksperimentado kaj al tradicifideleco.

El la elsendo 07.02.2014. Legas Milada

--------------------------------------------------------------------------------

Koninda polo: Henryk Sławik – 70-a mortodatreveno
[2014-02-07]
https://pola-retradio.org/2014/02/koninda-polo-henryk-slawik-70-a-mortodatreveno/

Henryk Sławik estas polo, kies nomo en la ĝenerala konscio estis longe forgesita kaj daŭre estas ne sufiĉe rekonita. En 2014 pasas la 70-a datreveno de lia morto en la germana koncentrejo Mauthausen-Gusen. Al li kaj al lia hungara amiko Jozefo Antall dankŝuldas savon almenaŭ 5 mil judoj. Senhezite eblas difini lin kiel heroon ne sole polan, sed ankaŭ kiel heroon de la hungara kaj juda nacioj.

La naskiĝinta en 1894 Henryk Sławik estis la 9-a infano en mizera kamparana familio en la suda Pollando. Kiel junulo – kiam la suverena Pollando ankoraŭ ne renaskiĝis – li soldat­servis en la aŭstra armeo kaj supozeble tie li renkontiĝis kun la socialistaj ideoj, al kiuj li fidelis ĝis la vivofino. Post la 1-a mondmilito li membriĝis en la Pola Socialista Partio kaj ekde la komenco distingiĝis per organizaj talentoj i.a. antaŭ plebiscito decidonta pri aparteno de la Supra Silezio al Pollando. Sekve li famiĝis kiel firma defendanto de malfortaj sociaj grupoj. En la periodo inter la du mondmilitoj Sławik gvidis imponan socian agadon aktivante en la loka medio, prezidante societojn kaj sportajn klubojn, organizante laboristajn universitatojn. Dum multaj jaroj li laboris kiel ĵurnalisto ligita kun la partia „Laborista Gazeto” komencante de kunlaboranto kaj finante kiel ĝia ĉefredaktoro.  Ĝis la eksplodo de la 2-a mondmilito li estis la prezidanto de la Sindikato de la Polaj Ĵurnalistoj de Silezio kaj Karbobaseno helpante al ĵurnalistaj kolegoj en la serĉado de laboro kaj organizado de la favoraj por ili karitataj kampanjoj. Pro ĉi tiu agado kaj ankaŭ pro la decide porpola sinteno lia nomo ektroviĝis sur la serĉlisto de la germana polico, do kvankam li tuj ekaktivis favore al defendo kontraŭ la germanan invadinton li devis forlasi Pollandon. Henryk Sławik celis al Francio por rekrutiĝi en la formiĝantaj tie polaj armeaj fortoj. Lia vojo, kiel de multaj polaj rifuĝintoj,  kondukis tra Hungario, kiu laŭplane estis sole dumvoja halto. Okazis aliel.

Komence de oktobro 1939 la tendaron de la polaj rifuĝintoj apud Miskolc vizitis  Jozefo Antall, oficisto de la hungara ministerio por la internaj aferoj delegita por kontaktoj kun poloj. Li rapide rimarkis tradukiston,  kiu senhezite postulis de Antall pli bonajn kondiĉojn por la polaj rifuĝintoj. Tiu estis Henryk Sławik. Li postulis por ili laboron, organizitan instru­sistemon kaj ne gastamon, kiu limiĝu al kaliklevado kaj bona manĝo. Antall proponis al Sławik kunlaboron, kiu rapide transformiĝis en amikecon. Henryk Sławik fariĝis la prezidanto de la Civitana Komitato por Helpo al Poloj dum la pola elmigra registaro nomumis lin delegito de la ministro por la socia protekto. Sławik kun karakteriza por si entuziasmo organizis socialan kaj medicinan helpo por la rifuĝintoj, helpis trovi la laboron. En la establitaj de la Komitato kleriĝejoj estis organizataj renkontiĝoj kaj artaj prezentoj. Estis eldonataj propraj gazetoj, kiel „Polaj Sciigoj”. La rimedoj por tiu agado venis kaj de la pola kaj de la hungara flankoj.

Inter la laboroj de la Komitato unu el la plej delikataj taskoj  estis savo de preskaŭ 5 mil judoj, venintaj al Hungario meze de 1943 post la likvido de getoj en la sudo de Pollando. Ankaŭ ĉi-sfere okazis intima, kvankam strikte konfidenca kunlaboro de Henryk Sławik kaj Jozefo Antall. La prezidanto de  la Civitana Komitato por Helpi Polojn estis aranĝanta por ili nomŝanĝojn kaj falsajn dokumentojn. Cento da judaj infanoj trafis al la katolika orfodomo en Vac, kiu oficiale funkciis sub la ŝildo de orfodomo por infanoj de polaj oficiroj. En la tiea antaŭ­lernejo kaj baza lernejo estis realigita pola instru­programo, sed la judaj infanoj ne estis senigitaj je sia identeco. Krom „oficiala” partopreno en la sankta meso ili estis instruataj pri la hebrea lingvo kaj la Malnova Testamento. Al la kamuflo  aliĝis la Katolika Eklezio.  Ĉio ĉi kaŭzis, ke ĉiuj infanoj el Vac saviĝis el la militinfero. Henryk Sławik ne estis tiom bonŝanca.

Printempe de 1944 Hitler malkontenta pro la „mola” politiko de Miklós Horthy komencis la okupaciadon de Hungario. Komenciĝis la persekutadoj de polaj rifuĝintoj, tuj kelkaj laborantoj kaj kunlaborantoj de la Civitana Komitato estis pafmortig­itaj kaj arestitaj. Henryk Sławik eĉ se konsciis pri la minaco tamen ne uzis la eblecon fuĝi al Svislando pravigante sian decidon per la maleblo lasi la homojn konfiditajn al lia protekto. Tuj komencis serĉi lin gestapo.

Sławik trafis en la manojn de gestapo en julio 1944 perfidita de iu lernanto el Balatonboglar. Arestita estis ankaŭ Antall. Henryk Sławik estis torturita por malkaŝi sian hungaran kunlaboranton kaj lian rolon en la kontraband­ado de polaj soldatoj al Francio kaj la Proksima Oriento, en la savado de judoj. Tio signifus  por Antall morto­verdikton. Sławik ĝis la fino ne cedis deklarante, ke Antall okupiĝis sole pri la socia helpo. Henryk Sławik trafis al la koncentrejo en Maŭthaŭsen, kie li estis mortigita fine de aŭgusto 1944. Jozefo Antall estis liberigita kaj transvivis la militon.

Post la 2-a mondmilito ŝajnis, ke la memoro de Henryk Sławik estos digne memorigita en Pollando. Ne okazis tiel.  La revenigon de la memoro Henryk Sławik dankŝuldas al Henryk Zimmermann – saviĝinta juda juristo, kiu kun la falsaj dokumentoj en 1943 fariĝis kunlaboranto de Sławik. Fine de 1988 tiu ĉi eksa politikisto, i.a. vicprezidanto de la Kneseto kaj diplomato, i.a. la israela ambasadoro en Novzelando pere de gazetara anonco en la periodaĵo „Przekrój” komencis serĉi >sinjoron Sławik, polan konsulon en Budapeŝto, kiu helpis savi multajn polojn kaj judojn<. Dank’ al lia atesto,  ke Henryk Sławik kontribuis al la savo kontraŭ la neevitebla morto de miloj da judoj, aŭtune  de 1990 la filino de Henryk Sławik transprenis en Yad Vashem en Jersualemo la postmorte atribuitan al li Medalon Justulo inter la Nacioj de la Mondo. Postmorte li estis distingita ankaŭ i.a. per la ordeno de la Blanka Aglo, liajn agojn omaĝas la nomoj de lernejoj kaj porokazaj memor­tabuloj. Al lia agado estas dediĉitaj libro „Henryk Sławik – la pola Wallenberg” kaj  kreiĝinta baze de ĝi filmo. Pasintjare la pola prezidento Bronisław Komorowski malkovris lta memor­tabulon al Henryk Sławik la savinto de i.a. ĉ. 5 mil judoj en la  koncentrejo Mauthausen-Gusen – memorigante, ke temas pri  la heroo de tri nacioj: pola, hungara kaj juda.

El la elsendo 07.02.2014. Legas Tomek

--------------------------------------------------------------------------------

Senlaboreco en la eŭropunia eŭrosfero en 2013
[2014-02-11]
https://pola-retradio.org/2014/02/senlaboreco-en-la-europunia-eurosfero-en-2013/

Laŭ Eurostat en decembro 2013 en la eŭropunia eŭrosfero estis senlaboraj 12 procentoj de la civitanoj, same kiel en novembro kaj oktobro. En la tuta Unio tiu indico iom malkreskis kaj egalis al 10, 7 procentoj. La fenomeno  rilatis al 26 milionoj da civitanoj. Kompare kun la sama periodo de 2012 la nombro de senlaboruloj kreskis je 130 mil personoj. Plej malgrandan senlaborecon oni notis en Aŭstrio, kie ĝi koncernis ne plenajn 5 procentojn de la civitanoj, sekve en Germanio kaj Luksemburgio. Plej malbone la situacio aspektis en Greklando kaj Hispanio. En tiu ĉi lasta lando la senlaboreco trafis pli ol 25 procentojn de peronoj. Kompare al 2012 la senlaboreco kreskis en 14 membrolandoj, malkreskis en 13, en Svedio ĝi restis sur la sama nivelo. En la tuta Unio senlaboraj estis pli ol 23 procentoj de junaj personoj. Laŭ Eŭrostat la senlaboreco en Pollando en decembro 2013 egalis al pli ol 10 procentoj, dum laŭ la Ĉefa Statistika Oficejo ĝi estis je 3, 4 procentoj pli alta.

El la elsendo 11.02.2014. Legas Krystyna

Senlaboreco en la eurosfero 2013

--------------------------------------------------------------------------------

Postuloj de islamanoj en Germanio
[2014-02-11]
https://pola-retradio.org/2014/02/postuloj-de-islamanoj-en-germanio/

La loĝantaj en Germanio turkoj postulas enkondukon de leĝe agnoskita  muzulmana festo kaj enlaborigon de islamaj religiuloj en la germanaj militistaj fortoj, hospitaloj kaj malliberejoj. Laŭ Kenan Kolat, la prezidanto de la turka komunumo kiel leĝe agnoskita festo konforma estus Festo de Ofero. Ĝi estas la plej grava muzulmana festo. En Germanio loĝas nun ĉirkaŭ 4 milionoj da muzulmanoj. En plimulto ili devenas el Turkio, la sekvan lokon okupas islamanoj el la Sud-Orienta Eŭropo.

El la elsendo 11.02.2014. Legas Krystyna

Postuloj de la turka malplimulto en Germanio

--------------------------------------------------------------------------------

Mirejo Grosjean pr la 5-a Afrika E-Kongreso (2013-2014) kaj pri planataj pliaj E-aranĝoj en Afriko
[2014-02-11]
https://pola-retradio.org/2014/02/mirejo-grosjean-pr-la-5-a-afrika-e-kongreso-2013-2014-kaj-pri-planataj-pliaj-e-arangoj-en-afriko/

Mirejo Grosjean el Svislando – renkontita dum la Interlingvistikaj Studoj en Poznano – interparolas kun ni pri la januara 5-a Afrika E-Kongreso kaj pri la planoj okazigi pliajn E-eventojn sur ĉi tiu kontinento. El la elsendo 11.02.2014 .

--------------------------------------------------------------------------------

E_elsendo el la 11.02.2014
[2014-02-11]
https://pola-retradio.org/2014/02/e_elsendo-el-la-11-02-2014/

Podkasto: Ludu en nova fenestro | Elŝutu

Kun Mirejo Grosjean ni interparolas pri la januara 5-a Afrika E-Kongreso kaj pri planataj pliaj E-aranĝoj sur la afrika kontinento. Komence de la 307-a E-elsendo ĉe www.pola-reradio.org aŭdiĝas informa segmento, en kiu ni i.a. informas pri senlaboreco en la eŭrosfero en 2013,  pri postuloj de la turka malplimulto en Germanio kaj longa kunloĝado de polaj junuloj kun la gepatroj. El la scienca bulteno eblas ekscii pri la plej profunda fervoj­tunelo ekde oktobro 2013 funkcianta en Istanbulo kaj pri kanadaj esploroj rilate la tango­terapion. Muzike akompanas nin kanto el la KD “Afrika Kompilo” eldonita de Vinilkosmo >Kiu lingvo por la homaro<. Aktualaĵoj kaj informoj el la scienca bulteno kaj ankaŭ interparolo kun nia antaŭ­mikrofona gasto aŭdiĝas en unuopaj rubrikoj de nia paĝo.

--------------------------------------------------------------------------------

Tango kiel  medikamento por personoj kun neŭrologiaj malsanoj
[2014-02-11]
https://pola-retradio.org/2014/02/tango-kiel-medikamento-por-personoj-kun-neurologiaj-malsanoj/

“Teo kaj Tango” estas la titolo de la eksperimenta programo por pacientoj kun neŭrologiaj malsanoj, kiu antaŭ kelkaj monatoj komenciĝis en la kanada Halifakso. Pacientoj dancas tangon ekzercante kun studentoj de la baleta lernejo kaj post la okupoj renkontiĝas trinkante teon. La unuaj rezultoj estas promeso­plenaj. La terapio estis organizita kunlabore kun porsenjora organizo „Happily Ever Active”. Konforme al la esploroj elmontrantaj signifan dependecon inter moviĝo kaj fizika kaj psika sano la psika kaj fizika bonfarto de pacientoj partoprenantaj tango­lecionojn rapide pliboniĝas. tango­terapio estis testita jam en la uni­veristata skolo de medicino en Vaŝingtono. Laŭ d-ino Gammon M. Earhart danco ŝajnas realigas multajn, se ne ĉiujn el la rekomend­ataj ekzerco­programoj por personoj suferantaj Parkinson-malsanon. Krom Halifkso la lecionoj kun popoldanco okazas en Toronto kaj estas analizataj de sciencistoj el la universitatoj York kaj Ryerson. La eblecon apliki terapie dancon oni esploras ankaŭ en Montrealo, en la teatro de la Granda Kanada Baleto. Funkcias tie  centro de danco­terapio ofertanta al interesiĝantoj i.a. kompletigon aŭ ŝanĝon de kvalifikoj. Krome oni kunlaboras kun 4 universitataj esplor­centroj.

El la elsendo 11.02.2014. Legas Tomek

--------------------------------------------------------------------------------

La plej profunda fervoja tunelo de la mondo
[2014-02-11]
https://pola-retradio.org/2014/02/la-plej-profunda-fervoja-tunelo-de-la-mondo/

Fine de oktobro 2013 estis inaŭgurita la fervoja tunelo sub la Bosfora Merkolo en Istambulo. Ĝi ligis la eŭropan kaj azian parton de Turkio. Laŭ la premiso ĝi estas ero de projekto ligi la azian fervoj­sistemon kun la eŭropa kaj stimulos la turkan mastrumadon.  La tunelo longas 14 kilometrojn, inkluzive de 1 kaj duon­kilometra segmento troviĝanta sub Bosforo mem. Ĝi troviĝas en pli ol 55-metra profundo kaj estas la plej profunda fervojlinia tunelo en la mondo. Kostante 4 miliardojn da dolaroj ĝi ligas kontinentojn de la historia Silka Trako. Unu miliardon investis japanoj. Laŭ enkondukaj pritaksoj la trajnoj de Marmaray povos ĉiutage transporti ĉirkaŭ unu milionon da pasaĝeroj. La trafikdaŭro sub Bosforo egalas al ĉirkaŭ 4 minutoj, veturo de unu rando de Istambulo al la alia postulas 105 minutojn. La konstruado komenciĝis en 2005 sed la investaĵo prokrastiĝis je 4 jaroj pro arkeologiaj esploroj pri i.a. retrovitaj objektoj post la bizanca haveno el la 4-a jarcento de nia erao. Sub Bosforo estas planita krome aŭtomobila tunelo, Istambulo ricevos krome la trian ponton kaj flughavenon laŭpremise la plej grandan en la mondo.

El la elsendo 11.02.2014. Legas Tomek

--------------------------------------------------------------------------------

E_elsendo el la 14.02.2014
[2014-02-14]
https://pola-retradio.org/2014/02/elsendo-el-la-14-02-2014/

Podkasto: Ludu en nova fenestro | Elŝutu

Nova vidindaĵo, proponata en la 308-a E-elsendo, estas la Kastelo en Będzin, en la suda Pollando. Komence ĉe la adreso www.pola-retradio.org aŭdiĝas kulturaj informoj, ĉiuj en la kunteksto de la varsovia Nacia Muzeo. E-informoj rilatas al la eventoj en Brazilo kaj en Pakistano. En nia leterkesta renkontiĝo – krom reagi al la korespondaĵoj de niaj geaŭskultantoj – ni i.a. referencas al la pasinta la 13-an de februaro Monda Tago de Radio lanĉita de Unesko kaj al la ĉi-rilata mesaĝo de la Ĝenerala Direktoro de Unesko, Irina Bokowa. Kulturaj informoj kaj la felietono estas samtempe legeblaj kaj aŭdeblaj en koncernaj rubrikoj de nia paĝo.

--------------------------------------------------------------------------------

Laŭvica rabita dummilite artverko revenis al Pollando
[2014-02-14]
https://pola-retradio.org/2014/02/lauvica-rabita-dummilite-artverko-revenis-al-pollando/

Komence de februaro en la pola konsulejo en Novjorko estis transdonita al Pollando la ŝtelita dum la 2-a mondmilito pentraĵo „Sankta Filipo baptas servon de la reĝino Kandaki” de la germana pentristo Johann Conrad Seekatz. Temas pri la 17-jarcenta pentraĵo sur la kupra lado kun motivo el la Nova Testamento. La pentraĵo ŝtelita plej verŝajne dum la Varsovia Insurekcio 1944 revenos al la Nacia Muzeo en Varsovio. Dum la solenaĵo la ĉeestanta kultur­ministro, Bogdan Zdrojewski memorigis, ke dum la 2-a mondmilito Pollando perdis grandegan parton de la kultura nacia heredaĵo. Laŭ lia pritakso el la muzeoj mem malaperis ĉ. 70 mil artverkojn. Pollando ne ĉesigos klopodojn por reakiri la ŝtelitajn dummilite aŭ perditajn kultur­trezorojn.

El la elsendo 14.02.2014. Legas Tomek

--------------------------------------------------------------------------------

Nova eldonaĵo pri la Nacia Muzeo en Varsovio
[2014-02-14]
https://pola-retradio.org/2014/02/nova-eldonajo-pri-la-nacia-muzeo-en-varsovio/

“La artveroj. La Nacia Muzeo en Varsovio” eldonita de Arkady estis elektita  en januaro la Libro de la Monato. La distingita de la Literatura Magazino LIBROJ albumo, en la unua jarduono de 2014 aperos anglalingve. Ĝi prezentas al la leganto krom verkoj de la pentroarto, skulptarto, desegnaĵo kaj grafiko ankaŭ artverkojn de la pola dezajno kaj fotoarto  proksimig­ante amplekson de la muzeaj kolektoj. Dum la prilaborado de la albumo la Muzeo reakiris kelkajn perditajn dum la lasta mondmilito verkojn. Ĝi aĉetis krome tre interesan portreton pentritan de Józef Mehoffer, kiun sendube eblas kalkuli al la trezoroj de la varsovia Nacia Muzeo. La 150-an jaron de sia ekzisto la ĉefurba Nacia Muzeo eniris kiel plur­segmenta institucio kolektanta, konservanta kaj disponig­anta artverkojn de multaj generacioj ekde la antikva epoko ĝis la nuntempo. Al aparte menciindaj apartenas kolektoj de la pola kaj eŭropa pentroarto, desegnaĵo, grafiko kaj artmetio. Ĝi fieras pri eksterordinare interesaj kolektoj de la malfru­mezepoka eklezia arto, de la antikva arto inkluzive de unikaj laŭ la monda skalo antikvaĵoj el la nubia katedralo en Faras. Menciindaj estas ĝiaj kabineto de numismataĵoj kaj medaloj, kaj artkolekto rilatanta al la Fora Oriento.

El la elsendo 14.02.2014. Legas Milada

--------------------------------------------------------------------------------

La kastelo en Będzin
[2014-02-14]
https://pola-retradio.org/2014/02/la-kastelo-en-bedzin/

Będzin estas la distrikta urbo situanta en la suda Pollando en la Karbobaseno de Dąbrowa Górnicza ĉe la rivero Czarna Przemsza. Ĝi apartenas al la plej malnovaj urboj de la Krakova Regiono kaj la Silezia Vojevodio.  Ni invitas vin hodiaŭ gesinjoroj pro la situanta sur la alta eskapro vizitinda kastelo, kiu estas ekzemplo de la defenda konstruarto el la mezo de la 14-a jarcento. Ĝi estis grava ĉenero de la defenda sistemo de la okcidenta limo de Pollando kontraŭ atakoj flanke de Silezio kaj Ĉeĥio kaj protektis la komercajn itinerojn el Silezio al Krakovo. La kastela altaĵo per siaj setlotradicioj radikas en la 7-a jarcento antaŭ Kristo, kvankam post la tiea setlejo de la soraba kulturo ne restis multo, sole pot­fragmentoj kaj spuroj de fajrujoj. Pli multo estus direnda baze de arkeologiaj restaĵoj pri la frumezepoka defenda burgo el la 9-a jarcento ĉirkaŭita per fosaĵo kaj remparego kiu ekzistis ĝis la 12-a jarcento post kiam la tereno estis ebenigita kaj kreiĝis sur ĝia tereno tombejo. La setlado moviĝis al la okcidenta parto de la altaĵo sur kiu poste estis konstruita kastelo.

La fortreso nun konsistas el supra kastelo kaj vasta sub­kastelejo kun restaĵoj de la defendo­murego. En la supra parto troviĝas loĝdomo, ali­konstruita kvarflanka loĝ-defenda turo kaj pli ol 20-metra ronda bastiono origine 30-metra. Sur ĝia pinto nun troviĝas panoramejo kun vasta alrigardo al la tuta regiono. La kastelon ĉirkaŭas fosaĵo kaj alta duobla ĉirkaŭ­murego en kies interno troviĝas promenejo kun benkoj kaj lumĵetiloj prilumantaj la kastelon nokte. Ene de la kastelo funkcias Muzeo kun tre riĉa kolekto de malnovaj armiloj, ekspozicio pri la urbo mem kaj pri aliaj kasteloj el la defenda itinero de la t.n. Aglaj Nestoj.

La kastelo estis notita jam en la dokumentoj el la 1349, mencias ĝin kronikistoj Jan el Czarnków kaj Jan D?ugosz en la registro de fortikaĵoj konstruig­itaj de la reĝo Kazimiro la Granda. Ĝi estis atestanto de multaj gravaj historiaj eventoj. En 1364 gastis tie Karolo la 4-a, la germana imperiestro kaj ĉeĥa reĝo. En 1434 en la kastelo estis subskribita interkonsento inter sileziaj kaj krak­ovprovincaj sinjoroj pri kon­trabatalado de limrabistoj. En 1588 estis subskribita tie Pakto de Będzin-Bytom, kiu devigis Maksumilianon Habsburg rezigni pri la pretendoj al la pola trono. En la kastelo gastis ankaŭ polaj reĝoj, Henryk Walezy, Johano la 3-a Sobieski rapidanta al Vieno por batalo kontraŭ turkoj, poste estis tie reĝo Aŭgusto la 2-a Forta.

En 1616 jaro parto de Będzin kune kun la kastelo forbrulis, sed oni rekonstruis ĝin adaptante prefere al la rezidaj ol defendaj celoj. 40 jarojn poste ĝi denove estas ruinigita kaj dum la tuta 18-a jarcento ĝi restis ruino. Romantikan novgotikan rekonstruon oni efektivigis en 1834, sed ĝi ne plu estis ekspluatata kaj novajn rekonstruojn necesis fari denove post la 1-a mondmilito. Definitive al  plena rekonstruo la kastelo estis subigita post la 2-a kaj ekde 1956 ĝi funkcias kiel Muzeo. La plej novaj rekonstruoj okazis nur en la lastaj jaroj. Nun ĉiujare okazas ĉirkaŭ la Kastelo okazas multaj eventoj kiel pafistaj kaj kavaliraj  turniroj.  La kastelo en Będzin logas ankaŭ muzik­ŝatantojn. Ĉiujare fine de la somera feria sezono la amantoj de vaste komprenata kelta kulturo renkontiĝas piede de la Kastelo por la plej granda en la centra Eŭropo Festivalo de la Kelta Muzoko. Oni aŭskultas ne nur muzikon el la tuta Eŭropo, samtempe eblas lerni la muzikludon kaj dancojn. Dum la festivalo siajn verkojn inspiritajn per la pejzaĝoj de Skotlando, Bretonio kaj Irlando prezenas plastikistoj el la tuta Pollando. Do bona loko por ripozo memoriganta la legendon pri la kreiĝo de la nomo de Będzin, kiam reĝo Kazimiro la Granda veninta tien deklaris: „Tutaj będziem odpoczywali”, kio signifas – tie ni ripozos.

El la elsendo 14.02.2014. Legas Barbara

--------------------------------------------------------------------------------

Monitorata la sorto de universitataj diplomitoj en Varsovio
[2014-02-18]
https://pola-retradio.org/2014/02/monitorata-la-sorto-de-universitataj-diplomitoj-en-varsovio/

Sistemo monitoranta  la sortojn de diplomitoj de la superaj lernejoj estas testata en la Varsovia Universitato. Laŭ la ĵus publikigitaj rezultoj evidentiĝas, ke 70 procentoj de la eksaj universitatanoj en Varsovio tri jarojn post la diplomitiĝo  havas stabilan etatan laboron enspezante pli ol 4 mil zlotojn monate. Ĉirkaŭ duono de ili estas dungita de la sama labordonanto. Aldoniĝas al tio 10 procentoj de la diplomitoj, kiuj establis propran firmaon aŭ laboras kontrakte. Rilate tiujn personoj mankas donitaĵoj pri iliaj enspezoj.  La ĵus menciitaj rezultoj estis formulitaj baze de analizo de donitaĵoj el la Instituto pri la Sociaj Asekuroj pri la periodo 2007-2011.

El la elsendo 18.02.2014. Legas Krystyna

Monitorado de enlaborigitaj diplomitoj

--------------------------------------------------------------------------------

“Hoteloj” por polenigantaj insektoj
[2014-02-18]
https://pola-retradio.org/2014/02/hoteloj-por-polenigantaj-insektoj/

En Varsovio funkcias la unua “hotelo” por polen­igantaj insektoj. Speciale konstruataj por ili “dometoj” – ĝiscele 100 – ekde marto komencos kreiĝi en la tuta lando. Dank’ al ili la sovaĝe vivantaj polenigantaj insektoj pli bone frontos la vivon en grandaj urboj. Mono por ilia elkonstruo estis kolektita dum la pasintjara septembra kampanjo “Adoptu abelon”. Ĝi celas protekti la polen­igantajn insektojn amase mortantajn sekve de malsanoj, amaskvanta uzo de  kemiaĵoj en la agrikulturo kaj detruado de iliaj vivejoj.

El la elsendo 18.02.2014. Legas Krystyna

Hoteloj por polenigantaj insektoj

--------------------------------------------------------------------------------

Fábio Santos dum vizito al Bona Espero (2014) parolas pri porpaca festivalo
[2014-02-18]
https://pola-retradio.org/2014/02/fabio-santos-dum-vizito-al-bona-espero-2014-parolas-pri-porpaca-festivalo/

Fábio Santos el Brazilo kune kun la familio jarŝanĝe de 2013/2014 venis al Bona Espero. Kondukis lin tien la spertoj kaj ideoj de la porpaca Festivalo en kiu Esperanto ludis signifan rolon, kiu en septembro 2013 okazis en Goiânia, Brazilo. El la elsendo 18.02.2014 .

--------------------------------------------------------------------------------

Praepokaj spuroj de kranitrepanado en Peruo
[2014-02-18]
https://pola-retradio.org/2014/02/praepokaj-spuroj-de-kranitrepanado-en-peruo/

Antaŭ pli ol mil jaroj en la montoj de Peruo oni praktikis komplikajn kirurgiajn operaciojn, inkluzive de kranitrepanado.  La malkovroj de Danielle Kuris el la Kalifornia Universitato en Santa Barbara pruvas, ke tiuj operacioj antaŭ mil jaroj estis sukcese efektivig­ataj. Danielle Kurin ekzamenis ostojn de 32 personoj sur kies kranioj ŝi trovis spurojn de 45 kirurgiaj intervenoj. Iuj interveno­lokoj estis kunkresk­itaj, kio atestas pri tio, ke paciento vivis post la operacio relative longe.  Sciencistoj estas konvinkitaj, ke temas pri la spuroj de la kuracista helpo kaj ne de torturoj aŭ vundoj. Sur la kranioj videbligas nome spuroj post la forrazado de haroj kaj aplikado de kuracherboj, kio manifestiĝis en ŝanĝo de koloro de la kranio. La unuaj pruvoj pri krani­trepanado el Peruo devenas el la 200-600 jaroj antaŭ nia erao. La lastaj el ĉ. 16-a jarcento.

El la elsendo 18.02.2014. Legas Barbara

--------------------------------------------------------------------------------

Ĉimpanza gestolingvo
[2014-02-18]
https://pola-retradio.org/2014/02/cimpanza-gestolingvo/

Specialistoj el la Ŝtata Universitato de Georgio pruvis, ke ĉimpanzoj havas propran gestolingvon ebliganta peri tre precizajn komunikojn. Ĝi helpis en la serĉado de nutraĵoj kaj reciproka informado pri minacoj. Ĝi estas ankaŭ elemento en la evoluo de parola lingvo. Kolektivo de doktoro Charles Menzel projektis eksperimenton, en kiu du ĉimpanzoj gvidu la aktivadojn de homo serĉanta nutraĵon en libera spaco. Homo, ne sciis kie ĝi troviĝas dum la ĉimpanzoj jes. Ili per la gestoj logis homoj direktiĝi al. koncerna loko. La simioj elektis la metodon de la komunikado kaj inaŭguris inter­paprolon. Ĉimpanzo devis kapti la atenton de la homon kaj gvidi laŭ la dezirata de si maniero. Laŭ Sarah-Jane Vick kvankam sciencistoj jam antaŭe sciis pri la kapablo de la ĉimpanzoj interkomuniki geste, sed la unuan fojon oni observis tiom komplikajn komunikojn kaj kunordigon de la agadoj.

El la elsendo 18.02.2014. Legas Barbara

--------------------------------------------------------------------------------

E_elsendo el la 18.02.2014
[2014-02-18]
https://pola-retradio.org/2014/02/e_elsendo-el-la-18-02-2014/

Podkasto: Ludu en nova fenestro | Elŝutu

Fabio Santos el Goiânia, Brazilo renkontita en Bona Espero estas la gasto de nia 309-a E-elsendo ĉe www.pola-retradio.org. Ni interparolas pri la porpaca Festivalo okazinta tie dum la pasintjara septembro, en kiu Esperanto ludis apartan rolon. En la elsendo aŭdiĝas speciale komponita por ĝi kanzono, kvankam ne temas pri koncerta surbendigo. Ĉefloke de la elsendo ni referencas al la daŭranta Semajno de Internacia Amikeco en akompano de Ĵomart kaj Nataŝa kaj ilia “Valso por amikoj”. En la aktualaĵoj ni informas pri monitorado de laboro de universitataj diplomitoj en Varsovio kaj pri “hoteloj” por polenigantaj insektoj. Nia trarigardo spegulas ekonomiajn problemojn. En la scienca bulteno ni ligas al novaj malkovroj pri gesta lingvo de ĉimpanzoj kaj praepokaj spuroj de kranitrepanado en Peruo. Krome Merlin kantas fragmente la titolan kanzonon de sia KD  eldonita de Vinilkosmo “Por la mondo”.

--------------------------------------------------------------------------------

Tago de la Gepatra Lingvo 21.02.2014
[2014-02-21]
https://pola-retradio.org/2014/02/tago-de-la-gepatra-lingvo-21-02-2014/

La hodiaŭa Internacia Tago de la Gepatra Lingvo pasas sub la devizo „Lokaj lingvoj por la globskala civitaneco – scienco en la atento­centro”. Ĝi emfazas la signifon de la gepatra lingvo kaj de la lokaj dialektoj por la evoluo de la globskala edukado formanta la kapablon de aktiva partopreno en la socia vivo kaj la kapablon solvi la problemojn same sur la loka kiel ankaŭ sur la tutmonda niveloj. Dum la planita por hodiaŭ Konferenco en la pariza Unesko-sidejo ekspertoj parolas i.a. pri la rolo de la gepatraj lingvoj en la perado kaj popularig­ado de la konoj de la lokaj kaj aŭtoktonaj socioj. Ili traktas ankaŭ la rolon de tiuj lingvoj en la solvado de aktualaj problemoj de la mondo. Unesko difinas la plurlingvan edukadon, kiel utiligadon de du aŭ pli lingvoj kiel instrumentojn de lernado kaj akirado de konoj. Laŭ la difino el 1999 temas pri lingvo de la loka socio, la gepatra lingvo kaj lingvoj de internacia komunikado. UEA en sia starpunkto el 2008 deklaris sin por la lernado de du, tri aŭ kvar lingvoj depende de la cirkonstancoj. Temas pri la gepatra lingvo, la regiona lingvo, se ĝi estas malsama ol la gepatra, la nacia lingvo, se ĝi malsamas disde la du ĵus menciitaj kaj la internacia lingvo estata nenies posedaĵo, alivorte Esperanto.

El la elsendo 21.02.2014. Legas Krystyna

--------------------------------------------------------------------------------

Interkompreniĝo en Kievo
[2014-02-21]
https://pola-retradio.org/2014/02/interkomprenigo-en-kievo/

La prezidento de  Ukrainio Wikotr Janukowycz kaj la gvidantoj de la opozicio Arsenij Jaceniuk, Witalij Kliczko kaj Ołeh Tiahnybok en la ĉeesto de la estroj de la pola kaj germana diplomataro subskribis interkompreniĝon pri elkonduko de la lando el la krizo. Jam vendredon posttagmeze estis realigita unu el la punktoj de la interkom­preniĝo, estis revenigita la Konstitucio el 2004. Inter aliaj punktoj estas establo de la koalicia registaro en la daŭro de 10 tagoj kaj antaŭdataj balotoj.

El la elsendo 21.02.2014. Legas Barbara

Interkomprenigxo en Kievo

--------------------------------------------------------------------------------

Laborante por malmultaj – la raporto de Oxfam
[2014-02-21]
https://pola-retradio.org/2014/02/laborante-por-malmultaj-la-raporto-de-oxfam/

La havaĵoj de 85 plej riĉaj homoj de la mondo egalas al la bonstato de la duono de la homaro, alivorte 3 kaj duona miliardoj da homoj. En la raporto de Oxfam „Laborante por malmultaj” tiu ĉi mondskala help-evoluiga organizo elmontras la skalon de malegaleco, kiun grandigas la rapide kreskantaj havaĵoj de super­riĉuloj. Ĝi ankaŭ avertas, ke tiu fenomeno minacas al la progreso de la homaro. En 2013 la grupo de miliarduloj grandiĝis je 210 personoj aliĝintaj al 1426 mondskalaj riĉuloj disponantaj pri la havaĵo kun la suma valoro de 5,4 bilionoj da dolaroj. La plej riĉa unu procento kontrolas la havaĵojn kun la valoro de 110 miliardoj da dolaroj, kio 65-oble superas la bonstaton de la malpli riĉa duono de la homaro. Tio konsistigas minacon por tutaj ekonomiaj kaj sociaj sistemoj. Laŭ Oxfam-enketo plimulto de la respond­intoj el Brazilo, Hispanio, la Hinda Unio, la Sudafrika Respubliko, Usono kaj Britio multaj leĝoj kaj reguligoj estis envivigitaj por favori la riĉulojn. Laŭ Oxfam kiel ekzemplo de ekstremaj mal­proporcioj servas la Hinda Unio, en kiu dum la lastaj 10 jaroj la nombro de miliarduloj kreskis de 6 ĝis 61.

El la elsendo 21.01.2014. Legas Barbara

Laborante por malmultaj_ la raporto de Oxfam

--------------------------------------------------------------------------------

E_elsendo el la 21.02.2014
[2014-02-21]
https://pola-retradio.org/2014/02/e_elsendo-el-la-21-02-2014/

Podkasto: Ludu en nova fenestro | Elŝutu

Jan aŭ Juan Szychowski – firme ligita kun Argentino – estas laŭvica koninda polo kun kiu eblas konatiĝi en la 310-a E-elsendo ĉe la adreso: www.pola-retradio.org. Komence ni proponas aktualaĵojn – temas pri interkompreniĝo rilate la konflikton en Ukrainio, Tago de la Gepatra Lingvo kaj la 204-a naskiĝ­datreveno de Frederiko Chopin. Nia informo reference al la GK-oj de UEA koncernas la nunjaran Esperantologian Konferencon dum la Bonaera UK. Fine ni renkontiĝas kadre de la leterkesta programero. Adiaŭante la nunjaran Semajnon de la Internacia Amikeco ni faras tion kun JoMo kaj lia kanto “Esperanto”, devenanta el la KD de Vinilkosmo “JoMo friponas”. Tekstoj de aktualaĵoj kaj de la felietono troviĝas en apartaj rubrikoj de nia elsendo­platformo. Eblas ilin samtempe aŭskulti kaj legi.

--------------------------------------------------------------------------------

La 204-a naskiĝ­datreveno de Chopin
[2014-02-21]
https://pola-retradio.org/2014/02/la-204-a-naskigdatreveno-de-chopin/

En la proksimaj tagoj pasas la 204-a naskiĝdatreveno de Frederiko Chopin, kvankam daŭre oni mencias du malsamajn datojn,  la 22-an de februaro kaj la 1-an de marto.

Jam morgaŭ, t.e. la 22-an de februaro estos inaŭgurita ekspozicio en la Muzeo de Frederiko Chopin en Varsovio „Diru dankon al Kolberg pro lia pena laboro. Oskar Kolberg: etnografo, muzikologo, „chopinologo”. Ekde la 1-a de marto samloke aldoniĝos ekspozicio de la plej interesaj plastikistaj laboraĵoj de infanoj kaj gejunuloj inspiritaj per la figuro de Frederiko Chopin. La 1-an de marto estos inaŭgurita ankaŭ aldona ekspozicio dediĉita al la popolaj instrumentoj sur la polaj teritorioj en la tempo de Freeriko Chopin. Ĝi funkcios en la naskiĝdomo de la komponisto en Żelazowa Wola, prezentante popolajn instrumentojn konatajn al Chopin el liaj pluraj vojaĝoj. Temos ankaŭ pri la plej karakterizaj kaj plej interesaj objektoj el la regionoj de li vizititaj eĉ se mallonge.

Okaze de la 204-a naskiĝdat­reveo de la komponisto okazos ankaŭ koncertoj. En Żelazowa Wola la 1-an de marto tagmeze koncertos Akiko Ebi, elstara japana pianistino, laŭreatino de la 5-a loko dum Chopin-konkurso en 1980, nun ĵurianino de plej gravaj muzikaj konkursoj en la mondo. Samtage en la varsovia  Nacia Filharmonio koncertos  vespere Yundi Li,  la venkinto de Chopin-Festivalo en 2000 kaj la laŭreato de speciala premio pro la plej bona plenumo de polonezo.

El la elsendo 21.02.2014. Legas Milada

--------------------------------------------------------------------------------

Konindaj poloj: Jan Juan Szychowski
[2014-02-21]
https://pola-retradio.org/2014/02/konindaj-poloj-jan_juan-szychowski/

Individuaj poloj estis venantaj al Argentino jam en la unua duono de la 19-a jarcento. Tiam ankaŭ aperis tie la unuaj polaj nomoj, kiuj misformitaj kaj adaptitaj al la hispana lingvo transdaŭris ĝis hodiaŭ eĉ en la familioj, kiuj ne plu memoras siajn polajn radikojn. La pola enmigrado intensiĝis post la falo de la Januara Insurekcio en 1863. Al Argentino venis ĉefe kleraj personoj. Komence de la 20-a jarcento direktiĝis tien panakire kamparanoj, ĉefe el la krakova regiono. Inter ili troviĝis muelista familio de Julian Szychowski el Borszczów. Kune kun aliaj poloj – laŭ invito de la argentina registaro kadre de ĝia enmigra programo – ili ekloĝis proksime al Apóstelos, en la bieno „La Cachuera”. Tie ili ricevis 25-50 hektarajn grundpecojn. Inter poloj, kiuj aparte meritiĝis por ĉi tiuj terenoj kaj la nuna provinco Misiones estis Jan Szychowski, inventinto kaj establinto de la familia entrepreno konata nun en la mondo pro la produktado de yerba-mate Amanda. Jan aŭ poste Juan veninte al Argentino havis nur 11 jarojn kaj lia klereco limiĝis al kelkaj klasoj de la baza lernejo. Komence li fariĝis forĝista metilernanto, havante 18 jarojn li malfermis propran forĝejon. Poste li edziĝis al Bronisława Kruchowska veninta al Argentino en la sama grupo de poloj, kiel Jan kun kiu li havis ok gefilojn. Komencaj jaroj ne estis tre promeso­plenaj, se Juan kun la patro direktiĝis laborcele dek kelkajn jarojn poste al Bonaero por akiri ­rimedojn por reveni al la hejmlando aŭ plumigri al Usono aŭ Kanado. La informoj pri la eksplodo de la unua mondmilito ĉesigis iliajn planojn. En Bonaero Jan-Juan la unuan fojon vidis modernajn tor­nomaŝinojn, konatiĝis kun ilia konstruo kaj decidis venigi ilin al la bieno apud Apóstoles. Antaŭ tio povis okazi li konstruis simplan ĉevaltiran radmaŝinon,  kiu fariĝis la energifonto por lia metiejo. Sekve iom laŭ rememoroj kaj dank’ al sia inĝenieco li memstare konstruis plur­funkcian tor­nomaŝinon. La origina estis farita el ligno, sed helpe de ĝi li elkonstruis baldaŭ tornomaŝinon metalan. Temis pri la unua tornomaŝino farita en Argentino. En 1919 Jan Szychowski disponis jam pri aranĝaĵoj kaj instrumentoj necesaj por plukonstrui la establojn de “La Cauchera”, kiu fine alportis al li admiron, famon kaj grandegan fortunon. Kun aprobo de la lokaj aŭtoritatoj Juan Szychowski pretigis geodezian planon de proksima valo,  sekve li projektis kaj elkonstruis digon barante tiel la rojon Chimiray lime de du provincoj. Kreiĝis artefarita lago kaj per la 700-metra kanalo Juan venigis la akvon, kiu movis la tri kaj duonmetran radon, anstataŭig­itan poste per Kaplan-turbino, produktante la elektran energion por la funkciado de maŝinoj en lia fabriko. Aldoniĝis la telefonia linio, kiun li kondukis al sia bieno el Apóstoles fora 20 kilometrojn. En 1932 Szychowski finkonstruis maŝinon por la purigado kaj apartigado de rizo kaj maizo. Poste muelejon por la alifarado de manioko je almelo. Post 4 jaroj li funkciigis maŝinon por la tranĉado de la folioj kaj branĉetoj de yerba-mate. Ĝuste lia plantejo de yerba-mate Amanda ĝis hodiaŭ funkcias kaj okupas laŭ diversaj fontoj la 2-an aŭ la 3-an lokon en Argentino. En 1934 la 2-a Pola Respubliko distingis sian elmigrintan civitanon en Argentino per Bronza Meritkurco pro la enorma entreprenemo kaj sukcesoj. Nun la kruco estas ekspozici­ata en la Muzeo portanta lian nomon,  troviĝanta sur la tereno de La Cachuera. Pro sia persisto kaj inĝenieco Juan Szychowski  fariĝis honora membro de “National Geographic Society”. Li mortis en 1960 lasante gravan heredaĵon al la regiono, en kiu li loĝis.   La entrepreno transiris en la familiajn manojn. En 1989 estis establita fondaĵo portanta la nomon de lia edzino, Bronisława Kruchowska. Inter ĝiaj verkoj estas Speciala Lernejo en Apóstoles portanta la nomon de la Pola Respubliko, salonoj de la samloka Provinca Lernejo de Teknika Edukado. La patrono de ĝia aŭlo estas Juan Szychowski. La fondaĵo engaĝiĝis krome en la elkonstruon de la baza lernejo por la indiĝenaj infanoj de infanoj Guarani “La Negrita”. Nun la fondaĵvolontuloj kunlaboras kun la Eklezio, kun multaj ekologiaj-edukaj organizoj kaj kun indiĝenoj. Kvankam Jan Juan Szychowski venis pli poste al Argentino ol la unuaj polaj setliĝantoj grave kontribu­intaj al la evoluo de Argentino nepre oni omaĝas ankaŭ lian memoron dum la ĉiujara nacia festo de Argentino solenata ekde la 1995-a jaro la 8-an de junio kun emfaza nomo: “Dia del Colono Polaco”,  “Tago de la Pola Setliĝinto”.

El la elsendo 21.02.2014. Legas Barbara

--------------------------------------------------------------------------------

Islando volas retiri peton pri membriĝo en la Eŭropa Unio
[2014-02-25]
