Koninda Polo: Roman Ingarden
[2020-01-03]
https://pola-retradio.org/2020/01/koninda-polo-roman-ingarden/

Kiel ni jam informis, unu el la patronoj de la 2020-a jaro en Pollando, estis proklamita pasintjare de la Pola Sejmo Roman Ingarden. Temas pri la plej granda pola fenomenologo egalkomparata al klasikaj filozofoj. Lia plej grava verko „Disputo pri la ekzisto de la mondo” estas komparata kun la >biblio de filozofio<, t.e. „Metafiziko” de Aristotelo. Verkante ĉefe en la pola kaj germana lingvoj li publikigis sume 224 verkojn, el inter kiuj multaj estis tradukitaj en pliajn lingvojn. Li prezentis ĉirkaŭ 300 prelegojn en la lando kaj eksterlande kaj liaj filozofiaj verkoj plenigas 13 volumojn. Roman Ingarden naskiĝis la 5-an de februaro 1893 en Krakovo en riĉa burĝa familio. En la gimnazia periodo lia plej granda pasio estis literaturo (li mem praktikis poezion), muziko (li diplomitiĝis en la klaso de violonludo  en la Konservatorio de la Pola Muzika Societo en Lvovo) kaj sporto. Elreviĝinta pri la metodoj de literatura kritiko, plena de scivola pasio li proksimiĝis al filozofio kredante, ke ĝi helpos al li ellabori la metodologion de laboro kun literatura teksto kaj kontentigos liajn teoriajn demandojn. Fininte gimnazion en 1911 li komencis filozofiajn studojn sub la gvido de la kreinto de la lvova-varsovia filozofia skolo Kazimierz Twardowski. Jaron poste li forveturis al Getingo, kie li daŭrigis filozofiajn studojn ĉe Edmund Husserl, matematikon ĉe David Hilbert kaj psikologion ĉe Georg Elias Müller. Dum la studoj Roman Ingarden vehiklis el Getingo al Vieno, el Vieno al Lvovo, fine al la germana Friburgo, kie li defendis sian doktorigan disertacion verkitan sun la gvido de la patro de la fenomenologio Husserl. Ingarden jam dum la studoj partoprenis en vigla intekta vivo kaj filozofiaj disputoj pri fenomenologio. Dum tiu periodo li konatiĝis kun multaj disĉiploj de Husserl, i.a. Edyta Stein, kun kiu ligis lin plurjara intelekta amikeco. Cetere ankaŭ dum jaroj li tenis kontaktojn kun Husserl mem. Post la doktoriĝo Roman Ingarden revenis al Pollando komence laborante kiel gimnazia instruisto de filozofio, matematiko kaj la germana lingvo. En tiu periodo li ne rezignis pri siaj sciencaj esploroj, kio fruktis per la origine germanlingva verko „Pri literatura verko – esploroj el la limejo de ontologio, lingvoteorio kaj filozofio de literaturo”.  Fariĝinte en 1933 eksterordinara profesoro Ingarden povis rezigni pri la rolo de gimnazia instruisto, sed verdire li estis soleca en la pola medio, en kiu fenomenologio komencis nur dank’ al li rampi.  En 1937 aperas lia laŭvica verko „Pri rekono de literatura verko”, en kiu Ingarden evoluigis siajn pli fruajn  interesiĝojn pri la esplorado de literaturo. En ĝi li priskribis teorion de strukturo de estetika travivaĵo. Iom post iom en sia rezonado li  direktiĝis al ontologia problemaro. Interesis lin tempo, disputo pri realismo kaj idealismo, kritiko de fenomenologio. Siajn ideojn Ingarden entenigis en sia ĉefverko, >opus magnum< – „Disputo pri la ekzisto de la mondo”. Al ĉi tiu verko li dediĉis la jarojn de la 2-a mondimilto en plimulto pasigitajn en Lvoovo, kie komence li laboris en la Katedro de la Germana Filologio. En tiu periodo li laboris en la strukturoj de la konsipra universitato, ĉar liaopinie la didaktika laboro estas emfazo de patriotismo. Kiel li skribis „Laboroj (pri „Disputo pri la ekzisto de la mondo”) ebligis al mi spiritan transdaŭron en la tempo eble plej malfacila. Kaj ĝia kreiĝo en tiuj kondiĉoj povas servi kiel unu el la pruvoj, ke la pola rezistospirito viglis ankaŭ en la sfero de la sciencaj laboroj”. Post la milito Ingarden entreprenis laboron en la krakova universitato, kies ordinara profesoro li estis nomumita, kaj en kiu li estris la 2-an Katedron de Filozofio. Tiuperiode li gvidis viglan didaktikan, akademian, esploran laboron partopreninte multajn eksterlandajn konferencojn. Tamen en 1950 la komunistaj aŭtoritatoj agnoskis liajn sciencajn atingaĵojn kiel malkongruajn kun validaj tiam ideologiaj prioritatoj kaj forigis lin de la posteno. En tiu perioso li tradukis en la polan „Kritikon de pura racio” de Immnuel  Kant kaj finverkis la trian volumon de sia „Disputo pri la ekzisto de la mondo”. En 1956 li revenis al la universitato, i.a. kiel estro de la Filozofia Katedro, kie li laboris ĝis sia emeritiĝo en 1963. Tio estis  periodo de la plej granda didaktika aktiviĝo de Roman Ingarden, en kiu li lekciis en lando kaj en Usono, en kiu li partoprenis plurajn filozofiajn kongresojn, en kiu li prelegis en la polaj kaj eksterlandaj sciencaj societoj. Ekde 1958 li estis membro de la Pola Scienakademio. Unu jaron pli frue oni komencis vastskalan eldonadon de liaj filozofiaj verkoj. Post la emeritiĝo Roman Ingarden ne ĉeseis sciencan laboron – jen kel lekcianto en la universitato en Oslo, jen kiel membro de la Estetika Sekcio de la Pola Filozofia Societo. Ĉiuj ĉi laborojn ĉesigis lia neatendita morto pro apopleksio  la 14-an de junio 1970 post la montara ekskurso farita unu tagon pli frue. En la memoro de la posteuloj Roman Ingarden restis kaj restas kiel persono, kiu dediĉis sin al filozofio en maniero profunda, honesta, krea kaj firma.

El la elsendo 03.01.2020. Legas Barbara – 8′

--------------------------------------------------------------------------------

Koninda Pollando: Kvar novaj urboj de Pollando
[2020-01-03]
https://pola-retradio.org/2020/01/koninda-pollando-kvar-novaj-urboj-de-pollando/

La unuan de januaro 2020 la listo de la polaj urboj grandiĝis je  kvar pliaj. Nun do Pollando entute havas 944 urbojn. Kvar novaj–malnovaj, oni ŝatus diri, ĉar ĉiuj verdire reakiris la urbostatuson, perditan pro la caraj (rusaj) reprezalioj post la januara insurekcio 1863. Ni dediĉu kelkan atenton al ili, kvankam ne pri ĉiuj informoj estas same abundaj. La unua el inter ili Czerwińsk apud Vistulo troviĝas en la centra Pollando, en la regiono Mazovio. Dum jarcentoj ĝia historio estis ligita kun la historio de la tiea klostro, kreiĝinta en la 12-a jarcento. La unua dokumento mencianta la urbon devenas el 1155. Tio estas buleo de papo Hadriano la 4-a rilatanta al la tiea klostro de kanonikoj vivantaj laŭ la aŭgustena regulo. Czwerwińsk disfloris ne sole pro ilia agado. Situante ĉe Vistulo ĝi estis grava grentransporta haveno ĉe la komerca itinero  inter Pomerio en la nordo kaj Mazovio en la centra Pollando. Czerwińsk rolis krome kiel grava defendopunkto dum la invadoj i.a. de prusoj kaj litovoj. En 1410 proksime de Czerwińsk la polaj trupoj de la pola reĝo Jagielo unuiĝis kun litovaj por komune lanĉi Vistulon kaj batalfrapi la ŝtaton de la teŭtonaj kavaliroj. Sed Czerwiński, kiu duetape estis ricevinta la urborajtojn gravis krome kiel administra centro: tie kunsidis reprezentantoj de la mazovia nobelaro, tie estis eldonita kodo de la mazoviaj principoj. En 1526 Czerwińsk eniris la konsiston de la Pola Reĝolando. Sed la abatejo iom post iom perdis sian signifon malgraŭ la miraklofara Dipatrino de Czerwińsk loganta multajn pilgrimantojn. La urbo ne plu kapablis cetere bone uzi avantaĝojn de la grentransportado laŭ Vistulo, multiĝis incendioj kaj inundoj. Post la sveda atako (difinata kiel la sveda inundo) en la urbo kun 500 domoj restis nur la duono. Fine de la 18-a estis tie sole 40 kaj loĝantaro ne superis 300 personojn.  Post la 18-jarcentaj dispartigoj Czerwińsk troviĝis en la prusa aneksoparto, sekve eniris la konsiston de la Varsovia Princilando kaj Pola Reĝolando dependa de Rusio. Fine laŭ la cara decido en 1870 la urbo oficiale estis senigita je la urborajtoj. Samjare je la urborajtoj estis senigita Klimontów en la sanktakruca vojevodio. Kiel vilaĝo ĝi kreiĝis meze de la 13-a jarcento. En 1604-a establis ĝin kiel urbon  – baze de la reĝa privilegio – magnato kaj politikisto Jan Zbigniew Ossoliński. Baldaŭ la urbo ricevis la komercoprivilegiojn semajnan kaj jarajn. Kreiĝis en ĝi la dominikana klostro, poste kolegiato. La loka loĝantaro okupiĝis pri la agrikulturo kaj pri la produktado de drapo. En la 18-a jarcento kreiĝis eĉ la drapfara manufakturo. Dum la novembra kontraŭcara insurekcio (1830) aktivis en Klimontów bataliono de la 12 Infanteria Regimento. Piątek (en la lodza vojevodio, en kiu troviĝas nun geometria centro de Pollando) la urborajtojn havis dum 530 jaroj,  inter la 1339-a kaj la 1869-a. Komence ĝi estis komerca setlejo. Jam kiel urbo ĝi transformiĝis en fortan metiistan-komercan centron. Meze de la 17-a jarcento ĝi famiĝis pro la bierproduktado. Pli frue ĝi estis ankaŭ religia centro, kiel urbo subalterna al la arkiepiskopo de Gniezno. La urboevoluon bremsis la sveda invado, kvankam la definivan frapon kaŭzis incendio, kiu konsumis preskaŭ la tutan urbon. La urborajtojn Piątek perdis pro la partopreno de siaj loĝantaj en la januara insurekcio. Lututów – ankaŭ en la lodza vojevodio – dufoje estis akiranta la urborajtojn. En 1406 (senigita je ili antaŭ 1714) kaj en 1843. La 15-an de junio 1863 dum la Januara Insurekcio okazis en ĝia proksimeco la batalo de ĉirkaŭ 250-inurgenta trupo en plimulto armita per herbofalĉiloj, kontraŭ kiuj atakis 1630 rusaj soldatoj. La trihora batalo transformiĝis en masakron de la grupeto de polaj inurgentoj, dum kiu elmurditaj estis ankaŭ ostaĝoj. Verŝajne baldaŭ ĉi tiuj kvar urboj, dum la lastaj 150 jaroj senigitaj je la urborajtoj kompletigos en la publikaj paĝoj informojn pri sia evoluo kaj disfloro, kio kondukis al la reakiro de ilia urbostatuso. Tiam ankaŭ ni volonte konigos tiujn informojn al niaj aŭskultantoj.

El la elsendo 03.01.2020. Legas Barbara – 6’14”

--------------------------------------------------------------------------------

Pentrista frandaĵo en Wawel-kastelo en Krakovo
[2020-01-03]
https://pola-retradio.org/2020/01/pentrista-frandajo-en-wawel-kastelo-en-krakovo/

La 15-jarcenta tolaĵo „Madono en la protektomantelo” aŭ „Mizerikorda Madono”,  unu el la plej gravaj en la kreado de la itala pentristo Giovanni da Gaeta estas admirebla en la Reĝa Kastelo sur la krakova Wawel-altaĵo ĝis la mezo de februaro 2020. Ĝi estis pentrita en 1448 kaj estas la unua el inter kvar datitaj verkoj de da Gaeta. Ĝi devenas el preĝejo el la itala Ardara sur Sardio. Por la krakova kolekto ĝi estis aĉetita en 1938 de la viena atikvaĵiisto Szymon Szwarc. Ĝis la lastaj restaŭristaj laboroj la tolaĵo ne estis konservata en kompleksa maniero kaj ĝia stato ne estis la plej bona. La nun finiĝintaj  intensaj kaj ĉiuflankaj renovigaj laboroj daŭrintaj du jarojn redonis plenan brilon al la bildo. Bedaŭrinde ne estas konataj la cirkonstancoj, en kiuj ĝi kreiĝis, malmulto konata estas pri Giovanni da Gaeta, kies kreado  estas rekonstruata baze de la tolaĵoj, kiujn oni al li atribuas. La troviĝanta en Wawel-Kolekto Miserikorda Madono estas pentraĵo unika, ĉar la pentristo neniam ripetis ĉi-specan prezenton, kvankam ofte li estis ripetanta diversajn temojn.

El la elsendo 03.01.2020. Legas  Maciek – 01’25”

--------------------------------------------------------------------------------

E_elsendo el la 03.01.2020
[2020-01-03]
https://pola-retradio.org/2020/01/e_elsendo-el-la-03-01-2020/

Podkasto: Ludu en nova fenestro | Elŝutu

La 925-a E_elsendo el la 03.01.2020 ĉe www.pola-retradio.org

En la unua varsovia E-elsendo el Varsovio tutkorajn Novjarajn Bondezirojn sendas al ĉiuj geaŭskultantoj kaj radioamikoj la tuta skipo de nia programo! Ĉiuspecan Prosperon, Sanon, Feliĉon kaj Sukcesojn !!! Krome ni proponas komence aŭskulti informojn pri la Paradoj de la Tri Reĝoj, kiuj la plej proksiman lundon okaze de Epifanio moviĝos tra 900 urboj de Pollando kaj eksterlande. Pri interesa tolaĵo de iom forgesita itala pentristo prezentata en Wawel-kastelo en Krakovo. Nia felietono pri koninda Pollando estas dediĉita al kvar novaj urboj, kiuj aldoniĝis jarkomence. Verdire temas pri kvar urboj, kiuj reakiris tiun ĉi statuson post 150-jara periodo. En la E-komunuma segmento ni donas la atenton al la 7-a Afrika kongreso de UEA kaj ĝia rezolucio. Fine ni proponas mallongan leterkestan renkontiĝon. Muzike akompanas nin Anna Osmakowicz en la pola kristnaska kanto pri la Tri Reĝoj. Ni krome prezentas la plej novan kanton-bosanovon de Lorenzo Tomezzoli kaj Gilbert Drigon „Mirinda Flor’” en la plenumo de Mélanie Prin – https://www.youtube.com/watch?v=LsL16tAuyyc&feature=youtu.be . La apudanta nian programinformon foto referencas al la eventoj de Epifanio, Parado de la Tri Reĝoj en polaj urboj kaj eksterlande. Tradicie ni disponigas eksterelsende paralele legeblajn kaj aŭdeblajn tekstojn el la hodiaŭa elsendo en unuopaj rubrikoj de nia paĝo, hodiaŭ t.e. estas „kulturkronikaj informoj” kaj “felietonoj”. Uzu tiun ĉi servon mem kaj rekomendu al aliaj, kiel efikan manieron altigi la aŭdokomprenon kaj parolkapablon. La elsendo estas aŭdebla ankaŭ en jutubo ĉe la kanalo Espero2009: https://www.youtube.com/results?q=pola+retradio&sp=CAI%253D . I.a. pere de ĝi vi povas rapidigi aŭ malrapidigi la elsendosonon konforme al viaj bezonoj.

--------------------------------------------------------------------------------

La ruĝa vino kaj varieco de la intesta mikrobioto
[2020-01-07]
https://pola-retradio.org/2020/01/la-ruga-vino-kaj-varieco-de-la-intesta-mikrobioto/

La novaj esploroj de sciencistoj el Kings College en Londono sugestas, ke personoj trinkantaj modere povas havi pli varian intestan mikrobioton ol abstinenculoj. Ili esploris la influon de biero, cidro, ruĝa kaj blanka vinoj je la intesta mikrobioto ĉe preskaŭ tri mil personoj drinkantaj el Usono, Britio kaj Nederlando. En la lastaj jaroj multaj esploroj elmontris ligitecon de la intesta mikrobioto kun la fizika kaj psika sano kaj ankaŭ kun efikeco de kelkiuj medikamentoj. Evidentiĝis, ke personoj drinkantaj ruĝan vinon havis pli varian intestan mikrobioton konsidrante ankaŭ aliajn faktorojn, kiel aĝon, pezon, regulan dieton kaj socian statuson. Kvankam delonge estas sciate pri favora efikado de ruĝa vivo je koro la esploroj konfirmis krome, ke modera vindrinkado altigas la variecon de bakteria mikrobioto, per kio eblas klarigi ĝian sanfavoran influon. Influas tion  i.a. polifenoloj ĝenerale troviĝantaj en la ruĝa vino. Krome ĉe vindrinkantoj estis konstatita malpli alta nivelo de la t.n. malbona kolesterolo kaj malpli granda obezeco.

El la elsendo 07.01.2020. Legas Maciek – 1’13”

--------------------------------------------------------------------------------

E_elsendo el la 07.01.2020
[2020-01-07]
https://pola-retradio.org/2020/01/e_elsendo-el-la-07-01-2020/

Podkasto: Ludu en nova fenestro | Elŝutu

La 926-a E_elsendo el la 07.01.2019 ĉe www.pola-retradio.org

En nia marda elsendo ni proponas literaturan segmenton, en kiu aŭdiĝas la 89-a fragmento de la romano „Quo Vadis” de Henryk Sienkiewicz en la E-traduko de Lidia Zamenhof. La komencaj aktualaĵoj rilatas al la marda kunsido de la Kabineta Konsilio kunvokita de la pola prezidento, al la decido de israelaj aŭtoritatoj plukonstrui domojn sur la palestinaj teritorioj. Nia sciencbultena temo traktas variecon de la intesta mikrobioto sub la influo de ruĝa vino. La akompana al la programinformo interreta foto rilatas al ĉi tiu temo. Muzike akompanas nin Duo Espera per la fragmento de la kanzono „Jen nia mondo”. Hodiaŭ vi denove trovas la paralele legeblajn kaj aŭdeblajn tekstojn el nia elsendo, kiuj troviĝas en la unuopaj rubrikoj de nia paĝo, hodiaŭ t.e. estas „novaĵoj” kaj „sciencaj informoj”. Ili faciligas efike altigi la aŭdokomprenon kaj parolkapablon. Uzu do ilin mem kaj rekomendu al aliaj. Nia elsendo estas aŭdebla ankaŭ en jutubo ĉe la kanalo Espero2009: https://www.youtube.com/results?q=pola+retradio&sp=CAI%253D

--------------------------------------------------------------------------------

Kroma subvencio por kulturo de polaj tataroj
[2020-01-10]
https://pola-retradio.org/2020/01/kroma-subvencio-por-kulturo-de-polaj-tataroj/

En la nuna jaro pli ol 270-milzlotan subvencion por projktoj flegantaj kulturon kaj tradiciojn de la tatara socio ricevos Muzulmana Religia Asocio en Pola Respubliko, Asocio de Tataroj de Pola Respubliko, la Fondaĵo Tatara Kultura Societo kaj religia muzulmana komunumo en Bjalistoko. La rimedoj helpos realigi ĉirkaŭ dudek projektojn ligitajn kun la eldonagado kaj festenoj flegantaj la tatarajn kutimojn. Tataroj, kies historio sur la teritorio de la iama Respubliko havas 600 jarojn,  konsisitigas unu el la plej malgrandaj etnaj grupoj en Pollando. En la lasta popolregistrado la tataran devenon dekaris ĉirkaŭ du mil personoj. Nun en plimulto ili loĝas en la Podlaĥia Vojevodio. En la lokoj Kruszyniany kaj en Bohoniki konserviĝis iliaj lastaj sur la polaj teritorioj lignaj moskeoj kaj muzulmanaj tombejoj.

El la elsendo 10.01.2020. Legas  Milada – 01’16”

--------------------------------------------------------------------------------

La Reĝa Łazienki-parko en nova brilo
[2020-01-10]
https://pola-retradio.org/2020/01/la-rega-lazienki-parko-en-nova-brilo/

La Reĝa Łazienki-parko apartenas al la ŝatataj vizitlokoj de la varsovianoj kaj turistoj. Jam printempe la publiko konatiĝos kun la rezultoj de la konservistaj-renovigaj laboroj, en kies daŭro la brilon reakiris du historiaj objektoj situantaj ĉe la Reĝa  Promenejo – Blanka Vilao kaj Akvoreceptaklo. Ekde nun en ili estos prezentataj muzeaj ekspozicioj. Revivigitaj estis ankaŭ la ĉirkaŭanta ilin historia ĝardeno kaj restaĵoj de la Novgotika Oranĝerio. La Blanka Vilao apartenas al la unikaj polaj 18-jarcentaj objektoj de rezideja arkitekturo kun konserviĝintaj preskaŭ plene internaj dekoraĵoj kaj parto de la ekipaĵaro. Origine planita kiel somera domo por la reĝo Stanislao Agusto Poniatowski ĝi rolis kiel rezidejo de la reĝaj gastoj. Dank’ al la konservistaj laboroj al la publiko post multaj jaroj malfermiĝos Akvoreceptaklo. Temas pri brika rotondo alikonstruita en la 19-a jarcento laŭ la modelo de la tombo de Caecilia Metella ĉe la roma Via Appia. Iam dank’ al ĝiaj akvoprovizoj funkciis la najbaraj konstruaĵoj kaj fontanoj. Nun estis revenigita ĝia historia interno kun restaĵoj bildigantaj la originajn  funkciojn. Fine, la laboroj en la historia ĝardeno redonis ĝian historian formon laŭ dokumentoj kaj ikonografio. La tieaj elementoj de malgranda ĝardena arkitekturo baziĝas ĉefe je akvarelaĵoj de Zygmunt Vogl el la 1786-a jaro.

El la elsendo 10.01.2020. Legas  Maciek – 01’41”

--------------------------------------------------------------------------------

E_elsendo el la 10.01.2020
[2020-01-12]
https://pola-retradio.org/2020/01/e_elsendo-el-la-10-01-2020/

Podkasto: Ludu en nova fenestro | Elŝutu

La 927-a E_elsendo el la 10.01.2020 ĉe www.pola-retradio.org

En nia hodiaŭa felietono pri Koninda Polo ni memorigas unu el la patronoj de la 2020-a, kiun en 2019 proklamis la pola Sejmo. Temas pri renoma, elstara pola filozofo, Roman Ingarden. Komence aŭdiĝas aktualaĵo pri la rezolucio de la Pola Sejmo koncerne mensogajn kaj kalumniajn asertojn de la plej superaj rusaj aŭtoritatoj. La kulturkronikaj informoj rilatas al revivigoj en la fama kaj multnombre vizitata varsovia Łazienki-parko, kaj al la nunjaraj subvencioj por la polaj tataroj. La E-komunumaj informoj koncernas la komunan polan-germanan E-Kongreson ( https://www.esperanto.de/eo/gek2020 ) kaj la 49-an E-Kongreseton por Infanoj kaj Adoleskuloj en Montrealo ( http://bertosch.free.fr/iik2020/ ). Muzike akompanas nin Kajto per la fragmento de sia „Trinkkanto” el la albumo „La Universala Arbo” distribuata de Vinilkosmo, kaj unu el la famaj MAZI-kantoj. La apudanta nian programinformon foto referencas al kulturkronika informo pri restarŭristaj laboroj en la varsovia Reĝa Łazienki-parko. Tradicie ni disponigas eksterelsende paralele legeblajn kaj aŭdeblajn tekstojn el la hodiaŭa elsendo en unuopaj rubrikoj de nia paĝo, hodiaŭ t.e. estas „kulturkronikaj informoj” kaj „felietono”. Uzu tiun ĉi servon mem kaj rekomendu al aliaj, kiel efikan manieron altigi la aŭdokomprenon kaj parolkapablon. La elsendo estas aŭdebla ankaŭ en jutubo ĉe la kanalo Espero2009: https://www.youtube.com/results?q=pola+retradio&sp=CAI%253D . I.a. pere de ĝi vi povas rapidigi aŭ malrapidigi la parolrapidecon konforme al viaj bezonoj.

--------------------------------------------------------------------------------

Kio gravas, krom lingvokono, por interkompreniĝi
[2020-01-15]
https://pola-retradio.org/2020/01/kio-gravas-krom-lingvokono-por-interkomprenigi/

Doktorino Celina Heliasz-Nowosielsa el la Fakultato pri Novfilologio de la Varsovia Universitato esploras la plurrimedan komunikadon, en kiu estas utiligataj ne sole vortoj sed ankaŭ gestoj, mimiko, intonacio kaj korposinteno. Evidentiĝas, ke la lingvokono ne sufiĉas por interkompreniĝi kun ĉiu. En sia laboro ŝi ekzamenas kiel homoj rakontas pri kazoj de komunikado, kiujn ili atestis  kaj kiom multe ili donas la  atenton al tio, kio okazas eksterparole. Sciencistoj volas konvinkiĝi ĉu ies eldiro  – aŭ inerrilatado inter kelkaj personoj – estas perceptata de observantoj kaj kiel tio, kion la ekzamenato agnoskis en sia rakonto pri la kazo kiel gravan dependas ekzemple de ies sekso, aĝo aŭ edukiteco. La komuna lingvo ne garantias, kiel evidentiĝas,  ke homo interkompreniĝos kun ĉiu alia, ĉar homoj diversmaniere uzas la vortojn kaj diversmaniere regas tion, kio kaŝiĝas ekster ili. La demando des pli interesa, ke En la socia skalo tiu ĉi temo estas ankoraŭ  malmulte esplorata.

El la elsendo 15.01.2020. Legas Barbara – 1’32”

--------------------------------------------------------------------------------

E_elsendo el la 15.01.2020
[2020-01-15]
https://pola-retradio.org/2020/01/e_elsendo-el-la-15-01-2020/

Podkasto: Ludu en nova fenestro | Elŝutu

La 928-a E_elsendo el la 15.01.2020 ĉe www.pola-retradio.org

En nia elsendo ni referencas al la novembra Malferma Tago en Roterdamo kaj al la tiama prelego de Orlando Raola pri Scienco en Esperanto. Ni prezentas ĝian unuan parton. La komencaj aktualaĵoj koncernas la pasintjarajn sukcesojn de la pola flugkompanio LOT, la polan markon ZELMER kaj ĝian novan posedanton, la protekton de moruo en la orienta parto de Baltiko. La sciencbultena temo traktas esplorojn de polaj sciencistoj pri la eksterparolaj elementoj de la homa komunikado. En la merkreda elsendo ni aŭdas fragmente la kanzonon de rusa poeto kaj kantisto Wladimir Wysocki „Adiaŭo al montoj”. La interreta foto rilatas al la informo pri limigo de la fiŝkaptado de moruo en la orienta Baltiko. Hodiaŭ tradicie eblas konsulti la paralele legeblajn kaj aŭdeblajn tekstojn el nia elsendo, kiuj troviĝas en la unuopaj rubrikoj de nia paĝo, hodiaŭ t.e. estas „novaĵoj” kaj „sciencaj informoj”. Ili faciligas efike altigi la aŭdokomprenon kaj parolkapablon. Uzu do ilin mem kaj rekomendu al aliaj. Nia elsendo estas aŭdebla ankaŭ en jutubo ĉe la kanalo Espero2009; ĝi ebligas laŭplaĉe reguligi la parolrapidecon: https://www.youtube.com/results?q=pola+retradio&sp=CAI%253D

--------------------------------------------------------------------------------

Karnavalo
[2020-01-17]
https://pola-retradio.org/2020/01/karnavalo/

Karnavalo verŝajne por ĉiuj signifas la periodon de amuziĝo, distro kaj senbrido. Laŭ iuj ĝi komenciĝas kune kun la Nova Jaro, laŭ aliaj ekde la Festo de la Tri Reĝoj, Epifanio. Ĝia fina dato ne elvokas tiomajn hezitojn. Nome ĝi ligiĝas kun la  moviĝanta en la kalendaro Pasko kaj la antaŭanta ĝin karesma periodo. Nunjare la karnavalo finiĝos la 25-an de februaro. Do, en 2020 la amuzo intensiĝos dum 7 semajnfinoj, kiuj povas signifi tempon de eĉ bruaj eventoj, amuziĝoj kaj baloj. La plej  konataj kaj samtempe la plej spektaklecaj estas la karnavaloj en Rio de Janeiro kaj en Venecio, sed atenton meritas ankaŭ karnavalo sur la Kanariaj Insuloj aŭ en Germanio.  La karnavalo originas en Italio.  La unua mencio pri ĝi troviĝas en la dokumento de Vitale Faliero el 1094, sed onidire ĝi estis konata jam en la mezo de la 10-a jarcento. Kelkaj elmontras la originon de la karnavalo en la antikvaj vintraj solenadoj omaĝe al la diino de fekundeco. En la mezepoko preskaŭ en la tuta Eŭropo la karnavalo estis solenata kun granda pompo, plej brue en Venecio kaj Romo. La nomo karnavalo deriviĝanta el latino aŭ la itala lingvo aludis al la baldaŭ komenciĝanta granda fasto, karesmo, em kiu oni draste limigis la viandokonsumadon. Temis do pri tio, ke antaŭ ĝi oni manĝu kaj frandu ĝissate. La esenco de la karnavala amuzo estis certigi al ĝiaj partoprenantoj plenan anonimecon. Servis por tio maskoj kaj kostumoj kaŝantaj diferencojn inter la partoprenantoj i.a. deriviĝantaj el diversaj sociaj klasoj. Karnavalo relative rapide hejmiĝis en Pollando, la unuaj mencioj devenas el la 17-a jarcento, kvankam la jarŝanĝaj kutimoj ekzistis pli frue kaj havis alian karakteron.   La bonvenigo de  la Nova Jaron kaj la silvestra nokto distingiĝadis per aŭguroj pri geedziĝoj, bonaj rikoltoj, venontjara vetero. La jarŝanĝon oni kutime festis en la kvietejo de la propraj domoj, bienoj, dum bankedoj kun punĉo, dum ĉasadoj. Ja la vintroj iam estis longaj, la vivo en la biendomoj kaj en la kamparo monotona.  Ne mirige, ke la novaj kutimoj ekplaĉis, eĉ se ricevis propajn trajtojn kaj emfazon. Al la plej popularaj karnavalaj amuzoj de la pola nobelaro kaj magnataro apartenis la gaja,  senbrida promena rapidrajdado tra neĝkovrita vojo per sledoj jungitaj de ĉevaloj, kiu povis daŭri eĉ kelkajn tagojn kun mallongaj paŭzoj por dormo. La veturilaro en la lumo de torĉoj kaj en la akompano de muziko kutime venadis vespere al la celita bieno. Tie oni – post la veturado en frosta aŭro varmigadis sin – satmanĝis, satdrinkis, senlace dancis, iom dormis por preskaŭ tuj poste celi la alian gastigonton. La gastigantoj zorgis pri digna bonvenigo, abunde provizitaj tabloj sur kiuj gravan lokon okupis bigoso (kuirita acida braskio kun variaj viandaĵoj), bakita viando de arbaraj bestoj, kolbasoj, vianda galanterio, pasteĉoj, fiŝoj en ĵeleo. Abundis variaj dolĉbakaĵoj – inter ili tortoj, mielkukoj, fruktoj en mielo. Oni tostis per vino, medo kaj biero.  Ankaŭ burĝoj kaj kamparanoj en karnavalo ofte organizadis buntajn amuziĝojn subĉiele, kelkfoje uzante maskojn por ĝuste gardi anonimecon. La alian karakteron havis  redutoj, maskobaloj organizataj laŭ la itala modo. La nepra akcesoraĵo estis masko, la vesto malpli gravis. Dum ili oni multe dancis, kartludis, ĝuis rafinitan bufedon, klaĉis. Redutoj logis la geamorantojn, por aliaj estis la okazo por sekretaj rendevuoj.  Dum iuj redutoj oni kvestis favore al mizeruloj. Pli pompaj baloj dum la karnavalo estis organizataj en riĉaj domoj de la aritokrataro. La baloj kaj la karnavalaj eventoj havis ja ankaŭ svatan karakteron, kio favoris brilajn balojn aŭ dancvesperojn en salonoj, teatroj, restoracioj. La balojn tradicie estis  inaŭguranta polonezo. La plej brue solenataj estis la lastaj tagoj de la karnavalo kaj la apogean komencon al la adiauo estis kaj estas donanta la Grasa Ĵaudo kaj finis mardo antaŭ la Cindra Merkredo. Dum la tuta semajno la dancado, manĝosenbrido kaj drinkemo estis senĉesa, ĉar tiel oni volis kontentigi ĉiajn karnajn plezurojn antaŭ la severa fastperiodo. Grasa menuo estis certigonta prosperon kaj fortunon sendepende ĉu temis pri la ĉefpladoj aŭ pri la dolaĉaĵoj. Iam la organizo de karnavalaj amuzoj kaj bankedoj postulis longajn preparojn. Nun multaj el la iamaj kutimoj forgesiĝis.  Tamen en la periodo inter la du mondmilitoj la karnavalaj kutimoj konforme al la financaj ebloj de la organizantoj daŭris.  Post la 2-a mondmilito oni ne forgesis pri la novjara amuzo, sed plej pompe ĝi estis organizata en la partiaj medioj,  kulturdomoj. Ankaŭ unuopaj laborentreprenoj organizis la karnavalan amuzon por siaj laborantoj.  Oni zorgis pri festa menuo servante viandaĵojn, ĵeleojn, barĉon, bigoson. Firmiĝis la tradicio  de la porinfanaj baloj de alivestitoj dum kiuj ili estis pridonacataj per pakaĵoj kun variaj frandaĵoj. Nun la Silvestran Nokton, Novan Jaron kaj Karnavalon oni ne plu solenas same brue kiel iam. Ŝanĝiĝas pladoj kaj iliaj kvantoj. La tradician polan menuon variigas manĝaĵoj el aliaj aliaj landoj kaj el aliaj mondopartoj. La lisito de drinkaĵoj ankaŭ internaciiĝis. Sed kiel ĉiam plej gravas bona kompanio, bona muziko, amikeca etoso.

El la elsendo 17.01.2020. Legas Barbara – 7’50”

--------------------------------------------------------------------------------

Pliaj memoraĵoj pri Wiesław Kazanecki en la Podlaĥia Librokolekto
[2020-01-17]
https://pola-retradio.org/2020/01/pliaj-memorajoj-pri-wieslaw-kazanecki-en-la-podlahia-librokolekto/

Pliaj memoraĵoj ligitaj kun Wiesław Kazanecki riĉigis la kolektojn de la Podlaĥia Libraro en Bjalistoko. Temas pri familiaj fotoj, privataj korespondaĵoj, tajpaĵoj kaj eĉ tajpmaŝino, kiujn transdonis lia edzino, Halina. Wiesław  Kazanecki (1939-1989) poeto, prozisto kaj publicisto naskiĝis kaj kreis en Bjalistoko. De preskaŭ 30 jaroj en Bjalistoko estas atribuata premio kun lia nomo. Al vera sukceso en lia kreado estas kalkulata volumeto „Portreto kun atako” (1969) taksata de kritikistoj kiel „atesto de luktado de la nuntempa poeto kun vorema realo, kiu delonge perdis etikan dimension”. Postmorte aperis i.a. la volumetoj de liaj verkoj „Elektitaj poeziaĵoj”, „Letero por la arĝenta  nupto” – t.e. por la 25-jariĝo de la geedziĝo kaj „La lastaj versaĵoj”. En 2017 la Podlaĥia Libraro aprigis en Esperanto, laŭ iniciato de la Bjalistoka E-Societo, liajn elektitajn poeziaĵojn kaj prozaĵojn, „Mi venis por diri al vi ĉiujn ĉi vortojn”.

El la elsendo 17.01.2020. Legas  Maciek – 01’18”

--------------------------------------------------------------------------------

Splendoro kaj rafiniteco. Spirito kaj materio en la arto de Koreio
[2020-01-17]
https://pola-retradio.org/2020/01/splendoro-kaj-rafiniteco-spirito-kaj-materio-en-la-arto-de-koreio/

Dum tri monatoj, ĝis la mezo de januaro en la varsovia Nacia Muzeo daŭris ekspozicio de la korea arto, titolita „Splendoro kaj rafiniteco. Spirito kaj materio en la arto de Koreio”. Temis pri la plej granda prezento de la korea arto en Pollando, omaĝanta la 30-jariĝon de la diplomatiaj rilatoj inter ambaŭ landoj. Ĝi respondis ankaŭ al la pola ekspozicio organizita en Seulo antaŭ kvin jaroj „La pola arto: la nevenkebla spirito”. La varsovia ekspozicio prezentis al la pola publiko artobjektojn el diversaj epokoj – de la prahistoriaj ĝis la fino de la regado de la dinastio Joseon en 1987. La tuta ekspozicia materialo estis grupigita je kvin periodoj kaj estis dediĉita al: „de prahistorio ĝis la periodo Samhan, al la periodo de Tri Reĝolandoj, al la kulturo de la unuiĝinta Silli, la unua reĝolando reganta sur la tuta korea duoninsulo, al la arto de la dinastio Goryeo, de kiu devenas la nuna nomo de la lando. La kvina periodo estis dediĉita al la 500-jara historio kaj kulturo de la dinastio Joseon. Ĉiuj eksponaĵoj devenis el la Korea Nacia Muzeo en Seulo.

El la elsendo 17.01.2020. Legas  Gabi – 01’32”

--------------------------------------------------------------------------------

E_elsendo el la 17.01.2020
[2020-01-17]
https://pola-retradio.org/2020/01/e_elsendo-el-la-17-01-2020/

Podkasto: Ludu en nova fenestro | Elŝutu

La 929-a E_elsendo el la 17.01.2020 ĉe www.pola-retradio.org

Nia hodiaŭa felietono pri Koninda Pollando estas dediĉita al karnavala periodo en Pollando, grandparte retrorigarde. La komencaj kulturkronikaj informoj koncernas grandan ekspozicion pri la korea arto, kiu meze de januaro finiĝis en Varsovio kaj pliajn memoraĵojn pri bjalistoka poeto Wiesław Kazanecki, kiuj riĉigis la Podlaĥian Libraron. La E-komunumaj informoj rilatas al la decido de la aŭtoritatoj de Braziljo, kiu ekde 2020 en la listo de siaj eventoj la 26-an de julio solenos kiel Tagon de Esperanto; kaj al la kunlaboro inter Litova E-Asocio kun la novaĵagentejo Mano kraštas. Dank’ al ĝi la agentejo prezentas i.a. E-kurson, kiun gvidas Grazina OPULSKIENE. Krome ni informas pri la kunlaboro de Asocio Jura Brüschweiler kun Svisa E-Societo por aperigi nunjare libron pri Hector Hodler en lia 100-a mortodatreveno. Muzike akompanas nin bjalistokaj gejunuloj per la kanzono „Se sento scii povus” el la KD Bjalistokaj Prezentaĵoj. Asorti kantas pri „Verda hejmo Esperanto”. La apudanta nian programinformon foto referencas al la daŭranta karnavala periodo. Tradicie ni disponigas eksterelsende paralele legeblajn kaj aŭdeblajn tekstojn el la hodiaŭa elsendo en unuopaj rubrikoj de nia paĝo. Hodiaŭ t.e. estas „kulturkronikaj informoj” kaj „felietono”. Uzu tiun ĉi servon mem kaj rekomendu al aliaj, kiel efikan manieron altigi la aŭdokomprenon kaj parolkapablon. La elsendo estas aŭdebla ankaŭ en jutubo ĉe la kanalo Espero2009: https://www.youtube.com/results?q=pola+retradio&sp=CAI%253D . I.a. pere de ĝi vi povas rapidigi aŭ malrapidigi la parolrapidecon konforme al viaj bezonoj.

--------------------------------------------------------------------------------

Preskaŭ la duono de la eŭropaj arbospecioj minacita
[2020-01-21]
https://pola-retradio.org/2020/01/preskau-la-duono-de-la-europaj-arbospecioj-minacita/

Preskaŭ duono de la eŭropaj arbospecioj (42 procentoj) estas minacitaj de malapero. Pri tio avertis Internacia Unio de Naturprotekto (IUCN) en sia Ruĝa Libro de la eŭropaj arboj. Ĉefloke troviĝas eskulo kaj  aŭkupario. La Unio havanta sian sidejon en Gland, Svislando la unuan fojon publikigis liston de la endanĝerigitaj eŭropaj arbopecioj.  Laŭ la direktoro de la Dendrologia Instituto de la Pola Sciencakademio, d-ro Andrzej Jagodzińki tiu situacio povas  influi tutajn eŭropajn ekosistemojn.  Inter la kaŭzoj de ĉi tiu aferstato la Ruĝa Libro mencias rapidan plukonstruiĝon de urbaj aglomerejoj, erarojn ligitajn  kun la arboforhakado, arbarajn incendiojn, sanĝojn en la eŭropa ekosistemo  kaj klimatajn ŝanĝojn. Laŭ la aŭtoroj de la raporto signifagrade minacitaj estas eŭropaj specioj de arbustoj, muskoj kaj likenoj.

El la elsendo 21.01.2020. Legas Maciek – 1’05”

--------------------------------------------------------------------------------

Kontakto kun arto influas la vivodaŭron
[2020-01-21]
https://pola-retradio.org/2020/01/kontakto-kun-arto-influas-la-vivodauron/

Kuracado pere de arto ne estas ideo nova, sed plej ofte oni parolas pri ĝi en la kunteksto de la psika sano. La plej novaj esploroj de sciencistoj el University College London elmontras, ke eĉ sporada kontakto kun arto kelkfoje dum la jaro malaltigas riskon de tro frua morto je 14 procentoj. La esploroj rilatis al personoj pli ol 50-jaraĝaj. Laŭ sciencistoj kontakto kun arto estas unu el la faktoroj – krom sociaj ligoj – povantaj esence influi la plibonigon de la bonfarto kaj fizika sano. Al personoj, kiuj en plej signifa grado povas profiti pro la terapiaj valoroj de la arto apartenas tiuj, kiuj ne inklinas partopreni la kulturan vivon. Temas pri personoj i.a. solecaj aŭ suferantaj deprimon. La britaj esploroj sugestas krome, ke hobioj ligitaj kun la arto, kiel pentrado, desegnado, kolorigado, lernado de ludo per muzikaj instrumentoj ankaŭ povas pozitive influi la homan sanstaton. Senepende de individuaj kapabloj la krea, arta aktiveco helpas kontraŭbatali streson, rolas kiel specifa meditado kaj ebligas distanciĝi disde premrezonadoj ligitaj kun la aferoj de la ĉiutaga vivo.

El la elsendo 21.01.2020. Legas Gabi – 1’26”

--------------------------------------------------------------------------------

E_elsendo el la 21.01.2020
[2020-01-21]
https://pola-retradio.org/2020/01/e_elsendo-el-la-21-01-2020/

Podkasto: Ludu en nova fenestro | Elŝutu

La 930-a E_elsendo el la 21.01.2019 ĉe www.pola-retradio.org

En nia hodiaŭa elsendo ni  referencas al la novembra Malferma Tago en Roterdamo kaj al la tiama prelego de Orlando Raola pri Scienco en Esperanto. Konforme al la anonco ni prezentas ĝian duan kaj lastan samtempan parton. La komencaj aktualaĵoj rilatas al la vizito de la pola ĉefministro en Japanio kaj al la komenciĝanta hodiaŭ en Davos Internacia Ekonomia Forumo. La sciencbultenaj temoj traktas la minacitajn eŭropajn arbospeciojn kaj tion, ke kontakto kun la arto influas la vivodaŭron. En la merkreda elsendo ni aŭdas fragmente la kanzon „Ni Ĉiuj Ni” el la KD „Rebela sono” produktita de Vinilkosmo. La interreta foto pri vizito en muzeo estas ilustraĵo al la scienca temo pri sanfavora kontakto kun la arto. Ni memorigas, ke kiel kutime eblas konsulti la paralele legeblajn kaj aŭdeblajn tekstojn el nia elsendo. Ili troviĝas en la unuopaj rubrikoj de nia paĝo, hodiaŭ t.e. estas „novaĵoj” kaj „sciencaj informoj”. Dank’ al ĉi tiu nia servo eblas efike altigi la aŭdokomprenon kaj parolkapablon. Uzu do ĝin mem kaj rekomendu al aliaj. Nia elsendo estas aŭdebla ankaŭ en jutubo ĉe la kanalo Espero2009; ĝi ebligas laŭplaĉe reguligi la parolrapidecon: https://www.youtube.com/results?q=pola+retradio&sp=CAI%253D

--------------------------------------------------------------------------------

Pola dezajno en la kanada Toronto
[2020-01-24]
https://pola-retradio.org/2020/01/pola-dezajno-en-la-kanada-toronto/

Ĝis la 16-a de februaro 2020 en la kanada Toronto estas rigardebla ekspozicio dediĉita al la pola dezajno kadre de la festivalo „DesignTO 2020”. Kronologie ĝi proksimigas tion, kiel en la 100-jara historio de la pola dezajno iuj materialoj, temoj kaj formoj revenas alprenante novan vizaĝon. Organizita kadre de la solenadoj de la 100-jariĝo de la regajnita suvereneco de Pollando ĝi ligas pasintecon kun la nuntempo proksimigante la atingaĵojn de la pola dezajno tra la atingaĵoj de la nuntempa pola grafiko. 25 polaj ilustristoj de juna kaj meza generacioj kaj freŝbakitaj diplomitoj interpretis 100 verkojn de la polaj projektintoj. Krom mebloj, vitraĵoj aŭ porcelanaĵoj – kutime vekantaj asociaciojn kun dezajno – estas prezentitaj literfasonoj, markosimboloj, infanaj ludiloj, lumreklamiloj, glisilo, skotero, pola dolĉaĵo „Ptasie Mleczko” [birda lakto], pola sporta ludo Ringo. La ekspozicio prezentante 100 plastikajn interpretojn de 100 objektoj proksimigas samtempe 100 diversajn historiojn ligitajn kun konkretaj projektoj. Ĝi reliefigas kiel kreiĝas ideoj kaj kiel eksterordinara estas dezajno, la artbranĉo kiu nin  ĉirkaŭas en la ĉiutaga vivo.

El la elsendo 24.01.2020. Legas  Gabi – 01’34”

--------------------------------------------------------------------------------

Koninda pola arkitekto:  Henryk Marconi
[2020-01-24]
https://pola-retradio.org/2020/01/koninda-pola-arkitekto-henryk-marconi/

La ĉefheroo de nia hodiaŭa felietono estas Henryk Marconi, unu el la plej elstaraj arkitektoj sur la polaj teritorioj en la 19-a jarcento. Li aŭtoris plurajn reprezentajn konstruaĵojn  en la novrenesanca, klasikisma kaj novgotika stiloj en diversaj polaj urboj. Plimulto troviĝas en Varsovio. Temas i.a. pri la Hoteloj Europejski kaj Bristol, pri palacoj de Branicki-familio kaj de Andrzej Zamoyski, pri preĝejoj de Ĉiuj Sanktuloj, de s-ta Karolo Boromeo, de s-ta Anna en la varsovia Wilanów. Li prilaboris krome la projekton de la unua varsovia akvodukto, kiu komencis funkcii en 1855. Entute li aŭtoras pli ol 40 arkitekturajn projektojn. Tiuj malpli grandaj aŭ tiuj, kiujn li administris aŭ korektis estis pli ol 50. Malgraŭ la militdetruoj – la du mondmilitoj – daŭre eblas admiri en Pollando konstruaĵojn kreiĝintajn laŭ lia projekto, detale kaj zorgeme rekonstruitajn post la 2-a mondmilito. Enrice Marconi naskiĝis en januaro 1792 en Romo en la familio de arkitekto, profesoro de la roma Belarta Akademio. Li edukiĝis sub la gvido de sia patro, sekve en la bolonja universitato kaj la tiea Belarta Akademio. Poste li laboris kiel desegnoinstruisto en Lugo. Samtempe li komencis laborojn pri arkitekturaj projektoj, kiuj rapide alportis al Enrice ĉiam pli da premioj en arkitekturaj konkursoj. Havante jam 30 jarojn li venis al Pollando laŭ invito de generalo Ludwik Michał Pac, por finkonstrui lian palacon en la loko Dowspuda en la podlaĥia regiono. Post la brila plenumo de la tasko Pac tuj konfidis al li la elkonstruon de Pac-Palaco en Varsovio. Henryk Marconi rapide radikiĝis en Pollando. Lia edzino fariĝis Małgorzta familie Heiton, la filino de la palaca ĝardenisto. Kun ŝi Marconi havis ses geinfanojn, kiuj en plimulto lasis spuron en la kultura vivo de la lando. Karol fariĝis pentristo, Władysław – pentristo kaj artkonservisto, Leandro – arkitekto. Eleonora edziniĝinte al Antoni Kolberg estis la patrino de i.a. Henryk Wilhelm – la pioniro de la optika industrio en Pollando. La aliaj filoj de Henryk estis Jan – inĝeniero,  Henryk – industriisto. Ties filo Bogdan fariĝis konata pola pentrarta konservisto, profesoro de la varsovia Belarta Akademio.  Sed ni lasu tiun flankvefton. Kvar jarojn post sia alveno al Pollando Henryk Marconi en 1826 transprenis la oficon de la konstrukonsilisto. Unu jaron poste li komencis labori en la Fako de la Industrio kaj Komerco de la registara komisiono por la Internaj kaj Religiaj Aferoj kaj por la Publika Klerigo. Henryk Marconi kreis pli ol grandegan kvanton de la konstruaĵojn. Li metis la bazon por la polaj arkitekturaj studoj.  En la jaroj 1851-58 Henryk Marconi estis profesoro en la varsovia Belarta Akademio. Ankoraŭ post la fermo de la altlernejo li lekciis almenaŭ dum 10 pliaj jaroj.  Tie li instruis arkitekturon ekde la fundamentoj kaj komplekse. Dank’ al li arkitekturo ĉesis  esti nur unu el la artbranĉoj kaj al kelkdek siaj disĉiploj Marconi transdonis plenon de siaj konoj pri la fako.  Marconi lekciis ankaŭ en la inĝenieria lernejo de vojoj kaj pontoj ĉe la Varsovia Universitato. Krome li  estis membro de multaj altlernejoj – i.a. de la Akademio de s-ta Luko en Romo, de la Belartaj Akademioj en Bolonjo kaj Florenco, de la Cara Akademio de la Belartoj en Petersburgo. Li membris ankaŭ  en la Filantropa Societo, el la konstrukomitato de la varsovia Teatro la Granda kaj en la komitato por la alikonstruo de la Saksa Palaco. Henryk Marconi apartenas al la plej fekundaj arkitektoj de sia epoko. Pollandon li traktis kiel sian duan hejmlandon. Fontoj mencias lian partoprenon en la kontraŭca novembra insurekcio 1831, kaj financan subtenon vivfine por la januara kontraŭcara insurekcio  1863.  Li mortis la 21-an de februaro 1863 kaj eterne ripozas en la varsovia nekropolo Malnova Powązki.

El la elsendo 24.01.2020. Legas Barbara – 5’55”

--------------------------------------------------------------------------------

Ekspozicio kronanta la Jaron de Moniuszko
[2020-01-24]
https://pola-retradio.org/2020/01/ekspozicio-kronanta-la-jaron-de-moniuszko/

En la sidejo de la kulturministerio en Varsovio estas rigardebla ekspozicio „Moniuszko”. Ĝi simbole fermas la Jaron de Stanisław Moniuszko, kiun enlande kaj eksterlande oni solenis pasintjare en la 200-a naskiĝdatreveno de la elstara pola komponisto. La ekspozicion formas dek kelkaj paneloj dokumentantaj la plej gravajn faktojn  el la vivo de la komponisto, liajn ideojn, tion kia homo kaj kreanto Moniuszko estis. Tiun bildon kompletigas arkivaj fotografaĵoj kaj krokizoj, kostumoj el la lasta, dek unua enscenigo de la opero „La Fantoma Nobeldomo” en la varsovia Teatro la Granda. Dank’ al la interesa ekspozicikoncepto Stanisław Moniuszko estas prezentita ne nur kiel elstara kulturkreanto, kies serioza rigardo estas konata el la portretoj. Eblas konatiĝi kun li ankaŭ kiel amanta edzo kaj patro de plurmembra familio, homo konanta problemojn de la ĉiutaga vivo. Li samtempe prezentiĝas kiel sentema komponisto dotita de la talento emfazi naciajn sentojn en la malfacila periodo, kiam pro la 18-jarcentaj dispartigoj Pollando ne ekzistis kiel suverena ŝtato.

El la elsendo 24.01.2020. Legas  Maciek – 01’22”

--------------------------------------------------------------------------------

E_elsendo el la 24.01.2020
[2020-01-24]
https://pola-retradio.org/2020/01/e_elsendo-el-la-24-01-2020/

Podkasto: Ludu en nova fenestro | Elŝutu

La 931-a E_elsendo el la 24.01.2020 ĉe www.pola-retradio.org

Nia hodiaŭa felietono estas dediĉita al Henryk Marconi, italdevena arkitekto, kiu radikiĝinte en Pollando kreis multegajn imponajn konstruaĵojn kaj kiel lekcianto de la Belarta Akademio metis fundamentojn por la pola arkitekturo. La komencaj kulturkronikaj informoj koncernas sumigan ekspozicion pri Stanisław Moniuszko en Varsovio en la sidejo de la kulturministerio; la daŭrantan en la kanada Toronto ekspozicion pri la pola dezajno. La E-komunuma informo rilatas al la komuna deklaro de UEA/ILEI okaze de Internacia Tago de Edukado. Ĝi aperis kiel Gazetara Komuniko de UEA (uea.org) . Muzike akompanas nin Helena Melnikowa per sia kanzono „Nesciate”. La apudanta nian programinformon foto referencas al la hodiaŭa felietono, prezentante la ne plu ekzistantan palacon de generalo Pac, kiun aŭtoris Henryk Marconi. Kiel kutime ni disponigas eksterelsende paralele legeblajn kaj aŭdeblajn tekstojn el la hodiaŭa elsendo en unuopaj rubrikoj de nia paĝo. Hodiaŭ t.e. estas „kulturkronikaj informoj” kaj „felietono”. Uzu tiun ĉi servon mem kaj rekomendu al aliaj, kiel efikan manieron altigi la aŭdokomprenon kaj parolkapablon. La elsendo estas aŭdebla ankaŭ en jutubo ĉe la kanalo Espero2009: https://www.youtube.com/results?q=pola+retradio&sp=CAI%253D . I.a. pere de ĝi vi povas rapidigi aŭ malrapidigi la parolrapidecon konforme al viaj bezonoj.

--------------------------------------------------------------------------------

Sunhorloĝoj sur la antikvaj mozaikoj
[2020-01-28]
https://pola-retradio.org/2020/01/sunhorlogoj-sur-la-antikvaj-mozaikoj/

Ĝis nun oni asertis, ke ekzistas nur 7 antikvaj mozaikoj sur kiuj videbliĝas sunhorloĝoj. Pola esploristo, profesoro Marek Olszewski identigis 8 nekonatajn mozaikajn prezentojn de sunhorloĝoj denove analizante konatajn antikvaĵojn. La ekzamenitaj de li objektoj devenas ĉefe el la meditereanea regiono, i.a. Turkio, Italio, Jordanio, Francio aŭ Jerusalemo. Historiistoj kaj arkeologoj konis ilin de jardekoj. Sed ĝis nun sunhorloĝoj estis identigataj kun olivlampo, nilometro aŭ eĉ kolono kovrita de tolaĵpeco. Laŭ la pola arkeologo el la Varsovia Universitatao la ĝisnuna problemo kun identigo de tiuj objektoj ligiĝis kun tre skema prezento kaj apliko de specifa perspektivo. La ideo pri reinterpreto de la konataj mozaikoj aperis dum liaj laboroj pri unu el la 6-jarcentaj mozaikoj en Jerusalemo, malkovrita proksime al la Damaska Pordego, monumenteca enirego al la antikva urbo. Inter riĉe vestitaj virinoj troviĝas mistera objekto, kiun sciencistoj komence de la 20-a jarcento difinis kiel olivlampon aŭ kolonon. Post ĝisfunda analizo kaj komparo kun la malkovrita dum foslaboroj sunhorloĝo eblis konkludi, ke ĉi tiu mozaiko same kiel aliaj al ĝi similaj prezentas sunhorloĝon. Profesoro Olszewski identigis ankaŭ aliajn sunhorloĝojn. I.a. sur la tiel nomata Mapo el Madaba, grandega planka mozaiko nun troviĝanta en la kirko de sankta Georgo en Madaba, Jordanio. Ĝi bildigas mapon de la Proksimia Oriento en la bizanca epoko. La sunhorloĝoj estis tre ofte uzataj en la antikva epoko. Ili apartenas al la plej malnovaj mezuraj instrumentoj. La plej malnovaj devenas el la antikva Egipto. En la meditereanea regiono ili troviĝis same en la publikaj kiel ankaŭ en la privataj lokoj. El la elsendo 28.01.2020. Legas Barbara – 2’32”

--------------------------------------------------------------------------------

Protekto de konsumantoj kontraŭ Artefarita Inteligenteco
[2020-01-28]
https://pola-retradio.org/2020/01/protekto-de-konsumantoj-kontrau-artefarita-inteligenteco/

Komisiono por la interna merkato de la Eŭropa Parlamento proklamis antaŭnelonge rezolucion, per kiu ĝi alvokas la Union, ke la evoluigon de la Artefarita Inteligenteco kaj Aŭtomata Alprenado de Decidoj (ADM) akompanu forta protekto de la konsumantoj. Aŭtomata alprenado de decidoj signifas procezojn de decidalprenado helpe de teknologiaj rimedoj sen la homa interveno (ekzemple en la interretaj bankoj). Eŭropaj deputitoj asertas, ke konsumantoj rilatantaj kun la sistemo ADM devas estis konforme informitaj kiel ĝi funkcias, kiel eblas kontakti homon kun decidkompetentoj kaj kiel eblas ekzameni kaj korekti la decidojn de la sistemo. La deputitoj alvokas ankaŭ la Eŭropan Komisionon prezenti leĝdonan propronon, alkonformigontan la uniajn sekurecregulojn rilate al produktoj por protekti konsumantojn. Ili alvokas ankaŭ prilabori taksosistemon de risko ligita kun la Artefarita Inteligenteco kaj Aŭtomata Alprenado de Decidoj. La rezolucipropono estos prezentita al la ŝtatoj membroj kaj Eŭropa Komsiono dum la plej proksima plensesio.

El la elsendo 28.01.2020. Legas Maciek – 1’18”

--------------------------------------------------------------------------------

La 75-jariĝo de la liberigo de Auschwitz-Birkenau
[2020-01-28]
https://pola-retradio.org/2020/01/la-75-jarigo-de-la-liberigo-de-auschwitz-birkenau/

Dum la lastlundaj solenaĵoj omaĝantaj la 75-an datrevenon de la liberigo de la eksa germana koncentrejo kaj mortotendaro Auschwitz-Birkenau partoprenis ĉirkaŭ 200 eksaj saviĝintaj  malliberigitoj kaj 60 delegacioj reprezentantaj ŝtatojn kaj internaciajn organizojn. Dum la porokazaj solenaĵoj la prezidento de Pollando, Andrzej Duda akcentis, ke la falsado de la historio de la 2-a mondmilito, kontestado de la krimoj de la hombuĉado, neado de holokaŭsto kaj ankaŭ instrumenta utiligado de Auschwitz por kiu ajn celo signifas senhonorigadon de la memoro de la viktimoj. Germanoj establis la koncentrejon Auschwitz por poloj en 1940. Du jarojn poste kreiĝis Auschwitz II-Birkenau, kiel ekstermoloko de judoj. Germanoj murdis tie ĉirkaŭ unu milionon 100 mil virinojn, virojn kaj infanojn, ĉefe judojn, sed ankaŭ polojn, romaojn, sovetuniajn ostaĵojn kaj homojn de diversaj naciecoj. La koncentrejon la 27-an de januaro 1945 liberigis la Ruĝa Armeo. La usona prezidento deklaris la 27-an de januaro 2020 la Nacia Tago de memoro pri la 75-a datreveno de la liberigo de Auschwitz. Li alvokis ĉiujn usonanojn soleni ĉi tiun tagon per specialaj programoj, solenaĵoj, preĝoj kaj rememoroj. La solenaĵojn sur la tereno de la koncentrejo Auschwitz finis komuna interreligia preĝo de kristanoj kaj judoj.

El la elsendo 28.01.2020. Legas Milada – 2’01”

--------------------------------------------------------------------------------

Ĉiuminute 30 mil novaj boteloj en Meditereaneo
[2020-01-28]
https://pola-retradio.org/2020/01/ciuminute-30-mil-novaj-boteloj-en-meditereaneo/

La unia organizaĵo ARLEM alarmas, ke ĉiuminute en Meditereaneon enfalas 30 mil plastaj boteloj. Tio signifas endanĝerigon de la marspecioj, ekosistemoj kaj nutroĉeno, kies parto estas ankaŭ homoj.  Samtempe la meditereanea regiono varmiĝas 20 procentojn pli rapide ol la cetera mondo. La raporto de ARLEM alvokas establi organizon de la meditereaneaj landoj sub la gvido de la Unio. Ĝi kompetentus pri direktivoj validaj por ĉiuj landoj de la regiono. La raporto pro la nuna stuacio kulpigas la aktivadon de homo, prognozante krome, ke en 2050 en la maroj estos pli da plastikaĵoj ol fiŝoj.

El la elsendo 28.01.2020. Legas Krystyna – 0’49”

--------------------------------------------------------------------------------

E_elsendo el la 28.01.2020
[2020-01-29]
https://pola-retradio.org/2020/01/e_elsendo-el-la-28-01-2020/

Podkasto: Ludu en nova fenestro | Elŝutu

La 932-a E_elsendo el la 28.01.2019 ĉe www.pola-retradio.org

En nia elsendo ni proponas denove renkontiĝon kun E-literaturo. Ĉi-foje temas pri la 90-a fragmento de la romano „Quo Vadis” de la pola Nobel-premiito Henryk Sienkiewicz en la E-traduko de Lidia Zamenhof. La komencaj aktualaĵoj koncernas la hieraŭ pasintan 75-an datrevenon de la liberigo de la germana mortotendaro Auschwitz-Birkenau; la rezolucion de la Eŭropa Parlamento pri protekto de konsumantoj kontraŭ Artefarita Inteligenteco; pri grava polucio de Meditereaneo, pri kio raportis ARLEM. La sciencbultena temo rilatas al malkovro de pola sciencisto pri sunhorloĝoj – ĝis nun maltrafe identigataj – sur la antikvaj mozaikoj. Ni aŭdas fragmente la kanzonon de Julián Hernández el la kasedo „Ami kaj kanti Esperante”. La interreta foto bildigas la historian mozaikan mapon en Madaba, Jordanio kiu i.a. prezentas ne tuj rekonitan sunhorloĝon. Ni memorigas, ke kiel kutime ankaŭ hodiaŭ eblas konsulti la paralele legeblajn kaj aŭdeblajn tekstojn el nia elsendo. Krome nia arkivejo prezentas centojn da malpli novaj en unuopaj rubrikoj de nia paĝo. Hodiaŭ ili troviĝas en la rubrikoj „novaĵoj” kaj „sciencaj informoj”. Dank’ al ĉi tiu nia servo eblas efike altigi la aŭdokomprenon kaj parolkapablon. Uzu do ĝin mem kaj rekomendu al aliaj. Nia elsendo estas aŭdebla ankaŭ en jutubo ĉe la kanalo Espero2009; ĝi ebligas laŭplaĉe reguligi la parolrapidecon: https://www.youtube.com/results?q=pola+retradio&sp=CAI%253D

--------------------------------------------------------------------------------

Homo, persono, personulo. Portreto en la religia spaco
[2020-01-31]
https://pola-retradio.org/2020/01/homo-persono-personulo-portreto-en-la-religia-spaco/

Interesan ekspozicion eblas rigardi ĝis la 30 de aprilo 2020 en Frombork, la norda Pollando, en la iama Episkopa  Palaco.  Ĝi prezentas formalajn kaj ikonografiajn verkojn, kiuj ebligas profundiĝi en la ideon de portreto, kiu prezentas homon – personon – personulon. La ekspozicio reliefigas, ke historia portreto destinita por la religia spaco havas riĉan ikonografian kaj idean spktrojn. Eternigante >homon – personon – personecon< ĝi kreis bildon, kiu rezistis la tempon kaj Fortunon, kreis bildon de heroo, bona kristano, batalema kavaliro, virta/pia virino, vera saktulo, ideala sacerdoto. La ekspozicion formas du traiĝantaj sferoj – de la katolika kaj de la protestanta ikonografio pruvantaj, ke kaze de „portreto” ambaŭ reciproke ĉerpis unu de la alia kaj inspiris sin reciproke.  La ekspozociataj verkoj devenas el la preĝejoj de la Varmia Arkidiocezo kaj Diocezo de Elbląg, el monakejoj kaj klostroj, el muzeaj kaj privataj kolektoj.

El la elsendo 31.01.2020. Legas  Maciek – 01’16”

--------------------------------------------------------------------------------

Kryzysztof Wodiczko en la tokia Mori Art Museum
[2020-01-31]
https://pola-retradio.org/2020/01/kryzysztof-wodiczko-en-la-tokia-mori-art-museum/

Ĝis la 29-a de marto 2020 en la tokia Mori Art Museum daŭras la ekspozicio “Future and the Arts”, dediĉita al la estonteco de homo en la kreado de artistoj laborantaj lime de vidartoj kaj novaj teknologioj. En ĝi estas prezentataj i.a. la rezultoj de kunlaboro de la pola dojeno en ĉi tiu sfero Krzysztof Wodiczko kun Rafael Lozano Hemmer.  Lozano-Hemmer estas meksika-kanada elektronika artisto  aplikanta en sia laboro arkitekturajn ideojn, ideojn de teknologia teatro kaj performance. La loĝanta kaj laboranta en Novjorko, Bostono kaj Varsovio Krzysztof Wodiczko laŭ edukiteco projektisto sian inĝenierian-projektistan sperton aplikas por vastigi la artesprimon. Wodiczko estas laŭreato de multaj premioj, kiel Hiroshima Art Prize, Kepes Arts Prize, premio de Katarzyna Kobro. Lia nuna prezento en la tokia Mori Art Museum okazas kadre de la eventoj omaĝantaj la 100-jariĝon de la polaj-japanaj diplomatiaj rilatoj.

El la elsendo 31.01.2020. Legas  Maciek – 01’16”

--------------------------------------------------------------------------------

„Povus esti simple”  de Persone
[2020-01-31]
https://pola-retradio.org/2020/01/povus-esti-simple-de-persone/

La rok-bando „Persone”, kiel unu el la plej famaj muzikensembloj en Esperantujo, ne bezonas prezentadon. Plimulton de sia repertuaro la grupo registris en 5 albumoj, kiuj eldoniĝis inter la jaroj 1987 kaj 2002. Dum ĉi tiu periodo „Persone” sukcesis krei kaj evoluigi sian individuan kaj tuj rekoneblan stilon. En la mallonga recenzo mi tamen dezirus fokusiĝi pri nur unu iliaj KDoj, pri tiu, kiun mi opinias la plej matura kaj interesa – Povus esti simple. Kiel oni scias, 100-elcente objektiva taksado de la muzikaĵoj ne estas ebla. En niaj opinioj, konforme al cirkonstancoj, speguliĝas diversaj faktoroj: gusto, antaŭjuĝoj (pozitivaj aŭ negativaj) kaj scio. Krom tio indas rimarki, ke ĉiu muzikstilo aŭ ĝenro funkcias fakte kiel iom aparta lingvo, kiun la aŭskultanto devas ekkoni, se li volas kompreni kaj ĝui la nuancojn de la konsiderata verko. Rilate al la perspektivo, en kiu mi vidas la kanzonojn de „Persone”, tutcerte influis ĝin miaj personaj muzikaj spertoj de akademia teoriisto kaj flutisto, kaj miaj inklinoj al verkoj de renesancaj kaj barokaj komponistoj. En ĉi tiu momento la aŭskultantoj sendube komencos mediti pri tio, kiajn aspektojn de la priparolataj verkoj tia „klasika” muzikisto kiel mi trovas interesaj. La albumo Povus esti simple konsistas el 13 kanzonoj. La unua afero, kiu altiris mian atenton, estis kvalito kaj diverseco de la tekstoj. Tiun sferon mi traktas kiel aparte gravan por vokalaj verkoj. Se poeziaĵon mi trovas banala kaj naiva, mi tuj ĉesas interesiĝi pri la kanzono, kaj eĉ la plej rafina muzika prilaboraĵo ne helpas. Feliĉe, tio ne estas la kazo de la albumo Povus esti simple. Sendepende de tio, ĉu la verko pritraktas amon aŭ aliajn aferojn, la teksto de ĉiu registrita kanzono enhavas en si iun interesan problemon aŭ enigmon (aŭ ambaŭ). Mi eĉ riskus la tezon, ke super la poezio de la tuta albumo ŝvebas certa melankolia ero kaj etoso de Weltschmerz. Tiel estas eĉ en la kazoj de kanzonoj kun tre vigla muzikstilo. Amo okazas afero tre komplika, kiu igas homojn suferi pro dubo, honto, soleco aŭ malebleco konstrui „pontojn inter kor’ kaj kor’”. Vivo devigas nin kaŝi siajn emociojn en eterna maskerado, kaj la veran memon oni povas malkaŝi nur post „la leviĝo de la lun’”. „Revoj” ne realigeblas kaj finfine ĉio „glitas el la man’”. Inter falantaj bomboj kaj malracia homkonduto naskiĝas nur demando, kiu freneziĝis: „ĉu la mondo, ĉu ni”. Ĉu tio ne estas komuna dilemo de la Esperantistaro? Sed la kanzonoj ne estus kanzonoj sen kantado kaj sonoj de instrumentoj. La ĝeneralan muzikstilon de la albumo oni povas priskribi kiej dura, intensa kaj eĉ iom intence kruda, kun intensaj gitarsono kaj akompano de la perkutinstrumentoj. Ĝi estas ankaŭ tre vigla kaj samtempe bone korespondanta kun karaktero de la tekstoj. En kelkaj kantoj la muziko eĉ ilustras la tekston kvazaŭ retorike, emfazante specifajn frazojn aŭ vortojn. Ekzemple en la fama „Revoj” la gitarakompano ŝajnas imiti pluverojn menciitaj en la unua frazo de la poeziaĵo („pluva aprilo”), kaj en la refreno revoj falas surteren ne nur tekste sed ankaŭ melodie. Tiaj frandaĵoj estas multe pli, kaj ĉiu atenta aŭskultanto sendube kapablos trovi ilin mem. Kvankam plimulton de la kanzonoj karakterizas ĵus menciita vigleco, en la KD estas ankaŭ kelkajn molajn kaj lirikajn komponaĵojn, kiel „Ili venos”, „Kiam amo regas” aŭ „Nun mallumas ekstere”. Tio donas al la aŭskultantoj momenton de mildigo kaj faras la albumon interne diferenciga. Indas ankaŭ konsideri la harmonian lingvon, sampemte simplan kaj rafinitan, kun interesa uzado de diskretaj disonancoj en la formo de diversaranĝitaj pasnotoj kaj sest- kaj septakordoj. Tiuj ĉi lastaj abundas, kiel oni povas ekspekti, ĉefe en la lirikaj kanzonoj, sed ne nur. Finfine oni devas diri kelkajn vortojn pri la prezentado. La sonkvalito estas tre klara, kaj ĉiujn tavolojn de la muzika strukturo oni facile perceptas. Martin Wiese kantas kun granda esprimpleneco kaj imagpovo. Lia prononco estas bona, sed en kelkaj frazoj, precipe kiam gitaroj tre laŭte akompanas aŭ ludas en alta registro, ĝi povintus esti iom pli klara. Mi devas konfesi, ke de tempo al tempo mi necesis kontroli la skribitan tekston, ĉar ne ĉiam mi certis pri unuopaj vortoj. Indas ankaŭ rimarki bonan akordon kaj agordon de la bando. Tio gravas precipe rilate al la kantado, ĉar, bedaŭrinde, ne ĉiam Esperantistaj vokalistoj disponas korektan intonacion, kaj mistrafitaj sonaltoj estas dolorego por aŭdo kaj malreklamo por nia muzikkulturo. Resume: Povus esti simple estas tre bela kaj matura albumo, vera klasikaĵo, pri kiu ni vere povas fieri.

El la elsendo 31.01.2020. Legas Marek – 6’06”

--------------------------------------------------------------------------------

Koninda Pollando: La kastela-parka komplekso en Krasiczyn
[2020-01-31]
https://pola-retradio.org/2020/01/koninda-pollando-la-kastela-parka-komplekso-en-krasiczyn/

Hodiaŭ ni invitas vin gesinjoroj al la loko Krasiczyn, en la sud-orienta Pollando por konatiĝi kun la kastela-parka komplekso, kiu ekde 2018 estas kalkulita kiel plia Historimonumento de Pollando. Temas pri unu el la plej belaj trezoroj de la renesanca-manierisma arkitekturo en Eŭropo. Ĝian konstruon lime de  la 16-a kaj  17-a jarcentoj komencis grafo Stanisław Krasicki, la kastelestro de Przemyśl. Tiun verkon daŭrigis lia filo Marcin, unu el la plej elstaraj tiam artmecenatoj en Pollando, transfominte la  krudan defendokonstruaĵon en imponan rezidejon. Ĝiaj flankoj levitaj sur la kvadrata plano estas orientitaj al kvar flankoj de la mondo. Ĉe la anguloj elstaras kvar diversaj turoj: Dia, Papa, Reĝa kaj Nobela aŭ Kavalira spegulante la mondokierarkion observatan de la fondintoj. Krom la ĵus menciitaj turoj estas ankoraŭ la 49-a metra Horloĝa ĉe kiu tra pordego kaj levponto – poste ŝtona – kondukis la vojo el la ekzistinta urbo. Ekde kelkaj jaroj ĝi estis disponigita al turistoj, kiuj de ĝia supro povas rigardi la vastan ravan panoramon.  De la kastela korto ĉirkaŭita per subarkadaj pasejoj eblas admiri aliflanke tre malofte renkontatajn, belegajn sgrafitartajn dekoraĵojn prezentantajn la bibliajn scenojn kaj medalionojn kun la bustoj de romiaj imperiestroj, kun bildoj de la polaj reĝoj kaj ĉasistaj scenoj. Ilia plena surfaco egalas al ĉirkaŭ 3500 kvadrataj metroj. La alikonstrulaboroj okazis sub la gvido de la italaj arkitektoj, sed la ornamajn kaj dekorajn laborojn plenumis lokaj artistoj. Pri la signifo kaj brilo de la kastelo en sia epoko atestas la fakto, ke ĝi gastigis ankaŭ polajn reĝojn i.a. Sigismundon la 3-an Vasa, Vladislavon la 4-an, Johanon Kazimiron. Post la senhereda morto de Krasicki-familio la kastelon kaj apartenantaj al ĝi havaĵoj transprenis reprezentantoj de aliaj magnataj familioj. Fine, en 1835 aĉetis ĝin princo Leon Ludwik Sapieha kaj ĝuste al  ĉi tiu princa familio la kastela-parka rezidejo plufloris dum pli ol 100 jaroj. Ili restaŭris la kastelon, establis segejon, bierfarejon kaj fabrikon de agrikulturaj maŝinoj samtempe aktivante favore al la ekonomia kaj socia evoluo de la regiono. Sapieha-familio inaŭguris belan tradicion planti en la kastela parko arbon ĉiukaze post la naskiĝo de siaj infanoj. Kverkon, kiu simbolas forton kaj potencon honore al filo, titlion – kiu simbolas fekundecon kaj amon honore al filino.  La kastelo malgraŭ pluraj incendioj kaj militoj konservis neŝanĝitan konstrubulon el la komenco de la 17-a jarcento. Tamen la 2-a mondmilito signis ĝian finon. Ĝis hodiaŭ oni rakontas pri la detrauj sekvoj, per kiuj frapis ĝin sovetuniaj trupoj, kiuj eniris tien en septembro 1939. Dum pli ol unu kaj duona semajnoj sur la kastela korto brulis ĉiuj dokumentoj, memoraĵoj, pentraĵoj, libroj, mebloj, kiujn la posedintoj ne sukcesis forveturigi el la kastelaj ĉambregoj. La riĉe ornamita sarkofago de la 16-jara princino Zofia el la karara marmoro estis frakasita. Bonŝance la sarkofagon, kiel ankaŭ la kastelan kapelon – unu el la plej elstaraj arkitekturaj elementoj de la kastelo en la Dia Turo komparata al la Sigismunda Kapelo en la krakova reĝa Wawel-kastelo – oni sukcesis restaŭri. La kastelon ĉirkaŭas sur la areo de 14 kaj duona hektaroj unu el la plej belaj en Pollando panoramaj parkoj, kies origino ankaŭ devenas el la 17-a jarcento.  La nuna plano kaj aranĝo de la kreskaĵoj ligiĝas kun inventemo kaj vojaĝpasio de Sapieha-familio. La malnovaj plantoj estis riĉigitaj per novaj kreskaĵoj. La riĉo de la plantoj – pli ol 200 arbo- kaj arbustospecioj, ravantaj en ĉiu jarsezono, inkluzive de ekzotikaj kaj zorge protektataj – estas aldona atuto de la kastelo en Krasiczyn. Aktuale en la kastelo troviĝas hotelo kun la konferenca centro. La gastoj havas la ŝancon viziti la kastelon kaj parkon kun gvidanto. Aparta atrakciaĵo estas la nokta vizitado de la kastelaj ĉambroj kun lakeo, dum kiu onidire eblas renkonti la spiriton de la Blanka Damo, onidire la junaĝe mortinta Zofia.

El la elsendo 31.01.2020. Legas Barbara – 6’09”

--------------------------------------------------------------------------------

E_elsendo el la 31.01.2020
[2020-01-31]
https://pola-retradio.org/2020/01/e_elsendo-el-la-31-01-2020-2/

Podkasto: Ludu en nova fenestro | Elŝutu

La 933-a E_elsendo el la 31.01.2020 ĉe www.pola-retradio.org

Nia hodiaŭa felietono pri koninda Pollando kondukas al la 17-jarcenta kastela-parka komplekso en Krasiczyn en la sud-orienta Pollando. Ĝian belecon eblas admiri ankaŭ virtuale i.a. ĉe la adreso: https://www.youtube.com/watch?v=JAaKMtt1zCU. La komencaj kulturkronikaj informoj rilatas al la prezento de la pola artisto Krzysztof Wodiczko en la Tokia Mori Art Museum kaj al la daŭranta en la pola Frombork ekspozicio koncentriĝanta pri la prezentoideo de portretita persono en la religia spaco; riĉa E-komunuma segmento liveras informojn pri la preparoj al la 43-a Esperantologia Konferenco dum la 105-a UK en Montrealo kaj la postkongresa Nitobe-simpozio. Ni informas krome pri la KELI-kongreso okazonta en aŭgusto en la pola Legnica (la sudorienta Pollando). En nia elsendo ni memorigas fragmente du kanzonojn. „Via nomo” de Ĵomart kaj Nataŝa kaj „Duone” de Tierry Faverial el lia samtitola KD. La interreta foto prezentas la kastelon en Krasiczyn, pri kiu ni  hodiaŭ felietonas. Kiel kutime ni disponigas eksterelsende paralele legeblajn kaj aŭdeblajn tekstojn el la hodiaŭa elsendo en unuopaj rubrikoj de nia paĝo. Hodiaŭ t.e. estas „kulturkronikaj informoj” kaj „felietono”. Uzu tiun ĉi servon mem kaj rekomendu al aliaj, kiel efikan manieron altigi la aŭdokomprenon kaj parolkapablon. La elsendo estas aŭdebla ankaŭ en jutubo ĉe la kanalo Espero2009: https://www.youtube.com/results?q=pola+retradio&sp=CAI%253D . I.a. pere de ĝi vi povas rapidigi aŭ malrapidigi la parolrapidecon konforme al viaj bezonoj.

--------------------------------------------------------------------------------

Monakoj laborantaj en Pollando
[2020-02-04]
https://pola-retradio.org/2020/02/monakoj-laborantaj-en-pollando-2/

La pasinta lastdimanĉe religia festo de la Prezento de Jesuo en la Templo estis la okazo doni la atenon al personoj konsekritaj, alivorte gemonakoj en Pollando. La 2-a de februaro kiel Tago de la Konsekrita Vivo estis lanĉita en 1997-a jaro. La polaj gemonakoj konsisitigas ĉirkaŭ 32-milmembran socian grupon. Plimulton konsisitigas virinoj. Temas pri ĉirkaŭ 20 240 mil personoj, inkluzive de 1290, kiuj vivas en izoliteco. Monakinoj gvidas i.a. 400 antaŭlernejojn, 115 elementajn, superelementajn kaj specialajn lernejojn; 79 kleriĝejojn, kie infanoj pasigas tempon ekster la lernejaj okupoj jam post la forlaso de la hejmo, 64 protektoedukajn centrojn, inkluzive de infandomoj, 31 vivofenestrojn (kie eblas lasi bebon kun certeco, ke ĝi ricevos konforman vivprotekton); 29 protektodomojn, 33 manĝejojn por mizeruloj, 47 centrojn, en kiuj oni disponigas al bezonantoj nutraĵojn kaj 72 domojn de spirita koncentriĝo. Ĉirkaŭ 100 monakinoj laboras kun malliberigitoj. Monakinoj aktivas krome en la amaskomunikiloj gvidante ĉirkaŭ 500 interretajn portalojn, ĉirkaŭ 400 fejsbukajn  kaj tviterajn profilojn. Ili havas ankaŭ 6 eldonejojn.

El la elsendo 04.02.2020. Legas Milada – 2’04”

--------------------------------------------------------------------------------

Oxfam pri sociaj malegalecoj
[2020-02-04]
https://pola-retradio.org/2020/02/oxfam-pri-sociaj-malegalecoj/

Internacia humaneca organizo Oxfam alarmas, ke sociaj malegalecoj grandiĝas laŭ hororiga ritmo. 1 procento de la plej riĉaj homoj en la mondo dispons pri riĉaĵoj superantaj pli ol duoble la havaĵojn de la cetera homaro. En raporto publikigita antaŭ la Ekonomia Forumo en Davos Oxfam, organizaĵo okupiĝanta pri kontraŭbatalado de malsato kaj helpo en la disvolviĝantaj landoj konstatis, ke registaroj amase malaltigas impostojn de riĉaj personoj kaj korporacioj dum la sektoro de la publikaj servoj estas subfinancita. La raporto atentigas, ke la „ekonomiaj malegalecoj eskapis la kontrolon”. En la 2019-a jaro  2153 miliarduloj havis pli da riĉaĵoj ol 4,6 miliardoj da homoj. Referencante al la esploroj de la Monda Banko Oxfam asertas, ke malkreskigo de malegalecoj havas pli grandan influon je malgrandigo de eksterma mizero ol ekonomia kresko. Laŭ ĝia analizo, se la landoj malgrandigus la enspezmalegalecojn je unu procento jare, tiam en 2030 la nombro de homoj vivantaj en ekstrema mizero malkreskus je 100 milionoj da personoj.

El la elsendo 04.02.2020. Legas Maciek – 1’25”

--------------------------------------------------------------------------------

Atlantika fraterkulo pli inteligenta ol supozite
[2020-02-04]
https://pola-retradio.org/2020/02/atlantika-fraterkulo-pli-inteligenta-ol-supozite-2/

Britaj zoologoj rimarkis atlantikajn fraterkulojn utiligantajn planttigetojn. Tio okazis kaj sur Islando, kaj ĉe la bordoj de Kimrio. La birdoj aplikis ilin rilate sin mem. Sciencistoj supozas, ke la birdoj aŭ sin gratis aŭ tiamaniere forigadis parazitojn. Laŭ kolektivo de doktorino Annette Fayet, ĉi tiuj kazoj povas ilustri specifajn bezonojn aperantajn en apartaj cirkonstancoj. Tiu supozo ŝajnas esti des pli pravigita, ĉar la konstatita kazo sur unu el la islandaj insuloj okazis dum aparte granda invado de iksodoj. Ne eblas ekskludi, ke helpe de tigeto estis pli facile forigi parazitojn  ol per la uzo de la beko. La britaj sciencistoj ne ekskludas samtempe, ke iliaj konstatoj povas ŝanĝi opinion pri la inteligenteco de la maraj birdoj. Ili havas relative malgrandajn cerbojn kompare al la korpodimensio kaj tial ne estas taksataj kiel tro inteligentaj. Aliflanke atlantikaj fraterkuloj vivas en neprognozebla medio, en kiu solvado de ĉi specaj problemoj postulas kondutelastecon kaj lerton en lernado, parkerado kaj planado. Ĝis nun la unusolaj birdoj, pri kiuj estis sciate, ke ili uzas plattigetojn por sin grati estis papagoj.

El la elsendo 04.02.2020. Legas Gabi- 1’31”

--------------------------------------------------------------------------------

Dimanĉa butikumado, ŝanĝo de kutimoj
[2020-02-04]
https://pola-retradio.org/2020/02/dimanca-butikumado-sango-de-kutimoj/

Poloj spertis antaŭ du jaroj veran ŝokon post la decido pri femitaj vendejoj dimanĉe. La ideo celis ebligi al vendistoj – aparte en grandaj komercaj centroj kaj ĉenaj vendejretoj – ĝui dimanĉon en la familia etoso. Pasintjare eblis butikumi nur en la lastaj dimanĉoj monate kaj en kelkaj pliaj, strikte difinitaj kazoj. En 2020  enviviĝis la tria etapo de la reformo, sekve de kiu nur 7 fojojn  en la jaro eblos butikumi dimanĉe. Tiuj limigoj ŝanĝis la kutimojn kaj oni rimarkis, ke klientoj ne rezignas pri butikumado dimanĉe, sed butikumas interrete. Ankaŭ la komerca sektoro reagis je novaj decidoj aplikante alternativajn solvojn por malkreskigi siajn perdojn. Temas plej ofte pri favora varoferto en la tagoj antaŭantaj la nekomercajn dimanĉojn, aparte vendrede. La Pola Konsilio de Komercaj Centroj aperigis en novembro 2019 socidiagnozan raporton. Laŭ ĝi  multaj klientoj estas malkontentaj pro la nekomercaj dimanĉoj, kiuj malebligis al ili pasigi dimanĉon en la komercaj centroj „plurdimensie”. Ili kutimiĝis, ke grandaj komercaj vendogalerioj ebligis al ili  ligi distron kun servoj, dimanĉan tagmanĝon en restoracio kun familia butikumado. La organizantoj elmontris negativajn ekologiajn sekvojn de la pli ofta interreta butikumado. Tio iliaopinie ligiĝas kun multeco de la uzataj pakumoj kaj varliveroj.

El la elsendo 04.02.2020. Legas Maciek – 1’44”

--------------------------------------------------------------------------------

E_elsendo el la 04.02.2020
[2020-02-06]
https://pola-retradio.org/2020/02/e_elsendo-el-la-04-02-2020/

Podkasto: Ludu en nova fenestro | Elŝutu

La 934-a E_elsendo el la 04.02.2019 ĉe www.pola-retradio.org

En nia elsendo ni hodiaŭ memorigas la arkivan interparolon de red. Anna Henn-Limont de antaŭ pli ol 20 jaroj kun László Szilvási pri la tiama stato de la interreta komunikado, kun aparta konsidero de eventoj kaj ret-info. Tio estu la okazo nepre viziti/reviziti la paĝojn de eventoj.hu La komencaj aktualaĵoj rilatas al la raporto de internacia organizaĵo Oxfam pri sociaj malegalecoj, al laboro socie utila de polaj gemonaĥoj, al ŝanĝiĝantaj butikumkutimoj post la enkonduko de komerce liberaj dimanĉoj. Per la sciencbultena temo ni alrigardas la demandon ĉu fraterkuloj konscie uzas planttigetojn por i.a. sia higieno. Hodiaŭ ni proponas fragmente la kanzonon de JoMo „La koloro de la amo”, devenantan el la KD „JoMo Slavumas” eldonita de Vinilkosmo. La interreta foto prezentas fraterkulojn, kiuj estas la herooj de nia sciencbultena informo. Ni memorigas, ke kiel kutime ankaŭ hodiaŭ eblas konsulti la paralele legeblajn kaj aŭdeblajn tekstojn el nia elsendo. Krome nia arkivejo enhavas centojn da malpli novaj audo-/legodokumentoj en unuopaj rubrikoj de nia paĝo. Hodiaŭ ili alidoniĝas en la rubrikoj „novaĵoj” kaj „sciencaj informoj”. Dank’ al ĉi tiu nia servo eblas efike altigi la aŭdokomprenon kaj parolkapablon. Uzu do ĝin mem kaj rekomendu al aliaj. Nia elsendo estas aŭdebla ankaŭ en jutubo ĉe la kanalo Espero2009; ĝi ebligas laŭplaĉe reguligi la parolrapidecon: https://www.youtube.com/results?q=pola+retradio&sp=CAI%253D

--------------------------------------------------------------------------------

Nekonata impresionismo en Poznano
[2020-02-08]
https://pola-retradio.org/2020/02/nekonata-impresionismo-en-poznano/

Ĝis la 29-a de marto 2020 en la poznana Kulturcentro Zamek eblas admiri grafikaĵojn de la plej elstaraj impresionistoj. Kadre de la ekspozicio „Nekonata impresionismo: Manet, Pissarro kaj iliaj nuntempuloj”  eblas rigardi du muzeajn kolektojn. La unua konsistas el 34 grafikaĵoj kaj devenas el la plej signifa ekster Francio arkivejo de impresionistoj, kiu estas  Ashmolean Museum en Oksfordo. Ĝi posedas imponan kolekton de la verkoj i.a. de Camille Pisarro. En la grafikaĵoj impresionistoj simile kiel en tolaĵoj aplikis modernajn teknikojn kaj zorgis pri plenumestetiko.  La alian ekspoziciatan en Poznano kolekton konsisitigas 10 verkoj de moderna franca grafiko troviĝantaj en la Nacia Muzeo de Krakovo. La ekspozicio en la poznana kulturcentro ZAMEK ebligas malkovri la modernisman karakteron de grafikaĵoj, malpli konata kreokampo de impresionistoj. Estas rigardeblaj laboraĵoj de  Camille Pissarro, Alfred Sisley, Paul Cezanne, Pierre-Auguste Renoir, Henri de Toulouse Lautrec, Édouard Manet, Édouard Vuillard, Pierre Bonnard. La ekspozicion akompanas edukprogramo – prelegoj, laborrenkontoj, muzeaj lecionoj, renkontiĝoj, gvidado, filmprezentoj. Por personoj blindaj aŭ kun malforta vidkapablo estis pretigitaj aŭdopriskriboj.

El la elsendo 08.02.2020. Legas  Gabi – 01’29”

--------------------------------------------------------------------------------

Ekspozicio pri Chopin en kvar japanaj urboj
[2020-02-08]
https://pola-retradio.org/2020/02/ekspozicio-pri-chopin-en-kvar-japanaj-urboj/

Ekde mezo de oktobro ĝis la jarfino 2019 la japana publiko en Kobe la unuan fojon povis rigardi muzikajn manuskriptojn kaj leterojn de Frederiko Chopin en la ekspozicio „Chopin – la bildo de la artisto dum 200 jaroj”. En 2020 ĝi estos prezentita en tri aliaj urboj de Japanio. Inter la 1-a de februaro kaj la 22-a de marto eblos rigardi ĝin en la Artmuzeo de Kurume (Fukuoka), inter aprilo kaj junio en la Kvartala Artmuzeo en Nerima, Tokio kaj inter aŭgusto kaj septembro en la Artmuezeo de Shizuoka. La ekspozicio prezentanta diversajn artverkojn kaj arkivajn materialojn baziĝante sur la biografio kaj la kreado de Chopin prezentas lian portreton tra 200 jaroj post lia naskiĝo. La ekspozicitrunkon konsisitigas objektoj pruntitaj el la varsovia Muzeo de la komponisto, el aliaj lokoj, kiel Nacia Muzeo de Varsovio aŭ la nederlanda Muzeo Dordrechts.  Entute temas pri 250 objektoj, kiel manskribitaj partituroj kaj leteroj, oleopentraĵoj, grafikaĵoj, artafiŝoj, skulptaĵoj, libroj kaj aliaj.

El la elsendo 08.02.2020. Legas  Gabi – 01’27”

--------------------------------------------------------------------------------

D-ino Katalin Kováts pri Instruista Trejnado
[2020-02-08]
https://pola-retradio.org/2020/02/d-ino-katalin-kovats-pri-instruista-trejnado/

Antaŭ nia mikrofono ni gastigas d-inon Katalin Kováts el edukado.net , kun kiu ni interparolas pri la ĵus finiĝinta februara sesio de la Instruista Trejnado kadre de la Interlingvistikaj Studoj en Adam Mickiewicz-universitato en Poznano (02-07.02.2020). El la elsendo 08.02.2020 – 11’59”

--------------------------------------------------------------------------------

E_elsendo el la 08.02.2020
[2020-02-08]
https://pola-retradio.org/2020/02/e_elsendo-el-la-08-02-2020/

Podkasto: Ludu en nova fenestro | Elŝutu

La 935-a E_elsendo el la 08.02.2020 ĉe www.pola-retradio.org

Antaŭ nia mikrofono ni gastigas hodiaŭ d-inon Katalin Kovats el edukado.net , kun kiu ni interparolas pri la ĵus finiĝinta februara sesio de la Instruista Trejnado kadre de la Interlingvistikaj Studoj en Adam Mickiewicz-Universitato en Poznano. La komencaj kulturkronikaj informoj koncernas Chopin-ekspozicion en kvar diversaj japanaj kulturcentroj kaj ekspozicion pri impresionista grafikarto nun daŭranta en Poznano. La E-komunumaj informoj rilatas ĉi-foje al Hispanio. I.a. temas pri la nova e-ista grupo kreiĝanta en Granada. En nia elsendo ni memorigas fragmente la kanzonon de Mourice Benin „Homa Blovo” el la KD „In-Spir” eldonita de Vinilkosmo. La interreta foto rilatas al la ekspozicio en Poznano pri impresionistaj grafikaĵoj,  titolita „Nekonata impresionismo”. Kiel kutime ni disponigas eksterelsende paralele legeblajn kaj aŭdeblajn tekstojn el la hodiaŭa elsendo en unuopaj rubrikoj de nia paĝo. Hodiaŭ t.e. estas „kulturkronikaj informoj”. Uzu tiun ĉi servon mem kaj rekomendu al aliaj, kiel efikan manieron altigi la aŭdokomprenon kaj parolkapablon. En la rubrirko „Antaŭ la mikrofono” aŭdeblas eksterelsende la interparolo kun nia antaŭmikrofona gasto. La elsendo estas aŭdebla ankaŭ en jutubo ĉe la kanalo Espero2009: https://www.youtube.com/results?q=pola+retradio&sp=CAI%253D . I.a. pere de ĝi vi povas rapidigi aŭ malrapidigi la parolrapidecon konforme al viaj bezonoj.

--------------------------------------------------------------------------------

Plengrasa aŭ sengrasigita lakto kaj obezeco
[2020-02-11]
https://pola-retradio.org/2020/02/plengrasa-au-sengrasigita-lakto-kaj-obezeco/

Sciencistoj el la Toronta Universitato kaj aliaj kanadaj sciencaj institutoj konstatis, ke infanoj trinkantaj plengrasan lakton estas minacitaj je malpli granda risko de aperonta ĉe ili tropezo kaj obezeco ol infanoj trinkantaj sengrasigitan lakton. Ili analizis 5862 sciencajn raportojn serĉante inter ili tiujn, kiuj koncentriĝis pri ligo inter graso en la lakto konsumata de infano inter la 1-a kaj la 18-a vivojaroj kaj aperanta tropezo kaj obezeco. 28 rilatajn esplorojn ili subigis al plia analizado. Pri tio ili raportis en la periodaĵo The American Journal of Clinical Nutrition . En 18 kazoj ili rimarkis ĉi tiun dependecon. Tio dubigas la aktualajn dietrekomendojn en multaj landoj, en kiuj oni konsilas al la infanoj lakton kun malgrandigita grasokvanto. La kanadaj esploroj havis dume observan karakteron. Por konfirmi ilin estas bezonaj pliaj esploroj. El la elsendo 11.02.2020. Legas Maciek – 1’11”

--------------------------------------------------------------------------------

La atento al reŭmatismaj malsanoj
[2020-02-11]
https://pola-retradio.org/2020/02/la-atento-al-reumatismaj-malsanoj-2/

Parolante pri reaŭmatismaj malsanoj ĝenerale oni pensas pri homoj grizaĝaj. Tamen suferas ilin ankaŭ infanoj kaj junuloj, sed plej ofte personoj inter la 30-a kaj 50-a vivojaroj.  Ili atakas ne sole artikojn, sed ankaŭ tiajn organojn kiel koro, renoj, pulmoj, okuloj kaj eĉ la nerva sistemo. La plej ofta problemo de malsanuloj estas doloro, kiu akompanas ilin dum la endormiĝado kaj vekiĝado. Kun tio ligiĝas la longiĝa laco, kiu ne pasas dumtage. La precizaj kaŭzoj de tiuj malsanoj ne estas konataj. La ekzamenadoj pruvas sole, ke ĉiuj ligiĝas kun la misfunkciado de rezistosistemo. Tamen temas pri nekuraceblaj malsanoj, kiuj en la daŭro de kelkaj jaroj povas kaŭzi tutecan neplenlertecon de pacientoj, aparte se malsanoj estas tro malfrue rekonitaj kaj malĝuste kuracataj. Nur laŭeble rapida diagnozo kaj ekkomenco de la kuracado donas ŝancon haltigi la malsanon kaj certigi laŭeble longan fizikan lertecon de koncerna paciento. La artikmalsanojn en Pollando suferas pli ol 9 milionoj da pacientoj,  alivorte ĉiu kvara polo.

El la elsendo 11.02.2020. Legas Maciek – 1’19”

--------------------------------------------------------------------------------

Raporto: Seksegaleco
[2020-02-11]
https://pola-retradio.org/2020/02/raporto-seksegaleco/

Dum la antaŭnelonga Monda Ekonomia Forumo en Davos oni konsideris la statuson de virinoj kaj viroj unuavice el la ekonomia vidpunkto en la monda skalo. En la egaligo de la seksoŝancoj oni rimarkas pli bonan utiligon de talentoj kaj kapabloj, kio tradukiĝas al akcelita ekonomia evoluo de la mondo. La konkludoj ne estas optimimaj. Malgraŭ ŝanĝoj en la vira-virina egaleco necesa estas ankoraŭ unu jarcento, por ke virinoj egalpaŝu kun viroj konsiderante sian ekonomian pozicion. En la forumo estis prezentita raporto ilustranta diferencojn ĉi-sfere, kiuj nun egalas al 68,6 procentoj. Vera egaleco venos, kiam ĝi estos 100-procenta. La indico pri la ekonomia seksoegaleco kreiĝas baze de detalaj informoj kaj donitaĵoj ilustrantaj la partoprenon kaj la statuson de virinoj kaj viroj en kvar sferoj. Temas pri ekonomio, politiko, edukado kaj sano. Koncerne la mezuradon de la ekonomia statuso oni utiligas tiajn donitaĵojn, kiel ekzemple strukturon de la labormerkato, diferencon en salajroj ĉe la samaj laborpostenoj, altecon de la enspezoj (kun la konsidero de la aĉetopovo en la unuopaj landoj), partoprenon de virinoj ĉe superaj menaĝeraj postenoj. La eduka statuso estas difinata baze de donitaĵoj pri skalo de analfabeteco, kvanto de viroj kaj virinoj atingantaj laŭvicajn eduknivelojn. La pritakso de la sanstato dependas de la prognozata vivodaŭro de virinoj kaj viroj en la unuopaj landoj. La politika pozicio dependas de partoprenoproporcio en la parlamentoj, ĉe la registaraj postenoj. Konsiderante ĉiuj ĉi faktorojn en 153 landoj, en la monda skalo, de multaj jaroj avanas Islando. Sur pliaj lokoj troviĝas Norvegio, Finnlando kaj Svedio. La egalecindico en Islando estas difinita je 88 procentoj. Malgraŭ tre alta partopreno de islandaj virinoj sur la labormerkato kaj ilia kvanto en la firmaaj estraroj kaj en la politika vivo daŭre aperas tie diferencoj ĉe la analogaj laborpostenoj. Pollano ne apartenas al avanuloj, se temas pri la seksa egalecnivelo. La indico egala al 73,6 procentoj estas pli alta ol la meza en la mondo, kiu egalas al 68,6 procentoj, sed metas nian landon voste de la plimulto de la eŭropaj landoj. Analogan nivelon atingis Niderlando kaj Serbio. Temas pri la 40-a loko en la mondo. De la lasta raporto pri ĉi tiu temo Pollando avancis je  2 lokoj kaj ekde 2006 la de egalrajteco pliboniĝis je 5,6 procentoj. El pli detala analizo de la donitaĵoj pri Pollando rezultas, ke la malgrandiĝanta, sed daŭranta diferenco en la statuso de viroj kaj virinoj sekvas unuavice el la ĉeesto en la publika vivo sur altaj postenoj kaj multe malpli forta ekonomia situacio de virinoj. Signifa estas ankaŭ diferenco favore al viroj, se temas pri enspezoj. La fora loko de Pollando se temas pri seksoegaleco ligiĝas krome kun malmulta partopreno de virinoj en strukturoj administrantaj la laborentreprenojn kaj la ŝtaton.

El la elsendo 11.02.2020. Legas Milada – 4’35”

--------------------------------------------------------------------------------

Interparolo kun prof.-ino Ilona Koutny (februaro, 2020)
[2020-02-11]
https://pola-retradio.org/2020/02/interparolo-kun-prof-ino-ilona-koutny-februaro-2020/

Nia  antaŭmikrofona gasto estas prof.-ino Ilona Koutny , kun kiu ni interparolas pri la januara interlingvistka konferenco en Parizo kaj la ĵus finiĝinta (en februaro) Interlingvistika Sesio ĉe Adam Mickiewicz-Universitato. Ni ekscias informojn pri la septembra ekzamena sesio en Poznano kaj pri la okazonta tiam Interlingvistika Simpozio, ankaŭ pli konkretajn informojn pri la estonteco de la tieaj studoj.

El la elsendo 11.02.2020 – 13’08”

--------------------------------------------------------------------------------

E_elsendo el la 11.02.2020
[2020-02-11]
https://pola-retradio.org/2020/02/e_elsendo-el-la-11-02-2020/

Podkasto: Ludu en nova fenestro | Elŝutu

La 936-a E_elsendo el la 11.02.2019 ĉe www.pola-retradio.org

Nia nunsemajna antaŭmikrofona gasto estas prof.-ino Ilona Koutny, kun kiu ni interparolas pri la januara interlingvistka konferenco en Parizo kaj la ĵus finiĝinta (en februaro) Interlingvistika Sesio ĉe Adam Mickiewicz-Universitato. Ni ekscias informojn pri la septembra ekzamena sesio en Poznano kaj pri la okazonta tiam Interlingvistika Simpozio, ankaŭ pli konkretajn informojn pri la estonteco de la tieaj studoj. Kadre de la komencaj aktualaĵoj ni prezentas raporton pri la foraj perspektivoj de la plena egaleco inter virinoj kaj viroj laŭ la ekonomia vidpunkto. La sciencaj temoj traktas la esplorojn pri la dependeco inter konsumado de malgrasigita lakto kaj obezeco; la alia temo rilatas al reaŭmatismaj malsanoj, kiuj suferigas ne sole grizaĝulojn. Hodiaŭ ni proponas fragmente la kanzonon de Dolchamar „Solaj paroj” el la KD” Rebela Sono” eldonita de Vinilkosmo. La interreta foto rilatas al la temo de unu el niaj sciencaj informoj pri tio, kiu lakto – plengrasa aŭ sengrasigita – decidas pri svelta silueto. Ni atentigas, ke ankaŭ hodiaŭ eblas konsulti la paralele legeblajn kaj aŭdeblajn tekstojn el nia elsendo. Niaj surpaĝaj rubrikoj enhavas cetere centojn da malpli novaj aŭdo-/legodokumentoj kun indiko de i.a. tempodaŭro. Hodiaŭ ili aldoniĝas en la rubrikoj „novaĵoj” kaj „sciencaj informoj”. Eksterelsende aŭdiĝas ankaŭ en la rubriko „Antaŭ la mikrofono” interparolo kun la gasto de nia redakcio. Dank’ al ĉi tiu nia servo eblas efike altigi la aŭdokomprenon kaj parolkapablon. Uzu do ĝin mem kaj rekomendu al aliaj. Nia elsendo estas aŭdebla ankaŭ en jutubo ĉe la kanalo Espero2009; ĝi ebligas laŭplaĉe reguligi la parolrapidecon: https://www.youtube.com/results?q=pola+retradio&sp=CAI%253D

--------------------------------------------------------------------------------

Festivalo de Barokaj Operoj
[2020-02-15]
https://pola-retradio.org/2020/02/festivalo-de-barokaj-operoj/

La 22-an de februaro 2020 en Varsovio komenciĝos la jubilea, 10 Festivalo de Barokaj Operoj organizata de la Varsovia Ĉambra Operejo. La tradicia jam festivalo transformiĝis en 10-jara periodo en vastskalan prezenton de la baroka muziko laŭ ĉiuj aspektoj. En la festivala programo troviĝas variaj eventoj por rafinitaj gustoj kaj atendoj de ĉiuj muzikŝatantoj. Inter la elstaraj programeroj menciinda estas i.a.  la inaŭgura koncerto de la fama 1756 Salzburg, komponaĵoj de Johann Sebastian en la ĵazinterpreto de  Andrzej Jagodziński, la premiero de „Castor et Pollux” de Rameau aŭ reenscenigo de „Armide”. Ĉi-lasta furis e la Varsovia Ĉambra Operejo en la sezono 1017/2018. La festivalaj konceroj daŭros ĝis la 5-a de aprilo 2020. En ĝia finalo aŭdiĝos la Pasiono laŭ sankta Johano de Johann Sebastian Bach.

El la elsendo 15.02.2020. Legas  Maciek – 0’55”

--------------------------------------------------------------------------------

Festo de la dekstraborda Varsovio
[2020-02-15]
https://pola-retradio.org/2020/02/festo-de-la-dekstraborda-varsovio/

La dekstraborda kvartalo de Varsovio, Praga la 10-an de februaro 1648 ricevis de la reĝo Vladislavo la 4-a Vasa la urborajtojn. Okaze de la 372-a datreveno de ĉi tiu fakto en la Muzeo de la Varsovia Praga okazis multaj eventoj, i.a. estis prezentita la plej nova mapo de metiistoj el la norda Praga. Ĝi prezentas 70 metiejojn, i.a. kudristajn, ŝuistajn kaj lignaĵistaj. Metiistoj prezentis al la publiko siajn metiejojn kaj iliajn elfaraĵojn en la stato 4 jarojn post la lasta mapoaktualigo. Alia evento kadre de la datreveno estis „La pola Loreto – memoraĵoj de la pasinteco” en la preĝejo de La Loreta Dipatrino. Ĝi ebligis konatiĝi kun la historio de la plej malnova preĝejo en ĉi tiu urboparto radikanta en la 17-a jarcento. La datreveno estis ankaŭ la okazo gvidi la publikon tra sia ĉefa ekspozicio „La Muzeaj Vizaĝoj”.

El la elsendo 15.02.2020. Legas  Maciek – 01’08”

--------------------------------------------------------------------------------

La 100-jariĝo de la reveno apud Baltikon
[2020-02-15]
https://pola-retradio.org/2020/02/la-100-jarigo-de-la-reveno-apud-baltikon/

De jarcentoj la pola ŝtato estis ligita kun Pomerio kaj Baltiko. Situante en la riverbranĉaro de Vistulo kaj Odra en maniero evidenta ĝi gravitis al la maro klopodante sub sian regadon transpreni la riverbuŝojn de ambaŭ riveroj. Jam unuaj polaj historiaj regantoj Mieszek 1 (Mjeŝko la 1-a) kaj Bolesław Chrobry (Boleslao la Brava) agnoskis tion, inaŭgurante sian maran politikon per la klopodoj enkorpigi en la novkreiĝantan ŝtaton la tutan Pomerion inter la riverbuŝoj de ĵus menciitaj riveroj. La fama pola renesanca poeto Jan Kochanowski en sia verko el 1564 glorigis Pollandon, ke ĝiaj limoj etendiĝas de maro ĝis maro, komprenigante du marojn –  Baltikon kaj la Nigran Maron. Laŭ historiistoj tio ne plene konformas al vero. Veras aliflanke, ke la riverbranĉaro de Vistulo ekde la 14-a jarcento rolis kiel la eŭropa grenujo. La riĉon de la agrikulturaj produktoj, kiujn oni transportis laŭ Vistulo eblas ĝis nun rimarki vizitante ĝiajn laŭbordajn urbojn komencante de Krakovo, tra Sandomierz, Kazimierz Dolny, Warszawa, Płock, Włocławek, Toruń, Bydgoszcz, Grudziądz, Tczew kaj Gdańsk mem. Rapide kreskanta bezonateco je greno en la okcidenta Eŭropo kaj ĝia manko devigis la niderlandajn komercistojn serĉi novajn liverantojn. Jam ekde la 14-a jarcento iliaj ŝipoj transportis grenon el Gdansko ĝis Amsterdamo. Kaj de tie ĝi estis eksportata al pli foraj lokoj, grave kontribuante al la bonstatiĝo de niderlandanoj. Ekde la 15-a jarcento centoj da ŝipoj jare ankris en Gdansko kaj aliaj baltikaj havenoj por reporti bonkvalitan kaj malmultekostan polan grenon. En la 17-a jarcento ĉefe el Gdansko al Amsterdamo ĉiujare oni venigadis 150 mil tunojn da greno, sed ja ne sole ĝi estis atendata varo, ja ankaŭ i.a. ligno, kiun oni povis transporti dum la tuta jaro. Polaj komercistoj, polaj nobeloj ĝuis reciproke venigatajn multekostajn drapojn, sudajn fruktojn, vinon, spicaĵojn, porcelanaĵojn kaj aliajn luksajn produktojn. La vastan aliron al Baltiko la unuiĝinta – post ĉirkaŭ 200 jara provinca diserigo en la 12-a/13-a jarcento – la Pola Reĝolando  akiris post la tn. Toruna Pactraktato kun Teŭtonoj en 1466, sed perdis ĝin sekve de la unua dispartigo de Pollando inter Rusio, Prusio kaj Aŭstrio en 1772. Tiu situacio, manko de aliro al la maro daŭris dum la tuta 19-jarcento. Sojle do de la regajnata suvereneco komence de la 20-a jarcento Pollando, konstruante la vizion de la reakirota sendependeco, la aliron al la maro agnoskis kiel kondiĉon nepran („sine qua non”) de sia ŝtatrekonstruo. La necedebla starpunkto de la polaj intertraktantoj en diskutoj ĉirkaŭ la decidoj de la Versajla Traktato alportis al Pollando sendepndecon kaj revenon al la bordo de Baltiko. Tiun jubileon ne eblas subtaksi. Aŭtune de la pasinta jaro la pola Sejmo proklamis rezolucion pri la solenado de la tn. Nupto de Pollando  kun la Maro en la loko Puck. Tio ligiĝis kun la proksimiĝanta tiam 100-jariĝo de ĉi tiu evento. La preciza datreveno pasis en la ĵusaj tagoj, la 10-an de februaro. Tiutage en la 1920-a jaro generalo Józef Haller simbole transprenis la regadon super la maro. Li venis kun la akompanaj personoj, inkluzive de polaj soldatoj al la loko Władysławowo sur la ferdeko de la kutro Seestern farante la unuan ralion tra la pola maro. Tiu ralio havis simbolan dimension. Similan havis la  famiĝinta enĵeto de la finaĉoringo en la marajn akvojn, kio okazis unu tagon pli frue en la loko Puck. La unuan fojon tiam post la 18/19-jarcentaj dispartigoj apud Baltiko aperis reprezentantoj de la pola ŝtato kaj de ĝiaj militistaj fortoj. La ĵus pasinta 100-jariĝo fariĝis la okazo por retrorigarda pritakso, kiel bone Pollando utiligis la liberecon regajnitan baze de la Versajla Traktato garntiinta al Pollando kaj sendependecon kaj revenon al Baltiko. Neniu dubas, ke ĉi tiu evento de antaŭ 100 jaroj estis enorme grava por la rekonstruo de la pola ŝtato laŭ la ekonomia vidpunkto. En la intermilita jardudeko la rekonstruon de Pollando fundamentis Gdynia, la haveno kies elkonstruo komenciĝis tuj post kiam Pollando revenis apud Baltikon. Tio ebligis pluevoluigon de la ŝtato, de la eksporto. La reveno apud Baltikon malfermis antaŭ polaj navigantoj, la pola floto, maritoj, pola marino oceanojn kaj marojn de la tuta mondo. La situo de Pollando ĉe Baltiko daŭre favoras ekonomian evoluon de la lando, floradon de ĝia mara mastrumado. Ĝi koncernas ŝipkonstruadon kaj ŝiprenovigadon, maran transporton, fiŝkaptadon kaj fiŝalifaradon, maran turismon. Malgraŭ malvama akvo kaj ne ĉiam favora vetero la pola Baltiko logas, aparte somere amason da turistoj. Atendas ilin ne sole sabloriĉaj plaĝoj, sed ankaŭ interesaj havenurboj al kiuj i.a. kalkuliĝas Gdańsk, Sopot, Hel, Kołobrzeg kaj Międzyzdroje. Post la 2-a mondmilito la pola marbordo egalas al 528 kilometroj formante naturan, nordan limon de Pollando.

El la elsendo 15.02.2020. Legas Barbara – 7’41”

--------------------------------------------------------------------------------

E_elsendo el la 15.02.2020
[2020-02-15]
https://pola-retradio.org/2020/02/e_elsendo-el-la-15-02-2020/

Podkasto: Ludu en nova fenestro | Elŝutu

La 937-a E_elsendo el la 15.02.2020 ĉe www.pola-retradio.org

Nian hodiaŭan felietonon pri Koninda Pollando ni dediĉas al la pasinta en la ĵusaj tagoj 100-jariĝo de la reveno de Pollando apud Baltikon. En la komencaj kulturkronikaj informoj ni parolas pri la jubileo de la atribuo de la urborajtoj al la varsovia kvartalo Praga kaj pri la baldaŭ komenciĝonta nunjara eldono de la festivalo de Barokaj Operoj. La E-komunuma informo, sekve de Sezonoj,  rilatas al altranga distingo de la litova parlamento por la konata litova E-aktivulo Povilas Jegorovas. En nia hodiaŭa elsendo ni citas muzike polajn kantojn kiuj akompanis la informon pri la varsovia Praga kaj nian felietonon. La interreta foto prezentas polan Baltikon. Ankaŭ hodiaŭ ni disponigas eksterelsende paralele legeblajn kaj aŭdeblajn tekstojn el la hodiaŭa elsendo en unuopaj rubrikoj de nia paĝo. Hodiaŭ t.e. estas „kulturkronikaj informoj” kaj „Felietonoj”. Uzu tiun ĉi servon mem kaj rekomendu al aliaj, kiel efikan manieron altigi la aŭdokomprenon kaj parolkapablon. La elsendo estas aŭdebla ankaŭ en jutubo ĉe la kanalo Espero2009: https://www.youtube.com/results?q=pola+retradio&sp=CAI%253D . I.a. pere de ĝi vi povas rapidigi aŭ malrapidigi la parolrapidecon konforme al viaj bezonoj.

--------------------------------------------------------------------------------

Pozitiva bilanco de la pola eksporto
[2020-02-18]
https://pola-retradio.org/2020/02/pozitiva-bilanco-de-la-pola-eksporto/

Pollando notis en 2019 pozitivan bilancon en la eksporto de la agrikulturaj-konsumaj produktoj. Ĝia valoro egalis al 31,4 miliardoj da zlotoj kaj estis je 5,8 procentoj pli bona ol en la jaro pli frua. En ĝia strukturo plej altan pozicion okupis viando, ĝiaj alifaraĵoj kaj porkaro. Pasintjare oni notis ankaŭ pli altan importon kompare al 2018 je 5,2 procentoj. Tiel la saldo de la ekonomia interŝanĝo atingis la valoron de 10 miliardoj 400 milionoj da eŭroj. La polaj nutraĵoj celas unuavice la unian merkaton. Pasinjare la eksporto tien alportis 81 procentojn de la enspezoj pro la eksporto de la agrikulturaj-nutraĵaj produktoj. La ĉefa komerca partnero de Pollando restis tradicie Germanio. Gravaj klientoj de la polaj produktoj estis ankaŭ Britio, Niderlando, Italio kaj Francio. Eksporto al la ceteraj landoj – ekster la Unio kaj la Komunaĵo de la Sendependaj Ŝtatoj – kreskis je 12 procentoj kaj ĝia valoro egalis al 4,3 miliardoj da eŭroj. En ĉi tiu grupo apartan lokon okupis Usono, Saŭda Arabio, Israelo kaj Ĉinio.

El la elsendo 18.02.2020. Legas Maciek – 1’21”

--------------------------------------------------------------------------------

Inteligentaj bandaĝoj kuracas longiĝajn vundojn
[2020-02-18]
https://pola-retradio.org/2020/02/inteligentaj-bandagoj-kuracas-longigajn-vundojn/

Usonaj sciencistoj deklaris, ke nova „inteligenta bandaĝo” povas plibonigi la klinikan protekton super personoj kun longiĝaj vundoj tiaj, kiel ulceroj, diabeta piedo, dekubito, brulvundoj. Ili estas la ĉefa kaŭzo de la membroamputoj, kiuj trafas ĉiujare milionojn da homoj en la tuta mondo. Samtempe pro ilia komplikeco la kuracado estas tre limigita. Aktuale grupo de esploristoj el la usonaj universitatoj de Connecticut,  Nebraska-Lincoln kaj Harvard Medical School projektis distance stiratan inteligentan pansaĵon, kiu povas precize dozi al la vundo diversajn medikamentojn sen la bezono de hejma vizito aŭ enhospitaliĝo. La procezo de vundcikatriĝo estas komplika kaj multetapa. Ĉe ĉiu el ili, t.e. ĉe diversaj stadioj de la historegenerado estas bezonaj aliaj medikamentoj. La novuma pansaĵo liveras necesajn medikamentojn kaj kio gravas ĝi ne devas esti daŭre ŝanĝata. Tra speciala platformo kuracisto distance kontrolas la liberiĝadon de medikamentoj, kiuj estas injekciataj helpe de miniaturaj etnadloj je kiuj estas ekipita pansaĵo. La ekzamenoj estis faritaj ĉe ĉelaj kulturlinioj, sekve ĉe musoj suferantaj diabeton kaj gravajn haŭtolezojn. Dank’ al la teknologio de inteligenta pansaĵo iliaj vundoj komplete cikatriĝis ne lasante postsignojn. Laŭ usonaj sciencistoj la inteligenta pansaĵo povas anstatui la aktuale ekzistantajn manierojn kuraci vundojn kaj malgrandigi la problemon de longiĝaj vundoj. Tio aparte gravas por homoj suferanaj la tiel nomatan diabetan piedon. El la elsendo 18.02.2020. Legas Barbara – 2’11”

--------------------------------------------------------------------------------

Elektronikaj komunikiloj de poloj
[2020-02-18]
https://pola-retradio.org/2020/02/elektronikaj-komunikiloj-de-poloj/

Laŭ la donitaĵoj de la pola Oficejo por la Elektronika Komunikado 70 procentoj de poloj utiligas la Interreton. Pli ol 91 procentoj aliras la reton helpe de la poŝtelefonoj. Ilin utiligas pli ol 9 je 10 respondintoj en la oficeja enketado. Pli ol la duono uzas krome en la poŝtelefonoj la bankan aplikaĵon. Iom alie aspektas la situacio, se temas pri senjoroj pli ol 60-jaraĝaj. Nur 30 procentoj de ili uzas la Interreton. Bremsas tion la timo fariĝi viktimo de la reta trompo kaj malkredo pri la kapablo lerni la retouzon. Nur 26,5 procentoj de la senjoroj deklaras la uzon de komputilo. Aliflanke preskaŭ 82 procentoj de poloj en la aĝo de 60 jaroj utiligas poŝtelefonon. Tio ne malhelpas, ke unu kvinono de la senjoroj daŭre disponas pri la firmloka, dratligita telefono. Kiel la motivon pli ol la duono de ili mencias „kutimiĝon”. Preskaŭ 90 procentoj de la instituciaj klientoj disponas pri interretaliro, kiu estas necesa por la komunikado kun la klientoj, por la interna komunikado kaj akirado de necesaj informoj. Laŭ la pola Oficejo por la Elektronika Komunikado pli ol 60 procentoj de la respondintoj konas la difinon „reto 5G”. Plimulto tamen asertas, ke la aktualaj parametroj uzi interreton el ilia firmao ne estas kontentigaj por ĝia apliko.

El la elsendo 18.02.2020. Legas Milada – 2’04”

--------------------------------------------------------------------------------

E_elsendo el la 18.02.2020
[2020-02-18]
https://pola-retradio.org/2020/02/e_elsendo-el-la-18-02-2020-2/

Podkasto: Ludu en nova fenestro | Elŝutu

La 938-a E_elsendo el la 18.02.2019 ĉe www.pola-retradio.org

