Pola Muzika Biblioteko interrete
[2021-01-01]
https://pola-retradio.org/2021/01/pola-muzika-biblioteko-interrete/

La funkcianta de 75 jaroj Pola Muzikeldonejo malfermas siajn unikajn kolektojn interrete. Ĝi estas la plej granda eldonanto de muziknotoj kaj muziktemaj libroj en Pollando. Inter pli ol 10 mil konsulteblaj bitaj objektoj troviĝas notmuzikaj materialoj de solistaj, ĉambraj kaj orkestraj komponaĵoj, verkoj ekde la mezepoko ĝis nuntempo, kiuj reprezentas diversajn stilojn kaj ĝenrojn destinitajn same por la plej junaj muzikadeptoj kiel ankaŭ por profesiuloj. Inter komponistoj, kies komponaĵoj troviĝas en la reta Pola Muzika Bilbioteko plej multnombre estas reprezentitaj Grażyna Bacewicz, Tadeusz Baird, Fryderyk Chopin, Wojciech Kilar, Janina Garścia, Marta Ptaszyńska, Witold Szalonek kaj Romuald Twardowski. La ikonografiaj kolektoj ampleksas fotografaĵojn kaj grafikaĵojn pri i.a. ĉiutaga vivo de tiaj komponistoj kiel Ignacy Jan Paderewski, Fryderyk Chopin, Stanisław Moniuszko, Karol Szymanowski, iliaj kuzoj kaj proksimuloj. La uzantoj de la Pola Muzika Biblioteko povos utiligi fragmentojn de la komponaĵoj por sia scienca kaj didakta laboro. ( www.polskabibliotekamuzyczna.pl )

El la elsendo 02.01.2021. Legas Maciek kaj Barbara – 1′ 21″

--------------------------------------------------------------------------------

Pola poŝtmarko la plej bela en Eŭropo
[2021-01-02]
https://pola-retradio.org/2021/01/pola-postmarko-la-plej-bela-en-europo/

La Pola Poŝto akiris la unuan premion en la filatela konkurso EUROPA Stamp 2020. Ĝia temo estis la iamaj poŝtaj itineroj. La poŝtmarko aŭtorita de Maciej Jędrysiak prezentas skeme la mapon de Pollando kun la plej gravaj poŝtaj itineroj en la 16-a jarcento kune kun desegnaĵoj de marŝantaj kaj ĉevalrajdantaj kurieroj. En la centra parto de la poŝtmarko bilidigita estas la riverfluo de Vistulo kun la siluetoj de situantaj ĉe ĝiaj bordoj reĝaj urboj – Kraków, Sandomierz, Warszawa, Toruń, Elbląg, Gdańsk. La premion atribuis ĵurio de internaciaj ekspertoj de PostEurop el diversaj medioj inkluzive de artistoj, kolektantoj kaj blogistoj. Ĝi konfirmas la brilajn talentojn de polaj artistoj kaj estas rekonesprimo por la filatelista medio de la Pola Poŝto. La duan premion egalvalore gajnis Postverk Foroya (Ferooj), Swiss Post (Svislando) kaj SC Ukrposhta (Ukrainio). La trian lokon okupis Deutsche Post DHL Group. Aldonendas, ke la Pola Poscto enlaborigas pli ol 80 mil personojn. Siajn klientojn ĝi priservas en 7600 poŝtoficejoj, filioj kaj poŝtistaj agentejoj.

El la elsendo 02.01.2021. Legas Maciek kaj Barbara – 1′ 32″

--------------------------------------------------------------------------------

Kiraso de reĝido Sigismundo Augusto en Pollando
[2021-01-02]
https://pola-retradio.org/2021/01/kiraso-de-regido-sigismundo-augusto-en-pollando/

La 24-an de decembro la hunagara registaro decidis, ke unika objekto el la Nacia Muzeo en Budapeŝto, kiel parto de la pola historia heredaĵo, revenu al Pollando. Temas pr renesanca kiraso de reĝido Sigismundo Aŭgusto, estonta reĝo de Pollando. Ĝi estis farita en la 16-a jarcento kiel donaco de imperiestro Ferdinando okaze de la geedziĝo de la pola reĝido kun la imperiestra filino, Elizabata. Temos plej verŝajne pri la unusola, plene konservita kiraso de pola reĝo en la nunaj kolektoj de Pollando. En ĝia fronta parto estas gravurita la mongramo „E S” por difini la nomojn Elizabeta kaj Sigismundo. Post la 1-a mondmilito kadre de interkonsento pri divido de vienaj imperiestraj kolektoj la kiraso trafis al Budapeŝto pro erara aserto, ke ĝi estis farita okaze de la gefianĉiĝo de la nepino de imperiestro Maksimiliano, Maria kun Ludoviko, la filo de la hungara reĝo Vladislao la 2-a. Jam en 1939 ekspertoj difinis ĝian apartenon al Sigismundo Aŭgusto. Baldaŭ ĝi revenos al Pollando.

El la elsendo 02.01.2021. Legas Maciek kaj Barbara – 1′ 21″

--------------------------------------------------------------------------------

E_elsendo el la 02.01.2021
[2021-01-02]
https://pola-retradio.org/2021/01/e_elsendo-el-la-02-01-2021/

Podkasto: Ludu en nova fenestro | Elŝutu

La 1027-a E_elsendo el la 02.01.2021 ĉe www.pola-retradio.org

Al Ĉiuj Niaj Geaŭskultantoj Feliĉan, Sukcesan kaj Ĉiel Prosperan Novan Jaron ! En la komencaj kulturkronikaj informoj ni sciigas pri la Pola Muzika Biblioteko konsultebla rete, www.polskabibliotekamuzyczna.pl ; pri originala kiraso de pola reĝido, Sigismundo Aŭgusto baldaŭ revenonta al Pollando, pri pola poŝtmarko, kiu evidentiĝis la plej bela en konkurso de EUROPA Stamp. Ĉerpante el la arkivaj felietonoj ni proksimigas la konindan polan vintran ĉefurbon Zakopane. En la E-komunuma segmento ni informas pri aperinta en 2020 libro dediĉita al Hector Hodler kaj pri la gvidantoj de la Interkultura Novel-Konkurso de Akademio Literatura de Esperanto: François Lorrain el Kanado kaj Nicola Ruggiero el Italio. La elsendon muzike akompanas Asorti per la kanzono „Novjara Nokto” kaj Manuel per la kanzono „Feliĉan naskiĝdatrevenon, bonŝancan Novan Jaron”. La apudanta la programinformon foto rilatas al la bonvenigo de la 2021, kiu akompanas niajn novjarajn bondezirojn. En unuopaj rubrikoj de nia paĝo eblas daŭre konsulti la paralele legeblajn kaj aŭdeblajn tekstojn el niaj elsendoj, kio estas tradicio de nia Redakcio ekde 2003-a jaro. Portempe ili – pro teknikaj kialoj – ne povas esti aktualigataj. Tial la aktualajn ĉerpaĵojn – paralele aŭdeblajn kaj legeblajn bv. sekvi per filmetoj ĉe: https://www.youtube.com/channel/UCeJkbvDDmlwesPAl_GmPOEA . La tuta elsendo estas aŭdebla en jutubo ĉe la kanalo: Espero2009: https://www.youtube.com/results?q=pola+retradio&sp=CAI%253D I.a. pere en jutubo, konforme al individua bezono, eblas rapidigi aŭ malrapidigi la parolritmon de la sondokumentoj, transsalti al iu serĉata fragmento de la elsendo.

--------------------------------------------------------------------------------

Pollando  avanas en karpobredado
[2021-01-05]
https://pola-retradio.org/2021/01/pollando-avanas-en-karpobredado/

Pollando fariĝis en la Eŭropa Unio la plej granda bredanto de karpoj. La pola jara produktado konsistigas 30 procentojn de la unia karpobredado. En la kvanto de dek ok ĝis dudek mil tunoj jare polaj karpoj estas preskaŭ tutece destinitaj por la landa merkato. Laŭ la esplorinstituto Eurostat en 2018 en la Unio oni produktis 61 mil tunojn da karpo. Pollando liveris 16, 5 mil tunojn, Ĉeĥio ĉirkaŭ 18, 5 mil kaj Hungario ĉirkaŭ 11, 5 mil tunojn. Tamen la bredadrezultoj varias kaj en signfa grado dependas de la veteraj kondiĉoj. En Pollando ekzistas 3 mil matrumejoj okupiĝantaj pri la bredado de karpoj, unuavice en la suda kaj la okcidenta Pollando. Ĉi tiu fiŝo en la konscio de poloj intime ligiĝas kun la tradicio de la solena antaŭkristnaka Sanktvespera, Vigilia Vespermanĝo. Oni taksas, ke du semajnojn antaŭ la Kristnasko estas vendataj ĉirkaŭ 90 procentoj de la landaj karpoj. Kvankam polaj karpoj estias unuavice destinitaj por la interna merkato, tamen en 2019 ilia eksporto kreskis je 56 procentoj. Polaj karpoj en 2019 estis servataj plej grandkvante ĉe la unilandaj tabloj en Germanio, Francio, Estonio, Litovio kaj Britio.

El la elsendo 05.01.2021. Legas Milada – 1′ 51″

--------------------------------------------------------------------------------

Pli da patroj estadas kun siaj infanoj
[2021-01-05]
https://pola-retradio.org/2021/01/pli-da-patroj-estadas-kun-siaj-infanoj/

Preskaŭ 61 procentoj de la polaj patroj dum la pandemitempo komencis pasigi tempon kun siaj infanoj. Temas pri la testorezultoj okazigitaj de la Ministerio por la Familio kaj Socia Politiko kadre de la programo Tato.net. Ili elmontris kiel ŝanĝiĝis la modelo de la patreco en la lastaj monatoj. Pli ol 21 procentoj de la respondintoj elmontris, ke la pandemio ebligis al ili evoluigi sian patrecon. Negative la situacion taksis pli ol 16 procentoj de la patroj dum pli ol 62 procentoj asertis, ke la pandemio ne influis ĝin. Tamen eĉ 60,8 procentoj de la enketitaj patroj konfesis, ke dum la pandemiperiodo ili pasigas kun siaj infanoj pli da tempo ol antaŭe. Inter la kontentomotivoj la enketitoj unuavice elmontris bonajn rilatojn kun siaj infanoj. Krome temas pri ilia kontento pri la infanoj, pri la familio kaj la edzino kaj ĝenerale pri pli da tempo pasigta kun la familio. Tiuj rezultoj povas helpi al la registaraj kaj eksterregistaraj organizoj ellabori helpoformojn al la patroj konstrui pozitivajn rilatojn kun siaj infanoj.

El la elsendo 05.01.2021. Legas Maciek – 1′ 14″

--------------------------------------------------------------------------------

DMT stimulas kreiĝon de novaj neŭronoj
[2021-01-05]
https://pola-retradio.org/2021/01/dmt-stimulas-kreigon-de-novaj-neuronoj/

DMT, t.e. dimetiltriptamino aperas en multaj plantoj. En malmulta kvanto ĝi troviĝas ankaŭ en la homa organismo. Ĝi eniras la konsisiton de la rita trinkaĵo kun fortaj halucinogenaj proprecoj – ayahuasca, uzata de ŝamanoj en la landoj de la Suda Ameriko. La novaj esploroj de hispanaj sciencistoj elmontras, ke dimetiltriptamino povas influi la cerboplastecon kaj stimuli kreiĝadon de novaj neŭronoj. Samtempe ili pruvis, ke la halucinogenaj proprecoj de DMT estas apartaj disde la mekanimso de la generado de neŭronoj. Ĝi stimulas ankaŭ kreiĝadon de gliaj ĉeloj. La rezultoj de la 4-jaraj esploroj de hispanaj sciencistoj aperis en la periodaĵo „Translational Psychiatry”. Eksperimentante kun musoj >in vitro< kaj >in vivo< ili elmontras, ke DMT influas neŭrogenezon kaj musoj, kiuj ricevis la substancon havis „pli grandajn kongnokapablojn” kompare al musoj el la kontrola grupo. Sciencistoj pruvis, ke dum 21 tagoj de la DMT-terapio reliefe pliboniĝis la kapabloj de ronĝuloj en taskoj ligitaj kun la lernado kaj memoro, en kiuj la ŝlosilan rolon ludas hipokampo. Tiu konstato kongruas kun pli fruaj laboroj elmontrintaj, ke la neŭrogenezo en ĉi tiu loko ĉe plenkreskuloj ludas gravan rolon en kognaj funkcioj. Interesa malkovro estis la konfirmo, ke la stimulita de psikedelaĵo neŭrogenezo ŝajnas esti regata de mekanismo aparta disde tiu, kiu rezultigas halucinacion.

El la elsendo 05.01.2021. Legas Tomek – 1′ 49″

--------------------------------------------------------------------------------

E_elsendo el la 05.01.2021
[2021-01-05]
https://pola-retradio.org/2021/01/e_elsendo-el-la-02-01-2021-2/

Podkasto: Ludu en nova fenestro | Elŝutu

La 1028-a E_elsendo el la 05.01.2021 ĉe www.pola-retradio.org

Jam la 104-an fojon ni proponas sekvi kun ni fragmenton de la romano de Henryk Sienkiewicz „Quo Vadis” en la E-traduko de Lidia Zamenhof. Komence ni referencas al la morgaŭa festo de Epifanio kaj tiurilate ni prezentas fragmenton de la pola kristnaska kanto pri Tri Monarkoj en la plenumo de Anna Osmakowicz. La komencaj aktualaĵoj rilatas al la grandkvanta bredado de karpoj en Pollando kaj al la pandemia tempo, kiu favoras la propatrecajn sintenojn. La kronvirusa kroniko rilatas al la kontraŭvirusa vakcinado. Nia scienca temo estas dediĉita al la malkovroj pri DMT kaj ĝia efikado je neŭronoj. La interreta foto ĉe nia programinformo prezentas epizodon de la pasintjara Epifania Parado en Varsovio. En unuopaj rubrikoj de nia paĝo eblas daŭre konsulti la paralele legeblajn kaj aŭdeblajn tekstojn el niaj elsendoj, kio estas tradicio de nia Redakcio ekde 2003-a jaro. Portempe – pro teknikaj kialoj – ili ne povas esti aktualigataj. Tial la aktualajn ĉerpaĵojn – paralele aŭdeblajn kaj legeblajn bv. sekvi per filmetoj ĉe: https://www.youtube.com/channel/UCeJkbvDDmlwesPAl_GmPOEA . La tuta elsendo estas aŭdebla en jutubo ĉe la kanalo: Espero2009: https://www.youtube.com/results?q=pola+retradio&sp=CAI%253D I.a. pere de jutubo, konforme al individua bezono, eblas rapidigi aŭ malrapidigi la parolritmon de la sondokumentoj, transsalti al iu serĉata fragmento de la elsendo.

--------------------------------------------------------------------------------

Unika tolaĵo de Frans Post en Pollando
[2021-01-08]
https://pola-retradio.org/2021/01/unika-tolajo-de-frans-post-en-pollando/

„Brazila pejzaĝo” datumita je la jaroj 1650-1680 estas la unusola tolaĵo de nederlanda pejzaĝisto Frans Post troviĝanta en la polaj muzeoj. Ĝi estis ŝtelita postmilite el la Lublina Muzeo (la orienta Pollando). Nun ĝi denove fariĝis posedaĵo de la Nacia Muzeo en Lublino dume lasita depone por kelkaj jaroj en la Nacia Muzeo de Varsovio, kiu aĉetis ĝin en 1949. Muzeaj specialistoj el Lublino identigis ĝin baze de la registro de militperdoj. Evidentiĝis tamen post tiu malkovro, ke la tolaĵo en Varsovio kompare kun la originalo estis post la ŝtelo pritondita, malaperis la aŭtografo de la pentristo kaj ĝia surfaco malgrandiĝis je ĉirkaŭ 45 procentoj. Frans Janszoon Post (1612 – 1680) estas agnoskita kiel la unua eŭropano, kiu pentris pejzaĝojn de la Suda Ameriko. En la jaroj 1637-1644 li partoprenis ekspedicion al Brazilo organizitan de la Okicdent-hinda Kompanio. En ĝia daŭro Post pentris kelkajn tolaĵojn kaj faris multajn detalajn desegnaĵojn kaj skizojn, servantajn por pli postaj bildoj. Li pentris unuavice brazilajn pejzaĝojn, la tiean faŭnon kaj flaŭron kaj scenojn kun la partopreno de indiĝenoj. Kolektoj de liaj verkoj troviĝas i.a. en Luvro, Irlanda Nacia Galerio kaj Ham House en Londono.

El la elsendo 08.01.2021. Lagas Barbara kaj Maciek – 1′ 47″

--------------------------------------------------------------------------------

La 16-jarcenta tolaĵo de Lucas Cranach en konservista laborejo
[2021-01-08]
https://pola-retradio.org/2021/01/la-16-jarcenta-tolajo-de-lucas-cranach-en-konservista-laborejo/

En la konservista laborejo de la krakova Wawel-kastela Muzeo al la restaŭraj labroj estas subigota pentraĵo probable de Lucas Cranach Aĝa. Specializaj analizoj klarigos, ĉu efektive la bildon aŭtoras la germana pentristo aŭ ĝi estis sole kreita en lia pentrista ateliero. La prezentita neniam ĝis nun pentraĵo devenas el la kolektoj de la franciskana klostro en Krakovo kaj prezentas Madonon kun Jesu-Infaneto en la akompano de dancantaj, muzikantaj anĝeloj. Post la konservistaj labroj ĝi estos ekspoziciita publike. Antaŭ kelkaj jaroj la artkonservistoj sur la krakova Wawel-altaĵo restaŭris alian tolaĵon de Lucas Cranach Aĝa „Kristo benanta infanojn”, kiu en Wawel-kolektoj troviĝas ekde 1928. Dum la pasintjara decembro Wawel-konservistoj prezentis al la publiko post la restaŭraj laboron la pentraĵon „Madono en protektomatelo” el 1448, kiu estas unu la unuaj datumitaj verkoj de Giovanni da Gaeta.

El la elsendo 08.01.2021. Lagas Barbara kaj Maciek – 1′ 11″

--------------------------------------------------------------------------------

Pliaj perdiĝintaj aŭ ŝtelitaj tolaĵoj revenas al Pollando
[2021-01-08]
https://pola-retradio.org/2021/01/pliaj-perdigintaj-au-stelitaj-tolajoj-revenas-al-pollando/

La Muzeo en Pontevedra en la hispana Galicio redonos al Pollando du 16-jarcentajn tolaĵojn ŝtelitajn de germanoj dum la 2-a mondmilito, kiuj poste trafis al Hispanio. Temas pri „Dolorosa” kaj „Ecce Homo” konsisitigantaj origine religian diptikon de la flamanda pentristo Dirk Bouts. La retrovitaj en Pontevedra artverkoj troviĝis origine en la artkolektoj de Czartoryski-princoj en la loko Gołuchów. La heredanto de la familia kolekto kaj lia edzino princino Maria de los Dolores de Borbon Dos Sicilias y Orleans post la germana invado kontraŭ Pollandon klopodis savi la artkolekton kaŝante ĝin ekster sia rezidejo. Tamen germanoj malkovris la kaŝlokon prirabante la plej valorajn objektojn. La tolaĵoj estis forveturigitaj eksterlanden en 1944 kaj aperis sur la merkato de artverkoj en Madrido en 1973. Tiam aĉetis ilin mecenato de la muzeo Fernando Lopez. Ĝi estis sekve aĉetita de la Muzeo de Pontevedra, kiu ne havis sciojn pri la deveno de la pentraĵoj. Post la marta plenda interveno de la pola flanko la direktoro de la muzeo Juan Manuel Rey konfirmis, ke sendube temas pri tolaĵoj, kies redonon postulas Pollando. Antaŭ la redono al Pollando ili estos la lastan fojon prezentitaj al la hispana publiko en januaro 2021. La temo de la ekspozicio estos la prirabado de la artverkoj, kiu okazas dum militoj.

El la elsendo 08.01.2021. Lagas Barbara kaj Maciek – 1′ 46″

--------------------------------------------------------------------------------

E_elsendo el la 08.01.2021
[2021-01-08]
https://pola-retradio.org/2021/01/e_elsendo-el-la-08-01-2021/

Podkasto: Ludu en nova fenestro | Elŝutu

La 1029-a E_elsendo el la 08.01.2021 ĉe www.pola-retradio.org

En la abundaj komencaj kulturkronikaj informoj ni parolas pri pentraĵoj perdiĝintaj aŭ ŝtelitaj dum la 2-a mondmilito revenintaj aŭ revenontaj al Pollando, krome pri baldaŭ restaŭrota tolaĵo de probable Lucas Cranach en la konservista laborejo de Wawel-kastelo. Hodiaŭ la E-poezio en nia elsendo aŭdiĝas en muzika vesto. Temas pri „La Vojo” de Ludoviko Zamenhof, kiun kante interpretas Gianfranco Molle. Ĝuste tiu ĉi fama, forpasinta itala E-kantisto patronas al la laŭvica eldono de la muzika konkurso de Itala E-Federacio, pri kio ni informas sekve. Multan lokon okupas en nia hodiaŭa programo Leterkesta programero. Finas ĝin dediĉa kanto por niaj subtenantoj. Ni elektis kiel dankesprimon la kanton de Feri Floro „Ni kompatu nin”. La hodiaŭan programinformon akompanas interreta foto prezentanta la unusolan tolaĵon de Frans Post en Pollando kun brazila pejzaĝo, kun signita fortranĉo. En unuopaj rubrikoj de nia paĝo eblas daŭre konsulti la paralele legeblajn kaj aŭdeblajn tekstojn el niaj elsendoj, kio estas tradicio de nia Redakcio ekde 2003-a jaro. Portempe ili – pro teknikaj kialoj – ne povas esti aktualigataj. Tial la aktualajn ĉerpaĵojn – paralele aŭdeblajn kaj legeblajn bv. sekvi per filmetoj ĉe: https://www.youtube.com/channel/UCeJkbvDDmlwesPAl_GmPOEA . La tuta elsendo estas aŭdebla en jutubo ĉe la kanalo: Espero2009: https://www.youtube.com/results?q=pola+retradio&sp=CAI%253D I.a. pere en jutubo, konforme al individua bezono, eblas rapidigi aŭ malrapidigi la parolritmon de la sondokumentoj, transsalti al iu serĉata fragmento de la elsendo.

--------------------------------------------------------------------------------

Laŭreatoj de la premio Benemerenti
[2021-01-12]
https://pola-retradio.org/2021/01/laureatoj-de-la-premio-benemerenti/

Per la nunjara premio Benemerenti atribuata de la Ordinaro de la Polaj Militistaj Fortoj estis distingitaj la pola Limgardistaro, La Centra Militista Biblioteko kaj Presejo de Specialaj Eldonaĵoj. La Pola Limgardistaro fariĝis la laŭreato de la premio i.a. pro la ĉiutaga protekto de la limoj de Pollando, pro agadoj kies celo estas antaŭmalhelpi kaj kontraŭi nelegalan migradon kaj kontrabandadon, pro la gardado de la interesoj de la ŝtato kaj ĝiaj civitanoj. La Centa Militista Biblioteko estis distingita i.a. pro popularigado kaj prezentado de la atingaĵoj de la nuntempa kaj iama militista penso, evoluigado de interesiĝoj de legantoj pri sciencoj ligitaj kun sekureco kaj defendo, pro edukagadoj en formado de patriotaj sintenoj. La lasta distingito Presejo de Specialaj Eldonaĵoj estis premiita pro la tuto de siaj atingaĵoj, inkluzive de pretigado de liturgiaj tekstoj dank’ al kio militistaj sacerdotoj povas servi al soldatoj en ilia religia vivo ankaŭ en malfacilaj atmosferaj kondiĉoj. La premioj Benemerenti de la Ordinaro de la Polaj Militistaj Fortoj estas atribuataj ekde 1995-a jaro.

El la elsendo 12.01.2021. Lagas Milada – 1′ 48″

--------------------------------------------------------------------------------

Poloj omaĝataj en 2021
[2021-01-12]
https://pola-retradio.org/2021/01/poloj-omagataj-en-2021/

La pola Sejmo decidis pri pliaj memoromaĝoj en 2021, kio tradukiĝas al diversspecaj eventoj en la socia vivo. I.a. oni donos apartan atenton al la 3-amaja Konstitucio el 1791 en la kunteksto de ĝia nuntempa aktualeco. En 2021 poloj solenas la memoron de la legendeca Primaso de Pollando, Stefan Wyszyński, engaĝiĝanta en la socian vivon de la nacio, reliefiganta en sia instruado, ke bono de homo devas troviĝi en la centro de la socia kaj ekonomia vivo. En 2021 pasas lia 100-a naskiĝdatreveno. Nunjare pasas ankaŭ la 100-a naskiĝdatreveno de la sekva patrono de 2021, Stanisław Lem. Li estas la plej elstara aŭtoro de la pola sciencfikcia literaturo, kies romanoj kaj rakontoj kalkuliĝas al la kanono de la monda literaturo. Ili estis tradukitaj en pli ol 40 lingvojn kaj aperis ĝis nun en 30-miliona eldonkvanto. En 2021 poloj omaĝas ankaŭ la memoron de tri poetoj – de Cyprian Kamil Norwid, en lia 200-a naskiĝdatreveno, de Tadeusz Różewicz kaj Krzysztof Kamil Baczyński en ilia 100-a naskiĝdatreveno.

El la elsendo 12.01.2021. Lagas Maciek – 1′ 21″

--------------------------------------------------------------------------------

Jaro de Kavernoj kaj Karsto
[2021-01-12]
https://pola-retradio.org/2021/01/jaro-de-kavernoj-kaj-karsto/

La 2021-a jaro estis proklamita kiel Interacia Jaro de Kavernoj kaj Karsto. Lige kun tio la Universitato de Vroclavo, unu el pli gravaj centroj en la Centra Eŭropo okupiĝanta pri la esplorado de kavernoj planas vicon da eventoj. Unuavice estas preparata speciala retejo dediĉita al vaste planita eduka kaj sciencpopulariga agado ligita kun la mistera kaj malluma mondo konata unuavice al vespertoj. La retejo servos kiel platformo de konferencoj, lekcioj, filmprezentoj. Post malapero de la pandemio estas planataj ankaŭ renkontiĝoj ligitaj kun la vizitado de tiuj objektoj, regionaj konferencoj kaj sciencaj tendaroj. Al la prgramo la vroclava universitato invitis administrantojn de la regionaj kavernoj, kiuj estas disponigitaj al turistoj – Niedźwiedzia kaj Radochowska. Kun sciencistoj kunlaboros speleologoj kaj organizaĵoj okupiĝantaj pri la protektado kaj esplorado de karsto. Por la vastskale planita laboro kreiĝos internaiaj sciencistaj kolektivoj kun partopreno de poloj, ukrainajoj, ĉeĥoj kaj alilandaj kunlaborantoj.

El la elsendo 12.01.2021. Lagas Gabi – 1′ 24″

--------------------------------------------------------------------------------

La influo de legado je  la homa cerbo
[2021-01-12]
https://pola-retradio.org/2021/01/la-influo-de-legado-je-la-homa-cerbo/

Sciencistoj el Emory University en Usono en la periodaĵo Brain [brejen konektivity] Connectivity raportis pri siaj esploroj, kiuj koncernas fizjologiajn ŝanĝojn en la homa certo daŭrantajn kelkajn tagojn post la tralego de lbro. Temas pri atigita konektebleco en la maldekstra tempia lobo kaj en la centra sulko. Por siaj esploroj sciencistoj el Emory University varbis 21 studentojn, kies tasko estis legi la libron „Pompejo”. Dum kvin unuaj tagoj oni skanis iliajn cerbojn en ripoza stato helpe de la funkcieca magneta rezonanco. Sekve ĉiutage la volontuloj devis vespere legi po unu el naŭ ĉapitroj de la libro. Ĉiun sekvan matenon esploristoj kontrolis en laboratorio ilian konon de la libroenhavo kaj skanis iliajn cerboj en la ripozostato kelpe de fMRI. Post la finlego de la libro ankoraŭ dum kvin tagoj la legovolontuloj subiĝis al la cerboekzamendo helpe de funkcieca magneta rezonanco. La esplorkolektivo trovis pruvojn pri altigita konektebleco en la maldekstra tempia lobo, respondeca pro alifarado kaj kompreno de lingvokomunikoj. Altigita konektebelco estis rimarkita ankaŭ en la centra sulko respondeca pro la percepto de tuŝo. Dank al ĝi homo havas la konscion pri sia korpo. Laŭ la esploraŭtoro Gregory Berns la librolegado kaŭzas, ke ni „transportiĝas en la korpon de ĉefheroo”. Ĝis nun oni komprenis tion en parabola senco. La eksperimento de sciencistoj el Emory University liveris pruvojn biologiajn. La esploristojn pensigis la longdaŭro de ĉi tiuj neŭronaj ŝanĝoj. Se ili estas konstateblaj dum kelkaj tagoj post la tralego de ajna libro eblas premisi, ke la ŝatata libro de iu persono povas havi multe pli grandan kaj longdaŭran biologian influon je ties cerbo.

El la elsendo 12.01.2021. Lagas Barbara – 2′ 21″

--------------------------------------------------------------------------------

E_elsendo el la 12.01.2021
[2021-01-12]
https://pola-retradio.org/2021/01/e_elsendo-el-la-12-01-2021/

Podkasto: Ludu en nova fenestro | Elŝutu

La 1030-a E_elsendo el la 12.01.2021 ĉe www.pola-retradio.org

En la hodiaŭa Trarigardo de la E-Gazetaro ni foliumas la decembran, 5-an numeron de „Esperantolehti” kaj la oktobran numeron de „La Revuo Orienta”. Kun nia kolego, d-ro Maciej Jaskot ni interparolas pri lia pandemifrukto, nova libro pri lernado de la hispana lingvo por poloj. La komencaj aktualaĵoj rilatas al omaĝataj nunjare elstaraj poloj kaj eventoj, la tiel nomataj Patronoj de 2021 kaj al la nunjaraj laŭreatoj de la premio Benemerenti. Ni prezentas ankaŭ la kronvirusan kronikon. Niaj sciencbultenaj temoj koncernas la 2021-an kiel Jaron de Kavernoj kaj Karsto kaj la esplorojn de usonaj sciencistoj pri iu el la aspektoj, kiel la legado influas la homan cerbon. Muzike akompanas nin Rell per fragmento de sia kanto „Dancu la mondo”. La interreta foto ĉe nia programinformo prezentas fragmenton de la Ursa Kaverno en la loko Kletno. En unuopaj rubrikoj de nia paĝo eblas daŭre konsulti la paralele legeblajn kaj aŭdeblajn tekstojn el niaj elsendoj, kio estas tradicio de nia Redakcio ekde 2003-a jaro. Bedaŭrinde – pro teknikaj kialoj – ili ankoraŭ ne estas aktualigataj. Tial la aktualajn ĉerpaĵojn – paralele aŭdeblajn kaj legeblajn bv. sekvi per filmetoj ĉe: https://www.youtube.com/channel/UCeJkbvDDmlwesPAl_GmPOEA . La tuta elsendo estas aŭdebla en jutubo ĉe la kanalo: Espero2009: https://www.youtube.com/results?q=pola+retradio&sp=CAI%253D I.a. pere de jutubo, konforme al individua bezono, eblas rapidigi aŭ malrapidigi la parolritmon de la sondokumentoj, transsalti al iu serĉata fragmento de la elsendo.

--------------------------------------------------------------------------------

El la E-Gazetaro_12.01.2021
[2021-01-12]
https://pola-retradio.org/2021/01/el-la-e-gazetaro_12-01-2021/

Rekte antaŭ la Kristnasko atingis la Redakcion du E-periodaĵoj, al kiuj hodiaŭ mi volas doni ioman atenton. Ni komencu de la decembra, kvina numero de „Esperanolehti”. La inaŭguraj vortoj de la prezidanto Tuomo Grundström pensigas la leganton pri la prepozicioj „inter, kontraŭ kaj kun” en la kunteksto de limoj. Liajn ĉi-rilatajn rezonadojn mi konsideras gravaj sojle de la nova jaro, kiu kiel ŝajnas – legante diverslandajn aktualaĵojn – firmigos negativaĵojn ligitajn kun la pandemio. Al pandemio tiukuntekste referencas la aŭtoro mem memorigante: „Limoj inter landoj estas konkretaj. Tion ni dum ĉi tiu jaro 2020 respertis pli konkrete ol plimulto el ni povas memori. Pro la pandemio registaroj strikte limigis internacian trafikon, kaj en multaj ŝtatoj kaj regionan eĉ landan”. Kaj reference al la menciitaj de li limrilataj prepozicioj mi plene konsentas kun lia konkludo: „La ĉelima prepozicio estu ne kontraŭ, sed kun. Trans limo, regiona, nacia, ŝtata, ĉiu ajn, estas io aŭ iu kun kiu ni rilatas. Limoj staras inter ni, kaj interdependeco etendiĝas trans ili. Transpaŝi limojn estas elekti kunecon anstataŭ kontraŭeco. Helpi tion celas nia komunlingva ideo”. La organo de E-Asocio de Finnlando aperigas ĉi-numere ampleksajn fragmentojn de la intervjuo kun Osmo Buller el la reta sezonoj.ru, kiu estis farita okaze de la 70-jariĝo de la eksa Ĝenerala Direktoro de UEA. Sed antaŭ ol Osmo Buller ekspostenis en Roterdamo li komencis sian aktivadon kiel meza esperantisto kaj por ni en E-Redakcio estas ĉiam kortuŝe sekvi lian deklaron, ke al la E-komunumo alkondukis lin kiel radioŝatanton niaj elsendoj de la publika Pola Radio. El la menciita intervjuo multon ni ekscias pri diversaj aspektoj de lia laboro en la CO, sed ankaŭ pri lia ekstermovada politika kaj socia vivo en Finnlando antaŭ kaj post la vivo en Roterdamo. Min, kaj verŝajne multajn aliajn, devas pensigi lia klarvida retrorigardo al momentoj, kiuj kiel kunruliĝantaj ŝtoneroj, alkondukis al la krizo de UEA, en kiu la subtaksado de la CO kaj daŭra malfortigado de ĝi ŝanceligis la forton de la Asocio. Sed Buller ne estas obstina. Li ne kaŝas, ke „pro la pandemio nia kiel ĉiuj aliaj movadoj devis evoluigi virtualajn agadformojn”. Sed samtempe li avertas „Oni tamen ne blindiĝu de ili, ĉar vera sento de kunpartopreno kaj komunumeco kreskas en ĉeestaj renkontiĝoj, kiujn virtualaj surogatoj ne povas anstataŭi”. La citata intervjuo kun Osmo Buller okaze de lia 70-jariĝo en novembro 2020 havas emfazan titolon „Mi ne bezonas penti”. La titolon „Mi fieras pro…. ” mi donus al lia deklaro pri la preferata, ŝatata laboro dum la oficado, kio estis redaktado, kunpensado kun revuredaktoro por la rubriko „Malferme”, „kies ideo – kiel li atentigis malfierinde – lastatempe iel perdiĝis. Tiel ankaŭ pri Gazetaraj Komunikoj, kies lingvon, stilon kaj formon mi ne plu rekonas kiel ion fonditan de mi”. Bedaŭrinde mi devas samopinii kun tiu konstato de Osmo Buller, ke la lingva sinprezento de la GK-oj iĝis forpuŝa, same kiel la nuna lingvouzo de UEA pli ĝenerale”. Sed ne tio estu la fincitaĵo el la intervjuo kun la eksa Ĝenerala Direktoro de UEA. Trankvile filozofiema kaj optimisma estas la konstato: „La vivo iras laŭ unu vojo, kaj mi ne plendas pri la mia. Eĉ se mi spertis en Esperantujo la plej malfeliĉigajn aferojn en mia vivo, mi renkontis vere multe da interesaj kaj bonaj homoj, kiuj pliriĉigis mian vivon. Mi ne bezonas penti”. La revuo de finnaj esperantistoj abundas je multaj gravaj informoj por la komunuma vivo. Mian atenton kaptis la vortoj de tri kantoj en E-vesto – Himno al Patrolando, Kanto de hejmlingvo kaj Ho, mia koro – ĉiuj ludantaj per la korkordoj de amo. Mian korkordon tiklis aldone la omaĝa artikolo honore al Tapio Sormunen, multjara finna aktivulo, kiun antaŭ jaroj mi ofte renkontis okaze de liaj vizitoj en Pollando kaj nia redakcio, pri kiu cetere hodiaŭ ni telefone interŝanĝis rememorojn kun Andreo Pettyn. Preskaŭ samtempe kun „Esperantolehti” la redakcion atinigis la oktobra numero de „La Revuo Orienta”. La periodaĵo de Japana E-Instituto ĉi foje proksimigas en la rubriko „Esperanto kaj mi” la silueton de honora membro de UEA, konata ĉeha aktivulo, eldonisto Petro Chrdle. Mikaelo Bronstejn felietonas pri „La artoj elvivi en la postsoveta Rusio”, kiu verdire traktas la adaptiĝadon de la sovetunia socio al la realo en malkomponiĝanta ŝtatego, kaj enhavas elementojn komunumajn por aliaj landoj, kiuj sendependiĝis disde la sovetunia protekto. La dankvortoj de SASAKI Teruhiro pro la premio Ossaka-2020 ne nur memorigis mian personan renkontiĝon kun la laŭreato, sed krome liveris multajn konojn pri lia riĉa e-ista aktivado post lia deĵorado kiel la universitata lekcianto. Kortuŝe estis konstati korme, ke ankaŭ li apartenis al la radioaŭskultantoj, inter alie de niaj polaj radioprogramoj. Sed kompreneble al la gratuloj ni aliĝas aparte pro lia traduka laboro de japanaj kaj ĉinaj klasikaĵoj en Esperanton! De ĉie venas informoj pri la pandemio. Ilin enhavas novaĵoj hokitaj de Okita, konstanta rubrikestro de „la Revuo Orienta”. Ĉi-foje pri la trankviliga korefiko de la supaperigado de la budhismaj sutroj”.

El la elsendo 12.01.2021. Legas Barbara – 7′ 58″

--------------------------------------------------------------------------------

Ŝatantoj de historio malkovras trezorojn
[2021-01-15]
https://pola-retradio.org/2021/01/satantoj-de-historio-malkovras-trezorojn/

Ŝatantoj de historio el la Historia-Esplora Grupo Wales malkovris sur la tereno de Toruń-distrikto 38 svedajn arĝentajn monerojn el la 16-a/17-a jarcentoj. La esplorata tereno ŝajnis komence ne tro atrakcia, sed iom hazarde retrovita pli frue unu arĝenta monero spronis plian serĉadon. La moneroj, kiuj kuŝis tie de 400 jaroj troviĝis relative malprofunde, ĉar nur 10 centimetrojn sub la grundo kaj ligiĝas kun la svedaj invadoj kontraŭ Pollandon, kadre de kiuj la bataloj okazis ankaŭ en la regiono de Toruń. La moneroj, kiuj estis transdonitaj al la konservisto de historiaj objektoj plej ofte prezentas la bildon de Gustavo la 2-a Aŭgusto, la sveda reĝo en la jaroj 1611-1632. Krome troviĝis inter ili moneroj emisiitaj dum la regado de Vasa-dinastio.

El la elsendo 15.01.2021. Legas Maciek – 0′ 56″

--------------------------------------------------------------------------------

Atlaso de antaŭ 400 jaroj virtuale
[2021-01-15]
https://pola-retradio.org/2021/01/atlaso-de-antau-400-jaroj-virtuale/

La Mazovia Bita Biblioteko, MBB disponigis rete la unikan ekzempleron de la atlaso „Speculum orbis terrae” aŭtorita de Gerard de Jode el la kolekto de la Nacia Muzeo en Varsovio. En la publikaj kolektoj en la mondo troviĝas ĉirkaŭ 50 ekzempleoj de ĉi tiu artverko eldonita en Antverpeno en 1593. En Pollando la dua ekzemplero de la atlaso troviĝas en la Muzeo de Włocławek. La atlaso „Speculum orbis terrae” distingiĝanta per fajna eldona kaj grafika vesto referencanta al la plej bonaj renesancaj imitmodeloj fariĝis la posedaĵo de la biblioteko post la 2-a mondmilito. Kaj kompare al tiu ĉi en Włocławk troviĝas en pli bona stato, kun 80 el inter 86 mapoj kaj 16 tekstopaĝoj. Ĝi prezentas ankaŭ mapojn de Pollando i.a. unu kun portreto de la reĝo Sigismundo la 3-a Vasa. La konservistaj laboroj pri la unika atlaso komenciĝis en 2019. La ĉefa celo de la bitigo estis certigi al ĉiuj virtualan, senpagan foliumadon de la verko de la 17-jarcenta kartografio. La alia pola ekzemplero de la atlaso bitigita en 2009 estas konsultebla nur surloke, en la muzeo de Włocławek. La skanaĵoj de „Speculum orbis terrae” ne ofte aperas rete. Ili estis disponigitaj en la Mazovita Bita Biblioteko kaj dank’ al ĝi troviĝas en Federacio de Bitaj Bibliotekoj, Europeana, Karlsruher VirtuellerKatalog kaj multaj aliaj.

El la elsendo 15.01.2021. Legas Maciek – 1′ 43″

--------------------------------------------------------------------------------

Ĉiuj murteksaĵoj de la reĝo
[2021-01-15]
https://pola-retradio.org/2021/01/ciuj-murteksajoj-de-la-rego/

Printempe de 2021 en la Reĝa Wawel-Kastelo en Krakovo estos prezentita la ekspozicio „Ĉiuj arasoj (murteksaĵoj) de la reĝo. Revenoj 2021-1961-1921”. Ĝi estas pretigita lige kun la 100-jariĝo de ilia revenigo el Sovetunio kaj lige kun la 60-jariĝo de ilia reveno el Kanado. La unuan fojon estos prezentita plena kolekto de la arasoj, inkluzive de la damaĝitaj kaj fragmente konservitaj. La reĝo Sigismundo Aŭgusto mendis ilin en la plej elstaraj teksistaj metiejoj de Bruselo en la jaroj 1550-60. Ili prezentas bibliajn scenojn, riĉan flaŭran kaj faŭnan mondon kaj blazonojn de Pollando kaj Litovio memorigantajn pri la Respubliko de Ambaŭ Nacioj. Komence la kolekto konsistis el 160 objektoj, ĝis nun konserviĝis 138. Preskaŭ ĉiuj troviĝas en Krakovo krom unu en Varsovio kaj la alia en Amsterdamo. La reĝaj murteksaĵoj estis teksitaj el lano, silko kun grandakvanta uzo de arĝentaj kaj oraj fadenoj. Origine ili servis kiel ornamo dum la plej pompaj solenaĵoj de la reĝa kortego. La kolekto de la murteksaĵoj el Wawel-kastelo estas la plej granda en Pollando kaj unu el la plej gravaj en Eŭropo. La reĝajn murteksaĵojn heredis la fratinoj de la reĝo kaj post ilia morto ili fariĝis la proporaĵo de la Pola Reĝolando. En 1795 rusoj forveturigis ilin al Peterburgo, de kie ili revenis baze de la Riga Traktato en 1921. Kelkaj damaĝitaj. Post la eksplodo de la 2-a mondmilito la teksaĵoj estis evakuitaj tra Rumanio, Francio kaj Britio al Kanado, de kie ili revenis postmilite al Wawel-kastelo en 1961.

El la elsendo 15.01.2021. Legas Gabi kaj Barbara – 2′ 21″

--------------------------------------------------------------------------------

Koninda polo – Kazimierz Michałowski
[2021-01-15]
https://pola-retradio.org/2021/01/koninda-polo-kazimierz-michalowski/

La nomon Kazimierz Michałowski ni menciis lastatempe en la felietono de nia egiptia aŭskultanto Michał Łabęda pri la malkovro fare de polaj arkeologoj de Hatŝepsut-templo. Hodiaŭ ni dediĉu la atenton al profesoro Kazimierz Michałowski mem, kiu estas la plej elstara pola egiptologo, la antaŭkuriero de nubiologio, la kreinto de la pola skolo de la meditereanea arkeologio. Dank’ al liaj foslaboroj en Egiptio ne eblas dubigi la kontribuon de la pola arkeologio al la monda scienco. Kazimierz Michalowski naskiĝis la 14-an de decembro 1901 en Tarnopol. Finlerninte en la tiea gimnazio en 1918 li daŭrigis siajn studojn en la Universitato de Jan Kazimierz en Lvovo en la fakultato pri klasika arkeologio kaj arthistorio. Siajn konojn li vastigis en Berlino, Hajdelbergo, Münster, Parizo, Romo kaj Ateno. En la lvova universitato Kazimierz Michałowski doktoriĝis en 1926 fariĝante docento en la katedro pri Klasika Arkeologio de la Lvova Universitato, 4 jarojn poste en la Varsovia Universitato. Ĉi tie en 1931 li organizis Katedron de la Klasika Arkeologio, kiu en 1955 estis alinomita je la Meditereanea. La unuan fojon Kazimierz Michałowski forveturis al Epiptio en 1934. En la jaroj 1936-39 li iniciatis la partoprenon de polaj arkeologiaj esploroj en Edfu en la suda parto de Egiptio, kiujn li gvidis kun francaj arkeologoj. Dum ĉi tiu ekspedicio estis malkovritaj i.a. objektoj el la periodo de Malnova Ŝtato. Jam en 1937 profesoro Michałowski organizis en la varsovia Nacia Muzeo ekspozicion de la atribuitaj al Pollando historiaj trovaĵoj, kiuj vekis enorman interesiĝon de la pola publiko. La junaĝo de Kazimierz Michałowski pasis en la periodo, kiam Pollando estis regajininta sian suverenecon. En la 1918 li rekrutiĝis en la polaj militistaj servoj. Post la studperiodo li revenis en iliajn vicojn en 1920 por denove daŭrgi la sciencistan karieron, restadante kaj avancante en la polaj rezervaj armeaj fortoj. Post la eksplodo de la 2-a mondmilito profesoro Michałowski kiel oficiro fariĝis ostaĝo en la militkaptitejo en la germana Woldenburg. Tiam estis detruitaj liaj manuskriptoj pri la unuaj foslaboroj, aliflanke tie ĉi li gvidis edukkampanjon por kunostaĝuloj kun seminarioj pri egiptologio kaj arkeologio. Post la milito profesoro Michałowski aktive aliĝis al rekonstruo de la scienca vivo de Pollando restante ĝis la vivofino persono politike senpartia. Ekde 1945 li estis membro de la Varsovia Scienca Societo, unu jaron poste li fariĝis membro de la Pola Akademio de Kapabloj, sekve de la Pola Sciencakademio. En 1956 li organizis Instituton de la Meditereanea Arkeologio de la Pola Sciencakademio, kiun li gvidis ĝis sia emeritiĝo komence de la 70-aj jaroj de la pasinta jarcento. Sed la administraciaj devoj ne forlogis profesoron Kazimierz Michałowski de la arkeologiaj esploroj. En la jaroj 1956-59 li gvidis foslaborojn en Mirmeki sur Kriemo en la loko de la antikva greka kolonio. En 1957 li restarigis la arkeologiajn esplorojn en Egiptio, en Tall al-Atrib, kaj por koordini ĉi tiujn laborojn li alkondukis al kreiĝo en 1960 – sub la aŭspicioj de la egipta registaro – de la Stacio (nun Centro) de la Mieditereanea Arkelogio en Kairo, kiun li gvidis ĝis la vivofino kaj taksis kiel sian vivoverkon. La foslaboroj en Tell al-Atrib daŭris 9 jarojn. En ilia daŭro estis malkovritaj malfruromiaj termoj kaj parte rekonstruita impona teatra konstruaĵo, urba komplekso. Sekve de la laboroj de profesoro Michałowski en la antikva Palmira (Sirio), la Malsupra Egiptio kaj Nubio la egipta registaro entreprenis savkampanjon de sanktejoj minancitaj per priinundo post la elkonstruo de Asuana Digo. En sama periodo profesoro Kazimierz Michałowski gvidis sciencajn esplorojn en Aleksandrio (ĝis 1966), kie i.a. estis rekonstruita fragmento de romia kvartalo. En sekvaj jaroj li gvidis malkonstruon de la nubiaj sanktejoj en Daobod (1961) kaj Abu Simbel (1961-1970) kaj laboris pri la rekonstruo de la tomba sanktejo de la reĝino Hatŝepsut en Deir al-Bahari (1961-64). Veran sensacion vekis inter la eksterlandaj esplorekspedicioj lia malkovro de la tempo de Tutmoso la 3-a el la 15-a jarcento antaŭ Kristo. La kreita de profesoro Michałowski pola skolo de la meditereanea arkeologio – kiun oni traktas kiel modelan – ligas foslaborojn, esplorojn kun konservistaj laboroj. En tiu kunteksto menciindaj estas pluraj aliaj, unikaj laŭ la monda skalo, malkovroj. Profesoro Michałowski i.a. difinis la periodon de la elformiĝo de la kanono de la religia arkitekturo en Egiptio kaj apartigis tute novan sciencbranĉon, kiu estas nubilogio. Ĉi-lasta verko ligiĝas kun lia verŝajne plej fama malkovro, nome la elfoso de la granda kopta katedrado en Farras. La pola sciencista ekspedicio montris al la mondo belegan frukristanan bazilikon, episkopan nekropolon kaj palacon. Profesoro Michałowski malkovris en la baziliko spirrabajn murpentraĵojn el la 8-12 jarcentoj post Kristo, kio ebligis dinfini la kristanigon de Nubio je la 6-a jarcento. Post ĉi tiu malkovro la nomo de profesoro Kazimierz Michałowski fariĝis monde konata kaj li akiris nesubfoseblan famon kaj prestiĝon inter polaj kaj eksterlandaj arkeologoj. Parto de freskoj el Faras formas aktuale apartan, unikan en Eŭropo, artgalerion, en la Nacia Muzeo en Varsovio. Ne eblas mencii en mia felietono ĉiujn honordoktorecajn titolojn kaj prestiĝajn postenojn. Ni limiĝu al mencio, ke li estis i.a. eksperto de la speciala komitato ĉe Unesko por la savado de la sanktejoj en Abu Simbel. La sciencista aktvado de profesoro Michałowski kongruis kun liaj neelĉerpeblaj fizikaj fortoj. Ankoraŭ kiel emerito li estris la Katedron de la Meditereanea Arkeologio ĉe la Varsovia Universitato, li sidis en la prezidumo de la Pola Sciencakademio kaj estis membro de multaj sciencaj societoj kaj scienakademioj en Pollando kaj eksterlande. Ne mencieblaj estas en mallonga felietono ĉiuj verkoj de profesoro Michałowski dediĉitaj al arkelogio kaj egiptologio, ĉiuj distingoj kaj honoromaĝoj. Samtempe profesoro Kazimierz Michałowski senlace kaj daŭre aktivis por popularigado de la meditereanea arkeologio, egiptologio prezentante plurajn prelegojn, gvidante seminariojn. Li asertis, ke sciencistoj kaj esploristoj havas la devon dividi kun la socio rezultojn de siaj laboroj. Al la kutimoj de profesoro Michałowski apartenis kunsidoj antaŭ la komenciĝo de la sciencistaj ekspedicioj, en kiuj ĉiuj partoprenantoj devis pruvi konon de fakulaj scioj pri sia laboro kaj post la fino de foslaboroj komune partopreni la prilaboron de publikaĵo pri la finiĝinta laborsezono. Sed profesoro Michałowski ne estis eburstatua figuro. Al miaj familiaj anekdotoj kalkuliĝas la rakonto de miaj gepatroj, kiuj vizitante la Farras-galerion en la varsovia Nacia Muzeo estis alparolitaj de la profesoro. Li entuziasme eksplikis al ili nuancojn de la malkovro en Farras en la maniero kvazaŭ ili estus la plej gravaj aŭskultantoj de liaj klarigoj.

El la elsendo 15.01.2021. Legas Barbara – 11′ 07″

--------------------------------------------------------------------------------

E_elsendo el la 15.01.2021
[2021-01-15]
https://pola-retradio.org/2021/01/e_elsendo-el-la-15-01-2021/

Podkasto: Ludu en nova fenestro | Elŝutu

La 1031-a E_elsendo el la 15.01.2021 ĉe www.pola-retradio.org

Hodiaŭ en la felietono pri koninda polo ni proksimigas la silueton de profesoro Kazimierz Michałkowski, la kreinton de la pola meditereanea arkeologia skolo, egiptologo, nubiologo. En la komencaj kulturtemaj aktualaĵoj ni informas pri bitigo kaj reta disponigo de atlaso de antaŭ 400 jaroj, pri baldaŭ prezentotaj ĉiuj murteksaĵoj de la reĝo Sigismundo Aŭgusto, pri sukcesoj de polaj serĉantoj de historiaj memoraĵoj. En E-komunuma segmento ni donas la atenton al la hispana E-Fondumo kaj ekspozicio en Barcelono, en kiu troviĝas E-rilataj eksponaĵoj. Kiel muzikan ornamon vi trovas en la hodiaŭa elsendo fragmentojn de la kanto „Ploras roz’ degelonta” en la plenumo de Ĵomart kaj Nataŝa kaj de „La plenumo”, kiun kantas la hispana Kvaropo Sinkopo. La hodiaŭan programinformon akompanas interreta foto prezentanta bitigitan atlason de antaŭ 400 jaroj. En unuopaj rubrikoj de nia paĝo eblas daŭre konsulti la paralele legeblajn kaj aŭdeblajn tekstojn el niaj elsendoj, kio estas tradicio de nia Redakcio ekde 2003-a jaro. Portempe ili – pro teknikaj kialoj – ne povas esti aktualigataj. Tial la aktualajn ĉerpaĵojn – paralele aŭdeblajn kaj legeblajn bv. sekvi per filmetoj ĉe: https://www.youtube.com/channel/UCeJkbvDDmlwesPAl_GmPOEA . La tuta elsendo estas aŭdebla en jutubo ĉe la kanalo: Espero2009: https://www.youtube.com/results?q=pola+retradio&sp=CAI%253D I.a. pere en jutubo, konforme al individua bezono, eblas rapidigi aŭ malrapidigi la parolritmon de la sondokumentoj, transsalti al iu serĉata fragmento de la elsendo.

--------------------------------------------------------------------------------

Kresko de vinkonsumado
[2021-01-19]
https://pola-retradio.org/2021/01/kresko-de-vinkonsumado/

Statistika polo drinkas jare 6 litrojn da vino dum ekzemple francoj 50. Malgraŭ tio la pola vinkonsuma merkato estas la plej promesoplena en Eŭropo. Pravigas tion daŭra ĉiujara kresko de la vinvendo je ĉirkaŭ 5-6 procentoj. Laŭ ekspertoj vera vinvenda eksplodo estas antaŭ ni, kio ligiĝas kun la prefero de junaj personoj por vino kaj biero. Tiu ĉi tendenco plej verŝajne firmiĝos, kun kio povos ligiĝi interesiĝo pri vinoj ĉiam pli kostaj. En la lastaj 12 monatoj la vendo de vino en Pollando kreskis je 9 procentoj, kaj oni elspezis por ĝi la rekordan sumon de 3,2 miliardoj da zlotoj ne kalkulante gastronomian sektoron kaj publikajn eventojn. Laŭ la Ĉefa Statistika Oficejo poloj plej ofte konsumas vinon dum manĝoj, dum societumaj eventoj, dum ripoza periodo. La kvanto de la konsumata vino estas konstanta (ĉirkaŭ 4 kalikoj) kaj sendependa de aĝo. Per tio diferenciĝas la konsumado de vino en Pollando rilate al biero kaj vodko. La konsumado de la du lastaj malkreskas kun la altiĝanta aĝo. Poloj preferas ruĝajn, sekajn vinojn (ili konsisitigas 80 procentojn de la vinvendo). Nur poste sekvas vinoj duonsekaj, duondolĉaj kaj dolĉaj. Kreskantan popularecon akiras ŝaŭmvinoj – la itala Prosecco kaj la hispana Cava. Evidentiĝas samtempe, ke poloj en plimulto ne konsideras vinon kiel alkoholaĵon. Kiel alkoholaĵon ili traktas vodkon (89 procentoj) kaj viskion (85 procentoj). Tio sekvas el la enketrezultoj de la esplorinstituto IBRIS.

El la elsendo 19.01.2021. Legas Maciek – 1′ 49″

--------------------------------------------------------------------------------

La unua hinda rinocero en  la vroclava zooĝardeno
[2021-01-19]
https://pola-retradio.org/2021/01/la-unua-hinda-rinocero-en-la-vroclava-zoogardeno/

La 6-an de januaro en la zooĝardeno de Vroclavo enmondiĝis hinda rinocero. Temas pri la filino de Maruŝka kaj Manas, rinoceroj el Ĉeĥio kaj el Francio. En la reta paĝo de la bestoĝardeno troviĝas filmoj pri la akuŝo kaj la unuaj vivmomentoj de la patrino kaj la ido. La sekvo de la 16-monata gravedeco havas enorman signifon por la transdaŭro de ĉi tiuj animaloj, ĉar en naturaj kondiĉoj ilia unusola rifuĝejo estas la Nacia Parko Kaziranga en la Hinda Unio. Bedaŭrinde ĉirkaŭas ĝin loĝkolonioj, vojoj, kultiveblaj kampoj, kio negative influas ĝian funkciadon. Ĝi frontas aktuale ankaŭ la sekvojn de la pandemio kaj de la kresko de la ŝtelĉasado. La hindaj rinoceroj troviĝas nur en 66 bestoĝardenoj de la mondo. En la lasta jaro enmondiĝis sole 7 idoj. La malgranda kvanto de naskiĝoj ligiĝas kun tio, ke la femaloj atingas la seksan maturecon havante 6-8 jarojn, ilia gravedeco daŭras eĉ 16 monatojn kaj la patrinoj flegas la idojn ĉirkaŭ tri jarojn. Kroman problemon konsistigas la bredokostoj ligitaj kun eksteraj moviĝspacoj, basenoj kaj kotaj terenoj. Alian defion kreas la nutrado. La hindaj rinoceroj bezonas ĉirkaŭ 25 kilogramojn da nutraĵoj tage. La vroclava bestoĝardeno de jaroj engaĝiĝas en protekton de hindaj rinoceroj en ilia natura medio en la naciaj parkoj Kaziranga kaj Manas.

El la elsendo 19.01.2021. Legas Maciek – 1′ 48″

--------------------------------------------------------------------------------

135 polaj sciencistoj en la stipendia programo de Mieczysław Bekker
[2021-01-19]
https://pola-retradio.org/2021/01/135-polaj-sciencistoj-en-la-stipendia-programo-de-mieczyslaw-bekker/

135 polaj sciencistoj ricevis stipendiojn de la Nacia Agentejo por la Akademia Interŝanĝo por realigi kunlabore kun eksterlandaj sciencistoj en 26 landoj de la mondo sciencajn projektojn aŭ postdoktoriĝajn staĝojn. En la tria eldono de la stipendia programo, kies patrono estas profesoro Mieczysław Bekker plej multnombraj polaj sciencistoj, ĉar 21 staĝos en usonaj sciencaj centroj. Multnombre ili laboros ankaŭ en Britio kaj en Germanio. Krome en Aŭstralio, Aŭstrio, Belgio, Ĉeĥio, Danlando, Finnlando, Francio, Greklando, Hispanio, Hungario, Islando, Italio, Japanio, Kanado, Koreio, Meksikio, Nederlando, Novzelando, Portugalio, Slovenio, Suda Singapuro, Svislando, kaj Svedio. En la ĝisnunaj tri eldonoj la programon Bekker de la Nacia Agentejo por la Akademia Interŝanĝo oni atribuis stipendiojn al pli ol 400 sciencistoj.

El la elsendo 19.01.2021. Legas Gabi – 1′ 11″

--------------------------------------------------------------------------------

E_elsendo el la 19.01.2021
[2021-01-19]
https://pola-retradio.org/2021/01/e_elsendo-el-la-19-01-2021/

Podkasto: Ludu en nova fenestro | Elŝutu

La 1032-a E_elsendo el la 19.01.2011 ĉe www.pola-retradio.org

En la rubriko „Protekti kontraŭ la forgeso” ni memorigas la arkivan interparolon kun Ludovikito, Ito Kanzi, la kreinto de la 43-voluma komentita verkaro de L. L. Zamenhof, kiun en 2004 dum sia vizito en Japanio faris red. Barbara Pietrzak. La 15-an de januaro pasis lia 103-a naskiĝdatreveno. Komence aŭdiĝas kronvirusa kroniko, kiun sekvas aktualaĵoj pri kresko de vinimporto en Pollando kaj sensacia enmondiĝo de hindia rinocero en la bestoĝardeno de Vroclavo. La sciencbultena temo koncernas pli ol 130 polajn profesorojn, kiuj en 2021 partoprenas eksterlandajn staĝojn. Muzike akompanas nin denove Ĵomart kaj Nataŝa per fragmento de sia plej nova kanto „Ĉiam kunesti”. La interreta foto ĉe nia programinformo prezentas la dorlotulinon de la bestoĝardeno en Vroclavo, hindian rinoceron. En unuopaj rubrikoj de nia paĝo eblas daŭre konsulti la paralele legeblajn kaj aŭdeblajn tekstojn el niaj elsendoj, kio estas tradicio de nia Redakcio ekde 2003-a jaro. Bedaurinde – pro teknikaj kialoj – ili ankoraŭ ne estas aktualigataj. Tial la aktualajn ĉerpaĵojn – paralele aŭdeblajn kaj legeblajn bv. sekvi per filmetoj ĉe: https://www.youtube.com/channel/UCeJkbvDDmlwesPAl_GmPOEA . La tuta elsendo estas aŭdebla en jutubo ĉe la kanalo: Espero2009: https://www.youtube.com/results?q=pola+retradio&sp=CAI%253D I.a. pere de jutubo, konforme al individua bezono, eblas rapidigi aŭ malrapidigi la parolritmon de la sondokumentoj, transsalti al iu serĉata fragmento de la elsendo.

--------------------------------------------------------------------------------

Interparolo kun Ito Kanzi
[2021-01-19]
https://pola-retradio.org/2021/01/interparolo-kun-ito-kanzi/

En la rubriko „Protekti kontraŭ la forgeso” ni memorigas la arkivan interparolon kun Ludovikito, Ito Kanzi , la kreinto de la 43-voluma komentita verkaro de L. L. Zamenhof, kiun en 2004 dum sia vizito en Japanio faris red. Barbara Pietrzak. La 15-an de januaro pasis lia 103-a naskiĝdatreveno.

El la elsendo 19.01.2021 – 8′   07″

--------------------------------------------------------------------------------

Montrezoro el la Jagelona epoko retrovita en Hungario
[2021-01-22]
https://pola-retradio.org/2021/01/montrezoro-el-la-jagelona-epoko-retrovita-en-hungario/

Pli ol 7 mil arĝentajn kaj 4 orajn monerojn retrovis arkeologoj en la vilaĝo Újlengyel, ĉirkaŭ 50 kilometrojn for de Budapeŝto. Ĝi devenas el la 20-aj jaroj de la 16-a jarcento, do el la periodo kiam la reganto estis Ludoviko la 2-a Jagelonido. La ujo estis retrovita en kultivebla grundo proksime al la loko, en kiu en 2019 estis retrovitaj 150 moneroj. La aĉetopovo de la nun retrovita trezoro ebligis en 1520, kiam plej verŝajne la moneroj estis kaŝitaj, aĉeton de sep ĉevaloj, aŭ aktuale de luksa aŭtomobilo. La plej malnova monero estas la romia arĝenta denaro kun la vizaĝo de la cezaro Lucius Verus reginta en la jaroj 161-169. La plej novaj ligiĝas kun la regado de Ludoviko la 2-a Jagelonido, kiu regis en Hungario en la periodo 1508-1956 kaj ekde 1509 estis ankaŭ la reĝo de Ĉeĥio. La oraj moneroj troviĝintaj sub la dua fundo devenas el la tempo, kiam regis Matiaso la 1-a. Estis trovita ankaŭ monero emisiita de papo Pio la 2-a. Laŭ la hipotezo de la laborantoj de Ferenczy-muzeo la kaŝo de moneroj ligiĝis kun la tiuperioda turka invado, kaŭzinta i.a. faligon de la Jagelona dinastio.

El la elsendo 22.01.2021. Legas Barbara kaj Maciek – 1′ 37″

--------------------------------------------------------------------------------

Nova eldonaĵo de polaj tataroj
[2021-01-22]
https://pola-retradio.org/2021/01/nova-eldonajo-de-polaj-tataroj/

Muzulmana Religia Asocio en Pollando eldonis albumon „Muhiry. Tataraj religiaj bildoj”. Ĝi enhavas fotojn de 50 ornamaj afiŝoj aŭ teksaĵoj – plej ofte kun citaĵoj el Korano – devenantaj el moskeoj kaj preĝodomoj de polaj islamanoj, el la muzeaj kaj privataj kolektoj. Polaj tataroj pendigas tiujn objektojn interne de moskeoj, preĝodomoj kaj siaj hejmoj kredante pri ilia protekta efiko kontraŭ malbonaĵoj. Samtempe ĉi tiuj objektoj atestas pri pieco de ĝiaj posedantoj kaj aŭtoroj. En ili aperas, kutime broditaj aŭ skribitaj, citaĵoj el Korano kaj ankaŭ religiaj konstruaĵoj kun aparta signifo. Ĉion ĉi akompanas kaligrafiaĵoj, ornamoj geometriaj, plantaj, arkitekturaj, muzulmanaj. Plej ofte temas pri „szahada”, la kredokonfeso. La kutimo pretigi ĉi-specajn religiajn bildojn aperis en la tatara socio loĝanta en la pola-litova limregiono lime de la 18-a kaj 19-a jarcentoj kaj daŭras ĝis hodiaŭ. Por krei ilin plej ofte oni uzis paperon aŭ dikpaperon aplikante guaŝon aŭ inkon, en la 20-a jarcento afiŝkolorigilojn, akvarelojn, kolorkrajonojn. Ofte renkontataj estis la brodaĵoj. La albumo koncernanta ĉirkaŭ 5 milmembran tataran socion en Pollando enhavas informojn pri la genezo de ĉi tiuj religiaj teksaĵoj, pri iliaj tipoj kaj kreoteknikoj kun la indiko de lokoj el kiuj ili devenas.

El la elsendo 22.01.2021. Legas Barbara kaj Maciek – 1′ 46″

--------------------------------------------------------------------------------

Historiaj kostumoj en la Tatry-montara Muzeo
[2021-01-22]
https://pola-retradio.org/2021/01/historiaj-kostumoj-en-la-tatry-montara-muzeo/

En la Tatry-montara Muzeo en Zakopane trovigas ĉirkaŭ du kaj duona mil objektoj, kiujn konsisitigas diversaj elementoj de popolaj kostumoj. En plimulto temas pri vestoj de montaranoj el Podhale-regiono, sed estas ankaŭ inter ili kostumoj en la regionoj Orawa kaj Spisz. Antaŭnelonge finiĝis la konservistaj laboroj pri 42 elementoj de tiuj historiaj kostumoj, el inter kiuj la plej malnovaj devenas el la fino de la 18-a jarcento. Temas pri ŝafpeltoj, korsaĵoj, jupoj, ĉapoj, manteloj. La popolaj montaranaj vestoj estas kolektataj en la Tatry-montara Muzeo ekde 1889-a jaroj. La plej malnovan kolekton konsisitigas 50 elementoj de la virinaj festaj vestoj el la loko Czortsztyn, kiun donacis al la muzeo grafo Stanisław Drohojewski. La muzeo planas prezenti kolekton de la montaranaj kostumoj al la vasta publiko en 2023, en restaurota ĉefa sidejo de la muzeo.

El la elsendo 22.01.2021. Legas Barbara kaj Maciek – 1′ 09″

--------------------------------------------------------------------------------

E_elsendo el la 22.01.2021
[2021-01-24]
https://pola-retradio.org/2021/01/e_elsendo-el-la-22-01-2021-2/

Podkasto: Ludu en nova fenestro | Elŝutu

La 1033-a E_elsendo el la 22.01.2021 ĉe www.pola-retradio.org

Hodiaŭ en la felietono pri koninda Pollando ni felietonas pri laŭvica historia parko de Varsovio, la kreiĝinta en la 17-a jarcento Krasiński-Ĝardeno. La komencaj kulturtemaj aktualaĵoj informas pri retrovita montrezoro de Jagelonoj en Hungario, pri rekonstruitaj kaj baldaŭ prezentotaj rekonstruitaj kostumoj de polaj montaranoj en Zakopane, pri nova eldonaĵo de polaj tataroj. En la E-komunuma segmento ni referencas al laŭvica mesaĝo de UEA al UN, ĉi-foje lige kun Internacia Tago de Edukado. En la rubriko „Minutoj kun literaturo” ni aŭdigas la poeziaĵon de Erik Blomberg „Mallumon ni ne timu” en E-traduko de Sten Johansson el la januara numero de „Ora Ĵurnalo”, la periodaĵo de la Gotenburga E-Societo. Muzike ni omaĝas la forpasintan Morice Benin, memorigante lian kanzonon „Kantados mi post mia mort’” el la KD „In’ Spir” eldonita de Vinilkosmo. La programinformon akompanas foto kun elemento de la tradicia montarana vira vesto. En unuopaj rubrikoj de nia paĝo eblas daŭre konsulti la paralele legeblajn kaj aŭdeblajn tekstojn el niaj elsendoj, kio estas tradicio de nia Redakcio ekde 2003-a jaro. Portempe ili – pro teknikaj kialoj – ne povas esti aktualigataj. Tial la aktualajn ĉerpaĵojn – paralele aŭdeblajn kaj legeblajn bv. sekvi per filmetoj ĉe: https://www.youtube.com/channel/UCeJkbvDDmlwesPAl_GmPOEA . La tuta elsendo estas aŭdebla en jutubo ĉe la kanalo: Espero2009: https://www.youtube.com/results?q=pola+retradio&sp=CAI%253D I.a. pere en jutubo, konforme al individua bezono, eblas rapidigi aŭ malrapidigi la parolritmon de la sondokumentoj, transsalti al iu serĉata fragmento de la elsendo.

--------------------------------------------------------------------------------

E_elsendo el la 26.01.2021
[2021-01-26]
https://pola-retradio.org/2021/01/e_elsendo-el-la-26-01-2021/

Podkasto: Ludu en nova fenestro | Elŝutu

La 1034-a E_elsendo el la 26.01.2011 ĉe www.pola-retradio.org

Hodiaŭ ni proponas en la literatura segmento de la elsendo la 105-an fragmenton de la romano de Henryk Sienkiewicz „Quo Vadis” en la E-traduko de Lidia Zamenhof. La komencaj aktualaĵoj koncernas pandemion. Krom la kronvirusa kroniko ni informas pri la kostoj, kiujn portis poloj por adaptiĝi al la distanca laboro. Niaj sciencbultenaj temoj informas pri eksterlandaj sciencistoj kiel gastprofesoroj en Pollando en 2021 kaj pri poloj, inter du procentoj de la plej ofte citataj sciencistoj en 2019. La interreta foto akompananta la programinformon prezentas historian konstruaĵon de la Universitato de Adam Mickiewicz en Poznano, la tn. Colegium Maius. Muzike akompnas nin Manŭel per la fragmento de sia kanto „La lamento de la Tero”. En unuopaj rubrikoj de nia paĝo eblas daŭre konsulti la paralele legeblajn kaj aŭdeblajn tekstojn el niaj elsendoj, kio estas tradicio de nia Redakcio ekde 2003-a jaro. Bedaŭrinde – pro teknikaj kialoj – ili daŭre ne povas esti aktualigataj. Tial la aktualajn ĉerpaĵojn – paralele aŭdeblajn kaj legeblajn bv. sekvi per filmetoj ĉe: https://www.youtube.com/channel/UCeJkbvDDmlwesPAl_GmPOEA . La tuta elsendo estas aŭdebla en jutubo ĉe la kanalo: Espero2009: https://www.youtube.com/results?q=pola+retradio&sp=CAI%253D I.a. pere de jutubo, konforme al individua bezono, eblas rapidigi aŭ malrapidigi la parolritmon de la sondokumentoj, transsalti al iu serĉata fragmento de la elsendo.

--------------------------------------------------------------------------------

Kromaj kostoj ligitaj kun la distanca laboro
[2021-01-27]
https://pola-retradio.org/2021/01/kromaj-kostoj-ligitaj-kun-la-distanca-laboro/

Laŭ la esploroj de Personnel Service 41 procentoj de personoj laborantaj distance portis kromajn kostojn ligitajn kun organizo de la hejma laborspaco, do aĉeto de skribotablo, taŭga seĝo, tekokomputilo aŭ presilo. Plimulto de firmaoj ne redonis al siaj laborantoj tiujn kostojn. Laŭ la esploroj plej ofte (64 procentoj) tiujn kostojn portis personoj inter la 18-a kaj la 24-a vivojaroj. En la aĝogrupo inter la 25-a kaj la 34-a vivojaroj tiujn elspezojn faris 28 procentoj de la enketitoj. Nur 4 je 10 labordonantoj partoprenis en la financado de laborinstrumentoj necesaj por la distanca laboro. Ankoraŭ malpli, ĉar nur 17 procentoj parte kovris la kostojn de la monata interreta ligo aŭ kurento, kiujn elspezis personoj distance laborantaj.

El le elsendo 26.01.2021. Legas Milada – 1′ 17″

--------------------------------------------------------------------------------

Gaststaĝoj de eksterlandaj sciencistoj en polaj altlernejoj
[2021-01-27]
https://pola-retradio.org/2021/01/gaststagoj-de-eksterlandaj-sciencistoj-en-polaj-altlernejoj/

La Nacia Agentejo de Akademia Interŝanĝo decidis pri la unua eldono de la programo „Gaststaĝoj”. Kadre de ĝi en polaj altlernejoj lekcios kvin sciencistoj kun internacia renomo. Kiel gastprofesoroj ili povos gvidi 3-4 jarajn sciencajn esplorojn kaj didaktikajn okupojn kaj la agentejo certigas al ili stipendiojn kun la suma valoro de unu miliono 410 mil zlotoj. Profesoro Emilian K. Kavalski el Ĉinio en la krakova Jagelona Universitato realigos la projekton pri internaciaj rilatoj sub la titolo „Lanĉante ordon en la epoko de socikirliĝoj”. Profesoro Francis Harvey el Germanio gvidos en la Varsovia Universitato okupojn pri la temo: „Lokoj, Homoj, Eventoj: Novumaj esploroj koncerne spacan homsciencon por helpi interpretadon kaj klarigadon”. Profesoro Guillaume Thierry el Britio en la poznana Adam Mickiewicz-universitato koncentriĝos pri projekto rilatanta al dulingveco „Liberigo de la povo de fremda lingvo – kogna bazo por efiko de la fremda lingvo kaj por la strategia lingvouzo”. Profesoro Robert Rollinger el Vieno en la Universitato de Vroclavo okupiĝos pri esplorprojekto rilate al proksimorientaj imperioj „De Aĥemenida regado ĝis la romia: imperio en la kunteksto – procezoj de longa daŭro”. Fine profesoro Georgiy Kasianov el Ukrainio en la Universitato de Maria Curie-Skłodowska en Lublino gvidos okupojn pri la analizo de historia politiko en la nuntempa Eŭropo kaj ĉirkaŭaĵo. „La serĉado de pasinteco: Historia Politiko en Unuiĝinta Eŭropo kaj ĉirkaŭaĵo (aktoroj, agadoj, sekvoj / fino de la 80-aj jaroj – 2020).

El le elsendo 26.01.2021. Legas Maciek – 1′ 52″

--------------------------------------------------------------------------------

Polaj sciencistoj inter du procentoj de la plej ofte citataj
[2021-01-27]
https://pola-retradio.org/2021/01/polaj-sciencistoj-inter-du-procentoj-de-la-plej-ofte-citataj/

Stanford University, la eldonejo Elsevier kaj la firmao SciTech Strategies publikigis en „PLOS Biology” liston de du procentoj de sciencistoj, kies prilaboraĵoj estas plej ofte citataj en la scienca literaturo. Inter ili estas 726 sciencistoj el Pollando. La listo ĉirkaŭprenas preskaŭ 160 mil specialistojn el 22 branĉoj dividitaj je 176 pli detalaj specializoj. La aŭtoroj de la rangolisto konsideris la atingaĵojn de esploristoj el ilia tuta vivo ĝis 2019. Inter polaj sciencistoj plej ofte estis citataj laboraĵoj de la ne plu vivanta profesoro Zdzisław Pawlak el la Varsovia Universitato, specialisto pri matematiko kaj informadiko. Li akiris 1827-an lokon. Pliajn lokojn okupis profesoro Tomasz Dietl el la Fizika Instituto de la Pola Sciencakademio, kemiistino, profesorino Elżbieta Frąckowiak el la Poznana Politekniko, ne plu vivanta kuracisto kaj sciencisto profesoro Andrzej Szczeklik, kemiisto kaj fizikisto el la Militista Teknika Akademio en Varsovio profesoro Antoni Rogalski, profesoro Tadeusz Robak hematologo el la Medicina Universitato en Lodzo. La rangolisto kreiĝis baze de komplika algoritmo, konsideranta i.a. indicon de Hirsch, aplikatan ekde 2005.

El le elsendo 26.01.2021. Legas Maciek – 1′ 26″

--------------------------------------------------------------------------------

Polaj grafikistoj premiitaj de EX LIBRIS Grafica Italiana
[2021-01-29]
https://pola-retradio.org/2021/01/polaj-grafikistoj-premiitaj-de-ex-libris-grafica-italiana/

Polaj grafikistoj fariĝis laŭreatoj de la internacia konkurso EX LIBRIS Grafica Italiana. La unuan egalrangan titolon kun Polina Kapurnika el Italio akiris Ryszard Baloń kaj Wiesława Kurdek. La duan premion akiris Natalia Leszczyńska egalrange kun Emilio Carrasco el Meksikio. Ĉiuj polaj laŭreatoj estas ligitaj kun la urbo Stargard. Ryszard Baloń gvidanta stablajn okupojn pri grafiko en la loka Junulara Kulturdomo estas diplomito de la Ŝtata Liceo de Plastikaj Artoj en Szczecin kaj de Supera Pedagogia Lernejo en Opole. Li praktikas pentroarton, aplikatan grafikon kaj grafikon artan. Ĝis nun li aŭtoris 261 miniaturaĵojn kaj ekslibrisojn. Baloń partoprenis multajn konkursojn kaj ekspoziciojn en Pollando kaj eksterlande. Liaj verkoj troviĝas en la ŝtataj kaj privataj kolektoj i.a. en la Nacia Biblioteko en Varsovio kaj Artgalerio de Ekslibriso en Krakovo. Krome en Muzeo de Ravensbrück, en la Artgalerio en Sint Niklaas en Belgio, Frederikshavn en Danlando, Nancy en Francji, ĉe la Fondaĵo de la Barono Taylor en Francio kaj en la Artmuzeo en Senigalia, Italio. Ekde 1969 Ryszard Baloń laboras kun instruistoj de plastikaj artoj kiel arta konsilanto kaj konsultanto.

El la elsendo 29.01.2021. Lagas Maciek – 1′ 34″

--------------------------------------------------------------------------------

Sovaĝa abelbredado en Unuesko-listo
[2021-01-29]
https://pola-retradio.org/2021/01/sovaga-abelbredado-en-unuesko-listo/

En la reprezenta listo de Nemateria Kulturheredaĵo de Unesko aperis meze de decembro la kulturo de la sovaĝa abelbredado el Pollando. Temas pri la dua en la listo subjekto el Pollando apud la krakovaj Kristnaskaj Kripetoj. La proponon kunprezentis antaŭ tri jaroj Pollando kaj Belorusio. kulturo de la sovaĝa abelbredado ĉirkauprenas konojn, kapablojn, praktikojn kaj kredojn ligitajn kun la bredado de sovaĝaj abeloj en la vivaj aŭ en forhakitaj arbotrunkoj. Ĝi estas perata de generacio al generacio baze de familia konotransdonado kaj agado de societoj okupiĝantaj pri arbara bredado de sovaĝaj abeloj. La abelbredistoj okupiĝas pri abeloj en maniero aparta kreante al ili vivkondiĉojn laŭeble plej fidelajn al la naturaj, ne intervenante en ilian vivociklon nek klopodante pri akiro de pli intensa mielrikolto. Ĉi-speca protekta zorgo spegulas la praktikon de harmonia kunvivado de homo kun la naturo.

El la elsendo 29.01.2021. Lagas Maciek – 1′ 11″

--------------------------------------------------------------------------------

La 50-jariĝo de la decido rekonstrui la Reĝan Kastelon
[2021-01-29]
https://pola-retradio.org/2021/01/la-50-jarigo-de-la-decido-rekonstrui-la-regan-kastelon/

La 26-an de januaro en la Granda Salonego de la Reĝa Kastelo en Varsovio okazis solenaĵo memore al la 50-jariĝo de la decido pri la rekonstruo de la Reĝa Kastelo kaj de la unua historia kunsido de la Civitana Rekonstrukomitato. Ĝi komenciĝis akurate je la 11.15, je la horo, kiam la horloĝo la kastela turo ĉesis funkcii pro la pribombado de germanoj. Tiu horo fantomis ĝis kiam la invadinto tutece ne detruis la kastelon eksplodiginte ĝin. La jubileaj solenadoj estas planitaj por 4 jaroj. En 2024 pasos la 50-a datreveno de la redono de la konstruaĵo en la kruda stato kaj la 40-a datreveno de la transdono de la Kastelo al la publiko. Dum tiu periodo estos organizataj eventoj referencantaj al la historia pasinteco kaj popularigantaj la nunan rolon de la Kastelo. Ekde la 2-a de septembro 1980 la Reĝa Kastelo kune kun la tuta Malnovurba Kvartalo de Varsovio troviĝas sur la Listo de la Monda Heredaĵo de Unesko.

El la elsendo 29.01.2021. Lagas Barbara – 1′ 26″

--------------------------------------------------------------------------------

Koninda polo – d-ro Seweryn Gałęzowski
[2021-01-29]
https://pola-retradio.org/2021/01/koninda-polo-d-ro-seweryn-galezowski/

La 25-an de januaro pasis la 200-a naskiĝdatreveno de Seweryn Gałęzowski talenta pola kirurgo, sciencisto. Konsiderata kiel elstara pola elmigra aktivulo post la falo de la kontraŭcara Novembra Insurekcio sendube li povas interesi unuavice polojn aŭ interesiĝantojn pri pola historio. Sed iu aparta epizodo en lia biografio inklinis nin doni kelkan atenton al lia interesa figuro en nia hodiaŭa felietono. La deriviĝanta el la pola nobela familio Seweryn Gałęzowski en 1824 diplomitiĝis pri medicino, kirurgio kaj akuŝa arto en la Vilna Universitato baze de la disertacio „De variola mitigata”. Baldaŭ poste li fariĝis asistanto en ĝia Ĥirurgia Kliniko, kaj vicrektoro. Kelkaj sukcesaj kuracprocedoj alportis al li famon de talenta kirurgo. La plej sensacia estis la kazo kuraci blindecon sekve de la ekstrakto de la putriĝinta dento. Pliaj kuracistaj sukcesoj fruktis per la kruco de s-ta Vladimiro, atribuita de la militista gubernatoro de la Pola Reĝolando, Konstanty. La nomumon por la kirurgia katedro en Varsovio d-ro Gałęzowski tamen ne akceptis. Malgraŭ tio en 1828 la fakultata konsilio direktis lin profundigi kirurgiajn studojn kaj konatiĝi kun la organizo de klinikoj en Germanio, Britio, Francio kaj Italio. Eksciinte en Napolo pri la eksplodo de la kontraŭcara Novembra Insurekcio Sewryn Gałęziowski revenis al la lando fariĝinte konfidoplena kunlaboranto de la insurgenta Nacia Registaro. Lia tasko estis la gvidado de la milita hospitalo en Varsovio. Pro la protekto super la vunditoj li ricevis la Oran Krucon Virtuti Militari. Post la falo de la insurekcio d-ro Gałęzowski forveturis al Berlino kaj Getingo fariĝante intima kunlaboranto de Karl Ferdinand Graefe kaj Philipp Franz Walther, publikigante artikolojn en la redaktata de ili „Revuo de Kirurgio kaj Oftomatologio”. Tamen persekutsekvata de rusaj spionoj serĉantaj ĉe li la akton de sentronigo de la rusa caro kiel la kapo de la Pola Reĝolando li en 1834 forveturis al Meksikio. Tie li transprenis la postenon de kuracisto en la gvidata de germanoj minejo de arĝento en Angangueo. Du jarojn poste li translokiĝis al la urbo Meksiko, fariĝante la kunestablinto de la loka universitato kaj ĝia kuracista fakultato. En Meksiko d-ro Seweryn Gałęzowski gvidis ĝuantan grandan estimon privatan kuracistan praktikon. Malgraŭ tio du tagojn semajne li destinadis al la senpaga kuracado de la povra indiana loĝantaro. Kelkfoje li miris, ke en la lando de daŭraj konfliktoj kaj ne kaŝeblaj banditekscesoj neniam li estis atakita. Evidentiĝis, ke la loka loĝantaro dankeme gardestaris laŭe de liaj vojoj, zoris pri lia havaĵo kaj gastejoj en kiuj li laŭvoje haltis. La sukcesa kuracista praktiko ebligis al d-ro Gałęzowski bonstatiĝi. Li kuracis sukcese ankaŭ i.a. usonajn generalojn havante kun ili rektajn kontaktojn dum la kunsidoj de la Medicina-Kirurgia Akademio en Novjorko. Li eĉ entreprenis klopodojn pri akiro de la usona civitaneco, sed en 1848 je la informoj prirevolucioj en Eŭropo, la t.n. Printempo de la Popoloj li revenis al la malnova kontinento. Li persone maltrafis la revolicieventojn renkontinte tamen en Parizo novajn elmigrintojn en Pollando. Demokrato laŭkonvinke, identiĝanta kun neniu partia frakcio, d-ro Seweryn Gałęzowski lasis la kuracistan praktikon. Siajn zorgojn kaj klopodojn li dediĉis al la pola lernejo Batiniol en Parizo. Li savis ĝin kontraŭ bankroto kaj organizis laŭ nova maniero. D-ro Seweryn Gałęzowski mortis en sia pariza loĝejo la 31-an de marto 1878 kaj eterne ekripozis en la tombjo Père-Lachaise.

El la elsendo 29.01.2021. Lagas Barbara – 5′ 56″

--------------------------------------------------------------------------------

E_elsendo el la 29.01.2021
[2021-01-29]
https://pola-retradio.org/2021/01/e_elsendo-el-la-29-01-2021/

Podkasto: Ludu en nova fenestro | Elŝutu

La 1035-a E_elsendo el la 29.01.2021 ĉe www.pola retradio.org

Hodiaŭ en la felietono pri koninda polo ni parolas pri d-ro Seweryn Gałęzowski en lia 200-jara naskiĝdatreveno aparte en la kunteksto de lia aktivado en Meksikio, kie li estis kunestablinto de la universitato en Meksiko-urbo kaj senhonoraria kuracisto de la indiĝenta loĝantaro. Nia komenca kulturkroniko informas pri plia subjekto el Pollando sur la listo de Kultura Unesko-heredaĵo – la sovaĝa abelbredado, pri historigrava 50-jariĝo de la decido rekonstrui la Reĝan Kastelon en Varsovio, pri polaj grafikistoj premiitaj en Italio. Ni retrorigardas al la pasinta (27.01.2021) datreveno de la liberigo de la germana koncentrejo Auschwitz-Birkenau, la tn. Tago de Holokaŭsto i.a. per referenco al la rilata GK de UEA kaj la poeziaĵo de Julius Balbin „88834”. En la E-komunuma segmento ni peras tristan informon pri la forpaso de elstara litova E-aktivulino, Irena Alijošiūtė kaj informas pri la lastaj aktivadoj de IKUE. Muzike el nia arkivejo ni memorigas la kanton pri altvaloraj aferoj kaj esperoj de Danuta Alczewska-Klus por la esperantigita teksto de Andrzej Pettyn. La programinformon akompanas foto rilata al la bredtradicio de sovaĝaj abeloj en Pollando, kiu nun troviĝas sur la Listo de la Kulturheredaĵo de Unesko. En unuopaj rubrikoj de nia paĝo eblas konsulti la paralele legeblajn kaj aŭdeblajn tekstojn el niaj elsendoj, kio estas tradicio de nia Redakcio ekde 2003-a jaro. Plimulto de la rubrikoj estis en la lastaj tagoj dank’ al Krystyna Grochocka aktualigitaj. Pliaj aktualigoj sekvos en la plej proksimaj tagoj. La tuta elsendo estas aŭdebla en jutubo; Espero2009: https://www.youtube.com/results?q=pola+retradio&sp=CAI%253D I.a. pere en jutubo, konforme al individua bezono, eblas rapidigi aŭ malrapidigi la parolritmon de la sondokumentoj, transsalti al iu serĉata fragmento de la elsendo.

--------------------------------------------------------------------------------

Interparolo kun Kalle Kniivilä
[2021-02-02]
https://pola-retradio.org/2021/02/interparolo-kun-k-kniivala/

Nia hodiaŭa antaŭmikrofona gasto estas Kalle Kniivilä , la redaktoro de Libera Folio. Ni intervjuas lin ne sole pri la Libera Folio, sed ankaŭ pri lia esperantistiĝo, liaj roloj en la E-komunumo, kelkaj privataj aferoj, ĵurnalista profesio kun iu aparta interesiĝo pri rusiaj aferoj.

El la elsendo 02.02.2021 – 17′ 53″

--------------------------------------------------------------------------------

E_elsendo el la 02.02.2021
[2021-02-02]
https://pola-retradio.org/2021/02/e_elsendo-el-la-02-02-2021/

Podkasto: Ludu en nova fenestro | Elŝutu

La 1036-a E_elsendo el la 02.02.2021 ĉe www.pola-retradio.org Nia hodiaŭa antaŭmikrofona gasto estas Kalle Kniivilä, la redaktoro de Libera Folio. Ni intervjuas lin ne sole pri la Libera Folio, sed ankaŭ pri lia esperantistiĝo, liaj roloj en la E-komunumo, kelkaj privataj aferoj, ĵurnalista profesio kun iu aparta interesiĝo pri rusiaj aferoj. La komencaj aktualaĵoj rilatas al demografiaj problemoj de Pollando kaj al la pola Enciklopedio pri filozifio tradukata en la anglan. La sciencbultema temo traktas la aplikon de bakterioj en la servo de la arto. La interreta foto akompananta la programinformon prezentas la unuan, aktualan paĝon de Libera Folio. Muzike akompanas nin Ĵomart kaj Nataŝa per la fragmento de la kanto „Mi kaj vi”. En unuopaj rubrikoj de nia paĝo eblas daŭre konsulti la paralele legeblajn kaj aŭdeblajn tekstojn el niaj elsendoj, kio estas tradicio de nia Redakcio ekde 2003-a jaro. Bv. sekvi ilin en niaj paĝo-rubrikoj. Sondokumentoj el la periodo post la 22-a de aŭgusto 2020 estas plejparte ĝisdatigitaj, sekvaj venos baldaŭ. La tuta elsendo estas aŭdebla en jutubo ĉe la kanalo: Espero2009: https://www.youtube.com/results?q=pola+retradio&sp=CAI%253D I.a. pere de jutubo, konforme al individua bezono, eblas rapidigi aŭ malrapidigi la parolritmon de la sondokumentoj, transsalti al iu serĉata fragmento de la elsendo.

--------------------------------------------------------------------------------

Pola Enciklopedio de Filozofio tradukota en la anglan
[2021-02-02]
https://pola-retradio.org/2021/02/pola-enciklopedio-de-filozofio-tradukota-en-la-anglan/

Dank’ al signifa subteno de la pola edukministerio en la anglan lingvon estos tradukita la 10-voluma Universala Enciklopedio de Filozofio, kreiĝinta ĉe la Katolika Universitato de Lublin (la orienta Pollando). Temas pri la unua ĉi-speca verko en la historio de la pola filozofio. Iniciatis ĝin la plurjara rektoro de la Universitato, prof. Mieczysław Krąpiec. Ĝi kreiĝis en la jaroj 2000-2009 kaj estis pretigita de la Pola Societo de Tomaso el Akvino ligita kun la filozofia medio de la Lublina Katolika Universitato. La Universala Enciklopedio de Filozofio prezentas la bazajn problemojn kaj filozofiajn sistemojn tra la jarcentoj kaj krome enhavas biogramojn de grandaj kreintoj kaj interpretantoj de la filozofia penso. Ĝi konsisitas el 9 volumoj kaj suplemento, pri kiuj laboris ĉirkaŭ 800 sciencistojn el la tuta Pollando. Ĉiu el la volumoj traktas ĉirkaŭ 500 enciklopediajn kapvortojn. Temas pri unu el sep enciklopedioj pri filozofio en la mondo. Kiam oni komencis ĝian prilaboradon ĝi estis inter kvar en la mondo. La unua volumo anglalingve aperos ene de kelkaj monatoj. Kiel oni premisas, ĝi ebligos la filozofian diskurson kun pensuloj en la tuta mondo.

El la elsendo 02.02.2021. Lagas Maciek – 1′ 28″

--------------------------------------------------------------------------------

Pollando frontas demografiajn problemojn
[2021-02-02]
https://pola-retradio.org/2021/02/pollando-frontas-demografiajn-problemojn/

Laŭ la donitaĵoj el la Ĝenerala Elektronika Sistemo de la Registrado de Loĝantoj, PESEL oni notis en 2020 tri rekordojn. La nombro de naskiĝoj, kiu egalis al 357,4 mil estis la plej malalta ekde 2004, samtempe la nombro de la forpasosj estis la plej alta post la 2-a mondmilito kaj egalis al 486,2 mil. La diferenco de 129 mil personoj estas tri kaj duoble pli alta ol en 2019. Laŭ la ministro por la familio, laboro kaj socia politiko, Marlena Maciąg la renversigado de la demografiaj tendencoj estas longdaŭra procezo. Necesas ankoraŭ atendi la rezultojn de la inaŭguritaj en 2016 kelkaj sociaj programoj. Nun en la fina fazo troviĝas pliaj programoj subtenontaj la familion. La demografian situacion en 2020 la gazeto „Dziennik Gazetra Prawna” pravigas aldone per la sekvoj de la kronvirusa epidemio kaj ĝia influo je la sanprotekta sistemo.

El la elsendo 02.02.2021. Lagas Maciek – 1′ 10″

--------------------------------------------------------------------------------

Bakterioj en la servo de  arto
[2021-02-02]
https://pola-retradio.org/2021/02/bakterioj-en-la-servo-de-arto/

La fama Arko de Septimo Severo en Romo sur Forum Romanum estas historia marmora monumento konstruita en 203 jaro honore al al la romia imperiestro kaj liaj filoj Karakalla kaj Geta por memorindigi lian venkon super Partoj. Ĝia riĉa basreliefa ornamaĵo prezentas mitologiajn diojn, personigon de la jarsezonoj kaj scenojn de militekspedicioj. Nun post la paso de 40-jara periodo ĝi estas subigita al restaŭristaj laboroj en kiuj oni aplikas eksperimentan teknikon kun la uzo de bakterion. Aŭtoras ĝin konservisto de antikvaĵoj Alessandro Lugari. La surfaco de la arko estos por kelka tempo kovrita de ĝelotavolo. Pli frue ĉi tiu motodo evidentiĝis efika kaze de pentraĵoj. Se ankaŭ ĉi-foje ĝi alportos pozitivajn rezultojn oni uzos ĝin dum konservistaj laboroj de aliaj historiaj objektoj sur la arkeologia tereno de Koloseo kaj Forum Romanum. La laboroj sur la arko vasta 25 metrojn kaj alta 23 metrojn daŭros 7 monatojn.

El la elsendo 02.02.2021. Lagas Barbara – 1′ 31″

--------------------------------------------------------------------------------

120-jariĝo de la Nacia/Pola Domo en Cieszyn
[2021-02-05]
https://pola-retradio.org/2021/02/120-jarigo-de-la-nacia-pola-domo-en-cieszyn/

Antaŭ 120 jaroj en Cieszyn (la suda Pollando) estis malfermita Pola Domo, kiu fariĝis la centro de poleco en la tuta Cieszyn-silezia regiono. Ĝia historio radikas en la 1496, kiam princo Kazimiro la 2-a kreis en la urbo la novan foirplacon. Tamen la unua historia mencio devenas nur el la 17-a jarcento. Reference al pli nova historio ĝi fariĝis en oktobro 1918 la sidejo de la kreiĝinta Nacia Konsilio de la Princolando Cieszyn, la unua pola organo de la terena administracio. Post la regajno de suvereneco fare de Pollando en la domo, oficiale funkciigita en januaro 1901, okazis pluraj koncertoj, recitaloj, muzikprezentoj, societaj, silvestraj kaj karnavalaj amuzoj. Ili apogis la agadon de multaj polaj institucioj, organizaĵoj kaj societoj, kiuj klopodis pli firme integri la regionon kun la tuta lando. Post la 2-a mondmilito la Nacia Domo, kiun nomon ĝi ricevis post la 1-a mondmilito, denove fariĝis centro de la loka kultura vivo en 1956. Nun ĝi funkcias sub la ŝildo de Cieszyn’a Kulturcentro Nacia Domo.

El la elsendo 05.02.2021. Legas Maciek – 1′ 22″

--------------------------------------------------------------------------------

Religia arto en la Etnografia Muzeo de Tarnów
[2021-02-05]
https://pola-retradio.org/2021/02/religia-arto-en-la-etnografia-muzeo-de-tarnow/

La Etnografia Muzeo en Tarnów – la suda Pollando prezentas ekspozicion, kun malnova kristnana arto kaj religiaj objektoj. Komence ĝi estis disponigita nur rete. La eksponaĵoj devenas el la kolektoj de la muzeo, el la loka Dioceza Muzeo kaj el privataj kolektoj. En la ekspozicio funkcianta ĝis la 31-a de marto la eksponaĵoj estis grupigitaj laŭ apartaj kultureligiaj branĉoj – la orientkristana kaj katolika. Inter objektoj ligitaj kun la orientkristanaj ritoj la atenton kaptas multaj ikonoj kaj ikonoparo el la 18-a jarcento kun Dipatrino kun la Infaneto kaj kun Jesuo Kristo. Aparta kuriozaĵo estas hejmaj krucoj, propraj al la etna grupo „hucuł”, el Orienta Karpatio kaj kolĉenoj el latunaj krucoj, kiuj servis kiel ornamo de la loka tradicia vesto. Al raraĵoj kalkuliĝas stampo por meti ornamon sur oblato, kiun estas ricevantaj kredantoj dum diservo. En la parto dediĉita al la katolika rito troviĝas i.a. bildoj kun Dipatrino el La Salette, el Ostra Brama en Vilno, skulptaĵoj kaj krucoj el diversaj mondopartoj. Aparte atentindaj estas du Hostiujoj el la 15-a kaj 17-a jarcentoj, Krucifikso el perlamonto devenanta el Francio. Krome diversformaj miniaturaĵoj kun la Nigra Madono de Częstochowa kaj krucoformaj relikvujoj. https://muzeum.tarnowpl/aktualnosci/dawna-sztuka-i-przedmioty-sakralne/

El la elsendo 05.02.2021. Legas Maciek kaj Barbara – 1′ 47″

--------------------------------------------------------------------------------

La 60-jariĝo de la artgalerio Faras
[2021-02-05]
https://pola-retradio.org/2021/02/la-60-jarigo-de-la-artgalerio-faras/

La decido, ke ekde la 1-a de februaro denove refunkcias muzeoj kaj kulturinstitutoj gvidantaj la ekspozicifgaleriojn en Pollando – post pli ol unumonata fermo – elvokis veran entuziasmon. Multaj el ni gapis spirdetene al la atendovicoj de artŝatantoj antaŭ la varsovia Nacia Muzeo, al kiuj – konforme al la ĉie videblaj afiŝoj – estis disponigita la Artgalerio de la Antikva Arto. Sendube la vicojn spronis aldone la ebleco viziti ĉiujn ĉi novmaniere aranĝitajn objektojn tute senkoste ĝis la plej proksima dimanĉo. La remmalfermo de la Nacia Muzeo kongruas kun la jubileo, pasinta la 2-an de februaro, la jubileo de la 60-jariĝo de Faras-artgalerio, al kiu artkolekto ni aludis en nia felietono el la mezo de januaro pri la koninda polo, la patro de la pola mediterenea arkeologio, profesoro Kazimierz Michałowski. Ĝuste la 2-an de februaro 1961 la pola arkeologia misio sub lia gvido venis al Faras. Tio okazis reage je la alvoko de la registaroj de Egiptio kaj Sudano kaj krome de Unesko, kiuj petis la internacian socion helpi en la savado de antikvaĵoj, priinundotaj per akvoj de Nilo sekve de elkonstruo de Granda Asuana Digo. La laboroj de la polaj arkeologoj daŭris en la periodo ekde 1960 ĝis 1964. Ili komenciĝis per esplorado de altaĵo kreiĝita pro sabloŝutiĝo. Profesoro Michałowski ne dubis, ke ne temas pri ajna altaĵo, ĉar ĉirkaŭis ĝin kelkdek faraonepokaj ŝtonblokoj. La antaŭsento ne trompis lin, kvankam ne temis – kiel atendite – pri faraonepoka konstruaĵo, sed pli posta katedralo el la kristana epoko de Nubio, el la periodo inter la 7-a kaj 14-a jarcentoj. Tio fariĝis vera mondskala sensacio. La mondaj amaskomunikiloj ĉi tiun malkovron kaj savon de 120 murpentraĵoj – antaŭ ol ili estis priinunditaj de Nilo – difinis kiel „Miraklon el Faras”. Ĝis hodiaŭ tio kalkuliĝas al la plej grandaj sukcesoj de la pola arkeologio de la 20-a jarcento kaj tieaj malkovroj firme pristampis la grandan sciencan karieron de profesoro Kazimierz Michałowski. La ĉefa tasko estis evidente savi savendaĵojn, ĉefe la murpentraĵojn. Sub la protekto de artkonservistoj en la pentraĵojn estis enpremita vakso kun la tn. kalafonio, gazotavoloj kaj lintavoloj. Nun poste sekvis pena fortranĉado de ili disde la muroj. El inter 169 murpentraĵoj oni sukcesis savi 120. Konforme al la interkonsento inter la registaroj de Egiptio kaj Sudano kaj krome de Unesko ĉiuj trovaĵoj estis dividitaj duone. Unu parto restis en la lando en kiu okazis la foslaboroj, la alia trafis al la lando, kiu efektvigis la malkovron. Tio estis bazo por la Artgalerio de Faras en la varsovia Nacia Muzeo. Tamen la restaŭrado kaj konservado de la pentraĵoj daŭris ĝis 1972. Ĉiuj pentraĵoj estis purigitaj, senpolvigitaj kaj ankaŭ ekzamenitaj per ultraviola radiado. La nunjaraj jubileaj eventoj daŭros ĝis aŭtuno. Oni antaŭvidas pubikaĵon kun nekonataj ĝis nun fotoj kaj aliaj arkivaj metarialoj el la periodo de foslaboroj. Estas planitaj rendevuoj kaj podiaj diskutoj kun la partopreno de publiko, diversaj edukaj eventoj adresitaj al infanoj kaj plenkreskultoj. La partoprenon en ili anoncis elstaraj arkeologoj kaj esploristoj de la nubia kulturo el la polaj centroj kaj el eksterlando. Sed krome jam de kelkaj tagoj la vizitantoj de la varsovia Nacia Muzeo povas konatiĝi kun la novaranĝita (post 10 jaroj) Artgalerio de la Antikva Arto. Troviĝas en ĝi ĉirkaŭ 1800 historiaj objektoj de antikvaj civilizacioj de Egiptio, Proksima Oriento, Greklando kaj Romio. Al la plej interesaj apartenas i.a. sarkofago kaj balzamita korpo de pastro Hor Dżehuti kaj mumio de nekonata ivino, kovrita per hieroglifaĵoj papiruso el la Librego de Mortintoj, rita blinda pordo de mastabo, alivorte tomboŝtono de egipta oficisto Izi, portreto de juna knabo el la setlejo Fajum en Egiptio kaj devenanta el Irano ora masko en la formo de virbova kapo.

El la elsendo 05.02.2021. Legas Barbara – 5′ 48″

--------------------------------------------------------------------------------

E_elsendo el la 05.02.2021
[2021-02-05]
https://pola-retradio.org/2021/02/e_elsendo-el-la-05-02-2021/

Podkasto: Ludu en nova fenestro | Elŝutu

La 1037-a E_elsendo el la 05.02.2021 ĉe www.pola-retradio.org La 1-an de februaro en Pollando denove estis refunkciigitaj muzeoj. Kun tio – evidente iom hazarde – koincidis la 60-jariĝo de la fama Artkolekto el Faras en la Nacia Muzeo en Varsovio. Al tio ni donas atenton per aparta felietono en la komenco de la elsendo. Ni daŭrigas per kulturtemaj informoj pri origine virtuala ekspozicio pri religia arto en la Etnografia Muzeo en la urboTarnów kaj pri la 120-jariĝo de la pola centro en Cieszyn, la tn. Pola Domo. La E-komunumaj informoj rilatas al la nunjara Esperantologia Konferenco kaj la plej lasta eldonaĵo de UEA en la serio Oriento-Okcidento, ĉi-foje ankaŭ elŝutebla senpage ĉe persa.trovu.com . La programon finas nia Leterkesta renkontiĝo unuavice ligita kun la demando kiel kaj ĉu – ŝanĝiĝu la varsoviaj E-elsendoj de la Pola RetRadio lige kun ilia proksimiĝanta 10-jariĝo. Muzike ni memorigas la kanton „Liberas la pens’” en la plenumo de Ralph Glomp. La programinformon akompanas foto bildiganta iun el la eksponaĵoj en la artgalerio Faras en la varsovia Nacia Muzeo. En unuopaj rubrikoj de nia paĝo eblas konsulti la paralele legeblajn kaj aŭdeblajn tekstojn el niaj elsendoj, kio estas tradicio de nia Redakcio ekde 2003-a jaro. Plimulto de la rubrikoj estis en la lastaj tagoj dank’ al Krystyna Grochocka aktualigitaj. Tio koncernas la periodon ekde komenco de septembro 2020 kaj fino de januaro 2021. Pliaj tiuperiodaj aktualigoj sekvos en la plej proksimaj tagoj. La tuta elsendo estas aŭdebla en jutubo; Espero2009: https://www.youtube.com/results?q=pola+retradio&sp=CAI%253D I.a. pere en jutubo, konforme al individua bezono, eblas rapidigi aŭ malrapidigi la parolritmon de la sondokumentoj, transsalti al iu serĉata fragmento de la elsendo.

--------------------------------------------------------------------------------

Grandaj teknologiaj firmaoj grandigas sian dominadon
[2021-02-10]
https://pola-retradio.org/2021/02/grandaj-teknologiaj-firmaoj-grandigas-sian-dominadon/

Laŭ la ĵurnalo „Wall Street Journal” la 2020-a jaro kaŭzis, ke la dependeco de firmaoj kaj de privataj uzantoj de la ciferecaj servoj ofertataj de tiaj gigantuloj kiel Apple, Amazon, Facebook, Google aŭ Microsoft aldone kreskis kaj ili firmigis sian dominan pozicion. Tio ligiĝis kun la elspezoj por komputiloj, videoludoj, reta butikumado, reta reklamado kaj nuboservoj por la merkatista sektoro. En la periodo kiam vendejoj kaj flugkompanjoj batalis por transdaŭro la sumaj ensezoj de la kvin plej grandaj firmoj de Usono – Apple, Microsoft, Amazon, Facebook kaj Alphabet kreskis ĝis 1,1 biliono da dolaroj. Por iuj firmaoj la kresko de enspezoj ebligis grandigi la dungitaron. Amazon pasintjare enlaborigis 500 mil novajn laborantojn. Laŭ la ĵurnalo la kresko de la ciferecaj gigantuoj konserviĝos post la kronvirusa pandemio. Kiel asertas la prezidanto de Microsoft la elspezoj por novaj teknologioj duobliĝos tiam ĝis la nivelo de 10 procentoj de la Landa Produkto Brutte.

El la elsendo 10.02.2021. Legas Milada – 1′ 32″

--------------------------------------------------------------------------------

Poloj deziras forigon de la propandemiaj rigoroj
[2021-02-10]
https://pola-retradio.org/2021/02/poloj-deziras-forigon-de-la-propandemiaj-rigoroj/

Laŭ la donitaĵoj de la Esplorevoluiga Centro BioStat prema plimulto de poloj deziras liberigon de la propandemiaj rigoroj. Favore al malfermo de hoteloj kaj restoracioj deklaras sin 87 procentoj de poloj, ne plenaj 10 procentoj asertas, ke ili daŭre estu fermitaj. Preskaŭ 17 procentoj opinias, ke la restoracioj devus funkcii sen ajnaj limigoj, tamen pli ol 34 kaj duona procentoj deklaras sin por observo de distanco kaj maskouzo. Iom pli ol 8 procentoj konstatis, ke la restoraciojn povas viziti sole renasiĝintoj, personoj vakcinitaj aŭ kun negativa testo pri kronviruso. Entute pli ol 69 procennyoj de poloj deklaras la deziron reviziti restoraciojn. Favore al malfermo de vendejgalerioj (kiuj refunkciis ekde la 1-a de februaro) deklaris sin preskaŭ 90 procentoj de la enketitoj. Pli ol 85 procentoj deziras la funkciadon de skiterenoj, preskaŭ 83 procentoj de la respondintoj deklaras sin por funkciado de korplertigaj kluboj, pli ol 73 procentoj por la funkciado de naĝejoj. Pli ol 48 kaj duona procentoj de la respondintoj favoras refunkciigon de la noktaj kluboj kaj dancejoj, tamen laŭ preskaŭ 42 procentoj tiuj distrolokoj restu fermitaj.

El la elsendo 10.02.2021. Legas Maciek – 0′ 51″

--------------------------------------------------------------------------------

Amazoniaj pluvarbaroj minacitaj de plena formorto
[2021-02-10]
https://pola-retradio.org/2021/02/amazoniaj-pluvarbaroj-minacitaj-de-plena-formorto/

La Amazoniaj arbaroj okupas la surfacon de kvin kaj duona milionoj da kvadrataj kilometroj. Tio estas la plej granda pluvarbaro de la Tero kontribuanta al redukto de la aerpoluado kaj reguliganta la globskalan cirkuladon de oksigeno kaj karbono. Ĝi reguligas krome pluvojn tiel helpante al konservo de la dolĉa akvo en la tuta regiono. Multaj sciencistoj deloge prognozis proksimiĝantan malaperon de la Amazoniaj arbaroj, sed neniu antaŭvidis, ke tiu katastrofo proksimiĝos tiom rapide. Profesoro Robert Walker el University of Florida prognozas ke ĝis 2064 la Amazonia pluvarbaro trasformiĝos en sekan ebenaĵon surkreskitan de arbustoj. Tio okazos ne nur pro klimataj transformiĝoj, sed ankaŭ pro la forhakado de arboj laŭ granda skalo. Profesoro Walker longe esploris la vivon de indiĝenaj loĝantoj, kontaktiĝante kun farmistoj kaj arbohakistoj. Konklude li konstatis, ke mizero kaj malbona registara administrado per la bonhavaĵoj definitive alkondukas al troa arbardeficito. Homoj zorgantaj pri vivtenrimedoj ne enzorgiĝas pri biologia diverseco kaj la natura medio. Oni ne sole forhas la arbojn en ĉi tiu regiono, sed lokaj farmistoj ofte bruligas la arbarojn por akiri kultiveblajn grundojn. Aldoniĝas incendioj ligitaj kun la globskala varmiĝo. Tiu problemo draste kreskis en 2019, kiam en aŭgusto de tiu jaro la brazila Nacia Instituto pri la Kosmaj Esploroj notis pli ol 80 mil incendiojn en la tuta lando, je sepdek sep procentoj pli ol en 2018. Walker atentigas, ke la Amazoniaj pluvarbaroj spertis jam sekecsezonojn kaj incendiojn en 2005, 2010 kaj 2015. Oni rimarkas tendencon al pli longdaŭraj kaj pli oftaj sekecperiodoj. Pro tio la arbaroj ne havas tempon por regeneriĝo. Se sekeco en la suda Amazonio plagos ĝin same kiel en la lasta jardeko tio fariĝos tipa fenomeno por ĉi tiu regiono fine de la jarcento. Laŭ Robert Walker la kriza momento povas veni ankoraŭ antaŭ la 2064 jaro.

El la elsendo 10.02.2021. Legas Barbara kaj Pamela – 2′ 34″

--------------------------------------------------------------------------------

La misio PLATO serĉonta ĝemelajn planedojn en 2026
[2021-02-10]
https://pola-retradio.org/2021/02/la-misio-plato-serconta-gemelajn-planedojn-en-2026/

Por la 2026 jaro estas planita starto de la misio PLATO. Kadre de ĝi la Eŭropa Kosma Agentejo serĉos planedojn similajn al la Tero. Polaj inĝenieroj el la firmao SENER projektos, produktos kaj testos aranĝaĵojn helpontajn al integriĝo, al kunligo de la elementoj de ĝia satelito. La ĉefa celo de PLATO (Planetary Transits and Oscillations of Stars) estas esplori la ekstersunajn plandsistemojn, aparte rokajn planedojn orbitantajn ĉirkaŭ steloj similaj al la Suno. Inter malkovrotaj objektoj la Agentejo esperas trovi planedojn similajn al la Tero. La esplorpunkto de la misio estos la virtuala punkto „L2” en la Kosmo troviĝanta en la distanco de unu kaj duona milionoj da kilometroj for de la Tero. La ĉefaj realigantoj de la projekto estas la eŭropa OHB System AG en Bremeno, la franca-itala konsorcio Thales Alenia Space kaj la svisa RUAG Space Switzerland. PLATO vastigos la daŭrantan nun mision de Cheops (the Characterising Exoplanet Satellite), kiu ekde 2019 (du mil dek naŭ) gvidas esplorojn pri ekzoplanedoj en la kosma spaco.

El la elsendo 10.02.2021. Legas Tomek – 0′ 19″

--------------------------------------------------------------------------------

El la E-Gazetaro_10.02.2021
[2021-02-10]
https://pola-retradio.org/2021/02/el-la-e-gazetaro_10-01-2021/

La hodiaŭan trarigardon de la E-gazetaro ni komencu per periodaĵo, kiu aperis jam en novembro 2020, pri kio ni jam siatempe informis. Al „Esperantologio / Esperanto Studies”, nova serio necesas doni iom pli da atento. Kiel atentigas ĝiaj kunredaktoroj Himphrey Tonkin kaj Orlando Raola tiu ĉi revuo pri ĉiuj fenomenoj rilataj al Esperanto estas historia daŭrigo, prefere kiel difinite „la tria manifestiĝo de ĉi tiu revuo”, kies historio komenciĝis jam en la jaro 1948. Kun tiu historio ligiĝas la figuro de konata dana sciencisto Paul Neergaraard kaj la 6 numeroj de la revuo eldonitaj ĝis 1961. La revuon relanĉis en 1999 Christel Kiselman, kiu en la periodo ĝis 2018 redaktis 8 ĝiajn numerojn. La ideo pri la tria manifestiĝo finmaturiĝis dum la kunveno de Centro de Esploro kaj Dokumentado pri Mondaj Lingvaj Problemoj pri nova aranĝo de la revuo kun ĝuste ŝildo de CED. La alia decido estis, ke la nova numero de Esperantologio enhavu referaĵojn de la Esperantologiaj Konferencoj el la lastaj jaroj. Tiu ĉi, kiu troviĝas ĉe mia skribotablo enhavas referaĵojn de la 2014-a. Ĉi tiu unua numero de la nova serio omaĝas aparte la memoron de Detlev Blanke (1941-1918). Ne senkaŭze. Li estis la ĉefa inspiranto de la Esperantogiaj Konferencoj okazantaj kadre de la Universalaj Kongresoj ekde 1978, kiam okazis eĉ tri ĝiaj sesioj en la kongresa programo. Kiel premisis tiam Blanke „La konferenco estos do forumo por jam agantaj esperantologoj kaj servos samtempe kiel stimulilo por aliaj kapabluloj komenci la sciencan studon de Esperanto”. Verdire ekzistas aktoj – eĉ se ne kompletaj – pri la unuopaj Esperantologiaj Konferencoj, sed kiel emfazas Tonkin kaj Raola – „Ni esperas, ke post rekapto de la ritmo de Esperanologiaj Konferencoj la nova „Espeantologio / Esperanto Studies povos ankaŭ …”ludi denove rolon kiel eldonloko de bona esperantologia kontribuado”. Nun kiel dirite la revuon eldonas CED kunlabore kun la eldonejo Mondial. Ĝi aperas rete kaj papare kaj atendas artikolojn ne sole Esperantlingvajn pri lingvosciencaj, historiaj, literatursciencaj, psikologiaj, sociologiaj kaj politikaj aspektoj de Esperanto. Ankaŭ recenzojn. La ĵus traktitan numeron de „Esperantologio / Esperanto Studies” ni ricevis rete, do jen papera periodaĵo, kiu ankaŭ rilatas al novembro 2020. Temas pri la 11-a numero de „La Revuo Orienta” kun bela foto de Aleksandra Wanatuki pri Torijoj en iu el la famaj sanktejoj de Kioto. Ĉi-foje en la rubriko „Esperanto kaj mi” la leganto ekscias pri la esperantistiĝo kaj esperantista vivo de Judith Kovats el Hungario. Pri tute novaj spertoj el la fizika kaj reta okazigo de la 107-a Japana E-kongreso skribas la prezidanto de la kongresa LKK, Yamaguti Sin’iti kaj Hotta Youri el la kongresa komitato. La revuo daŭrigas la temon ligitan kun ainoj trilingve. La leganto i.a. ekscias pri la veneniga efiko de la planto akonito. La alia artikolo ĉi numere rilatas al la esperantigo de ainaj eposoj – jukaroj. Ampleksa artikolo, kun kiu nejapana leganto ekscias el la E-lingva resumo, rilatas al la rolo de franca monako Alphonse Mistler enonduki Esperanton en Japanion. La aŭtoro de ĉi tiu artikolo Moriwaki Yasumasa informas ankaŭ pri sia vizito en la naskiĝloko de la pastro, kiun li faris gvidata de Edmond Ludwig. „La Revuo Orienta” en la novembra numero citas la tekston de Penny Vos pri la Montesoria instrumetodo kaj Esperanto. Okita Kazumi proksimigas la figuron de la nuna japana ĉefministro Suga Yoshihide. Kaj fine la leganto konatiĝas kun nova direktoro de Japana E-INstituto, Aikawa Takuya. Estas interese ekscii, ke li estas koreologo studanta korean literaturon kaj rekono mi legas liajn fierajn vorton pri la partopreno en la multjara tradicio de la profunda amika interrilatao inter koreaj kaj japanaj esperantistoj. Espereble lia deziro verki pri sia studo en Esperanto realiĝos. Tute freŝe kaj ja sendube surprize atingis nin post multmonata, kvankam anoncita silento, la reta, januara numero de „Novaĵoj Tamtamas” de Esperanto Johohama (Hama Rondo). Kune kun la bondeziroj por 2021 venis trankviliga konfeso, ke kvankam „pro la kriza situacio de Kovim-19 nia agado ŝrumpis, tamen kunlernado per la komputila programo Zoom, aŭ en la posta duono, ĉeestaj lernadoj ja okazis. La plej granda afero ĉe ni estas la akiro de la domo por la „muzeo”. Apartan raporton pri ĉi tiu akiro kaj provizora malfermo la 19-an de decembro ni trovas ene de la numero. La oficiala estas planita por la nunjara aprilo. Sed „Novaĵoj Tamtamas” alportas ankaŭ – sendube optimsiman – rakonton el Edo-epoko pri Amabie, japana folklora sireno, kiu forigos epidemion”. Temas pri monstro, kiu ŝajnas esti sireno kun tri piedoj kaj longaj haroj. Nun ĝiaj diversaj kaj buntaj desegnaĵoj aperis enrete kun preĝovortoj por regajni pacan kaj sanan tempon. La foto pri originala teksto estas tradukita en Esperanton. Ni esperu, bonŝancige por ni ĉiuj. Kaj fine mi sole menciu la februaran numeron de „Turka Stelo”, la revueto de la turka esperantistaro. Ne kredu gesinjoroj, ke temas pri la periodaĵo dank’ al kiu ni ekscios iom pli pri la turka E-movado. Temas pri kultura periodaĵo kun kontribuoj de diverslandaj originale verkemaj kaj tradukemaj esperantistoj. Mi sole bedaŭras pro amasaj ne sole tajperaroj, sed ankaŭ redaktaj malpoluroj. Ĉiukaze mi plene ĝuis la kontribuon pri la greka mitologio kun la rakonto pri Leonido veninta el sub la plumo de Spiros Sarafian el Grekio.

El la elsendo 10.02.2021. Legas Barbara – 8′ 34″

--------------------------------------------------------------------------------

E_elsendo el la 10.02.2021
[2021-02-11]
https://pola-retradio.org/2021/02/e_elsendo-el-la-10-02-2021/

Podkasto: Ludu en nova fenestro | Elŝutu

La 1038-a E_elsendo el la 10.02.2021 ĉe www.pola-retradio.org

