E_elsendo el la 01.01.2013
[2013-01-02]
https://pola-retradio.org/2013/01/e_elsendo-el-la-01-01-2013/

Podkasto: Ludu en nova fenestro | Elŝutu

Nova Jaro, novaj kalendaroj ! Pri ili diversfacete ni rakontas komence. Ĉe nia mikrofono en la 190a E-elsendo http://retradio.posterous.com gastas la renkontita aŭtune en Pollando Bill Mak. Arkones estis la okazo aŭdi lian interesan prelegon pri Hongkongo, la renkontiĝo interparoli ankaŭ pri lia laboro.

--------------------------------------------------------------------------------

E_elsendo el la 04.01.2013
[2013-01-04]
https://pola-retradio.org/2013/01/e_elsendo-el-la-04-01-2013-2/

Podkasto: Ludu en nova fenestro | Elŝutu

Ekologia informo el Pollando kaj la alia el Bulgario rilate rekonon por la agado de esperantistoj, novaj kaj malnovaj kutimoj de Epifanio en Pollando, la unua novjara Leterkesto – ĉio ĉi – aŭdiĝas en la 191-a varsovia E-elsendo ĉe: http://retradio.posterous.com .

--------------------------------------------------------------------------------

E_elsendo el la 08.01.2013
[2013-01-08]
https://pola-retradio.org/2013/01/e_elsendo-el-la-08-01-2013/

Podkasto: Ludu en nova fenestro | Elŝutu

Nia programo tradicie enhavas komence aktualaĵojn, temojn el la pola gazetaro kaj sciencan bultenon. Barbara proponas renkontiĝi kun sia antaŭmikrofona gasto renkontita eĉ du fojojn en 2012, laste en Poznano, aŭtune.

--------------------------------------------------------------------------------

E_elsendo el la 11.01.2013
[2013-01-11]
https://pola-retradio.org/2013/01/e_elsendo-el-la-11-01-2013/

Podkasto: Ludu en nova fenestro | Elŝutu

“Mondlingvoj forpasas kaj venas” – tiel titolita prelegaro okazis hieraŭ en la universitato de Helsinki, hodiaŭ ni raportas pri ĝi dank’ al J. Ahomaeki. Krome en la 193 E-elsendo ĉe http://retradio.posterous.com ni invitas al Palmejo de Zielona Góra. Aŭdiĝas E-informoj kaj Leterkesto. Kantas Manuel.

--------------------------------------------------------------------------------

E_elsendo el la 15.01.2013
[2013-01-15]
https://pola-retradio.org/2013/01/e_elsendo-el-la-15-01-2013/

Podkasto: Ludu en nova fenestro | Elŝutu

Mallonga interparolo kun Humphrey Tonkin pri la Belartaj Konkursoj de UEA troviĝas en la programo de la 194a E-Elsendo. Ĉe http://retradio.posterous.com aŭdiĝas krome aktualaĵoj, temoj el la pola gazetaro kaj scienca bulteno. Kantas bjalistokaj gejunuloj, ni aŭskultas kanton el KD de Strika Tango.

--------------------------------------------------------------------------------

E_elsendo el la 18.01.2013
[2013-01-18]
https://pola-retradio.org/2013/01/e_elsendo-el-la-18-01-2013/

Podkasto: Ludu en nova fenestro | Elŝutu

Pri la subtera muzeo de Krakovo funkcianta ekde 2010 vi aŭdas i.a. en la 195-a E-elsendo ĉe http://retradio.posterous.com . Krome audiĝas aktualaĵoj, E-informoj kaj Leterkesto. Kantas Patrick. Lia kanto el la KD Okcitanio eldonita de Vinilkosmo aparte atentigas pri ĝia Promeskampanjo.

--------------------------------------------------------------------------------

E_elsendo el la 22.01.2013
[2013-01-22]
https://pola-retradio.org/2013/01/e_elsendo-el-la-22-01-2013/

Podkasto: Ludu en nova fenestro | Elŝutu

Post aktualaĵoj kaj temoj el la pola gazetaro ni proponas literaturan elsendon. En la 196a programo ĉe http://retradio.posterous.com estas prezentita la 1a parto de la rakonto “Plenkreskuloj kaj infanoj en

--------------------------------------------------------------------------------

E_elsendo el la 25.01.2013
[2013-01-25]
https://pola-retradio.org/2013/01/e_elsendo-el-la-25-01-2013/

Podkasto: Ludu en nova fenestro | Elŝutu

En la 197-a E-elsendo de Pola retRadio aŭdiĝas la 2-a parto de la rakonto “Plenkreskuloj kaj infanoj en Oświęcim” el la rakontaro “Medalionoj” de Zofia Nałkowska. Ni prezentas silueton de la aŭtorino. Krome ĉe http://retradio.posterous.com aŭdiĝas aktualaĵoj kaj E-informo pri skanado de E-gazetoj.

--------------------------------------------------------------------------------

E_elsendo el la 29.01.2013
[2013-01-29]
https://pola-retradio.org/2013/01/e_elsendo-el-la-29-01-2013/

Podkasto: Ludu en nova fenestro | Elŝutu

En 198-a elsendo ĉe http://retradio.posterous.com aŭdiĝas aktualaĵoj. En ĝi apartan atenton ni donas al la vaŝingtona diskuto pri pola oficiro W. Pilecki, la tn. volontulo de Auschwitz. Aŭdiĝas krome temoj el la pola gazetaro kaj scienca bulteno.Kantas Konga Espero kaj Kajto.

--------------------------------------------------------------------------------

E_elsendo el la 01.02.2013
[2013-02-01]
https://pola-retradio.org/2013/02/e_elsendo-el-la-01-02-2013/

Podkasto: Ludu en nova fenestro | Elŝutu

La 98-a UK En Rejkjaviko estas la ĉeftemo de la 199a E-elsendo, en nia interparolo kun KKS, Clay Magalhães. Komence aŭdiĝas aktualaĵoj. Ĉe la adreso http://retradio.posterous.com troviĝas ankaŭ kutima vendrede Leterkesto, la forumo por opiniinterŝanĝo inter la geaŭskultantoj kaj la Redakcio.

--------------------------------------------------------------------------------

E_elsendo el la 05.02.2013
[2013-02-05]
https://pola-retradio.org/2013/02/e_elsendo-el-la-05-02-2013/

Podkasto: Ludu en nova fenestro | Elŝutu

Bruce Crisp, nia aŭskultanto kaj kunlaboranto el Kanado estas la gasto de la 200-a E-elsendo de Pola retRadio. Ĉe la adreso http://retradio.posterous.com aŭdiĝas komence aktualaĵoj, temoj el la pola gazetaro kaj scienca bulteno. Kantas KTP sian kanton el la KD “Plaĉas al mi” eldonita de Vinilkosmo.

--------------------------------------------------------------------------------

E_elsendo el la 08.02.2013
[2013-02-08]
https://pola-retradio.org/2013/02/e_elsendo-el-la-08-02-2013/

Podkasto: Ludu en nova fenestro | Elŝutu

En la leterkesta forumo eĥas la marda, 200-a E-elsendo, sed krome en la 201-a programo aŭdiĝas ĉe http://retradio.posterous.com aktualaĵoj kaj E-informoj. Bildkarto el Pollando prezentas la ruinon de la Reĝa Kastelo en Chęciny.

--------------------------------------------------------------------------------

E_elsendo el la 12.02.2013
[2013-02-12]
https://pola-retradio.org/2013/02/e_elsendo-el-la-12-02-2013/

Podkasto: Ludu en nova fenestro | Elŝutu

Morgaŭ la 2-a Monda Tago de Radio. Lige kun ĝi ni interparolas kun A. Pettyn. Komence ĉe http://retradio.posterous.com aŭdiĝas aktualaĵoj, temoj el la pola gazetaro kaj scienca bulteno. “La estonto estas nun” estas la brazila E-kanto, kiun fragmente ni prezentas en la 202 E-elsendo de Pola retRadio.

--------------------------------------------------------------------------------

E_elsendo el la 15.02.2013
[2013-02-15]
https://pola-retradio.org/2013/02/e_elsendo-el-la-15-02-2013/

Podkasto: Ludu en nova fenestro | Elŝutu

En nia ĉiuvendreda E-elsendo varie eĥas Monda Tago de Radio (13.02) en Leterkesto, aŭdiĝanta en ĝia fino estas pli riĉa. Ĉe la adreso http://retradio.posterous.com aŭdiĝas krome aktualaĵoj kaj E-informoj. Morice Benin kantas la kanzonon “Maristoj de l’ ter’” el sia KD eldonita de Vinilkosmo.

--------------------------------------------------------------------------------

E_elsendo el la 19.02.2013
[2013-02-20]
https://pola-retradio.org/2013/02/e_elsendo-el-la-19-02-2013/

Podkasto: Ludu en nova fenestro | Elŝutu

La gasto de nia 204-a E-elsendo estas ĉi-marde Nuegosh Dube el Varsovio. Pli frue ĉe https://pola-retradio.org aŭdiĝas aktualaĵoj, temoj el la pola gazetaro kaj scienca bulteno. Novan kanton en Esperanto “Valora koncert’” kantas Mélanie Prin. Per ĝi ni salutas ĉiujn geaŭskultantojn lige kun SIA.

--------------------------------------------------------------------------------

E_elsendo el la 22.02.2013
[2013-02-23]
https://pola-retradio.org/2013/02/e_elsendo-el-la-22-02-2013/

Podkasto: Ludu en nova fenestro | Elŝutu

En la 205-a E-elsendo ni komencas novan programciklon pri famaj poloj, alterne aŭdigotan kun felietonoj pri polaj vididaĵoj. Hodiaŭ temas pri Mikołaj Kopernik, lige kun lia 540-a naskiĝdatreveno. Tradicie aŭdiĝas aktualaĵoj, E-informoj kaj Leterkesto. Ĉio ĉi ĉe http://retradio.posterous.com.

--------------------------------------------------------------------------------

E_elsendo el la 26.02.2013
[2013-02-26]
https://pola-retradio.org/2013/02/e_elsendo-el-la-26-02-2013/

Podkasto: Ludu en nova fenestro | Elŝutu

Tradiciaj eroj: novaĵoj, temoj el la pola gazetaro kaj scienca bulteno aŭdiĝas kun tute novaj enhavoj. Eĉ tri E-kantoj en la plenumo de Kajto el Nederlando, Ling el Ĉinio kaj Jacques Yvart en Francio emfazas niajn printempsopirajn atendojn. Ĉio ĉi en la 206-a E-elsendo ĉe http://retradio.posterous.com .

--------------------------------------------------------------------------------

La 6-a de marto – Eŭropa Tago de Justuloj
[2013-03-01]
https://pola-retradio.org/2013/03/la-6-a-de-marto-europa-tago-de-justuloj/

Memori bonon

La 10-an de majo 2012 la plimulto de la eŭropuniaj deputitoj aprobis la skriban deklaracion,  per kiu la 6-a de marto estis starigita kiel Eŭropa Tago de Justuloj , kiu tago instigas ĉiujn uniajn landojn entrepreni diversspecajn iniciatojn favore al memoro de bono.

Proksimigo de individuaj biografioj de homoj, kiuj elpaŝis defende por la homa digno en totalismaj sistemoj aŭ savis la homan vivon dum etnaj purigad­kampanjoj kaj hombuĉadoj estas ne sole memor­ekzerco, sed celas memorigi al ni, ke tiuj homoj suferis por heredigi al la estontaj generacioj la respekton por demokratio kaj plurismo, respekton por aliaj kaj deklaris sin kontraŭ ajna formo de la manipulado kaj mensogoj. Tiuokaze necesas konsideri la demandon, kiun eblas agnoski Justulo , kiucele estas necesa la memoro de bono. Kiel la memoro pri Justuloj instruas la personan respondecon.

La Eŭropa Parlamento subtenis la ideon festi la 6-an de marto kiel Eŭropan Tagon de Memoro pri Justuloj. La omaĝ­admaniero dependas de la unuopaj uniaj landoj. La ideodoninto de la Eŭropa Memortago pri Justuloj estas la itala organizo Komitato de la Monda Ĝardeno de Justuloj, Gariwo. La iniciaton subtenis multaj konataj figuroj, i.a.  en Pollando, kiel la eksa pola ĉefministro Tadeusz Mazowiecki, eksaj estroj de la pola diplomataro – Władysław Bartoszewski kaj Adam Daniel Rotfeld, la prezidanto de la Pola Societo de Justuloj inter la Nacioj de la Mondo, Anna Stupnicka-Bando.

--------------------------------------------------------------------------------

Fiero kaj malespero
[2013-03-01]
https://pola-retradio.org/2013/03/fiero-kaj-malespero/

En la lastaj tagoj la rigardo de poloj estis direktita al la montoĉeno Karakorumo kaj al unu el ĝiaj pintoj Broad Peak lime de Ĉinio kaj Pakistano. Ĝi estas la 12-a laŭ la alteco monto de la mondo situanta 8051 metrojn super la marnivelo.

Kun eksterordinara ĝojo oni notis la informon, ke marde inter la 17-a kaj 18-a horo kvar polaj himalajistoj, kiel la unuaj en la historio – unu post la alia – konkeris ĝin en la vintra sezono. Temis pri 58-jara Maciej Berbeka, 27-jara Tomasz Kowalski, 29-jara Adam Bielecki kaj 33-jara Artur Małek. Bedaŭrinde dum la malsuprenirado, kiun la kvaropo entreprenis tuj por eviti la proksimiĝantan krepuskon, aperis problemoj. Du poloj sukcesis reveni al la baza tendaro, tamen la kontakto kun la du aliaj ŝiriĝis. Merkrede post la rekontrolo de loko, kie ili estis videblaj la lastan fojon oficiale oni rekonis ilin perdiĝintaj. Malgraŭ senĉesaj esperoj la ŝanco por ilia transdaŭro estas minimuma.

--------------------------------------------------------------------------------

E_elsendo el la 01.03.2013
[2013-03-01]
https://pola-retradio.org/2013/03/e_elsendo-el-la-01-03-2013/

Podkasto: Ludu en nova fenestro | Elŝutu

Aktualaĵoj, la vizito en la kretaj subterejoj de Chełm, E-informoj kaj leterkesta forumo – ĉio ĉi estas aŭdebla kaj aŭskultebla en la 207-a E-elsendo de la Pola retRadio ĉe la adreso http://retradio.posterous.com .

--------------------------------------------------------------------------------

E_elsendo el la 05.03.2013
[2013-03-05]
https://pola-retradio.org/2013/03/e_elsendo-el-la-05-03-2013/

Podkasto: Ludu en nova fenestro | Elŝutu

Interparolo kun prof. H. Tonkin referncas al lia prelego pri la nacikulturaj spuroj en la E-tradukado prezentita dum la aŭtuna Malferma Tago. Krome en la 208-a E-elsendo ĉe: http://retradio.posterous.com aŭdiĝas aktualaĵoj, temoj el la pola gazetaro kaj scienca bulteno. Kantas Alejandro Cosavella.

--------------------------------------------------------------------------------

E_elsendo el la 08.03.2013
[2013-03-09]
https://pola-retradio.org/2013/03/165/

Podkasto: Ludu en nova fenestro | Elŝutu

Al la adreso http://www.pola-retradio.com/ estis direktita la 209-a E-elsendo de Pola RetRadio. En ĝi ni proksimigas la silueton de fama polo Ignacy Domeyko, sciencisto aparte meritiĝinta por Ĉilio. Krome aŭdiĝas i.a. E-informoj kaj Leterkesto. Okaze de Tago de Virinoj la redakciajn bondezirojn ornamas muzike Kajto kaj Manuel.

--------------------------------------------------------------------------------

E_elsendo el la 12.03.2013
[2013-03-13]
https://pola-retradio.org/2013/03/e_elsendo-el-la-12-03-2013/

Podkasto: Ludu en nova fenestro | Elŝutu

Vintro revenis al Pollando, tiuokaze al la sukcesoj de pola vintra sporto ni retrorigardas kun red. W. Uaskiewicz. En la 210-a varsovia E-elsendo ĉe https://pola-retradio.org aŭdiĝas aktualaĵoj, temoj el la pola gazetaro kaj scienca bultento. Kantas La Kompanoj.

--------------------------------------------------------------------------------

E_elsendo el la 15.03.2013
[2013-03-16]
https://pola-retradio.org/2013/03/e_elsendo-el-la-15-03-2013/

Podkasto: Ludu en nova fenestro | Elŝutu

Komence de la 211-a varsovia E-elsendo ni prezentas plenmanon da gazetaraj reagoj je la elekto de papo Francisko. Sekve ĉe la elsendoplatformo de Pola RetRadio https://pola-retradio.org ni invitas al la urbo Tychy. Aŭdiĝas E-informoj kaj Leterkesto. Kantas Amindaj.

--------------------------------------------------------------------------------

E_elsendo el la 19.03.2013
[2013-03-19]
https://pola-retradio.org/2013/03/e_elsendo-el-la-19-03-2013/

Podkasto: Ludu en nova fenestro | Elŝutu

La 212-a E-elsendo de la Pola RetRadio ĉe la adreso – https://pola-retradio.org enhavas aktualaĵojn, temojn el la pola gazetaro kaj sciencan bultenon. La informriĉan enhavon interplektas kantoj de la hispana grupo Sinkopo Kvaropo: “Ave Maria”, “En bosko fraksena” kaj “La plenumo”.

--------------------------------------------------------------------------------

E_elsendo el la 22.03.2013
[2013-03-22]
https://pola-retradio.org/2013/03/e_elsendo-el-la-22-03-2013/

Podkasto: Ludu en nova fenestro | Elŝutu

En la 213-a varsovia E-programo ĉe https://pola-retradio.org aŭdiĝas aktualaĵoj, silueto de iu junaĝa polino vivanta en Norvegio, konkerinta korojn de norvegoj. Ni prezentas E-informojn. Fine la Redakcio renkontiĝas kun la geaŭskultantoj kadre de Leteresto. Kantas Miŝo Zdravev kaj Amindaj.

--------------------------------------------------------------------------------

E_elsendo el la 26.03.2013
[2013-03-26]
https://pola-retradio.org/2013/03/e_elsendo-el-la-26-03-2013/

Podkasto: Ludu en nova fenestro | Elŝutu

En la 214a E-elsendo ĉe https://pola-retradio.org aŭdiĝas aktualaĵoj, temoj el la pola gazetaro. Ni prezentas sciencan bultenon kaj felietone rakontas pri la polaj paskaj palmoj kaj komenciĝinta Sankta Semajno. Tiuokaze aŭdiĝas fragmente du polaj pasionaj kantoj. Ene de la elsendo kantas Merlin.

--------------------------------------------------------------------------------

E_elsendo el la 29.03.2013
[2013-03-31]
https://pola-retradio.org/2013/03/e_elsendo-el-la-29-03-2013/

Podkasto: Ludu en nova fenestro | Elŝutu

La 215-a E-elsendo ĉe https://pola-retradio.org ligas parte al la kristana Sankta Semajno kaj Pasko – i.a. per la bildkarta felietono pri la Polaj Kalvarioj. Komence aŭdiĝas aktualaĵoj, ankaŭ E-informoj kaj fine la Redakcio proponas renkontiĝon en la tradicia opininterŝanga forumo – Leterkesto.

--------------------------------------------------------------------------------

E_elsendo el la 02.04.2013
[2013-04-03]
https://pola-retradio.org/2013/04/e_elsendo-el-la-02-04-2013/

Podkasto: Ludu en nova fenestro | Elŝutu

Aktualaĵoj, temoj el la pola gazetaro kaj scienca bulteno konsistigas la informriĉan enhavon de la ĉiumarda E-elsendo de la Pola RetRadio ĉe https://pola-retradio.org En la 216-a E-programo muzike akompanas nin du kantoj de la slovaka pop-roka grupo TEAM – “Volas ni” kaj “Rakonta silentado”.

--------------------------------------------------------------------------------

E_elsendo el la 05.04.2013
[2013-04-05]
https://pola-retradio.org/2013/04/e_elsendo-el-la-05-04-2013/

Podkasto: Ludu en nova fenestro | Elŝutu

Novaj enhavoj en aktualaĵoj politikaj kaj kulturaj, la laŭvica silueto de koninda polo, ĉi-foje J.J. Ignacy Łukasiewicz, E-informoj kaj Leterkesto aŭdiĝas en la 217-a E-elsendo de Pola RetRadio ĉe https://pola-retradio.org

--------------------------------------------------------------------------------

E_elsendo el la 09.04.2013
[2013-04-09]
https://pola-retradio.org/2013/04/e_09-04-2013-2/

Podkasto: Ludu en nova fenestro | Elŝutu

En la 218-a E-elsendo Pola RetRadio audiĝas aktualaĵoj, temoj el la pola gazetaro, sciencaj informoj. La muzika gasto de la elsendo estas la grupo Young Folk Crew el Bjalistoko kreiĝinta ĉe la tiea Zamenhof-Centro. Ĉio ĉe http://retradio.posterous.com kaj samtempe ĉe https://pola-retradio.org .

--------------------------------------------------------------------------------

E_elsendo el la 12.04.2013
[2013-04-12]
https://pola-retradio.org/2013/04/e_elsendo-el-la-12-04-2013/

Podkasto: Ludu en nova fenestro | Elŝutu

La enhavon de la 219-a E-elsendo de Pola RetRadio konsistigas interesa kultura informo, felietono pri la plej malnova kuracloko de Pollando, Cieplice-Zdrój. Aŭdiĝas E-informoj kaj la Redakcio renkontiĝas kun siaj geaŭskultantoj kadre de Leterkesto. Ĉio ĉi estas aŭdebla ĉe la adresoj: http://retradio.posterous.com kaj https://pola-retradio.org .

--------------------------------------------------------------------------------

E_elsendo el la 16.04.2013
[2013-04-16]
https://pola-retradio.org/2013/04/e_elsendo-el-la-16-04-2013-3/

Podkasto: Ludu en nova fenestro | Elŝutu

La marda, 220-a E-elsendo de la Pola RetRadio enhave riĉas per aktualaĵoj, temoj el la pola gazetaro kaj scienca bulteno. Ĉe la adreso: www.pola-retradio.org kantas krome la ensemblo de la Varsovia Politekniko, furorinta dum UK-1987 kaj Supernova (KD de Vinilkosmo).

--------------------------------------------------------------------------------

E_elsendo el la 19.04.2013
[2013-04-19]
https://pola-retradio.org/2013/04/e_elsendo-el-la-19-04-2013/

Podkasto: Ludu en nova fenestro | Elŝutu

Aktualaĵoj, hodiaŭ tutece dediĉitaj al la 70-a datreveno de la eksplodo de insurekcio en la varsovia getto, E-informoj kaj Leterkesto plenigas la enhavon de la 221-a E-elsendo de Pola retradio. Ĝi estas aŭskultebla pere de la adreso: www.pola-retradio.org

--------------------------------------------------------------------------------

E_elsendo el la 23.04.2013
[2013-04-23]
https://pola-retradio.org/2013/04/e_elsendo-el-la-23-04-2013-2/

Podkasto: Ludu en nova fenestro | Elŝutu

La enhavo de la 222-a E-elsendo de la Pola Retradio www.pola-retradio.org konsistas el aktualaĵoj, temoj el la pola gazetaro, sciencaj informoj. En trarigardo de la E-gazetaro estas traktitaj la nunjaraj numeroj de Esperantolehti kaj Norvega Esperantisto. Kantas Jacques Yvart.

--------------------------------------------------------------------------------

E_elsendo el la 26.04.2013
[2013-04-26]
https://pola-retradio.org/2013/04/e_elsendo-el-la-26-04-2013/

Podkasto: Ludu en nova fenestro | Elŝutu

Aktualaĵo, silueto de koninda polo, prof. Hilary Koporowski, la inventinto de injekciaĵo kontraŭ poljomjelito, E-informoj kaj Leterkesto konsistigas la enhavon de la 223-a E-elsendo de Pola RetRadio aŭdebla ĉe www.pola-retradio.org

--------------------------------------------------------------------------------

E_elsendo el la 30.04.2013
[2013-04-30]
https://pola-retradio.org/2013/04/e-elsendo-el-la-30-04-2013/

Podkasto: Ludu en nova fenestro | Elŝutu

La gasto de nia 224-a E-elsendo ĉe www.pola-retradio.org estas la ĉefpreleganto de la lastsabata Malferma Tago en la CO en Roterdamo Kalle Knivilä. Komence aŭdiĝas novenhavaj aktualaĵoj temoj el la pola gazetaro kaj scienca temo.

--------------------------------------------------------------------------------

Klonitaj homaj embrioj laŭ Dolly-metodo
[2013-05-01]
https://pola-retradio.org/2013/05/klonitaj-homaj-embrioj-lau-dolly-metodo/

Kiel informis la periodaĵo Cell la homaj embrioj estis klonitaj laŭ la metodo de la ŝafo Dolly. La unuan fojon eblas ricevi el ili praĉelojn aŭ alimaniere stamĉelojn. Tio malfermas novajn eblojn bredi histojn kaj organojn, sed elvokas samtempe etikajn rezervojn. Internacia sciencista kolektivo sub la gvido de Masahito Tachiban el universitato en Oregono utiligis la ovoĉelojn donacitajn de iu virino. Oni forigis el ili la ĉelokernon, kiu entenis la principan parton de DNA kaj en ĝian lokon estis enmetita haŭta ĉelokerno prenita de alia matura virino. Per tiu metodo estis klonita en 1996 la ŝafo Dolly. Doktoro Shoukhrat Mitalipov el la Oregona centro asertas, ke la plej nova eksperimento signifas gravan antaŭenpaŝon postulanta pliajn esplorojn, por ke la klonado kaj histoinĝenierio estu efika kaj sekura. Aliaj esploristoj atentigas pri moralaj rezervoj rilate al ĉi-specaj eksperimentoj. Doktoro David King el Human Genetics Alert avertas, ke ili malfermas vojon al homklonado. Liaopinie eĉ publikigado de rezultoj de ĉi-specaj esploroj estas nemorala.

Legas Barbara

--------------------------------------------------------------------------------

Ĉu la Luno el la tera materio ?
[2013-05-02]
https://pola-retradio.org/2013/05/cu-la-luno-el-la-tera-materio/

Laŭ unu el la teorioj la Luno estas parto de nia planedo kaj kreiĝis rezulte de la kosma kolizio antaŭ 4 kaj duona miliardoj da jaroj. Tiu teorio ne konfirmiĝis en faktoj, sed nun ŝajnas verŝajna. Antaŭ kelkaj semajnoj  sciencistoj ekzamenis la lunajn rokojn, malkovrante en ili akvospurojn. Preciza ekzameno de ilia kemia konsisto elmontris, ke ĝi identas kun la kemia strukturo de la akvo sur la Tero, kio povus sugesti, ke ĝi devenas el la sama fonto. Dum longa tempo sciencistoj premisis, ke varmo produktita dum la kosma kolizio kaŭzis, ke en la spacon estis elŝprucita hidrogeno kaj aliaj kemiaĵoj, kio signifus, ke la Luno devis komenci sian ekziston kiel absolute senhumida objekto. Tamen la plej novaj esploroj de rokoj venigitaj de usonaj astronaŭtoj el Apollo-misio pruvis, ke sur la Luno akvo troviĝas same surface, kiel ankaŭ sub la lunokrusto. Pliaj esploroj elmontris, ke akvo troviĝis tie la tutan tempon. La ekzamenojn okazigis sciencistoj el geologia fakultato de Brown-universitato. La esplorkolektivo gvidita de Alberto Saala malkovris, ke ĉ. 98 procentoj de la akvo troviĝanta sur la Tero devenas el meteoritoj, kio sugestas, ke same la Tero kiel ankaŭ la Luno havas la komunan fonton. La plej facila ekspliko de ĉi tiu fenomeno estas, ke la akvo el la Tero estis transportita sur la Lunon. Tio igas verŝajna la teorion, ke la Luno kreiĝis el la materialoj devenantaj el la Tero. Restas la demando, kiamaniere akvo povus transdaŭri grandan kosman kolizion, kio ne estas klarigebla. Sciencistoj daŭre ne kapablas bone kompreni la procezon de la kreiĝado de planedoj kaj de iliaj satelitoj.

Legas Barbara

--------------------------------------------------------------------------------

Ĉiam pli da turistoj en Toruń
[2013-05-03]
https://pola-retradio.org/2013/05/ciam-pli-da-turistoj-en-torun/

Kun ĉiu jaro kreskas la nombro de turistoj vizitantaj la naskiĝurbon de Mikołaj Kopernik. Torunon en 2012 vizitis unu miliono 657 mil turistoj. Unu kvinonon konsistigas eksterlandaj gastoj. Inter ili avanis turistoj el Germanio, Francio kaj Britio. Ĝenerale temis pri turistoj meze 27-40-jaraĝaj, inter kiuj dominis virinoj. Ĉiuj statistike elspezis dum sia restado 42 zlotojn pli ol en 2011. Al ĉiuj la urbo vekis asociaciojn unuavice kun mielkukoj, Nikolao Kopernik kaj malnovurba kvartalo. La gastoj plej volonte vizitis planetarion, la domon de Kopernik, la urbodomon, la katedralon de sanktaj Johanoj kaj la preĝejon de la Plej Sankta Virgulino-Maria. Turistoj alte taksis la etoson de Toruno, kiu en la 5-grada skalo akiris 4,7 poentojn. Oni alte taksis ankaŭ la urban distroferton, turisman informadon, urbajn inform­afiŝojn kaj sekurecon. Ne plaĉis nesufiĉa nombro de parkejoj, publikaj tualetejoj kaj tarfikstopado. Enketiloj por turistoj estis pretigitaj en la pola kaj 6 fremdaj lingvoj enhavante 20 demandojn kaj rubrikon por person­donitaĵoj. La enketadon Toruno okazigis en marto, majo, aŭgusto kaj oktobro. Partoprenis ĝin 1554 personoj.

El la elsendo 03.05.2013.

--------------------------------------------------------------------------------

E_elsendo el la 03.05.2013
[2013-05-03]
https://pola-retradio.org/2013/05/370/

Podkasto: Ludu en nova fenestro | Elŝutu

La 225-a E-elsendo ĉe www.pola-retradio.org konsistas el aktualaĵoj, en kiuj ni ligas al la solenata la 3-an de majo en Pollando Tago de la Konstitucio. Aŭdiĝas E-informoj. En leterkesto  ni referencas i.a. al  komentoj pri  la interparolo kun Kalle Knivilä kaj klarigas la demandon pri inventintoj de  injekciaĵo kontraŭ poliomjelito, inter kiuj kiel la unua estis profesoro Hilary Koporowski.

--------------------------------------------------------------------------------

Revolucia metodo malkovri kanceron de pankreato
[2013-05-03]
https://pola-retradio.org/2013/05/revolucia-metodo-malkovri-kanceron-de-pankreato/

La 16-jaraĝa usonano kun polaj radikoj Jack Andraka elpensis teston por malkovri kanceron de pankreato, kiu estas 160-oble pli rapida, 36-miloble malpli kosta kaj 400-oble pli sentiva ol la tradiciaj ekzamenoj. Post centoj da provoj okazigi profesiajn testojn en profesiaj testolaboratorioj, tio okazis dank’ al la fondaĵo de  John Hopkins.

Anstataŭ tre multekosta tomografia ekzamenado Jack Andraka proponis la malkovron de tumoraj ĉeloj en guto de sango aŭ urino. Nun lia inventaĵo estas klinike testata. Ĝi povas evidentiĝi epokfara por centoj da miloj da homoj. Nome 85-procente la kancero de pankreato estas diagnozata tro malfrue por longigi la homan vivon. Jack Andraka koncentriĝas nun pri sia laŭvica celo. Li volas pruvi, ke lia testo aplikeblas por malkovro de ĉiaj malsanoj.

Legas Barbara

--------------------------------------------------------------------------------

Israela komputilo baze de DNA
[2013-05-04]
https://pola-retradio.org/2013/05/israela-komputilo-baze-de-dna/

Israelaj bio­inĝenieroj kreis teknologie antaŭkurieran biologian maŝinon, kiu kapablas manipuli per la genetika kodo.  Tiu maŝino kreita de laborantoj de Technion, Israela Teknologia Instituto malsame ol simplaj komputiloj kapablas kunlabori rekte kun biologiaj sistemoj kaj eĉ kun vivaj organismoj. La komputilo baziĝas sur DNA kaj kapablas legi genetikan informon aŭ ĝin ŝanĝi. Kiel klarigis Ehud Keinan el Technion temas pri aparta maŝino, kiu kreas rezultojn observeblajn biologie. Simila aranĝaĵo liaopinie iam estonte povus krei novajn bioteknologiajn eblojn, helpi en genetikaj terapioj aŭ en klonado. La nova komputilo estas ankaŭ aplikebla kiel kalkulaparato, do estas mulaj taskoj por kiuj eblus ĝin utiligi.

Legas Barbara

--------------------------------------------------------------------------------

Marsaj paŝiloj de polaj studentoj venkis
[2013-05-05]
https://pola-retradio.org/2013/05/marsaj-pasiloj-de-polaj-studentoj-venkis/

La Marsaj paŝiloj el Pollando okupis du unuajn lokojn en la prestiĝa internacia rivalado University Rover Challenge en Usono. Venkis Hyperion de la kolektivo el la Bjalistoka Politekniko kaj Scorpio III el la Vroclava Politekniko. La bjalistoka kolektivo atingis la plej bonan rezulton en la historio de la rivalado akirinte 493 poentojn je 500 eblaj. La venkintoj krom premio, kovro de la kostoj ligitaj kun alveno kaj estado dum la konvencio rajtas fieri pri sia venko dum la tuta jaro. Antaŭ du jaroj Magma2 el Bjalistoko ankaŭ akiris la plej altan podilokon. Nunjare la rivaladon partoprenis 14 taĉmentoj el Usono, Kanado, Pollando kaj Hinda Unio. La venka Hyperion estas adaptita por moviĝi en la tereno dezerta, sabloza kaj ŝtonriĉa kaj povas venki la grund­deklivon eĉ 50-procentan. La dua venkinto, la paŝilo Skorpio III dank’ al apliko de artika kontruo ebligas pli bone ĝiri kaj ataki krutajn altaĵojn. La rivalado URC okazis en la usona dezerto en la ŝtato Utaho en kondiĉoj similaj al la marsaj en kiuj unuopaj studentaj kolektivoj devis plenumi komplikajn taskojn: rekoni la terenon, serĉi la vivospurojn en grundo­provaĵoj kaj liveri medicinistan helpofaskon al vundita astronaŭto.

Legas Barbara

--------------------------------------------------------------------------------

E_elsendo el la 07.05.2013
[2013-05-07]
https://pola-retradio.org/2013/05/e_elsendo-el-la-07-05-2013/

Podkasto: Ludu en nova fenestro | Elŝutu

Abiturientaj ekzamenoj en Pollando estas unu el la novaĵoj de nia 226-a E-programo ĉe la adreso www.pola-retradio.org. Sekvas ilin temoj el la pola gazetaro kaj sciencaj informoj. Nia antaŭmikrofona gasto estas Povilas Jegorovas, la prezidanto de Litova E-Asocio. La ĉeftemo de la interparolo estas la julia BET-49, en kies kultura programo prezentiĝos i.a. la litova grupo Asorti. Ilia kanto ornamas nian hodiaŭan elsendon.

--------------------------------------------------------------------------------

E_elsendo el la 10.05.2013
[2013-05-10]
https://pola-retradio.org/2013/05/e_elsendo-el-la-10-05-2013/

Podkasto: Ludu en nova fenestro | Elŝutu

Signifan parton de nia vendreda programo ĉe www.pola-retradio.com okupas la sonsceno pri prezento de la libroservaj novaĵoj fare de Ionel Onet dum la lasta Malferma Tago de la CO en Roterdamo. La 227-a  E-elsendo enhavos komence aktualaĵon, informon el la lastaj Gazetaraj Komunikoj. Fine tradicie aŭdiĝas Leterkesto.

--------------------------------------------------------------------------------

Pola junulino  en internacia scienca konkurso
[2013-05-10]
https://pola-retradio.org/2013/05/pola-junulino-en-internacia-scienca-konkurso/

La 17-jarulino, Kinga Panasiewicz el la loko Hrubieszów akiris la 2-an lokon en internacia scienca konkurso por la junularo Internacia Scienca kaj Inĝenieria Foiro . Krom ricevita monpremio, unu el la asteroidoj estos baptita per ŝia nomo. Kinga Panasiewicz estis distingita pro esploroj super la sinkronigo de cerbaj hemisferoj. Pri la cerbo ŝi interesiĝis ekde la plej fruaj vivojaroj kaj ŝiaj interesiĝoj evoluis de prestidigitatoraj trukoj, utiligantaj la cerbo­funkciadon, hiponoto ĝis neŭrologio. Ŝi ekzamenis la aktivecon de la cerbaj hemisferoj dum diversaj taskoj, sekve ŝi prilabris ekzerco­faskon, kiu ebligas aktivigi tiun cerbo­hemisferon, kiu normale ne okupiĝus pri koncerna tasko. Interesiĝon pri ŝiaj esploroj manifestis sciencistoj el Cambridge kaj Glasgow. La pola junulino pensas pri estontaj medicinistaj aŭ fizikaj studoj en Pollando, Oxford aŭ Cambridge, dume tamen ŝi deziras koncentriĝi pri abiturienta ekzameno,  al kiu ŝi subiĝos venontjare.

Legas Barbara

--------------------------------------------------------------------------------

Thorbjoern Jagland en Moskvo
[2013-05-11]
https://pola-retradio.org/2013/05/thorbjoern-jagland-en-moskvo/

La gastanta en Rusio Ĝenerala Sekretario de Konsilio de Eŭropo, Thorbjoern Jagland dum interparolo kun prezidento Vladimir Putin esprimis maltrankvilon pri situacio de rusaj neregistaraj organizoj.

Liaopinie la lastaj agadoj de la rusa prokuroraro damaĝas la homajn rajtojn kaj civitanajn liberecojn. De kelkaj semajnoj rusaj prokuroroj postulas, ke parto de neregistaraj organizoj registriĝu kiel eksterlandaj agentoj. Tio ligiĝas kun leĝo, laŭ kiu tiun devon havas organizoj okupiĝanaj pri politika agado kaj utiligantaj eksterlandajn porcelajn subvenciojn. Se iu organizo ne plenumas tiun devon povas esti likvidita. Sur la listo de la rusa prokuroraro troviĝas i.a. analiza centro de Jurij Lewada, societo de la defendantoj de la homaj rajtoj Memoriał , organizo monitoranta la balot­procezojn Gołos kaj jurista societo Agora.

Legas Krystyna

--------------------------------------------------------------------------------

E_elsendo el la 14.05.2013
[2013-05-14]
https://pola-retradio.org/2013/05/e_elsendo-el-la-14-05-2013/

Podkasto: Ludu en nova fenestro | Elŝutu

Ela Karczewska el Bjalistoko estas la gasto de la 228-a E-elsendo de la Pola RetRadio rakontante pri sia vojaĝo al la sicilia Mazara dell Valo kun la kantgrupo Young Folk Crew. Ili koncertis tie, ili kantas ankaŭ en nia ĉiumarda elsendo. Ĉe la retradreso www.pola-retradio.org aŭdiĝas komence aktualaĵoj, temoj el la pola gazetaro kaj scienca bulteno.  Aŭskultu nin, aŭskultigu aliajn! Ne forgesu reagi per viaj rimarkoj, opinioj, sugestoj.

--------------------------------------------------------------------------------

Delfenoj pli inteligentaj ol asertite
[2013-05-15]
https://pola-retradio.org/2013/05/delfenoj-pli-inteligentaj-ol-asertite/

Delfeno trejnita por malkovrado de subakvaj minoj malkovris la 130-jaran torpedon. Ĝi troviĝis funde de Pacifiko proksime al la marina centro en San Diego. Dum la marta trejnosesio la trejnisto ordonis al defeno malkovri la plifrue instalitajn sur la marfundo objektojn. Mirige por la trejnisto la delfeno tre rapide reaperis sur la marsurfaco, kvankam la malkovrendaj objektoj estis lokitaj en kelka distanco. Tio estis konsiderita eraro, tamen kiam la alia delfeno reagis same sapeistoj decidis ekzameni lokojn, kiujn estis elmontrantaj delfenoj. Komence oni asertis, ke temas pri fragmento de iu malnova bombo ĵetita el aviadilo. Tamen finfine evidentiĝis, ke temas  pri fragmento de la torpedo Howell (haŭel), unu el la unuaj konstruataj de la usona marino. Tiuj torpedoj kun la atingopovo de 360 metroj pesis 60 kilogramojn kaj longis 3,4 metrojn. Ili estis uzataj ĝis la jaro 1898. La trovaĵo de delfenoj estis direktita al la vaŝingtona Komandantaro pri la Marina Historio kaj Heredajo, kie troviĝas la unusola ĉi-speca konserviĝ­inta torpedo.

Legas Barbara

--------------------------------------------------------------------------------

Nokto de Muzeoj en Varsovio (2013)
[2013-05-15]
https://pola-retradio.org/2013/05/nokto-de-muzeoj-en-varsovio-2/

Eĉ 210 institucioj anoncis aliĝon al la Nokto de Muzeoj en Varsovio, okazonta inter la plej proksima sabato kaj dimanĉo. La unuan fojon eblos viziti tiunokte la sidejon de la Kulturministerio, la Nacian Stadionon kaj muzeon de polaj judoj. La evento ĝuas grandan popularecon, de du jaroj meze partoprenas ĝin ĉ. 200 mil personoj. La Nacia Stadiono invitos gastojn al la lumigita placludejo, kiun eblos rigardi ankaŭ el la loĝio por eminentuloj. Estos gviditaj ankaŭ tra ĝi organizitaj promenoj. Vizitantoj de la Kulturministerio konatiĝos kun la historio kaj internoj de la ministeria sidejo, kiu estas Palaco de Potocki-familio. Kvankam muzeo de polaj judoj jam partoprenis la Nokton de Muzeoj en la antaŭaj eldonoj, ĉi-foje eblos konatiĝi kun la inaŭgurita antaŭnelonge ĝia nova sidejo. I.a. dum internacia debato ĝia arkitekto Rainer Mahlamaki el Finnlando kun aliaj partoprenos la debaton Arkitekturo de la Muzeo de Polaj Judoj – inspiroj, simbolaro, procezo, funkcieco.  Najbare en la sama urboparto Muranów la duan fojon siajn pordojn malferos dumnokte la sidejo de la Pola E-Asocio proponante i.a. infanludojn, rapidkurson, konatiĝon kun la Unua Libro, E-literaturo kaj kun eksterlandaj esperantistoj loĝantaj en Varsovio. En kelkaj urbolokoj prezentiĝos Muzeo Perdita. Temas pri virtuala prezento de la perditaj dummilite artverkoj. Pri la graveco de la temo atestu la fakto, ke rezulte de la 2-a mondmilito Pollando perdis 70 procentojn de sia materia kultur­heredaĵo. Tiuj prezentoj okazos antaŭ la Prezidenta Palaco, en la Nacia Muzeo, Palaco en Wilanów kaj sur la Nacia Stadiono. Kiel ĉiujare al la eventoj de la nokto inter sabato kaj dimanĉo aliĝas i.a. Muzeo de la Polaj Armeaj Fortoj, Muzeo de la Nuntempa Arto, la artgalerio Zachęta, la Reĝa Kastelo, Mickiewicz-Instituto, Instituto de la Nacia Memoro, la Historia Muzeo, Muzeo de Literaturo, Muzeo de Moderna Arto, la Scienca Centro Kopernik. La unuan fojon inter la muzeoj kaj aliaj objektoj eblos trafiki per la urba biciklo Veturilo, kiu disponas nun pri 128 strataj lustacioj kun 2200 bicikloj. Trafikos ankaŭ 26 malmodenaj busoj el la 50-aj kaj 60-aj jaroj, inter ili 15 tiel nomataj kukumoj, do busoj duoble longaj.

Legas Tomek

--------------------------------------------------------------------------------

La 54-a sezono de Chopin-koncertoj
[2013-05-16]
https://pola-retradio.org/2013/05/la-54-a-sezono-de-chopin-koncertoj/

La 19-an de majo okazis la solena inaŭguro de la 54-a sezono de Chopin-koncertoj en la varsovia Łazienki-parko. Krom la prezidenta paro partoprenis ĝin ambasadoroj de la landoj, el kiuj devenis la ĝisnunaj laŭreatoj de la internacia Chopin-konkurso ekde 1927. La inaŭguro de la sezono kun amasa partopreno de la publiko estis ne sole granda muzika evento, sed aŭguris samtempe laŭvican sukcesan sezonon. Ekde 1959 la formulo de la koncertoj plurfoje ŝanĝiĝis. Jen temis pri fortepianaj koncertoj akompanite de simfonia orkestro, jen pri recitaloj kaj deklamadoj de la romantika poezio. De dek kelkaj jaroj okazas klasikaj recitaloj de elstaraj pianistoj. La aparta karakterizaĵo de la dimanĉaj Chopin-koncertoj en Łazienki-Parko estas, ke Chopin-muziko miksiĝas kun la urbobrueto, kanto de birdoj, sono de la superflug­antaj aviadiloj kaj ĉiufoje sonas alimanire. Samtempe kun la inaŭguro de la muzika sezono estis solene malfermita ĝardeno ĉirkaŭ la monumento de Chopin post la okazigita rearanĝo. I.a. estis plantitaj 6600 rozujoj kaj 15 mil aliaj plantoj. La ĉiudimanĉaj Chopin-koncertoj en Łazienki-parko daŭros ĝis la 29-a de septembro.

Legas Milada

--------------------------------------------------------------------------------

E_elsendo el la 17.05.2013
[2013-05-17]
https://pola-retradio.org/2013/05/e_elsendo-el-la-17-05-2013/

Podkasto: Ludu en nova fenestro | Elŝutu

La informo pri Nokto de Muzeoj la plej proksiman semajnfinon en Varsovio komencas la 229-an E-elsendon de Pola RetRadio. Ĉe la adreso www.pola-retradio.org ni sekve invitas al koninda loko Ostrzyca, kiu atestas, ke iam ankaŭ en Pollando funkciis vulkanoj. E-informoj kaj Leterkesta renkontiĝo, en kiu i.a. ni informas pri nia retejo kompletigas la ĉiuvendredan elsendon. Muzike akompanas al ni Jacque Yvart per la kanto La pluvombrelo el  sia unua KD eldonita de Vinilkosmo.

La teksto de la informo pri Nokto de Muzeoj troviĝas en la sekcio Novaĵoj . La tekston  pri Ostrzyca estas konsultebla en la sekcio Felietonoj .

--------------------------------------------------------------------------------

Internacia piankonkurso por infanoj en Szafarnia
[2013-05-17]
https://pola-retradio.org/2013/05/internacia-piankonkurso-por-infanoj-en-szafarnia/

Junaj pianistoj el Singapuro, Italio, Belgio kaj Pollando fariĝis laŭreatoj de ĉefpremioj de la 21-a Internacia Pianista Konkurso por Infanoj kaj Junularo en la loko Szafarnia. La premioj egalis de 700 ĝis 1300 eŭroj. Inter specialaj premioj estas la eblo koncerti en la hispana Pampeluna kaj estado en Hungario. En la konkurso partoprenis pianistoj en la aĝo de 6 ĝis 18 jaroj, inkluzive de tiuj, kiuj ne estas lernantoj de Ŝtataj Muzikaj Lernejoj. Entute temis pri 47 partoprenantoj el Azerbejĝano, Belgio, Israelo, Kanado, Litovio, Germanio, Rusio, Rumanio, Serbio, Singapuro, Ukrainio, Turkio, Hungario kaj Italio. Pollandon reprezentis 30 junaj artistoj. La ideo de la Pianistaj koncertoj en Szafarnia kreiĝis en 1992. Por multaj pianistoj ĝi estis la unua paŝo al la artista kariero. En Szafarnia apud Golub-Dobrzyń en la jaroj 1824 kaj 1825 feriis Frederiko Chopin gastante en la biendomo de sia lerneja kolego Dominik Dziewanowski. Tie Chopin komponis 4 mazurkojn kaj redaktis  la lokan gazeteton, kies celo estis detale priskribi por la gepatroj eventojn, kiuj okazis dum lia estado en Szafarnia.

Legas Milada

--------------------------------------------------------------------------------

Bisfenolo A kaj la obezeco
[2013-05-20]
https://pola-retradio.org/2013/05/bisfenolo-a-kaj-la-obezeco/

Kemiaĵo aplikata por la produktado de plastoj, bisfenolo A povas grandigi riskon de obezeco ĉe adolesk­ulinoj. La pli fruaj ekzamenoj elmontris, ke ĝi endanĝerigas fekundecon kaj influas denaskajn evolu­difektojn. La plej novaj esploroj de kaliforniaj sciencistoj informas, ke ĝi influas ankaŭ nian pezon. La nivelo de bisfenolo A , BPA estis testita en urin­provaĵoj de pli ol 1300 infanoj en la aĝo de 9 ĝis 12 jaroj. Evidentiĝis, ke knabinoj ĉe kiuj estis konstatita pli alta elcento de ĝia kvanto estas pli minacitaj de obezeco. Ekzemple knabinoj, en kies urino estis pli ol 2 mikrogramoj de BPA en unu litro duoble pli estis endanĝerigitaj je obezeco ol iliaj koleginoj, kies BPA-kvanto estis sub ĉi tiu nivelo. Ne ekzistas simila dependeco ĉe knaboj. Doktoro De-Kun Li el la Esplorfako de Kaiser Permanente el Oakland delonge ekzamenas la influon de bisfenolo A. Eksperimentoj kun partopreno de bestoj elmontradis, ke BPA influas metabolon, kio ofte kondukas al obezeco kaj diabeto. Kvankam laŭ d-ro Li la kaliforniaj testadoj ne pruvas, ke BPA rekte kaŭzas la knabinan obezecon, sendube ĝi estas unu el la gravaj faktoroj. Bisfenolo A perturbas la funkciadon de hormona strukturo kaj efikas simile al estrogeno je la digesto­funkcioj. Sendube BPA ludas gravan rolon en la globskala epidemio de obezeco. La eksperto konsilas rezigni pri pakumoj, en kies konsiston eniras BPA, alivorte plastaj boteloj, plastaj nutraĵpakumoj kaj plastaj nutr­aĵskatoloj.

Legas Barbara

--------------------------------------------------------------------------------

E_elsendo el la 21.05.2013
[2013-05-21]
https://pola-retradio.org/2013/05/e-elsendo-el-la-21-05-2013/

Podkasto: Ludu en nova fenestro | Elŝutu

Gazetara Kampanjo ĉirkaŭ la Rejkjavika UK de UEA estas la temo de interparolo kun aldona Komisiito por ĉi tiu tasko, Emilio Cid el Brazilo. Komence de la 230-a E-elsendo de la Pola Retradio aŭdiĝas aktualaĵoj, temoj el la pola gazetaro kaj scienca bulteno. Kante akompanas nin hodiaŭ Flavio Fonseca.

En la paĝo www.pola-retradio.org eblas jam  legi la tekstojn de aktualaĵoj kaj informojn de la  scienca bulteno samtempe ilin aŭskultante.

--------------------------------------------------------------------------------

E_elsendo el la 24.05.2013
[2013-05-24]
https://pola-retradio.org/2013/05/e_elsendo-el-la-24-05-2013/

Podkasto: Ludu en nova fenestro | Elŝutu

La ĉi-vendreda E-elsendo el Varsovio, ĉi-foje jam la 231-a, proponas aktualaĵon, felietonon pri polaj insurgentoj de la Januara kontraŭcara Insurekcio, kiuj fariĝis la unuaj esploristoj de la plej malnova kaj plej profunda lago de la mondo, Bajkalo. Ni prezentas E-informojn kaj fine traktas aktualajn temojn sur la leterkesta  forumo.

En la rubrikoj Aktualaĵoj kaj Felietonoj estas legeblaj tekstoj aŭdiĝantaj en la  elsendo

--------------------------------------------------------------------------------

Ostrzyca
[2013-05-24]
https://pola-retradio.org/2013/05/ostrzyca/

Hodiaŭ mi volas vin konduki, gesinjoroj,  al iom fora loko en la sudokcidenta Pollando, en Sudety-montaro, en la distrikto de Złotoryja. Tie ĝis antaŭnelonge eblis trovi la unikan en Pollando kreskolokon de ajlo strikta, la restaĵo de la glaĉera epoko, nun jam malaperinta.  Ne ajlon striktan ni serĉos tie, sed nian atenton ni donu al la altaĵo Ostrzyca, kiu povas veki asociaciojn kun egiptaj piramidoj. Piramidforman aspekton Ostrzyca dankŝuldas al la vulkana historio de Sudetoj. Hodiaŭ neniu vulkano funkcias tie, sed daŭre eblas rekoni vulkankonusojn en la panoramo de la regiono. La plej alta vulkanrestaĵo, alta 501 metrojn super la marnivelo, estas dominanta en la ebena panoramo Ostrzyca, kiu kiel vulkano,  ne funkcias de 4 milionoj da jaroj. Ĝiaj deklivoj estas relative krutaj kun klare rimarkebla pinto. La altaĵo kun varia geologia historio konsistas  el variaj miocenaj vulkanrokoj, kiuj en likva formo elverŝiĝis el la iama vulkano. Nun Ostrzyca estas tutece surkreskita de kapsoarbaro konsistanta el sikomora acero, frakseno, tilio, ulmo, en malpli granda grado kvero. Ĉepiede kreskas piceoj kaj betuloj. En la pinta regiono sur la areo de 3,81 hektaroj estis kreita la naturrezervejo Ostrzyca Proboszczowicka. Al aparte protektataj formacioj apartenas tie bazalta roka gruzo kaj la rokoplantoj. La pinto mem, kiel menciite, dominanta en la regiono estas bonega panormrigardejo. Kondukas al ĝi 445 ŝtonaj ŝtupoj. La altaĵo pro sia formo estas difinata i.a. kiel la silezia Fuĵi-monto. Dum la favora vetero ĝi estas  videbla de Karkonosze-montaro. La unuopaj deklivoj pro malsama sunradiado karakteriz­aĝas per varia mikroklimato, kio influas ĝian planto­veston.

La naturrezervejo estis establita en 1962 kaj enhavas – kiel dirite – interesajn geologiajn formaciojn kaj multajn maloftajn plato­speciojn. Ĝi estis establita ĉefe por konservi la restaĵojn de la terciara vulkano kun la bazalta gruzo kaj por protekti la rokoplantojn – entute 160 speciojn – en la pinta segmento de la altaĵo. Sur la tereno de la naturrezevejo vivas i.a. aproj, cervoj, kapreoloj. El inter malpli grandaj bestoj estas menciindaj vulpoj, martesoj, leporoj, sciuroj, musteloj. Riĉe estas reprezent­ita birdaro. La rezervejo estas ankaŭ la vivejo de tre malofte aperanta en Sudetoj limako Clausilia Dubia kaj nur ĉi tie aperantaj du papili­specioj Aplota kadeniella kaj Bryotropha basaltinella .

La arbara komplekso, sur kies tereno troviĝas la rezervejo en la pasineco rolis kiel la kavalira havaĵo. La arkeologiaj esploroj en 1959 konfirmis en Ostrzyca spurojn de la frumezepoka setliĝado.  Jam en 1926 pro la elstaraj naturvaloroj de Ostrzyca germanaj aŭtoritatoj deklaris la terenon sur la areo de 2,46 hektaroj protektata. Tiu tereno en 1962 estis vastigita je 1,36 hektaroj.  En 1982 kreiĝis aldone sur la surfaco de preskaŭ 12 kvadrataj kilometroj tereno de la protektenda panoramo, Ostrzyca Proboszczowska, kiu ĉirkaŭas la rezervejon, kaj sur kiu tereno eĉ pli ol tri kvadratajn kilometrojn okupas arbaroj.

Lagas Barbara

--------------------------------------------------------------------------------

Premiita magistriga disertacio
[2013-05-25]
https://pola-retradio.org/2013/05/premiita-magistriga-disertacio/

La ministro por la eksterlandaj aferoj, Radosław Sikorski enmanigis premiojn al la nunjaraj laŭreatoj de la konkurso por la magistriga disertacio-2012 rilatanta al la aktualaj internaciaj rilatoj. Entute oni alsendis el la tuta Pollando 54 verkojn kun varia temaro, postulanta ne sole konojn, sed ankaŭ esplor­-sendependecon de la verkintoj. La laŭreato de la unua premio estas Witold Gruszczyński el la Varsovia Universitato studinta en la fakultato pri ĵurnalismo kaj politikaj sciencoj. Lia magistriga disertaĵo rilatis al la energetika politiko de la Eŭopa Unio kun aparta konsidero de la tergaso. Krom financa premio atendas lin praktiko en la elektita de li ministeria departemento aŭ staĝo eksterlanda.

Legas Milada

Premiita magistriga disertacio

--------------------------------------------------------------------------------

Poŝtelefonoj kaj nia sano
[2013-05-25]
https://pola-retradio.org/2013/05/postelefonoj-kaj-nia-sano/

Daŭras diskutoj, eĉ disputoj pri la influo de poŝtelefonoj je la homa sano. La esploroj de d-ro Leif Salford ne lasas iluziojn, ke la mikroondoj trapenetras la protekto­barilon kaj atingas nian cerbon. La sveda neŭro­kirurgo de jaroj okupiĝas pri la influo de la elektromagneta radiado je la homa cerbo.

Jam en 1975 la usona biofizik­isto kaj neŭrologo Allan Frey malkovris, ke la mikroondoj traiĝas al la cerboĉeloj. La natura barilo sango-cerbo, kiu formas fizikan kaj biokemian protekton, specifan protekto­torĉon inter sangoportaj vojoj kaj nerva sistemo ne prezentas por ili problemon. En la universitato en Lund de jaroj daŭras esploroj pri la influo de la radiado je la cerboĉeloj. Ekde 1988 d-ro Salford testis la efikadon de mikroondoj je miloj da laboratoriaj ratoj. De 20 jaroj kiel fonton de la radiado li uzas poŝtelefonojn. La testo­rezultoj estas alarmaj. Evidentiĝas, ke ne sole la radiado de la poŝ­telefoniaj retoj estas danĝera, sed ankaŭ aranĝaĵoj, kiuj funkcias kun miloble malpli granda povo ol ili detruas la naturan barieron sango-cerbo. Krome la malgrandigo de la povo de la radiadfonto efikas kontraŭe ol oni atendas. Nome aranĝaĵoj emisiantaj kun malpli granda povo en pli signifa grado detruas la naturan protektobarilon. Tio signifas, ke la truk­klopodoj de la poŝtelefoniaj produktantoj estas vanaj, ĉar malgrandig­ita radiadpovo de poŝtelefono ne malgrandigas la negativan influon de la radiado je nia sano. La esploroj ĉe ratoj, elmontradis, ke jam post du minutoj la mikroondoj traiĝis tra la bariero sango-cerbo. La 2-hora efikado de poŝtelefono je ratoj alkondukis al detruo de 2 procentoj de la cerboĉeloj en la formo de misformoj aŭ subfunkcio. La 6-hora efikado alkondukis al memor­perturboj kaj genetikaj ŝanĝoj. Profesoro Leif Salford difinas la uzadon de poŝtelefonoj fare de homoj “la plej granda biologia eksperimento en la historio”.

Legas Barbara

--------------------------------------------------------------------------------

Konindaj poloj: La unuaj esploristoj de Bajkalo
[2013-05-25]
https://pola-retradio.org/2013/05/konindaj-poloj-la-unuaj-esploristoj-de-bajkalo/

Nunjare pasas la 150-a datreveno de la kontraŭcara, liberiga insurekcio, la Januara Insurekcio. Multaj ĝiaj komandantoj, insurgentoj post la insurekci­falo estis kondamnitaj je morto aŭ ekzilo al Siberio. Inter ili estis komisaro de la insurgenta pola Nacia Registaro en Litovio i Belorusio, Benedykt Dybowski. Post la aresto la rusaj aŭtoritatoj kondamnis lin je mortopuno. Savis lin tamen germanaj zoologoj intervenante pere  de prusa fera kanceliero Otton von Bismarck. La puno estis ŝanĝita je la 12-jara ekzilo al Siberio. Tie polaj insurgentaj ekzilitoj kiel la unuaj komencis gvidis sistemajn esplorojn de Bajkalo. Inter ili estis Benedykt Dybowski la malkovrinto de la faŭno kaj flaŭro de ĉi tiu plej malnova kaj plej profunda lago de la mondo. Dybowski, kies 180-a naskiĝ­datreveno pasis  fine de aprilo, kun sia amiko Wiktor Godlewski malkovris tie 100 speciojn de organismoj, la plej ofte vivantajn en Bajkalo krustulojn.  Kiel konfirmas hidobiologo el altlernejo en Ulan-Ude en la orienta Siberio doktoro Dmitrij Wiktorowicz Matafonow – poloj iniciatis tute novan etapon en la malkovrado de la Bajkala geografio kaj ĝia besta kaj planta mondo. de bestoj kaj plantoj de Bajkalo. Liaopinie neniu pli frue ol Dybowski kun tioma sukceso estis malkovranta la endemian faŭnon de Bajkalo. La lago havanta ĉ. 25 milionojn da jaroj karakteriz­iĝas per pli ol 70 procentoj de besto- kaj planto­specioj vivantaj ekskluzive en ĝiaj akvoj. Tio fascinis la polan esploristojn, kiu  priskribis ol 100 speciojn de nekonataj bestoj.

Kune kun Wiktor Godlewski Dybowski gvidis eslorojn en Kałtuj, malgranda loĝloko ĉe la suda bordo de Bajkalo, kie ĝis hodiaŭ oni memoras pri polaj malkovrintoj.  Dybowski kaj Godlewski gvidis siajn esplorojn laŭ la propra originala metodo. Nome en profundon de la lago tra forhokita glacikrusto – en tre malfacilaj kondiĉoj, kiam frosto havis ĉirkaŭ minus 30 gradojn – ili estis enmetantaj mortan fiŝon, kies korpon tuj voris diverpeciaj krustuloj. Elmetane ĝin ili jam disponis pri esplor­materialo. Inter la malkovraĵoj de Dybowski en Bajkalo troviĝas iu el la plej  karkterizaj por la lago fiŝoj, pole gołomianka, latine Comephorus dybowskii , kiu havas mirigajn proprecojn. Ĝi vivas tre profunde kaj estas preskaŭ diafana. Elprenita el la akvo kaj metita en la sunradiojn ĝi transformiĝas en oleecan likvaĵon. Tiu oleo servis al la vivantaj ĉe la bordoj de Bajkalo burjakoj por lumigi iliajn lampojn.

Estadante ĉe Bajkalo kaj esplorante ĝiajn akvojn Dybowski fariĝis la kunaŭtoro de nova sciencbranĉo, limnologio, kiu koncernas kompleksajn esplorojn geologiajn, hidrologiajn kaj natursciencajn de la kontinentaj akvoj. Post la punestado Dybowski laŭ la propra elekto daŭrigis siajn sciencajn laborojn en la fora Rusio, i.a. sur Komĉatko. Li meritiĝis ankaŭ kiel kuracisto kaj etnografo inter la vivantaj en Siberio burjakoj kaj evenkoj. Fine li  revenis al Pollando kaj ekloĝinte en Lvovo tie li mortis en 1930a.

Sed ne nur la nomo de Dybowski estas ligita kun Bajkalo. Alia elstara pioniro de la sibira scienco estis pola geologo Jan Czerski, ankaŭ eksilita al Siberio pro la partopreno en la januara insurekcio. Lia merito estas la priskribo de la tuta lagobordo de Bajkalo, inkluzive de enfluantaj ĝin riveroj. Lian nomon memorigas  Czerski-Monto, la plej alta pinto de Bajkalaj Montoj kaj la tiel nomata Czerski-ŝtono,  monto troviĝata proksime al la loko Litwianka. Czerski same kiel Dybowski post la malkovro de la siberia naturo libervole revenis tien por daŭrigi siajn sciencajn laborojn. La tragika por Pollando 1863, pro la falo de la januara insurekcio,  fariĝis epokfara en la esplor­histrio de Bajkalo. Ekzilitaj polaj insurgentoj estis la unuaj, kiuj komencis ĝin sisteme esplori.

Legas Barbara

--------------------------------------------------------------------------------

Mużakowski-Parko
[2013-05-26]
https://pola-retradio.org/2013/05/muzakowski-parko/

Ĉi-semajne gesinjoroj ni invitas vin al la okcidenta Pollando por konatiĝi kun unu el la plej grandaj turismaj atrakciaĵoj de la regiono, Mużakowski-Parko. Establita en la unua duono de la 19-a jarcento sur la tereno kun apartaj panoramaj valoroj fare de princo Hermann von Pückler-Muskau ĝi formas la plej grandan anglastilan parkon en Pollando kaj en Germanio. Ĝi etendiĝas sur la areo de 728 hektaroj ambaŭborde de la Soraba Niso, kiu rolas kiel la pola-germana limo.  Unuflanke troviĝas la germana Bad Muskau, ĉe la pola flanko Łęknica. Post la 2-a mondmilito ĉe la germana flanko  restis la centra parto kun palaco, ĉefaj konstruaĵoj kaj ĝardenoj, kiu okupas ĉ. unu trionon de la tuta projekto. Polaflanke sur la areo de ĉ. 500 hektaroj etendiĝas naturstila parko. Ambaŭ partojn kunigas du parkaj pontoj. Mużakowski-parko imponas per la naturaj valoroj de la tereno en la valo de la Soraba Niso, kie la rivero tranĉfluas inter geologiaj formacioj de la onidire plej granda en la mondo finmoreno, difinata kiel Mużaków-akso. En majo 2004 la pola parto de la parko estis rekonita kiel histori­monumento, en julio samjare ĝi estis registrita en la listo de la Monda Kulturheredaĵo de Unesko.

La parkon eblas viziti diversmaniere – piede, bicikle aŭ surĉevale. Faras tion ĉiujare miloj da turistoj, kiujn logas senfinaj herbejoj, majestaj arboj, zigzagaj padoj, pitoreskaj lagoj kaj riveroj, unikaj pontetoj kaj konstruaĵoj. Tio, kio ŝajnas aparteni al la  natura panoramo estas ĝardenista verko kreita de princo Hermann von Pückler-Muskau.

La vivinta en la jaroj 1785-1871 prusa aristokrato post siaj pluraj vojaĝoj, i.a. al Britio restis sub la influo de forta raviĝo pri la anglastilaj parkoj. Heredinte de la patro komence de la 19-a jarcento kastelon kun parko en Muskau tre baldaŭ li direktis alvokon al urbo­loĝantoj pri helpo establi aglastilan parkon. En la daŭro de 30 jaroj (1815-1845) la rezidejon ĉirkaŭis vasta parko kun panorama karaktero. Oni rearanĝis la tutan terenon, elkonstruis pontojn super Niso, oni plantis milojn da arbaroj kaj arbustoj kaj ĉio ĉi estis perfekte enkomponita en la internan riverovalon. Bedaŭrinde la financa ŝarĝo ligita kun la realigo de tiom vastskale planita projekto kaj pliaj vojaĝoj de la princo devigis lin vendi la terposedaĵon en Muskau. Pliajn modernigojn efektivigis la laŭvicaj posedantoj – principo Frederiko la Niderlanda kaj la familio von Amin, kiu en 1945 – pro la postmilitaj limŝanĝoj – estis eksloĝigita.

Dum la 2-a mondmilito la parko kaj multaj parkaj konstruaĵoj estis detruitaj, inkluzive de la ĉefa rezidejo Nova Kastelo. Ekde la fino de la 80-aj jaroj la parko fariĝis objekto de la pola-germana revaloriga projekto. Iom poste estis  i.a. restaŭrita monumento de la parko­kreinto princo Hermann von Pückler-Muskau kaj jam komence de la 2-milaj jaroj estis rekonstruitaj la eksplodig­itaj dum la 2-a mondmilito Duobla Ponto kaj la Angla Ponto. Nun pli ol 300 mil turistoj el la tuta mondo venas ĉiujare por ripozi for de la urba bruo kaj sufokaj stratoj kaj  por admiri kaj ĝui eksterordinaran verkon de la mondklasa ĝardenista arto.

Legas Barbara

--------------------------------------------------------------------------------

Antoni Grabowski, elstara E-pioniro, Patro de la E-poezio
[2013-05-27]
https://pola-retradio.org/2013/05/antoni-grabowski-elstara-e-pioniro-patro-de-la-e-poezio/

Kiam en 1887 en Varsovio aperis la Unua Libro de D-ro Esperanto, Antoni Grabowski estis 30-jaraĝa. Omaĝante lian laŭvican naskiĝ­datrevenon, ĉi-jare jam la 156-an necesas ne nur reliefigi lian rolon kiel la Patro de la E-poezio. Grabowski estas samtempe unu el la plej gravaj E-pioniroj meritiĝinta ankaŭ sur la movada kampo. Multaj biografiaj informoj pri Antoni Grabowski, pri lia tre ampleksa E-agado, ne sole literatura kaj lingva, sed ankaŭ organiza – tre grava por la universala kaj pola E-movadoj – troviĝas dise tra la E-gazetaro, en kelkaj prilabor­aĵoj. La unua fonto prezentanta koncize lian biogramon laŭ Edward Wiesenfeld kaj Kalomano Kalocsay estas „Enciklopedio de Esperanto”, 1933. El inter la postmilitaj prilaboroj interesajn informojn enhavas la antaŭparolo de Andrzej Pettyn al la libreto de „Halka” de W?odzimierz Wolski aperinta en 1987. Interalie tre valora laŭ la vidpunkto de multaj cititaj font­materialoj estas la libro de Zofia Banet-Fornal el 2001 „Antoni Grabowski eminenta Esperanto-aganto”. La figuro de Antoni Grabowski impresas multajn lingvo­adeptojn pro la informo, nun eĉ jen kaj jen dubigata, ke inter li kaj d-ro Ludoviko Zamenhof okazis la unua konversacio en Esperanto. Sed kiel legeblas en la rememora artikolo de Antoni Grabowski mem en „Esperantysta Polski” el 1910, tiel efektive okazis. Grabowski skribas: „ĝoja estis ankaŭ kaj ne forgesebla por mi la tago, kiam en 1888, veninte Varsovion, mi vizitis nian Majstron. Tiam, kiel al mi memorigas Dro Ludwik Zamenhof, inter ni ambaŭ eksonis la plej unua interparolado esperanta. Ambaŭ ni parolis la lingvon la unuan fojon kaj tamen la lingvo ekfluis vigle, ĉar ĝi estis jam antaŭe viva en niaj koroj kaj mensoj.”

Antoni Grabowski estis poligloto scianta multajn lingvojn. Antaŭ la konatiĝo kun Esperanto, kiu samtempis kun la eldono de la Unua Libro, en somero 1887 logis lin Volapuko. Li renkontiĝis kun la kreinto de tiu ĉi lingvo, pastro Martin Schleyer, li estis ankaŭ membro de la viena volapukista klubo. Tiun ĉi medion li senprokraste forlasis post la konvinkiĝo pri la supereco „de la vera lingvo internacia”. La kontakton kun la aŭtoro de tiu vera lingvo internacia li tuj ligis sendinte al D-ro Esperanto gratul­leteron. Sekvis tion iliaj korespondaj kontaktoj. Tiel do la konversacio ĵus menciita en ne okazis inter nekonataj personoj. Estas vero, ke pli poste – kiel ni legas en la Enciklopedio – dum kelkaj jaroj Antoni Grabowski estis unu el la ĉefoj de la lingvo­reforma movado, serĉante la kaŭzon de la malrapida disvastiĝo de Esperanto en ĝia mal­perfekteco. Sed pri reformemo li rezignis post la decida voĉdono de 1894, restinte fidela al la Fundamento. La jam menciita Enciklopedio citas liajn vortojn: „>Tablo< – diris Grabowski – devas esti nomata tablo ne pro ia logika aŭ alia rezono, sed tute simple pro tio, ke tiel volis Zamenhof; se li estus volinta ĝin nomi >tiŝo< ni ĉiuj akceptus tiun ĉi vorton…”

Janina Ender kaj Marek Wajsblum en la artikolo el „Pola Biografia Vortaro” esperantig­ita de Jan Zawada skribas i.a. „…Grabowski plene meritas la nomon „Patro de la esperanta poezio”. Celkonscie kaj persiste li eksperimentis ĉe siaj tradukoj kaj originalaj verkaĵoj kun poetikaj formoj, formis la esperantan ritmikon kaj per ekzemploj montradis la riĉecon de la rimoj en la esperanta poezio lingvaĵo, uzante ĉiujn eblojn kreitajn de ĝia morfologia strukturo. La plej alta atingo de lia poezia tekniko estas la majstra traduko de „Sinjoro Tadeo” (originale „Pan Tadeusz”), en kiu unuafoje sian plenan esprimon trovis la onomatopeaj valoroj de Esperanto”. La traduko de „Sinjoro Tadeo” de Adam Mickiewicz fare de Antoni Grabowski estis verdire unu el la lastaj laboroj de Grabowski – sendube la plej grandioza, kiun li entreprenis en 1916. Laŭ Leono Zamenhof, tio estis lia multjara revo, kvankam ambaŭ opiniis tion utopio. La viv­cirkonstancoj, en kiuj ektroviĝis Grabowski post la forveturo de la familio el Varsovio spronis kaj favoris tiun laboron. Kiam unu jaron poste li prezentis la traduk­specimenojn al Ludoviko Zamenhof, kiun li vizitis en la akompano de alia E-poeto Stanisław Karolczyk, de Ludoviko Zamenhof li ricevis ne sole la manpreman gratulon, sed ankaŭ instigon, ke la tuta epopeo estu esperantigita. Zamenhof mem ne ĝisatendis ĝian libroforman aperigon, kio okazis en 1918, sed ja konis ĝiajn fragmentojn. Antoni Grabowski mem pri sia traduk­laboro jene skribis i.a. en la antaŭparolo al la unua esperantlingva eldono de „Sinjoro Tadeo”: „La traduko de la tuta epopeo en lingvon Esperanto ŝajnis al mi, pro la grandegaj malfacilecoj, afero preskaŭ neebla; almenaŭ mi neniam kuraĝis pensi, ke miaj fortoj por tia tasko povus sufiĉi. Sed en la jaro 1916, kiam mi kolektis malgrandan aldonon por mia “El Parnaso de popoloj”, tiam tentite de samideano S.K. – t.e. Stanisław Karolczyk, post longa ŝanceliĝado mi decidiĝis aldoni kelkajn belegajn fragmentojn el ĉi tiu verko. Vizitante la malsanan, neforgeseblan karan Majstron, mi ricevis la respondon: “Traduku la tutaĵon”. Mi ekridis, ĉar al mi ŝajnis, ke la Majstro naive postulas neeblaĵon. Sed doktoro Zamenhof ne ĉesis min emigi dum ĉiu mia nova vizito, ĝis mi fine subiĝis kaj komencis en decembro de la jaro 1916 la tradukadon, kun malfido, ke mi iam ĝin finos. Tamen komencinte mi jam ne ĉesis. La Majstro, kiun mi konsultadis pri kelkaj novaj vortoj, formoj kaj esprim­manieroj, legis antaŭ sia morto preskaŭ la unuajn kvar librojn. Poste, malgraŭ mia malbona sanstato, mi daŭrigis la laboron, kiu postulis streĉon de ĉiuj miaj animfortoj por plenumi la lastan deziron de mia kara amiko, la granda kreinto de nia lingvo. Nun mi prezentas la verkon al la Esperantistaro en la konvinko, ke mi faris bonan servon al la patrujo kaj al nia tutmonda afero”.

Antoni Grabowski mem mortis nur tri jarojn post la aperigo de la libroforma traduko de „Sinjoro Tadeo” en 1918 trafita de korinfarkto sur varsovia strato antaŭ vitrino de la librovendejo kun E-libroj en 1921. Kvankam la meritoj de Antoni Grabowski, pola E-pioniro – kies agadkampo estas multe pli vasta ol la literatura – estas esencaj por la tuta E-komunumo. Lia litertura agado daŭre estas la plej bone konata al meza esperantisto.

Barbara Pietrzak

Legas Barbara

--------------------------------------------------------------------------------

E_elsendo el la 28.05.2013
[2013-05-28]
https://pola-retradio.org/2013/05/e_elsendo-el-la-28-05-2013/

Podkasto: Ludu en nova fenestro | Elŝutu

Heidi Goes estas nia antaŭmikrofona gasto rakontante pri siaj lastaj spertoj en Indonezio kaj la Orienta Timoro. Tiun interparolon, surbendigitan dum la Malferma Tago en Roterdamo, antaŭas  aktualaĵoj, temoj el la pola gazetaro kaj scienca bulteno. En la 232-a E-programo ĉe www.pola-retradio.org aŭdiĝas litova kanto en Esperanto Vojoj tra maro .

Pere de la sama paĝo estas krome konsulteblaj en la rubrikoj Aktualaĵoj kaj Sciencaj informoj ses tekstoj akompanitaj de la sondosieroj el la hodiaŭa elsendo.

--------------------------------------------------------------------------------

Konindaj poloj – prof. Jan Czochralski
[2013-05-29]
https://pola-retradio.org/2013/05/konindaj-poloj-prof-jan-czochralski/

Laŭ la decido de la polaj deputitoj inter la omaĝataj figuroj de la 2013-a jaro  troviĝas ankaŭ profesoro Jan Czochralski. Li estas unu el la plej konataj kaj agnoskataj en la mondo polaj sciencistoj, tamen en Pollando eĉ ĝis la mezo de 2011 lia figuro  estis apenaŭ konata kaj en la sciencista medio li elvokis ekstremajn sintenojn. Finfine spite plur­jardekajn suspektojn, profesiajn enviojn, kalumniojn lia memoro estis plene rehonorita.

En la usona Silicia Valo estas loko aparte prezentata al la vizitantaj turistoj, en kiu oni informas, ke ĉion kion eblas tie ĉi vidi kaj admiri, la mondo dankŝuldas al tri homoj: Tomas Edison, Albert Einstein kaj Jan Czochralski. Jan Czochralski estas la plej ofte citata en la mondo pola sciencisto apud Mikołaj Kopernik kaj Maria Skłodowska-Curie, sed en la lando mem li estis longe forgesita.

Dume, profesoro Czochralski estas la inventinto i.a. de la aplikata ĝis hodiaŭ metodo de la akirado de mon­okristaloj de silicio, sen kio ne evoluus elekroniko. Li prilaboris la metalon B ( bahnmetal aŭ fervojan metalon) – la senzinkan alojon por fervojaj lagroj. Li ankaŭ inventis radio­mikroskopon, kiu estis la pramodelo por la nuntemaj elektronaj skanmikroskopoj.  Tiuj malkovroj certigis al profesoro Czochralski firman lokon inter la plej renomaj sciencistoj de la pasinta jarcento. Aparte grava estas lia malkovro de teknologio  akiri la mono­kristalojn de silicio, famiĝinta kiel Czochralski-metodo. Temas pri la plej bona produkto­metodo de silicikristaloj kun tre orda strukturo, kiu teknologio amasskale estas utiligata ĝis hodiaŭ por produkti ĉiajn mikro­procesilojn.

Jan Czochralski [1885-1953] estis kemiisto kaj metal­eksperto. Li naskiĝis en la loko Kcynia, kiu tiam – dum la dispartigo­periodo de Pollando – troviĝis en la prusa aneksoparto. Konforme al la deziro de la patro li finis instruistan seminarion, sed indignita pro maljustaj, subtaksaj notoj li detruŝiris sian abiturientan ateston, kio tiuepoke grave bremsis la vojon al la instruista kaj sciencista kariero.

De fruaj jaroj li interesiĝis pri kemio.  Kiel la 16-jarulo li forveturis kaj komencis labori en apoteko de Krotoszyn, kie li gvidis sciencajn eksperimentojn pri kemio. En 1904 li forveturis al Berlino. Li laboris diversloke okupiĝante pri la difinado de kvalito kaj pureco de ercoj, oleoj, ŝmiraĵoj, metaloj, alojoj, iliaj duon­produktoj kaj kupro­rafinado. Samtempe li frekventis kiel libera studento lekciojn pri speciala kemio en la politekniko de Charlottenburg, kaj tie li akiris la diplomon de kemia inĝeniero.

En la jaroj 1911-1914 li estis asistanto de Wichard von Moellendorff, kun kiu Czochralski publikigis sian unuan disertacion pri kris­tolografio de metaloj. La plej grandan famon alportis al li la malkovrita en 1916 mezurmetodo pri rapideco de metal­kristaliĝo, nun utiligata por la produktado de mono­kristaloj de silicio. En 1924 li patentumis la revoluciigan  lagran B-alojon por la fervojo, kiu estis enorme grava por la germana mastrumado, kiun rilatis la malpermeso importi zinkon. Lian patenton aĉetis ne nur Germanio, sed ankaŭ Usono, Sovetunio, Ĉeĥoslovakio, Francio kaj Britio. En 1924 Jan Czochralski fariĝis vicprezidanto kaj la sekvan jaron la prezidanto de la germana Metalurgia Societo. Henry Ford proponis al li tiam laboron en sia laboratorio en Detroit. Li ne akceptis tiun inviton, kaj rezignis pri ĉiuj postenoj en Germanio kaj pri la germana civitaneco. Laŭ persona invito de la pola prezidento Ignacy Mościcki li revenis al Pollando. Li fariĝis profesoro en la kemia fakultato de la Varsovia Politekniko. Speciale por li estis establita Katedro de metalurgio,  kiu estis ekpita per la plej moderna intrumentaro. Czochralski konstruis ĝin de la fundamentoj povante enlaborigi tiom da homoj, kiom li bezonis. Tio motivis kalumni­lavangon flanke de liaj kolegoj, inter kiuj avanis profesoro Witold Broniewski akuzanta Czochralski pri fi­kunlaborado kun germanoj. Kvankam sekve de la tribunala proceso Czochralski estis senkulpigita dum Broniewski estis arestita kaj devis pagi monpunon – tio ne trankviligis polan sciencistan medion. Eĉ pli, la 2-a mondmilito kaŭzis pliajn suspektojn pri fikunlaborado de profesoro Czochralski kun germanoj dum evidentiĝis fine, ke li laboris la tutan tempon por la pola konspira ŝtato kaj ĝia Landa Armeo. Post la milito arestita, pro manko de pruvoj li estis senkulpigita. Malgraŭ tio la sciencista medio  de la Varsovia Politekniko rifuzis en 1945 akcepti lin en sian gremion, kondamnante lin je  forgeso. Czochralski revenis al sia naskiĝloko, Kcynia, kie li establis la kemian fabriketon BION, kiu produktis diversspecajn kosmetikaĵojn kaj higienajn produktojn. Li mortis en 1953, sed nur en 1998 sur anonima tombo estis lokita tabuleto kun lia nomo. La provoj rehonori lian memoron en la varsovia sciencista medio en la jaroj 1984 kaj 1993 fiaskis. Nur la 29-an de junio 2011 post la ekzameno de la font­materialoj la Senato de la Varsovia Politekniko rehonoris la memoron de prof. Czochralski.  Kaj menciindas  finfine, ke reveninte al Pollando prof. Czochralski kunportis ankaŭ grandan fortunon, akritan pro sia profesia laboro, vendataj patentoj.  Li malavare uzis ĝin por studentaj stipendioj, por tiaj sociaj celoj kiel i.a. rekonstruo de biendomo de Chopin-familio en Żelazowa Wola aŭ foslaboroj en la frumezepoka slava setlejo en Biskupin.

Legas Barbara

--------------------------------------------------------------------------------

Iom pri la Marborda Regiono de Koszalin
[2013-05-30]
https://pola-retradio.org/2013/05/iom-pri-la-marborda-regiono-de-koszalin/

Mia pasint­semajna vizito en Mielno estu la okazo iom rakonti pri tiu interesa regiono,  en kiu de 35 jaroj rendevuas esperantistoj dum la jam tradicia junia Ĉebalta E-itsa Printempo. Mielno en la Marborda Regiono de Koszalin, traktata kiel aparta geografia unuo kun apartaj trajtoj influitaj de la Balta Maro,  estas unu el la popularaj marbanejoj. La situanta en la kvinminuta promen­distanco sporta centro, kiun utiligas esperantistoj, ebligas en libera tempo ĝui kaj la marbanadon kaj sunbrun­iĝadon sur la blanksabla plaĝo. Tamen sufiĉas dekminuta promeno al kontraŭa direkto kaj jen alia akvotereno, la lago Jamno okupanta la areon de pli ol 2200 hektaroj kaj estanta la 9-a laŭ la grandeco lago de Pollando kaj la 3-a en la Okcidentpomeria Vojevodio. La meza profundo de la lago egalas al 1, 4 metroj, sed la plej profundaj lokoj egalas al 3,9 metroj. En la lagon enfluas du riveretoj kaj Jamno mem estas ligita kun la Balta Maro per la kanalo Jamno-fluo, kiu ofte dum ŝtormoj estas sablobarita. Kvankam la akvokvalito de la lago en la lastaj jaroj pliboniĝis, sed  daŭre ĝi servas kiel enfluejo de forfalaĵoj, pluvakvo kaj malvarmig­itaj akvoj de la vodko­produktejo el Osieki. Unu el la gravaj defioj estas sendube plibonigi ĝian akvo­kvaliton. Dume la lago estas utiligata por intense praktikataj akvosportoj, laŭe de ĝiaj bordoj troviĝas pluraj jaktaj havenetoj kaj dum la somera sezono tra Jamno navigas turisma ŝipo. Sed jam post unu jaro dank’ al la konstruata kluzo kreiĝos rekta navigovojo inter la lago kaj la Balta Maro. La urbo­aŭtoritatoj konscias, ke Jamno daŭre estas loko laŭ la turisma vidpunkto ne plene utiligita kaj ligas multajn esperojn, ke la situacio baldaŭ signife ŝanĝiĝos.

Ni ne limiĝu al Jamno. Ja en la makro­regiono de Koszalin multas turismaj centroj, ripozejoj kaj kuracejoj, marhavenoj kaj havenoj de la plezur­navigado.  Sur la tereno troviĝas ankaŭ pluraj naturrezervejoj kaj Słowiński Nacia Parko, unu el 23 en Pollando, establita antaŭ pli ol 45 jaroj. Ĝuste al ĝi ni donu kelkan atenton.

La Parkon karakterizas la apudmaraj lagoj, marĉoj, herbejoj, torfejoj, apudmaraj arbaroj kaj unuavice dunoj. La apudmaraj lagoj distingiĝas per tio, ke dum fortaj ŝtormoj periode enfluas ilin la marakvo kaj tio favoras la kreskadon de halofitoj. Entute sur la tereno de la Parko kreskas ĉ. 920 specioj de vaskulaj plantoj, 165 specioj de briofitoj, 500 specioj de algoj, 430 fungo­specioj, inter kiuj 77 estas strikte protekt­endaj. Inter faŭno plej riĉe estas reprezent­itaj birdoj, entute 260 specioj. La duonon konsistigas la akvobirdaro kaj marĉo­birdaro. Riĉe reprezentiĝas insektoj, amfibioj, rampuloj, mamuloj. Kiel kuriozaĵon valoras noti la aperantajn foj-foje tie fokojn kaj focenoj. Sur la tereno de la Parko estis establitaj 12 striktaj kaj 3 partaj naturezervejoj.

Antaŭ ses mil jaroj sur la tereno de la Parko etendiĝis la balta golfo kun bordoj formitaj de morenaj altaĵoj, kiuj estis restaĵo de la skandinnavia glaĉero, plene malaperinta antaŭ 10 mil jaroj. Pro la efikado de baltaj ondoj, ventoj, marfluoj kaj alŝutiĝanta sablo kreiĝis malvasta sabloza duoninsulo izolanta la golfon disde la maro. En la histori­daŭro ĝi grandiĝis kaj nun longas 35 kilometrojn kaj vastas inter unu kaj 15 kilometroj. La procezo de la sablo­alŝutado daŭras, kaj ĝuste tiu procezo respondecas pro vastaj moviĝantaj dunoj. Tio estas kuriozaĵo laŭ la eŭropa skalo. En 1977 Słowiński Nacia Parko estis – kadre de la programo Homo kaj Biosfero – enigita de Unesko en la reton de la Mondaj Rezevejoj de Biosfero. Ekde 1995 ĝi troviĝas sur la listo de protektendaj terenoj akvo-kotaj kun internacia natur­signifo, kiu estis proklamita en la irana Ramsar.

Legas Barbara

--------------------------------------------------------------------------------

E_elsendo el la 31.05.2013
[2013-05-31]
https://pola-retradio.org/2013/05/e_elsendo-el-la-31-05-2013/

Podkasto: Ludu en nova fenestro | Elŝutu

Multaj komentoj kaj reagoj  pri la novaj eblecoj de la funkcianta jam unu monaton nova adreso de la Pola RetRadio en Esperanto ĉe www.pola-retradio.org dominas en la nunsemajna Leterkesto. Antaŭas ĝin aŭdiĝantaj komence aktualaĵoj, felietono pri laŭvica vidindaĵo, ĉi-foje Murżanów-Parko en la okcidenta Pollando, informo pri la 2-a monda ekzamentago laŭ KER-sistemo. Varsovian folkloran kanton plenumas la ensemblo de la Varsovia Politekniko.

Pere de la paĝo www.pola-retradio.org estas konsulteblaj tekstoj de aktualaĵoj kaj de la felietono pri laŭvica vidindaĵo, Mużakowski-Parko. Akompanas ilin sondokumentoj el la hodiaŭa elsendo.

--------------------------------------------------------------------------------

Malbona konjunkturo por polaj juvelistoj
[2013-06-02]
https://pola-retradio.org/2013/06/malbona-konjunkturo-por-polaj-juvelistoj/

Malbonan konk­junkturon spertas juvelistoj. Kvankam briliantoj vendiĝas bonege same la juvelistaj vendejretoj, kiel ankaŭ individuaj juvelistoj fermas butikojn. En Puls Biznesu Krzysztof Madelski, la prezidanto kaj kreinto de la juvelista marko Yes konfesis, ke kreskon notas sole ne tro kostaj porokazaj juveletoj kaj  juvelaro plej multekosta. Furoras briliantoj, pri kies vendo kontentas same la firmao Yes, kiel ankaŭ Apart. Entute la 2012 jaro estis rekorda, se temas pri la vendado de juveloj kun briliantoj. Apud briliantoj prosperas la merkato de luksaj horloĝoj. Ilia vendateco kreskas ĉiujare. Tamen ne ĉiuj juvelistoj antaŭvidis tiun konjunkturon, do plimulto de la juvelistaj vendejoj spertas malfacilan periodon. Des pli, ke la klientoj ankaŭ ŝparas. Okazas, ke ili rezignas pri la atradiciaj oraj geedzaj ringoj, kontentiĝante per la arĝentaj.

El la elsendo, 25.06.2013. Legas Tomek

Mabona konjunkturo por polaj juvelistoj

--------------------------------------------------------------------------------

E_elsendo el la 04.06.2013
[2013-06-04]
https://pola-retradio.org/2013/06/e_elsendo-el-la-04-06-2013/

Podkasto: Ludu en nova fenestro | Elŝutu

Katalin Kovats estas la gasto de la 234-a E-elsendo ĉe www.pola-retradio.org antaŭ la planita por la 8-a de junio 2-a Monda KER-ekzamenttago. Komence de la programo aŭdiĝas aktualaĵoj, temoj el la pola gazetaro kaj scienca bulteno. Muzike akompanas nin la litova grupo Asorti per sia kanto Ni kredu Amiko.

Pere de la sama adreso estas jam legeblaj kaj samtempe aŭskult­eblaj aktualaĵoj kaj informoj el la scienca bulteno de la hodiaŭa elsendo.

--------------------------------------------------------------------------------

Polaj Tagoj en Erevano, Armenio
[2013-06-05]
https://pola-retradio.org/2013/06/polaj-tagoj-en-erevano-armenio/

Tri mil personoj partoprenis la ĵus finiĝintajn Polajn Tagojn en Erevano. Unu el la plej gravaj eventoj de la nunjara eldono organizita de la Pola Ambasado en Armenio estis lanĉo de la universitata Centro de la Pola Lingvo.

En la daŭro de la Tagoj okazis koncertoj kun komponaĵoj de Witold Lutosławski, lekcioj pri la pola nuntempa muziko; estis prezentitaj ses monodramoj en la plenumo de polaj aktoroj. Okazis krome prezento de la nuntempaj polaj filmoj, labor­renkontoj popularigantaj  ekologiajn pakumojn, lekcioj  pri la historio kaj geografio de Pollando. Estis prezentitaj projektoj de la pola evoluiga helpo por Armenio. renkontiĝoj de polaj diplomatoj kun la akademia junularo kaj neregistaraj organizoj.

Kiel menciite grava evento estis malfermo de la Centro de la Pola Lingvo promocianta la polan lingvon kaj kulturon en la Lingva Univiversitato de Erevano.

Legas Krystyna

Polaj Tagoj en Erevano, Armenio

--------------------------------------------------------------------------------

E_elsendo el la 07.06.2013
[2013-06-07]
https://pola-retradio.org/2013/06/e_elsendo-el-la-07-06-2013/

Podkasto: Ludu en nova fenestro | Elŝutu

La enhavo de la 235-a E-elsendo de la Pola RetRadio ĉe www.pola-retradio.org konsistas el la komencaj aktualaĵoj, arkiva interparolo, informo de nia hispana aŭskultanto Tonjo del Barrio pri interesa Tago de la Libro en la madrida San Fermin kaj leterkesta renkontiĝo. Per la arkiva interparolo el 1988 ni omaĝas la memoron de la forpasinta la 4-an de junio 2013 longjara parolista kunlaboranto de nia E-Redakcio de Pola Radio, Lucjan Szołajski.

La komencaj aktualaĵoj kaj la informo el Madrido de Tonjo del Barrio estas samtempe legeblaj kaj aŭskulteblaj en la rubrikoj Novaĵoj kaj Aŭskultantoj kontribuas.

--------------------------------------------------------------------------------

E_elsendo el la 11.06.2013
[2013-06-11]
https://pola-retradio.org/2013/06/e_elsendo-el-la-11-06-2013/

Podkasto: Ludu en nova fenestro | Elŝutu

La pasanta hodiaŭ 156-a naskiĝ­datreveno de Antoni Grabowski enhave dominas en la 236-a E-elsendo ĉe www.pola-retradio.org. Ni informas pri la semajnfinaj Grabowski-Tagoj en Toruń (la norda Pollando), Barbara Pietrzak felietonas pri Grabowski, kiel E-pioniro kaj patro de la E-poezio. Specimene el niaj arkivaĵoj ni prezentas fragmenton de la enkonduko al plej grandioza tradukverko de Grabowski, kiu estas „Sinjoro Tadeo” de Adam Mickiewicz. Recitas Zbigniew Lutogniewski.

La ĉi-marda aktuala segmento de la programo limiĝas al aktualaĵo, temo el la pola gazetaro  kaj scienca informo Ili ĉiuj estas jam samadrese legeblaj kaj samtempe aŭskult­eblaj, simile kiel la feliotono pri Antoni Grabowski.

--------------------------------------------------------------------------------

E_elsendo el la 14.06.2013
[2013-06-14]
https://pola-retradio.org/2013/06/e_elsendo-el-la-14-06-2013/

Podkasto: Ludu en nova fenestro | Elŝutu

La programo de la 237-a E-elsendo de la Pola RetRadio ĉe www.pola-retradio.org proponas aktualaĵon, felietonon pri prof. Jan Czochralski, kiel koninda polo. E-informo rilatas al aktivado de UEA-komisiitoj ĉe UN. En Leterkesto oni traktas recenzajn leterojn de la aŭskultantoj el Kanado, Finnlando kaj Ĉinio. Kantas Georgo Handzlik.

En la redakcia retejo en la rubriko Novaĵoj kaj Felietonoj eblas aŭskulti kaj samtempe legi la tekstojn de la novaĵo kaj felietono el la aktuala E-elsendo.

--------------------------------------------------------------------------------

E_elsendo el la 18.06.2013
[2013-06-19]
https://pola-retradio.org/2013/06/e_elsendo-el-la-18-06-2013-2/

Podkasto: Ludu en nova fenestro | Elŝutu

Aktualaĵoj en la E-elsendo  de la Pola RetRadio www.pola-ret-radio.org el la 18-a de junio 2013 konsistas el novaĵoj, temoj el la pola gazetaro. Kantas Mélanie Prin kaj ŝian kanton Morgaŭ [E-vortoj de Lorenzo Tomezzoli] sekvas scienca bulteno kaj interparolo kun Stanisław Mandrak pri Ĉebalta E-ista Printempo, kiun semajnfine partoprenis Barbara.

En la rubrikoj Novaĵoj kaj Sciencaj Informoj aldoniĝis entute kvin tekstoj el la lastmarda E-elsendo, kiuj estas paralele aŭskulteblaj. La kanto de Mélanie Prin Morgaŭ (Demain) estas aŭskultebla en YouTube. Surekrane estas videblaj la E-vortoj de la kanzono.

--------------------------------------------------------------------------------

E_elsendo el la 21.06.2013
[2013-06-21]
https://pola-retradio.org/2013/06/e_elsendo-el-la-21-06-2013/

Podkasto: Ludu en nova fenestro | Elŝutu

La programo de la 239-a E-elsendo de la Pola RetRadio ĉe www.pola-retradio.org komence enhavas aktualaĵojn. Nia felietono estas dediĉita la Marborda Regiono de Koszalin. La E-informoj rekomendas teatran staĝon en la franca Grezijono en aŭgusto kaj tuj poste sekvontajn 17-ajn Internaciajn E-Renkontiĝojn en la bretona Plouzek. La elsendon finas la leterkesta renkontiĝo. Kante akompanas nin la hispana grupo Kvaropo Sinkopo, en kies plenumo ni aŭdas Kiu velas sur mar’.

Ankaŭ ĉi-foje du komencaj aktualaĵoj kaj la teksto de nia ĉi-vendreda felietono estas legeblaj kaj paralele aŭdeblaj en la rilataj rubrikoj.

--------------------------------------------------------------------------------

Islando suspendas interparolojn kun la Unio
[2013-06-25]
https://pola-retradio.org/2013/06/islando-suspendas-interparolojn-kun-la-unio/

La afer-­reprezentanto de la nova islanda registaro anoncis, ke la unua paŝo de la kabineto estos ĉesigo de aliĝinterparoloj kun la Eŭropa Unio. La interparoloj, laŭ la anonco de reprezentantoj de la nova registaro, povos esti restarig­itaj nur kondiĉe, ke tion akceptos la civitanoj de Islando en la tutlanda referendumo. Kiel asertas observantoj tio estas tre malverŝajna.

La nova ĉefministro de la koalicia registaro en Rejkjaviko estas Sigmundur Gunnlaugsson, la estro de la centra Partio de Progreso. Aliflanke Bjarni Benediktsson, la gvidanto de la konservativula Partio de Sendependeco, kiu ricevis dum la aprilaj balotoj iom malpli da voĉoj fariĝis la financministro. La plej grandaj malvenk­intoj de la islandaj balotoj estas Socialdemokrata Alianco kaj la Movado de Maldekstrulaj Verduloj, kiuj grave kontribuis al elkonduko de Islando el profunda kaj ankoraŭ ne finiĝinta krizo, samtempe klopodante pri aliĝo de Islando al la Unio.

Samtempe kun la  pliboniĝado de la interna ekonomia situacio ŝanĝiĝis la rilato de islandanoj al la Unio. Nun dominas la opinio, ke la eŭropunia membreco ligiĝas kun minaco por la landa suvereneco, limigante i.a. la liberon de la fiŝkaptado kaj balen­kaptado.

Legas Krystyna

Islando suspendas interparolojn kun la Unio

--------------------------------------------------------------------------------

Marŝoj subtene por Vivo kaj Familio
[2013-06-25]
https://pola-retradio.org/2013/06/marsoj-subtene-por-vivo-kaj-familio/

En ĉirkaŭ 100 polaj urboj lastdimanĉe estis organizitaj Marŝoj subtene por Vivo kaj Familio . Nunjare ili okazis sub la devizo „ Direkto: la Familio ” kaj la ĉefa atento estis donita al la drameca demografia situacio en Pollando. Nome inter 222 ŝtatoj ĝi troviĝas ĉe la 211-a loko, se temas pri la infannombro.

La partoprenantoj manifestis samtempe ligiĝon al la familiaj valoroj kaj respekton por la vivo ekde la koncipiĝo ĝis la natura morto.  En Varsovio la marŝon – kiu komenciĝis ĉe Kopernik-monumento kaj finiĝis per familia pikniko en la Saksa Parko partoprenis ĉ. 10 mil personoj. Oni estis kolektantaj subskribojn sub la civitana leĝdona iniciato, kies celo estas firmigo de la familio, en kiu la geedza paro konsistas el virino kaj viro  kaj el la naskiĝintaj iliaj infanoj.  Kiel akcentis la afer­prezentantino de la marŝo ĝi celas atentigi la publikan opinion pri tio, ke la familio devas esti traktata kiel  prestiĝa publika institucio pro siaj taskoj kaj funkcioj. La marŝoj celas instigi la aŭtoritatojn envivigi solvojn, kiuj al familio helpas.

Lastlunde prezidento Bronisław Komorowski avertis  dum renkontiĝo kun la gvidantoj de politikaj partioj pri la minaco de demografia kolapso.

Legas Krystyna

Marshoj subtene por vivo kaj familio

--------------------------------------------------------------------------------

Ebleco de limkontroloj ene de Schengen-sfero
[2013-06-25]
https://pola-retradio.org/2013/06/ebleco-de-limkontroloj-ene-de-schengen-sfero/

Por maksimume du jaroj ĉiu el la ŝtatoj de Schengen-sfero povas revenigi la lim­kontrolojn, se tion ĝi rekonos necesa. Tian interkonsenton el­intertraktis post longdaŭraj interparoloj la ŝtatoj-membroj de la Eŭropa Unio, la Eŭropunia Parlamento kaj la Eŭropa Komisiono. Ankaŭ la ĝisnunaj principoj de Schengen-traktato allasis portempan revenigon de la intern-lima kontrolo en unuopaj landoj kaze de endanĝerigo de la publika ordo aŭ interna sekureco. Tian kontrolon  en 2008 revenigis dum la eŭropa futbalista ĉampionado Aŭstrio.

Ĝis nun oni ne traktis la revenigon de kontraloj pro nelegalaj enmigrantoj. La nunajn interparolojn spronis amaso da enmigrantoj el la norda Afriko post la araba printempo  lime de 2010 kaj 2011.

Nun revenigi la internan lim­kontrolon eblos en apartaj kazoj, kiujn severe kontrolos  la oficejo de la komisaro por la internaj aferoj. Schengen-traktato garantias en Eŭropo la liberon moviĝi. Ĉe la limoj de 26 ŝtatoj apartenantaj al la sfero kontroloj ne ekzistas. Temas pri areo enloĝata de pli ol 400 mil personoj. La longeco de ĝiaj eksteraj kontinentaj limoj egalas al 7700 kilometroj, de la maraj limoj al 42 mil 700 kilometroj.

Legas Krystyna

Ebleco de limkontroloj ene de Schengen-sfero

--------------------------------------------------------------------------------

La programo PRISM funkcias
[2013-06-25]
https://pola-retradio.org/2013/06/la-programo-prism-funkcias/

La usona in­vigilservo konfirmis la gazetarajn informojn pri la monitorado de eksterlandaj internaŭtoj. Agentoj utiligis la programon PRISM por akiri donitaĵojn pri tiuj, kiuj loĝas ekster Usono – diris al la televido NBC James Clapper, la direktoro de National Intelligence. Li aldonis, ke la usona Nacia Sekurecagantejo notis jam donitaĵojn pri deliktoj ligitaj kun malkaŝo de informoj pri la programo PRISM. La informo, ke la Nacia Sekurecservo kaj FBI traserĉas  donitaĵojon de 9 ĉefaj interretaj konzernoj aperis en „The Washington Post”. Sekve elektronikaj mesaĝoj, fotoj, dokumentoj, aŭdo- kaj video-dokumentoj estas de ili senĝene konsultebaj. La estroj de guglo kaj fejsbuko Larry Page kaj Mark Zuckerberg kontestis, ke ili sciis pri la ekzisto de la sistemo PRISM.

Legas Tomek

La programo PRISM funkcias

--------------------------------------------------------------------------------

Testado de medikamentoj
[2013-06-25]
https://pola-retradio.org/2013/06/testado-de-medikamentoj/

La testado de medikamentoj tiamaniere, ke la sanstato de paciento ne estu damaĝita signifas veran defion por sciencistoj. Kiel ni legis en Dziennik Polski krakovaj sciencistoj laboras pri metodologio ebligonta etikan pritakson de bio­medicinaj esploroj, kiujn partoprenas homoj. La testado de medikamentoj, kiun partoprenas same pacientoj, kiel ankaŭ personoj sanaj fariĝas ĉiam pli populara. En Pollando ĉiujare nur en klinikaj testadoj partoprenas 30 mil personoj. Ĉiujare aldoniĝas ĉirkaŭ 450 novaj klinikaj ekzamenadoj pri kurac­produktoj kaj medicinaj elfaraĵoj. Doktoro Marcin Waligóra, adjunkto en la Instituto pri Filozofio kaj Bioetiko de Collegium Medicum de la Jagellona Universitato gvidas la projekton financatan de la Nacia Scienca Centro. Ĝia celo estas respondi la demandon kiel efike gvidi esplorojn en biomedicino, ke la risko de la sanperdo estu laŭeble minimuma. La bazaj principoj jam validas, sed multaj aspektoj de biomedicinaj ekzamenoj ne estas ankoraŭ leĝe reguligitaj. Mankas ankaŭ devigaj instrukci­adoj kaj ekzamenoj por membroj de la bioetikaj komisionoj, t.e. organoj pri­taksantaj kaj akceptantaj la sekurecon kaj pravig­eblecon de projektataj medicinistaj esploroj.

Legas Tomek

Testado de medikamentoj

--------------------------------------------------------------------------------

Demokratio progresas en Pollando
[2013-06-25]
https://pola-retradio.org/2013/06/demokratio-progresas-en-pollando/

Dum la lastaj 4 jaroj Pollando avancis de la 10-a je la 3-a loko en la pritakso de demokratio kaj la stato de ekonomio en la Centra-Orienta Eŭropo. Tio rezultas el la prestiĝa ekzamenado de Bertelsmann-Fondaĵo.Ĝi okazas de 10 jaroj en pli ol 120 landoj de la mondo, kiuj subiĝis aŭ subiĝas al transformado. La unuopaj landoj estas pritaksataj en tri kategorioj: demokrati-kvalito, la stato de la merkata mastrumado kaj administrado.Sendube temas pri eksterordinaraj rezultoj. Ankoraŭ antaŭ 4 jaroj Pollando okupis du 7-ajn lokojn kaj unu 9-an en la ĵus menciitaj kategorioj.

Ŝajnas do, ke la pola demokratio notas ĉiam pli bonajn rezultojn. Laŭ la pritakso de sociologo, profesoro Radosław Markowski – ekster la limoj de nia lando oni reliefigas grandan ekonomian sukceson, pli ĝenerale,  grandan evoluan sukceson de Pollando.

Legas Krystyna

Demokratio progresas en Pollando

--------------------------------------------------------------------------------

Malbona nutrado de infanoj
[2013-06-25]
https://pola-retradio.org/2013/06/malbona-nutrado-de-infanoj/

Internaciaj ekspertoj publikigis en la medicina semajnrevuo The Lancet statistik­aĵojn, laŭ kiuj rezultas, ke preskaŭ la duonon de mortoj de malgrandaj infanoj en la mondo kaŭzas malbona nutrado. Pro la subnutro ĉiujare mortas tri milionoj da infanoj ĝis la 5-a vivojaro. Tamen malbona nutrado signifas ne sole la subnutradon, sed ankaŭ tronutradon, kiu kondukas al obezeco. Tiuj problemoj koncernas unuavice landojn mizerajn kaj meze bonstatajn. La kostoj de malbona nutrado estas astronomiaj kaj egalas al tri kaj duona bilionoj da dolaroj jare. Kalkulite je ĉiu loĝanto de la Tero temas pri 500 dolaroj jare. Tiuj kostoj rezultas el necesaj rimedoj por la kuracado, ili ligiĝas ankaŭ kun perdoj de la monda mastrumado, ĉar personoj subnutritaj en matura vivo estas profesie malpli produktivaj.

Malbona nutrado estos temo de speciala internacia pint­renkonto en Londono. Traktos ĝin ankaŭ venont­semajne en la norda Irlando  la pintrenkonto de la ŝtatoj el la grupo G8. Samtempe lastĵaŭde UNEP, la UNO-a agentejo por la aferoj de la medio komunikis, ke en la mondo oni misuzas de 30 ĝis 40 procentojn de ĉiuj produktitaj nutraĵoj. Aliflanke la maja raporto de la karitata organizo Savi Infanojn elmontris, ke pro la subnutro ĉiu kvara infano en la mondo povas fronti problemojn kun la legado, skribado kaj nombrado.

Legas Krystyna

Malbona nutrado de infanoj

--------------------------------------------------------------------------------

Kresko de la aprila industria produktado
[2013-06-25]
https://pola-retradio.org/2013/06/kresko-de-la-aprila-industria-produktado/

La Ĉefa Statistika Oficejo sciigis, ke la industria produktado en aprilo kreskis je 2,7 procentoj. En marto ĝi havis minusan valoron. Pli fruaj monatoj ankaŭ ne estis optimism­igaj. Pozitivan efikon havis la fakto, ke en aprilo estis de pli labortagoj, samtempe kelkaj laboroj estis ŝovitaj pro tre longa ĉi-jare vintro. Aliflanke malkreskas enlaborigo kun samtempa kresko de salajroj. Ili estis kreskantaj je 3 procentoj en la periodo, kiam inflacio estis malpli alta. El tio sekvis reala salajro­kresko.

Legas Milada

Kresko de aprila industria produktado

--------------------------------------------------------------------------------

La unua vivo de Angela M.
[2013-06-25]
https://pola-retradio.org/2013/06/la-unua-vivo-de-angela-m/

Angela Markel en la epoko de Germana Demokrata Respubliko estis – en pli granda grado ol asertite ĝis nun – engaĝita en la agadon de la komunista junulara organizo FDJ, asertas la aŭtoroj de ŝia nova biografio La unua vivo de Angela M. Kiel laboranto de la Sciencakademio de GDR, Merkel en la Centra Instituto de Fizika Kemio, lime de la 70-aj kaj 80-aj jaroj, estis sekretario por la agitado kaj propagando. La libro de Ralf Georg Reuth kaj Guenther Lachmann aperis antaŭnelonge en Germanio. Ĝis nun Merkel asertis, ke ŝi respondecis tiam sole pri kultur­aferoj. Post la apero de la libro ŝi komentis, ke plej gravas por ŝi tio, ke nenion ŝi kaŝis.  Ŝi aldonis: Mi povas baziĝi sur miaj propraj rememoroj [..] se nun evidentiĝas, ke estis alie, ankaŭ kun tio eblas vivi .

Legas Milada

La unua vivo de Angela M

--------------------------------------------------------------------------------

Mia lernejo en la Eŭropa Unio – Akademio de Juna Diplomato
[2013-06-25]
https://pola-retradio.org/2013/06/mia-lernejo-en-la-europa-unio-akademio-de-juna-diplomato/

Junaj laŭreatoj de la 10-a eldono de la konkurs­programo “Mia lernejo en la Eŭropa Unio – Akademio de Juna Diplomato” partoprenos ekskurson al la ĉefurboj de la landoj de la Viŝegrada Grupo. Al ĉiuj 10 eldonoj de la konkurso aliĝis pli ol 13 mil lernejoj kaj 250 laŭreatoj partoprenis en la organizataj de la ministerio por la eksterlandaj aferoj studvizitoj. La konkursprogramo celas diskonigi inter la polaj gejunuloj konojn pri la Eŭropa Unio kaj pri diversaj aspektoj de la pola membreco en la Unio. Ĉi-jare la organizantoj koncentriĝis pri la nuntempa diplomatia servo en Pollando kaj en la Unio kaj la rolo, kiun ĝi havas en la internacia politiko. La junuloj i.a. interpretis vortojn de la eksa ĉeĥa prezidento, Vaclav Havel politiko ne estas arto pri tio, kio ebla – sed pri tio, kio estas malebla . Parto de la konkursaĵoj interpretis ankaŭ la moton de la pola diplomataro: Al Pollando servi, Eŭropon krei, la mondon kompreni.

Legas Milada

Mia lernejo en la Unio…

--------------------------------------------------------------------------------

Hagia Sofia en Istambulo denove estos moskeo
[2013-06-25]
https://pola-retradio.org/2013/06/hagia-sofia-en-istambulo-denove-estos-moskeo/

La islama organizo “Junaj el Anatolio” ĉiuvendrede organizos preĝojn antaŭ la sanktejo Hagia Sofia  en Istabulo – nun funkcianta kiel muzeo – favore al transformo de ĝi en moskeon. Tio estis deklarita dum la gazetara konferenco okaze de la 560 datreveno de la konkero de Konstantinopolo fare de turkoj. La sanktejo dediĉita al la Dia Saĝo konstruita en la 6-a jarcento estis transformita en moskeon post la konkero de Konstantinopolo fare de turkoj en 1453.  Antaŭ 80 jaroj la aŭtoritatoj de la laika turka ŝtato transformis ĝin en muzeon. Nun diversaj islamaj grupoj postulas, ke ĝi denove fariĝu moskeo.  En Turkio sep iamaj kristanaj bazilikoj de Dia Saĝo funkciis kiel muzeoj. Kvin el inter ili en la lastaj jaroj estis transformitaj en moskeojn.

Legas Gabi

Hagia Sofia en Istambulo denove estos moskeo

--------------------------------------------------------------------------------

Omaĝa rezolucio de la pola Senato
[2013-06-25]
https://pola-retradio.org/2013/06/omaga-rezolucio-de-la-pola-senato/

Hieraŭ la Senato omaĝis la memoron de poloj, kiuj antaŭ 70 jaroj fariĝis viktimoj de la amasmurdoj efektivigitaj de la ukrainaj bandoj UPA sur la tereno de Wołyń-regiono. En la rezolucio senatanoj difinis la krimon kiel etnan purigoakton, kun simptomoj de la hombuĉado.  La senata rezolucio memorigas, ke per la atako de UPA kontraŭ la vilaĝo Parośla Pierwsza en Wołyń-regiono komenciĝis la kampanjo de la fizika eliminado de poloj, efektivigita de Bander-frakcio de la Organizo de Ukrainaj Naciistoj kaj Ukraina Ribela Armeo. La rezolucio parolas pri ĉirkaŭ 100 mil murditaj poloj: viroj, virinoj, infanoj kaj maljunuloj, kio konformas al la donitaĵoj de la Instituto pri la Nacia Memoro.

Legas Krystyna

Omagha rezolucio de la pola Senato

--------------------------------------------------------------------------------

Kvotoj por la publika servo en la Unio
[2013-06-25]
https://pola-retradio.org/2013/06/kvotoj-por-la-publika-servo-en-la-unio/

La proponataj de la Eŭropa Komisiono kvotoj por la publika helpo povas kaŭzi en Pollando  likvidon de la sistemo, kiu subtenas la enlaborigon pere de krompagoj al la salajro.

La komisiono pretigis projekton de nova direktivo, laŭ kiu la menciita  kvoto egalu al unu dekono de procento de la landa produkto brutte de lando-membro el la antaŭa jaro aŭ al la kvoto, kies ekvivalento egalus al 100 milionoj da eŭroj. Kaze de Pollando temus pri 150 milionoj da zlotoj respektive 420 milionoj. Se la publika helpo superus iun el tiuj kvotoj necesus peti la Komisionon pri individua aprobo de la supero, plej malfrue en la daŭro de 6 monatoj. Dume la jaraj elpezoj de la Ŝtata Rekapabliga Fonduso de Neplenlertaj Personoj por krompagoj al salajroj egalas al pli ol 3 miliardoj da zlotoj. Tial la projekto de nova direktivo elvokas maltrankvilon de polaj labo­rdonanoj. Kiel substrekas en Dziennik Gazeta Prawna Jan Zając, la prezidanto de la Pola Organzio de la Labordonantoj de Neplenlertuloj – akcepto de direktivo en proponita formo signifus faktan likvidon de ĉi tiu helpoformo kaj ruinigon de la tuta sistemo subtenanta la enlaborigon de ne­plenlertuloj.

Legas Tomek

Propono de kvotoj por la publia helpo en EU

--------------------------------------------------------------------------------

Ĉina raketo en la komso
[2013-06-25]
https://pola-retradio.org/2013/06/cina-raketo-en-la-komso/

Reprezentantoj de la usona administracio neoficiale konstatis, ke Ĉinio okazigis pasintlunde testadon de nova transkapta raketo, kiu povas esti uzita por detrui satelitojn sur la ĉirkaŭtera orbito. La raketo leviĝis 10 mil kilometrojn super la ternivelo kaj sekve al la tero revenis. Temis pri la plej alta flugo post 1976. Similajn flugojn Usono okazigis en la 60-aj jaroj. Ĉinio informis, ke la flugo havis sciencan karakteron, la raketo estis enhavanta aparataron por esplori la magnetosferon. Pentagono monitoris la pasint­semajnan flugon. Kiel sciigis Reuter-agentejo la flugo de la ĉina raketo­ okazis unu semajnon post kiam Pentagono informis pri la usonaj klopodoj pri sekureco de satelitoj kaj kontraŭagado de virtualaj endanĝerigoj flanke de aliaj ŝtatoj en la kosma spaco.

Legas Milada

China raketo en la kosmo

--------------------------------------------------------------------------------

Nova ripozmodo – sen modernaj teknologioj
[2013-06-25]
https://pola-retradio.org/2013/06/nova-ripozmodo-sen-modernaj-teknologioj/

Multaj turistoj pretas pagi multon por dum la feriado ĝui plenan trankvilon. Tial poloj ĉiam pli ofte pasigas sian liberan tempon sen konsulti modernan teknologion. Laŭ esploroj de la firmoj Euromonitor kaj World Travel Market la feriado sen novaj teknologioj estas nova turisma tendenco,  kiu populariĝas ankaŭ en Pollando. Ĉiam pli da turismaj oficejoj, hoteloj kaj ripoz­centroj konsideras tion en sia oferto. La ekspertoj konvinkas, ke tio estas la plej bona maniero por sukcesa ripozo. Ripozlokoj liberaj de novaj teknologioj celas ĉefe personojn kun stresiga vivmaniero. Tiajn – kiel atentigas Dziennik Polski – kiuj eĉ dum libera tempo ne kapablas rezigni pri la kontrolado de elektronika poŝtkesto aŭ laborcela telefonado.

Legas Tomek

--------------------------------------------------------------------------------

4 Honoraj Konulejoj de Hungario en Pollando
[2013-06-25]
https://pola-retradio.org/2013/06/4-honoraj-konulejoj-de-hungario-en-pollando/

