Pola Humaneca Helpo 25-jariĝi
[2018-01-02]
https://pola-retradio.org/2018/01/pola-humaneca-helpo-25-jarigi/

Antaŭ pli ol 25 jaroj, la 26-an de decembro 1992 el Pollando forveturis la unua helpokonvojo por la sieĝata Sarajevo. Ekde tiam Pola Humaneca Helpo helpis al 9 milionoj 600 mil personoj damaĝitaj pro militoj, kataklismoj, totalismaj sistemoj en 44 landoj. La ĉefa devizo de la organizaĵo establita kaj gvidata de Janina Ochojska estas igi la mondon pli bona dank’ al malgrandigo de sufero kaj portado de humanismaj valoroj. Pola Humaneca Helpo gvidas konstantajn misiojn en Sirio, la suda Sudano, Somalio, la orienta Ukrainio kaj Irako reagante ankaŭ je subitaj krizoj. Ĝi gvidas ankaŭ la programon de kromnutrado de infanoj en Pollando.

El la elsendo 02.01.2018. Legas Maciek – 0’52”

--------------------------------------------------------------------------------

50 milionoj da eŭroj el Pollando por migrokrizo
[2018-01-02]
https://pola-retradio.org/2018/01/50-milionoj-da-euroj-el-pollando-por-migrokrizo/

Pollando kiel la unua lando de la Eŭropa Unio subskribis kontrakton kun Eŭropa Investa Banko pri partopreno en Iniciato de Ekonomia Subteno. 50 milionoj da eŭroj estas senprecedence alta kvoto destinita de Pollando por iniciato ligita kun la migrokrizo. La partopreno de Pollando en ĉi tiu programo estas sekvo de la konsekvece realigata strategio, ke la plej efika formo reagi je la migrokrizo estas helpo donata en la landoj tuŝitaj de la konfikto aŭ en la landoj najbaraj. La pola aliĝo al la programo signifas solidaran kontribuon fronti la plej seriozajn evoluajn, humanecajn kaj migrajn defiojn en la najbarejo de la Unio. La 50-milioneŭra subteno de Pollando estas la plej alta inter la ĝis nun deklaritaj de la uniaj ŝtatoj-membroj. Nia partopreno en la programo koncentriĝos en la helpoagadoj en Libano, Jordanio kaj ĉe la Okcidenta Bordo, kio konformas al la plurjara pola programo pri evolukunlaboro 2016-2020.

El la elsendo 02.01.2018. Legas Maciek – 1’06”

--------------------------------------------------------------------------------

Diamentosimila materialo el grafeno
[2018-01-02]
https://pola-retradio.org/2018/01/diamentosimila-materialo-el-grafeno/

Sciencistoj el la novjorka universitato prezentis kiamaniere eblas utiligi du tavolojn de grafeno, ĉiu kun dikeco de unu atomo – por produkti en la ĉambra temperaturo diamentosimilan materialon. Baptita anglalingve „diamene” ĝi havas eksterordinarajn proprecojn, kiuj povas trovi multajn aplikojn – de akvoimunaj protektosurfacoj ĝis ultraleĝeraj kugloimunaj kamizoloj. Diameno estas la plej maldika iam ajn kreita materialo havanta rigidecon kaj malmolecon de diamento. Dum la testado de grafito aŭ unusola grafentavolo oni sentas molan tavolon. Sed kiam la grafita folio estis dutavola evidentiĝis, ke la materialo sub la premo fariĝas eksterordinare dura kaj pli rigida ol diamento. Diameno estas mola kaj fleksebla nur ĝis momento kiam oni grandigas premon. Grafito kaj diamento estas karbonaj substancoj, sed la atomoj en ĉi tiuj materialoj estas aranĝitaj diversmaniere, kun kio ligiĝas iliaj proprecoj. La nova tekniko prilaborita de usonaj sciencistoj ebligas manipuli per grafeno tiel,  ke ĝi akiru en difinitaj kondiĉoj deziratajn proprecojn de diamento.

El la elsendo 02.01.2018. Legas Tomek  – 1’14”

sc_tm_Eksterordinara_materialo_el_grafeno_01’14”.mp3; filename_=UTF-8”sc_tm_Eksterordinara materialo el grafeno_0114

--------------------------------------------------------------------------------

Novaj eksponaĵoj en la naturscienca centro en Bialistoko
[2018-01-02]
https://pola-retradio.org/2018/01/novaj-eksponajoj-en-la-naturscienca-centro-en-bialistoko/

Preskaŭ 800 diversspecaj mineraloj, rokoj, meteoritoj kaj tektitoj riĉigis la universitatan Natursciencan Centron en Bialistoko, kiel donaco de la geedza paro Irena kaj Jan Data. La kolekto de la polaj geologoj estos disponigita al vizitantoj meze de januaro 2018. La Centro funkcianta ekde 1999 posedas ĝis nun ĉirkaŭ 6 mil eksponaĵojn. En la donacita kolekto troviĝas 745 diversaj mineraloj kaj rokoj, inter kies plej valoraj objektoj troviĝas agatoj. Multaj devenas el polaj fosejoj, sed troviĝas ankaŭ agatoj el Ĉeĥio, Maroko, Bocvano, Brazilo kaj Aŭstralio. Al la centro trafis ankaŭ la tn. kaktaj ametistoj, piritoj, grenatoj, galenoj kaj multaj aliaj mineraloj el ĉiuj kontinentoj. Kolekto de la kosmodevena materio, t.e.  meteoritoj kaj tektitoj konsistas el 40 objektoj kaj donos komencon al kreota en la Centro nova kolekto. La novaj akiraĵoj estos prezentataj komence en portempa ekspozicio. Sekve elektotaj eksponaĵoj estos rigardeblaj en unu el konstantaj ekspozicioj de la Universitata Naturscienca Centro en Bialistoko, kiuj okupas la areon de 750 kvadrataj metroj.

El la elsendo 02.01.2018. Legas Tomek  – 1’18”

sc_tm_Naturscienca_kolekto_en_Bialistoko_ricigis_01’18”.mp3; filename_=UTF-8”sc_tm_Naturscienca kolekto en Bialistoko ricigis_0118

--------------------------------------------------------------------------------

E_elsendo el la 02.01.2018
[2018-01-02]
https://pola-retradio.org/2018/01/e_elsendo-el-la-02-01-2018/

Podkasto: Ludu en nova fenestro | Elŝutu

La 715-a E_elsendo el la 02.01.2018 ĉe www.pola-retradio.org

– En la literatura fragmento de nia unua en 2018 E-elsendo ni proponas la 63-an fragmenton de la romano de Henryk Sienkiewicz „Quo Vadis” en la E-traduko de Lidia Zamenhof. – La komencaj aktualaĵoj rilatas al 50-milioneŭra kontribuo de Pollando por solvi la migrokrizon kaj 25-jariĝo de la organizo Pola Humaneca Kampanjo. – La scienca bulteno enhavas informojn pri „diameno” la nova materialo kun eksterordinaraj proprecoj akirita el grafeno kaj pri riĉiĝo de la Naturscienca Centro en Bjalistoko per nova kolekto de mineraloj. – En la hodiaŭa programo ni memorigas malnovan, ĉar 65-jaran kanzonon pri Varsovio en la plenumo de Andrzej Tomecki. La E-vortojn por la kanzono de Władysław Szpilman verkis Andrzej Pettyn. – La foto akompananta la programinformon prezentas unu el la eksponaĵoj de la riĉa kolekto de la Naturscienca Centro en Bjalistoko. – Nia elsendo estas aŭskultebla ankaŭ en jutubo pere de: https://www.youtube.com/results?q=pola+retradio&sp=CAI%253D

--------------------------------------------------------------------------------

Solena parado de la Tri Reĝoj
[2018-01-05]
https://pola-retradio.org/2018/01/solena-parado-de-la-tri-regoj/

Sabate, en la festo de Epifanio, la 6-an de januaro tra 644 loĝlokoj en Pollando kaj 16 ekster ĝiaj limoj ekmoviĝos Solenaj Paradoj de la Tri Reĝoj. La plej granda estos la varsovia, kiu startos de sur la Kastela Placo tuj post la Anĝeluso. Temas pri laŭvice jam 10-a publika evento,  por kiu estas invititaj ĉiuj,  konforme al la devizo „Dio estas por ĉiuj”. La nunjaraj figuroj de la Tri Reĝoj reprezentos tri kontinentojn kaj tri generaciojn. Junulo, simbolos homon, kiu sojle de sia plenkreska vivo serĉas kaj trovas la vivvokiĝon. Matura vivo – reprezentanta edzojn kaj familipatrojn – simbolas homon, kiu serĉas Jesuon kaj ĝustan vojon por si mem kaj sia familio. Oldulo, reprezentas grizaĝan generacion, kiu fine de sia vivo, riĉa je multaj spertoj, retrovas vojon al Jesuo. La akompana publiko ankaŭ en kronoj kaj kun reĝaj atributoj tradicie komune plenumos la kristnaskajn kantojn, ankaŭ teme ligitajn kun la Epifanio. Okaze de la pasanta nunjare 100-jariĝo de la renaskiĝo de Pollando la tradicia kantolibro por la publiko enhavas 14 polajn kristnaskjn kantojn kun ilia historia priskribo. Dum evento okazos kvestado „La Saĝuloj por la Oriento” cele al kulturaj kaj edukaj institucioj funkciantaj ekster la orienta limo de Pollando. Kun ĉiu jaro sur la mapo de la solena parado aldoniĝas novaj lokoj, lastatempe ĉirkaŭ 100. Ne nur en Pollando, sed ankaŭ en la mondo. En 2018 ekster Europo la paradoj okazos en Afriko kaj la Norda Ameriko.

El la elsendo 05.01.2018. Legas  Milada – 2’12”

--------------------------------------------------------------------------------

La sukcena Stelo de Paco por Bet Leĥem
[2018-01-05]
https://pola-retradio.org/2018/01/la-sukcena-stelo-de-paco-por-bet-lehem/

La 6-an de januaro 2018 en la Groto de la Naskiĝo de Jesuo en Bet Leĥem estos instalita eksterordinara verko de la pola sukcenartisto Mariusz Drapikowski. Temas pri lia donaco, Stelo de Paco el la montara kristalo, orumita metalo kaj sukceno. Sur ĝiaj ok brakoj troviĝas la surskribo Stelo de Paco en 16 lingvoj i.a. aramea, pola, japana, ĉina, araba, hebrea, angla, franca kaj itala. Ĝi troviĝos sur la volbo de la groto en la parto apartenanta al katolikoj. La Stelo de Paco per delikata lumo traiĝados tra montara kristalo kaj sukceno lumigante varmkolore la lokon, kie laŭ la tradicio Jesuo estis metita en la stalon. Ĝi troviĝos ĉirkaŭ du metrojn for de la stelo troviĝanta en la planko en la ortodoksa parto de la groto. La ok brakoj de la Stelo  enhavas simbolan signifon. La cifero ok referencas al Kristo, kiel Nova Komenco, ĉar sep en la hebrea ikonografio signifas tempon plenumitan, fermitan. La stelo enhavas polajn akcentojn. Temas pri la uzita sukceno kaj vota signifo de la farita laboro omaĝe al la 100-a datreveno de la reakiro de sendependeco de Pollando kaj kun peto, ke Dio protektu Pollandon kaj la mondon kontraŭ milito pridonacante ĝin per firma paco.

El la elsendo 05.01.2018. Legas  Maciek – 1’28”

--------------------------------------------------------------------------------

Ne nur Oriento en la Palaco sub la Lada Tegmento
[2018-01-05]
https://pola-retradio.org/2018/01/ne-nur-oriento-en-la-palaco-sub-la-lada-tegmento/

Orientaj tapiŝoj, murteksaĵoj, nobelaj teksaj vestozonoj, nederlandaj mebloj, itala majoliko, historiaj horloĝoj estas de kelkaj tagoj admireblaj en la ekspozicio „Ne nur Oriento. La aĉetoj de la Fondaĵo de Teresa Sahakian 2007-2017” en la varsovia Palaco sub la Lada Tegmento. La ekspozicio omaĝe al Teresa Sahakian en la 10-a datreveno de ŝia morto daŭros ĝis la fino de novembro 2018. Kvankam plimulton de sia vivo Teresa Sahakian pasigis ekster Pollando, sed dum la tuta vivo ŝi estis forte ligita kun la hejmlando kaj enamiĝinta al Varsovio. Teresa Sahakian apartenis al la grupo de la plej senavaraj sponsoroj de la varsovia Reĝa Kastelo, subtenante ĝin dum rekonstruo kaj aranĝado de la kastelaj internoj. En 1989 kaj 1991 ŝi trandonis al la Kastelo kolekton de la orientaj tapiŝoj kaj plurajn verkojn de la orienta kaj okcidenta ornamarto. Ŝi testamentis por la kastelo parton de siaj artaj kolektoj kaj la tutan heredaĵon. La eksterordinara kolekto de la Fondaĵo konata ĝis nun pro pli ol 600-objekta kolekto de la orientaj tapiŝoj kaj teksaĵoj estis kompletigita per pliaj orientaj teksaĵoj, tre interesaj objektoj de la eŭropa arto, inkluzive de artverkoj ligitaj  kun Pollando.

El la elsendo 05.01.2018. Legas  Tomek – 2’24”

--------------------------------------------------------------------------------

Sep novaj urboj en Pollando
[2018-01-05]
https://pola-retradio.org/2018/01/sep-novaj-urboj-en-pollando/

Ekde komenco de 2018 Pollando havas jam 930 urbojn, ĉio ĉi pro la decido aldoni al ilia ĝenerala nombro sep novajn. Temas pri la lokoj Józefów apud Vistulo, Łagów, Otyń, Radoszyce, Sanniki, Tułowice, Wiślica, kiuj ĝis la jarkomenco havis la statuson de komunumoj. Kvin el ili ĝuis la urbostatuson en la pasinteco, sed la historitempesto sengradigis ilian rangon. La statuso de la urbo ŝanĝas nun ilian publikan bildon kaj altigas la prestiĝon. Ĝi ja ligiĝas ankaŭ kun la mezureblaj avantaĝoj,  kiel ekzemple investoatrakcieco kaj la ebleco klopodi pri rimedoj ligitaj kun la evoluigado de la urbaj regionoj. Sendube ĉiuj novaj urboj utiligos tiun ĉi ŝancon. Ni tamen proponas mallongan enrigardon en historion de tiuj lokoj, precize kvin, kiuj jam iam ĝuis la urbostatuson. Hodiaŭ ni parolos pri tri el inter ili Józefów ĉe  Vistulo, Łagów kaj Otyń. Józefów ĉe Vistulo en la vojevodio de Lublin (la orienta Pollando) ĝuis la urborajtojn dum pli ol 180 jaroj, en la periodo 1687-1868. El ĉi tiu periodo devenas tiaj vizitindaj lokoj kiel la baroka preĝejo de Dia Korpo kaj konstruita kune kun ĝi Bernardena Klostro, la Preĝeja Sonorilturo, Palaca-Parka Komplekso de grafoj Rzewuski. La urbo estis establita en 1687 de krakova kastelestro Andrzej Potocki kaj ĝia nomo deriviĝas de la persona nomo de unu el liaj filioj. Józefów ĉe Vistulo ricevis privilegiojn de reĝo Johano la 3-a Sobieski organizi dimanĉe kaj ĵaŭde jarmarkojn kaj kvin fojojn jare grandajn bazarojn. La burĝoj ricevis la rajton fabriki vodkon kaj bieron. En 1691 Andrzej Potocki, krom la menciitaj pli frue historiaj objektoj, establis ankaŭ hospitalon por mizeruloj. En la 17-a jarcento Józefów fariĝis signifa komerca centro kun dogana kamero. En la epoko de la 18-jarcentaj dipartigoj Józefów ektroviĝis en la aŭstra aneksoparto kaj dum kelka tempo ĝi estis centro de aŭstra administracio. Meze de la 19-a jarcento en la urbo estis 31 masonitaj konstruaĵoj kaj 13 lignaj kaj inter ili distingiĝis unuetaĝa urbodomo kun turo, kiu bedaŭrinde ne transdaŭris. La centron de la urbo okupis foirplaco kaj 10 stratoj. En Józefów funkciis lernejo financata el la  partopagoj de la loĝantoj kaj de la urboposedantoj. Tamen la doganbarieroj aplikitaj de la aneksintoj malfortigis la komercon, sekve malkreskis la nombro de la loĝantoj. Post la likvido de religiaj ordenoj en la postklostraj bernardenaj konstruaĵoj sian sidejon trovis la baza lernejo kaj poŝto. Reprezalioj post la malvenko de la januara kontraŭcara insurekcio 1863 alkondukis al perdo de la urborajtoj de Józefów ĉe Vistulo en 1868. Multe pli longe, ĉar 494 jarojn  la urborajtojn ĝuis Łagów – 1375-1869. La urbo estas situanta en la Sanktakruca Montaro en la suda Pollando kaj veninte tien valoras viziti la ununavan paroĥan preĝejon el la 15-a jarcento, pli poste riĉigitan per malfrugotikaj portaloj kaj 17/18-jarcentaj kapeloj formantaj flankajn navojn. Vizitinda estas Ravino Dule, mondkonata surfaca fosejo de nigraj kalkoŝtoniĝintaj kapopieduloj. Ĵurasa Rabista Kaverno longa 160 metrojn menciita en la geografiaj publikaĵoj el la 19/20-jarcentoj konata ankaŭ kiel Łagów-kaverno estas vivejo de kelkaj interesaj animalspecioj.  Łagów famas pro turismaj valoroj kaj estas nun ankaŭ startoloko lau blua turisma itinero al kastelo en Chęciny kaj laŭ la verda al la loko Nowa Słupia. La unuaj mencioj pri Łagów aperis jam en la 11-a jarcento. Laŭ kronikisto Jan Długosz en 1086 la Piast-dinastia princo Władysław Herman laŭ propetoj de sia edzino Judyta donacis la vilaĝon al la Eklezia Kapitulo de Kujavia Regiono, kiu instalis tie la kastelsidejon. En 1375 la reĝino de Pollando kaj Hungario, Eliżbieta al la episkopo Zbylut el Łagów atribuis la privilegion ŝanĝi la vilaĝon en la urbon, kion 25 jarojn poste konfirmis reĝo Vladislavo Jagelo. En 14-a la jarcento Łagów famiĝis kiel metiista centro, ĉefe de la potfarado. Estis fosataj tie ercoj de fero kaj plumbo. Otyń – en la lubuŝa vojevodio (la okcidenta Pollando) fieris pri la urborajtoj plej longe inter la ĵus menciitaj urboj, nome dum 616 jaroj (1329-1945). Kiel historiajn objektojn oni traktas tie i.a. ĝian urboplanan konstruon el la 14/19-jarcentoj. La paroĥa malfrugotika preĝejo de la Suprenlevo de la Sankta Kruco devenas el la 16/17-a jarcentoj. Al la historiaj objektoj kalkuliĝas ankaŭ ruinoj de la gotika kastelo el la 15-a jarcento, en kiu instaliĝis la klostra komplekso de jezuitoj en la 16/17-a jarcentoj. La unuaj mencioj pri Otyń devenas el 1322, kiam ĝi nomiĝis Wartinberg. Temis pri malferma urbo sen urbomuroj apartenanta al Żagań-Princoando. En la mezo de la 15-a jarcento aĉetis ĝin de la ĉeĥa reĝo Władysław fratoj Hans kaj Nikiel von Rechenberg. Laŭvice en la jaroj 1649-1776 ĝi apartenis al jezuitoj. La jezuita klostro estis prirabita de  ruĝa armeo en 1945, la loka fabriko de bicikloj bruligita. La urbo perdis la signifon kaj siajn urborajtojn. Revigliĝo sekvis en la 90-aj jaroj de la pasinta jarcento. Ekde nun Otuń denove estas urbo. Sur la listo de novaj urboj de Pollando, kiuj posedis jam iam la urborajtojn troviĝas ankoraŭ Radoszyce (1370-1870) kaj  Wiślica (1326-1869). Pri ilia historio kaj vizitindaj lokoj ni rakontos en nia laŭvica felietono el la ciklo Koninda Pollando.

El la elsendo 05.01.2018. Legas Barbara – 8’24”

--------------------------------------------------------------------------------

E_elsendo el la 05.01.2018
[2018-01-05]
https://pola-retradio.org/2018/01/e_elsendo-el-la-05-01-2018/

Podkasto: Ludu en nova fenestro | Elŝutu

La 716-a E_elsendo el la 05.01.2018 ĉe www.pola-retradio.org

– Nian hodiaŭan felietonon ni dediĉas al sep novaj polaj urboj sur la administracia mapo de la lando donante apartan atenton al tri el inter kvin, kiuj jam iam ilin havis, sed pro la historiaj eventoj tiun rangon perdis. Temas pri Józefów ĉe Vistulo, Łagów kaj Otyń. – En la komenca kulturkroniko ni informas pri interesa ekspozicio en la varsovia Palaco sub Lada Tegmento pri riĉiĝinta kolekto de la Fondaĵo de Teresa Sahakian; pri nova sukcena artverko de pola artisto, Stelo de Bet Leĥem instalota morgaŭ en la Naskiĝgroto de Jesuo; pri la morgaŭa Epifanio kaj okazontaj lige kun ĝi – la jam 10-an fojon – Paradoj de la Tri Reĝoj, nunjare en 644 lokoj en Pollando kaj 16 ekster ĝiaj limoj. – Fine ni proponas leterkestan renkontiĝon. – Muzike akompanas nin polaj kristnaskaj kantoj lige kun la Epifanio en la plenumo de la koruso Hejnalo kaj Anna Osmakowicz. Ni prezentas krome unu plian varsovian kanton en E-vesto dank’ al Andrzej Tomecki kaj Andrzej Pettyn. – La foto akompananta la programinformon prezentas epizodon el iu el la antaŭaj eldonoj de la evento Paradoj de la Tri Reĝoj. – Nia elsendo estas aŭskultebla ankaŭ en jutubo pere de: https://www.youtube.com/results?q=pola+retradio&sp=CAI%253D

--------------------------------------------------------------------------------

Finna eksperimento kun la sveda lingvo
[2018-01-09]
https://pola-retradio.org/2018/01/finna-eksperimento-kun-la-sveda-lingvo/

La sveda lingvo en la finnaj lernejoj estas deviga lernoobjekto. Ekde nun parto de lernantoj povos tamen elekti, ĉu anstataŭ la svedan ili preferas lerni alian lingvon. Tian decidon akceptis la finna parlamento.  La eksperimenton povos partopreni apenaŭ 2200 lernentoj, kiuj ekde sekva lernojaro troviĝos en la kvina, sesa klasoj de la bazaj lernejoj. Aktuale en Finnlando oni lernas ambaŭ oficialajn (naciajn) lingvojn – la finnan kaj la sveda. Krome la lernantoj lernas almenaŭ unu fremdan lingvon. La nuna eksperimento ligiĝas kun la iniciato rezigni pri la deviga instruado de la sveda. La programo estas antaŭvidita por la jaroj 2018-2024. Pledantoj por la libervola lernado de la sveda elmontras la utilon lerni aliajn fremdajn lingvojn, ekzemple en la orienta Finnlando de la rusa, kaj en la nordo de la norvega. Tamen ne malaperas argumentoj, ke translokiĝante laborcele okcidenten aŭ suden en la ĉirkaŭlokojn de Helsinki estas necesa en la profesia vivo kono de la sveda. Ĝis nun ĉiuj oficialaj informoj en Finnlando devas aperi ambaŭlingve, tamen la nombro de svedparolantoj ne estas granda. Kiel la unuan uzas ĝin ĉirkaŭ 300 mil personoj en la lando kun  5,5 milionoj da loĝantoj.

El la elsendo 09.01.2018. Legas Maciek kaj Barbara – 1’34”

--------------------------------------------------------------------------------

Knaboj lernas pli bone en la akompano de knabinoj
[2018-01-09]
https://pola-retradio.org/2018/01/knaboj-lernas-pli-bone-en-la-akompano-de-knabinoj/

En lernejoj, en kiuj signifan elcenton de lernantoj konsistigas knabinoj, knaboj atingas pli bonajn lernorezultojn. Tio aparte rilatas al ilia kapablo legi. Informis pri tio  la periodaĵo „School Effectiveness and School Improvement”. En la ekzamenado efektivigita i.a. de nederlandaj sciencistoj el la universitato en Utrecht partoprenis 200 mil 15-jaraĝuloj en la tuta mondo. Ili estis subigitaj al testo, kiu ekzamenis ilian legokapablon. Evidentiĝis, ke knaboj el lernejoj,  en kiuj pli ol 60 procentojn de lernantoj konsistigis knabinoj estis akirantaj pli bonajn lernorezultojn. La antaŭaj ekzamenadoj sugestis, ke knaboj forte reagas je lernokondiĉoj. La ĝenerala lernoetoso aŭ pigrostimula atmosfero povas signife influi ilian rilaton al lernado. Pro la fakto,  ke knabinojn karakterizas kutime bona koncentriĝo kaj ilia sukcesaspiro estas alte motivita, ilia ĉeesto povas pozitive influi kolegojn. Kiel asertas d-ino  Margriet van Hek la problemo de malalta legokapablo de knaboj estas vaste konata, sed ne sufiĉe esplorita. La nunaj esploroj elmontris, ke tiu problemo intensiĝas, kiam lernantoj frekventas lernejojn,  en kiuj dominas knaboj.

El la elsendo 09.01.2018. Legas Tomek – 1’24”

sc_tm_Lernantinoj_influas_lernosukcesojn_de_knaboj_01’24”.mp3; filename_=UTF-8”sc_tm_Lernantinoj influas lernosukcesojn de knaboj_0124

--------------------------------------------------------------------------------

Malsama reago de la virinaj kaj viraj cerboj je streso
[2018-01-09]
https://pola-retradio.org/2018/01/malsama-reago-de-la-virinaj-kaj-viraj-cerboj-je-streso/

Sciencistoj el Rockefeller-universitato en Novjorko rimarkis evidentajn diferencojn en la reago je genostreso en la virinaj kaj viraj cerboj. Esplorante cerbodiferencojn ili koncentriĝis pri la spaco CA3 de la hipokampo, kiu ludas ŝlosilan rolon en tiaj procezoj, kiel reago je streso, memorlaboro, reguligado de animagordo kaj informalifarado. En ilia eksperimento la musaj femaloj kaj maskloj estis dum 6 minutoj subigitaj al. streso en la formo de truda naĝado. Sekve estis kontrolita la reago de iliaj neŭronoj kaj genoj en la spaco CA3. Ĉe la femaloj la stresa situacio influis pli da genojn ol ĉe la maskloj en la rilato  6472 je 2474. Laŭ la usonaj sciencistoj tiom granda diferenco sugestas, ke reage je streso esencan rolon plenumas la genetika materialo. Genoj en la cerboj de femaloj reagas je mediaj stresofaktoroj en multe pli granda grado ol ĉe maskloj. Daŭrigante la esplorojn la sciencistoj identigis 1842 genojn reagantajn je stresoj kaze de ambaŭ seksoj. Evidendiĝis, ke ili funkcias kontraste. Genoj atakitaj de streso ĉe femaloj estis blokataj ĉe maskloj kaj inverse. Esploristoj faris ankaŭ eksperimentojn kun musoj havantaj la varianton de la geno BDNF, kiu ĉe homoj grandigas riskon de neŭropsikaj malsanoj provokitaj de streso. Pluraj testoj elmontris, ke femaloj – eĉ en senstresa stato – malpli bone solvis testojn pri spaca memoro dum maskloj havis kun tio neniujn poblemojn. Tio – laŭ esploristoj – povas ligiĝi kun interago de la genetika materialo kun femalaj sekshormonoj. Laŭ la aŭtoro de la analizo, doktoro Jordan Marrocco en la neŭropsikiatriaj kaj endokrinologiaj ekzamenoj necesas konsideri diferencojn inter la seksoj. Ekzemple la farmacia industrio testante medikamentojn  ĉefe ĉe viroj devas preni en konsideron riskon, ke ilia efikado povas esti malsama ĉe virinoj.

El la elsendo 09.01.2018. Legas Maciek kaj Barbara  – 2’27”

--------------------------------------------------------------------------------

Polaj anseroj ne sole kuirarta frandaĵo
[2018-01-09]
https://pola-retradio.org/2018/01/polaj-anseroj-ne-sole-kuirarta-frandajo/

La polaj anseroj liveras ne sole altvaloran viandon, popularan ankaŭ eksterlande, aparte en Germanio. Alia valora produkto estas la ansera lanugo. La valoron de lanugo el polaj anseroj alte taksas japanoj, sur kies merkaton ĉiujare trafas 100 tunoj  de ĉi tiu produkto. Japanoj alte taksas ĝin pro neĝblanka koloro, malpli granda pezo kompare kun la aliaj, la altgrada elasteco kaj la fakto, ke ĝi estas plukata mane kaj ne maŝine. La kvalito de la pola ansera lanugo ligiĝas kun la maniero bredi la anserojn. Ili paŝtas sin libere, do senstrese,  kio influas la kvaliton de la lanugo. Krome ne sesensignifa estas la fakto, ke ili ricevas kiel furaĝon avenon, kiu estas fonto de valoraj mikroelementoj. La valoro de la eksporto de la ansera lanugo  el Pollando al Japanio en 2016 egalis al 9,6 milionoj da eŭroj. Jam en la daŭro de la tri unuaj jarkvaronoj de 2017 Pollando eksportis tien 72, 5 tunojn da ansera lanugo kun la valoro de 6,9 milionoj da eŭroj. Krome Pollando eksportas la anseran lanugon ankaŭ al multaj aliaj landoj i.a. Usono, al Tajvano kaj Germanio.

El la elsendo 09.01.2018. Legas Tomek – 1’18”

--------------------------------------------------------------------------------

Poloj kontentaj pri 2017
[2018-01-09]
https://pola-retradio.org/2018/01/poloj-kontentaj-pri-2017/

Laŭ la plej nova opinisondado de CBOS 65 procentoj de poloj taksis la pasintan jaron kiel jaron bonan por ili mem kaj iliaj familioj. CBOS, la pola opinisonda centro taksas tiun ĉi pritakson kiel la plej bonan  ekde 27 jaroj. La ĉiujara opinisondado koncernis la pasintan jaron rilate al personaj, familiaj, profesiaj aferoj, rilate al la landa kaj monda situacioj. Laŭ la esploraŭtoroj ju pli granda kontento pri la propra materiala situacio des pli bonaj pritaksoj de la tuta jaro. La 2017-an kiel bonan por si mem kaj siaj familioj taksis 82 procentoj de la enketitoj difinantaj sian materialan situacion bona, sed entute kiel bonan la pasintan jaron taksis 65 procentoj de poloj. La pasintan jaron por siaj laborfirmaoj pli bone taksis viroj ol virinoj (70, respektie 60 procentoj). Plej kontentaj estis laborantoj de privataj kompanioj kaj de la fisko, malplej – laborantoj de agrikulturaj entreprenoj. Sed entute 48 procentoj de la respondintoj en ĉi tiu grupo taksis la pasintan jaron kiel bonan. 49 procentoj de poloj taksis la pasintan jaron kiel bonan por Pollando. 26 procentoj taksis ĝin nek bona nek malbona, 19 procentoj havis negativan opinion. Se temas pri la monda situacio nur 27 procentoj de poloj taksis ĝin bona, 32 procentoj ne havis konkretan opinion, sed por 30 procentoj de la enketitoj temis pri jaro malbona. Malgraŭ ĝenerale bonaj pritaksoj poloj esperas, ke la 2018-a estos pli bona por ili mem (46 procentoj) kaj por iliaj familioj (45 procentoj). Nur 6 procentoj prognozas la nunan jaron malbona. Pliboniĝon de la situacio en siaj laborlokoj antaŭvidas 44 procentoj de la enketitoj, sed nur 29 procentoj de laborantoj de agrikulturaj entreprenoj havas tiom pozitivan pritakson. Laŭ prognozoj de poloj el komenco de decembro 2017 la 2018-a estos malplibona por la mondo ol por Pollando. Pliboniĝon de la situacio atendas 34 procentoj de la enketitoj, ŝanĝomankon 31 procentoj de poloj.

El la elsendo 09.01.2018. Legas Milada kaj Barbara – 3’03”

--------------------------------------------------------------------------------

Intervjuo kun prof. Nicolau Dols
[2018-01-09]
https://pola-retradio.org/2018/01/intervjuo-kun-prof-nicolau-dols/

La antaŭmikrofona gasto de nia marda programo estas fonetikisto profesoro Nicolau Dols el la Balearaj Insuloj , lekcianto de la Interlingvistikaj Studoj en Poznano. Kun li ni interparolas pri lia fako, i.a. pri E-fonetiko, pri lia motivo aŭskulti la elsendojn  de Pola RetRadio en Esperanto kaj lia poezia verkado. Dum la lasta eldono de Belartaj Konkursoj-2017 de UEA li akiris la unuan premion en la branĉo „poezio”. El la elsendo 09.01.2018 – 11’41”

--------------------------------------------------------------------------------

E_elsendo el la 09.01.2018
[2018-01-09]
https://pola-retradio.org/2018/01/e_elsendo-el-la-09-01-2018/

Podkasto: Ludu en nova fenestro | Elŝutu

La 717-a E_elsendo el la 09.01.2018 ĉe www.pola-retradio.org

– La antaŭmikrofona gasto de nia marda programo estas fonetikisto profesoro Nicolaus Dols el la Balearaj Insuloj, lekcianto de la Interlingvistikaj Studoj en Poznano. Kun li ni interparolas pri lia fako, i.a. pri E-fonetiko, pri lia motivo aŭskulti la elsendojn de Pola RetRadio en Esperanto kaj lia poezia verkado. Dum la lasta eldono de Belartaj Konkursoj-2017 de UEA li akiris la unuan premion en la branĉo „poezio”. – La komencaj aktualaĵoj liveras informojn pri pozitiva pritasko de la pasinta 2017 flanke de poloj, pri alta kvalito de pola ansera lanugo preferata de japanoj kaj pri interesa lingva eksperimento en Finnlando. – La scienca bulteno proponas temojn ligitajn kun favora influo de knabinoj je lernorezultoj de knaboj kaj pri malsama reagado de viraj kaj virinaj cerboj je streso. – La foto akompananta la programinformon prezentas polan anseran lanugon ŝatatan ankaŭ de eksterlandanoj. – Nia elsendo estas aŭskultebla ankaŭ en jutubo pere de: https://www.youtube.com/results?q=pola+retradio&sp=CAI%253D

--------------------------------------------------------------------------------

El la E-Gazetaro 12.01.2018
[2018-01-12]
https://pola-retradio.org/2018/01/el-la-e-gazetaro-12-01-2018/

La jarkomencaj tagoj alportis novajn E-periodaĵojn el Finnlando, Norvegio kaj Japanio. Temas pri la lastaj numeroj de 2017, sed multkaze kun informoj aktualaj en la nova jaro kaj ĉiukaze kun interesaj kontribuoj. „Esperantolehti” per la enkonduka poezirimaĵo de Tuomo Grundström (laŭtlegota aŭ kantota laŭ Kalevala ritmomelodio) kombinas la pasintan komence de decembro 100-jariĝon de Finnlando, Zamenhoftagon kaj la 130-jariĝon de Esperanto. El ĝi por nia ĝenerala pripenso mi elektis nur unu strofon, nenielkapabla tamen observi la Kalevala-ritmomelodion. >Homo estas la kreskejo de la semo plej valora; tiu estas homa lingvo por ordigi la konscion, ĝin esprimi kaj dividi, por konstrui kolektivon, kunpercepton de la sensoj, kunefikon de la membroj<. Tiuj versoj povas esti spronaj ankaŭ por ni poloj, kiuj en 2018 solenas la 100-jariĝon de la reakiro de la (perdita en la 18-a jarcento) sendependeco kaj ĝenerale por esperantistoj, kies ligvokomunumo eniras 113-jaran ekziston. La internacia lingvo frontas similajn demandojn kiel la lingvoj naciaj. Ne mirigas do demandoj marĝene de tre interesa artikolo de Sakari Kauppinen pri la klopodoj senigi la finnan lingvon je seksismaj esprimoj. Seksismaj ne en la kompreno de esprimoj ofendaj, sed klare elmontrantaj sekson. Kun scivolo mi do legis kiel tiurilate funkcias la finna, kiu havas apartajn finaĵojn por tiu distingo kaj nun traktante ilin eksmodaj oni entreprenas paŝojn por neŭtraligi ilian emfazon. Kaj en Esperanto ? Sakari Kauppinen esprimas la bedaŭron, ke daŭre oni uzas in-formojn en ekzemple profesidifinoj, atentigas pri la ne enradkiĝinta „ri” por esprimi „li aŭ ŝi”, sed  prefere estas por la uzo de la vorto „aliseksa” en la senco nek viro nek virino, kiel ekvivalento de la finna neologismo ĉi-rilata. La sama aŭtoro levas aliloke la demandon pri progresoj en la aŭtomata, maŝina tradukado reference al la lastoktobre lanĉita gugla kapaŭskultilo, kiu interpretas parolon rekte de unu lingvo al la alia jam en 40 lingvoj. Prave atentigante ĝenerale , ke ne eblas haltigi la evoluon,  Sakari Kauppinen samtempe atentigas pri la utileco de gugla tradukilo malgraŭ ĝia ankoraŭa malperfekteco. Min persone interesas la prononckvalito ĉe gugla traduka kapaŭskultilo. Sed tio estas flanka demando. La lasta numero de „Esperantolehti” riĉas je raportetoj pri E-aranĝoj okazintaj dum inter la okazontaj elstaras informoj pri martaj Vintraj Tagoj, kies ĉeftemo estas „Esperanto kaj Afriko” kun riĉa rilata programo. Kadre de ĝi, kiel ni ekscias okazos la unua trejnseminario por la UK en Lahti 2019, i.a. kun tia kompetentulo kiel Osmo Buller. La enkondukaj vortoj de Mario Machlik, la prezidanto de Norvega E-Ligo en la lasta numero de „Norvega Esperantisto” aperas sub la titolo „Ni amuziĝu per Esperanto”. La titolo estas iom trompa por ekstera leganto,  ĉar rilatas al la – eble riproĉeto – ke „la norvega movado ĉefe agas pri Esperanto kaj malmulte per ĝi”. Mario Machlik do listigas amaseton da ekzemploj el la propra vivo, kiam oni pere de Esperanto eble ne rekte amuziĝas, sed ĝuas Esperanton ekster la primovadaj aŭ lingvaj diskutoj. NEL-prezidanto eksplicite ne prisilentas la gravecon de la movadumado kaj organiza laboro, sed ankaŭ invitas al amuzrilataj revukontibuoj. Kiel tian, t.e. amuzan li difinas sian  viziton en Japanio, kiam marĝene de la aŭtuna turneo de lia orkestro li vizitis Japanan E-Instituton. Lia unua pato de „japana mozaiko”, memorigis al mi mian siatempan viziton samloke i.a. en la arkivo kaj biblioteko de JEI. Kun scivolo mi atendas la duan parton de liaj rememoroj kun intereso eksciante, ke japanoj entreprenis labrojn pri nova japana-Esperanta vortaro. La 6-a pasintjara numero de „Norvega Esperantisto” riĉas ankaŭ per aliaj interesaj kontribuoj. „Lingva pilolo” de Otto Prytz proksimigas la sekretojn indiki horojn en Esperanto,  Vidar B. Skretting pledas pri la valoro de la rekta metodo, Otto Prytz raportas laŭvice pri interesa renkontĝo en Itala Kulturinstituto pri Giacomo Casanova organizita de la itala diplomato Giorgio Novello, en kiu aperis ankaŭ E-akcentoj en la formo de laŭtlegado el la esperantigita biografio de la itala famulo. Mian atenton kaptis la raporto de Kim Keyser pri lia vojaĝo al Arkones kaj pensoj pri internacia komunikado. Ĉi-lastajn spronis la renkontiĝo kun Ella el Koreio kaj sekvinta skajprenkonto kun ŝiaj E-lernantoj. Kaj tiel por Kim Keyser kiel obstaklo rolas tempodiferencoj kaj tial kiel solvon li proponas kontaktojn kun personoj el la samaj tempozonoj, kiujn li difinas solidarecozonoj. Kiel komunikilmankon li rimarkas la  nuntempajn ekranojn, kiuj ne permesas samtempan plurpersonan komunikadon. Tiukuntekste li atentigas pri la jam progresintaj video- kaj aŭdokomunikiloj, kiuj tion ebligas. Kiel lingvomankon li konsideras la fakton, ke E-on formas unuavice hindoeŭropaj radikoj kaj lanĉas la ideon konstrui eĉ pli justan, pli rapidlernatan, pli logikan lingvon. Multaj interesaj ideoj, sed la lastan malfacilus trakti serioze. Multloke en Pollando ankoraŭ brilas la abiaj lumoj, abio kun la ĉepinta stelo ornamas la  decembran numeron de „La Revuo Orienta” de Japana E-Instituto. Jam delonge enkondukas en la unuopajn numerojn sinprezentoj de elstaraj esperantistoj kadre de la rurbriko „Esperanto kaj mi”. Ĉi-numere faras tion iranano Hamzeh Shafiee reliefigante i.a. tion, ke Esperanto malfermis antaŭ li novajn fenestrojn kaj melebligis, ke lia vivo restu sencela kaj senmotiva sen ĝi. Nun kiel sian taskon Hamzeh Shafiee opinias disvastigi la informojn pri la movado. Novajn informojn pri japana E-movado ni ĉerpas el la raporto pri la 104-a Japana E-kongreso en Jokohamo, kiu komence de novembro 2017 liveris al 355 partoprenintoj pli ol 60 fakkunsidojn, riĉajn ekspoziciojn, postkongresajn ekskursojn kaj eĉ du librojn kiel kongresajn memoraĵojn. La premio Ossaka-2017 iris al SIMATANI Takesi, tradukinto de japanaj noaj komedioj, klasika japana rakonto „Rakontoj antaŭ longa tempo”, fondinto kaj prizorganto de TTT-ejo de E-Societo en Ikeda. KIMOTO Jasuhioro raportas en la decembra periodaĵo de JEI pri sia partopreno de en 49-a Korea E-kongreso. Du omaĝoj kaptis mian apartan atenton. Tiu de SIBAYAMA Zyuni’ti, kiu en siaj kondolencaj vortoj elstarigas la meritojn por la japana E-movado de la forpasinta YAMASAKI Seikô. La alia rilatas al ekstermovada figuro, la 105-jara kuracisto HINOHARA Shigeaki, kiun proksimigas OKITA Kazumi. Temas pri homo, kiu pionire aktivis i.a. por la t.n. „Novaj grandaĝuloj”, do 75-jaraj kaj pli aĝaj japanoj fizike kaj mense sanaj, kiuj povas ankoraŭ sufiĉe kontribui al la socio. Lia asocio komence dumilmembra nun havas ĉirkaŭ 8 mil personojn aktivantaj laŭ lia ideo: „Homoj povas ŝanĝi sian vivmanieron iam ajn. Do laŭeble uzu la tempon donitan al vi por aliaj homoj”.

El la elsendo 12.01.2018. Legas Barbara – 10’29”

--------------------------------------------------------------------------------

Podlaĥia Muzeo riciĝis je portretoj de Bjalistoko-fondintoj
[2018-01-12]
https://pola-retradio.org/2018/01/podlahia-muzeo-ricigis-je-portretoj-de-bjalistoko-fondintoj/

La bjalistoka Podlaĥia Muzeo aĉetis fine de la pasinta jaro portretojn de la establinto de la urbo Jan Klemens Branicki kaj lia edzino Izabela, kiu estis mecenatino de la kultura vivo en la urbo. Temas pri valora akiraĵo, ĉar memoraĵoj ligitaj kun Branicki-familio en la polaj kolektoj ne abundas. Hetmano Jan Klemens Branicki (1689-1771) estis la plej granda magnata potenculo en la 18-a jarcento gvidante vastskale konceptitan politikon. Liaj havaĵoj troviĝis ne sole en Bjalistoko kaj la vojevodio, sed ankaŭ en la krakova regiono (la suda Pollando), sur la tereno de la nunaj Ukrainio kaj Belorusio.  La portretoj  de Jan Klemens kaj Izabela el la 18-a jarcento estis aĉetitaj komence de decembro dum aŭkcio en Munkeno. Post la necesaj analizoj kaj konservistaj laboroj ili estos ekspoziciataj en la Artgalerio de la Pola Pentroarto en Bjalistoko, kie estas prezentata i.a. la 19-jarcenta portreto de Jan Branicki el la muzeaj kolektoj. En ili troviĝas ankaŭ la dokumento el 1769 kun la aŭtografoj de Branicki kaj libroj el la kolekto de Izabela Branicka.

El la elsendo 12.01.2018. Legas  Barbara – 1’34”

--------------------------------------------------------------------------------

Trezoro de Peruo. La reĝa tombo en Castillo de Huarmey
[2018-01-12]
https://pola-retradio.org/2018/01/trezoro-de-peruo-la-rega-tombo-en-castillo-de-huarmey/

Ĝis la fino de majo 2018 en la varsovia Etnografia Muzeo funkcias la unua en Pollando ekspozicio de antaŭinkaaj historiaj objektoj. Temas pri pli ol 150 originalaj eksponaĵoj, i.a. ora kaj arĝenta juvelaro, ceramikaĵoj kovritaj per polikromiaĵoj kaj aliaj. Ili venis por la prezento „Trezoro de Peruo. La reĝa tombo en Castillo de Huarmey” el la Nacia Muzeo de Arkeologio, Antropologio kaj Historio de Peruo en Limo. Plimulto de ili estis malkovrita dum la esploroj de la pola arkeologia misio en Castillo de Huarmey. Poloj malkovris tie la unuan ne prirabitan tombon de la antaŭkolombia kulturo Wari de antaŭ ĉirkaŭ 1200 jaroj. Dank’ al apliko de la plej nova virtuala teknologio kaj la t.n. vastigita realo la vizitantoj povos surmetante specialajn okulvitrojn transporti sin al la loko de la polaj foslaboroj en Peruo. En la monumenteca tombo troviĝis skeletoj de 64 personoj, ĉefe virinoj kaj pli ol 1200 valoraj objektoj el arĝento, oro, bronzo, luksaj ceramikaĵoj kaj aliaj. Inter rigardeblaj objektoj troviĝas tre delikataj, zorgeme ornamitaj teksaĵoj, apartenantaj al reprezentantoj de la tiamaj elitoj. Aparta atrakciaĵo estas la prezentata la unuan fojon – arte kaj science rekreita – hiperrealisma rekonstruo de la busto kaj vizaĝo de reĝino el Castillo de Huarmey, virino sepultita en la plej alta loko de la malkovrita tombo.

El la elsendo 12.01.2018. Legas  Maciek – 1’40”

--------------------------------------------------------------------------------

E_elsendo el la 12.01.2018
[2018-01-12]
https://pola-retradio.org/2018/01/e_elsendo-el-la-12-01-2018/

Podkasto: Ludu en nova fenestro | Elŝutu

La 718-a E_elsendo el la 12.01.2018 ĉe www.pola-retradio.org

– Ĉi-vendrede ni proponas la unuan nunjare Trarigardon de la E-gazetaro (Esperantolehti – 05.2017; Norvega Esperantisto – 06/2017 kaj La Revuo Orienta – 12.2017); – La komencaj kulturkronikaj informoj rilatas al nova akiraĵo de la Podlaĥia Muzeo en Bjalistoko riĉiĝinta je portretoj de la urbofondintoj Jan Klemens kaj Izabela Branicki kaj al la varsovia ekspozicio prezentanta Trezoron de Peruo. – Nia nunsemajna E-komunuma segmento riĉas je informoj pri SAT-kongreso (baldaŭa finiĝo de la unua favorpreza aliĝperiodo – http://www.satesperanto.org/spip.php?article3951 ), franca porjunulara poezikonkurso „Poezio tutlibera” nunjare malfermita ankaŭ por esperantistoj (www.poesie-en-liberte.fr) kaj Ora Insulo (la unua konkurso pri infanaj kantoj, pri kiu pliajn detalojn eblas ricevi ĉe orainsulo @ gmail.com). – Muzike ni memorigas la malnovan kanton de JoMo pri Esperanto, kiu devenas el lia KD eldonita de Vinilkosmo „JoMo friponas”. – La interreta foto akompananta la programinformon prezentas la portretojn de la urbofondintoj de Bjalistoko. – Nia elsendo estas aŭskultebla ankaŭ en jutubo pere de: https://www.youtube.com/results?q=pola+retradio&sp=CAI%253D

--------------------------------------------------------------------------------

Ĉu doloro povas esti iluzio
[2018-01-16]
https://pola-retradio.org/2018/01/cu-doloro-povas-esti-iluzio/

Doloro, kvankam plenumas avertan funkcion en la organismo ne ĉiam aperas en la loko, kie la korpo estis lezita. Kaze de iuj neŭropsikologiaj perturboj pacientoj sentas, ke mano ne apartenas al ili, la aliaj sentas fantomajn  dolorojn en organoj, kiujn efektive ili ne havas. Tio i.a. instigas al esploroj pri korpa konscio. Al sciencistoj esplorantaj tiun fenomenon aliĝis polaj sciencistoj el la Psikologia Instituto de la Jagelona Universitato. Ili decidis esplori la doloroforton sentatan de sanaj personoj subigitaj al la iluzio de kaŭĉuka mano. Ĉe la testataj personoj estis aplikitaj dolorimpulsoj ĉe ambaŭ manoj antaŭ la iluzio kiel ankaŭ post ĝi. Dum la aplikata doloro ili ne vidis siajn manojn, sed ĉe la mano kiu estis subigita al iluzio la testataj personoj sentis pli fortan doloron. Kvankam pri sentata doloro ĉe personoj subigitaj al iluzio de kaŭĉuka mano estis faritaj multaj esploroj tamen ne ĉiam esplorrezultoj estis koheraj i.a. pro aplikata metodologio. La kompreno de tio kiamaniere la percepto de propra korpo ligiĝas kun la forto de sentata doloro povas esti helpa en kreado de novaj terapioj. Tiel la polaj sciencistoj alportas kontribuon per siaj esploroj al la konoj pri tio, en kiuj kondiĉoj la spertata doloro povas grandiĝi aŭ malgrandiĝi.

El la elsendo 16.01.2018. Legas Tomek – 1’34”

sc_tm_Cu_doloro_povas_esti_iluzio_01’34”.mp3; filename_=UTF-8”sc_tm_Cu doloro povas esti iluzio_0134

--------------------------------------------------------------------------------

Monda Tago de Migranto kaj Rifuĝinto
[2018-01-16]
https://pola-retradio.org/2018/01/monda-tago-de-migranto-kaj-rifuginto/

Lastdimanĉe pasis Monda Tago de Migranto kaj Rifuĝinto. La tago fariĝis do la okazo por tiucela kvestado kaj altigo de la konscio pri la portata helpo. Caritas Polska liveras sisteme helpon al rifuĝintoj en Sirio, Libano, Jordanio, Irako, Palestina Aŭtonomio. La unuaj rimedoj en 2012 estis transdonitaj por helpi al rifuĝintoj el Sirio. Unu jaron poste tri mil infanoj el Damasko, Hawran-Dara kaj Homs ricevis festajn pakaĵojn. Ekde 2018 Caritas subvencias Medicinan Centron Bab Sharki en Damasko. Ĝis la fino de decembro la funkciado de la centroj estis kromfinancata el la Eŭropa Fondaĵo por Azilo, Migrado kaj Integriĝo administrata de la pola ministerio por la internaj aferoj. Tiun taskon en 2018 transprenis Caritas Polska, kiu por integrigaj programoj destinas pli ol 9,6 milionojn da zlotoj. La plej granda kampanjo de Caritas Polska helpanta al rifuĝintoj estas la prograno „Familio al Familio” inaŭgurita en oktobro 2016. La subteno celas personojn loĝantajn en Sirio, siriajn rifuĝintojn en Libano kaj libananojn vivantajn en mizero pro la migrokrizo. Ĝis nun tiun helpon utiligis pli ol 7 mil familioj en Sirio kaj Libano.

El la elsendo 16.01.2018. Legas Milada – 1’47”

--------------------------------------------------------------------------------

Esplorinstituto pri polaj medikamentoj
[2018-01-16]
https://pola-retradio.org/2018/01/esplorinstituto-pri-polaj-medikamentoj/

500 milionojn da zlotoj la pola registaro destinas en 2018 por la produktado de medikamentoj. Kreiĝis speciala esplorprogramo pri polaj medikamentoj kontraŭ la kormalsanoj kaj tumoroj. La celo de la entrepreno estas laŭeble efike kaj favorpreze kuraci polajn pacientojn. Aktuale 70 procentoj de medikamentoj sur la pola merkato estas importataj. Ekzemple en Germanio kaj Francio eĉ 90 procentoj de medikamentoj devenas el la landa produktado. Por realigi tiun celon estas anoncita establo de moderna Instituto gvidonta esplorojn koncerne medicinajn bioteknologiojn, kiu signife altigos ĉi-sfere la nivelon de la pola medicino. La kreiĝanta institucio servos ankaŭ por logi al la kunlaboro sciencistojn ne nur el Pollando. Samtempe la polaj elstaraj sciencistoj, inĝenieroj, informadikistoj, genetikistoj, biogenetikistoj povos labori en Pollando kaj kun kuracistoj evoluigos la plej modernajn medicinajn teknologiojn sanfavorajn.

El la elsendo 16.01.2018. Legas Maciek – 1’08”

--------------------------------------------------------------------------------

Interparolo kun Miguel Fernández
[2018-01-16]
https://pola-retradio.org/2018/01/interparolo-kun-miguel-fernandez/

La gasto de  nia programo estas Miguel Fernández , i.a. la prezidanto de la Belartaj Konkursoj de UEA, kiun ni renkontis dum la varsovia Kulturlingva Festivalo organizita lige kun Zamenhof-Jaro. La renkontiĝo estis la okazo interparoli i.a. pri lia verkista/kantista laboro kaj pri la Belartaj Konkursoj de UEA. El la elsendo 16.01.2018 – 9’06”

--------------------------------------------------------------------------------

E_elsendo el la 16.01.2018
[2018-01-16]
https://pola-retradio.org/2018/01/e_elsendo-el-la-16-01-2017/

Podkasto: Ludu en nova fenestro | Elŝutu

La 719-a E_elsendo el la 16.01.2018 ĉe www.pola-retradio.org

– Hodiaŭ en nia programo gastas Miguel Fernández, i.a. la prezidanto de la Belartaj Konkursoj de UEA, kiun ni renkontis dum la varsovia Kulturlingva Festivalo organizita lige kun Zamenhof-Jaro. La renkontiĝo estis la okazo interparoli i.a. pri lia verkista/kantista laboro kaj pri la Belartaj Konkursoj de UEA. El la varsovia programero „Mia liriko kaj la muziko” ni prezentas koncertajn surbendigojn de du kantoj en lia plenumo „Hedero” kaj „Horloĝo”. Fine de la elsendo ni memorigas la informon pri la nunujara eldono de Belartaj Konkursoj de UEA. – La komencaj aktualaĵoj koncernas establon de esplorinstituto pri polaj medikamentoj, kio ĝiscele certigos pli da polaj medikamentoj sur la pola merkato. Pollando sisteme grandigas sian helpon por viktimoj de konfliktoj en la Proksima Oriento. Kun tio ligiĝas ankaŭ la lastdimanĉe solenata Internacia Tago de Migranto kaj Rifuĝinto. Tiuj temoj speguliĝas en du laŭvicaj aktualaĵoj. – Nia sciencbultena temo estas dediĉita al la demando ĉu doloro estas iluzio kaj al ĉi-rilataj esploroj de polaj sciencistoj en Krakovo. – La interreta foto akompananta la programinformon referencas al la kampanjo de Caritas Polska „Familio al familio”, pri helpo donata al konkretaj familioj suferantaj pro la konflikto en la Proksima Oriento. – Nia elsendo estas aŭskultebla ankaŭ en jutubo pere de: https://www.youtube.com/results?q=pola+retradio&sp=CAI%253D

--------------------------------------------------------------------------------

Eurostat pri plej popularaj lokoj el Unesko-listo
[2018-01-19]
https://pola-retradio.org/2018/01/eurostat-pri-plej-popularaj-lokoj-el-unesko-listo/

Eurostat publikigis liston de la plej popularaj lokoj el la listo de la Monda Unesko-heredaĵo en Vikipedio. Inter pli ol unu mil lokoj el Unesko-listo estas menciitaj dudek lokoj, elektitaj per la suma kvanto da vizitoj en tiuj virtualaj lokoj. Du troviĝas en Pollando. Temas pri la eksa germana koncentrejo Auschwitz-Birkenau kaj la Malnova Urbo en Varsovio. La koncentrejo Auschwitz-Birkenau okupis la 4-an lokon kun 4,6 milionoj da vizitoj. La varsovia Malnova Urbo troviĝas ĉe la 17-a loko kun 2,7 milionoj da vizitoj. Plej popularaj estis la sejnaj bulvardoj en Parizo, la urbocentro de Romo kaj historiaj kvartaloj de Instambulo. La duono de la lokoj el la plej populara dudeko troviĝas en Eŭropo. En la interreta listo de Unesko pri la eksa germana koncentrejo Auschwitz-Birkenau (en la listo ekde 1979) estas i.a. notite, ke ĝiaj postrestaĵoj atestas pri la kondiĉoj, en kiuj okazis la hombuĉado fare de Hitler-soldatoj. La Malnova Urbo en Varsovio troviĝanta en la listo ekde 1980 estas priskribita kiel loko, kiu dum la Varsovia Insurekcio 1944 estis 85-procente detruita de germanoj.

El la elsendo 19.01.2018. Legas  Maciek – 1’27”

--------------------------------------------------------------------------------

E_elsendo el la 19.01.2018
[2018-01-19]
https://pola-retradio.org/2018/01/e_elsendo-el-la-19-01-2018/

Podkasto: Ludu en nova fenestro | Elŝutu

La 720-a E_elsendo el la 19.01.2018 ĉe www.pola-retradio.org

– La komenca kulturkroniko enhavas informojn pri du lokoj en Pollando el Unesko-listo plej ofte vizitataj en Vikipedio kaj pri la nunjaraj eventoriĉaj planoj de Bjalistoko por la 100-a datreveno de reakiro de sendependeco fare de Pollando. – La E-komunuma segmento alportas tre malĝojigan informon pri la forpaso de la kuniniciatinto kaj kunorganizanto de Artaj Konfrontoj en Esperanto ARKONES, Paweł Janowczyk. Ni prezentas ankaŭ la raporton de Bernhard Tuider, la estro de la E-muzeo en Vieno pri la atingaĵoj de ĉi tiu centro. [Pliaj informoj https://www.onb.ac.at/eo/bibliothek/sammlungen/kolekto-por-planlingvoj/ kaj https://www.onb.ac.at/eo/museen/esperantomuzeo/ ]. – La hodiaŭa Leterkesto i.a. enhavas kelkajn alrigardojn al 2017 i.a. informante pri la riĉa enhavo de nia arkivo. – Muzike ni ĉerpis fragmente en la kanzono „Vieno, la urbo de miaj revoj” el la vinila disko „Alberta Casey kantas 30 kantojn” kaj memorigas la kanzonon „Babelturo” de Flavio Fonseca el la KD „Vinilkosmo-Kompil’ 1”. – La interreta foto akompananta la programinformon prezentas la Malnovan Urbon de Varsovio, kiu troviĝas ekde 1980 sur Unesko-listo kaj kiu en 1944 estis 85-procente detruita. – Nia elsendo estas aŭskultebla ankaŭ en jutubo pere de: https://www.youtube.com/results?q=pola+retradio&sp=CAI%253D

--------------------------------------------------------------------------------

La 100-a datreveno de suvereneco en Bjalistoko
[2018-01-19]
https://pola-retradio.org/2018/01/la-100-a-datreveno-de-suvereneco-en-bjalistoko/

La 2018-a jaro estas solenata en Pollando kiel jaro de la 100-a datreveno de la reakiro de suvereneco post la 123-jara foresto sur la mapo de Eŭropo. Krom la jam konataj eventoj ankaŭ unuopaj urboj kaj medioj prezentas siajn omaĝplanojn. Kaj ekzemple la loĝantoj de Bjalistoko solenos en 2018 la centjariĝon de la reakiro de sendependeco fare de Pollando per muralo, t.e.  murpentraĵo  pri Esperanto kaj libereco, koncertoj, plantado de arboj kaj arbustoj ĉe „Skvaroj de la 100-jariĝo”. Kiel substrekis dum speciala gazetara konferenco la prezidanto de Bjalistoko, Tadeusz Truskolaski pro la graveco de la jubilea jaro la bjalistokanoj omaĝos la sendependecon  per vico da eventoj en la daŭro de la tuta jaro kaj ne sole la 11-an de novembro. Kadre de la solenadoj estos organizitaj i.a. ekspozicio de portretoj de marŝalo Józef Piłsudzki aŭtoritaj de Ludomir Sleńdziński, ekspozicio pri la 100-jariĝo de la akiro de la balotrajtoj fare de virinoj. Okazos ankaŭ edukaj laborrenkontoj „Ni, fronte al sendependeco”. Oni intencas intervjui la plej aĝajn loĝantojn de la urbo pri tio, kiel ili memoras la unuajn jarojn de la reakirita libereco. Ĝis la fino de januaro estos solvita konkurso por porokazaj aranĝoj, kiuj ricevos specialan emblemon elektotan de la urboloĝantoj. Bjalistoko destinis por la porokazaj eventoj 250 mil zlotojn.

El la elsendo 19.01.2018. Legas  Przemek – 1’37”

--------------------------------------------------------------------------------

Vundoj suferitaj dumtage pli rapide cikatriĝas
[2018-01-23]
https://pola-retradio.org/2018/01/vundoj-suferitaj-dumtage-pli-rapide-cikatrigas/

Vundoj kaj brulvundoj suferitaj dumtage cikatriĝas pli facile ol tiuj, kiuj okazis nokte. Informis pri tio sciencistoj el MRC Laboratory of Molecular Biology w Cambrigde. Iliaopinie tio povas ligiĝi kun la funkciado de biologia horloĝo. Siajn konkludojn ili tiris post la ekzameno de 118 pacientoj en brulvundaj fakoj de britaj publikaj hospitaloj. Evidentiĝis, ke brulvundoj kreiĝintaj nokte bezonis 28 tagojn por cikatriĝi, tiuj suferitaj dumtage nur 17 tagojn. Tio povas ligiĝi kun la funkcianta en la homaj ĉeloj mekanismo mezuranta la tempopason, do biologian horloĝon. La laboratoriaj esploroj ebligis difini, ke la propreco de la haŭtoĉeloj, t.e. fibroblastoj ŝanĝiĝas en la 24-hora ciklo. Ili kiel la unuaj reagas je lezo,  translokiĝante al. difektita loko por fermi la vundon. Tage ili reagas rapide, sed nokte ili noteble malrapidiĝas pro malpli granda aktiveco de proteinoj influantaj ilian movkapablon. Laŭ la britaj sciencistoj tiu kono povos esti utiligita por plibonigi la rezultojn de kirurgiaj operacioj. Kelkaj medikamentoj, ekzemple kortizolo nuligas la „horloĝon” de unuopaj ĉeloj. Tiu kono povas esti utiligita  kaze de kirurgiaj operacioj okazigataj nokte. Aliflanke la biologia horloĝo de ĉiu homo funkcias iom alie, tial individua elekto de konforma operacihoro povas gravi. Ekzemple la vundokuracado  en la brita publika sanservo konsumas ĉirkaŭ 5 miliardojn da britaj pundoj jare, tial plibonigo de la vundokuraca efiko ligiĝus kun signifaj ŝparoj.

El la elsendo 23.01.2018. Legas Maciek – 1’56”

sc_mj_Novaj_informoj_pri_vundoj_01’56”.mp3; filename_=UTF-8”sc_mj_Novaj informoj pri vundoj_0156

--------------------------------------------------------------------------------

Dependiĝo de komputilaj ludoj kiel psika perturbo
[2018-01-23]
https://pola-retradio.org/2018/01/dependigo-de-komputilaj-ludoj-kiel-psika-perturbo/

Monda Sanorganizo (WHO) baldaŭ aktualigos sian liston de malsanoj kaj sanproblemoj. En la 2018 aperos sur ĝi i.a. dependiĝo de komputilaj ludoj. La organizo rekonis ĝin kiel formon de psika dependiĝo, simile kiel tio estas kaze de hazardludoj. La aktualigita listo estos prezentita en majo. En la enkonduka, ankoraŭ ne oficiala dokumento oni klarigas, ke la komputila ludo povas esti kvalifikita kiel psika perturbo, se homo perdas super ĝi kontrolon kaj okupiĝas pri ĝi en maniero obseda. Tio signifas, ke temas pri fenomeno firma, revenanta, negative influanta tion, kiel koncerna persono funkcias en la familio, socio, kiel tio speguliĝas en la kleriĝado, laboro kaj aliaj vivaspektoj de la koncernato. La ludo en la vivo fariĝas afero prioritata, ĉiam pli ofte ripetiĝanta malgraŭ negativaj sekvoj. Ĝi estas diagnozebla  kiel psika perturbo, se ĉi-speca konduto daŭras almenaŭ 12 monatojn. La diskuto pri tio, kiel trakti obsedan okupiĝadon pri komputilaj ludoj daŭras delonge kvankam esploristoj kaj psikologoj ne samopinias disputante pri tio, kiuj premisoj atestas, ke la komputila ludo de ŝatokupo transformiĝas en dependiĝon kaj kiel tion mezuri. La Internacia Klasiifiko de Malsanoj de la Monda Sanorganizo estas listo utiligata de kuracistoj kaj esploristoj. La unuaj uzas ĝin en diagnozado, la ceterej por difini kategoriojn de sanstatoj kaj por la statistikaj celoj.

El la elsendo 23.01.2018. Legas Przemek – 1’45”

sc_pw_Komputilaj_ludoj_kiel_dependigo_01’45”.mp3; filename_=UTF-8”sc_pw_Komputilaj ludoj kiel dependigo_0145

--------------------------------------------------------------------------------

E_elsendo el la 23.01.2018
[2018-01-23]
https://pola-retradio.org/2018/01/e_elsendo-el-la-23-01-2018/

Podkasto: Ludu en nova fenestro | Elŝutu

La 721-a E_elsendo el la 23.01.2018 ĉe www.pola-retradio.org

– Hodiaŭ denove ni invitas por la literatura segmento de nia elsendo, en kiu aŭdiĝas la jam 64-a fragmento de la romano de Henryk Sienkiewicz „Quo Vadis” en la E-traduko de Lidia Zamenhof. – Al la temo de „Quo Vadis” referencas ankaŭ nia kulturtema aktualaĵo pri prestiĝa premio por la albumo enhavanta la oratorion „Quo Vadis” de Feliks Nowowiejski, antaŭ nia literatura segmento. – Komenca aktualaĵo sumige retrorigardas al la eksporto de polaj nutraĵoj en 2017. – La sciencbultenaj informoj koncernas la komputilajn ludojn kiel dependiĝon laŭ klasifiko de WHO kaj novajn konojn pri la vundocikatriĝado. – Muzike ni citas el la oratorio de Feliks Nowowiejsi „Quo Vadis”. Pri la komponisto ni felietonis en la elsendo el 26.05.2017. – La interreta foto akompananta la programinformon prezentas la lastan furoraĵon inter eksportataj polaj nutraĵproduktoj – glaciaĵojn. – Nia elsendo estas aŭskultebla ankaŭ en jutubo pere de: https://www.youtube.com/results?q=pola+retradio&sp=CAI%253D

--------------------------------------------------------------------------------

La Poznana Filharmonio premiitz pro „Quo Vadis”
[2018-01-23]
https://pola-retradio.org/2018/01/la-poznana-filharmonio-premiitz-pro-quo-vadis/

La unua en la mondo diska surbendigo de la oratorio „Quo Vadis” de Feliks Nowowiejski akiris la prestiĝan premion de International Classical Music Awards-2018. La eldonita – de la germana diskoprotuktejo cpo – albumo estis nomumita en la kategorio de voĉa-instrumenta muziko. La enmanigo de la premio okazos en aprilo 2018 en Katowice. Inter la premiitoj de ICMA-2018 troviĝas ankaŭ pianistoj Krystian Zimerman kaj Szymon Nehring, krome orkestrdirektisto Krzysztof Urbański. „Quo Vadis” de Nowowiejski rivalis kun du aliaj diskoj “Stabat Mater” de Antoni Dvořak, kaj “Vesproj” opuso 37 de Siergiej Rachmaninow. “Quo vadis” estis registrita dum koncerto la 29-an de junio 2016 en la Aŭlo de Adam Mickiewicz-Universitato en Poznano. La oratorio estis prezentita al muzikŝatantoj en la koncerta salonego de la Poznana Filharmonio en la Jaro de Feliks Nowowiejski (en la 70-a datreveno de lia naskiĝo,) kaj en la Jaro de Henryk Sienkiewicz. Unu tagon poste la komponaĵo estis plenumita en Konzertsaal Universitat der Kunste Berlin, ĉar  “Quo vadis” parte kreiĝs ĝuste en Berlino, kie Feliks Nowowiejski studis kaj laboris. Dank’ al la dudiska albumo de cpo „Quo Vadis” trafas al la muzikŝatantoj en la tuta mondo. Ĝi jam akiris favorajn recenzojn en la prestiĝa brita magazino “Gramophone”. Ĝi fariĝis ankaŭ disko de la monato de la monatrevuo de  MusicWeb International. La prapremiero de  “Quo vadis”, kiu estis sekve varme bonvenigita en multaj eŭropaj landoj kaj en Ameriko, okazis en 1907. En la intermilita periodo „Quo Vadis” estis prezentita ĉirkaŭ 200 fojojn en diversaj urboj de Eŭropo kaj ambaŭ Amerikoj en 13 lingvaj versioj.

El la elsendo 23.01.2018. Legas  Tomek – 1’55”

--------------------------------------------------------------------------------

UEA omaĝas la tagon de Holokaŭsto
[2018-01-26]
https://pola-retradio.org/2018/01/uea-omagas-la-tagon-de-holokausto/

Ankaŭ Universala E-Asocio omaĝis la Tagon de Holokaŭsto proklmaitan de UNO antaŭ 13 jaroj. En la porokaza deklaro ni legas i.a. “La Esperanto-movado aparte funebras tiujn kredantojn pri internaciismo kaj internacia kompreniĝo kiuj, ĉu pro sia raso ĉu pro siaj politikaj aŭ aliaj konvinkoj pereis je la manoj de la Nazioj. Inter ili estis ĉiu rekta familia posteulo de Ludoviko Lazaro Zamenhof, fondinto de Esperanto, escepte de unu sola transvivanto – krome inter ili estis multnombraj esperantistoj en Germanio, Pollando, Hungario, Ĉeĥoslovakio kaj aliloke. Ili inkluzivis esperantistajn ŝtatoficistojn, instruistojn, kuracistojn, ĵurnalistojn, poetojn. Kaj inter la travivantoj estis ankaŭ esperantistaj herooj, kiuj ŝirmis aliajn for de ekstermiĝo. En la deklaro de UEA ni legas ankaŭ: “Temas ankaŭ pri tago,  kiam ni memoras tiujn kiuj ne rezistis aŭ ne povis rezisti tiun tiranecon kaj buĉadon; kaj ni promesas, antaŭ la ekzemplo de la Holokaŭsto, kontraŭstari maljustecon”. La anglalingvan kaj E-lingvan deklaron akompanas la poeziaĵo de esperantista poeto Leen Deij, kiu en 1948 esprimis sentojn. kiuj rilatas al ĉiuj gentoj kaj ĉiuj religioj “Al la juda foririnto”.

El la elsendo 26.01.2018. Legas Milada – 1’47”

--------------------------------------------------------------------------------

Portugalaj lernantoj lernas pri holokaŭsto
[2018-01-26]
https://pola-retradio.org/2018/01/portugalaj-lernantoj-lernas-pri-holokausto/

La lernejaj aŭtoritatoj de la portugala Pombol organizas por siaregionaj lernantoj la jam 3-an fojon vizitkampanjon cele profindigon de konoj pri la historio de holokaŭsto.  Ĝi pasos tra Auschwitz-Birkenau, berlina Juda Muzeo kaj pariza Memormuzeo Shoah. En Portugalio multiĝas en la lastaj jaroj publikaĵoj kaj esploroj pri civitanoj de ĉi tiu lando maliiberigitaj en la germanaj koncentrejoj, inkluzive de tiuj sur la pola teritorio. Laŭ la speciala portugala komisiono esploranta la hitleranajn krimojn en la germanaj koncentrejoj pereis kelkcent civitanoj de ĉi tiu lando. Laŭ ĝiaj ĝisnunaj esploroj la viktimoregistroj de  germanoj kreiĝis i.a. en Pollando, Auhstrio, Germanio, Francio kaj Belgio.

El la elsendo 26.01.2018. Legas Maciek – 0’51”

--------------------------------------------------------------------------------

La unua nunjara Bulteno de Instituto pri la Nacia Memoro
[2018-01-26]
https://pola-retradio.org/2018/01/la-unua-nunjara-bulteno-de-instituto-pri-la-nacia-memoro/

La ĉeftemo de la unua nunjara „Bulteno” de la Instituto pri la Nacia Memoro estas la germanaj koncentrejoj. Plimulto de la publikaĵoj rilatas al germanaj koncentrejoj establitaj ankoraŭ antaŭmilite en la Regno, sekve – post la eksplodo de la 2-a mondmilito – sur la teritorioj de la okupaciata Pollando. La artikoloj traktas i.a. la temon de la aplikata mortoteknologio, la koncentrejan realon „Infero laŭ la germana maniero laŭ Pilecki”, en kiu i.a. estas akcetita la rolo de la pola oficiro, malliberigito kaj organizinto de la rezistomovado en Auschwitz kaj informanto de la ekstera mondo pri la reganta tie hororiga situacio. Estas traktata  ankaŭ la problemo de la historia konscio inter la juna generacio de germanoj kaj aŭstroj, kiu havas problemojn fronti tiun heredaĵon.

El la elsendo 26.01.2018. Legas Maciek – 0’54”

--------------------------------------------------------------------------------

Laŭvica datreveno de liberigo de la Auschwitz-Birkenau
[2018-01-26]
https://pola-retradio.org/2018/01/lauvica-datreveno-de-liberigo-de-la-auschwitz-birkenau/

La 27-an de januaro 2018 pasas la laŭvica  datreveno de la liberigo de la germana koncentrejo kaj mortotendaro Auschwitz-Birkenau. Sabate okazos tie la ĉiujaraj porokazaj omaĝsolenaĵoj. Auschwitz establita en 1940 origine rolis kiel labortendaro por poloj. Du jarojn poste (1942) kreiĝis Auschwitz II-Birkenau – la dua plej granda koncentreja komplekso – fariĝante la ekstermejo de judoj, kie laŭ kalkuloj pereis 90 procentoj de ili. En la tuta mortotendara komplekso germanoj mortigis almenaŭ 1,1 milionojn da homoj, ĉefe judojn, sed ankaŭ polojn, romaojn, sovetiajn ostaĝojn kaj alinaciajn malliberigitojn. Hodiaŭ Auschwitz rolas por la mondo kiel simbolo de ekstermo kaj kruelaĵoj de la 2-a mondmilito, kiu en 2005 estis proklamita de UN-o Internacia Tago de Memoro pri Holokaŭsto.

El la elsendo 26.01.2018. Legas Barbara kaj Maciek – 1’12”

--------------------------------------------------------------------------------

La 16- kaj 17-jarcentaj moneroj retrovitaj en Bydgoszcz
[2018-01-26]
https://pola-retradio.org/2018/01/la-16-kaj-17-jarcentaj-moneroj-retrovitaj-en-bydgoszcz/

Al la Regiona Muzeo en Bydgoszcz trafis jarkomence aparta trezoro. Temas pri 480 oraj moneroj kaj 200 aliaj objektoj, i.a. juveloj, bidoj, objektoj de religia kulto el la 16-a kaj 17-a jarcentoj, retrovitaj dum la arkeologiaj laboroj en la loka katedralo. Neniu supozis dum la rutinaj arkeologiaj laboroj ligitaj kun la renovigo de la sanktejo la ekziston de tiuj objektoj. Plimulto de la troviĝantaj sub la planko de presbiterio moneroj devenas el la 40-aj jaroj de la 17-a jarcento. La plej malnova datiĝas al 1570, la plej nova al 1652. Plimulton konsistigas moneroj el la Unuiĝintaj Nederlandaj Provincoj, sed krome temas ankaŭ pri dukatoj el Toruno kaj Poznano, el Aŭstrio kaj eĉ Turkio. La historia juvelaro origine troviĝanta en ligna kesto kun metalaj fermiloj konsistis el ringoj, ornampendaĵoj, surkudraĵoj ĉefe oraj aŭ inkrustitaj de noblaj ŝtonoj. La ligna kesto ne konserviĝis. La valoro de la bidgoŝĉa trezoro estas enorme granda, ĝian devenon esploras arthistoriistoj.

El la elsendo 26.01.2018. Legas  Tomek – 1’13”

--------------------------------------------------------------------------------

E_elsendo el la 26.01.2018
[2018-01-26]
https://pola-retradio.org/2018/01/e_elsendo-el-la-26-01-2018/

Podkasto: Ludu en nova fenestro | Elŝutu

La 722-a E_elsendo el la 26.01.2018 ĉe www.pola-retradio.org

– Hodiaŭ antaŭ nia mikrofono ni interparolas kun konata jutuba videoblogisto, kunlaboranto de Amikumo, Evildea el Aŭstralio. Nian interparolon asistas kaj intervenas Chuck Smith. La temo estas evidente tiu ĉi nova formato de la komunikado. – La komencaj aktualaĵoj rilatas la morgaŭ pasonta laŭvica datreveno de la liberigo de la germana mortotendaro establita sur la tereno de la okupaciita Pollando, Auschwitz-Birkenau. Ni referencas i.a. al speciala deklaro de UEA pri holokaŭsto. – La kulturkronika informo rilatas al eksterordinara arkeologia malkovro efektivigita antaŭ kelkaj semajnoj, sed jam en 2018, en la pola urbo Bydgoszcz. – La E-komunuma informo traktas preparojn al la simpozio “Multlingvismo en Internaciaj Organizaĵoj kaj en Internacia Kunlaborado” okazonta la 10/11-an de majo 2018 en Novjorko ( http://www.esperantic.org/wp-content/uploads/2018/01/IpI_103_final.pdf ). – Muzike ni prezentas fragmente la kanzonon de Jonny M. „Verduloj” el lia plej nova KD Kreaktiva, eldonita de Vinilkosmo. – La interreta foto akompananta la programinformon prezentas la laste retrovitan trezoron el la katedralo en Bygoszcz, pri kio traktis nia kulturkronika informo. – Nia elsendo estas aŭskultebla ankaŭ en jutubo pere de: https://www.youtube.com/results?q=pola+retradio&sp=CAI%253D

--------------------------------------------------------------------------------

Evildea kaj Chuck Smith pri videoblogaĵoj
[2018-01-26]
https://pola-retradio.org/2018/01/evildea-kaj-chuck-smith-pri-videoblogajoj/

Antaŭ nia mikrofono ni interparolas kun konata jutuba videoblogisto, kunlaboranto de Amikumo, Evildea el Aŭstralio. Nian interparolon surbendigitan en Seulo asistas kaj intervenas Chuck Smith . La temo estas evidente tiu ĉi nova formato de la komunikado. El la elsendo 26.01.2018 – 8’02”

--------------------------------------------------------------------------------

Duoblaj akvoturbuladoj en oceanoj
[2018-01-30]
https://pola-retradio.org/2018/01/duoblaj-akvoturbuladoj-en-oceanoj/

Sciencistoj jam antaŭ kelka tempo konstatis, ke en la maroj kaj oceanoj kreiĝas grandegaj akvoturbuladoj kun la diametro egala eĉ ĝis kelkcent kilometroj. Temas pri la tiel nomataj mezoskalaj akvoturbuladoj, kiuj peras longdistance grandegajn kvantojn da akvo kaj varmo. Laŭ matematikaj kalkuloj oni ŝpinis spekulativadojn, ke ili povas aperi pare, sed longe oni parolis pri tio nur teorie. Nun eblis observi ilin pere de satelitoj kaj malkovris tion sciencistoj el Liverpulo. Ili estis rimarkitaj en Tasmana Maro, oriente for de Aŭstralio. Alia ĉi-speca kazo estis notita en la suda Atlantiko ĉe la okcidenta bordo de la Suda Afriko. Laŭ sciencistoj tiuj akvoformacioj povas tre rapide aliloki je grandaj distancoj malgrandajn marajn animalojn. Estis konfirmite, ke la akvoturbuladoj moviĝas laŭ kotraŭaj direktoj, kvankam ili estas  ligitaj. Estis ankaŭ difinite, ke tia para drivado de akvoturbuladoj povas daŭri eĉ 6 monatojn. Se la unuopaj mezoskalaj akvoturbuladoj preskaŭ ĉiam direktiĝas okcidenten,  la paraj akvoturbuladoj kapablas moviĝi orienten kun rapideco eĉ 10-obla. Ilia influo je la tera klimato ne estas ankoraŭ difinita, sed kiel asertite ĝi tutcerte ekzistas, ĉar moviĝanta varmo influas la atmosferan cirkuladon.

El la elsendo 30.01.2018. Legas Tomek- 1’31”

--------------------------------------------------------------------------------

Korprema efiko ĉe suĉinfanoj
[2018-01-30]
https://pola-retradio.org/2018/01/korprema-efiko-ce-sucinfanoj/

La korpremado de suĉinfanoj povas grave influi ilian postan vivon. La lastaj esploroj en la Universitato de Brita Kolombio elmontras, ke tuŝo povas influi sferojn de DNA, ligitajn kun la imuna sistemo kaj metabolo. La daŭro de la korpremado de infano en la beba periodo povas ŝanĝi genekspresion almenaŭ en 5 fragmentoj de ilia DNA. Dum la esploroj estis pruvite, ke suĉinfanoj, kiuj spertis malpli proksiman fizikaj kontakton en la unuaj vivsemajnoj havis en siaj ĉeloj malpli forte evoluintan molekulan profilon. La eksperimenton partoprenis la gepatroj de 94 infanoj, kiuj gvidis taglibron dum 5 semajnoj ekde la naskiĝo de ilia infano. Ili notis kiel kondutas la infanoj, kaj ankaŭ kiom ofte estas tuŝataj kaj korpremataj. En la aĝo de 4-5 jaroj la provaĵoj de DNA de ĉiuj infanoj estis subigitaj al ekzameno. Esploristoj aparte donis la atenton al la metilado de DNA, kiun povas influi eksteraj kondiĉoj, aparte infanaĝe. Evidentiĝis, ke aperas konstantaj diferencoj en DNA-metilado en kvin specifaj lokoj de DNA inter infanoj kun alta kaj malalta nivelo de la fizikaj kontaktoj. Du el ili gravas por la imuna sistemo kaj en metabolo. Estas planitaj pliaj esploroj por profundigi konojn pri la signifo de la fizika kontakto bebaaĝe, aparte kaze de infanoj spertantaj malfacilan situacion.

El la elsendo 30.01.2018. Legas Maciek – 1’39”

sc_mj_La_signifo_de_korpremado_de_sucinfanoj_01’39”.mp3; filename_=UTF-8”sc_mj_La signifo de korpremado de sucinfanoj_0139

--------------------------------------------------------------------------------

Leĝamendo kontraŭ historiaj mensogoj
[2018-01-30]
https://pola-retradio.org/2018/01/legamendo-kontrau-historiaj-mensogoj/

Vendrede la pola Sejmo proklamis amendon de leĝo pri Instituto de la Nacia Memoro – Komisiono por la Persekutado de Krimoj kontraŭ la Pola Nacio. Konforme al ĝi ĉiu, kiu publike kaj malgraŭ la faktoj atribuas al la pola nacio aŭ al la pola ŝtato respondecon aŭ kunrespondecon pro la krimoj efektivigitaj de la 3-a Germana Regno, aŭ pro aliaj krimoj kontraŭ la homaro, paco aŭ militkrimoj estos minacita de monpuno kaj ĝis la 3-jara mallibereco. La sama puno minacas pro „skandala malgrandigado de la respondeco de efektivaj kaŭzintoj de ĉi tiuj krimoj”. Al la amendovortumoj kritike rilatigis sin lastsabate i.a. la israela ĉefministro kaj la israela ambasodorino en Pollando Anna Azari, kiu alvokis ŝanĝi la amendon. Tio okazis dum la solenaĵo omaĝanta la liberigon de la germana mortotendaro Auschwitz-Birkenau en la ĉeesto de i.a. polaj politikistoj, altranguloj kaj ankoraŭ vivantaj viktimoj de la koncentrejo. Kiel difinis tion la gazetara aferprezentanto de la pola prezidento, Krzysztof Łapiński la israela ambasadorino elektis por esprimo de siaj rezervoj la plej bedaŭrindan momenton. Kiel informis la aferprezentanto de la registaro, Joanna Kopcińska la projekto de la leĝamendo estis konata al la israela flanko. Ambasadorino Azari prezentis al ĝi rimarkojn, kiuj estis konsideritaj de la pola flanko. Post tio venis ŝiaflanke neniuj rimarkoj „ĝis la lasta sabato”. Krome la projekto de la leĝamendo estis publike konsultebla de pli ol unu kaj duona jaroj. Lastdimanĉe Joanna Kopcińska informis, ke en la leĝamendo pri la Instituto, okazos neniuj ŝanĝoj. Konfirmis tion la vicmarŝalo de la Sejmo Beata Mazurek. La prezidanto de la Instituto de la Nacia Memoro Jarosław Szarak kiel maltrankviligan en la diskuto pri la amendo rekonis la starpunkton de la israela flanko. La amendo traktota ankoraŭ en la Senato ne limigas sciencajn esplorojn nek parolliberecon, celas kontraŭ konscia primensogado de historio, senhonorigado de la memoro de la viktimoj, senhonorigado de la vivantaj malliberigitoj de la germanaj koncentrejoj. Similaj reguloj pri la punado de historiaj mensogoj validas ankaŭ en aliaj landoj, inkluzive Israelon. Dum sia oficiala vizito en la loko Żory, la suda Pollando la pola prezidento Andrzj Duda omaĝis la memoron de la Sileziaj Insurgentoj kaj de la Polaj patriotaj soldatoj persekutataj de la postmilita komunista reĝimo. En la porokaza parolado la prezidento diris i.a. „Neniam mi aprobos tion, ke ni kiel la nacio – poloj kiel la nacio – aŭ Pollando kiel ŝtato estu kalumniataj pere de falsado de la historia vero kaj pere de absolute falsaj akuzoj da kiuj en la lastaj tagoj laŭ la adreso de nia lando kaj nia nacio aŭdiĝis absolute tro, por ke oni lasu ilin senregae”. Krzysztof Łapiński, la gazetara aferprezentanto de Andrzej Duda reliefigis lunde, ke se Israelo, la suverena ŝtato rajtas puni personojn kontestantajn holokaŭston kaj aplikas tian leĝon, Pollando kiel la suverena ŝtato rajtas meti en sian leĝaron punadon pro mensogoj pri polaj koncentrejoj, ĉar tiaj ne ekzistis. Pollando aplikas similajn solvojn, kiujn aplikas Israelo kaj aliaj landoj. En la mesaĝo okaze de la Internacia Tago de la Viktimoj de Holokausto la pola ĉefministro Mateusz Mazowiecki memorigis i.a. pri interkonsento inter Pollando kaj Israelo pri kunlaboro en la batalo kontraŭ la mensogojn pri holokoaŭsto. Laŭ tiuj interkonsentoj ni enkondukas regulojn por prezenti veron pri teruraj krimoj trafintaj polojn, judojn, romaojn kaj aliajn naciojn, viktimojn de kruealaj totalismoj hitlerana kaj komunista, kiuj ankaŭ estas la punforma defendotorĉo pro la disvastigado de malvero. Ĉefministro Morawiecki substrekis, ke hodiaŭ ne sufiĉas memorigi, kiu estis buĉisto kaj kiu viktimo. Necesas puni ankaŭ tiujn, kiuj celas forviŝi veron pri la krimoj de la hombuĉado por renversigi la historian veron.

El la elsendo 30.01.2018. Legas Barbara kaj Milada – 5’27”

--------------------------------------------------------------------------------

E_elsendo el la 30.01.2018
[2018-01-30]
https://pola-retradio.org/2018/01/e_elsendo-el-la-30-01-2018/

Podkasto: Ludu en nova fenestro | Elŝutu

La 723-a E_elsendo el la 30.01.2018 ĉe www.pola-retradio.org

– Hodiaŭ ni interparolas kun konata pola jungeneracia esperantisto Lukis Żebrowski, TEJO-oficisto pri Afriko, eksa PEJ- kaj TEJO-prezidanto. Ne sole la movadaj aferoj estas la temo de nia interparolo, ankaŭ lia E-familio kaj mallonge lia interesa profesio. – La komenca aktualaĵo rilatas al la amendo de la pola leĝo pri la Pola Instituto pri la Nacia Memoro rilate la punadon de historiaj mensogoj, i.a. kalumniaj vortumoj pri polaj koncentrejoj aŭ mortotendaroj, kiun amendon lastsabate atakis reprezentantoj de Israelo. – La scienbultenaj temoj alportas informojn pri la duoblaj akvoturbuladoj en oceanoj kaj pri efiko de la korpremado de suĉinfanoj. – Muzike ni memorigas la kanton „Intergenta am’” de Zhou Mack Mafuila el la KD „Originoj” eldonita de Vinilkosmo. – La interreta foto referencas al la sciencbultena informo pri la signifo kaj graveco de la korpremado de la suĉinfanoj. – Nia elsendo estas aŭskultebla ankaŭ en jutubo pere de: https://www.youtube.com/results?q=pola+retradio&sp=CAI%253D

--------------------------------------------------------------------------------

Intervjuo kun Lukis Żebrowski
[2018-01-30]
https://pola-retradio.org/2018/01/intervjuo-kun-lukis-zebrowski/

Hodiaŭ ni interparolas kun konata pola jungeneracia esperantisto Lukis Żebrowski , TEJO-oficisto pri Afriko, eksa PEJ- kaj TEJO-prezidanto. Ne sole la movadaj aferoj estas la temo de nia interparolo, ankaŭ lia E-familio kaj mallonge lia interesa profesia. Ĉar en la interparolo ni mencias la novan TEJO, estraron necesas aldoni, ke la 23-an de januaro 2018 sekve de reta voĉdonado la nova prezidanto de TEJO estas  Hoan Tran (Ĝojo), la ĝenerala sekretario fariĝis  Charlotte Scherping Larsson. El la elsendo 30.01.2018 – 10’26”

--------------------------------------------------------------------------------

Laŭvica albumo pri polaj tataroj
[2018-02-02]
https://pola-retradio.org/2018/02/lauvica-albumo-pri-polaj-tataroj/

Muzulmana Religia Asocio en Pola Respubliko eldonas laŭvican albumon kun fotoj kaj priskribo de la tradicioj de polaj tataroj. Ĝi estas dediĉita al la ritoj ligitaj kun la akcepto de la infano en la tataran komunumon. Ĝis nun aperis albumoj pri iliaj nuptaj kaj sepultaj tradicioj. La albumo „Kaj memoru nomon vian. Ritoj de transiroj de polaj tataroj – azan” fermas la serion. Azan estas la unua rito de transiro ligita kun la naskiĝo de infano enkondukanta ĝin en la konfesian vivon. Dum ĝi la gepatroj elektas por la infano plej ofte du nomojn. La unua estas oficiala, la alia uzata ĉiutage. La azan-solenaĵo en la ĉeesto de imamo havas familian karakteron okazante hejme aŭ en luita salono. Por ĝi estas necesa tablo kovrita per blanka tablotuko, sur kiun oni metas Koranon, akvoglason, panon kun salo kaj ŝafan felon, kio estas tipa por la tatra tradicio. Troviĝas sur ĝi ankaŭ dolĉa regalmanĝo „sadoga” el mielo, faruno kaj butero servata al la gastoj en la fino de la solenaĵo. En Pollando vivas ĉirkaŭ kvin mil tatardevenaj muzulmanoj. Plej multnombre en la nordorienta Pollando en la lokoj Bialistoko, Sokółka, Suchowola kaj Dąbrowa Białostocka.

El la elsendo 02.02.2018. Legas  Maciek – 1’31”

--------------------------------------------------------------------------------

Zalipie inter 30 plej belaj lokoj en Eŭropo
[2018-02-02]
https://pola-retradio.org/2018/02/zalipie-inter-30-plej-belaj-lokoj-en-europo/

La vilaĝo Zalipie en la krakova vojevodio ektroviĝis inter 30 plej belaj, vizitendaj lokoj en Eŭropo laŭ la Japana Asocio de Vojaĝoficejoj JATA (Japanese Association of Travel Agents). Zalipie famas pro la kutimo de la lokaj virinoj ornami per flormotivoj i.a. la domfrontonojn kaj frontonojn de la hejmaj mastrumejoj. De jaroj en junio estas organizata konkurso „La pentrita ĥato”, kiu logas ne sole rivalantinojn, sed ankaŭ ĉiam pli multajn turistojn. La  konkurso „La pentrita ĥato” estas konsiderata la plej malnova, se temas pri popola arto. Ĝi ne havas fiksan daton kaj ĉiujare okazas dum la unua semajno post la religia festo de Dia Korpo. Dum tri konkursaj tagoj Zalipie svarmas de vizitantoj, inter kiuj troviĝas kreskanta nombro de eksterlandaj turistoj. Entute la krakova vojevodio fariĝas turisme pli alloga. En la pasinta jaro temis pri 16 milionoj da turistoj.

El la elsendo 02.02.2018. Legas  Maciek – 1’06”

--------------------------------------------------------------------------------

Novaj Ramsar-regionoj en Pollando
[2018-02-02]
https://pola-retradio.org/2018/02/novaj-ramsar-regionoj-en-pollando/

Vendrede, la 2-an de februaro pasis la Internacia Tago de Marĉoj. Temas pri laŭvica datreveno de la Internacia Traktato pri naturprotekto subskribita en 1971en la irana ripozloko Ramsar. Ĝi konceras protektadon kaj konservon de regionoj akvo-kotaj en neŝanĝita stato, laŭ la vidpunkto de la akvobirdaj populacioj loĝantaj aŭ estadantaj periode sur tiuj ĉi terenoj. En Pollando komence de 2018 temas jam pri 16 ĉi-specaj terenoj kun la suma areo de preskaŭ 152 mil hektaroj. En la komencaj tagoj de januaro aldoniĝis al tiu ĉi listo kun internacia signifo tri novaj regionoj en Pollando. Tio estas Przemków-lagoj en la okcidenta Pollando enirantaj la konsiston de la ornitologa rezervejo kaj ĝia panorama parko, Marĉejoj de Izera-rivera valo en la suda Pollanddo kaj la Akvobuŝo de Vistulo en la norda Pollando. Krom la ĵus menciitaj lokoj temas ankaŭ pri 6 naciaj parkoj, kvin lagoj kaj aldone ampleksa komplekso de la karpobredaj lagoj en la ĉirkaŭaĵoj de la loko Milicz en la okcidenta Pollando. La konvencio pri la akvo-kotaj regionoj kun internacia signifo kiel vivejo de akvobirdaro, difinata kiel Ramsar-konvencio,  estas la plej malnova monda konvencio dediĉita al la protektado de la natura medio. Laŭ ĝi kiel akvo-kotaj regionoj estas konsiderataj terenoj de torfejoj, marĉoj, kotriĉaj terenoj same naturaj, kiel aftefaritaj, firmaj kaj periodaj, kun akvoj fluaj aŭ stagnaj, dolĉaj, saletaj aŭ salaj inkluzive de marakvoj, kies profundeco dum refluciklo ne superas 6 metrojn. Aktuale la Ramsar-konvecion subskribis 169 ŝtatoj, kiuj difinis 2293 Ramsar-regionojn kun la suma surfaco de  pli ol 225 milionoj da hektaroj. Ni informu pri tiuj plej novaj Ramsar-regionoj registritaj en Pollando en 2018. Kiel menciite temas pri la regiono de Przemków-lagoj, kiu  estas la akvo-kota regiono en la riverbranĉaro de Szprotawa,  ĉirkaŭprenanta du kompleksojn de  fiŝaj bredejoj  kaj apudajn  akvumitajn regionojn – malaltajn kaj marĉajn  torfejojn, humidajn herbejojn, kareksejojn kaj ĉeriverajn arbojn. La regiono de Przemków-lagoj  kiel birdorifuĝejo apartenas en ĉi tiu parto de Eŭropo al la plej signifaj lokoj de ripozo kaj sinnutrado de birdoj dum la migrado, aparte de fabanseroj. Ĝi estas ankaŭ la  kovejo de multaj aliaj akvokotaj birdoj. La areo de la regiono de Przemków-lagoj egalas al 4605 hektaroj. Torferoj de Izera-rivera valo konsistigas la plej grandan en Pollando komplekson de montaraj torfejoj en la centra parto de Izerskie-montoj laŭe de la pola-ceĥa limo.   Surkreskas ilin montaj pinoj, senarbaraj herbejoj kaj piceaj arbaroj. La surfacon de la torfejoj karakterizas  variforma erodado kaŭzita de frosto aŭ ventoj. Aperas tie longaj, humidaj geomorfologiaj grundoformacioj similaj al tiuj, kiuj aperas sur la torfejoj de la norda Skandinavio. La kreskaĵojn de tiuj torfejoj karakterizas la unika en nia klimato subarkta tundro. La surfaco de la regiono de Izera-riveaj torfejoj egalas al  529 hektaroj. La regiono de la Vistula  Riverbuŝo regiono konsistas el du apartaj partoj de la plej granda en Pollando estuaro de Vistulo. Ĝia okcidenta fragmento signifagrade kovras la terenon de la naturrezervejo „La Birda Paradizo”, la orienta ĉirkaŭprenas la ĉefan riverelfluejon de Vistulo inkluzive de sablozaj, lagoformaj formacioj de stagna akvo, kie troviĝas la naturrezervejo „Meva Sablozejo”. Ĉi tiu surfaco apartenas al unu el la plej gravaj rifuĝejoj por la traflugantaj kaj vintrumantaj akvokotaj birdoj ligitaj kun la marbordo. Temas pri la unusola en Pollando kovejo de sandviĉa ŝterno kaj unu el la plej gravaj kovejoj de la malgranda  kaj hirundaj ŝternoj. Temas samtempe pri la ĉefa en Pollando loko, en kiu aperas grizaj fokoj kaj la unusola loko en nia lando, en kiu generas ordinara foko. La surfaco de la  regiono de la Vistula Riverbuŝo egalas al 1748 hektaroj.

El la elsendo 02.02.2018. Legas Barbara – 5’50”

--------------------------------------------------------------------------------

E_elsendo el la 02.02.2018
[2018-02-03]
https://pola-retradio.org/2018/02/e_elsendo-el-la-03-02-2018/

Podkasto: Ludu en nova fenestro | Elŝutu

La 724-a E_elsendo el la 02.02.2018 ĉe www.pola-retradio.org

– Hodiaŭ nia felietono estas dediĉita al tri novaj regionoj de Pollando registritaj en la listo de Ramsar-konvencio pri la protektado kaj konservo de la akvokotaj regionoj necesaj por la vivantaj kaj migrantaj tra ili birdopopulacioj. Temas pri lagoj de Przemków en la okcidenta parto de la lando, torfejoj en la valo de la rivero Izera en la suda Pollando kaj pri la riverbuŝo de Vistulo en la norda parto de la lando. – La kulturkronikaj informoj rilatas al la vilaĝo Zalipie kalkulita de japanaj turismaj aŭtoritatoj inter 30 plej belaj kaj vizitendaj lokoj en Eŭropo kaj al la nova albumo kun fotoj kaj klarigoj dediĉita al polaj tataroj vivantaj ĉefe en la nordorienta Pollando. – En la E-komunuma segmento ni prezentas informon pri la julia Internacia Somerlernejo kun la temo “Lingvopolitiko kaj lingvoplanado: edukado, lingvoj kaj migrado” en Sieno kaj pri KAEST-2018. – En la fino aŭdiĝas leterkesta programero. Reference al la traktita en ĝi letero kaj nia respondo al interesiĝantaj aŭskultantoj ni donas adreson de la anglalingva elpaŝo de la pola ĉefministro rilate la leĝamendon pri la Instituto de la Nacia Memoro: https://www.youtube.com/watch?time_continue=11&v=R9bS9z5OiWY – Muzike ni memorigas la kanton de Feri Floro „Fluas akvo”. – La interreta foto ligas al hodiaŭa felietono prezentante fragmenton de Izera-rivera torfejo.

– Nia elsendo estas aŭskultebla ankaŭ en jutubo pere de: https://www.youtube.com/results?q=pola+retradio&sp=CAI%253D

--------------------------------------------------------------------------------

Polaj hirudoj povas helpi dum kosmokonkero
[2018-02-06]
https://pola-retradio.org/2018/02/polaj-hirudoj-povas-helpi-dum-kosmokonkero/

La medicinaj hirudoj el la bredejo en Opole (la suda Pollando) estis utiligitaj dum la sciencaj esploroj de la kosma misio ICAres-1. Estonte ili povos medicine servi al partoprenantoj de pliaj  kosmaj misioj. En ICAres-1 (Innovative Concepts Ares) temis pri simulita misio al Marso, efektivigita sur la tereno de la unusola en Eŭropo, speciala >stacio habitat< Lunares en la loko Piła kun la partopreno de sciencistoj el Pollando, Francio kaj Germanio. Ĝia celo estis i.a. sciencaj eksperimentoj en kondiĉoj proksimaj al tiuj, kiuj povas regi sur la tereno de la kosmaj stacioj en la kondiĉoj de mikrogravitado. La medicina parto de la misio  estis aŭspiciita de la Medicina Universitato en Poznano kadre de ĝia novkreita Laborejo de Ekstrema Medicino. Dum la simulado helpe de specialaj aranĝaĵoj oni klopodis rekrei kondiĉojn en la kosmaj stacioj sur Marso kaj la Luno. Temis pri reprezentantoj de la tera faŭno kaj flaŭro, virtualaj partneroj de kosmonaŭtoj dum iliaj veturoj ekseter la Teron. Evidentiĝis, ke lumbrikoj kaj plantoj ne ŝatas polvon de meteoritoj dum muŝoj kaj hirudoj ne havis la problemojn en tiuj ĉi kondiĉoj generi. Oni asertas, ke hirudoj en longdaŭraj flugmisioj povas plenumi diversajn rolojn ligitajn kun senmoviĝo en malvasta spaco dum plurmonataj veturoj. Laŭ Maria Mroczko de jaroj bredanta hirudojn en Namysłowice, liverinta ilin al la misio ICAres-1 la apliko de hirudoj,  kiel medicina rimedo ne mirigas, ĉar temas pri vera fabriko de komplikaj kemiaj strukturoj. Ĝis nun estis esploritaj 120 el ili. La partopreno en la kosma programo povas helpi al la specio „hirudo medicinalis” esti agnoskita kiel specio minacita de formorto. La interesiĝo pri polaj hirudoj venanta el la tuta mondo superas la bredoeblojn, kiuj ĉirkaŭprenas 50 mil hirudojn inkluzive de la 8-mila genera grupo,  ĉiujare grandiĝanta.

El la elsendo 06.02.2018. Legas Tomek kaj Gabi – 2’16”

sc_tm_gk_Polaj_hirudoj_servas_al_kosmaj_esploroj_02’16”.mp3; filename_=UTF-8”sc_tm_gk_Polaj hirudoj servas al kosmaj esploroj_0216

--------------------------------------------------------------------------------

Komune pri la Konstitucio, komune pri familio
[2018-02-06]
https://pola-retradio.org/2018/02/komune-pri-la-konstitucio-komune-pri-familio/

Familio formas absolutan fundamenton de la socia reĝimo de la ŝtato kaj kiel tia ĝi devas estis enskribita en la Konstitucio. Tiun konstaton prezentis prezidento Andrzej Duda dum la konferenco „Komune pri la Konstitucio, komune pri familio”. Kiel klarigis la pola prezidento la debatobjekto estas la demando ĉu la familio trovas taŭgan lokon en la Konstitucio, ĉu ĝia signifo estas adekvate reliefigita. Ĉu lige kun tio familio kiel institucio estas kontetige protektita de la Konstitucio kaj kiamaniere laŭ la reĝima vidpunkto familio devas esti traktita estonte.

El la elsendo 06.02.2018. Legas Milada – 0’51”

--------------------------------------------------------------------------------

Francio rekone por la polaj himalaistoj
[2018-02-06]
https://pola-retradio.org/2018/02/francio-rekone-por-la-polaj-himalaistoj/

La franca ministerio por la aferoj de Eŭropo  kaj eksterlandaj aferoj esprimis rekonon por la heroeco de polaj himalaistoj, kiuj organizis savkampanjon de la franca alpinistino Elisabeth Revol surgrimpinta la pinton de Nanga Prabat. En la porokaza deklaro de la franca ministerio troviĝas i.a. la vortumo: „Ĉiuj personoj, kiuj engaĝiĝis en savkampanjon donis la ateston de modela kuraĝo kaj la plej supera solidarecoprovo. Ni ĝojas ankaŭ pro la bonega kunlaboro de reprezentantoj de Pollando kaj Francio en Pakistano, kiel ankaŭ kun la pakistanaj aŭtoritatoj”. Lastdimanĉe polaj himalaistoj sub la gvido de Adam Bielecki forportis el la unua tendaro je 4850 metroj sur Nanga Parbat la francan himalaistinon. Sur la alteco de 7200 restis poreterne Tomasz Mackiewicz. La vintra konkero de Nanga Parbat – 8126 super la marnivelo – fare de Elisabeth Revol i Tomasza Mackiewicza estas la dua en la mondo. Revol estas la dua virno, kiu atingis tion, Mackiewicz estas la unua polo. Tiel li realigis sian revon 6 fojojn ekde 2011 klopodante konkeri Nanga Parbat. Fine de januaro 2018 tio okazis la lastan fojon. Inter himalaistoj la pinto estas difinata „mortiga monto”. Karakterizas ĝin la plej granda relativa alteco en la mondo, kiu egalas al ĉirkaŭ 7 mil metroj super la marnivelo. La ĉefa bazo ĉe la norda flanko situanta ĉirkaŭ 3600 metrojn super la marnivelo kalkuliĝas al la plej malalte situantaj inter ĉiuj bazoj de la 8-milmetraj montopintoj.

El la elsendo 06.02.2018. Legas Maciek – 1’44”

--------------------------------------------------------------------------------

Pollando en eŭrosfero (2018)
[2018-02-06]
https://pola-retradio.org/2018/02/pollando-en-eurosfero-2018/

La pola ĉefministro Mateusz Mazowiecki okaze de sia estado dum la Ekonomia Forumo en Davos donis intervjuon al la televido Bloomberg, en kiu li respondis la demandon pri eniro de Pollando en eŭrosferon. Laŭ la pola politikisto tio estos ebla, kiam nia lando atingos 80-90 procentojn de la enspezoj de la plej riĉaj okcidentaj landoj kiel Germanio aŭ Nederlando kalkultitaj kiel nivelo de la elspezoj de la hejmaj mastrumejoj post la subtraho de firmaj kostoj kiel lupago aŭ diversspecaj vivtenaj pagoj, kaj kiam okazos konverĝo de niaj mastrumdaoj en la plej gravaj sektoroj. Pli rapide ni proksimiĝas al la evolunivelo de la okcidenteŭropaj landoj, se temas pri la pokapa nivelo de la Landa Produkto Brutte kalkulita laŭ la kurzo de la valuta aĉetoforto. Laŭ tiu indico Pollando fine de 2016 atingis 68 procentojn, sed la indicoj de tiaj landoj kiel Nederlando kaj Germanio estas multe pli altaj kaj egalas al 80-90 procentoj.

El la elsendo 06.02.2018. Legas Maciek – 1’05”

--------------------------------------------------------------------------------

E_elsendo el la 06.02.2018
[2018-02-06]
https://pola-retradio.org/2018/02/e_elsendo-el-la-06-02-2018/

Podkasto: Ludu en nova fenestro | Elŝutu

La 725-a E_elsendo el la 06.02.2018 ĉe www.pola-retradio.org

– Hodiaŭ antaŭ nia mikrofono ni gastigas unu el la plej popularaj E-kanzonistoj Jonny M. La okazo de la renkontiĝo estis lia vizito kaj koncerto dum la lasta ARKONES. Tie okazis lia pola premiero de la KD „Kreaktiva” eldonita de Vinilkosmo. Ne mirige, ke Jonny M. akompanas nian hodiaŭan E-elsendon per tri muzikĉerpaĵoj el siaj KD-oj: „Dankon” el la KD „Regestilo” kaj „Bim Bam” kaj „Por mia patro” el la KD „Kreaktiva” eldonitaj de Vinilkosmo. – Niaj komencaj aktualaĵoj rilatas al la pola starpunkto, kiam nia lando povos ektroviĝi en eŭrosfero, al la lastlunda konferenco en la prezidenta palaco dediĉita al loko de pola familio en la konstitucio kaj al la dankesprimo de francaj aŭtoritatoj pro la savo de franca himalajistino. – La sciencbultenaj temoj koncernas la rolon de polaj hirudoj en la kosma spaco kaj la sanigan efikon de cinamo, kiu estas ne sole fajna kuirarta spico. – La interreta foto akompananta la programinformon estas la omaĝesprimo por la pola himalajisto Tomasz Mackiewicz, kies laŭvica provo konkeri Nanga Parbat sukcesis, sed por ĉiam retenis ĉe sia deklivo dum lia grimpakompanantino estis savita de polaj himalajistoj. – Nia elsendo estas aŭskultebla ankaŭ en jutubo pere de: https://www.youtube.com/results?q=pola+retradio&sp=CAI%253D

--------------------------------------------------------------------------------

Interparolo jun Jonny M
[2018-02-06]
https://pola-retradio.org/2018/02/interparolo-jun-jonny-m/

Antaŭ nia mikrofono ni gastigas unu el la plej popularaj E-kanzonistoj Jonny M . La okazo de la renkontiĝo estis lia vizito kaj koncerto dum la lasta ARKONES. Tie okazis lia pola premiero de la KD „Kreaktiva” eldonita de Vinilkosmo. Ne mirige, ke Jonny M. akompanas nian  E-elsendon el la 06.02.2018 per tri muzikĉerpaĵoj el siaj KD-oj: „Dankon” el la KD „Regestilo” kaj „Bim Bam” kaj „Por mia patro” el la KD „Kreaktiva” eldonitaj de Vinilkosmo. El la elsendo 06.02.2018 – 6’59”

--------------------------------------------------------------------------------

Stalowa Wola prezentas la ĉinan terakotan armeon
[2018-02-09]
https://pola-retradio.org/2018/02/stalowa-wola-prezentas-la-cinan-terakotan-armeon/

La loĝantoj de la loko Stalowa Wola en la apudkarpatia vojevodio (la suda Pollando) havos la eblecon ĝis la fino de marto admiri duplikatojn de la mondfamaj figuroj de la  Terakota Armeo de la 1-a Imperiestro de Ĉinio.  Kalkulata al la mondaj mirindaĵoj ekde 1987 ĝi troviĝas en la listo de la monda kulturheredaĵo de Unesko.  En la loka regiona muzeo de Stalowa Wola troviĝas 40 terakotaj soldatoj, inkluzive la imperiestron Qin, infanterianoj, arkopafistoj, oficiroj, ĉevaloj kaj ĉevaltiraj veturiloj. Ili estis faritaj sammaniere kiel la originaloj, rigardeblaj sole en la ĉina Xi’an. La armeo estis farita el terakoto, kiu antaŭ du mil jaroj estis transportata el la tuta Ĉinio al la konstruloko de la imperiestra maŭzoleo. La karakteriza trajto de la figuroj estas tio, ke ili ne identas. Ĉiu havas la malsamajn vizaĵtrajtojn, mimikon, hararanĝon, ĉiu estas prezentita en malsama pozo kaj estas malsame armilekipita. Kuriozaĵo estas,  ke la terakotaj soldatoj estis ekipitaj per veraj armiloj, i.a. glavoj, halebardoj, arbalestoj. Iliaj forĝitaj elementoj estas funkcipovaj ĝis nun.  La surpriza malkovro de la maŭzoleo dum la putfosado en 1974 fariĝis arkeologia sensacio de la 20-a jarcento. Ĝis nun estis elterigitaj  pli ol 8 mil figuroj. Shi Huang el Qin-dinastio, kiu transprenis la povon havante 13 jarojn komencis la konstruadon de la Granda Ĉina Muro. Li unuigis la malnovan ĉinan ŝtaton inaŭgurante ĝian  modernan staton. Li envivigis unuecigitan sistemon de mezuroj, pezoj, komunan valuton kaj alfabeton. La ekspozicio en Stalowa Wola estas vizitebla ĝis la 27-a de marto.

El la elsendo 09.02.2018. Legas  Tomek – 1’52”

--------------------------------------------------------------------------------

Arkivo de Henryk Mikołaj Górecki en Nacia Biblioteko
[2018-02-09]
https://pola-retradio.org/2018/02/arkivo-de-henryk-mikolaj-gorecki-en-nacia-biblioteko/

Preskaŭ kompleta arkivo de unu el la plej elstaraj polaj komponistoj de la lasta jarcento, la mortinta antaŭ 8 jaroj Henryk Mikołaj Górecki ektroviĝis en la kolektoj de la Nacia Biblioteko. Temas i.a. pri la komponistaj manuskriptoj, i.a de lia 3-a Simfonio, personaj leteroj, inkluzive leteron de Johano Paŭlo la 2-a, korespondaĵoj kun multaj kreantoj kaj ankaŭ kvin kajeroj vastigantaj konojn pri kelkiuj komponaĵoj de Górecki, kiuj klarigas la kreoprocezon kaj la kreajn planojn de la komponisto.  En la arkivo troviĝas ankaŭ la komponaĵo Susan (por la miksita koruso a capella), kiu estis ĝis nun ne konata kaj nepublikigita. La aĉeton de la manuskriptoj ebligis helpo de la pola kulturministerio. La arkivo de Henryk Mikołaj Górecki en Nacia Biblioteko estos konsultebla de esploristoj kaj kreantoj.

El la elsendo 09.02.2018. Legas  Maciek – 1’02”

--------------------------------------------------------------------------------

E_elsendo el la 09.02.2018
[2018-02-10]
https://pola-retradio.org/2018/02/e_elsendo-el-la-09-02-2018/

Podkasto: Ludu en nova fenestro | Elŝutu

La 726-a E_elsendo el la 09.02.2018 ĉe www.pola-retradio.org

– Niaj komencaj kulturkronikaj informoj koncernas la transdonon de arkivo de la elstara pola komponisto Henryk Mikołaj Górecki al la Nacia Muzeo, kaj la ekspozicion de 40 duplikatoj de la fama terakota armeo el Xian, Ĉinio en la Regiona Muzeo de Stalowa Wola (la suda Pollando). – Venis la lasta semajnfino de karnavalo, ĝia apogeo. Kvankam la tempo de bruaj amuzoj, elegantaj baloj pasis, tamen kelkaj kutimoj ja elstarigas ĉi tiun periodon. Kun ili konatiĝis studentoj de Interlingvistikaj Studoj el Poznano, sabate vizitinte Torunon kaj i.a. la tiean Etnografian Muzeon. Krome en la E-komunuma segmento ni informas pri tio, kio estas Multlingva Akcelilo kaj pri Alta Protektanto de la 103-a UK en Lisbono. – En la fino ni proponas Leterkeston, en kiu ni prezentas la poeziaĵon de Amerigo Iannacone „Eterna Alternanco” el lia dulingva volumeto „Eterna Metamorfozo”. – Muzike ni memorigas unu el la kantoj de Olivier Tzaut el la vinila disko „Karnavaleto”. – La interreta foto akompananta la programinformon referencas al la kutimoj ligitaj kun la fino de karnavalo en la vojevodio de Kujavio (al tiu regiono parte apartenas la urbo Toruń). – Nia elsendo estas aŭskultebla ankaŭ en jutubo pere de: https://www.youtube.com/results?q=pola+retradio&sp=CAI%253D

--------------------------------------------------------------------------------

Vroclavo venkis kiel la Plej Bona Eŭropa Turisma Celo 2018
[2018-02-13]
https://pola-retradio.org/2018/02/vroclavo-venkis-kiel-la-plej-bona-europa-turisma-celo-2018/

Vroclavo en la sudokcidenta Pollando, kie okazos nunjare IFEF-kongreso, venkis en la konkurso por la plej bona eŭropa turisma celo. La konkurso estas organizata de internacia institutuco okupiĝanta pri la popularigado de kulturo kaj turismo en Eŭropo. Vroclavo, kiel la unusola pola urbo partoprenanta la konkurson, venkis rivalante i.a. kun Ateno, Amsterdamo, Bilbao, Colmar, Rigo, Milano kaj Parizo. La rivaladon ĉiujare partoprenas 20 urboj. Vroclavo estis elektita en la interreta voĉdonado en kiu partoprenis loĝantaj de la urbo kaj vizitantaj ĝin turistoj. Entute por Vroclavo venis voĉoj el 146 landoj. Ĉiujare vizitas ĝin inter 4 kaj 5 milionoj da turistoj.

El la elsendo 13.02.2018. Legas Milada – 1’03”

--------------------------------------------------------------------------------

Pola Aviada Grupo
[2018-02-13]
https://pola-retradio.org/2018/02/pola-aviada-grupo/

Komence de la jaro estis establita Pola Aviada Grupo,  akcia kompanio kun la kapitalo de 1,2 miliardoj da zlotoj. Ĝiscele ĝian konsisiton eniros la plej gravaj kompanioj de la fisko funkciantaj en la branĉo de la pasaĝera aviado. I.a. temas pri la Polaj Aerlinioj LOT, LOT AMS – okupiĝanta pri la teknika priservado de aviadiloj kaj  LS Airport Services respondeca pri la surtera priservo de pasaĝeroj kaj kargoj. Ili konservos organizan apartecon realigante komunuan strategion konforman al la bezonoj de la aviada merkato en Pollando kaj en la Centra-Orienta Eŭropo. Pola Aviada Grupo respondas je la kreskanta rekordatempe bezonateco de la aviada transporto en Pollando kaj la Centra-Orienta Eŭropo kaj neceso plibonigi konkurencon kaj efikecon de la pola sektoro de la pasaĝeraj servoj.

El la elsendo 13.02.2018. Legas Maciek – 0’54”

--------------------------------------------------------------------------------

Pola ĉefministro en Libano
[2018-02-13]
https://pola-retradio.org/2018/02/pola-cefministro-en-libano/

La pola ĉefmininistro Mateusz Mazowiecki faras viziton en Libano, kie li renkontiĝis kun sia samrangulo kaj la libana prezidento. La gvidataj interparoloj koncernas kaj la ekonomijn aferojn (i.a. kunlaboron en la banka sektoro, fervoja infrastrukturo) kaj la komunajn projektojn pri helpo al rifuĝintoj. La pola registaro sisteme grandigas sian helpon kaj nun decidis destini krome el speciala rezervo 10 milionojn da dolaroj. La helpo estas destinata al lokoj,  kie la problemoj kreiĝas, ĉar multaj sirianoj volas resti proksime al siaj hejmoj kaj ne migri.

El la elsendo 13.02.2018. Legas Barbara – 0’47”

--------------------------------------------------------------------------------

Ne aĝo decidas pri la postoperaciaj komplikaĵoj
[2018-02-13]
https://pola-retradio.org/2018/02/ne-ago-decidas-pri-la-postoperaciaj-komplikajoj/

