2015 en la pola politiko
[2015-01-02]
https://pola-retradio.org/2015/01/2015-en-la-pola-politiko/

Laŭ politologoj kaj sociologoj, kun kiuj interparolis PAP-agentejo la prezidentaj kaj parlamentaj balotoj estos la plej grava evento en 2015. Laŭ politologo Rafal Chwedoruk el la Varsovia Politekniko tio estos la plej grava jaro ekde 2005. Liaopinie partio, kiu ilin gajnos plej verŝajne restos en la pola politika sistemo pli ol unu ofic­periodon. Kiu atingos tro malfortan rezulton aŭ ne superos la balotsojlon povas entute adiaŭi la politikan vivon. Laŭ ĉi tiu vidpunkto la decidaj estos la rezultoj de la Pola Kamparana Partio kaj Alianco de Demokrata Maldekstrularo. Se Civitana Platformo gajnos balotojn aŭ certigos al si – en la alianco kun la kamparanoj – decidan plimulton la pola partia sistemo transformiĝos en sistemon kun unusola dominanta partio. Aldonendas, ke la Civitana Platformo regas en Pollando jam ekde 2007 kiel rivalon havante la partion  Juro kaj Justeco. Laŭ Maciej Gdula en „Politika Kritiko” konsiderante la regadstilon de Ewa Kopacz el Civitana Platformo ne eblas al ŝi aŭguri grandan sukceson. Sed liaopinie multo dependas de la balot­rezulto de la re­kandidatonta por la prezidenta posteno Bronislaw Komorowski. Politologo el la Jagelona Univiersitato Jaroslaw Flis ankaŭ asertas, ke la balotoj de 2015 certigos la povoaranĝon por longa tempo eĉ ĝis aŭtuno 2018. Liaopinie Civitana Platfromo kun la Kamparana Partio havas ŝancon pluregi eĉ se bonan rezulton atingus Juro kaj Justeco. Similan opinion prezentas Rafał Matyja el la Supera Lernejo de Informadiko kaj Administrado en Rzeszów (en la sudorienta Pollando). Nur du aferoj povas ŝanĝi la ĝinunan regoaranĝon – apero de laŭvica prezidento­kandidato kaj la fakto, ke la Civitana Platformo fermiĝis je junaj generacioj konsiderante la aĝon de la gvidantoj, kiu superas 50 jarojn. Povas do sekvi generacia revolucio, ĉar junaj poloj estas sub­reprezentitaj en la pola politika sistemo. Laŭ Antoni Duda la dua duono de la nuna oficperiodo de la aktuale reganta Civitana Platformo kaj Kamparana Partio ne estos same stabila kiel  la unua.

El la elsendo 02.01.2015. Legas Milada

--------------------------------------------------------------------------------

Poloj bonvenigis la Novan Jaron hejme
[2015-01-02]
https://pola-retradio.org/2015/01/poloj-bonvenigis-la-novan-jaron-hejme/

Plimulto de poloj, eĉ 59-procente deklaris komence de decembro, ke la Silvestran Nokton pasigos hejme inter la familianoj. Malpli oni unu kvinono (16 procentoj) faris tion kun gekonatoj, amikoj – ankaŭ dum hejmaj aranĝoj. Nur 7 procentoj bonvenigis la 2015-an dum baloj.

Laŭ la decembraj esploroj de CBOS-centro nur malmultaj enketitoj – 2 procentoj – tiucele forveturis ekster sian loĝlokon, partoprenis koncerton, vizitis teatron, amuziĝis dum organizita surstrata  Silvestra Festo.

Laŭ la esploroj de CBOS rezultas, ke kvankam ekde la fino de la 90-aj jaroj de la 20-a jarcento malkreskis iom grupo de poloj bonvenig­antaj la Novan Jaron kun familianoj en la propra hejmo (je 7 procentoj) daŭre la pasigado de la Silvestra Nokto okazas en la familia rondo. Ekde 1997 ne ŝanĝiĝis en maniero esenca elcento de personoj, kiuj bonvenigas la Novan Jaron alimaniere. Tamen junaj poloj en la aĝo de 18-24 jaroj nur 21-procente pasigis la Silvestran Nokton kun familianoj, 85-procente faris tion personoj pli ol 65-jaraĝaj. Balon, nokton en kafejo aŭ restoracio plej ofte elektis poloj 25-44-jaraĝaj. Silvestron ekster la hejmo preferis loĝantoj de grandaj aglomerejoj.

El la elsendo 02.01.2015. Legas Gabi

--------------------------------------------------------------------------------

Jubilea ekspozicio en la Muzeo de Ludiloj kaj Ludoj
[2015-01-02]
https://pola-retradio.org/2015/01/jubilea-ekspozicio-en-la-muzeo-de-ludiloj-kaj-ludoj/

Pluŝaj ursetoj, pupoj, tabulludoj, sciencorientigaj ludiloj, aviadil­modeloj troviĝas inter la eksponaĵoj rigardeblaj en la Muzeo de Ludiloj kaj Ludoj en Kielce en la centra Pollando. La 35-jariĝo de la Muzeo estas la preteksto por rememoroj ligitaj ĉefe kun la kolektitaj tie ludiloj. En la junbilea ekzspozicio estas prezentataj krom diversaj kolektoj, eksponaĵoj antaŭnelonge aĉetitataj kaj neniam prezentataj.

Inter la plej malnovaj eksponaĵoj troviĝas pupoj el la limperiodo de la 19-a kaj 20-a jarcentoj. Eblas rigardi ankaŭ etajn meblojn, kuirejajn instrumentojn kaj lignajn popolajn ludilojn. Krome la ekspozici­ataj objektoj devenas el portempaj ekspozicioj prezentataj en la Muzeo i.a. pri pupoj de la mondo. Ŝatantoj de la animitaj filmoj povas rigardi la heroajn pupojn el tiaj filmoj, kiel  „Urseto kun klaporeleto”, „Aventuroj de la Urseto Coralgol” aŭ „Eta Pingveno Pik-Pok”.

Inter la eksponaĵoj estas objektoj aparte kortuŝaj pro ilia historio kiel pluŝa urseto transdonita de viro, kies korprema ludilo ĝi estis dum la 2-a mondmilito. Li priskribis aldone historion de kelkfojaj trudaj ­translokoj de lia  familio dum la 2-a modmilito. Lia tasko estis aparte gardi la urseton, kiu servis ankaŭ por kontraband­ado de presliteroj.

La ekspozicio daŭros dum la tuta jaro. Muzeo de Ludiloj kaj Ludoj en Kielce estas la plej malnova ĉi-speca institucio en Pollando. Ĝi kreiĝis en 1979. Ĝi disponas nun pri 26 mil eksponaĵoj, inter kiuj estas ludiloj historiaj, etnografiaj, artaj kaj nuntempaj. La muzeo pretigas ne sole ekspoziciojn, sed ankaŭ funkcias kiel loko de infanaj labor­renkontoj. Ĉiujare vizitas ĝin inter 30 kaj 40 mil personoj. De kelkaj jaroj ĉi tiu kultura centro organizas konkurson „Ludilo amika al infano”. En februaro 2015 estos anoncita la dua eldono de la konkurso „Libro amika al la infano”.

El la elsendo 02.01.2015. Legas Maciek

--------------------------------------------------------------------------------

En la salminejo de Wieliczka kapelo de s-ta Johano Paŭlo la 2-a
[2015-01-02]
https://pola-retradio.org/2015/01/en-la-salminejo-de-wieliczka-kapelo-de-s-ta-johano-paulo-la-2-a/

En la salminejo Wieliczka apud Krakovo (la suda Pollando) funkcias moderna kapelo de s-ta Johano Paŭlo la 2-a. La ĉefornamon de la sanktejo formas tri salbuloj kreitaj el speciala materialo fidele imitanta salon. Unu funkcias kiel altaro, la dua estas elemento de la internoornamaĵo. La tria konsistanta el 4 partoj estis metita surmure. Disetendiĝante ĝi formas luman krucon. Sur la muroj de la kapelo estas prezentataj elektronikaj tabuloj, sur kiuj estas dis­bildigataj fragmentoj de homilioj de Johano Paŭlo la 2-a kaj kalendaro de liaj pilgrim­vizitoj. Pere de son­aŭdigiloj estas emisiataj fragmentoj de liaj homilioj en 6 lingvoj. En vitroŝranko apud la altaro videbliĝas la folio el la taglibro de konklavo de Karol Wojtyła kun lia unua subskribo kiel la papo Johano Paŭlo la 2-a. La kapelo funkcias kiel religia objekto sub la protekto de sacerdoto. En ĝi okazas i.a. solenaĵoj ligitaj kun la figuro de la papo. La kapelo de Johano Paŭlo la 2-a troviĝas ĉe la pilgrima itinero „Szczęść Boże” -Dio favoru.

El la elsendo 02.01.2015. Legas Maciek

--------------------------------------------------------------------------------

E_elsendo el la 02.01.2015
[2015-01-02]
https://pola-retradio.org/2015/01/e_elsendo-el-la-02-01-2015/

Podkasto: Ludu en nova fenestro | Elŝutu

La jarŝanga festoperiodo estis/as la okazo por interŝanĝo de multaj bondeziroj Kristnaskaj kaj Novjaraj. Tiu temo dominas en nia Leterkesto, sed ĝojigas nin ankaŭ komentaj leteroj. Komence de la 401-a E-elsendo ĉe www.pola-retradio.org ni rerigardas, kiel la Novan Jaron 2015 bonvenigis poloj kaj ni informas, kio en la komenciĝanta jaro estos laŭ politologoj la plej grava en Pollando. Kio estas la plej grava por la E-komunumo kaj movado elstarigas prezidanto de UEA, Mark Fettes. Kun multaj citaĵoj ni prezentas lian mesaĝon, kies plena teksto kiel Gazetara Komuniko de UEA estas legebla ĉe www.uea.org . La festa periodo estas aparte ĉarma por infanoj. Multaj el Pollando sendube havos la eblecon pluĝui la etoson en la unusola en Pollando Muzeo de Ludiloj. Muzike akompanas nin bondezira kanto el la KD „Vinilkosmo kompil’ 2” kaj kanteto „Bela rideto” en la plenumo de la ensemblo Tintilo. La komencaj kaj kulturkronika informoj estas paralele legeblaj kaj aŭskult­eblaj ĉe nia paĝo en la rubrikoj Novaĵoj.

--------------------------------------------------------------------------------

E_elsendo el la 06.01.2015
[2015-01-06]
https://pola-retradio.org/2015/01/e_elsendo-el-la-06-01-2015/

Podkasto: Ludu en nova fenestro | Elŝutu

En la 402-a E-elsendo ĉe www.pola-retradio.org ni gastigas Roland Belkorpa, prezidanton de Junularo Esperantista Brita renkontitan en Poznano,  kun kiu ni interparolas pri lia vojo al Esperanto, al la E-komunumo kaj liaj aŭtoraj planoj. La 6-an de januaro en multaj landoj oni solenas Epifanion, ankaŭ ni en Pollando. Pri la relative nova kutimo tiuokaze, la publikaj Adorparadoj de la Tri Reĝoj ni rakontas komence. Sevas kultur­kronika informo pri nova kapelo en la salminejo en Wieliczka, dediĉita al Johano Paŭlo la 2-a. Scienca temo traktas interesajn planojn de Zoo-ĝardeno en Płock (la norda Pollando). Fine ni anoncas la publikigitajn rezultojn de la zagreba literatura konkurso, al kiu patronecas Ivo Ratković. El la kristnaska muzika repertuaro ni memorigas kantojn de la pola grupo “Muzilanoj” kaj de la nederlanda “Akordo”. La informoj de la elsendo estas aparte legeblaj kaj aŭskult­eblaj en la rubrikoj “Novaĵoj” kaj “Sciencaj informoj”. En la rubriko “Antaŭ la mikrofono” aŭdiĝas la interparolo kun nia antaŭ­mikrofona gasto.

--------------------------------------------------------------------------------

Interparolo kun Rolando Belkorpa pri lia vojo al Esperanto kaj liaj aŭtoraj planoj
[2015-01-06]
https://pola-retradio.org/2015/01/interparolo-kun-rolando-belkorpa-pri-lia-vojo-al-esperanto-kaj-liaj-autoraj-planoj/

Kun Rolando Belkorpa el Britio , la prezidanto de Junulara Esperantista Brita renkontita en Poznano ni interparolas pri lia vojo al Esperanto, al la E-komunumo kaj pri liaj aŭtoraj planoj. El la eslendo 06.01.2015 .

--------------------------------------------------------------------------------

En ZOO-ĝardeno en Płock mara flaŭro kaj faŭno el la tuta mondo
[2015-01-06]
https://pola-retradio.org/2015/01/en-zoo-gardeno-en-plock-mara-flauro-kaj-fauno-el-la-tuta-mondo/

Kelkdek akvarioj kun la volumeno de 500 ĝis 40 mil litroj estos el­konstruitaj en la Urba Bestoĝardeno de Płock [pŭock] en la norda Pollando kadre de la projekto „Akvoj de la mondo”. Eblos en ili rigardi la ekzemplojn de faŭno kaj flaŭro el ĉiuj plej grandaj maraj kaj dolĉaj akvo­receptakloj de la mondo. La projekto – la plej granda en Pollando – estos preta lime de somero kaj aŭtuno 2016, kio ligiĝos kun la 65-jariĝo de la loka besto­ĝardeno. La plej granda akvario destinita por ŝarkoj entenos 40 mil litrojn de la akvo. Ĝiaj muroj dikos 10 centimetrojn, ĝi longos 12 metrojn kaj estos vasta je du kaj duona metroj. Tra la ekspozicio kondukos pado memoriganta la sekiĝintan river­fluejon kun la bordaj muroj el akrilo. La ZOO-ĝardeno en Plock kun la surfaco de ĉirkaŭ 15 hektaroj estis establita en 1951. Loĝas en ĝi pli ol 3200 bestoj reprezentantaj 307 speciojn, inkluzive de tiuj al kiuj minacas la formorto. En Płock troviĝas unu  el la plej grandaj en la lando did­aktosciencaj pavilonoj kun ekspozicio de reptiloj kaj amfibioj kaj specimene aranĝita tropika arbaro kun originala, ekzotika plantaro. Ekde 12 jaroj la bestoĝardeno de Płock – vizitata jare de pli ol 250 mil personoj –  apartenas al la Monda Organizo de ZOO-ĝardenoj.

El la elsendo 06.01.2015. Legas Tomek

--------------------------------------------------------------------------------

Kolektoj de la varsovia Nacia Muzeo en la reto
[2015-01-09]
https://pola-retradio.org/2015/01/kolektoj-de-la-varsovia-nacia-muzeo-en-la-reto/

Post kelkaj monatoj en la unua duono de 2015 la internaŭtoj povos partopreni virtualan promenon tra la Nacia Muzeo en Varsovio. Enretigitaj estos la Artgalerio Faras, la Artgalerio de la Mezepoka Arto kaj la Artgalerio de la 19-jarcenta Arto. Kiel la dua en Pollando la varsovia Nacia Muzeo aliĝos al  pli ol 120 institucioj de la mondo, i.a. la Blanka Domo en Usono, la Versajla Palaco  en Francio, kies internojn eblas rigardi kadre de la projekto Museum View. Entute en la varsovia Nacia Muzeo la retaj vizitantoj povos rigardi 983 objektojn i.a. pli ol 600 eksponaĵojn el la nov­malfermita Artgalerio Faras. Estas en ĝi prezentataj trezoroj de la nubia  civilizacio de antaŭ pli ol 1500 jaroj  (ekzistinta sur la tereno de la nuna Sudano). La prezentataj bildoj de sanktuloj aŭ episkopoj devenas el la katedrala preĝejo malkovita de polaj arkeologoj en la urbo Faras. Tiu malkovro estis epitetita kiel „miraklo el Faras”. 67 el 120 savitaj en Faras pentraĵoj  troviĝas en Varsovio. En la Artgalerio de la Mezepoka Arto temas ĉefe pri objektoj el la 14-a /16-a jarcentoj devenantaj el diversaj regionoj de Pollano. Inter ĉ. 100 rete disponig­itaj objektoj troviĝos alaj altaroj, liturgiaj instrumentoj, tolaĵoj kaj skulptaĵoj. La kernon de la Argalerio de la 19-a jarcento konsistigos 270 artverkoj de polaj pentristoj kaj skulptistoj akompane de pentraĵoj de diverslandaj eŭropaj artistoj.

Krome eblos rigardi en la reta Nacia Muzeo de Varsovio la gigapikselan pentraĵon de Bernardo Belotto nomata Canaletto „Panoramo de Varsovio de sur la teraso de la Reĝa Kastelo”. Canaletto estis la kortega pentristo de Stanislaw August Poniatowski. Museum View kaj la gigapiksela foto de la pentraĵo estas parto de la projekto Google Art Project. Ĝi kreiĝis kadre de la platformo Google Cultural Institute, kiu ebligas prezenti arton en la Interreto.

El la elsendo 09.01.2015. Legas Maciek

--------------------------------------------------------------------------------

Vizitrekordoj 2014 en polaj kulturcentroj
[2015-01-09]
https://pola-retradio.org/2015/01/vizitrekordoj-2014-en-polaj-kulturcentroj/

Komenco de la jaro estas la periodo de diversspecaj sumigoj. Ili rilatas ankaŭ al la kultura sfero, i.a. al. la vizitfrekfenteco en polaj kulturaj centroj. Rekordan popularecon en 2014 notis la Salminejo en Wieliczka. Vizitis ĝin 1 miliono 290 mil personoj duone el Pollando, duone el eksterlando. Inter la eksterlandaj gastoj el preskaŭ 200 landoj dominis britoj, germanoj, italoj, francoj kaj hispanoj. La minejo funkcias senĉese ekde la mezo de la 13-a jarcento, organizita turisma vizitado komenciĝis tie fine de la 18-a jarcento. Aktuale la turisma itinero de Wieliczka-minejo troviĝanta sur Unesko-listo de la monda Kulturheredajco longas 2 kaj duonan kilometrojn kaj ampleksas 20 kamerojn.

Malpli da gastoj notis la  Kastela Muzeo en Malbork (en la norda Pollando). En 2014 vizitis ĝinĉ. 460 milgastoj el pli ol 80 landoj. Plej multnombre germanoj, sekve rusoj kaj hispanoj. Oni notis krome gastojn el Mongolio, Maŭritiuso, Ĉilio, Saŭda Arabujo, Novzelando. En la lastaj jaroj kreskas la nombro de la eksterlandaj gastoj vizitantaj la Muzeon kaj la kastelon mem. En 2014 ili konsistigis jam unu kvaronon de ĉiuj vizitantoj.

El la elsendo 09.01.2015. Legas Gabi

--------------------------------------------------------------------------------

E-elsendo el la 09.01.2015
[2015-01-09]
https://pola-retradio.org/2015/01/e-elsendo-el-la-09-01-2015/

Podkasto: Ludu en nova fenestro | Elŝutu

En 403-a E-elsendo ĉe www.pola-retradio.org nian felietonon pri koninda polo ni dediĉas al Jan Długosz, elstara pola historiisto, diplomato, patro de la pola historiografio kaj heraldiko. La komenca kulturkroniko prezentas informojn pri du el polaj kulturcentroj multnombre vizititaj en 2014 kaj pri bitigo de la eksponaĵoj de la varsovia Nacia Muzeo. E-movade ni informas pri la forpaso de la eksa UEA-prezidanto Kep Enderby. Fine de la elsendo ni invitas al la leterkesta rendevuo. La kulturkronikaj informoj kaj la la felietono estas paralele legeblaj kaj aŭskulteblaj en la rubrikoj Novaĵoj kaj Felietonoj.

--------------------------------------------------------------------------------

Koninda polo: Jan Długosz
[2015-01-09]
https://pola-retradio.org/2015/01/koninda-polo-jan-dlugosz/

Komence de decembro la pola Sejmo proklamis la 2015-an Jaron kiel Jaron de  la s-ta Johano Paŭlo la 2-a, kiel Jaron de Jan Długosz [dŭgoŝ] kaj kiel Jaron de la Pola Teatro. Hodiaŭ ni volas paroli pri Jan Długosz, kiun polaj parlamentanoj memorigis kiel “elstaran polan historiiston, diplomaton kaj sacerdoton, kiel patron de la pola historiografio kaj heraldiko”.

Jan Długosz blazone Wieniawa naskiĝis antaŭ 600 jaroj la 1-an de decembro 1415 en la loko Brzeźnica [bĵeznica] en mezbonstata nobela familio. Lia patro Jan Długosz el Niedzielsko [njeĝelsko] pro meritoj en la kontraŭ­teŭtona batalo apud Grunwald ricevis la postenon de starosto. Lia filo, Jan Długosz komence lernis en paroĥa lernejo, sekve dum tri jaroj li studis en la Krakova Akademio. Post tio kiel publika notario li aperis en la kortego de la krakova episkopo Zbigniew Oleśnicki. Długosz fariĝis lia konfidenca kunlaboranto, sekretario kaj kanceliero. En tiu periodo li estis nomumita krakova kanoniko kaj post la  morto de episkopo Oleśnicki li restis en la servo de reĝo Kazimiro Jagelonido ekde 1467 fariĝinte edukanto de la reĝaj filoj: Władyslaw [vŭadislav], Kazimierz [kazimieĵ], Jan Olbracht [olbraĉt], Aleksander, Zygmund kaj Fryderyk. Dum oftaj vojaĝoj tra la lando knaboj vekiĝadis frue, portis modestajn vestojn, iliaj manĝoj estis simplaj, samtempe multan tempon ili dediĉis al la lernado. Tiel ilia edukisto pretigis ilin al la malfacila regometio. Kazimiro Jagelonido la elekton de la edukanto de siaj infanoj faris tutkonscie.  Sian internan ŝtat­politikon li apogis sur alianco kun kavaliraro/nobelaro. Jan Długosz el tiu socia tavolo elkreskis. Dank’ al liaj instruoj la reĝaj filoj  bone ekkonis ĝian mentalon. La reĝo cetere aprobe rilatis al la severaj, kavalirecaj edukmetodoj de Długosz, konis ja lian amon de braveco, kavalireco kaj kuraĝo, lian mastrumemon kaj praktikan talenton necesan al la reagntoj. Kazimiro Jagelondio alte taksis ankaŭ sciojn de Jan Długosz, lian profundan konon de la historio de Pollando, liajn talentojn en politikaj kaj diplomatiaj aferoj, kiujn akompanis funda kono de la tuto de la aktuala politika situacio en la tiama Eŭropo.

Jan Długosz  partoprenis multajn diplomatiajn misiojn. En 1449 al Romo, 1467 al Ĉeĥio, 1469  al Hungario, 1478 al Viŝegrado. Proponita de la reĝo Kazimiro Jagelonido je la posteno de arki­episkopo de Lvovo li ne ĝisatendis la papan aprobon, kiu venis jam post lia morto, kiu okazis la 19-an de majo 1480. La korpaj restaĵoj de Jan Długosz komence troviĝantaj en la Wawel-altaĵa katedralo estis transportitaj en la 400-a datreveno de lia morto en la Panteonon de Meritiĝintaj Poloj en la subterejo de la krakova paŭlena preĝejo.

Jan Długosz famiĝis kiel kronikisto kaj historiisto kaj kiel kreinto de unu el la plej elstaraj verkoj de la mezepoka eŭropa historiografio. Temas pri la 12-voluma verko “Annales seu cronicae incliti Regni Poloniae” (Analoj, alivorte kronikoj de la fama Pola Reĝolando), kiu traktas la historion de Pollando ekde la legendeca pratempo ĝis la 1480-a. Temas pri la plej granda kronikista verko de la 15-a jarcento verkita en Eŭropo latine. Sian  verkon Długosz komencis skribi jam en 1455-a jaro kaj ĝi poste ludis gravan rolon en la eduko de la reĝidoj. Kelkloke ĝi impresas, kvazaŭ ĝi estus verkata ĝuste kun la penso pri ili, ke estontaj regantoj konatiĝante kun la bravagoj aŭ mispaŝoj de siaj antaŭuloj kapablos regi juste.

La analoj longe ne aperis en la pola lingvo, sed por multaj historiistoj servis kaj servas kiel la referenca fonto. Ne nur por historiistoj, ĉar ekzemple baze de ili Henryk Sienkiewicz verkis sian romanon “Teŭtonoj”. Siajn informojn pri tiu ĉi temo Jan Długosz ĉerpis el la fontoj, al kiuj aliron ne havis plimulto de la kronikistoj,  dank’ al siaj multaj kaj diversaj sacerdotaj funkcioj, dank’ al tio, ke estante helpanto de la reĝo li povis konsulti dokumentojn en la reĝa kancelario.   Tutcerte Dlugosz utiligis la originalon de “Konfliktokroniko” dediĉita al batalo kontraŭ la Teutonan Kavaliraron. Li konis ankaŭ kaj prenis en konsiderojn la teŭtonajn raportojn. Se temas pri Grunwald-batalo multajn konojn li ekhavis el rakontoj de la partoprenintaj ĝin kavaliroj. Apartenis al ili kaj la patro kaj la patra onklo de la kronikisto kaj unuavice  kardinalo kaj krakova episkopo Zbigniew Oleśnicki, lia longjara superulo kaj protektanto. La analoj enhavas ankaŭ dokumenton kun unika valoro, kiu estas „Chorographia Regni Poloniae”. Ĝi prezentas detalan priskribon de la teritorio, aparte hidrografio de la polaj teritorioj kaj konfirmas la enormajn geografiajn konojn de la aŭtoro.

Lime de la 19-a kaj 20-a jarcentoj la verko de Jan Długosz estis subigita al akra kritiko, iniciatita de konata slavologo Aleksander Brückner. Aktuale post la rifuzo de lia enorme kritika sinteno, kiun oni ne hezitas nomi kalumnia,  la analojn de Jan Długosz ĉiam pli ofte oni traktas kiel valoran verkon, kiu  sur la kompara grundo meritas pliajn esplorojn. La junaj generacioj de poloj estis kaj daŭre estas nutrataj de legendecaj faktoj el la komenco de la pola ŝtateco, kiujn Długosz transprenis de pli fruaj kronikistoj kaj bunte evoluigis. Jen pri la reĝo Popiel, kiun musoj formanĝis aŭ pri la princino Wanda, kiu preferis morton en Vistulondoj oni edziniĝon al germano.

El la elsendo 09.01.2015. Legas Tomek

--------------------------------------------------------------------------------

Germanologio kaj centreŭropaj studoj en Krakovo
[2015-01-13]
https://pola-retradio.org/2015/01/germanologio-kaj-centreuropaj-studoj-en-krakovo/

La Pedagogia Universitato en Krakovo kune kun la Universitato en Prago funkciigos en la nova akademia jaro novan magistrigan stud­direkton pri german­ologio kaj la centreŭropaj studoj. Dum unu el kvar semestroj polaj studentoj lernos en Prago kaj la ĉeĥaj en Krakovo. Diplomitoj ricevos diplomojn de ambaŭ altlernejoj. Kvankam la Pedagogia Universitato en Krakovo ne estas la unusola en Pollando proponanta german­ologion kiel studdirekton, sed la unusola kiu en sia profilo donas la atenton al la centro­eŭropaj problemoj. La kunlaboro kun ĉeĥa universitato ebligos konatiĝi kun la ĉeĥa vidpunkto pri la ĉeĥaj-germanaj-polaj rilatoj, kiu apenaŭ estas konata kaj konsiderata en la polaj altlernejoj. La atuto de la nova studdirekto estas la interŝanĝa stud­semestro jen en Krakovo jen en Prago, kio donos la eblecon konatiĝi kun alia akademia medio kaj labori en multkultura kolektivo.

Nova studdirekto vastigos konojn de la studentoj pri la germanlingvaj kaj centreŭropaj mastrumadoj kaj kulturoj kaj krome praktike preparos al la pola-germana-aŭstra-ĉeĥa kunlaboro ebligonte laboron en firmaoj kaj institucioj okupiĝantaj pri la polaj-germanaj-ĉeĥaj-aŭstraj kontaktoj.

El la elsendo 13.01.2015. Legas Milada

--------------------------------------------------------------------------------

Interparolo kun Pascal Dubourg Glatigny pri dummilitaj francaj koncentrejoj
[2015-01-13]
https://pola-retradio.org/2015/01/interparolo-kun-pascal-dubourg-glatigny-pri-dummilitaj-francaj-koncentrejoj/

Kun Pascal Dubourg Glatigny el Germanio ni interpaolas pri lia prelego dum la lasta ARKONES. Ĝi estis dediĉita al francaj koncentrejoj lige kun la aperinta en Francio  en 2014 libro. Temas pri la franclingva traduko de libro de Jaume Grau Casas, kiu enhavas ankaŭ multajn E-veftojn. El la elsendo 13.01.2015 .

--------------------------------------------------------------------------------

Brumapo de Baltiko
[2015-01-13]
https://pola-retradio.org/2015/01/brumapo-de-baltiko/

Ĝis la jarfino daŭros esploroj, kiuj servos por krei la brumapon de Baltiko. La donitaĵojn kolektas 40 sondiloj dislokitaj en diversaj lokoj. Sciencistoj el 6 landoj, inkluzive de Pollando, antaŭvidas, ke la kreiĝonta mapo helpos protekti la marbestojn kontraŭ la sekvoj de la subakva bruo. La sondiloj estas lokitaj en la akvoj de Baltiko ĉe la bordoj de Svedio, Danlando, Pollando, Germanio, Estonio kaj Finnlando. Ĉiu lando lokis inter 4 ĝis 10 aranĝaĵojn, Pollando kvin. Ili troviĝas en la profundo de eĉ 90 metroj kaj estis dislokitaj tiel, ke la kolektitaj informoj liveru laŭeble plenajn donitaĵojn pri la bruo en la tuta maro. Ĉar la mezurado daŭras ekde la jarkomenco la finaj donitaĵoj prezentos la staton de la bruo en la Balta Maro dum la tuta jaro.

Paralele kun la registrado de la subakvaj sonoj la aŭtoroj de la projekto kolektas donitaĵojn pri la trafiko de ŝipoj, kiuj estas la ĉefaj bru­kaŭzantoj. Temas pri informoj rilate specon kaj grandecon de la marunuoj kaj rilate rapidecon, kun kiu ili navigas.

Tiel kreiĝos la brumapo de Baltiko ne sole prezentante kiel bruo dismetiĝis sub la marakvo, sed ebligonta prilaboron de komputila programo, kiu kun relative granda precizeco prognozos kiomgrada bruo kreiĝos en elektita parto de la maro depende de la premisita ŝiptrafiko. Tiuj laboroj daŭros ĝis la 2016-a jaro.

Ekde la 2-a mondmilito la brunivelo en la maroj kaj oceanoj kreskis kelkoble, kion pruvis enkondukaj esploroj gvidataj de multaj institucioj. La marbestoj estas tre impresiĝemaj je bruo dum sono sub la akvo disvastiĝas kun pli granda forto kaj atingeblo ol en la aero.

La internacia projekto kadre de kiu estas ekzamenata bruo nomiĝas sigle BIAS (t.e. Baltic Sea Information on Acoustic Soundscape). Ĝi estas subvenciata de la Eŭropa Unio. En Pollando krom­financas ĝin la Nacia Fonduso por la  Medioprotekto kaj Akva Mastrumado.

El la elsendo 13.01.2015. Legas Tomek

--------------------------------------------------------------------------------

E_elsendo el la 13.01.2015
[2015-01-13]
https://pola-retradio.org/2015/01/e_elsendo-el-la-13-01-2015/

Podkasto: Ludu en nova fenestro | Elŝutu

La antaŭmikrofona gasto de la 404-a E-elsendo el Varsovio estas Pascal Dubourg Glatigny, kun kiu ni interparolas pri lia prelego dum la lasta ARKONES. Ĝi estis dediĉita al francaj koncentrejoj lige kun la aperinta en 2014 libro, kiu enhavas ankaŭ E-veftojn pro ĝia heroo, kiu estas Jaume Grau Casas. Komence ni referencas al polaj amaskomunikiloj rilate la lastajn eventojn en Francio. Krome ĉe www.pola-retradio.org aŭdiĝas informo pri komenciĝonta akadamia kunlaboro inter la pola kaj ĉeĥa altlernejoj pri studoj dediĉitaj al germanologio kaj la Centra Eŭropo. La temo de la scienca bulteno koncernas la kreiĝantan brumapon de Baltiko. La informo pri la altlerneja kunlaboro, scienca temo kaj la interparolo kun nia antaŭmikrofona gasto aŭdiĝas ankaŭ eksterelsende en unuopaj rubrikoj de nia paĝo. La tekstoj estas paralele legeblaj kaj aŭskulteblaj.

--------------------------------------------------------------------------------

Franciskanoj el Krakovo plu­konstruas bibliotekon
[2015-01-16]
https://pola-retradio.org/2015/01/franciskanoj-el-krakovo-plukonstruas-bibliotekon/

Franciskanoj en Krakovo – la iama ĉefurbo de Pollando – plukonstruas kaj renovigas sian bibliotekon kaj  troviĝantajn en ĝi libro­kolektojn. Ili estis tie kolektataj ekde la komenco, tio estas  ekde 1237. Multaj el la valoraj manuskriptoj kaj malnovpresaĵoj forbrulis en incendio, kiu plagis Krakovon en 1850. La kolekto havanta nun 100 mil librojn kaj periodaĵojn ĉefe kun la filozofia-teologia temaro ne estas disponig­ebla al ĉiuj. Eblas utiligi ĝin por ekzemple scienc­esploraj celoj akirante aldone specialan permeson de la monakoj. La libro­kolekton utiligas ankaŭ studentoj de la Supera Sacerdotiga Seminiario funkcianta ĉe la klostro. Post unu kaj duona jaroj – kiam finiĝos renovigo de la bibliotekaj ejoj kaj laboroj pri nova kvarteaĝa alo de la klostro tio ŝanĝiĝos.  Ekzistas plano disponigi al ĉiuj legantoj librojn,  kiuj ĝis nun troviĝis en la fermita parto de la klostro. Tio okazos dank’ al la bitigo de la kolektoj kaj bitiga sistemo de ilia katalogado kaj disponigado.

En tiu periodo finiĝos laboroj pri libro­konservado, kiu ĉirkaŭprenas 6 mil librojn, kiuj neniam estis disponig­itaj al la legantoj. Sed jam nun sur la interreta paĝo de la biblioteko eblas rigardi du unikajn franciskanajn kolektojn. Temas pri Gradualo el 1499 kaj Antifonaro el 1743.

La Gradualon aŭtoras franciskano Fran­ci­scus de Bru­gis, kiu estis ankaŭ muzik­teoriulo. Temas pri inkunablo presita en Venecio en 1499. Ĝi enhavas i.a. kantojn pri sanktuloj, kantojn favore al la mortintoj kaj kantojn pri la Dipatrino. Sur ĝia leda kovrilo troviĝas plant­ornamaĵoj.

Antifonaro estas rezulto de la liturgia reformo de franciskanoj el 1743. Ĝi estis komponita de franciskano An­to­nio Az­zo­gu­idi el Italio kaj enhavas liturgiajn fragmentojn de la meso pri franciskanaj sankuloj kaj ankaŭ rubrikon pri la maniero ilin kanti. La ledan kovrilon ornamas kupraj elementoj kun rozeto en la centro de la kovrilo. La libron fermas ornama buko.

La renovigon de la libroj kunfinancas la pola kultur­ministerio, la renovigon de la biblioteko kovras la krakova provinco de franciskanoj.

El la elsendo 16.01.2015. Legas Tomek

--------------------------------------------------------------------------------

E_elsendo el la 16.01.2015
[2015-01-16]
https://pola-retradio.org/2015/01/e_elsendo-el-la-16-01-2015/

Podkasto: Ludu en nova fenestro | Elŝutu

La Cisterciana Abatejo en Lubiąż (la sudokcidenta Pollando) estas laŭvica vizitinda loko, kun kiu konatiĝi viziti felietone ni invitas en la 405-a E-elsendo el Varsovio ĉe la adreso www.pola-retradio.org. Pliaj informoj pri la loko estas konsulteblaj ĉe: http://www.fundacjalubiaz.org.pl/galeriaa/ . En la kulturkroniko ni informas pri daŭranta renovigado de franciskana biblioteko en Krakovo kaj pri muzeo kreiĝinta en la postindustria loko en Tarnów. Nia E-movada informo memorigas pri la proksimiĝanta limdato anonci kontribuojn por la nunjara eldono de IKU kadre de la jubilea UK en Lillo. Fine de la elsendo aŭdiĝas leterkesta forumo. La kulturkronikaj informoj kaj la la felietono estas paralele legeblaj kaj aŭskulteblaj en la rubrikoj Novaĵoj kaj Felietonoj.

--------------------------------------------------------------------------------

Vizitinda Pollando: La Cisterciana Abatejo en Lubiąż
[2015-01-16]
https://pola-retradio.org/2015/01/vizitinda-pollando-la-cisterciana-abatejo-en-lubiaz/

La cist­ercianan abatejon en Lubiąż [lubjonĵ] en la sudokcidenta Pollando ni menciis antaŭnelonge, kiel unu el la objektoj troviĝanaj sur la plej nova listo de la t.n. 7 novaj mirlokoj de Pollando. Hodiaŭ ni proponas konatiĝi iom pli proksime kun ĉi tiu plej granda cisterciana abatejo en la mondo, kiu kiel la religia objekto lokiĝas en Eŭropo tuj post la palaca-klostra komplekso Eskurial en Hispanio.

La klostran komplekson konsistigas: Baziliko de la Ĉielpreno de la Plej Sankta Maria Virgulino el la 14-a jarcento, konstruig­ita super la restaĵoj de la romanika preĝejo kun sama nomo el la 12-a jarcento; klostro, la abata palaco el la 17/18-a jarcentoj, helpa preĝejo de sankta Jakobo kaj mastrumaj konstruaĵoj. Notindas, ke en la kripto super la gotika baziliko troviĝas tomboj de 6 Piast-dinastiaj regantoj el la periodo de la 13-a ĝis la 15-a jarcentoj. Troviĝas tie ankaŭ mumioj de la cist­ercianaj abatoj kaj monakoj; en bona stato konserviĝis nur 98.

Origine kreiĝis tie la benedektiktana klostro kaj ĝuste bend­ediktanoj  konstruis la preĝejon de sankta Jakobo. Post kiam ili  forlasis la lokon la unuan fojon en Silezio aperis ĉi tie cist­ercianoj, kiujn venigis princo Bolesław Wysoki [bolesŭav visoki], Boleslao la Alta. En la daŭro de la jarcentoj klostro plu­konstruiĝis. En la mezepoko ĝi rolis kiel grava kultur­centro. Kreiĝis tie multaj signifaj 12-jarcentaj verkoj, kiel Kroniko de la Polaj Princoj, La Jarlibroj de Lubiąż aŭ Katalogo de la Vroclavaj Episkopoj.

Komence de la 15-a jarcento dum militoj de religi­reformemuloj de Jan Hus la klostro kaj la preĝejoj estis bruligitaj. Fine de la sama jarcento pro konflikto inter polaj kaj germanaj monakoj ili ĉiuj estis forigitaj kaj la klostraj konstruaĵoj transiris en la laikajn manojn. Sed jam 6 jarojn poste monakoj revenis renovigante ĝisfunde la klostron kaj fortikig­ante la klostran komplekson. Sed laŭvicaj batoj venis relative rapide dum la Reformacio, sekve dum la 30-jara milito, kiam oni forrabis bibliotekon kaj arkivaĵojn. La militfino kaj reformo de abato Arnold Freiberg inaŭguris en 1649 grandan renovigadon en la baroka stilo, al kio grave konstribuis la avana barokstila pentristo de la regiono Michał Willmann. La sekvaj kvar abatoj gvidis laborojn ĉefe pri reprezentaj konstruaĵoj. La plej grava estis konstruita en la periodo 1681-1699 monumenteca abata palaco enhavanta pli ol 300 salonojn riĉe ekipitajn. Ne multe malpli grava estis la barokstila rearanĝo de la preĝejo de la Ĉielpreno de la Plej Sankta Maria Virgulino. Prave do la abatejo ĝuis la epiteton “perlo de la silezia baroko”, kaj tiel ankaŭ nun ĝi estis difinata post la restaŭraj laboroj en la lastaj jaro. Revenante al historio direndas, ke la apogea periodo de la klostro­brilo finiĝas en la 1-a duono de la 18-a jarcento, kiam ĉi tiujn terenojn konkeris prusoj. En 1810 prusa reĝo likvidis la cistercianan ordenon alporprigante ĝiajn posedaĵojn kaj riĉaĵojn. Tiam oni detruis multajn valoraĵojn, malaperis la biblioteko kaj en la klostro estis aranĝita hospitalo. Kiel oni supozas, dum la 2-a mondmilito en la klostraj keloj germanoj en­labrigante malliberigitojn funkciigis la produktadon de vic­elementoj por la raketoj V1 kaj V2. La  malliberigatajn sur la tereno de la klostro en la jaroj 1942-43 civitanojn de Luksemburgo omaĝas la dulingva tabulo. En 1945 la ruinigadon de la klostro fin­efektivigis rusoj. Serĉante trezorojn ili frakasis ĉerkojn de la Piast-dinstiaj regantoj. Malaperis kronoj, sceptroj kaj glavoj.   La troviĝantaj tie mumioj estis detruitaj kaj ĥaose disĵetitaj surplanke tiel,  ke el inter ili oni sukcesis identigi nur tiun de la pentrista majstro Willmann. Rusaj trupoj garnizonis en Lubiąż ĝis 1948, poste troviĝis tie psikiatria hospitalo por ruĝarmeanoj. Ekde 1950 en la klostraj ejoj estis staplataj libroj kaj muzeaj kolektoj.

Preskaŭ ekde jarcent­kvarono (1989) en Lubiąż daŭras  restaŭraj laboroj de la klostra komplekso, dank’ al la Fondaĵo Lubiąż kiu transprenis la tutan konstruaĵon. Ekde 1994 komenciĝis kompleksa renovigo de la abateja komplekso.  I.a. antaŭ 15 jaroj estis ŝanĝitaj tagmentoj super la tuta komplekso kaj ne temas pri bagatela afero, ĉar ilia surfaco egalas al du kaj duona hektaroj. Por aldone proksimigi la grandecon de la konstruaĵoj menciinda estas la alia fakto, nome la nombro de fenestroj, kiu egalas al 600. Dank’ al tiuj klopodoj kaj efika laboro de la speciala fondaĵo ekde 1996 estas vizitebla impona Princa Salono alta 13,4 metrojn kun la surfaco de pli ol 400 kvadrataj metroj. En la duetaĝa salonego troviĝas i.a. skulptaĵoj de Józef Magoldt, plafono kaj mur­pentraĵoj de Christian Bantum. Nun tiu ĉi salonego opiniata kiel la plej brila ekzemplo de la silezia baroko gastigas elektitajn koncertojn de la Internacia Festivalo Vratislavia Cantans. Sed krome okazas tie multaj aliaj kulturaj eventoj, historiaj spektakloj kaj grupaj vizitadoj de la tuta komplekso dum la tuta jaro. Ili okazas komece de ĉiu plena horo. Kadre de la vizitoj la gastoj rigardas la abatan manĝejon, la princan salonon, la preĝejon de la Plej Sankta Maria Virgulino kaj manĝejon monakan. Lubiąż do meritas viziton des pli, ke ĝi troviĝas nur 54 kilometrojn for de Vroclavo (http://www.fundacjalubiaz.org.pl/galeriaa/).

El la elsendo 16.01.2015. Legas Barbara

--------------------------------------------------------------------------------

Pollando sen GMO
[2015-01-20]
https://pola-retradio.org/2015/01/pollando-sen-gmo/

Pollando estas kaj daŭre intencas resti lando libera de Genetike Modifitaj Organismoj, informis polaj aŭtoritatoj rilatigante sin al la proklamitaj de la Eŭropa Parlamento reguloj facilig­antaj al la uniaj landoj enkonduki malpermeson  kultivi plantojn genetike modifitajn. Ili donas al la landaj aŭtoritatoj  pli grandan elastecon i.a. ebligante, ke jam en la daŭro de la t.n. aŭtoriga proceduro de koncerna GMO-specio sur la unia nivelo la koncerna lando povu elpaŝi por limigi la geografian kultivad­terenon, tiel ke ĝi ne ampleksu ĝian teritorion. Aliflanke ŝtatoj, en kiuj plantoj genetike manipulitaj estas kultivataj devos zorgi, ke GMO-specioj ne traiĝu sur la teritorion de najbaraj ŝtatoj kreante la tiel nomatajn bufro­sferojn. La leĝdona procezo sur la unia nivelo ankoraŭ ne finiĝis. Kiam tio okazos kaj la teksto de la direktivo estos publikitita, kio povas okazi ĝis la fino de la unua jarkvarono 2015, tiam eblos envivigi ĝin ankaŭ en Pollando.

Aktuale en la Eŭropa Unio estas allaseblaj nur tiuj GMO-kultivaĵoj, kiuj laŭ Eŭropa Oficejo por Nutraĵsekureco ne endanĝerigas homojn, bestojn kaj la medion. La uniaj landoj kvankam povas sur sia teritorio enkonduki periodajn limigojn aŭ malpermesojn, devas tion pravigi per argumentoj rilatantaj al la homa sano kaj mediokonsideroj.

El la elsendo 20.01.2015. Legas Milada

--------------------------------------------------------------------------------

Boato kun hibrida motoro
[2015-01-20]
https://pola-retradio.org/2015/01/boato-kun-hibrida-motoro/

La Mara Akademio en Szczecin (la nordokcidenta Pollando) kune kun turka ŝipfarejo konstruos boaton, kiu utiligos la renovigeblajn energifontojn disponante pri la sunenergia-venta-elektra motoro. La lanĉo kaj la unua ralio de la marunuo okazos sur la Marmora Maro en 2016. La konsorcio de la Mara Akademio, la Varsovia Politekniko kaj Au­to­comp Ma­na­ge­ment ricevis unu milionon da eŭroj por kromfinanci la realigon de la projekto. La boato ekzempligos la evoludirekton de hibridaj motoroj kaj jakto­trunkoj en la plej proksimaj dudek jaroj. Dek kelk metrojn longa jakto por ĉ. 6-persona anaro estos konstruita el modernaj kompozitaj materialoj. La projekto kreiĝas kadre de la pro­gra­mu Era Net Trans­port,  kadre de kiu funkcias internacia konsorcio konsistanta el centroj financantaj scienc­esplorojn rilate transporton, kiel ministerioj, registaraj agentejoj kaj esplor­centroj. Inter 24 subjektoj el 18 landoj Pollandon reprezentas Nacia Centro por Esploroj kaj Evoluo.

El la elsendo 20.01.2015. Legas Maciek

--------------------------------------------------------------------------------

Interparolo kun Babak Soroush el Irano
[2015-01-20]
https://pola-retradio.org/2015/01/interparolo-kun-babak-soroush-el-irano/

Kun Babak Soroush el Irano ni interparolas pri lia partopreno en la Interlingvistikaj Studoj ĉe la poznana Universitato de Adam Mickiewicz, liaj planoj studi en Pollando kaj prilabori novan instrumedon de Pollando, kiu ebligus la tujan alproprigon de la parola lingvouzo. El la elsendo 20.01.2015 .

--------------------------------------------------------------------------------

E_elsendo el la 20.01.2015
[2015-01-20]
https://pola-retradio.org/2015/01/e_elsendo-el-la-20-01-2015/

Podkasto: Ludu en nova fenestro | Elŝutu

La antaŭmikrofona gasto en la 406-a E-elsendo el Varsovio estas Babak Soroush el Irano, unu el la novaj studentoj de la Interlingistikaj Studoj en Poznano. Krome ĉe la adreso www.pola-retradio.org aŭdiĝas la 17-a fragmento de la romano “Quo Vadis” de Henryk Sienkiewicz en la E-traduko de Lidia Zamenhof. En la komenca informa parto ni superrigardas mallonge la lastajn eventojn en Pollando: vintrajn feriojn de lernantoj, finalon de la kantkonkurso pri la plej bona plenumo de la kristnaskaj kantoj, eksterlande – la semajnfinajn protestreagojn kontraŭ la francaj mokdesegnaĵoj pri Mahometo. Krome ni informas pri kreiĝanta en Pollando boato kun hibrida motoro, kaj pri tio, ke Pollando volas resti lando sen GMO. Nia sciencbultena temo traktas pri formikoj, el kiuj unu dekono havas komunajn radikojn. Muzike akompanas nin mallonge Anna Osmakowicz. Fragmente aŭdiĝas “Nova Jaro”, kanto de Martin kaj La Talpoj el ilia lasta KD eldonita de Vinilkosmo “Superbazaro”. Du novaĵoj, scienca temo kaj interparolo aŭdiĝas ankaŭ eksterelsende en unuopaj rubrikoj de nia paĝo. La tekstoj estas paralele legeblaj kaj aŭskulteblaj.

--------------------------------------------------------------------------------

Unu dekono de ĉiuj formikoj formas unu familion
[2015-01-20]
https://pola-retradio.org/2015/01/unu-dekono-de-ciuj-formikoj-formas-unu-familion/

Unu dekono de ĉiuj formikoj formas unu familion. Kiel informis sciencistoj en “Royal Society B: Biological Sciences” ĉiujn reprezentas la genron Pheidole. Ankoraŭ anaŭnelonge sciencistoj ne antaŭvidis, ke povis evolui tiom multaj  specioj de Pheidole, kiuj ekregi teron kun tiom malsamaj ekosistemoj,  kiel dezertoj kaj pluvarbaroj. Pli da informoj venis dank’ al Evan Economo, profesoro de Okinawa Institute of Science and Technology (OIST) kaj liaj kunlaborantoj el Universitato de Michigan. Ili komparis la genomojn de 300 specioj de Pheidole el la tuta mondo kaj skizis „genealogian” arbon, kiu bildigas kiam kaj kie ĉiu el ĝiaj specioj aperis sur la tero. Analizante publikaĵojn kaj datumbazojn, serĉante en muzeoj de la naturhistorio en la tuta mondo ili kolektis donitaĵojn pri la aperado de ĉiuj 1200 specioj de Pheidole en la tuta mondo. Evidentiĝis ĉeokaze, ke la Pheidole evoluis du fojojn. La unuan fojon por  konkeri ambaŭ Amerikojn, la alian fojon ekregante Afrikon, Eŭroazion kaj Aŭstralion. Tiu evoluo okazis sendepende pere de individua formiko traiĝinte el la tiel nomata Nova al la Malnova Mondo. La aperado de Pheidole dependas de la klimato, ili estas pli multnombraj en la regionoj varmaj kaj humidaj. Nun Economo volas ekzameni kiel eblas, ke multaj specioj de Pheidole kapablas kunekzisti kaj ankaŭ tion, kiel ili serĉas nutraĵojn, lokojn por nestoj k.s. Formikoj multas en plimulto de la ekosistemoj, kie ili plenumas diverajn gravajn rolojn. Sciencistoj interesiĝas ne sole pri tiu roloj, sed ankaŭ pri ilia socia konduto.

El la elsendo 20.01.2015. Legas Tomek

--------------------------------------------------------------------------------

E_elsendo el la 23.01.2015
[2015-01-23]
https://pola-retradio.org/2015/01/e_elsendo-el-la-23-01-2015/

Podkasto: Ludu en nova fenestro | Elŝutu

Ĉi-vendrede en la 407-a E-elsendo ĉe www.pola-retradio.org Jorma Ahomäki el Finnlando prezentas recenzon pri la aperinta en 2014 libro “Esploro kaj Dokumentado” de Ivo Lapenna, aperinta lige kun la 60-jariĝo de la unua Unesko-rezolucio pri Esperanto. Ni notas ankaŭ kun profunda bedaŭro la forpason de la elstara figuro de la nederlanda kaj universala E-movado kaj komunumo, Hans Bakker. En la komenca kulturkroniko ni referencas al la 70-jariĝo de la unua en la postmilita Pollando pupteatro kaj informas pri Vistulo. La plej granda pola rivero estos aŭtune la honora gasto de la Festivalo de Luaro en Francio. En la fino aŭdiĝas leterkesta programero. La kulturkronikaj informoj kaj recenzo estas paralele legeblaj kaj aŭskulteblaj en la rubrikoj Novaĵoj kaj Felietonoj. En la programo ni aŭdigas fragmente la muzikon el la KD-oj “Esperanto” kaj “Regestilo” de Jonny M.

--------------------------------------------------------------------------------

Pupekspozicio en la poznana Teatro de Animado
[2015-01-23]
https://pola-retradio.org/2015/01/pupekspozicio-en-la-poznana-teatro-de-animado/

Kelkcent pupoj el la teatraj spektakloj eblas rigardi en la poznana Teatro de Animado. Okaze de sia 70-jariĝo la teatro decidis prezenti parton de kolektoj el sia riĉa scenografia arkivejo.

Unu el la atrakciaĵoj estas scenografio el la unua enscenigo de la dramo de Stanisław Wyspiański „Nupto”, en kiu rolis pupoj. Ili estas faritaj el pajlo, delikata kolora papero, lignostangetoj, tre malgrandaj elementoj. Ili aspektas tre moderne kaj forte impresas la vizitantojn. Kadre de la ekspozicio en du salonoj de la Artgalerio de la teatro de Animado troviĝas kelkcent pupoj, kaj temas sole pri­ malgranda fragmento de la tuta kolekto. La teatro neniam forigadis siajn pupajn rolantojn.

La plej malvaj pupoj devenas el la 50-aj jaroj de la 20-a jarcento. Parton de la eksponaĵoj konsistigas marionetoj. Parto pro sia delikateco kaj facila detruebleco neniam povos estis publike prezentataj. La ekspozico daŭros ĝis la jarfino. La historio de la poznana pupteatro radikas en la 1945. Tiam oni establis tie la unuan pupteatron en la postmilita Pollando. Inter ĝiaj spektantoj dominas infanoj kaj gejunuloj.

El la elsendo 23.01.2015. Legas Maciek

--------------------------------------------------------------------------------

Vistulo la honora gasto dum la Festivalo de Luaro
[2015-01-23]
https://pola-retradio.org/2015/01/vistulo-la-honora-gasto-dum-la-festivalo-de-luaro/

Pollando,  la rivero Vistulo kaj amantoj de la tradiciaj vistulaj boatoj kaj ŝipetoj estos la honoraj gastoj de la Festivalo de Luaro en la franca Orleano. Ĝi okazas ĉiun duan jaron kaj estas la plej bone konata en Eŭropo evento, prezentanta la riĉecon de la eŭropaj apudriveraj kulturoj. En la antaŭaj jaroj la apartaj gastoj de la festivalo estis italoj el la Venecia Laguno kaj nederlandanoj fierantaj pri pluraj kanaloj. En 2015 la pola stando troviĝos en la honora loko kaj poloj havos la eblon vaste konigi sian kulturon (polajn dancojn, arton kaj kuriarton) kaj Jaron de Vistulo, kiu estas planita por 2017.  Aparte oni deziras prezenti la polajn flosistajn tradiciojn. Apud muziko de Chopin eblos do konatiĝi kun tradiciaj flosistaj kantoj en la nova aranĝo.  Poloj prezentos krome kadre de la festivalo siajn tradiciajn lignajn boatojn kaj ŝipetojn. Aparta atrakciaĵo estos flosanta akvomuelejo kaj forĝejo.

La festivalo en Orelano okazos ekde la 23-a ĝis la 27-a de septembro. Jam somere el Krakovo elnavigos du rekonstruitaj platfundaj ŝipoj servantaj por la kontinenta var­transportado. Ilia itinero laŭ la eŭropaj riveroj longos 2700 kilometrojn kaj daŭros du monatojn. La ceteraj boatoj kaj ŝipetoj estos venigitaj al Francio per voja transporto.

El la elsendo 23.01.2015. Legas Gabi

--------------------------------------------------------------------------------

Esploro kaj Dokumentado de Ivo Lapenna. Postmorte eldonita en Zagreb 2014
[2015-01-23]
https://pola-retradio.org/2015/01/esploro-kaj-dokumentado-de-ivo-lapenna-postmorte-eldonita-en-zagreb-2014/

Tute freŝa estas en miaj manoj la verko Esploro kaj Dokumentado de Ivo Lapenna. La libro estas eldonita okaze de la 60-jara datreveno de la Rezolucio favore al Esperanto akceptita en la Ĝenerala Konferenco de Unesko en Montevideo 1954. Redaktis ĝin Birthe Lapenna en Danlando. Grafike kaj teknike aranĝis la enhavon Josip Pleadin en Kroatio. La okazintaĵoj en la Esperanto-movado 1976-1987 formas la kvintesencon de la nova eldonaĵo.

Dum la legado miaj pensoj flugis en la pasintecon. La unuan fojon mi sekvis la festparoladon de Ivo Lapenna en Bruselo 1960. Ĝia ĉeftemo estis internacia humanismo. Poste mi povis plurfoje ripete tralegi ĝin en la verko Elektitaj Paroladoj kaj Prelegoj (1966). Tre grava fonto por mi estas krome Memorlibro pri la Zamenhof-jaro (1960), kiun redaktis prof. d-ro Ivo Lapenna.

Unika kaj neforgesebla estis la prelegvojaĝo de Ivo Lapenna printempe 1971 en finnaj universitatoj. Kiel liaj interpretisto kaj sekretario mi tre proksime povis sekvi tre fekundan kaj sukcesan agadon de nia ŝatata kaj prestiĝa gasto. Liaj ĉarmaj bonhumoro kaj afableco konkere venkis kaj kaptis ĉiujn partoprenantojn de la aranĝoj. Tre tikla tiutempe estis la prelego pri Internacijuraj problemoj de spacveturado. Ĵurnalistoj ne emis ĉesi siajn demandojn pri la temo en la gazetaraj konferencoj.

Tiuj agrablaj spertoj instigis min esplorfosi en la giganta verko Esperanto en Perspektivo (1974) kun 844 paĝoj. Sekvis Eseoj memore al Ivo Lapenna redaktita de Carlo Minnaja. Ni konas la meritojn de nia klarvida kaj vojmontra spirita gigantulo kaj kreinto de moderna UEA. Nun ni havas la dokumenton ED je nia dispono. Indas detale trastudi la enhavon. Konata eldiro substrekas la fakton Audiatur et altera pars. Multajn okazintaĵojn oni puŝis en ombron. Tial ni devas esti kontentaj, ke Birthe Lapenna kribris en la tagan lumon multajn al granda publiko nekonatajn aferojn. La stilo kaj voĉo de nia longtempa movada ĉefo estas kvazaŭ palpeble kapteblaj sur la paĝoj de la postmorte eldonita grava 221-paĝa dokumento.

Indas mencii, ke la arkivo de prof. d-ro Ivo Lapenna estas nun deponita en la Dana Ŝtata Arkivo en la koro de Kopenhago. Oni povas konstati, ke la verko de Ivo Lapenna parolas per si mem kaj estas avide studata ne nur nun sed ankaŭ – kaj tutcerte en la estonteco.

Kiam mi gratulas al Birthe Lapenna kaj Josip Pleadin pro iliaj bone plenumita valora laboro, estas necese substreki, ke legontoj de Esploro kaj Dokumentado trovos surprizajn aferojn, por multaj nekonatajn. Legado similas vojaĝon de esploraj veturistoj. Plej plaĉa maniero estas mem trankvile digesti la enhavon. Sincera voko venas jen: ek en la aventuron!

Jorma Ahomäki decembre 2014

El la elsendo 23.01.2015. Legas Jorma

--------------------------------------------------------------------------------

La 70-a datreveno de la liberigo de Auschwitz
[2015-01-27]
https://pola-retradio.org/2015/01/la-70-a-datreveno-de-la-liberigo-de-auschwitz/

Eksaj malliberigitoj kaj saviĝintoj el Holokaŭsto estis la plej gravaj gastoj dum la solenaĵoj ligitaj kun la 70-a datreveno de la liberigo de la germana koncentrejo Auschwitz-Birkenau. Unue eksaj malliberigitoj metis florkronojn kaj bruligis torĉojn ĉe la Mortomuro sur la korto de la bloko 11  de la eksa koncentrejo en Auschwitz. Sekve en la Centro de Dialogo kaj Preĝo estis celebrita la sankta meso kun ilia partopreno. La kuliminaj solenaĵoj komenciĝis posttagmeze en tendo ĉe la ĉefpordo de la eksa koncentrejo Birkenau, nun Auschwitz II-Birkenau. Laŭvice la delegacioj bruligis torĉojn antaŭ la monumento de la viktimoj de la koncentrejo, kiu staras inter ruinoj de du plej grandaj gaskameroj de Birkenau. Antaŭtage de la solenaĵoj en la Librogalerio en Oświęcim kun la eksaj malliberigitoj de la koncentrejoj – inter kiuj plejmultis poloj – renkontiĝis ĵurnalistoj.

Germanoj establis la koncentrejon Auschwitz por poloj en 1940. Auschwitz II-Birkenau kreiĝinta du jarojn poste fariĝis ekstermoloko de judoj. En la koncentreja komplekso funkciis koncentrejaj subfakoj. Germanoj ekstermis almenaŭ unu milionon 100 mil personojn: judojn, polojn, romaojn, sovetuniajn ostaĝojn, alinaciaj malliberigitoj. La 27-an de januaro 1945 la koncentrejon liberigis soldatoj de la Ruĝa Armeo. Sur ĝia tereno en 1947 kreiĝis muzeo.

El la elsendo 27.01.2015. Legas Tomek

--------------------------------------------------------------------------------

Tribunalo malfondis Societon de Silezia Nacio
[2015-01-27]
https://pola-retradio.org/2015/01/tribunalo-malfondis-societon-de-silezia-nacio/

La tribunalo en Opole (la sudokcidenta Pollando) malfondis la Societon de Silzia Nacio kaj verdiktis ĝian likvidon. Ĝi agnoskis valida la starpunkton de la Plej Supera Tribunalo, laŭ kiu ĝia nomo kaj la celo erarigas rilate juran apartigon de la silezia nacia malplimulto. La prezidanto de la Societo de Personoj de Silezia Nacieco anoncis apelacion kaj aldone direkton de la afero al kompetentaj organoj sur la eŭropa nivelo. Juristino Irena Majcher prezentante motivojn de la decido memorigis, ke laŭ la Plej Supera Tribunalo la nomo kaj celo de la societo povas implici eraran aserton pri ekzisto de la silezia nacio. La agado de la societo kun tiu nomo kaj kelkaj ĝiaj statut­paragrafoj lezas polan leĝaron, aparte leĝon pri naciaj kaj etnaj malplimultoj kaj balotkodon.

El la elsendo 27.01.2015. Legas Milada

--------------------------------------------------------------------------------

Caritas Polska solenas la 25-jariĝon
[2015-01-27]
https://pola-retradio.org/2015/01/caritas-polska-solenas-la-25-jarigon/

Caritas Polska solenas en 2015 la 25-jariĝon. Ĝi estas la plej bone konata en Pollando karitata organizo. Caritas funkcias sur la tereno de la tuta lando gvidante tranoktejojn, nutrejojn, domojn de soleca patrino, fenestrojn de la vivo, soci­terapeŭtajn kleriĝejojn, protekto­lokojn por malsanuloj en la fina vivstadio, distribu­ejojn de vestaĵoj, dis­tribejojn de nutraĵoj, labor­renkontojn de okupa terapio, centrojn de kriza interveno. Caritas krome engaĝiĝas eksterlande organizante helpon por Ukrainio, Irako, Sirio, Libano, Jordanio kaj Balkanio. Kadre de la jubilea jaro pasanta sub la devizo „Caritas por la familio”  inter multaj iniciatoj ĉiu monato estos dediĉita al malsama agadsfero de Caritas – ekzemple al helpo por ne­plenlertuloj, por senhejmuloj, por senlaboruloj, al infanoj. La ĉefaj jubileaj solenaĵoj okazos aŭtune, kiam estas planita i.a. internacia konferenco „Familio en la zorgo de Caritas”. Lige kun la jubileo en la Interreto kreiĝas servilo pri socia subteno de la karitataj iniciatoj kaj servilo dediĉita al Caritas-volontuloj entute ĉirkaŭ 100 mil personoj.

El la elsendo 27.01.2015. Legas Milada

--------------------------------------------------------------------------------

E_elsendo el la 27.01.2015
[2015-01-27]
https://pola-retradio.org/2015/01/e_elsendo-el-la-27-01-2015/

Podkasto: Ludu en nova fenestro | Elŝutu

Joel Ericson el Svedio – juna sveda esperantisto, la unuafoja partoprenanto en la pola E-aranĝo – estas la antaŭmikrofona gasto de la 408-a E-elsendo ĉe www.pola-retradio.org. Niaj hodiaŭaj aktualaĵoj estas dupartaj. Komence aŭdiĝas mallongaj informoj pri la plej aktualaj eventoj, inter kiuj la datreveno de la liberigo de la germanaj koncentrejoj Auschwitz kaj Auschwitz-Birkenau okupas la ĉefan lokon. Sekve ni informas pri malfondo de la Silezia Societo kaj pri la plej granda pola karitata organizo Caritas Polska, kiu nunjare festas jubileon. Sciencbultena temo estas dediĉita al hormone aktivaj substancoj aldonataj al kosmetikaĵoj, medikamentoj, purigaj substancoj kaj pakumoj. Sub la siglo EDC ili estas konataj kiel substancoj perturbantaj hormonprocezojn. Porokaze ni prezentas fragmente kanton “Auschwitz”, kiun kantas Emanuele Rovere, same fragmente ni aŭskultas muzikon el la KD “Karma” de Jim Petit kaj kompreneble muzikas por ni ankaŭ Joel Ericson. Novaĵoj, scienca temo kaj interparolo aŭdiĝas krome eksterelsende en unuopaj rubrikoj de nia paĝo. La tekstoj estas paralele legeblaj kaj aŭskulteblaj.

--------------------------------------------------------------------------------

Negativaj sekvoj de kemiaj substancoj en kosmetikaĵoj
[2015-01-27]
https://pola-retradio.org/2015/01/negativaj-sekvoj-de-kemiaj-substancoj-en-kosmetikajoj/

Laŭ la lastaj esploroj rezultas, ke hormone aktivaj substancoj aldonataj i.a. al kontraŭŝvitigaj kosmetikaĵoj,  medikamentoj, purigaj substancoj de la ĝenerala uzo, pakumoj povas kaŭzi perturbojn de koncentriĝo, malortiĝon de la memorkapablo, movperturbojn, aŭtismon kaj senfekundecon. Usona Epidemiologia Revuo publikigis informojn, ke EDC-substancoj, t.e. kemiaĵoj perturbantaj la hormonprocezojn,  troviĝantaj en senŝvitigaj kosmetikaĵoj malaltigas la viran fekundecon je 30 procentoj.  Laŭ la raporto de la Nordia Konsilio rezultas, ke la konsekvencoj de la malsalubra efikado de la aplikataj EDC-substancoj en la Eŭropa Unio ligiĝas  kun la kostoj egalaj al duona miliardo da eŭroj ĉiujare.

La perturbojn kaŭzas ĉefe hormone aktivaj substancoj, kiuj estas signitaj per la siglo EDC. Inter la plej popularaj troviĝas dioksinoj, pesticidoj, bifenoloj, kiel bisfenolo A.  Ili ĝuste kaŭzas misfunkciojn en la produktado kaj metabolo de naturaj hormonoj de la homa organismo. Ili povas influi ankaŭ ilian dislokon, kio grave damaĝas la funkciadon de organo kontrolata de koncerna hormono. Laŭvicaj ekzamenoj el la lastaj jaroj alportas informojn pri la ligo inter EDC-substancoj perturbantaj la hormonprocezojn kaj antaŭdata maturiĝo, pertuboj de koncentriĝo, malfortiĝo de memoro, movfunkciaj deficitoj, aŭtimo kaj senfekundeco. Ŝanĝoj rezultigitaj de kemiaĵoj povas ne tuj aperi, sed  nur en laŭvicaj generacioj. Reprezentantoj de la Nordia Konsilio alvokis la Eŭropan Union enkonduki normojn malpermestantajn la uzon de tiuj substancoj por la produktado de kosmetikaĵoj, medikamentoj kaj purigaj substancoj.

Profesoro Andreas Kortenkamp, toksikologo el la londona Brunel-universitato atentigas, ke estas tre malfacile unusignife pruvi la ligojn inter la aplikataj konsmetikaĵoj enhavantaj  tiujn ĉi substancojn kaj malsaniĝado, ĉar pro evidentaj kialoj oni ne faras tiajn eksperimentojn ĉe homoj. Alilflanke ekzistas tre konvinkaj pruvoj pri negativa influo de kemiaj substancoj je animalaj ĉeloj. Liaopinie la raporto de la Nordia Konsilio devus esti konsiderita por reguligi normojn ligitajn kun la aplikado de substancoj perturbantaj la hormonprocezojn.

El la elsendo 27.01.2015. Legas Barbara

--------------------------------------------------------------------------------

Interparolo kun Joel Ericson pri lia partopreno en Arkones kaj aliaj temoj
[2015-01-27]
https://pola-retradio.org/2015/01/interparolo-kun-joel-ericson-pri-lia-partopreno-en-arkones-kaj-aliaj-temoj/

Dum la antaŭmikrofona renkontiĝo  kun Joel Ericson el Svedio ni interparolas pri lia unua partopreno en la pola E-aranĝo kiel ARKONES, pri lia vojo al la Esperanto kaj la E-komunumo kaj lia partopreno en E-aranĝoj kun sia violono kaj muzikado, kiu aŭdiĝas ankaŭ en nia interparolo. El la ensendo 27.01.2015.

--------------------------------------------------------------------------------

La 95-jariĝo de la Muzika Akademio en Poznano
[2015-01-30]
https://pola-retradio.org/2015/01/la-95-jarigo-de-la-muzika-akademio-en-poznano/

Pli ol 20 koncertojn planis la Muzika Akademio de Ignacy Jan Paderewski en Poznano okaze de sia 95-jariĝo. La jubilea jaro estos dediĉita al la memoro de la muzikistoj ligitaj en ĉi tiu periodo kun la altlernejo. La solenadoj inaŭguritaj la 16-an de januaro finiĝos la 16-an de oktobro 2015 en la datreveno de ĝia kreiĝo. Kadre de la jubileo siajn apartajn koncertojn donos ĉiu el 5 fakultatoj de la altlernejo, estis planita komuna prezentiĝo de ĉiuj muzikistoj de la Akademio. Unu el la kuliminaj eventoj de la jaro estos la koncerto „Maria-vojo” la 1-an de aprilo, dum kiu estos prezentita Stabat Mater de Karol Szymanowski kaj Magnificat Re-maĵora BWV 243 de Johann Sebastian Bach.

Aktuale en la poznana Muzika Akademio lernas pli ol 740 studentoj, laboras ĉirkaŭ 240 akademiaj instruistoj, inkluzive de 50 kun la profesora titolo. La altlernejo ofertas studojn en kvin fakultatoj: pri komponado, direktado, muzika teorio kaj ritmiko; instrumenta; voĉista-aktora; pri korusa direktado, muzika edukado kaj religia muziko; pri arĉaj instrumentoj, harpo, gitaro kaj konstruado de arĉinstrumentoj.

El la elsendo 30.01.2015. Legas Tomek

--------------------------------------------------------------------------------

En Szczecin kreiĝas Galerio de la Eŭropa Arto
[2015-01-30]
https://pola-retradio.org/2015/01/en-szczecin-kreigas-galerio-de-la-europa-arto/

La 19-jarcentaj divers­skolaj verkoj kaj tiuj el la unua duono de la 20-a jarcentro troviĝos en la Galerio de la Eŭropa Arto kreiĝanta en Szczecin (la nordokcidenta Pollando)  baze de la provizoj de la loka Nacia Muzeo, novaj aĉetoj kaj deponoj i.a. de la kreanta propran kolekton Societo de Amikoj de la Ŝĉecina Nacia Muzeo. La societo, kiu fine de 2014 inaŭguris sian mecenatan mision transprenis patronecon super parto de la muzea spaco.   Ĝi en sia agado referencas al la komencoj de la Urba Muzeo en Szczecin de antaŭ 100 jaroj – kiam ĝiajn provizojn eniris elstaraj verkoj de eŭropaj artistoj dank’ al la kreiĝinta en 1911 Ŝĉecina Muzea Societo.

En la Nacia Muzeo de Szczecin daŭras nun la ekspozicio „Wojciech Gerson kaj lia skolo”, kiu estas la unua labora prezento de la muzeaj provizoj fariĝonte bazo por estonta konstanta ekspozicio. Aktuale la muzeo disponas pri kvar liaj tolaĵoj. La 19-jarcentaj pentraĵoj estos konfrontitaj kun verkoj de studentoj de la loka Belarta Akademio. Junaj artistoj inspiritaj per la pentraĵo de Gerson „Sen la tero. Pomerianoj forpuŝitaj de germanoj sur la insultojn de Baltiko” proponis kritikan re­interpreton de la pentraĵo. Tiun ĉi pentraĵon trovigantan aktuale en la privata kolekto klopodas akiri la Societo de Amikoj de la Nacia Muzeo en Szczecin.

El la elsendo 30.01.2015. Legas Milada

--------------------------------------------------------------------------------

E_elsendo el la 30.01.2015
[2015-01-30]
https://pola-retradio.org/2015/01/e_elsendo-el-la-30-01-2015/

Podkasto: Ludu en nova fenestro | Elŝutu

La heroo de la nunsemajna felietono pri koninda polo estas Witold Pilecki, libervola malliberigito kaj organizanto de la rezistmovado en la germana koncentrejo Auschwitz dum la 2-a mondmilito (i.a. http://www.pilecki.ipn.gov.pl /). Komence de la 409-a E-elsendo ĉe www.pola-retradio.org aŭdiĝas kulturkroniko kun informoj pri la jubileo de la Muzika Akademio en Poznano kaj pri la kreiĝanta en Szczecin artgalerio de la eŭropa arto. Nia E-movada informo rilatas al la okazonta kadre de la UK en Lillo Esperantologia Konferenco, kiun organizas Orlando Raola. Fine ni proponas renkontiĝon en la leterkesta programero. La kulturkronikaj informoj kaj la felietono estas samtempe legeblaj kaj aŭskulteblaj en la rubrikoj Novaĵoj kaj Felietonoj. Uzu kaj diskonigu ĉi tiun servon unuavice inter viaj lingvolernantoj, krome ankaŭ inter viaj klubaj aŭ grupaj konatoj, kiuj ne havas ankoraŭ kuraĝon paroli Esperanton.

--------------------------------------------------------------------------------

Koninda polo: Witold Pilecki
[2015-01-30]
https://pola-retradio.org/2015/01/koninda-polo-witold-pilecki/

Kiel la heroon de nia hodiaŭa felietono ni elektis la kapitanon de la kavalerio de la Polaj Armeaj Fortoj, kun­organizinton de la Konsipra Pola Armeo, soldaton de la Landa Armeo, malliberigiton kaj kunorganizinton de la rezista movado en la germana koncentrejo Auschwitz dum la 2-a mondmilito, aŭtoron de la raportoj pri holokaŭsto.. Ne povas mirigi tiu elekto, se nur antaŭ kelkaj tagoj ni solenis la 70-jariĝon de la liberigo de la koncentrejo.

Witold Pilecki naskiĝis en 1901 en la nobela familio kun patriotaj tradicioj. Lia avo 7 jarojn pasigis ekzilita al Siberio pro la partopreno en la januara insurekcio. Jam kiel 14-jarulo Witold apartenis al la malpermesita de la rusa aneksinto skolta movado. En 1918 inter multaj aliaj skoltoj ankaŭ Pilecki trapuŝigis sur la terenon de la renaskiĝanta Pollando.  En la jaroj 1918-21 li estis soldato de la Pola Armeaj Fortoj kaj partoprenis la Varsovian Batalon de 1920. Du fojojn li estis distingita per Kruco de Bravbatalantoj.  En la 20-aj jaroj de la 20-a jarcento la familio reakiris la bienon Sukurcze apud Lida. Tie lia najbaro estis marŝalo Edward Rydz-Śmigły laŭ kies iniciato Pilecki entreprenis kunlaboron kun la pola kontraŭinvigilservo. En aŭgusto 1939 Witold Pilecki estis mobilizita kaj batalis sekve kiel komandanto dum la septembra kontraŭ­germana kampanjo. Post ĝia finiĝo Pilecki transiris al la konspira agado. En Varsovio li fariĝis la kun­organizinto de la Konspiraj Polaj Armeaj Fortoj. Komence de 1940 Gestapo arestis kelkajn ĝiajn membrojn, kiuj post mallonga estado en fifama malliberejo Pawiak estis direktitaj al Auschwitz. Tiu ĉi koncentrejo kaj la aliaj establataj de germanoj en la okupaciata Pollando fariĝis objekto de aparta interesiĝo de la Konspiraj Polaj Armeaj Fortoj. Estis decidite, ke iu el la strikta komandantaro  de la organizo traiĝos en Auschwitz-koncentrejon por kontaktiĝi kun la malliberigitaj kolegoj, por kolekti informojn pri la funkciado de la koncentrejo, pri kio tiam ankoraŭ malmulto estis sciata. Witold Pilecki anoncis sin por ĉi tiu tasko kaj ricevis falsajn person­dokumentojn.

Li estis haltigita de germanoj en Varsovio dum la ŝtratĉasado de civitanoj la 19-an de septembro 1940 kaj jam nokte de la 20-a al la 21-a trafis al Auschwitz ricevinte la numeron 4859. En la koncentreja infero li travivis 947 tagojn komence kun la  invigila tasko poste kreinte konspiran Asocion de Militistaj Organizoj. Malliberigitoj, ĉefe eksaj soldatoj estis formataj en la tiel nomatajn  kviopojn. Ĉiu el ili plu­konstruis sian konspir­reton sciante nenion pri aliaj kvinopoj. La Asocio konforme al la plano de Pilecki estis preparanta insurekcion en Auschwitz.

Malgraŭ nehomaj vivkondiĉoj Pilecki kaj lia Asocio kolektadis kaj transdon­asis in­vigilinformojn al la eksera mondo. Li prilabris la unuajn raportojn pri la hombuĉado en Auschwitz, kiuj tra Varsovio kaj Svedio atingis Okcidenton. Pere de la Ĉefkomandanto en Londono raportoj kaj notoj pri la vera bildo de la ekstermejo, vivkondiĉoj de la malliberigitoj kaj krimoj de la koncentreja anaro atingis la registarojn de Usono kaj Britio. La mondo estis informita pri la krueleco de la germanaj koncentrejoj. Samtempe en sia ĉiutaga agado la Asocio klopodis helpi al la malliberigitoj transdaŭri la inferan periodon.

Nokte inter la 26-a kaj 27-a de marto 1943 Pilecki kune kun du aliaj malliberigitoj decidis kaj sukcese eskapis el Auschwitz. Helpe de Landa Armeo Pilecki atingis Varsovion. Tie li batalis en la Varsovia Insurekcio 1943-1944, post kio en la jaroj 1944-45 li estis germana malliberigito en oficir­kaptitejo en Murnau. Post ĝia liberigo kaj la militfino li aliĝis al la 2-a Pola Korpuso en Italio kaj laŭ la ordono de generalo Anders li revenis al Pollando por gvidi invigilan servojn kolektante informojn pri la situacio en Pollando, soldatoj de la Landa Armeo kaj la 2-a Korpuso malliberigitaj de NKWD kaj deportataj al Sovetunio. En 1945 Pilecki verkis 113-paĝan raporton pri Auschwitz.

En la 1947-a jaro li estis arestita de la komunistaj aŭtoritatoj, unu jaron poste kondamnita je la mortopuno, kiu estis efektivigita per la pafo kontraŭ la kranion.  Ĝis la 1989 ĉiaj informoj pri la faroj kaj sorto de Witold Pilecki estis cenzurataj. Postmorte li estis distigita i.a. per Komandora Kruco de la Ordeno de la renaskiĝo de Pollando kaj per Ordeno de la Blanka Aglo. En 2013 postmorte li estis avancita al la kolonela grado. La brita historiisto Michael Foot kalkulis Witoldon Pilecki al unu el la ses plej kuraĝaj homoj de la rezista movado dum la 2-a mondmilito.

El la elsendo 30.01.2015. Legas Barbara

--------------------------------------------------------------------------------

Ŝipo por Universitato en Gotenburgo
[2015-02-03]
https://pola-retradio.org/2015/02/sipo-por-universitato-en-gotenburgo/

En la ŝipfarejo Nauta en Gdansko (la norda Pollando) estis metita kilo de la moderna scienc­esplora ŝipo por la universitato en Gotenburgo, Svedio. Ĉiuj laboroj devintus finiĝi ĝis la fino de la jaro. La meto de la ĉefa konstru­elemento de la marunuo iam unusignife inaŭguris la konstru­procezon. Nun tio signifas mejloŝtonon en la konstru­procezo. La konstru­kontrakto por la ŝipo destinita al la sveda uni­versitato estis subskribita fine de 2013. Nauta venkis la rivaladon kun 14 eŭropaj ŝipfarejoj, i.a. kun la dana Damen kaj la finna STX. La konstruata en Gdansko ŝipo servos al la svedaj studentoj kaj sciencistoj por esplori globskalajn klimatajn ŝanĝojn en Skandinavio kaŭzitajn per la ŝanĝo de marfluoj kaj acideco de la mara akvo. Ĝi estos ekipita per modernaj laboratorioj kaj esplor­postenoj. La ŝipo pezante 800 tunojn estos longa 44,5 metrojn kaj vastos 11 metrojn. Sur ĝia ferdeko krom 5-membra personalo povos labori 20 studentoj kaj sciencistoj. Ĝi uzos je ĉirkaŭ 40 procentojn malpli da fuelo ol la nun laboranta por la universitato marunuo Skagerak.

El la elsendo 03.02.2015. Legas Tomek

--------------------------------------------------------------------------------

Kion emfazas niaj ŝatosignoj
[2015-02-03]
https://pola-retradio.org/2015/02/kion-emfazas-niaj-satosignoj/

Laŭ sciencistoj el Cambridge neniu konas nin tiom bone kiom niaj komputiloj, do certe ne la familianoj aŭ koramikoj. Niaj fejsbukprofilaj ŝatosignoj estas vera minejo de tiaj konoj. Eksperimentoj kun dekoj da miloj da internaŭtoroj konfirmis, ke komputilo pere de speciala programo efektive deĉifras perfekte niajn verajn ŝatojn kaj inklinojn. Esplorrezultoj pri tiu temo aperis en la periodaĵo PNAS. Jam pli fruaj esploroj de la universitato en Cambridge kaj en Stanford-Universitato elmontris, ke baze de la ŝatosignoj kun granda verŝajno eblas difini tiajn personajn trajtojn, kiel politikaj vidpunktoj aŭ seksan orientiĝon. En la menciita komence esploro oni volis ekzameni, ĉu maŝinoj aŭ homoj pli bone difinas trajtojn de nia personeco kaj karaktero.

Evidentiĝis, ke analizinte 10 ŝatojn komputilo pli bone analizis tiujn donitaĵojn ol laborkolegoj. Kiam estis analizitaj 70 ŝatoj – pli bonaj ol amikoj aŭ personoj kunloĝantaj kun ni – estis maŝinoj. Analizinte 150 ŝatojn komputilo sciis pli pri nia personeco ol la membroj de la plej proskima familio. Post la analizo de 300 ŝatosignoj komputilo sciis pri ni pli ol kungeedzo. Sciencistoj do avertas, ke aktuale komputiloj disponas pri multaj delikataj informoj pri ni mem kaj samtempe ilia memorkapacito estas grandega. Ne havante tamen homajn trajtojn ili povas subiĝi al ies komisio kaj fari tiujn analizojn sen nia scio. Jam nun multaj konzernoj kaj firmaoj utiligas la komputilajn analizojn por krei pli diafanan bildon pri tio, kiu kaj kio envere ni estas. Aldone, virtualaj labordonantoj laŭ ĉi tiu vidpunkto por rekoni laborkandidaton povas ekzameni kaj ekzamenas sociajn portalojn. Tiel do envere internaŭto havas malgrandan kontrolon pri tio, kiajn informojn pri li aŭ ŝi oni kolektas.

El la elsendo 03.02.2015. Legas Tomek

--------------------------------------------------------------------------------

E_elsendo el la 03.02.2015
[2015-02-03]
https://pola-retradio.org/2015/02/e_elsendo-el-la-03-02-2015/

Podkasto: Ludu en nova fenestro | Elŝutu

En Pollando daŭras studenta ekzamena sesio. Tiukuntekste ni interparolas kun d-ro Maciej Jaskot, kiu estas ne sole universitata lekcianto, sed ankaŭ studento pri la ukraina lingvo. Komence en la 410-a E-elsendo ĉe www.pola-retradio.org en informa parto ni parolas pri la klopodoj de la nova greka registaro persisti sur la vojo de reformoj kaj atendoj pri tio de germanaj politikistoj. Ni notas la forpason de germana prezidento tre meritiĝinta por la pola-germana dialogo kaj ankaŭ la enpostenigon de la nova itala prezidento. Ekonomia informo rilatas al konstruata en Pollando ŝipo por universitato en Gotenburgo. Temoj el la pola gazetaro koncernas kreskon de pola eksporto al Svedio kaj laboremon de poloj semajnfine. Kion eblas ekscii analizante niajn ŝatosignojn en Facebook-profilo tion klarigas la scienc-teknika temo. En la programo akompanas nin la kanto de Feri Floro “Galopante”. Ekonomia aktualaĵo, scienca temo kaj interparolo aŭdiĝas krome ekster­elsende en unuopaj rubrikoj de nia paĝo. La tekstoj estas paralele legeblaj kaj aŭskult­eblaj.

--------------------------------------------------------------------------------

Intervjuo kun d-ro Maciej Jaskot pri liaj novaj studoj pri la ukraina lingvo
[2015-02-03]
https://pola-retradio.org/2015/02/dintervjuo-kun-d-ro-maciej-jaskot-pri-liaj-novaj-studoj-pri-la-ukraina-lingvo/

Kun d-ro Maciej Jaskot ni interparolas – en la kunteksto de la daŭranta studenta sesio en Pollando –  pri liaj novaj studoj pri la ukraina lingvo, entreprenitaj lastaŭtune. El la elsendo 03.02.2015.

--------------------------------------------------------------------------------

Kolekto de la Vroclava Universitata Biblioteko bitigita kaj disponigita
[2015-02-06]
https://pola-retradio.org/2015/02/kolekto-de-la-vroclava-universitata-biblioteko-bitigita-kaj-disponigita/

Pli ol 400 dosierojn bildig­antajn 3 mil objektojn inkluzive de 1100 mezepokaj manuskriptoj disponigis en la reto la Universitata Biblioteko en Vroclavo. Tio okazis kadre de la programo „Heredaĵo de la regiono kaj Eŭropo”, kiu konsistis en bitigo de la plej valoraj kolekoj. Dank’ al tio eblis rete disponigi la plej valorajn manuskriptojn kaj malnov­presaĵojn, kiuj estas la plej atente gardataj pozicioj. Kvankam principe nedisponigeblaj nun ili estas detale rigardeblaj de ĉiuj.

Inter la plej valoraj troviĝas „Statuta synodalia episcoporum Wratislaviensium” eldonita en 1475 kun la plej malnovaj tekstoj presitaj en la pola lingvo aŭ „Legenda maior de beata Hedwigi” eldonita en 1504, verkoj de Luter, Cervantes kaj Ŝekspiro.   La Universitata Biblioteko en Vroclavo disponigas siajn provizojn pere de la Bita Biblioteko de la Universitato kaj per la portalo „La kultura heredaĵo en la esploroj de la Universitata Biblioteko. Speciala paĝo (www.dk.uni.wrocl.pl) disponigas ĉiujn materialojn bitigitajn kadre de diversaj projektoj.

La Universitata Biblioteko de Vroclavo enhavas ĉirkaŭ 30 procentojn de la konserviĝ­intaj sur la polaj teritorioj mezepokaj manuskriptoj. Ĝi disponas pri la plej granda kolekto de atlasoj el la 16-18-a jarcentoj kaj pri la plej granda en Pollando kolekto de malnov­presaĵoj eldonitaj ĝis 1800. Inter preskaŭ 317 mil malnov­presaĵoj 3200 estas inkunabloj eldonitaj ĝis 1500. Pli grandan kolekton posedas nur la Jagelona Biblioteko en Krakovo.

El la elsendo 06.02.2015. Legas Maciek

--------------------------------------------------------------------------------

Vizitinda Pollando: La orminejo „Aurelia”
[2015-02-06]
https://pola-retradio.org/2015/02/vizitinda-pollando-la-orminejo-aurelia/

La unua granda „orfebro” en la ĉirkaŭaĵoj de Złotoryja [zŭotoria], kies nomo indikas la orakiradon (or-fosa) okazis lime de la 11-a kaj 12-a jarcentoj. La tereno en la valo de la rivero Kaczawa [kaĉava] apartenis al la plej riĉaj en Eŭropo orportaj gruztavoloj. Jare oni akiradis tie ĝis 50 kilogramoj de la pura oro.  La urborajtojn al la setlejo en 1211 donis princo Henriko la 1-a Barbulo en la kastelo de la najbara Rokitnica kaj tiel Złotoryja estas la plej malnova pola urbo. La tiea orakirado finiĝis post la napoleonaj militoj. Pli postaj provoj reaktivigi la orakiradon evidentiĝis sensukcesaj pro la elĉerpiĝo de la orprovizoj. Tamen oni taksas, ke en la daŭro de la jarcentoj en la regiono de Złotoryja oni akiris entute ĉirkaŭ 5 tunojn da ora erco.

Nun la orminejo „Aurelia” estas atrakcia  loko por ĉiuj amantoj de subterejoj kaj minejaj ŝaktoj vizitantaj la sud-okcidentan Pollandon.  La ŝakto – kiu nun nomiĝas la orminejo „Aurelia” estis pioĉita ĉirkaŭ la 1660-a jaro en dura diabaza vulkan­devena roko sub la monto de Sankta Nikolao en la regiono de jarcentoj konata pro la orportaj tavoloj. Tiun nomon verdire oni donis al  ĝi nur en la 90-aj jaroj. Ĝi referencas al la latina „aurum”, kiu signifas oron kaj al unu el la unuaj 13-jarcentaj latinaj nomoj de la urbo: Mons Aurum.

La rivero Kaczawa fluanta tra montoj kaj altaĵoj ellavis oron el la rokoj kaj la erco sedimentiĝis sur orporta sablo.

Kun la minejo estas ligitaj kelkaj legendoj. Unu rakontas pri avida monako, prenanta de ministroj dekonaĵon por la ekleziaj bezonoj. En mallonga tempo li fariĝis ĉiam pli oravida kaj postulis ĉiam pli grandan dekonaĵon. Iun fojon indignitaj kaj koleregaj ministoj enkondukis lin en la minejan labirinton kaj mortigis. En morto­momento la monako malbenis ĉiujn orminejojn kaj lia malbeno kaŭzis, ke la tuta oro malaperis, kaj ĝia efikado ĉesos, kiam en la ruino de la kastelo en la loko Wilcza Góra [vilĉa gura), Lupa Monto oni trovos ortrezoron.  Dume ekde tiam la monako veante erarvagas tra la minejaj koridoroj. Laŭ alia rakonto iu bonŝanculo trovis tie veran orvejnon, sed li tute ne intencis dividi ĝin kun kamaradoj. Li decidis kaŝveni en la minejon kaj forporti oron por preparoj al la unua komunio de sia filino. Sed kiam kun poŝoj plenaj de oro li klopodis foriri li perdis la vojon kaj restis en la minejo por eterne. Lia filino dum la ceremonio ploregis senespere  pro la manko de la patro. Ekde tiam onidire en Złotoryja en la tago de la 1-a komunio el la minej­profundo aŭdiĝas ploroj de la perdiĝinta patro.

La preĝejo de sankta Nikolao troviĝanta ĉepinte de la samnoma altaĵo super la minejo estas ĉirkaŭita de tombejo, do rondiris la onidiro, ke en Złotoryja la mortintojn oni sepultas en oro. Laŭ aliaj onidiroj la minejo havis ligon kun la subterejoj de la preĝejo, sed neniam oni ĝin retrovis. Entute la minejon vualas la mistero. Ĝi ne troviĝas sur la malnovaj germanaj mapoj. Ne estas eksludite, ke en 1945 parton de koridoroj germanoj eksplodigis, kion pruvas elementoj de germanaj armiloj. En 1997 oni malkovris tie grandan 28 metran vertikalan ŝakton intence superŝutitan per rokoj, laŭ la nomo de la malkovrinto nun nomata la ŝakto de Karlo. Denove onidire ĝi estis utiligata de proksima fabriko, en kiu dum la 2-a mondmilito la firmao Opta produktis radiajn aranĝaĵojn i.a. por la germana aviado.

Krom la orminejo „Aurelia” disponigita al. turistoj en Złotoryja jam en la 1973-a jaro la alia vizitinda loko en la urbo ligita kun oro esta Muzeo de Oro. En la historia konstruaĵo el la mezo de la 17-a jarcento oni proksimigas la urbo­historion kaj ĝiajn ligojn kun la orakirado, la geologion de la regiono. Eblas rigardi tie ankaŭ diversajn formojn de la ora kaj orsimilaj mineraloj, instrumentojn de orserĉantoj kaj kolekton de mineraloj kaj rokoj de avanaj kolektantoj el la Malsupra Silezio.

En la blazono de Złotoryja troviĝas la figuroj de la geprinca paro Henriko la 1-a Barbulo kaj lia edzino sankta Jadwiga, kiuj havis sian kastelon en la menciita komence Rokitinica kaj tie Złotoryja ricevis la urborajtojn.  La vilaĝo meritas la ekskursan promenon tien por rigardi fragmenton de la kastelruino el la 13-a jarcento, kiu apartenas al la plej malnovaj masonitaj konstruaĵoj en Pollando. Krom la rezidejaj funkcioj ĝi protektis la ĉirkaŭajn orminejojn, ĉar la orakirado riĉigadis la princan kason. En la 14-a jarcento ĝia rolo malkreskis kaj la kastelo fariĝis la sidejo de princaj oficistoj, sekve doganejo por komercistoj moviĝantaj inter la lokoj Legnica kaj Lwówek Sląski [lvuvek slonski]. En la 15-a jarcento la kastelo fariĝis post la Hus-militoj sidejo de rabistaj kavaliroj. Konkeris ĝin en 1451 Wrocław- [vrocŭav] kaj Świdnica [svidnica]-burĝoj kaj detruis. Neniam ĝi estis rekonstruita.

El la elsendo 06.02.2015. Legas Tomek

--------------------------------------------------------------------------------

E_elsendo el la 06.02.2015
[2015-02-06]
https://pola-retradio.org/2015/02/e_elsendo-el-la-06-02-2015/

Podkasto: Ludu en nova fenestro | Elŝutu

Per la nunsemajna felietono ni invitas al la loko en la sudokcidenta Pollando dum jarcentoj ligita kun la orminado t.e. la loko Złotoryja kaj la tiea orminejo Aurelia. En la komenco de la 411-a E-elsendo ĉe www.pola-retradio.org nia kultur­kronika informo rilatas al la bitigitaj kolektoj de la Universitata Biblioteko en Vroclavo nun disponig­itaj publike. La E-movada informo traktas la bezonojn de la kataluna Biblioteko-Arkivo Petro Nuez. Fine ni proponas renkontiĝon en la leterkesta programero, en kiu i.a. pri literaturaj elsendoj en nia programo ni interparolas kun nia hispana aŭskultanto Suso Moinhos. La kulturkronika informo kaj la felietono estas samtempe legeblaj kaj aŭskult­eblaj en la rubrikoj Novaĵoj kaj Felietonoj. Uzu kaj diskonigu ĉi tiun servon unuavice inter lingvo­lernantoj, krome ankaŭ inter klubaj aŭ grupaj konatoj, kiuj ne havas ankoraŭ kuraĝon paroli Esperanton.

--------------------------------------------------------------------------------

Radikalismo ne radikas en religio
[2015-02-10]
https://pola-retradio.org/2015/02/radikalismo-ne-radikas-en-religio/

Dum la lastvendreda debato de la Eŭrop-Atlantika Societo en Varsovio ĝiaj partopren­intoj reliefigis, ke radikalismo ne radikas en religio, sed religio estas instrumente utiligata inter enmigrantoj pro ilia koloniisma ekspluatado kaj manko de perspektivoj. Laŭ la prezidanto de la Plenumkonsilio de la societo, eksa defend­ministro Janusz Onyszkiewicz iluzia estas la rezonado, ke tiu temo nin ne koncernas. Ĝi koncernas nin almenaŭ malrekte pro la sekureco de niaj aliancanoj. Profesoro Tomasz Aleksandrowicz el  Collegium Civitas atentigis i.a., ke ni frontas vaste komprenatan civilizacian konflikton. Interesan intervenon faris diplomato kaj parlamenta eksperto pri la problemoj de enmigrado Wojciech Gilewski dirante, ke „facile estas provoki radikalismon, kiam oni metas homon en la centron por eksterlandanoj, en kiu validas prizona reĝimo, la oficistoj ne konas lingvon nek kulturon de la apartigitoj, ekzemple servante tabuajn nutraĵojn. Eksa estro de likviditaj Militistaj Invigilservoj – WSI atentigis, ke teroristoj komencas apliki metodojn karakterizajn por specialaj servoj organizante komunikadon kaj konspirajn renkontojn, kaj severaj varbado­kriterioj malebligas enpenetri la radikalajn mediojn. La debato estis dediĉita al la temo „Pollando fronte al minacoj ligitaj kun islama radikalismo”.

El la elsendo 10.02.2015. Legas Tomek

--------------------------------------------------------------------------------

E_elsendo el la 10.02.2015
[2015-02-10]
https://pola-retradio.org/2015/02/e_elsendo-el-la-10-02-2015/

Podkasto: Ludu en nova fenestro | Elŝutu

La laŭvica fragmento de Quo Vadis de Henryk Sienkiewicz en la E-traduko de Lidia Zamenhof estas la ĉefa programero en la 412-a E-elsendo ĉe www.pola-retradio.org. En la komenca, informa parto ni alrigardas eventojn en la mondo apartan atenton donante al la debato „Pollando fronte al minacoj ligitaj kun islama radikalismo”, okazinta semajnfine en Varsovio. En la temo el la pola gazetaro ni referencas al la starpunkto de OECD pri klerigaj reformoj en Pollando. En la scienca bulteno ni donas atenton al la apartaj proprecoj de tibetaj anseroj flugantaj super Himalajo. Hodiaŭ muzike akompanas nin Ĵak Le Puil per la fragmente prezentata kanzono “Al virino” el lia KD Sen elizi’ eldonita pasintjare de Vinilkosmo. La informoj de la elsendo estas samtempe legeblaj kaj aŭskult­eblaj en la rubrikoj “Novaĵoj” kaj “Sciencaj informoj”.

--------------------------------------------------------------------------------

Anseroj flugantaj super Mount Everest
[2015-02-10]
https://pola-retradio.org/2015/02/anseroj-flugantaj-super-mount-everest/

Dank’ al aplikitaj miniregistriloj al 29 tibetaj anseroj (Anser indicus) el la regiono de la mongola lago Terkhiin Tsagaan oni sukcesis analizi la flugitineron de ĉi tiuj birdoj super Himalajo. La miniregistriloj monitoris multajn parametrojn, inkluzive de geografia situo, flugoalto, flugilfrapado kaj korfunkciado. Kiam post unu jaro la anseroj revenis oni sukcesis kapti 14 ekzemplerojn kun enplantaĵoj kaj akiri sufiĉe da analizendaj donitaĵoj el 7 registriloj.

La tibetaj anseroj apartenas al birdoj flugantaj plej alte. Por atingi al la varma Hindio, kie ili pasigas vintron el la malvarma Mongolio ili ĉiujare superflugas Himalajon. Oni notis ilian transflugon ankaŭ super Mount Everest, ĉirkaŭ 9 kilometrojn super la marnivelo. Tio estas la unusolaj grandaj birdoj flugantaj tiom alte sen glisado. Kvankam super Himalajo traflugas ankaŭ stepaj gruoj (Grus virgo), sed ili ofte glisas dank’ al siaj larĝaj flugiloj. La tibetaj anseroj ne glisas eĉ dum la descenda flugo.

Eksterordinaraj kapabloj de tiuj birdoj fascinas sciencisojn de jarcentoj. Estis i.a. konstatie, ke iliaj pulmoj estas je unu kvarono pli grandaj ol ĉe aliaj anseroj, kaj ke ilia hemoglobino kapalas efike absorbi oksigenon en granda alto. Ili disponas pri kromaj vejnoj provizantaj per sango koron kaj muskolojn. Nun sciencistoj el la brita  Bangor University konstatis, ke la tibetaj anseroj ne leviĝas tiom alte por flugi rektlinie super la montopintoj, sed ili flugas laŭ itinero kiu memorigas telferon fidele spegulanta la formon de montoj kaj valoj. Dank’ al tio ili povas ŝpari ĉirkaŭ 8 procentojn de la energio, kio estas des pli grava, ĉar dum la tuta traflugo ili svingas per la flugiloj ne farante paŭzon por la glisado.

El la elsendo 10.02.2015. Legas Maciek

--------------------------------------------------------------------------------

„Panoramo kun la mizerikorda Samaritano” de Rembrandt en Szczecin
[2015-02-13]
https://pola-retradio.org/2015/02/panoramo-kun-la-mizerikorda-samaritano-de-rembrandt-en-szczecin/

Ĝis la komencaj tagoj de junio eblas la unuan fojon en Szczecin (la nordokcidenta Pollando) rigardi la tolaĵon de Rembrandt. La pentrita de la 32-jaraĝa artisto bildo estas unu el la ses pejzaĝoj pentritaj de Rembrandt inter liaj 400 verkoj. La prezentata en la ŝĉecina Nacia Muzeo tolaĵo estis disponigita de la Fondaĵo de Czartoryski-familio kaj apartenas al tri verkoj de Rembrandt en la polaj kolektoj. La ceteraj „Knabino en la kadro de la bildo” kaj „Sciencisto ĉe la pupitro” estas rigardeblaj en la Reĝa Kastelo en Varsovio (https://www.zamek-krolewski.pl/). Ambaŭ devenas el la familia artkolekto de profesorino Karolina Lanckoroński, kiu transdonis signifan parton de la familiaj kolektoj al Pollando.

El la elsendo 13.02.2015. Legas Tomek

--------------------------------------------------------------------------------

E_elsendo el la 13.02.2015
[2015-02-13]
https://pola-retradio.org/2015/02/e_elsendo-el-la-13-02-2015/

Podkasto: Ludu en nova fenestro | Elŝutu

Karolina Lanckoroński estas la ĉefheroo de la felietono pri koninda polo en la 413-a E-elsendo ĉe www.pola-retradio.org. En la komenca kulturoniko ni informas pri la 100-jara jubileo de la Nacia Filharmonio en Łódź kaj pri laŭvica pola urbo, Szczecin kies loĝantoj povas konatiĝi kun la bildo de Rembrandt “Mizerikorda Samaritano”. La E-movadaj informoj rilatas al la premio por prof. Federico Gobbo veninta el Seulo kaj al la impona radia reklamkampanjo pri Esperanto antaŭ nova studenta sesio en Hungario. Mallonga leterkesta renkontiĝo – en kiu aŭdiĝas fragmente la kanto de Kapriol’ “Jen forira moment’” el la KD eldonita pasintjare de Vinilkosmo – finas la elsendon. La kulturkronika informo kaj la felietono estas samtempe legeblaj kaj aŭskulteblaj en la rubrikoj Novaĵoj kaj Felietonoj.

--------------------------------------------------------------------------------

Koninda polo: Karolina Lanckoroński
[2015-02-13]
https://pola-retradio.org/2015/02/koninda-polo-karolina-lanckoronski/

Hodiaŭ ni volas prezenti al vi eksterordinaran polinion. Ankoraŭ kiel 92-jaraĝa virino ŝi lernis, studis, vizitadis bibliotekojn. Tion ŝi konfesis en 1998 en intervjuo lige kun sia 100-a naskiĝdatreveno.  Meze de sia vivo – en la periodo de la 2-a mondmilito – ŝi diametre ŝanĝis siajn profesiajn interesiĝojn rezignante pri la amata arthistorio favore  al la profundigado de la historio de Pollando. La naskiĝinta en Vieno filino de polo kaj germanino malgraŭ la fakto, ke plimulton de sia vivo pasigis eksterlande ĉiam akcentis sian ligon al Pollando kaj polecon. Neniam ŝi rezignis pri la pola civitaneco, en ĉiuj cirkonstancoj agante por la bono de la lando.

Karolina Lanckoroński estis la lasta reprezentanto de la malnova kaj meritiĝinta por Pollando magnata gento, kies historio radikas en la 14-a jarcento. Ŝia familia nomo deriviĝas de la urbo Lanckorona, kiun donaci al ŝiaj prauloj  reĝo Jagelo rekone pro iliaj bravagoj en la kontraŭteŭtona batalo sur la kampoj Grunwald. Reprezentantoj de la familio aktive partoprenis en la vivo de la nobela Respubliko, servis al ĝi kiel deputitoj kaj senatanoj, generaloj, episkopoj, vojevodoj, kastelestroj kaj starostoj. Ili batalis defene por la lando kaj ĝiaj interesoj  kontraŭ tataroj kaj kozakoj.

Karolina Lanckoroński naskiĝis en 1898 en Aŭstrio, kien post la tria dispartigo de Pollando translokiĝis ŝia avo. Ŝia patro, grafo Karol Lanckoroński, granda bienposedanto en Pollando kaj Aŭstrio okupis altan postenon ĉe la aŭstra kortego. Ŝia patrino Małgorzata Lichnowski estis fratino de la germana ambasadoro en Britio. Dank’ al la patro, granda amanto de literaturo kaj artkolektanto vizitanta kun siaj infanoj gravajn eŭropajn muzeojn ekde frua infancaĝo ŝi intesiĝis pri la arto. Samtempe malgraŭ grandsinjora kaj senĝena vivo Karolina sentis fortan ligon kun la pola kulturo kaj historio, malgraŭ tio, ke Pollando malaperis tiam sur la mapo de Eŭropo. Ŝi intersiĝis pri ĝaj klopodoj rakiri sendepedecon  kolektante fotojn pri la legioj kaj legionoj, agloinsignojn, broŝurojn. Dum kelka tempo ŝi zorgis pri malsanaj kaj vunditaj polaj soldatoj en resanigejo konstruigita de la patro. Eĉ se komence ŝi pensis pri flegistina kariero finfine ŝi elektia la arthistorion en la Viena Universitato. Aparte ŝi dediĉis sin al la kreado de Michelangelo kaj post la doktoriĝo dum kelkaj jaroj en Romo ŝi esploris la arton de la itala renesanco kaj baroko.  En 1934 ŝi forveturis al Lvovo. Tie en la Universitato de reĝo Jan Kazimierz ŝi lekciis arthistorion. Du jarojn poste ŝi kiel la unua polino habilitiĝis pri la arthistorio.

La feliĉan vivon ĉesigis la 2-a mondmilito kaj la invado de Lvovo fare de ruĝarmeanoj la 22-an de septembro 1939. La 42-jaraĝa tiam profesorino Karolina Lanckoronski ne uzis la doniĝintan  okazon evakui sin, sed tuj aliĝis al la konspira lvova filio de la Asocio de Armita Batalo.  En majo 1940 ŝi forveturis al Krakovo troviĝanta sub la germana okupacio, tie daŭragante la konsiran laboron por la krakova filio de la Asocio, engaĝiĝante samtempe en la agadon de la Ruĝa Kruco. Al ŝiaj taskoj apartenis poste ankaŭ  la zorgo pri polaj malliberigitoj en la tuta Ĝenerala Gubernio, establita de germanoj sur la polaj teritorioj. Kiam germanoj konkeris la orientajn randregionojn de Pollando ŝi estis redelegita al Lwów kaj Stanisławów. En majo 1942 ŝi estis arestita. Dum ŝia priaŭskultado la komandanto de gestapo Hans Krüger estis tiom nervozita pro ŝia rezista sinteno kaj manifestado de poleco, ke en furiozo li konfesis la elmurdon de 25 profesoroj de altlernejoj de Lvovo en julio 1941. Tiel Karolina Lanckoroński  eksciis pri ĉi tiu krimo, fariĝinte ĝia atestanto. Dank’ al la interveno de la itala reĝa familio ĉe Himmler ŝi evitis la verdiktitan mortopunon. Komence ŝi estis direktita al Berlino, sed en januaro 1943 ŝi trafis al la germana koncentrejo en  Ravensbrück, kie ŝi ricevis la numeron 16076. 8 tagojn ŝi pasigis en obskurejo – en kiu ĉiutage – laŭ siaj rememoroj – ŝi nutris sin per rememoraj imagoj  kaj imagtaj vizitoj en po unu el la famaj eŭropaj muzeoj.  En  Ravensbrück Karolina Lanckoroński fariĝis atestanto de multaj ekzekutoj kaj medicinaj eksperimentoj, sed unuavice ŝi rapidis helpri morale al kunmalliberigitinoj inaŭgurinte lekciojn pri historio kaj arthistorio. Unu monaton antaŭ la militfino – dank’ a la klopodoj de la prezidanto de la Internacia Ruĝa Kruco – ŝi estis liberigita kiel la unua polino en la grupo de 229 francinoj.

Postmilite pro sia aristokrata origino prof. Karolina Lanckorońska ne povis reveni al komunista Pollando. Ŝi ekloĝis en Italio, kie laŭ peto de generalo Anders ŝi organizis studojn por ĉirkaŭ 1300 eksaj soldatoj de la 2-a Korpuso. Dank’ al ŝiaj klopodoj ili povis studi en Romo, Bolonjo, Torino. Similan helpon ŝi donis al eksaj polaj soldatoj en Skotlando kaj Britio.

Aŭtune 1945 kun pastro Walerian Meysztowicz kaj kelkaj polaj sciencistoj ŝi establis en Romo Polan Historian Instituton. Ŝi rezignis pri sia sciencista kariero elektinte la postenon de profesoro en la Pola Universitato en Elmigrejo koncentriĝante pri la historio de Pollando en la establita de si Instituto. En tiu periodo ŝi kreis monumentecon 76-voluman eldonserion pri fontoj al la historio de Pollando. La materialoj devenis el eksterlandaj bibliotekoj kaj arkievjoj i.a. el la malnova arkivejo de la teŭrona ordeno en Królewiec (la nuna Kalilingrado), el la reĝa arkivo en Danlando, el la italaj, hispanaj kaj portugaloj arkivoj. Ŝian laboron helpis ŝia flua rego de la klasikaj greko kaj latino, de la anga, franca, itala, germana kaj pola lingvoj. En 1967 Karolina Lanckoroński establis en Svislando Fondaĵon de Lanckoroński-familio. Ĝi finance helpis jen al ŝia Pola Historia Instituto, jen al la Pola Biblioteko en Parizo, jen al la universitataj bibliotekoj en Pollando. Dank’ al ŝi polaj sciencistoj povis akiri eksterlandajn stipendiojn. En 1994 profesorino Karolina Lanckoroński donacis al la Reĝaj Kasteloj en Krakovo kaj en Varsovio tolaĵojn el la familia kolekto. Al Wawel trafis pli ol 500 eksponaĵoj, inkluzive 82 pentraĵojn de la itala gotiko kaj renesanco, pli ol 200 desegnaĵoj kaj 69 leteroj de pola pentristo, amiko de la familio, Jacek Malczewski. 37 bildojn ricevis la Reĝa Kastelo en Varsovio inkluzive de du tolaĵoj de Rembrandt, krome historiajn meblojn, valorajn arkivaĵojn kaj familiajn memoraĵojn. Antaŭ 20 jaroj en ambaŭ muzeoj estis ekspozicie prezentitaj ŝiaj donacoj. La Reĝa Kastelo en Varsovio en la 100-a naskiĝdatreveno de profesorino Karolina Lanckoronski funkciigis novan segmenton de la konstanta ekspozicio en la 2-a etaĝo de la norda alo, kiu prezentas la plej valorajn objektojn el la familia trezoro de profesorino Lanckoroński. Ŝi mortis senherede en 2002 havante 104 jarojn tiel finante la ekziston de la elstara pola Lankoroński-familio.

El la elsendo 13.02.2015. Legas Barbara

--------------------------------------------------------------------------------

La 100-jariĝo de la Lodza Filharmonio
[2015-02-13]
https://pola-retradio.org/2015/02/la-100-jarigo-de-la-lodza-filharmonio/

Per ciklo da jubileaj koncertoj la Filharmonio de Łódź [la centra Pollando] inaŭguras en februaro solenaĵojn de sia 100-jariĝo. La Lodza Simfonia Orgestro el kiu originas la nuna orkestro de la Lodza Filharmonio sian unuan koncerton donis la 17-an de februaro 1915.

La  jubilean koncertocikon inaŭguras la 13-an la plenumo de la monumenteca oratorio de Haydn „La kreo de la mondo”. La 17-an de februaro, 100 jarojn post la debuto de la lodza orkestro,  denove aŭdiĝos la simfonia poemo „Finnlando” de Sibelius kaj la fortepiana konĉerto fa-minora de Chopin. Dum la jubilea vespero estos plenumita ankaŭ porokaze mendita konĉerto „Musica festiva” por du orgenoj kaj simfonia orkestro de elstara pola komponisto Krzysztof Meyer. La unuan fojon la publiko aŭdos la sonadon de la simfonia orgeno kune kune la orgeno baroka. Kvankam ambaŭ disponas pri malsamaj sonskaloj kaj laŭaserte ili ne povas soni kune tiu ĉi principo ĉi-foje ne estos observita. La Lodza Filharonio estas la unusola koncertejo en la mondo disponanta pri ambaŭ orgenoj. La realigo de ĉi tiu projekto finiĝis en 2014. Dum laŭvica tago de la jubilea koncertociklo, la 20-an de februaro aŭdiĝos la komponaĵo „La citta futurista” mendita ĉe la lodza komponisto Artur Zagajewski. Kun orkestro ludos muzikistoj-amatoroj per tiaj instrumentoj, kiel muzikskatoloj, kristalaj pelvoj kaj polivinil-kloridaj tuboj. La jubileado finiĝos la 21-an de februaro per du orgen­recitaloj. Ludos Ludger Lohmann la aŭtoro de la koncepto pri orgenkonstruo en la filharmonio, lekcianto en la Supera Muzika Lernejo en Stutgardo. Recitalon donos krome Krzystof Urbaniak elstara pola orgen­ludisto kaj konsultanto rilate la orgenan projekton. La patrono de la Lodza Filharmonio estas mondfama pianisto devenanta el Lodzo, Artur Rubinstein.

El la elsendo 13.02.2015. Legas Maciek

--------------------------------------------------------------------------------

Varsovio kaj Krakovo en la rangolisto de vizitindaj urboj
[2015-02-17]
https://pola-retradio.org/2015/02/varsovio-kaj-krakovo-en-la-rangolisto-de-vizitindaj-urboj/

Varsovio kaj Krakovo okupas bonajn lokojn en la rangolisto de la plej volonte vizitataj urboj de la mondo.  Malgraŭ manko de aparta varb­kampanjo la interesiĝo pri Varsovio ne malkreskas. Ek­troviĝinte en la 42-a loko ĝi pretepasis Dublinon, Bruselon, Munkenon kaj Lisbonon. Laŭ la donitaĵoj de la listo „Top 100 City Destinations Ranking”, kiun prilaboris Euromonitor International rezultas, ke en 2013 Varsovion vizitis preskaŭ 4 milionoj da personoj, je preskaŭ 9 procentoj pli ol 2012. Similan kreskon en la sama periodo notis Krakovo, kiu en la rangolisto troviĝas ĉe la 70-a loko. Tiu kresko­tendenco konserviĝas de kelka tempo. La pola ĉefurbo bone evoluigis la turismajn servojn. Krom riĉa gastronomia kaj distra oferto, bona reto de vendo­galerioj – favorprezaj kompare al la okcidentaj – Varsovio disponigas  multajn allogajn lokojn, kiel la Sciencan Centron Kopernik aŭ Nacian Stadionon. Tio ebligas al turistoj rikolti multajn impresojn kaj sin distri. Laŭ turismaj ekspertoj la amasa turismo ne plu celas historiajn objektojn kaj vidindaĵojn, kiujn  oni rigardas kvazaŭ ĉeokaze.

Laŭ la ranglolisto „Top 100 City Destinations Ranking” plej multaj turistoj vizitis en 2013 Hong-Kongon, ĉar eĉ 25 kaj duona milionoj da personoj. Inter la eŭropaj urboj plej multnombre estis vizitata Londono, kiun elektis kiel vojaĝcelon 16, 7 milionoj da turistoj.

El la elsendo 17.02.2015. Legas Maciek

--------------------------------------------------------------------------------

Polaj studentoj studas en eksterlandaj altlernejoj
[2015-02-17]
https://pola-retradio.org/2015/02/polaj-studentoj-studas-en-eksterlandaj-altlernejoj/

Kreskas nombro de polaj studentoj eksterlande. Oni taksas la 20-procentan kreskon malgraŭ jarala malapogeo notita dum la lastaj tri jaroj. Laŭ la plej novaj statistikaj donitaĵoj de OECD temas jam pri ĉirkaŭ 48 polaj gejunuloj, inkluzive de preskaŭ 18 mil, kiuj studas en Britio.

Ĉiam pli granda popularecon ĝuas studoj en Danlando, kiu ofertas al eksterlandaj studentoj pli ol 500 stud­programojn en la angla lingvo. Polaj studentoj alte taksas la tien studsistemon, opiniatan unu el la plej bonaj en la mondo. Konfirmas tion prestiĝa rangolisto de Ŝanhajo. Kvankam en Danlando ekzistas nur 8 universitatoj, tamen du el ili troviĝas inter 100 plej bonaj en la mondo. La edukado en danaj altlernejoj ne estas pegenda. Aldone, se eksterlandaj studentoj entreprenas almenaŭ 10-horan laboron semajne, ili povas klopodi pri sociala stipendio, kiu kovras iliajn estad­kostojn.

La plej bonaj polaj altlernejoj: la krakova kaj la varsovia universitatoj troviĝas ekster la menciita  rangolisto.

El la elsendo 17.02.2015. Legas Maciek

--------------------------------------------------------------------------------

Vespertoj en Regiono de Międzyrzecz-Fortikaĵo
[2015-02-17]
https://pola-retradio.org/2015/02/vespertoj-en-regiono-de-miedzyrzecz-fortikajo/

38 594 vespertoj vintrumas en la Regiono de Międzyrzecz-Fortikaĵo en la lubuŝa vojevodio (la nordokcidenta Pollando). Temas pri rekordo dum la 15-jara monitorado de vespertoj en ilia plej granda vintrumejo. La  plej multnombraj estas vespertoj el la specio Myotis myotis superante 29 mil ekzemplerojn. 4 kaj duonan milnombran grupon konsistigas vespertoj Myotis daubentonii, la sekvan lokon okupas vespertoj Myotis nattereri.

La grandaj vespertoj Myotis myotis dominantaj super la ceteraj specioj falas en la vintran dormon jam kiam aperas la unuaj simptomoj de la malvarmiĝo kaj tial ilia nombro estas stabila. La aliaj specioj en la sama periodo kapablas esti aktivaj kaj venas al vintrumejo nur kiam ekregas vere severa vintro. Ili ankaŭ forlasas la vintrumejojn kiam ekstere ne estas varme.

Nunjare en la vesperta vintrumejo en Miedzyrzec oni konstatis sume 9 vespertospeciojn.

El la elsendo 17.02.2015. Legas Tomek

--------------------------------------------------------------------------------

Jaro de siluro en la Nacia Parko de Biebrza-rivero
[2015-02-17]
https://pola-retradio.org/2015/02/jaro-de-siluro-en-la-nacia-parko-de-biebrza-rivero/

La 2015-a jaro pasas en la plej granda pola Nacia Parko de Biebrza-rivero [bjebĵa-rivero] kiel Jaro de Siluro. Dum la plej proksimaj tri jaroj entute ne eblos fiŝkapti silurojn.  Kvankam Biebrza-rivero riĉas je multaj taŭgaj vivejoj kaj nutrejoj favorantaj la vivkondiĉojn al siluroj, sed ilia populacio – pro civilizaciaj ŝanĝoj – malkreskas kaj necesa estas protekta programo. Krom tio kunlabore kun iĥtiologoj, fiŝkaptistoj kaj amikiĝintaj plonĝistoj siluro estos monitorata en la Parko dum la tuta jaro.

