La dominado de la angla – manko en la sciencaj konoj
[2017-01-03]
https://pola-retradio.org/2017/01/la-dominado-de-la-angla-manko-en-la-sciencaj-konoj/

Laŭ d-ro Tatsuya Amano el Zoologia Instituto de Cambridge-Universitato la lingvaj barieroj daŭre malfaciligas la kolektadon kaj utiligadon de sciencaj konoj en la monda skalo. Homoj,  por kiuj la angla estas la baza lingvo tendencas premisi, ke ĉiuj esencaj sciencaj konoj estas disponeblaj anglalingve. Aliflanke homoj, por kiuj la angla ne estas la unua lingvo ofte premisas, ke la plej grava prioritato estas gvidi esplorojn anglalingve, el kio sekvas, ke ili ignoras neanglalingvajn konojn. Esploristoj el Cambridge aldonas, ke manko de ekvilibro en la konoperado estas plej videbla en la landoj, en kiuj la angla ne estas la baza lingvo. En multaj vivsferoj, ekzemple en la sciencoj pri la medio signifa parto de konoj, kreiĝintaj en ĉi tiuj landoj estas referencebla nur en la angla lingvo. Sciencistoj esplorantaj tiun fenomenon kontaktis i.a. homojn respondecajn pro la protekto de la natura medio en Hispanio. Pli ol la duono de la respondintoj konfesis, ke unu el la plej gravaj barieroj por utiligi la plej novajn esplorojn estas ĝuste la lingva baro. Esploristoj el Cambridge analizis ankaŭ la sciencajn tekstojn el 2014  pri la protekto de la biodiverseco el la gugla platformo Scholar. Pli ol 35 procentoj de pli ol 75 mil dokumentoj estis anglalingvaj. Nur ĉ. La duono de ili enhavis ankaŭ titolojn, ŝlosilvortojn en la angla lingvo. Tio kaŭzas, ke tiuj ĉi tekstoj ofte estas nekonsiderataj en sistemaj trarigardoj. En la sumigado de la aktuala stato de la sciencaj konoj oni ofte favoras tekstojn anglalingvajn. En sciencoj pri la naturprotekto tio signifas ankaŭ, ke la informoj pri lokaj animalspecioj k.s. estas prisilentataj en la anglalinga scienca literaturo. Eĉ se la angla estas agnoskata kiel la baza lingvo de la scienco tamen pli ol unu triono de la informoj estas publikigata en aliaj lingvoj. La informoj pri sciencaj malkovroj nur en unu lingvo – eĉ se tiu estus la angla – kaŭzas breĉon en la trafluo de la sciencaj konoj. Unu el la manieroj kontraŭbatali tiun fenomenon estas provizi artikolojn publikigatajn en la sciencaj periodaĵoj per plurlingvaj resumoj. La alia solvo devas ligiĝi kun helpo de universitatoj en la tradukado de tekstoj, publikigitaj de iliaj laborantoj.

El la elsendo 03.01.2017. Legas Barbara – 3’14”

sc_bp_Malavantagoj de unulingva scienca literaturo_03’14”

--------------------------------------------------------------------------------

Fringo venkis en la pola eldono de la Eŭropaj Tagoj de Birdoj-2016
[2017-01-03]
https://pola-retradio.org/2017/01/fringo-venkis-en-la-pola-eldono-de-la-europaj-tagoj-de-birdoj-2016/

Fringo venkis en la pola eldono de la Eŭropaj Tagoj de Birdoj-2016. Tio estas parto de la kampanjo EŭroBirdwatch, organizata de BirdLife International en la tuta Eŭropo kaj en la Centra Azio. En la 2016-a jaro homoj el 36 ŝtatoj – de Norvegio ĝis Kipro kaj de Portugalio ĝis Uzbekio – komune observis, konatiĝis kun la traflugoitineroj kaj kun minacoj endanĝerigantaj birdojn dum la aŭtunaj traflugoj. En Pollando tiuokaze oni organizis 150 promenojn kaj aliajn eventojn. Fringo estis observita en Pollando pli ol 122 mil fojon. La sekvajn lokojn okupis sturno, observita 38 mil fojojn kaj granda paruo – 15 mil fojojn. En la unua kvinopo ektroviĝis krome blatbeka anaso, rimarkita pli ol 14 mil fojojn kaj vanelo rimarkita pli ol 10 mil fojojn. Grandegaj gregoj de fringoj kaj sturnoj estis konstatitaj en multaj landoj kaj ili estis la plej oftaj birdospecioj dum la Eŭropaj Tagoj de Birdoj 2016. Entute en 40 ŝtatoj de Eŭopo kaj la Centra Azio estis observitaj sume 5 milionoj 800 mil migrantaj birdoj kaj en ĉiuj ĉi eventoj partoprenis pli ol 24 mil personoj.

El la elsendo 03.01.2017. Legas Barbara – 1’37”

sc_bp_Fringo la heroo de la pola Europa Tago de Birdoj-2016_01’37”

--------------------------------------------------------------------------------

Aldonaj rimedoj por la Centro de Polaj Studoj en Cambridge
[2017-01-03]
https://pola-retradio.org/2017/01/aldonaj-rimedoj-por-la-centro-de-polaj-studoj-en-cambridge/

La pola Ministerio por la Scienco kaj Supera Klerigo destinis pli ol 15 milionojn da zlotoj por subteni la evoluigon de la Centro de la Polaj Studoj en la Universitato en Cambridge. La kromaj rimedoj ebligos al la pola katedro en Cambridge unuavice gvidi studojn pri konoj rilate Pollandon en la sfero de humanismaj kaj sociaj sciencoj. Krome ili ebligos efektivigon de la polaj-britaj sciencaj esploroj formante la bildon de Pollando kiel lando kun grandaj sciencaj kaj kulturaj ebloj.

El la elsendo 03.01.2017. Legas Krystyna – 0’41”

--------------------------------------------------------------------------------

Post 10 jaroj la plej malalta deficito en la polaj publikaj financoj
[2017-01-03]
https://pola-retradio.org/2017/01/post-10-jaroj-la-plej-malalta-deficito-en-la-polaj-publikaj-financoj/

Kvankam la pola financministerio ne publikigis ankoraŭ donitaĵojn ligitajn kun decembro 2016 jam nun eblas konstati, ke la deficito de la tuta sektoro de la publikaj financoj pro 2016 estos la plej malalta ekde 2007 kaj ne superos 2,4 procentojn de la Malneta Landa Produkto. En la periodo januaro-novembro 2016 la buĝetaj enspezoj estis plenumitaj en 93,8 procentoj, la elspezoj en la alteco de 87,4 procentoj rilate al la premisitaj. Sekve de tio, la buĝeta deficito egalas al 50,4 procentoj de la planita.

El la elsendo 03.01.2017. Legas Krystyna – 0’49”

--------------------------------------------------------------------------------

Sep Kultutinstitucioj en Bjalistoko
[2017-01-03]
https://pola-retradio.org/2017/01/sep-kultutinstitucioj-en-bjalistoko/

En Bjalistoko 2017 funkcias sep kulturinstitucioj, por kiuj en la buĝeto de la urbo estas rezervitaj 22 milionoj da zlotoj. Ekde la 1-a de januaro la agadon inaŭguris du novaj kulturinstitucioj: Bjalistoka Kulturcentro kreiĝinta el la samnoma institucio kaj Zamenhof-Centro, por kiu en la buĝeto estas destinitaj 5,6 milionoj da zlotoj kaj Muzeo de Memoro pri Siberio, apartigita el la Muzeo de la Polaj Militaraj Fortoj. Por ĝi estas destinitaj 1,8 milionoj da zlotoj. Zamenhof-Centro establita en 2009 lige kun la okazanta tiam 94-a Universala Kongreso de Esperanto, kiel la filio de Bjalistoka Kulturcentro, celis prezenti kaj popularigi la kulturan, naciecan kaj religian variecon de la regiono. Unu jaron poste ĝi memstariĝis. Laŭ la ideo de la urboaŭtoritatoj la denova kunigo de ambaŭ institucioj ebligos pli racie uzi la potencialon de ambaŭ centroj kaj alportos financan ŝparon en la alteco de 500 mil zlotoj jare. La novstruktura Bjalistoka Kulturcentro okupiĝos pri la popularigado de la kultura kaj historia heredaĵo de la urbo ligita kun ĝia plurkultureco, pri la disvastigado de la ideo de toleremo, la formado de platformo por kultura dialogo, popularigado de la figuro kaj la verko de Ludoviko Zamenhof. La urbo jam havas riĉan planon, realigotan kun lokaj esperantistoj, ligitan kun la solenado de la 100-a mortodatreveno de la naskiĝinta en ĝi Ludoviko Zamenhof. Ĝia direktorino fariĝis Grażyna Dworakowska. La Muzeo de la Memoro pri Sibiro en konstruado fariĝos tutlanda centro okupiĝanta pri i.a. la fortransportado de poloj orienten. La kolektado de eksponaĵoj por la kreata institucio daŭras de kelkaj jaroj – temas pri memoraĵoj transdonataj de Sibiri-ekzilitoj aŭ akiritaj aĉetovoje, dokumentoj bildigantaj la sortojn de la polaj ekzilitoj. Ĝia direktoro fariĝis historiisto Wojciech Śleszyński,  profesoro de la Bjalistoka Universitato.

El la elsendo 03.01.2017. Legas Milada – 2’53”

--------------------------------------------------------------------------------

Interparolo kun Walter Żelazny
[2017-01-03]
https://pola-retradio.org/2017/01/interparolo-kun-walter-zelazny/

Nia antaŭmikrofona gasto estas profesoro Walter Żelazny el Pollando , la  estro de la Katedro pri kultura antropologio en la Universitato de Bjalistoko. Ni interparolas pri lia prelegserio pri judaismo, kiun li gvidis dum BET-2016, pri lia esperantigita libro „Ludoviko Lazaro Zamenhof – Lia pensaro, sekvoj kaj konsideroj” kaj pri la didaktika laboro de lia katedro, en kiu eblas doktoriĝi kelklingve ankaŭ pri E-rilataj temoj,  ricevante ŝtatan diplomon agnoskitan en la landoj de la Eŭropa Unio. El la elsendo 03.01.2017 – 10’12” /wp-content/uploads/2017/01/bp_rozm.-z-prof.-W.-Zelazny_1012.mp3

--------------------------------------------------------------------------------

E_elsendo el la 03.01.2017
[2017-01-03]
https://pola-retradio.org/2017/01/e_elsendo-el-la-03-01-2017/

Podkasto: Ludu en nova fenestro | Elŝutu

La 612-a E-elsendo ĉe www.pola-retradio.org el la 03.01.2017:

– Nia hodiaŭa antaŭmikrofona gasto estas profesoro Walter Żelazny el Pollando, la estro de la Katedro pri kultura antropologio en la Universitato de Bjalistoko. Ni interparolas pri lia prelegserio pri judaismo, kiun li gvidis dum BET-2016, pri lia esperantigita libro „Ludoviko Lazaro Zamenhof – Lia pensaro, sekvoj kaj konsideroj” kaj pri la didaktika laboro de lia katedro, en kiu eblas doktoriĝi kelklingve ankaŭ pri E-rilataj temoj, ricevante ŝtatan diplomon agnoskitan en la landoj de la Eŭropa Unio. – Niaj komencaj aktualaĵoj rilatas al la bona stato de la publikaj financoj en Pollando, al kroma subvencio por la Centro de Polaj Studoj en Cambridge. Ni informas aldone pri la bjalistokaj kulturcentroj. En la novstrukturita Bjalistoka Kultur-Centro sian lokon havas denove Zamenhof-Centro. – En la scienca bultena ni informas pri novaj esploroj rilate la malavantaĝon de la dominita de la angla scienca literaturo kaj pri Fringo, la ĉefheroo de la Eŭropaj Birdo-Tagoj-2016 en Pollando. – Muzike akompanas nin la novjara kanto de Muzikumejo: https://www.youtube.com/watch?v=mIqkBY0NqvU kaj la novjara mesaĝo de Dirce Sales: https://drive.google.com/file/d/0B3VrPGl7lVKbLWNxQjlBd1dkY3c/view . Ni citas krome el la kanto de Nikolin „Zamenhof”. – Aktualaĵoj estas paralele legeblaj kaj aŭskulteblaj en la koncernaj retpaĝaj rubrikoj. Aparte aŭdiĝas interparolo kun nia antaŭmikrofona gasto.

--------------------------------------------------------------------------------

E_elsendo el la 06.01.2017
[2017-01-06]
https://pola-retradio.org/2017/01/e_elsendo-el-la-06-01-2017/

Podkasto: Ludu en nova fenestro | Elŝutu

La 613-a E-elsendo el la 06.01.2017 ĉe www.pola-retradio.org:

– La nunsemajnan elsendon komencas kultura kroniko kun informoj referencantaj al la hodiaŭa Festo de la Tri Reĝoj, Epifanio. Temas pri interesa ekspozicio enhave ligita kun la hodiaŭa festo, kiu prezentas la bildojn de aŭstra pentristo Franz Christoph Janneck en Krakovo. Temas pri publikaj Paradoj de la Tri Reĝoj, kiuj disvolviĝis en centoj da polaj urboj, ankaŭ eksterlande. – Rilate la eventojn de la E-komunumo ni informas pri la inaŭguro de la sociaj aktivadoj ligitaj kun Zamenhof-Jaro en Bjalistoko. – Kun Anna Striganova ni renkontiĝis en 2016 same dum BET, kiel ankaŭ dum la Nitra UK. Hodiaŭ ni prezentas la interparolon surbendigitan kun ŝi dum la Baltaj E-Tagoj en la litova Birštonas, en kiu ŝi i.a. klarigas sian interesiĝon pri fabeloj, rakontas kelkvorte pri sia pentroarto kaj kunlaboro kun la eldonejo Impeto kaj pri sia vojo al Esperantujo. – En la fino ni proponas mallongan leterkestan renkontiĝon. – Muzike akompanas nin kristnaskaj kantoj en la pola lingvo kaj Esperante (kantas Remigiusz Kossakowski) ligitaj kun Epifanio. Ni memorigas ankaŭ iun el la komunaj kantoj dum amikaj vesperoj en Birštonas. – La akompana foto ĉe la informo pri la elsendo ligiĝas kun la Parado de la Tri Reĝoj en Pollando, pri kiu ni informis en nia elsendo. La elsendo estas ankaŭ aŭskultebla en YouTube. La kulturkronikaj informoj estas paralele legeblaj kaj aŭskulteblaj en la koncerna rubriko de nia paĝo. Ankaŭ aparte aŭdiĝas interparolo kun nia antaŭmikrofona gasto.

--------------------------------------------------------------------------------

Ekspozicio en Krakovo enhave ligita kun Epifanio
[2017-01-06]
https://pola-retradio.org/2017/01/ekspozicio-en-krakovo-enhave-ligita-kun-epifanio/

[Pro teknika kialo la transskribita teksto ne estas nun havebla sed ĝi estos videbla denove — espereble iam dum 2022. Dankon pro via pacienco.]

[Intertempe la sondosiero estas ĉiam ludebla per uzo de la kutima suba butono.]

El la elsendo 06.01.2017

--------------------------------------------------------------------------------

Anna Striganova pri fabeloj, pentroarto kaj aliaĵoj
[2017-01-06]
https://pola-retradio.org/2017/01/anna-striganowa-pri-fabeloj-pentroarto-kaj-aliajoj/

Kun Anna Striganova en Rusio ni renkontiĝis en 2016 same dum BET, kiel ankaŭ dum la Nitra UK. Hodiaŭ ni prezentas la interparolon surbendigitan kun ŝi dum la Baltaj E-Tagoj en la litova Birštonas, en kiu ŝi i.a. klarigas siajn interesiĝon pri fabeloj, rakontas kelkvorte pri sia pentroarto kaj kunlaboro kun la eldonejo Impeto kaj pri sia vojo al Esperantujo. El la elsendo 06.01.2017 – 6’58” /wp-content/uploads/2017/01/bp_interp.-kun-Anna-Striganova_0658.mp3

--------------------------------------------------------------------------------

Paradoj de la Tri Reĝoj
[2017-01-06]
https://pola-retradio.org/2017/01/paradoj-de-la-tri-regoj/

[Pro teknika kialo la transskribita teksto ne estas nun havebla sed ĝi estos videbla denove — espereble iam dum 2022. Dankon pro via pacienco.]

[Intertempe la sondosiero estas ĉiam ludebla per uzo de la kutima suba butono.]

El la elsendo 06.01.2017

--------------------------------------------------------------------------------

Pli da flugoj de LOT al Ĉikago kaj Seulo
[2017-01-10]
https://pola-retradio.org/2017/01/pli-da-flugoj-de-lot-al-cikago-kaj-seulo/

La pola flugkompanio LOT ekde julio 2017  grandigos la kvanton de siaj flugoj al la Suda Koreio kaj revenigos rektan flugkonekton el Krakovo al Ĉikago. La revenigo de ĉi-lasta flugkonekto respondas al la bezonoj de pasaĝeroj, kiuj pro familiaj motivoj de jaroj flugas laŭ ĉi tiu itinero. Ĉiujare temas pri pli ol 90 mil ĉi-specaj pasaĝeroj. Ilia nombro kreskas. LOT reagas ankaŭ je la kreskanta bezonateco de pasaĝeroj flugantaj al Azio. Post la paso de la unuaj 4 monatoj la pola flugkompanio decidis grandigi la nombron de la flugoj al Seulo. La konekto inter Varsovio kaj Seulo ĝuas popularecon ne sole inter la loĝantoj de la Suda Koreio kaj Pollando. La flugojn kun LOT al Seuo elektas ĉiam pli da pasaĝeroj el aliaj eŭropaj urboj. Grandigo de la flugkonektoj al Seulo kaj restarigo de la fluoj el Krakovo al Ĉikago apartenas al la strategio dinamike evoluigi la longdistancajn konektojn, kiujn LOT planas por la nuna jaro.  En aprilo aldoniĝos ĝiaj du tute novaj flugitineroj al Los Angelos kaj al Newark.

El la elsendo 10.01.2017. Legas Milada – 1’33”

--------------------------------------------------------------------------------

En 2017 komenciĝos esploroj en Solaris
[2017-01-10]
https://pola-retradio.org/2017/01/en-2017-komencigos-esploroj-en-solaris-2/

En 2017 komenciĝos esploroj en Solaris,  la plej moderna sinkrotrono, unusola ĉi-speca aranĝaĵo en la Centra-Orienta Eŭropo, kiu troviĝas en Krakovo kaj apartenas al la Jagelona Universitato. Sinkrotrono, akcelilo de elektronoj,  Solaris troviĝanta en la konstruaĵo de la Nacia Centro de Sinkrotrona Radiado estis funkciigita en septembro 2015. Ekde tiam kolektivo de pli ol 40 personoj pretigas tiun lokon al laboro tiel, ke post kelkaj monatoj sciencistoj povu komenci unikajn mezuradojn el diversaj sciencbranĉoj: fiziko, kemio, medicino, geologio. La esploroj servos por prilaboro de novaj teknologie materialoj, ekzemple sunĉeloj, detektiloj. Por marto estis planita akcepto de esplorprojektoj kaj la unuaj sciencistoj komencos labori tie meze de 2017. Sinkrotrono kun la perimetro de 96 metroj troviĝas sub la kovraĵo el 180 betonaj platoj, kiuj pezas de tri ĝis kvin tunoj. Ili konsistigas radiologian barilon, kiu ebligas sekuran laboron. Sinkrotrono funkcianta tutdiurne, tagnokte ebligos esplorojn al dek kelkaj grupoj en la sama tempo. La krakova aranĝaĵo estas aktuale la plej moderna, sed ne la plej granda en la mondo. Ĝi estas la unusola sinkrotrono en la Centra-Orienta Eŭropo. Alia, simile moderna akcelilo funkcias en la laboratorio Max IV en la universitato de Lund. La tieaj sciencistoj helpis en la kreo de Solaris. La kosto de la kvinjaraj laboroj pri Solaris egalis al ĉ. 200 milionoj da zlotoj kaj devenis el la Eŭropa Unio. La tutjara funkciado de la Centro kostas 14 milionojn da zlotoj kaj estas financata el la ŝtata buĝeto. En la mondo funkcias ĉ. 60 sinkrotronoj, sed duono de ili estas malnoviĝinta. Ili troviĝas ĉefe en la Norda Ameriko, la Fora Oriento kaj la Okcidenta Eŭropo.

El la elsendo 10.01.2017. Legas Tomek – 2’05”

sc_tm_La pola sinkrotrono Solaris_02’05”

--------------------------------------------------------------------------------

Raporto pri ukrainanoj laborantaj en Pollando
[2017-01-10]
https://pola-retradio.org/2017/01/raporto-pri-ukrainanoj-laborantaj-en-pollando/

La 12-an de decembro 2016 la Nacia Pola Banko publikigis la rezultojn de raporto pri esploroj koncerne ukrainajn enmigrantojn, laborantajn en Pollando. Ĝi analizas la situacion de enmigrantoj sur la pola labormerkato, la monfluon ligitan kun laboro de eksterlandanoj en Pollando kaj proksimigas la fenomenon de la nova ondo de enmigrantoj. Per sia strukturo ĝi malsimilas disde tiu, kiu ligiĝis kun la alveno de ukrainanoj al Pollando antaŭ la 2014-a jaro. Aktuale en plimulto temas pri junaj viroj. En pli signifa grado ili devenas el la orienta Ukrainio, inter ili estas malpli da personoj posedantaj infanojn. En plimulto ukrainaj civitanoj plenumas en Pollando simplajn fizikajn laborojn, kiuj ne postulas kvalifikojn. Ili laboras ĉefe en agrikulturo, hejmaj mastrumejoj, sur konstruplacoj, ili okupiĝas pri renovigaj-finpretigaj domlaboroj. Ukrainanoj laboras meze 54 horojn semajne kaj ilia monata enspezo nete egalas al ĉ. 2100 zlotoj. Plimulto de iliaj enspezoj estas perata al Ukrainio. En 2015 ukrainanoj perlaboris 8 miliardojn da zlotoj, el kio 5 miliardoj trafis al ilia hejmlando. Plej ofte ili persone peras mononon revenante al sia lando ĉiun 2-3-an monaton. La perlaboritaj en Pollando rimedoj estas unuavice destinataj por kurantaj bezonoj kaj plibonigo de la loĝeja situacio. Apartan grupon de enmigrantoj el Ukrainio konsistigas studentoj, kies nombro signife kreskas. En plimulto ili intencas estonte labori en Pollando aŭ almenaŭ esti kun Pollando ligitaj profesie.

El la elsendo 10.01.2017. Legas Maciek – 1’52”

--------------------------------------------------------------------------------

Usonaj solatoj firmigas la orientan NATO-alon
[2017-01-10]
https://pola-retradio.org/2017/01/usonaj-solatoj-firmigas-la-orientan-nato-alon/

La unuaj grupoj de usonaj soldatoj venis lastsabate al la ekzercokampo proksime al la loka Żagań (la okcidenta Pollando). Temas pri parto de blendbrigado firmigonta la orientan alon de NATO. La 14-an de januaro okazos oficiala bonvenigo de la usonaj soldatoj. La aliancana fortigo de la regiono, konfirmita dum la varsovia pintrenkonto de NATO premisas, ke ekde aprilo 2017 en Pollando kaj en la regiono troviĝos plurnacia bataliona batalgrupo subalterna al NATO-komandantaro. Lastvendrede en la germana Bremenhaven komenciĝis la elkargado de la aranĝaĵoj de la usona Grupo direktitaj al Pollando al Żagań kaj Drawsko Pomorskie. Ekde februaro la soldatoj kaj aranĝaĵoj estos dislokataj en la regiono por partopreni batalekzercojn kun eŭropaj aliancanoj.  La brigada batalgrupo konsistas el ĉ. tri kaj duona mil homoj, pli ol 400 raŭpveturiloj, pli ol 900 radaj veturiloj.

El la elsendo 10.01.2017. Legas Barbara – 1’08”

--------------------------------------------------------------------------------

Intervjuo kun Suso Moinhos pri verkoj liaj kaj aliaj temoj
[2017-01-10]
https://pola-retradio.org/2017/01/intervjuo-kun-suso-moinhos-pri-verkoj-liaj-kaj-aliaj-temoj/

La literaturaj temoj eĥiĝas en nia antaŭmikrofona renkontiĝo kun Suso Moinhos el Hispanio , kun kiu renkontiĝinte en Poznano lige kun la lasta interlingvistika sesio kaj Arkones-2016 ni povis i.a. paroli pri lia eldonita tiujare poezivolumo „Laminarioj” kaj laborstato pri „Memoraĵoj de kampara knabo” la tradukita de li verko de Xosé Neira Vilas. Ĉi-lasta aperas komence de 2017 en la eldonejo Mondial. El la elsendo 10.01.2017 – 13’20”

--------------------------------------------------------------------------------

E_elsendo el la 10.01.2017
[2017-01-10]
https://pola-retradio.org/2017/01/e_elsendo-el-la-10-01-2017/

Podkasto: Ludu en nova fenestro | Elŝutu

La 614-a E-elsendo el la 10.01.2017 ĉe www.pola-retradio.org:

Pola Flugkompanio LOT

– La literaturaj temoj eĥas hodiaŭ en nia antaŭmikrofona renkontiĝo kun Suso Moinhos el Hispanio, kun kiu renkontiĝinte en Poznano lige kun la lasta interlingvistika sesio kaj Arkones-2016 ni povis i.a. paroli pri lia eldonita tiujare poezivolumo „Laminarioj” kaj laborstato pri „Memoraĵoj de kampara knabo” la tradukita de li verko de Xosé Neira Vilas. Ĉi-lasta aperas komence de 2017 en la eldonejo Mondial. – La komencaj aktualaĵoj rilatas al la unuaj usonaj soldatoj venintaj al Pollando kaj la regiono por firmigi la orientan flankon de NATO; al la lastaj esploroj pri ukrainanoj laborantaj en Pollando; al novaj planoj de la pola flugkompanio LOT, kiu i.a. ekde julio grandigas la nombron de flugkonektoj al Seulo. – La sciencbultena temo koncernas la finajn laborojn pri funkciigo de la plej moderna sinkrotrono Solaris en Krakovo. – Muzike ni renkontiĝas kun la grupo Kaj Tiel Plu ĝuante fragmente ĝian kanton „Anda haleo” el ilia KD eldonita de Vinilkosmo „Plaĉas al mi”. La aktualaĵoj kaj la scienbultena temo estas paralele legeblaj kaj aŭskulteblaj en la koncernaj rubrikoj de nia paĝo. En la rubriko „Antaŭ la mikrofono” aŭdiĝas interparolo kun nia antaŭmikrofona gasto.

--------------------------------------------------------------------------------

Arto ĝuebla de personoj blindaj aŭ de reduktita vidkapablo
[2017-01-13]
https://pola-retradio.org/2017/01/arto-guebla-de-personoj-blindaj-au-de-reduktita-vidkapablo/

[Pro teknika kialo la transskribita teksto ne estas nun havebla sed ĝi estos videbla denove — espereble iam dum 2022. Dankon pro via pacienco.]

[Intertempe la sondosiero estas ĉiam ludebla per uzo de la kutima suba butono.]

--------------------------------------------------------------------------------

E_elsendo el la 13.01.2017
[2017-01-13]
https://pola-retradio.org/2017/01/e_elsendo-el-la-13-01-2017/

Podkasto: Ludu en nova fenestro | Elŝutu

La 615-a E-elsendo el la 13.01.2017 ĉe www.pola-retradio.org:

– Nia felietono pri koninda polo prezentas la silueton de Erazm Jerzmanowski, kontraŭcara insurgento, soldato, industriisto, mecenato, socia aganto difinata kiel „la pola Nobel” kaj ĝuinta epiteton de polo, kiu „lumigis Usonon”. – Niaj kulturkronikaj informoj koncernas la agadojn de la Fondaĵo Autodeskripcja kaj ĝia portalo iSztuka.edu.pl kaj la ekspozicion de 100 objektoj el la Katolika Universitato en Lublino, kiu nun estas rigardebla en la varsovia Reĝa Kastelo. – La E-komunuma informo rilatas al la konkurso por TEJO-aĝaj esperantistoj partopreni la projekton Afrika-Eŭropa Junulara Kapabligo http://pej.pl/eo/2017/01/10/trejnigu-en-italio-kaj-igu-trejnisto . Muzike akompanas nin Zhou-Mack Mafuila per la fragmento de la kanto „La fluo” el la KD „Originoj” eldonita de Vinilkosmo. – La akompana foto ĉe la informo prezentas laŭ vikipedio portreton de Erazm Jerzmanowski, polo dank’ al kiu eblis apliki sintezan gason por profitdonaj komercaj projektoj por lumigo de usonaj urboj. – La kulturkronikaj informoj kaj la felietono estas paralele legeblaj kaj aŭskulteblaj en la koncerna rubriko de nia paĝo. Ankaŭ aparte aŭdiĝas interparolo kun nia antaŭmikrofona gasto. – Nia elsendo estas aŭskultebla ankaŭ pere de: https://www.youtube.com/results?q=pola+retradio&sp=CAI%253D

--------------------------------------------------------------------------------

Artverkoj el la kolekto de la Katolika Universitato de Lublin videblaj en la Reĝa Kastelo, Varsovio
[2017-01-13]
https://pola-retradio.org/2017/01/artverkoj-el-la-kolekto-de-la-katolika-universitato-de-lublin-videblaj-en-la-rega-kastelo-varsovio/

[Pro teknika kialo la transskribita teksto ne estas nun havebla sed ĝi estos videbla denove — espereble iam dum 2022. Dankon pro via pacienco.]

[Intertempe la sondosiero estas ĉiam ludebla per uzo de la kutima suba butono.]

--------------------------------------------------------------------------------

Koninda polo – Erazm Jerzmanowski [jeĵmanofski], polo kiu lumigis Usonon
[2017-01-13]
https://pola-retradio.org/2017/01/koninda-polo-erazm-jerzmanowski-jejmanofski-polo-kiu-lumigis-usonon/

La heroo de nia nunsemajna felietono estas Erazm Józef Dołęga Jerzmanowski, insurgento de la kontraŭcara Januara Insurekcio 1963, soldato, industriisto, mecenato, socia aganto kaj filantropo difinata ankaŭ kiel „la pola Nobel”. Li ĝuas krome la epiteton de „polo, kiu lumigis Usonon”. Erazm Józef Jerzmanowski naskiĝis la 2-an de junio 1944 en la loko Tomosławice, en malnova kvankam malriĉiĝinta nobela familio blazone Dołęga. Ĝi distingiĝis per grandaj patriotaj tradicioj kaj ĝiaj antaŭuloj estis senatanoj, deputitoj, partoprenis la grandan 4-jaran Sejmon, fidelis ĉe la flanko de la imperiestro Napoleono eĉ ĝis lia morto sur la insulo de S-ta Helena. Erazm Jerzmanowski ricevis tradician edukon. Post la lernado en la gubernia gimnazio en Varsoio li komencis studojn en la Politeknika kaj Agronomi-Arbaristika Intituto en Puławy (tiam Nowa Aleksandria). Tie surprizis lin  la eksplodo de la Januara Insurekcio, en kiu li aktive partoprenis. Internigita de la aŭstraj aŭtoritatoj en Olomouc kaj sekve liberigita en 1864 li elmigris el Pollando kaj tra Svislando atingis Francion. Tie helpis al li la familiaj tradicioj kaj kontaktoj. Unue li trafis al la elita Mineja Lernejo kaj sekve al la Lernejo de Militista Inĝenierio kaj Artilerio en Metz. El ĝi li estis vokita al la fronto kaj en 1870 kiel franca oficiro li batalis kontraŭ prusoj. Post la milito li estis elaborigita en la firmao de Cyprian Tessie du Motay [siprian tesi de mote], kiu malkoris novan manieron utiligi gason por la lumigado de urboj. Kiel ĝia reprezentanto Jerzmanowski en 1871 veturis al Usono. Tie evidentiĝis tamen, ke la malkovro de du Motay eĉ se promesoplena ne estas perfekta, ke ne eblas apliki ĝin por profitdonaj komercaj solvoj. Tiam Jerzmanowski decidis utiligi siajn inĝenieriajn konojn kaj kompetentojn por ĝia plibonigo. Li fariĝis la aŭtoro kaj kunaŭtoro de sume 22 patentoj perfektigantaj la sistemon akiri kaj ekspluati sintezan gason. Li alportis kontribuon al establo de la Urba Gaskompanio en Novjorko kaj en 1882 kune kun grupo de usonaj financistoj, ĉefloke kun William Rockefeller, li establis la gaskompanion “The Equitable Gas Light Company” [ekvitejbl-gas lajt kompany], kiun li gvidis dum preskaŭ 13 jaroj.  Tre rapide la kompanio malfermis siajn filiojn aŭ dependajn kompaniojn en aliaj usonaj urboj, kiel Ĉikago, Balitmore, Detroit, Indianopolis, Lafayette  kaj Albany. Jerzmanowski mem kiel la unua poloj kaj tiam la unusola polo ektroviĝis en la rondo de usonaj milionuloj. Tio ebligis al Jerzmanowski realigi vastan filantropan agadon. Ĝi ne ligiĝis kun rekta mondonado, sed la helpo en trovo de laboro, en vastigo de profesiaj kapabloj, ankaŭ fare de la virinoj. Ankoraŭ dum la estado en Usono li senavare helpadis al la tiea pola kolonio partoprenante labrojn de la Nacia Pola Asocio poste prezidante ĝian Centran Komitaton de Bonfarado, li helpis en establo de la helpooficejo por polaj enmigrantoj, li subvenciis la Polan Legejon en Novjoroko, la polan Eklezion en Usono. En 1890 li eniris la estraron de la Nacia Muzeo en la svisa Rapperwill subvenciante ĝin per signifaj kvotoj kiel ĉefsponsoro. Dank’ al lia helpo povis kreiĝi en Krakovo Societo de Popolaj Lernejoj, sed lia donacemo subtenis krome la popolan gazetaron, instruistemon. Neniam li perdis la kontakton kun la malnova lando al kiu li ĉiam klopodis helprapidi kaze de neceso kaj regule vitadis Krakovon, kie li havis amikojn. En 1869-a jaro Erazm Jerzmanowski revenis al la lando kaj elkoĝis en la aĉetita  bieno en la apukrakova Prokocim, koncentriĝante pri sia senavara karitata agado, kiun apenaŭ eblas listigi.  En sia testamento li destis 1,2 milionojn da kronoj al la Akademio de Kapabloj, kiu sumo transformiĝis en la fondaĵon de la Premio de Erazm kaj Anna Jerzmanowski. La unua premio – kiu estis difinata kiel „la pola Nobel-premio” estis atribuita en 1915 al la krakova akiepiskopo, princo Adam Stefan Sapieha. Inter la sekvaj premiitoj troviĝas i.a. la nomoj de Henryk Sienkiewicz, Napoleon Cybulski, Ignacy Paderewski, Benedykt Dybowski. La premiatribuadon ĉesigis la 2-a mondmilito. Ĝia relanĉo okazis en 2009. Erazm Jerzmanowski mortis la 7-an de februaro 1909 kaj lia entombiga solenaĵo logis amason da homoj, kiuj volis honori lian memoron. Nun lian memoron flegas la Societo de Prokocim-amikoj.

El la elsendo 13.01.2017. Legas Barbara – 6’40”

--------------------------------------------------------------------------------

Transpanto de mano al homo senigita je ĉi tiu organo
[2017-01-17]
https://pola-retradio.org/2017/01/transpanto-de-mano-al-homo-senigita-je-ci-tiu-organo/

Kirurgoj el la Univiersitata Klinika Hospitalo en Vroclavo gvidata de doktoro Adam Domanasiewicz en decembro efektivigis senprecedencan operacion. Ili transplantis al 32-jaraĝa paciento, denaske senigita je mano, ĉi tiun organon de persono mortinta. Temis pri la unua ĉi-speca kazo, kiu havas enorman signifon por la evoluo de transplantologio kaj neurofiziologio. Ĝis nun estis asertite, ke tia operacio estas neebla, ĉar paciento kun denaska difekto ne havas ĉiujn anatomiajn elementojn, iuj estas subevoluintaj la aliaj tute ne ekzistas. Oni asertis krome, ke en la cerbo de tiuj personoj ne funkcias rilataj konektoj. La sukceso de la vroclavaj kirurgoj estas la unua paŝo por faligi tiun ĉi tezon kaj malfermas novajn eblojn por multaj personoj kun anatomiaj difektoj. La operacio daŭris 13 horojn. La paciento komencis movi la manon tuj post la vekiĝo. Dum la unua monato post la operacio li estis subigita al rekapabligado. La tutan tempon li troviĝos sub la kuracista protekto.

El la elsendo 17.01.2017. Legas Tomek – 1’11”

--------------------------------------------------------------------------------

Rimedoj por la plukontruo de la varsovia metroo
[2017-01-17]
https://pola-retradio.org/2017/01/rimedoj-por-la-plukontruo-de-la-varsovia-metroo/

Preskaŭ 1,9 miliardojn da zlotoj (pli ol 390 milionojn da eŭroj) ricevis Varsovio el la uniaj rimedoj por plukonstruo de la metroo. Ili estos destinitaj por elkonstruo de tri laŭvicaj stacioj al la okicdenta direkto kaj de aliaj tri al la nordo. El ili estos aĉetitaj krome 13 novaj vagonaroj, kiuj priservos ambaŭ metrooliniojn, okazos plukonstruo de la infrastrukturo kaj projektado de novaj metroosegmentoj.  La konstruado de la ses menciitaj stacioj jam daŭras. La metroo estas en Varsovio la plej rapida trafikilo. La unuan linion, kiu funkcias en la nuna formo ekde oktobro 2008 ĉiutage utiligas ĉirkaŭ 500 mil pasaĝeroj. La duan linion, kiu komencis funkcii en 2015 uzas ĉirkaŭ 100 mil pasaĝeroj tage. Ambaŭ metroolinioj kruciĝas ĉe la stacio Świętokrzyska.

El la elsendo 17.01.2017. Legas Tomek – 0’53”

--------------------------------------------------------------------------------

Ne,  por senlegalizo de la germana NPD
[2017-01-17]
https://pola-retradio.org/2017/01/ne-por-senlegalizo-de-la-germana-npd/

La germana Konstitucia Tribunalo ne konsentis marde, ke estu senlegalizita Nacia-Demokrata Partio de Germanio (NPD). Juĝistoj en Karsruhe rifuzis hodiaŭ la petpostulon de la dua ĉambro de la germana parlamento Bundesrat pri agadmalpermeso de ĉi tiu ekstrema partio. Pravigante la decidon la prezidanto de la germana Konstitucia Tribunalo diris, ke kvankam NPD gvidas agadon malamikan rilate la germanan konstitucion, tamen mankas konkretaj premisoj elmontrantaj, ke ĝia agado povus alkonduki al sukceso en batalo kontraŭ la reganta reĝimo. La tribunalo konfirmis, ke en unuopaj kazoj membroj kaj simpatiantoj de NPD uzas perforton, kio povas maltrankvligi, sed ne estas sufica argumento por la senlegalizo. La establita en 1964 NPD glorigas la 3-an Regnon kaj dubigas la postmilitajn limojn en Europo, inkluzive de la pola-germana. La plej grandan popularecon ĝi ĝuas en la orienta Germanio en la regionoj limantaj kun Pollando kaj Ĉeĥio. NPD havanta pli ol 5 mil membrojn ricevas por sia agado el la ŝtata buĝeto 1,4 milionojn da eŭroj jare.

El la elsendo 17.01.2017. Legas Milada – 1’38”

--------------------------------------------------------------------------------

Pola prezidenta paro en Israelo
[2017-01-17]
https://pola-retradio.org/2017/01/pola-prezidenta-paro-en-israelo/

Prezidento Andrzej Duda kune kun la edzino lastlunde komencis kelktagan oficialan viziton en Israelo kaj Palestino. La prezidento de Pollando renkontiĝas kun la prezidento kaj ĉefministro de Israelo kaj aliaj gravaj israelaj politikistoj. Andrzej Duda merkede vizitos Bet Leĥem kaj renkontiĝos ankaŭ  kun la prezidento de Palestino. Dum sia vizito en Israelo prezidento Duda havos du gravajn elpaŝojn. La unua en la Centro de Menachem Begin koncernos la polajn-judajn rilatojn historiajn kaj nuntempajn. Pri geopolitiko, minacoj kaj defioj por sekureco kaj paco la pola prezidento kiel honora gasto  parolos dum konferenco en Israela Konsilio por la Internaciaj Rilatoj, kiun ĝi organizas kune kun la Pola Instituto pri Internaciaj Rilatoj. Marde la pola prezidenta paro vizitis antaŭtagmeze Institon Yad Vashem. Posttagmeze prezidento Andrzej Duda distingis la eksan prezidanton de la Kneseto kaj eksan mabasadoron de Israelo en Pollando per Ordeno de la Blanka Aglo.

El la elsendo 17.01.2017. Legas Milada – 1’23”

--------------------------------------------------------------------------------

E_elsendo el la 17.01.2017
[2017-01-17]
https://pola-retradio.org/2017/01/e_elsendo-el-la-17-01-2017/

Podkasto: Ludu en nova fenestro | Elŝutu

La 616-a E-elsendo ĉe www.pola-retradio.org el la 17.01.2017:

– Hodiaŭ ni prezentas la laŭvican, ĉi-foje la 50-an fragmenton de la romano de la pola Nobel-premiito, Henryk Sienkiewicz „Quo Vadis” en la E-traduko de Lidia Zamenhof. – Niaj komencaj aktualaĵoj rilatas al la vizito de la pola prezidenta paro en Israelo, al la novaj rimedoj por pliaj segmentoj de la varsovia metroo kaj al la decido de la germana Konstitucia Tribunalo koncerne la ekstreman partion NPD. – En la scienca bultena ni informas pri la sukceso de polaj kirurgoj, kiuj en decembro transplantis manon al neplenlertulo senigita je ĉi tiu organo. – Muzike ni prezentas la kanton „Lando, mia lando” en la plenumo de Tova Ben-Cvi el la KD „Bonvenu paco”. – Aktualaĵoj kaj sciencbultena informo estas paralele legeblaj kaj aŭskulteblaj en la koncernaj rubrikoj de nia paĝo. Nia elsendo estas aŭskultebla ankaŭ pere de: https://www.youtube.com/results?q=pola+retradio&sp=CAI%253D .

--------------------------------------------------------------------------------

E_elsendo el la 20.01.2017
[2017-01-20]
https://pola-retradio.org/2017/01/e_elsendo-el-la-20-01-2017/

Podkasto: Ludu en nova fenestro | Elŝutu

La 617-a E-elsendo el la 20.01.2017 ĉe www.pola-retradio.org:

– En nia felietono pri koninda Pollando ni parolas pri la plej longa pola rivero Wisła [visŭa], Vistulo. La Jaron de Vistulo en 2017 proklamis la pola Sejmo; ankaŭ la aŭtoritatoj de la Mazovia Vojevodio, kies ĉefa urbo estas Varsovio. – La komenca kultura kroniko liveras informojn pri la jubileo de la operejo en Lodzo (la centra Pollando); pri la kreiĝanta portalo de Krakova Provinco dediĉita al la religiaj artverkoj de ĉi tiu regiono; pri interesa ekspozicio dediĉita al la finna arkitekturo kaj dezajno daŭranta en la varsovia Muzeo pri Historio de Polaj Judoj, kies konstruaĵo estas ankaŭ verko de finnaj arkitektoj. – La E-komunuma segmento liveras informojn pri la preparoj al la Internacia Infana Kongreseto 2017 ( http://bertosch.free.fr/iik2017/index.htm ); pri la laŭvica, kroata versio de la reta kurso „Esperanto je 12 tagoj” bazita sur la zagreba metodo ( http://learn.esperanto.com ); pri la nunjara eldono de la usona kursaro NASK ( nask.esperanto-usa.org/venonta ). Muzike akompanas nin populara pola kanto pri Vistulo kaj JoMo memoriganta la kanton „Lernu nun” el la KD JoMo Friponas eldonita de Vinilkosmo. – La akompana foto ĉe la programinformo prezentas foton pri Vistulo el la provizoj de la Interreto. – La kulturkronikaj informoj kaj la felietono estas paralele legeblaj kaj aŭskulteblaj en la koncernaj rubrikoj de nia paĝo. – Nia elsendo estas aŭskultebla ankaŭ en jutubo: https://www.youtube.com/results?q=pola+retradio&sp=CAI%253D

--------------------------------------------------------------------------------

Finna arkitekturo kaj dezajno en la varsovia Muzeo pri Historio de Polaj Judoj
[2017-01-20]
https://pola-retradio.org/2017/01/finna-arkitekturo-kaj-dezajno-en-la-varsovia-muzeo-pri-historio-de-polaj-judoj/

[Pro teknika kialo la transskribita teksto ne estas nun havebla sed ĝi estos videbla denove — espereble iam dum 2022. Dankon pro via pacienco.]

[Intertempe la sondosiero estas ĉiam ludebla per uzo de la kutima suba butono.]

El la elsendo 20.01.2017

--------------------------------------------------------------------------------

Jubileo de la Granda Teatro en Lodzo
[2017-01-20]
https://pola-retradio.org/2017/01/jubileo-de-la-granda-teatro-en-lodzo/

[Pro teknika kialo la transskribita teksto ne estas nun havebla sed ĝi estos videbla denove — espereble iam dum 2022. Dankon pro via pacienco.]

[Intertempe la sondosiero estas ĉiam ludebla per uzo de la kutima suba butono.]

El la elsendo 20.01.2017

--------------------------------------------------------------------------------

Portalo Religia heredaĵo de Krakova Provinco
[2017-01-20]
https://pola-retradio.org/2017/01/portalo-religia-heredajo-de-krakova-provinco/

[Pro teknika kialo la transskribita teksto ne estas nun havebla sed ĝi estos videbla denove — espereble iam dum 2022. Dankon pro via pacienco.]

[Intertempe la sondosiero estas ĉiam ludebla per uzo de la kutima suba butono.]

El la elsendo 20.01.2017

--------------------------------------------------------------------------------

Koninda Pollando: Vistulo
[2017-01-20]
https://pola-retradio.org/2017/01/koninda-pollando-vistulo/

Hodiaŭ ni invitas al Pollando por prezenti al vi gesinjoroj la riveron Wisła, Vistulon. La plej longa pola rivero, difinata kiel la reĝino de la polaj riveroj longas 1047 kilometrojn kaj trafluas la tutan landon de la sudo ĝis la nordo. Ĝiaj fontoj troviĝas en la suda Pollando ĉe la piedoj de Barania Góra (La ŝafa monto) kaj la akvoj enfluas Baltikon. La pola sejmo proklamis la 2017-an kiel Jaron de Vistulo, aldone oni solenas la 2017-an kiel la Jaron de Vistulo en Mazovio (la centra provinco de Pollando, en kiu troviĝas Varsovio). Tio estas ankaŭ la aparta okazo por paroli pri la rivero trafluanta dekojn da urboj, urbetoj, vilaĝoj, en kiu ĉiu intime estas kun ĝi ligita.  Sed por ĉiuj poloj Vistulo estas samtempe grava historia simbolo kaj sen troigo la plej pola inter la polaj riveroj. Kiel diris en iu el siaj paroladoj Johano Paŭlo la 2-a „Vistulo estas la rivero de ĉiuj polaj terenoj, la rivero de nia historio. De jarcentoj – antaŭ ol la nomo Pollando aperis en la historiaj kronikoj. [..] Vistulo estas silenta atestanto de la vivo de generacioj, de ilia enmondiĝado kaj forpasado. De ilia luktado, kelkfoje luktado je vivo kaj morto por konservi kaj protekti tion, kio hejmlanda, tion kio estas komuna atingaĵo kaj komuna heredaĵo…” La nomo Wisła havas pli ol 2 mil jarojn. La unua latina mencio devenas el la 7/5-a jaro antaŭ nia erao kaj troviĝas en la prezentita en Porticus Vipsania mapo de Marek Agrippa  kaj en Natura Historio de Plinio la Maljuna, kiu nomis la riveron Viscla. Ekde la 5-a jarcento ĝia nomo aperas en la formo Vistla. Iuj asertas,  ke la nomo estis transprenita fare de hindoeŭropaj popoloj de pli fruaj loĝantoj de ĉi tiuj terenoj. Vistulo estas strikte ligita kun la historio de Pollando kaj Varsovio. La unua burgo sur la tereno de Varsovio ekzistis en Jazdów kun spuroj el la 7/9-a jarcentoj, kiu akiris apartan signifon en la 13-a jarcento pro sia situo ĉe la kriĉiĝo de du gravaj itineroj el Pomerio tra Zakroczym kaj Czersk ĝis la Nigra Maro, do el la nordo ĝis la sudo kaj el la oriento-okcidenten. En la 16-a/17-aj jarcentoj, kalkulataj kiel la ora epoko  en la pola historio al la laŭvistula navigado oni donis apartan atenton pro ĝia navigebleco kaj pro la kreskanta eksterlanda konjunkturo je la pola lingvo kaj greno. En la centra segmento de la rivero la ĉefa rivera haveno fariĝis tiam Varsovio kaj ĝi havis unu el la plej grandaj riveraj flotoj en Eŭropo. Hodiaŭ Vistulo estas la lasta rivero de Eŭropo, kies panoramo en signifa parto redonas ĝian naturan, nereguligitan karakteron. La riverbranĉaro de Vistulo kovras du trionojn de la surfaco de Pollando. De la aliaj eŭropaj riveroj distingas ĝin harmonio kaj belaj pejzaĝoj ne plu videblaj ĉe riveroj jam reguligitaj, kion kaŭzas multbranca akvofluejo, vico da insuloj, sablozaj riverbranĉoj. En la akvoj de Vistulo daŭre eblas observi procezojn de la mempurigado, riĉiĝado je oksigeno, riverborda erodado. Vistulo gravas nuntempe en la eŭropa skalo pro sia ekologia koridoro laŭ la akso nordo-sudo. Ĝia natura karaktero ebligas la moviĝadon de vivaj organismoj inter Skandinavio kaj Afriko. Malgraŭ alikonstruo de la malsupra akvofluo Vistulo daŭre plenumas gravan rolon en la alilokiĝado de fiŝoj. Ankaŭ por diverspeciaj mamuloj  la spacoj inter kontraŭinundaj remparoj rolas kiel grava moviĝvojo. Pro parte natura karaktero de la dekstraborda Vistulo en la regiono de Varsovio la animaloj povas moviĝi libere laŭe de la rivero malgraŭ la ekologia baro, kiun formas la granda urbo. La plej granda riĉaĵo de Vistulo estas tamen la birdaro. Naskiĝas tie kaj nestas du trionoj de ĉiuj birdoj de Pollando, inkluzive de malofte aperantaj kaj minacitaj de formorto en Pollando kaj en Eŭropo. Nestas tie 95 procentoj de la polaj grizaj mevoj, 70 procentoj de malgrandaj ŝternoj kaj pli ol 50 procentoj ol hirundaj ŝternoj. Rifuĝejon trovas tie ankaŭ tre maloftaj riverbirdoj, kies kvanto sur la tuta teritorio de Pollado ne superas 60 parojn. Temas i.a. pri trielo, nigrakapa mevo, pigmea mevo kaj blankvanga ŝterno. Apud Vistulo en la regiono de Varsovio eblas renkonti pli ol 200 birdosepciojn. Pli ol en aliaj lokoj de Pollando kaj temas same pri akvaj, arbaraj kaj herbejaj birdospecioj. Krome tiu ĉi loko rolas kiel unu el la plej gravaj en Pollando kordiroj de la printempa-aŭtuna birdomigrado. Krom bridoj en Varsovio apud Vistulo, ofte en la urbocentro mem vivas kastoroj, lutroj aŭ alkoj. Se temas pri flaŭro kreskas tie ne sole plantoj delonge tie aperantaj, ĉar la tereno estas ankaŭ loko kie multaj surprizaj plantospecioj kiel tomatoj aŭ…  asparago transformiĝas en sovaĝajn formojn. Dum jaroj postmilite ĉe la vistulbordaj plaĝoj oni piknikis en Varsovio amase. La Sanktjohana nokto estis loganta al la rivero por lanĉi florkronojn kaj amuziĝi homamasojn. Sed sekvis longa paŭzo en tiu amika rilatado de varsovianoj kaj la rivero. Nur en la lastaj jaroj varmegaj someroj revenigis al la riverbordo amase la varsovianojn kaj turistojn, kion favoras la kreiĝanta kaj disfloranta infrastrukturo: kafejetoj, rapdmanĝejoj, restracietoj malfermaj por la publiko inter majo kaj septembro.  La plej populara plaĝo etendiĝas ĉe Poniatowski-ponto, sed krom ĝi estas kvar aliaj kaj krome multaj naturaj kaj tiel nomataj sovaĝaj plaĝoj, sen aparta infratsurkturo. Ili ĉiuj estis rekonitaj de National Geographic ektroviĝinte en la registro de la plej belaj tiaj lokoj en la mondo. Sed en Varsovio eblas ĝui la riprozon ĉe Vistulo ne nur surplaĝe. Eblas ĝui ĝin de sur biciklo. La laŭbordaj biciklaj vojetoj havas entute 40 kilomerojn. Laŭe de Vistulo kondukas krome en Varsovio la plej grandaj kurvojetoj por la ŝatantoj de aktiva ripozo, estas lokoj por praktiki aliajn sportojn. Por la  varsovianoj kaj gastoj de la pola ĉefurbo same allogaj kaj atrakciaj estas plukonstruiĝantaj promenejoj laŭe de Vistulo. Al unu el la apudvistulaj atrakciaĵoj kalkuliĝas sendube Parko de Fontanoj piede de la  Malnovurba Eskarpo inaŭgurita en 2011-a jaro. Ni aldonu fine, ke Varsovio estas la unusola urbo en Eŭropo pro la du troviĝantaj apudvistule terenoj de la programo Naturo 2000.

El la elsendo 20.01.2017. Legas Barbara – 9’08”

--------------------------------------------------------------------------------

Avantaĝoj de konsciaj sonĝoj
[2017-01-24]
https://pola-retradio.org/2017/01/avantagoj-de-konsciaj-songoj/

Nur malmultaj personoj havas la tiel nomatajn konsciajn sonĝojn. Dum ili la dormantaj personoj konscias, ke bildoj kreataj de ŝia/lia cerbo ne estas realo. Dank’ al tio ili povas en maniero preskaŭ laŭplaĉa gvidi eventojn vidatajn en la sonĝo kaj krei la nerealan spacon. Sciencistoj el Britio faris eksperimentojn kun personoj, kiuj estis dotitaj de ĉi tiu kapablo. Evidentiĝis, ke ili en iugrado superas homojn, kiuj ne kontrolas siajn sonĝojn. Sciencistoj el  Lincoln-Universitato en Britio dum unu monato ekzamenis grupon de 68 personoj en la aĝo de 18-25 jaroj. Parto de ili spertis la konsciajn sonĝojn dum la aliaj dormis normale. Evidentiĝis, ke homoj havantaj konsciajn sonĝojn manifestis pli grandan facilon solvi problemojn en la reala vivo. Partoprenantoj de la eksperimento estis ricevantaj sekvencojn de tri vortoj, kiujn ligis laŭvica vorto. Ilia tasko estis trovi vorton-ŝlosilon. Homoj, kiuj spertis konsciajn sonĝojn havis je 25 procentoj pli bononajn rezultojn ol la ceteraj membroj de la grupo. Kiel konkludis doktoro Patrick Bourke, kiu gvidis la eksperimenton, homoj, kiuj havas konsciajn sonĝojn povas en maniero multe pli natura fronti la problemon el alia perspektivo kaj trovi alian vojon por ĝin solvi. Onidire eblas tiun kapablon sonĝi konscie ellerni.

El la elsendo 24.01.2017. Legas Tomek – 1’36”

sc_tm_Avantagoj havi konsciajn songojn_01’36”

--------------------------------------------------------------------------------

Sano en la ĉefa rolo. 2017 – La Zamenhof-Jaro
[2017-01-24]
https://pola-retradio.org/2017/01/sano-en-la-cefa-rolo-2017-la-zamenhof-jaro/

Lastlunde en la Varsovia Centro de la Edukaj-Sociaj Novumoj okazis konferenco de oftalmologoj kaj specialistoj pri la problemoj de okulmalsanoj kaj viddifektoj „Sano en la ĉefa rolo. La 2017-a – la Zamenhofjaro. Kion vidis Zamenhof?”. Ĉiuj prelegoj estis dediĉitaj al  la vidproblemoj de lernejanoj, kiuj problemoj sekvas el naturaj kaŭzoj aŭ estas sekvo de malsanoj kaj lezoj. Specialistoj el diversaj varsoviaj altlernejoj kaj institutoj parolis ankaŭ pri la rilataj terapioj, modernaj metodoj forigantaj la viddifektojn, trejnadoj plibonigantaj la vidkvaliton, pri la dependecoj inter dieto kaj vidkapablo. La enkondukan prelegon pri D-ro Zamenhof kiel lingvisto kaj okulisto prezentis d-ro Maciej Jaskot, adjunkto en Fakultato de Humanismaj kaj Sociaj Sciencoj en la varsovia SWPS-Universitato.

El la elsendo 24.01.2017. Legas Milada – 1’16”

--------------------------------------------------------------------------------

Dulingvismo protektas cerbon kontraŭ demenco
[2017-01-24]
https://pola-retradio.org/2017/01/dulingvismo-protektas-cerbon-kontrau-demenco/

Cerboj de personoj dulingvaj pli ŝpareme mastras siajn provizojn, dank’ al kio ili pli longe konservas regulkonformajn konigajn funkciojn. Dum la esploroj de kanadaj sciencistoj, en kies kadro estis observataj cerboj de senjoroj, ekzamenatoj  estis petitaj koncentriĝi pri vidinformo (koloro de objekto), sed ignori samtempe la spacan informon (lokalizon de la objekto). La eksperimenton partoprenis du grupoj de kanadanoj. En la unua troviĝis sole franclingvuloj, en la alia dulingvuloj uzantaj kaj la francan kaj la anglan. Ĉiuj estis samaĝaj, 74 jaraj kaj havis similan klerignivelon. Kiel informis „Journal of Neurolinguistics” evidentiĝis, ke la cerboj de unulingvuloj engaĝis multajn cerbosferojn ligitajn kun la alifarado de vidinformoj, selekta koncentriĝo kaj kun funkcioj plenumi ĉi tiun taskon. La cerboj de la dulingvuloj ŝparis la energion engaĝante malpli da cerbosferoj, sed sferojn pli taŭgajn por plenumi la taskon. Ĉe la dulingvuloj oni konstatis ankaŭ pli grandan nombron de nervokonektoj en la cerboparto, kiu rolas en la alifarado de vid- kaj spac-informoj. Konkludante la kanadaj sciencistoj konstatis, ke tiu efika cerboselektiveco, kiu ebligas atingi la saman rezulton per malpli granda streĉo favoras regulkonforman funkciadon de cerbosferoj en >lobus temporalis<, kiu pro sia naturo estas subiĝema en la procezoj de maljuniĝado. I.a. dank’ al tio personoj dulingvaj en malpli granda grado estas minacitaj de demenco.

El la elsendo 24.01.2017. Legas Tomek – 1’42”

sc_tm_malsameco en la cerbolaboro de unu- kaj dulingvuloj_01’42”

--------------------------------------------------------------------------------

Cele al rekonstruo de la pola ŝipkonstrua industrio
[2017-01-24]
https://pola-retradio.org/2017/01/cele-al-rekonstruo-de-la-pola-sipkonstrua-industrio/

La Investa Fonduso Mars aĉetis la ŝipfarejon de Szczecin (la nord-okcidenta Pollando), kio estas la unua paŝo al la rekonstruo de la pola ŝipkonstrua industrio. Tiel apud Baltiko povas kreiĝi la plej granda kaj unu el la plej grandaj ŝipkonstruaj grupoj en Eŭropo. Tio alportos mezureblajn avantaĝojn al la tuta pola ŝipkonstrua industrio, kiu denove fariĝos grava piliero de la pola mastrumado. En Szczecin krom ŝipoj civilaj povos estonte esti konstruitaj la subakvaj ŝipoj por la Polaj Armeaj Fortoj, kun kio ligiĝos kreo de novaj laborlokoj. La aŭtoritatoj de la regiono substrekas aldone, ke dank’ al ĉi tiu investaĵo la Okcidenta Pomerio akiras gravan merkatistan partneron.

El la elsendo 24.01.2017. Legas Milada – 1’o1″

--------------------------------------------------------------------------------

Libroproponoj por la komuna pola legado
[2017-01-24]
https://pola-retradio.org/2017/01/libroproponoj-por-la-komuna-pola-legado/

Prezidento Andrzej Duda prezentis proponon de libroj el inter kiuj inaternaŭtoj elektos tiun, kiu estos legita dum la tradicia jam tago de la Nacia Legado 2017. La listo de la gravaj verkoj de la pola literaturo kreiĝis sekve de konsultoj kun la altlernejaj fakultatoj de la pola filologioa, Nacia Biblioteko kaj Instituto pri Literaturaj Esploroj de la Pola Sciencakademio. La interreta plebiscito daŭras ĝis la 15-a de februaro, la rezultoj estos anoncitaj la 21-an. Inter la proponoj troviĝas „Przedwiośnie” (Antaŭprintempo) de Stefan Żeromski, „Pamiętniki Soplicy” (La memorliro de Soplica) de Henryk Rzewuski, „Beniowski” de Juliusz Słowacki kaj „Wesele” (La nupto) de Stanisław Wyspiański. La unua Nacia Legado okazis en 2012, kiam la tuta Pollando legis la epikan poemon de Adam Mickiewicz „Sinjoro Tadeo”; Pasintjare temis pri „Quo Vadis” de Henryk Sienkiewicz.

El la elsendo 24.01.2017. Legas Barbara – 1’15”

--------------------------------------------------------------------------------

E_elsendo el la 24.01.2017
[2017-01-24]
https://pola-retradio.org/2017/01/e_elsendo-el-la-24-01-2017/

Podkasto: Ludu en nova fenestro | Elŝutu

La 618-a E-elsendo ĉe www.pola-retradio.org el la 24.01.2017:

– Niaj komencaj aktualaĵoj rilatas al rekonstrupaŝoj de la pola ŝipkonstrua industrio, al la plebiscito por verko legota dum la Tago de la Nacia Legado 2017 kaj al konferenco de oftalmologoj kaj specialistoj pri vidproblemoj, kiu okazis lastlunde en Varsovio sub la temo „Sano en la ĉefa rolo. La 2017-a – la Zamenhofjaro. Kion vidis Zamenhof?”. La rilata foto troviĝas en la rubriko „Fotogalerio”. – La scienca bulteno traktas la esplorojn pri cerbofunkciado de unu- kaj dulingvuloj kaj pri personoj, kiuj estas dotitaj per la kapablo havi konsciajn sonĝojn. – Nia sonsceno prezentas fragmenton de la prelego de Vera Barandovska-Frank pri >slava reciprokeco< farita dum la lingvopolitika konferenco de la landoj V4+: “Perspektivoj de lingva komunikado en EU”. – Muzike akompanas nin Maragan’ per fragmento de la kanto „Speguloj” el la KD „Kiu semas venton”. – Aktualaĵoj kaj sciencbultena informo estas paralele legeblaj kaj aŭskulteblaj en la koncernaj rubrikoj de nia paĝo. Nia elsendo estas aŭskultebla ankaŭ pere de: https://www.youtube.com/results?q=pola+retradio&sp=CAI%253D . La akompana al ĉi tiu informo foto devenanta el la Interreto prezentas la polan prezidentan paron dum la tago de la Nacia Legado.

--------------------------------------------------------------------------------

Distingitaj per Benemerenti
[2017-01-27]
https://pola-retradio.org/2017/01/distingitaj-per-benemerenti/

La Fondaĵo de Ewa Błaszczyk „Akogo” kaj Reprezenta Artensemblo de la Polaj Armeaj Fortoj fariĝis laŭreatoj de la ĉiujara premio de la Militista Diocezo Benemerenti. La fondaĵo „Akogo” estis honorita pro oferplena servo favore al homoj post neŭrologiaj lezoj kaj favore al iliaj familioj kaj proksimuloj, pro persista batalo por rajto vivi al infanoj en la stato de la postleza komato, pro nobla agado de specializa medicina centro kaj rekapabliga kliniko „Budzik” (vekhorloĝo). La reprezenta Artensemblo de la Polaj Armeaj Fortoj estis premiita pro valora kontribuo al la nacia kulturo, pro la popularigado de patriotaj kaj kristanaj valoroj, pro la flegado de glora memoro de la polaj militistaj fortoj. La premioj Benemerenti (Bone Meritiĝintaj) estas atribuataj de la Militista Diocezo de la Polaj Armeaj Fortoj ekde 1995 al personoj kaj institucioj, kiuj per sia agado donas la ateston pri la plej superaj valoroj, kiuj en la vivo de individuoj kaj socio estas vero kaj justeco. La nunjaran solenaĵon de la enmanigo de la premioj Benemerenti finis koncerto de la kristnaskaj kantoj en la plenumo de la Reprezenta Artensemblo de la Polaj Armeaj Fortoj.

El la elsendo 27.01.2017. Legas Maciek – 1’27”

--------------------------------------------------------------------------------

En Pollando okaze de la Memortago pri la viktimoj de holokaŭsto
[2017-01-27]
https://pola-retradio.org/2017/01/en-pollando-okaze-de-la-memortago-pri-la-viktimoj-de-holokausto/

Antaŭtage de la pasanta hodiaŭ Memortago pri la viktimoj de holokaŭsto la pola Sejmo omaĝis per minuto de silento la memoron de la viktimoj de la germana-nacisocialisma sistemo de ekstermo, en kies sekvo la vivon perdis milionoj da homoj. La hodiaŭaj ĉefsolenaĵoj  okazis sur la tereno de la eksa koncentrejo Aŭschwitz I kaj en Varsovio.  Ĉirkaŭ 40 eksaj malliberigitoj metis florkronon kaj torĉojn antaŭ la Mortomuro enirantre la terenon de la eksa koncentrejo kaj mortotendaro tra la pordo kun la surskribo „Arbeit macht frei”. Multaj portis tukojn kun blankaj-bluaj strioj, memorigantaj la koncentrejajn vestojn. En la centro de la florkrono el la blankaj-bluaj troviĝas ruĝa triangulo kun la lietro „P” simbolanta polajn politikajn malliberigitojn. La ĉefaj solenaĵoj en Varsovio en la ĉeesto de la ŝtataj, komunumaj, konfesiaj aŭtoritatoj, reprezentantoj de ambasadoj, sociaj kaj konfesiaj organizoj okazis antaŭ la Monumento de Getto-herooj. Krom meto de floroj kaj memoralvoko estis enprogramita teatra spektaklo.

El la elsendo 27.01.2017. Legas Barbara – 1’28”

--------------------------------------------------------------------------------

E_elsendo el la 27.01.2017
[2017-01-27]
https://pola-retradio.org/2017/01/e_elsendo-el-la-27-01-2017/

Podkasto: Ludu en nova fenestro | Elŝutu

La 619-a E-elsendo el la 27.01.2017 ĉe www.pola-retradio.org:

La koncentrejo-mortotendaro Auschwitz-Birkenau

– Ĉefloke ni referencas al la pasanta hodiaŭ 72-a datreveno de la germana mortotendaro Auschwitz-Birkenau establita sur la pola teritorio. Ni referencas al la genezo de ĉi tiu koncentrejo, sekve mortotendaro, ĝia rolo en la eksterma plano de la eŭropaj judoj, la hodiaŭaj solenaĵoj en Pollando. Ni prezentas ankaŭ poeziaĵon de Julius Balbin dediĉitan al la ekstermo de judoj. En la kultura kroniko ni informas pri la laŭreatoj de la premio Benemerenti kaj pri laŭvica eldonaĵo kun la tataraj fabeloj eldonota nunjare. – La E-komunuma segmento liveras informojn pri novaj platformoj por UEA membroj – aktivulo.net kaj forumo.esperanto.net . Ni informas pri la planoj de la Hispana E-Federacio lige kun la nunjara Zamenhof-Jaro. Muzike ni cite prezentas muzikon ligitan kun la memoro pri holokaŭsto, kun la kantarto de la ensemblo de la Polaj Armeaj Fortoj kaj fragmente ni memorigas la E-tangon en la plenumo de Tore Skogman. – La akompana foto ĉe la programinformo prezentas la enirpordon al la koncentrejo-mortotendaro Auschwitz-Birkenau. – Komencaj kaj la kultuktonikaj informoj estas paralele legeblaj kaj aŭskulteblaj en la koncernaj rubrikoj de nia paĝo. – Nia elsendo estas aŭskultebla ankaŭ en la jutubo: https://www.youtube.com/results?q=pola+retradio&sp=CAI%253D

--------------------------------------------------------------------------------

La 72-a datreveno de la liberigo de la germana koncentrejo Auschwitz-Birkenau
[2017-01-27]
https://pola-retradio.org/2017/01/la-72-a-datreveno-de-la-liberigo-de-la-germana-koncentrejo-auschwitz-birkenau/

Hodiaŭ pasas la 72-a datreveno de la liberigo de la germana koncentrejo Auschwitz-Birkenaŭ fare de la Ruĝa Armeo. En momento de la liberigo, la 27-an de januaro 1945 en la tuta koncentreja komplekso troviĝis ĉirkaŭ 7 mil 500 malliberigitoj. En la daŭro de ĝia ekzisto, do ne plenaj kvin jaroj,  estis murditaj  tie ĉirkaŭ unu miliono cent mil virinoj, viroj kaj infanoj, en plimulto judoj, sed krome poloj, sovetaj ostaĝoj, romaoj,  reprezentantoj de pli ol 20 nacioj. Germanoj establis la koncentrejon Auschwitz en 1940 por malliberigi en ĝi polojn. Auschwitz II-Birkenau kreiĝis du jarojn poste fariĝante ekstermejo de judoj.  Hodiaŭ la tuta koncentreja-mortotendara komplekso  rolas kiel simbolo de la ekstermo de judoj, martirologio de poloj, sovetuniajaj militkaptitoj kaj civitanoj de la okupaciataj de la Tria Regno eŭropaj ŝtatoj. La rekta kaŭzo por la establo de la koncentrejo estis la grandiĝanta nombro de amase arestataj poloj kaj plenŝtopiĝo de la ekzistantaj malliberejoj. Ilia unua transporto venis al Aŭschwitz la 14-an de junio 1940 el malliberejo en la loko Tarnów. Komence Auschwitz estis konceptita kiel plia koncentrejo establata de germanoj kaj funkciantaj jam ekde la 30-aj jaroj. Laŭ brita historiisto Paŭl Johanson temis en la periodo 1933-1945 pri 1634 koncentrejoj kaj iliaj filioj kaj pli ol 900 laborternaroj. Sur la tereno de la konkerita kaj okupaciita Pollando germanoj establis krom koncentrejoj en  la lokoj Sztuthof kaj Płazów  ankaŭ mortotendarojn en la lokoj Chełmo, Belżec, Sobibór, Majdanek, Treblinka. Ambaŭ rolojn plenumis Auschwitz-Birkenau, kiu ekde 1942 fariĝis ankaŭ unu el la centroj por definitiva solvo de la juda problemo. Tiuj lokoj de kelka tempo estas epitetataj en okcidentaj landoj, Usono kaj en Germanio mem kiel polaj koncentrejoj. Tiujn kalumniajn asertojn kontraŭas polaj aŭtoritatoj kaj pola leĝaro. Lastatempe eksplodis vasta socia kampanjo  en la reto, pere de sociaj portaloj kontraŭ ĉi tiuj mensogaj praktikoj. En tiu kunteksto ni memorigu, ke antaŭ unu semajno, la 20-an de januaro pasis la 75-a datreveno de la konferenco en Wansee apud Berlino organizita de la Ĉefa Sekurecoficejo de la Regno (RSHA), dum kiu estis prezentita la ekstermoplano de la eŭropaj judoj. En la protokolo de la konferenco troviĝas tabelo de la landoj kaj nombro de judoj el tiuj landoj destinitaj por baldaŭa deporto kaj nenigo. Temis ne sole pri landoj tiam okupaciitaj de Germanio, sed ankaŭ neutralaj rilate Germanion kiel Hispanio, Portugalio, Svislando aŭ Svedio. Estis menciitaj landoj tiam alianciĝintaj kun la 3-a Regno inkluzive de  tiaj  satelitaj landoj kiel Kroatio, Slovakio, Hungario, Italio aŭ parto de Francio sub Vichy-registaro, estis menciitaj judoj el Britio, kiu estis en la stato de milito kontraŭ Germanion. Por ekstermo estis destinitaj laŭ tiuj planoj 11 milionoj da judoj. Laŭ profesoro Jacek Leociak el la Esplorcentro pri Ekstermo de Judoj de la Pola Sciencakademio la germana ŝtato tutece engaĝiĝis en realigon de ĉi tiu plano: la civila kaj miltista administracio, fervojo, ministerioj pri la eksteraj kaj pri la internaj aferoj, organoj de terena administracio, polico, sekurecservo, gestapo, SS.

En novembro 2005 la Ĝenerala UNO-Asembleo proklamis Internacian Memortagon pri la Viktimoj de Holakaŭsto por omaĝi la juddevenajn viktimojn, murditajn dum la 2-a mondmilito indikante kiel la omaĝtagon la 27-an de januaro. Ni tamen devas hodiaŭ memori kaj omaĝi  ĉiujn viktimojn de la koncentrejo-mortotendaro Aŭschwitz-Birkenaŭ, la plej hororiga, infera loko, kiun germanoj establis dum la 2-a mondmilito sur la pola teritorio.

Julis Balbin:

Ĉu mi iam estis tie?

Ĉu mi iam povus imagi tion?

Ĉu mi iam kapablus trasuferi tiel?

Ĉu mi iam estus elteninta tiom?

Ĉu mi iam estus transvivinta gehenon tian?

Ĉu eble estis nura koŝmaro tia?

Ne, mi neniam estis tie…

Ne, tute ne eblas,

ke ĉio-ĉi estu vera,

ke ĉio-ĉi vere okazis tie,

en Eŭropo, en kvardekaj jaroj

de nia tiom progresinta jarcento.

El la elsendo 27.01.2017. Legas Barbara kaj Milada – 7’03”

--------------------------------------------------------------------------------

Nomoj de SS-viroj el Auschwitz publikigitaj
[2017-01-31]
https://pola-retradio.org/2017/01/nomoj-de-ss-viroj-el-auschwitz-publikigitaj/

Ĉirkaŭ ok kaj duona mil nomoj de SS-viroj el la eksa germana koncentrejo-mortotendaro Auchwitz troviĝas en bazo de donitaĵoj publikigita lastlunde de la krakova filio de la Instituto pri la Nacia Memoro. En la planoj estas kompletigo de ĉi tiu bazo per donitaĵoj el aliaj eksaj germanaj koncentrejoj sur la pola teritorio. La unua kaj unusola ĉi-speca prilaboraĵo en la mondo estas konsultebla ĉe la reta adreso www.truthaboutcamps.eu/zalogass . Tiuj donitaĵoj aperis en la reago je la uzado de la difino „polaj koncentrejoj” elmontrante la anaron de SS-funkciuloj. La originala bazo konsistas el kvar tabeloj enhavantaj personajn donitaĵojn, dokumentojn de justico, fotojn de SS-viroj kaj priskribon de la servado en la kocentrejo Auschwitz. Ĉi lasta estas ankoraŭ kompletigata kaj estos publikigita tuj post la verkonformiga proceduro. Ne aperas ankoraŭ listo de servantaj en Auschwitz virinoj, kiu ankaŭ estas ankoraŭ verkonformigata. La bazo aperas en la trilingva versio – pola, germana kaj angla. Detalajn donitaĵojn dume eblas legi nur germane (originalaj nomoj) kaj en la pola traduko. La publikigitaj donitaĵoj ne konsideras dokumentojn kreitajn aŭ kolektitajn ekster la limo de Pollando. Ili ĉiuj havas informan kaj ne valorigan karakteron. La bazo kreiĝis en la kunlaboro kun la Ŝtata Muzeo Auschwitz-Birkenaŭ, kiu prezentas la ligon al la adreso de la bazo en sia interreta paĝo.

El la elsendo 31.01.2017. Legas Krystyna – 1’45”

--------------------------------------------------------------------------------

La 30-jariĝo de la programo Erasmus
[2017-01-31]
https://pola-retradio.org/2017/01/la-30-jarigo-de-la-programo-erasmus/

La unia programo de la studenta interŝanĝo Erasmus solenas nunjare la jubileon de sia 30-jariĝo. Laŭ la plej novaj donitaĵoj de la Eŭropa Komisiono en 2015 partoprenis ĝin 678 mil personoj kaj ilia nombro daŭre kreskas. En la daŭro de la 30-jara funkciado el la programo de studenta interŝanĝo ĝi evoluis al komplika programo financanta agadojn celitajn por junularo, edukado kaj evoluigado de la eŭropa identeco. Krom projektoj ligitaj kun la supera eduksistemo ĝi rilatas ankaŭ al volontulado, sporto aŭ socia integriĝo de enmigrantoj. Vastiĝis ankaŭ la geografoa bazo de la programo  de 11 ŝtatoj en 1987 ĝis 33 aktuale (ĉiuj uniaj landoj plus Turkio, Makedonio, Norvegio, Islando kaj Liĥtenŝtejno). Pri la sukceso de la programo, kiu de tri jaroj nomiĝas Erasmus+ atestas tio, ke en 2015 kadre de la programo 678 mil personoj forveturis eksterlanden por studi, labori aŭ volontuli. Samjare la unio investis 2,1 miliardojn da eŭroj en 19 600 projektojn, kiujn partoprenis 69 mil organizoj. En 2015 la sfero de Erasmus+ krome vastiĝis. La unuan fojon en la historio oni ebligis al institucioj de la supera eduksistemo interŝanĝi studentojn kaj laborantojn kun ekstereŭropaj altlernejoj, kion utiligis pli ol 28 mil personoj. La plej multnombraj partoprenantoj de Erasmus devenas el Francio, Germanio kaj Hispanio. Aliflanke Hispanio, Germanio kaj Brito estas landoj, kiuj akceptas kadre de la programo plej multajn personojn. 94 procentoj de Erasmus-partoprenantoj asertas, ke dank’ al la programo gramdiĝis iliaj kapabloj kaj 80 procentoj sentis, ke la partopreno en la programo influis tre pozitive iliajn eblojn de profesia kariero. Ĉiu tria persono staĝanta kadre de Erasmus+-programo ricevas laborofreton de enteprreno, kiu akceptis lin/ŝin por la staĝo. Eŭropa Komisiono premisas, ke en la jaroj 2014-2020 la programon utiligos 4 milionoj da personoj. La buĝeto de Eramus + por tiu periodo egalas al 14,7 miliardoj da eŭroj.

El la elsendo 31.01.2017. Legas Milada – 1’40”

--------------------------------------------------------------------------------

Kolumpsitako  dekumas upuojn
[2017-01-31]
https://pola-retradio.org/2017/01/kolumpsitako-dekumas-upuojn/

La devenanta el Afriko kaj la Suda Azio rezistema, agresa kaj inteligenta kolumpsitako rapide adaptiĝas en la novaj vivcirkonstancoj. Nun ĝi vivas en 35 landoj de kvar kontinentoj kaj en Eŭropo mem eblas renkonti ĝin en pli ol 100 urboj, plej multnombre en Britio, Belgio, Nederlando kaj Germanio. Laŭ ekologoj tiuj allogaj, verdoplumaj birdoj tre negative influas la faŭnon, aparte  birdojn nestantajn en arbotrunkaj truetoj kiel eŭropaj sitoj, pegoj, sturnoj. La komunaj esploroj de polaj kaj israelaj sciencistoj elmontras, ke kolumpsitako grave minacas al la populacio de upupoj en Isrealo. D-ro Piotr Zduniak el la Biologia Fakultato de Adam Mickiewicz-Universitato en Poznano kun profesoro Reuven Yosef el Ben Gurion University of the Negev en Israelo kaj doktoro Michał Żmihorski el la Instituto pri Naturprotekto de la Pola Sciencakademio en Krakovo observis la invadon de kolumpsitakoj en Israelo kaj ĝian sekvon por la lokaj birdoj. Dum naŭ jaroj (de la dumila ĝis 2009) oni regule nombris birdojn sur kvar spacoj en la suda Israelo en la ĉirkaŭaĵoj de Ejlat. Samtempe estis ekzamenataj grandaj kompleksoj de daktilujoj plantataj de homo en la dezerto, kie vivas upupo la unusola birdospecio nature vivanta en ĉi tiu loko, bezonanta arbartrunkajn truetojn. En la jaroj 2002 kaj 2006 sur du terenoj oni komencis noti la aperon de  kolumpsitakoj, kio rezultis per forta malkresko de la upupopopulacio. Sur aliaj terenoj ne estis rimarkita tiu dependeco.  La afero konsistas en tio, ke same kolumpsitakoj kaj upuoj por kovi idojn bezonas arbotrunkajn truetojn. Israelo kiel lando signifagrade dezerta suferas ilian deficiton. Ĉar la kolumpsitakoj komencas la kovadon pli frue ol upupoj ili senigas tiel upupojn je kovolokoj. Laŭ d-ro Piotr Zduniak aldoniĝas al tio aliaj minacoj por upupo, kiel por specio impresiĝema je ŝanĝoj en la medio. Nome kolumpsitakoj plej ofte aperas en amaso, ili estas fortaj kaj inteligentaj kaj kapablas esti tre agresaj rilate al aliaj birdospecioj. Konkurante pri teritorio ili kapablas forpeligi kaj kelkfoje eĉ mortigi aliajn birdojn. Agresaj kolumpsitakoj influas ankaŭ la konduton de la aliaj birdoj trudate al ili daŭran singardemon tiel negative influate ilian efektivan sinnutradon.

El la elsendo 31.01.2017. Legas Maciek – 2’55”

sc_mj_Kolumpsitakoj dangeraj por indigenaj specioj_02’55”

--------------------------------------------------------------------------------

E_elsendo el la 31.01.2017
[2017-01-31]
https://pola-retradio.org/2017/01/e_elsendo-el-la-31-01-2017/

Podkasto: Ludu en nova fenestro | Elŝutu

La 620-a E-elsendo ĉe www.pola-retradio.org el la 31.01.2017:

– Kun profunda malĝojo ni ricevis la informon pri la forpaso de konata pola esperantisto, sociologo okupiĝanta rilate la E-komunumon pri la sociologiaj aspektoj de la E-movado, d-ro Zbigniew Galor. En nia elsendo ni prezentas fragmenton de lia prelego pri tiu temo prezentitan dum la Interlingvistika Simpozio en Poznano en 2011. – En la komencaj aktualaĵoj ni informas pri subvencio por elkonstrui tunelon inter la polaj insuloj Uznam kaj Wolin; pri aperigita en la reto bazo de ĉ. 8 kaj duona mil nomoj de SS-viroj el la eksa germana koncentrejo-mortotendaro Auschwitz ( www.truthaboutcamps.eu/zalogass ); pri la jubileo de la programo Erasmus. – La scienca bulteno liveras informojn pri polaj-israelaj esploroj pri agresa kolumpsitako dekumanta la israelajn upupojn. – Hodiaŭ kantas Amindaj „Ĉar ankoraŭ batas via kor’”, la kanzonon devenantan de ilia KD eldonita de Vinilkosmo. – Aktualaĵoj kaj sciencbultena informo estas paralele legeblaj kaj aŭskulteblaj en la koncernaj rubrikoj de nia paĝo. Nia elsendo estas aŭskultebla ankaŭ pere de: https://www.youtube.com/results?q=pola+retradio&sp=CAI%253D . La akompana al ĉi tiu informo foto devenanta el wikipedia.pl prezentas la mapon de la insuloj Uznam kaj Wolin, kiujn ligos submara tunelo.

--------------------------------------------------------------------------------

La festivalo „Opera Rara” (2017)
[2017-02-03]
https://pola-retradio.org/2017/02/la-festivalo-opera-rara-2017/

[Pro teknika kialo la transskribita teksto ne estas nun havebla sed ĝi estos videbla denove — espereble iam dum 2022. Dankon pro via pacienco.]

[Intertempe la sondosiero estas ĉiam ludebla per uzo de la kutima suba butono.]

El la elsendo 03.02.2017

--------------------------------------------------------------------------------

500-paĝa eldono de prozaĵoj de Wisława Szymborska
[2017-02-03]
https://pola-retradio.org/2017/02/500-paga-eldono-de-prozajoj-de-wislawa-szymborska/

[Pro teknika kialo la transskribita teksto ne estas nun havebla sed ĝi estos videbla denove — espereble iam dum 2022. Dankon pro via pacienco.]

[Intertempe la sondosiero estas ĉiam ludebla per uzo de la kutima suba butono.]

El la elsendo 03.02.2017

--------------------------------------------------------------------------------

Restaŭrigita varsovia naskiĝdomo de Maria Skłodowska-Curie
[2017-02-03]
https://pola-retradio.org/2017/02/restaurigita-varsovia-naskigdomo-de-maria-sklodowska-curie/

[Pro teknika kialo la transskribita teksto ne estas nun havebla sed ĝi estos videbla denove — espereble iam dum 2022. Dankon pro via pacienco.]

[Intertempe la sondosiero estas ĉiam ludebla per uzo de la kutima suba butono.]

El la elsendo de 03.02.2017

--------------------------------------------------------------------------------

E_elsendo el la 03.02.2017
[2017-02-03]
https://pola-retradio.org/2017/02/e_elsendo-el-la-03-02-2017/

Podkasto: Ludu en nova fenestro | Elŝutu

La 621-a E-elsendo el la 03.02.2017 ĉe www.pola-retradio.org:

– En nia ĉi-semajna felietono pri koninda polo ni memorigas la figuron de la forpasinta antaŭ kvin jaroj pola Nobel-premiitino, Wisława Szymborska prezentante krome en la E-traduko ŝian poeziaĵon „Kato en malplena loĝejo” verkitan post la morto de ŝia partnero Kornel Filipowicz en 1990. – La kultura kroniko alportas informon ligitan kun la heroino de nia felietono, pri la 500-paĝa eldono de ŝiaj prozaĵoj en Hispanio. Ni informas krome pri la nunjara eldono de la festivalo „Opera Rara” en Krakovo kaj pri restaŭrigita varsovia naskiĝdomo de Maria Skłodowska-Curie, kies 150-a naskiĝdatreveno pasos ĉi-aŭtune. – La E-komunuma segmento liveras informon pri la komenciĝonta venontsemajne 5-monata reta E-kurso de la Jagelona Universitato sub la gvido de Maria Majerczak ( goo.gl/x1S3AH ). Ni informas pri novaj skanaĵoj de Esperantomuzeo kaj de la Kolekto por Planlingvoj ( http://data.onb.ac.at/rec/AC01262463 ; http://data.onb.ac.at/rec/AC02733406 ; http://data.onb.ac.at/rec/AC00650520 ; http://data.onb.ac.at/rec/AC05003222 ; http://data.onb.ac.at/rec/AC03512601 ) kaj Verkoj (1887-1930) de Ludoviko Zamenhof: https://www.onb.ac.at/eo/bibliothek/sammlungen/kolekto-por-planlingvoj/digitaj-dokumentoj/ludwik-l-zamenhof/ – Muzike ni informas pri la fizika aperigo de la KD “Kreaktiva” de Jonny M mendebla ĉe Vinilkosmo. – La akompana foto ĉe la programinformo prezentanta la enmanigon de Nobel-premio al Wisława Szymborska devenas el la Interreto. – La kulturkronikaj informoj kaj la felietono estas paralele legeblaj kaj aŭskulteblaj en la koncernaj rubrikoj de nia paĝo. – Nia elsendo estas aŭskultebla ankaŭ en la jutubo: https://www.youtube.com/results?q=pola+retradio&sp=CAI%253D

--------------------------------------------------------------------------------

Wisława Szymborska
[2017-02-03]
https://pola-retradio.org/2017/02/wislawa-szymborska/

Antaŭ kvin jaroj la 1-an de februaro 2012 en sia krakova hejmo mortis havante 89 jarojn la plej lasta pola Nobel-premiito pri literaturo, Wisława Szymborska. 6 jarojn pli frue ŝi ricevis la prestiĝan Nobel-premion pro „poezio, kiu kun ironia precizeco ebligas al la historia kaj biologia kunteksto reliefiĝi en fragmentoj de la homa realo”, oni legas  en la pravigo. En sia prelego prezentita dum la enmaniga solenaĵo ŝi i.a. diris: „La hodiaŭa poeto estas skeptita kaj suspektema eĉ – kaj eble unuavice – rilate sin mem. Malvolonte tiu deklaras publike, ke estas poeto – kvazaŭ iom hontus pro tio. Sed en nia brua epoko estas multe pli facile deklari proprajn malvirtojn, se nur ili prezentiĝas efekte, kaj multe malpli facile virtojn, ĉar ili estas pli profunde kaŝitaj kaj kiujn oni mem neĝisfine kredas… En diversaj enketoj aŭ interparoloj kun hazarde renkontitaj homoj, kiam poeto jam nepre devas difini sian okupon, tiu sciigas ĝenerale „literaturisto” aŭ menciis la krome praktikatan laboron.” Tiuj ĉi vortoj tre trafe prezentas Vislava-n Szymborska mem. Szymborska ne ŝatis interparolojn pri literaturo aŭ pri la sekretoj de la poezia stablo premisante, ke aŭtoro devus esprimis sin ekskluzive per siaj verkoj. La plej proksima al ŝi medio konsideris ŝin kiel modestan personon, kiu aprecas trankvilon. Ŝi ne toleris demandojn intervenantajn en kies ajn privatecon, kaj ankaŭ mem ne konsideris ĝuste paroli pri si mem. „Mi pri la aferoj personaj paroli ne volas, sed ankaŭ  mi ne ŝatis, ke aliaj parolu” – ŝi konfesis al la aŭtorinoj de libro al ŝi dediĉita Anna Bikont kaj Joanna Szczęsna. Szymborska malbone toleris ĉiajn pufdemonstrojn aŭ solenadojn,  do situacio, en kiu post la anonco iĝi Nobel-premiitino ŝi devis doni multajn intervjuojn estis por ŝi iom traŭma travivaĵo, kiun ŝiaj amikoj difinis kiel „stokholman tragedion”.  Wisława Szymborska naskiĝis la 2-an de julio 1923 en la loko Bnin apud Kórnik en la okcidenta Pollando kiel filino de Wincenty Szymborski, administranto de la bienoj de grafo Władysław Zamoyski,  kaj Anna Maria, familie Rottermund. Komence de ŝia naskiĝjaro la gepatroj translokiĝis tien el Zakopane (la suda Pollando) kun la celo ordigi la financajn aferojn de la tieaj havaĵoj de grafo Zamoyski. Post lia morto en 1924 la familio translokiĝis al Torun kaj ekde 1929 ili loĝis jam en Krakovo kaj kun Krakovo Szymborska ligis sian tutan vivon. Tie ŝi frekventis gimnazion, subiĝis al la abiturienta ekameno, tie ŝi daŭrigis la lernadon dum la 2-a mondmilito en sekretaj kursoj kaj fine por eviti trudveturigon en la Regnon ŝi fariĝis en 1943 fervojista oficistino. En tiu periodo ŝi komenis verki rakontojn, malpli ofte poeziaĵojn. Kiel poetino Wisława Szymborska debutis en 1945 sur la paĝoj de la periodaĵo „Dziennik Polski” per la versaĵo „Mi serĉas la vorton”. Ekde tiam ŝi partoprenis la literaturistan vivon de Krakovo kaj samjare kun sia debuto ŝi komencis unue filologiajn studojn pri la pola lingvo, sekve pri sociologio.  Ŝia geedziĝo en 1948 kun poeto Adam Włodek daŭris nur ses jarojn kaj kvankam finiĝis per divorco ambaŭ konservis amikajn rilatojn. Por Wisława Szymborska tiu ĉi periodo signifis ĉiutagan kontakton kun literaturistaj elstaruloj. 15 jarojn post la divoro ŝi ligis sian vivon kun verkisto Kornel Filipowicz, al. kelkaj niaj auskultantoj konata pro la prezentita en nia programo „Morto en ZOO-ĝardeno”. Post lia morto en 1990 Szymborska verkis poeziaĵon „Kato en malplena loĝejo”. Ŝia unua poezivolumeto „Kial ni vivas” aperis en 1952 en la eldonkooperativo „Czytelnik”. Samjare ŝi fariĝis membro de Asocio de Polaj Literaturistoj. Unu jaron poste ŝi fariĝis estro de poezifako en „Życie Literackie” en kiu ŝi ankaŭ publikigadis siajn felietonojn „Nedevigaj legaĵoj”, kiuj poste aperis libroforme. Ekde 1988 ŝi estis membro de Pen Club, unu jaron pli poste ŝi kunfondis Societon de Polaj Verkistoj. La plej grava riproĉo direktata al Szymborska estas la fakto, ke en la frua periodo de Popola Pollando, en la periodo de stalinismo, ŝi apartenis al la grupo de entuziasmaj popularigantoj de socrealismo, kiuj kiel plej gravan taskon de literaturo konsideris subtenadon de la reganta reĝimo enkondukanta en la pola socio socialistan reĝimon. Ŝi reagis poste je tiu riproĉe per sincera konfeso. „Nu, kion diri, mi estis malbonŝanca iam esti juna persono, facilanima, malbone orientiĝanta pri la aferoj, kiujn mi tuj devintus ĝuste taksi. Kelkiuj tamen rajtas juĝi min pro tio severe, se efektive ili estas konvinkitaj, ke kelkaj versaĵoj tiam skribitaj pli pesas ol ĉio alia, kion mi verkis poste”. La poeziaĵoj de Wisława Szymborska aperis ankaŭ en la E-traduko en la kolekto „Mi inventas la mondon” eldonita de Bialistoka E-Societo en 2015. La poezia verkaro de Wisława Szymborska laŭnombre estas relative modesta konsistanta el ĉ. 350 poeziaĵoj. Ilia enhavo ŝajne simpla estas ege trafa. Antaŭ la ricevita Nobel-premio ŝia kreado ne estis alte taksata, nek tre vaste konata kvankam ŝiaj libroj estis tradukitaj en 42 lingvojn. Multaj el ŝiaj poezipensoj enpenetris la ĉiutage uzatan lingvon, kiel „Nenio du fojojn okaza” au „La vivo – spektaklo sen ĝenerala provo”.

El la elsendo 03.02.2017. Legas Barbara – 8’09”

--------------------------------------------------------------------------------

Angela Merkel vizite en Varsovio
[2017-02-07]
https://pola-retradio.org/2017/02/angela-merkel-vizite-en-varsovio/

La estro de la germana registaro, kanceliero Angela Merkel marde faras viziton en Varsovio. Laŭ PAP-agentejo per sia vizito kancelieto Angela Merkel donas la signalon, ke ŝi interesiĝas pri plibonigo de la rilatoj kun Pollando, pri kio interesiĝas ankaŭ la pola registaro. Angela Merkel renkontiĝas kun la pola ĉefministro Beata Szydło kaj la prezidento de Pollando Andrzej Duda. La temo de la interparoloj estas i.a. aferoj ligitaj kun la eksterlanda politiko kaj politiko de sekureco. En la planoj de ŝia vizito estas renkontiĝo kun la prezidanto de Juro kaj Juteco, Jarosław Kaczyński, kiu estis planita en la varsovia hotelo Bristol. Inviton por la renkontiĝo kun la germana kanceliero en la germana ambasado en Varsovio ricevis la prezidantoj de la opoziciaj partioj Civitna Platformo, Grzegorz Schetyna kaj de la Pola Kamparana Partio, Władysław Kosiniak-Kamysz. Ambaŭ partioj kune kun CDU, kiun prezidas Angela Merkel troviĝas en la Eŭropa Kamparana Partio.

El la elsendo 07.02.2017. Legas  Milada – 1’24”

--------------------------------------------------------------------------------

Pola Agentejo por Investaĵoj kaj Komerco
[2017-02-07]
https://pola-retradio.org/2017/02/pola-agentejo-por-investajoj-kaj-komerco/

Lastvendrede komencis funkcii Pola Agentejo por Investaĵoj kaj Komerco. Ĝia celo estas ne nur la logado de investaĵoj al Pollando, sed ankaŭ helpo al polaj firmaoj eksterlande. Tiucele en la planoj estas funkciigo de 70 polaj komercaj oficejoj en la tuta mondo por diversigi la polan eksporton. La unua funkcias jam en Nairobi, kie i.a. instaliĝis la pola Ursus. Tio estis ebla dank’ al speciala kredito donita de la pola registaro. La agentejo ne rezignas ankaŭ pri sia origina misio, tio estas helpado al la eksterlandaj investantoj, kiujn bezonas la pola mastrumado. Nunjare la buĝeto de la Agentejo egalas al 36 milionoj da zlotoj, perspektive ĝi kreskos ĝis 200 milionoj.

El la elsendo 07.02.2017. Legas Krystyna – 0’54”

--------------------------------------------------------------------------------

Mirigaj novumoj de polaj sciencistoj
[2017-02-07]
https://pola-retradio.org/2017/02/mirigaj-novumoj-de-polaj-sciencistoj/

Kolektivo de fizikistoj el Pollando kaj Nederlando deklaras turnopunktan, principan ŝanĝon en la registrado kaj konservado de informdonitaĵoj. Ili sukcesis ĉirkaŭiri la barieron en la rapideco kaj efikeco de la informregistrado. Dank’ al iliaj metodoj la donitaĵojn sur la dura disko eblos registri miloble pli rapide ol nun kaj krome dank’ al pli pova memoro la komputiloj estos pli energiŝparaj. Temas pri la tiel nomata teknologio de malvarma ultrarapida fotomagneta registro, pri kio informis la prestiĝa „Nature”. Ekzemple dank’ al la apliko de la prilaborita de ili teknologio, grafikaĵoj 3D, kies alifarado daŭras kelkdek minutojn estas generitaj dum kelkaj sekundoj. Ankaŭ tekokomputiloj povas labori pli longe sen kroma ŝargado. Laŭ polaj kaj nederlandaj sciencistoj la vera povo de ĉi tiu solvo estos aparte rimarkebla en grandegaj servilejoj aŭ centroj por la konservado kaj alifarado de donitaĵoj. Iliakaze ŝparoj – se temas same pri tempo,  kiel ankaŭ pri energio necesa por la registrado kaj alifarado de donitaĵoj – estas vere revolucia.

El la elsendo 07.02.2017. Legas Tomek – 1’14”

sc_tm_Revoluciaj sangoj enregstrado de informdonitajoj_01’14”

--------------------------------------------------------------------------------

Duvalvulo helpos esplori klimaton
[2017-02-07]
https://pola-retradio.org/2017/02/duvalvulo-helpos-esplori-klimaton/

Duvalvulo apartenanta al la specio Mercenaria vivas eĉ 500 jarojn helpos kompreni la klimatoŝanĝojn okazintajn dum jarcentoj. Analizante la kemian konsiston de la ringoj aldoniĝantaj sur la konko de la duvalvulo Macenaria macenaria sciencistoj rekonstruos la klimatajn ŝanĝojn, kiuj okazis en la daŭro de la lastaj jarcentoj en la regiono de la norda parto de Atlantiko. La  aldoniĝantaj ringoj de la duvalvulo memorigas la ringojn en la arbotrunkoj, kiuj ankaŭ regule aldoniĝas. Laŭ sciencistoj el la britaj universitatoj en Cardiff kaj Bangor University antaŭ la industria epoko – ĝis la 1800-a jaro – la signifaj ŝanĝoj en Atlantiko estis elvokitaj ekskluzive per la funkciado de la Suno kaj vulkanoj. Post la 1800-a jaro, samtempe kun la komenco de la industria epoko la akvojn de la norda Atlantiko influis ankaŭ atmosfero, tio estas la forcejaj gasoj produktataj de la homo. Analizante la konkojn de marcenaria sciencistoj kapablas analaizi la historion de la klimato eĉ kun unumiljara retrorigardo. Tiuj esploroj estas esencaj por kompreni kiamaniere ŝanĝoj en la regiono de la norda Atlantiko povas influi klimaton kaj veteron en la norda hemisfero.

El la elsendo 07.02.2017. Legas Tomek – 1’23”

sc_tm_Duvalvulo helpos sekvi klimatsangojn_01’23”

--------------------------------------------------------------------------------

E_elsendo el la 07.02.2017
[2017-02-07]
https://pola-retradio.org/2017/02/e_elsendo-el-la-07-02-2017/

Podkasto: Ludu en nova fenestro | Elŝutu

La 622-a E-elsendo el la 07.02.2017 ĉe www.pola-retradio.org:

– Hodiaŭ ni invitas ĉiujn literaturamantojn sekvi la 51-an fragmenton de la romano de la pola Nobel-premiito Henryk Sienkiewicz „Quo Vadis” en la E-traduko de Lidia Zamenhof. – La komencaj aktualaĵoj rilatas al la marda vizito de la germana kanceliero Angela Merkel en Varsovio. Ni informas krome pri la ĵus komencinta funkcii Pola Agentejo por Investaĵoj kaj Komerco. – La sciencbultenaj temoj rilatas al la revolucia metodo prilaborita de la polaj-nederlandaj sciencistoj ebliganta miloble pli rapide registri la informdonitaĵojn kaj al la duvalvulo macenaria macenaria, kiuj helpos sekvi la ŝanĝojn de la klimato. La aktualaĵoj kaj la scienbultenaj temoj estas paralele legeblaj kaj aŭskulteblaj en la koncernaj rubrikoj de nia paĝo. Nia elsendo estas aŭskultebla ankaŭ en jutubo pere de: https://www.youtube.com/results?q=pola+retradio&sp=CAI%253D. La akompana al ĉi tiu informo foto devenas el la Interreto kaj prezentas la duvalvulon macenaria macenaria, pri kiu ni porolas en la scienca bulteno.

--------------------------------------------------------------------------------

Interparolo kun prof. Ilona Koutny (februaro 2017)
[2017-02-10]
https://pola-retradio.org/2017/02/interparolo-kun-prof-ilona-koutny-februaro-2017/

Hodiaŭ gastas antaŭ nia mikrofono prof. Ilona Koutny kun kiu ni interparolis en Poznano en la daŭro de la februara sesio de la Interlingvistikaj Studoj, i.a. okaze de la Simpozio pri la Lernanto en la lingvolerna procezo. Komence, Barbara transdonas siajn kondolencojn kaj tiujn de la geaŭskultantoj pri la morto de la edzo de Ilona Koutny, Zbigniew Galor , El la elsendo 10.02.2017 – 8’59”

--------------------------------------------------------------------------------

Valorega manuskripto denove en Pollando
[2017-02-10]
https://pola-retradio.org/2017/02/valorega-manuskripto-denove-en-pollando/

[Pro teknika kialo la transskribita teksto ne estas nun havebla sed ĝi estos videbla denove — espereble iam dum 2022. Dankon pro via pacienco.]

[Intertempe la sondosiero estas ĉiam ludebla per uzo de la kutima suba butono.]

El la elsendo 10.02.2017

--------------------------------------------------------------------------------

E_elsendo el la 10.02.2017
[2017-02-10]
https://pola-retradio.org/2017/02/e_elsendo-el-la-10-02-2017/

Podkasto: Ludu en nova fenestro | Elŝutu

La 623-a E-elsendo el la 10.02.2017 ĉe  www.pola-retradio.org:

Valora manuskripto denove en Pollando

– Hodiaŭ gastas antaŭ nia mikrofono prof. Ilona Koutny kun kiu ni interparolis en Poznano en la daŭro de la februara sesio de la Interlingvistikaj Studoj, i.a. okaze de la Simpozio pri la Lernanto en la lingvolerna procezo. – La kultura kroniko liveras informojn pri valorega aĉeto de la Nacia Biblioteko de la 15-jarcenta kodo enhavanta la liturgian propetan preĝon en la katolika Eklezio aranĝitan laŭ la brevieraj horoj, kiu perdiĝis en la fino de la 19-a jarcento. – La E-komunuma segmento informas pri la novaj redaktoroj de UEA-revuo „Esperanto”, kiuj fariĝos ekde la aprila numero Dima Ŝevĉenko kaj Anna Striganowa. Muzike akompanas nin Helena Melnikova per fragmento de sia kanzono „Vi rakontu”. – La akompana foto ĉe la programinformo devenanta el la Interreto prezentas la plej novan aĉeton de la Nacia Bilbioteko, kiu jam bitigita troviĝas en la paĝo de la bita Nacia Bilbioteko – Polona.pl . – La kulturkronika informo estas paralele legebla kaj aŭskultebla en la koncerna rubriko de nia paĝo. Aparte aŭdiĝas interparolo kun prof. Ilona Koutny. – Nia elsendo estas aŭskultebla ankaŭ en la jutubo: https://www.youtube.com/results?q=pola+retradio&sp=CAI%253D

--------------------------------------------------------------------------------

La senmova vivstilo akcelas maljuniĝadon
[2017-02-14]
https://pola-retradio.org/2017/02/la-senmova-vivstilo-akcelas-maljunigadon/

Senjorinoj pasigantaj sidmaniere pli ol 10 horojn tage kaj malaktivaj fizike estas je 8 jaroj pli aĝaj, ol tiuj kiuj estas moviĝemaj. Tiun konkludon tiris sciencistoj el la Kalifornia Universitato en San Diego analizinte donitaĵojn pri preskaŭ 1500 virinoj en la aĝo de 64 ĝis 95 jaroj, kiuj partoprenis vastskalan analizon WHI (Women’s Health Initiative). La senjorinoj estis plenigantaj tabelojn pri sia sano kaj fizika dispozicio kaj dum sep tagoj portis ĉe karpeo rubandojn kun enmuntita akcelometro. Analizinte donitaĵojn sciencistoj konstatis, ke la virinoj kiuj sidpozicie pasigis ĉiutage pli ol 10 horojn kaj engaĝiĝis en fizikan aktivadon kun modera intenseco dum malpli ol 40 minutoj havis malpli longajn telomerojn, tio estas finaĵojn de kromosomoj. Telomeroj estas ofte komparataj al la finaĵoj de laĉoj, kiuj protektas kromosomojn kontraŭ difektoj kaj perdo de la genetika materialo dum la ĉeldividiĝado. Kiam telomeroj fariĝas tro mallongaj ili maljuniĝas kaj formortas. Tiun procezon influas tamen la vivstilo kaj tiaj faktoroj kiel obezeco. Ankaŭ la fumado povas akceli la procezon de la mallongiĝado de telomeroj. Kiel informis Usona Epidemologia Revuo tio kauzas  tumorojn, diabeton kaj malsanojn de la korangia sistemo.

El la elsendo 14.02.2017. Legas Tomek – 1’35”

sc_tm_Minacoj de la senmova vivmaniero de senjorinoj_01’35”

--------------------------------------------------------------------------------

Dormapneo
[2017-02-14]
https://pola-retradio.org/2017/02/dormapneo/

Unu kaj duona milionoj da poloj suferas dormapneon, danĝeran dormoperturbon, sed en plimulto ne scias pri tio, ĉefe pro limigita ebleco diagnozi la malsanon.  Ekzameno konfirmanta dormapneon (polisomnografio, en kies daŭro oni faras EEG, EMG, EOG-ekzamenojn)  estas malfacile alirebla, multekosta, postulanta necesan aparataron kaj prizorgadon de paciento. En Pollando subiĝis al. ĝi ĉ. 14 mil personoj. Laŭ doktoro Zbigniew Gaciong plibonigon en la alireblo al diagnozado de dormapneo eblus akiri aplikante pli simplan kaj pli ol duoble malpli kostan metodon, kiun de kelka tempo eblas okazigi en hejmaj kondiĉoj. Ebligas tion aranĝaĵo prilaborita de polaj inĝenieroj kaj sciencistoj el Infoscan Akcia Kompanio. Temas pri la unua ĉi-speca aranĝaĵo en Europo. Kvankam pri dormapneo oni parolas kutime en la kunteksto de ronkado, tamen ne ĉiu ronkulo suferas dormapneon. Dormapneo estas tre serioza sanperturbo, kiu karakteriziĝas per ofta spirhalto dum la dormo, kion favoras troa pezo kaj obezeco. Ĝi aperas rezulte de la labileco de gorĝomuskoloj kaj aerblokado de pulmoj pro fleksiĝo de ilia mola parto. Dirante rekte homoj suferantaj dorapneon sufokiĝas dum dormo, kaj post vekiĝo sentas kapdolorojn, estas dormemaj kaj lacaj, ili estas pli subiĝemaj al deprimo kaj agordoperturboj, pli ofte suferas impotentecon. Nekuracita dormapneo kreskigas riskon de pluraj seriozaj malsanoj. Sed por proponi al pacientoj efikan terapion de dormapneo unue necesas ĝin diagnozi kaj helpa ĉi-rilate povas esti la menciita inventaĵo de polaj sciencistoj kaj inĝenieroj. La kosto de diagnozo kun ĝia apliko estas duoble malpli alta ol kaze de klasika polisomnografio.

El la elsendo 14.02.2017. Legas Tomek – 2’04”

sc_tm_cirkau problemoj de dormapneo en Pollando_02’04”

--------------------------------------------------------------------------------

Pola mastrumado en 2017 inter 6 plej bone evoluantaj en la Unio
[2017-02-14]
https://pola-retradio.org/2017/02/pola-mastrumado-en-2017-inter-6-plej-bone-evoluantaj-en-la-unio/

La pola mastrumado en 2017 estos unu el ses plej rapide evoluantaj en la Eŭropa Unio. Tio sekvas el la prezentitaj lastlunde bazaj makroekonomiaj donitaĵoj koncerne la 2016-n jaroj kaj el la prognozoj por la nuna jaro.

La Komisiono konfirmis, ke pasintjare la pola Landa Pordukto Brutte (LPB) kreskis je 2,8 procentoj, kio estas rezulto identa kun la publikigita antaŭnelonge de la Ĉefa Statistika Oficejo. La Komisiono sciigis ankaŭ, ke la deficito de la publikaj financoj egalis nur al 2,3 procentoj de la LPB kaj estis la plej malalta ekde 2007. Laŭ unu el la fiskaj kriterioj de Maastricht-Traktato ĝi ne povas superi 3 procentojn. La deficito tamen estos envere je la duona procento pli alta, ĉar kiel atentigis Eurostat Pollando devas partigi 10 miliardojn da zlotoj de la buĝetenspezo pro la vendita frekvenco LTE. Malgraŭ tio la deficito ne superos Maastricht-kriterion.  Multe pli optimisma estas la prognozo de la Eŭropa Komisiono rilate la ekonomian kreskon en Pollando en la nuna jaro. Laŭ ĝi la LPB egalos al 3,2 procentoj, kio lokas Pollandon inter la ses plej rapide evoluantaj uniaj mastrumadoj.

El la elsendo 14.02.2017. Legas Krystyna  kaj Barbara – 1’35”

--------------------------------------------------------------------------------

Kontraŭ trompoj lige kun la aldonvalora imposto
[2017-02-14]
https://pola-retradio.org/2017/02/kontrau-trompoj-lige-kun-la-aldonvalora-imposto/

La pola ŝtato pro la deliktoj sekvantaj el trompoj ligitaj kun la aldonvalora imposto perdas miliardojn da zlotoj. Nur en 2015 ili sumiĝis al preskaŭ 40 miliardoj da zlotoj. Dank’ al la amendo de la Punkodo subskribita lastlunde de la prezidento, Andrzej Duda la batalo kontraŭ trompistoj estos pli efika kaj la punoj pli severaj.

Pro la falsado de fakturoj pri aldonvalora imposto minacas ekde nun puno de eĉ 25-jara mallibereco. Punoj estas proporcioj al la skalo de la perdoj, suferitaj de la ŝtato. La amendo listigas gamon de novaj kategorioj, kiel prezentado de fikciaj fakturoj pri la aldonvalora imposto, falsado de ili kaj alifarado por akiri materialajn profitojn. Se la falsa fakturo rilatas al kvoto pli ol 5-miliona la antaŭvidita puno egalas al mallribeceo inter 3 kaj 15 jaroj. La falsado koncerne sumon pli ol 10-milionan estas minacita eĉ per 25-jara mallibereco. La leĝo ekvalidos la 1-an de marto 2017. Krom la amendo en la Punkodo ĝi enkondukas sanĝojn en la leĝoj pri polico, Centra Kontraŭkorupta Oficejo, Limgardistaro, Militista Ĝandarmaro kaj fiska kontrolo.

El la elsendo 14.02.2017. Legas Krystyna  kaj Barbara – 1’34”

--------------------------------------------------------------------------------

E_elsendo el la 14.02.2017
[2017-02-14]
https://pola-retradio.org/2017/02/e_elsendo-el-la-14-02-2017/

Podkasto: Ludu en nova fenestro | Elŝutu

La 624-a E-elsendo el la 14.02.2017 ĉe www.pola-retradio.org:

– Hodiaŭ post kelka paŭzo ni denove invitas foliumi kun ni lastatempe venintajn al la Redakcio E-gazetojn. Hodiaŭ ni parolas pri la januaraj numeroj de „La Lanterno Azia” de Korea E-Asocio kaj „La Revuo Orienta” de Japana E-Instituto. – La komencaj aktualaĵoj rilatas al ekonomiaj aferoj. Unue ni informas pri la amendo de la Punkodo malfaciligonta trompojn rilate la aldonvaloran imposton kaj pri bonaj prognozoj de la Eŭropa Komisiono, laŭ kiuj Pollando en 2017 troviĝos inter 6 plej rapide evoluantaj mastrumadoj de la Unio. – La scienca bulteno liveras informojn pri la minacitaj senjorinoj, kiuj praktikas senmovan vivstilon antaŭ komputilo kaj pri nova aparato, kiu dank’ al sia favorpreza kosto ebligos al pli da poloj ekzameni ĉu ili ne suferas dormapneon. La aktualaĵoj, la scienbultenaj temoj kaj la Trarigardo estas paralele legeblaj kaj aŭskulteblaj en la koncernaj rubrikoj de nia paĝo. Muzike en la korvarman etoson enkondukas Kajto i.a. lige kun la hodiaŭa festo de enamiĝintoj. „Rave kun vi” devenas el la KD „Duope” Nia elsendo estas aŭskultebla ankaŭ en jutubo pere de: https://www.youtube.com/results?q=pola+retradio&sp=CAI%253D. La akompana al ĉi tiu informo foto prezentas SHIN EŬN SOOK, E-nome Sonĝanta, la ĉeforganizanton de la Seŭla Internacia Infana Kongreseto. La retejo de la Seula UK troviĝas ĉe la adreso: http://www.2017uk.net/

--------------------------------------------------------------------------------

El la E-Gazetaro 14.02.2017
[2017-02-14]
https://pola-retradio.org/2017/02/el-la-e-gazetaro-14-02-2017/

Ĵus mi ricevis la freŝan faskon de la venintaj lastatempe E-gazetoj, kiun mi tuj scivoleme ekfoliumis. Inter ili troviĝas ankaŭ la 1-a nunjara, la januara numero de “La Lanterno Azia”, oficiala organo de Korea E-Asocio. La revuo tuj foliumenda, ĉar ja nur post kelkaj monatoj multaj el ni renkontiĝos dum la Universala Kongreso en Seulo. Prave mi elektis, ĉar la unuan lokon okupas en ĝi la novjara mesaĝo de la prezidanto de KEA, LEE Youngkoo elstariganta jam per la titolo la esperon, ke per la 102-a UK koreaj esperantistoj faros la turnopunkton en la historio de sia E-movado. Kvankam la mesaĝo celas koreajn esperantistojn mi ŝatus ĉerpi el tiu mesaĝo kelkajn citaĵojn, por doni al ni ĉiuj imagon pri la revoj kaj faritaj/farataj preparlaboroj. “Tri jarojn sen ajna paŭzo sen ajna ripozo ni faris nian plej bonan laboron por la 102-an UK-on inviti kaj dissciigadi, kaj en la lasta somero en Nitra UK en Slovakio fine transprenis la flagon de la kongresa lando. Nun restas por ni nenio alia ol fari la Seulan UK-on la plej ŝika. Tio ne estas ĉio! Semajnon antaŭe kaj semajnon poste de la seula UK, en la urboj Busan kaj Gimpo, sian kulminon anoncos la 50a ILEI-Kongreso kaj la 90a SAT-Kongreso, tiel ke dum tri da plensemajnoj grandegan kulturan feston povas ĝui koreaj esperantistoj kun geamikoj el la tuta mondo”. Por ke tio plene realiĝu en Koreio estis entreprenita vastskala kampanjo de diversspecaj lingvokursoj kaj paroligaj trejnadoj tra diversaj lokoj en la lando, dum la LKK de la Seula UK tenante proksiman kontakton kun KKS kunsidis nur en la pasinta jaro dek kelkajn fojojn. La laboroj de koreoj do koncentriĝas pri la UK, sed malgraŭ la fako, ke la kongresa temo de la 102-a estas “Turismo kaj evoluado” el la agadhorizonto  koreoj ne perdas la nunjaran Zamenhof-Jaron, kaj kiel certigas en sia mesaĝo la prezidanto de KEA – “memorfestojn konvenajn por tio ni planas”. Pri multaj aferoj eblas jam ekscii pere de la korea hejmpaĝo pri la 102-a UK ĉe la adreso www.2017.uk.net . Sed ankoraŭfoje mi referencu al la vortoj de la prezidanto LEE, kiu koncentriĝante pri la nunaj laboroj ja rigardas perspektive: “Ni ĉiuj konscias, ke la celo atinginda tra la UK estas kreskigi junan generacion, kiu fariĝos firma kolono de nia estonta movado, kaj starigi gvidantojn kiel motorojn de nia afero.” Sendube la 102-a UK kontribuos al tio, sed jam nun motoroj de la E-evoluo en Koreio kaj Azio ne mankas, pri kio ni informiĝas el la sekva artikolo de alia koreo, la nova prezidanto de KAEM, SO Jinsu elektita dum la novembra 8a Azia Kongreso de Esperanto en Ĉinio. Ankaŭ en liaj planoj estas pliaj aktivaj agadoj por disvastigo de Esperanto tra la landoj de la tuta Azio, kiun kontinenton li difinas kiel ne nur vastan, varian, diversan – sed ankaŭ plej dinamikan en la 21-a jarcento. Kiel li emfazas “Azio nun okufrape ŝanĝiĝas, Azio rapide progresas kaj evoluas. Kaj la E-movado en ĝi tiom varmas.” Ĉi lastaj vortoj evidente atestas, ke la E-movado havas en Azio bonan kaj firman fundamenton. Tiun aserton konfirmas la mesaĝo enestanta en la novjara saluto de la prezidanto de Japana E-Instituto Suzuki Keiichiro en la januara numero de “La Revuo Orienta”. Elirante en sia saluto de la nunjare solenata sub la aŭspicio de Unesko Zamenhof-Jaro li deklaras sian senton pri la granda vivoforto de Esperanto alvokante utiligi la ŝancojn, kiujn donas la disvolviĝanta interreta mondo.  Multan atenton la prezidanto de JEI donas ankaŭ al la 102-a UK en Seulo alvokante japanajn esperantistojn, ankaŭ komencantojn multnombre ĝin partopreni por >disvastigi sian mondon de Esperanto ĉeestante riĉajn programerojn de la UK, utiligante kaj ĝuante ilin”. La ĉefan parton en la januara “La revuo Orienta” konsisitigas pluraj elĉerpaj  raportoj pri la oktobra 103-a Japana E-Kongreso, sed krome aperas en ĝi konciza raporto de KAEM-sekretario pri la 8-a Azia Kongreso kaj du impresoj, kies aŭtoroj ne kaŝas memfidon pri la forto de la evoluperspektivoj de la azia movado.  Sesimo Masaja i.a. esprimas la konvinkon, ke la Kongreso rezultigos fortigon de la E-aktivado inter landoj en Azio kaj plu valorigos Esperanton en la vasta teritorio, kaj la azia movado atingos pli altan nivelon. Aliflanke Sanpei Keiko rimarkigas, ke la forto de la azia E-movado radikas en ĝia historio, en kiu seninterrompe okazis pasigo de E-bastoneto per la manoj de ĉiaj esperantistaj generacioj. Sendube nunjaraj partoprenantoj de la Seula UK havos la okazon pri tio konvinkiĝi.

El la elsendo 14.02.2017. Legas Barbara – 7’33”

--------------------------------------------------------------------------------

Interparolo kun Irmi Haupenthal memore al la edzo, Reinhard Haupenthal
[2017-02-17]
https://pola-retradio.org/2017/02/interparolo-kun-irmi-haupenthal-memore-al-la-edzo-reinhard-haupenthal/

