{"url": "https://pola-retradio.org/2012/01/e_elsendo-el-la-02-01-2012/", "title": "E_elsendo el la 02.01.2012", "published": "2012-01-02 20:24:34+01:00", "content_text": "Podkasto: Ludu en nova fenestro | Elŝutu\n\nLa 2-a parto de la prelego de prof. J. Wells „Lingvoj en mia vivo” estas la ĉeftemo de nia unua E-elsendo-2012 ĉe https://pola-retradio.org . Antaŭas ĝin scienca bulteno kaj temoj el la pola gazetaro. En la Novan Jaron enkondukas „Je Novjaro” de Wilhelm Bush esperantigita de Manfred Retzlaff.", "author": null, "categories": ["Elsendoj"], "audio_links": ["/wp-content/uploads/2012/01/E_elsendo-el-la-02.01.2012.mp3"]}
{"url": "https://pola-retradio.org/2012/01/e_elsendo-el-la-06-01-2012/", "title": "E_elsendo el la 06.01.2012", "published": "2012-01-06 19:43:01+01:00", "content_text": "Podkasto: Ludu en nova fenestro | Elŝutu\n\nKien la Pola retRadio en 2012 – https://pola-retradio.org ? Jen la ĉefdemando, kiun ni levas fine de nia hodiaŭa Leterkesto. Komence aŭdiĝas kulturkroniko. Ni ankaŭ kante kaj informe referencas al Epifanio en Pollando, festata ĉi tie kiel Festo de la Tri Reĝoj.", "author": null, "categories": ["Elsendoj"], "audio_links": ["/wp-content/uploads/2012/01/E_elsendo-el-la-06.01.2012.mp3"]}
{"url": "https://pola-retradio.org/2012/01/e_elsendo-el-la-09-01-2012/", "title": "E_elsendo el la 09.01.2012", "published": "2012-01-09 19:24:43+01:00", "content_text": "Podkasto: Ludu en nova fenestro | Elŝutu\n\nLa ĉefkonkludo de la prelego de prof. J. Wells, Lingvoj en mia vivo, jenas:  „lernu ĝis kiam vi estas junaj”. Aŭskultu ĝian finan parton ĉe https://pola-retradio.org . Komence aŭdiĝas sciencaj informoj. Sekve la sveda ensemblo „Trifolio” kante ŝpinas la ideojn pri 2053.", "author": null, "categories": ["Elsendoj"], "audio_links": ["/wp-content/uploads/2012/01/RetRadio_09.01.2012.mp3"]}
{"url": "https://pola-retradio.org/2012/01/e_elsendo-el-la-13-01-2012/", "title": "E_elsendo el la 13.01.2012", "published": "2012-01-13 19:05:30+01:00", "content_text": "Podkasto: Ludu en nova fenestro | Elŝutu\n\nLa baza E-agado okazas en kluboj, grupoj, filioj. Pri tio en la pola Gliwice ni ekscias dank’ al Stanislaw Mandrak kaj Krystyna Grochocka ĉe https://pola-retradio.org . Komence aŭdiĝas kulturaj informoj. Muzike akompanas nin la ensemblo de la Varsovia Politekniko (1987) kaj la kvarteto Muzilo.", "author": null, "categories": ["Elsendoj"], "audio_links": ["/wp-content/uploads/2012/01/E_elsendo-el-la-13.01.2012.mp3"]}
{"url": "https://pola-retradio.org/2012/01/e_elsendo-el-la-16-01-2012/", "title": "E_elsendo el la 16.01.2012", "published": "2012-01-16 17:42:33+01:00", "content_text": "Podkasto: Ludu en nova fenestro | Elŝutu\n\nLa E-programo ĉe https://pola-retradio.org enhavas sciencajn informojn. Krome ni informas pri aktivadoj rilate al la E-instruado. Nian sondokumenton konsistigas la kontribuo de Ladányi I.al la 2-a Interlingvistika Simpozio en Poznano (2011) pri E-o en la formado de studentoj pri andragogio en Szeged.", "author": null, "categories": ["Elsendoj"], "audio_links": ["/wp-content/uploads/2012/01/E_elsendo_16.01.2012.mp3"]}
{"url": "https://pola-retradio.org/2012/01/e_elsendo-el-la-20-01-2012/", "title": "E_elsendo el la 20.01.2012", "published": "2012-01-20 21:45:50+01:00", "content_text": "Podkasto: Ludu en nova fenestro | Elŝutu\n\nLa ĉeflokon en la E-elsendo ĉe https://pola-retradio.org okupas la programo rilatanta al la reagoj de la geaŭskultantoj je unuopaj elsendoj, do Leterkesto. Ĉu imageblas, ke en Eŭropo eblas puni pro la uzo de la minoritataj lingvoj ? Evidentiĝas, ke jes. La elsendon inaŭguras kulturaj informoj.", "author": null, "categories": ["Elsendoj"], "audio_links": ["/wp-content/uploads/2012/01/E_elsendo-el-la-20.01.2012.mp3"]}
{"url": "https://pola-retradio.org/2012/01/e_elsendo-el-la-23-01-2012/", "title": "E_elsendo el la 23.01.2012", "published": "2012-01-23 21:28:03+01:00", "content_text": "Podkasto: Ludu en nova fenestro | Elŝutu\n\nLa 89-a E-elsendo ĉe https://pola-retradio.org enhavas sciencajn informojn, omaĝan rememoron pri la forpasinta ĉeĥa poetino Eli Urbanova. La sondokumenton konsistigas prelego de prof.John Wells (la 1-a parto) pri La koloroj de lumo, prezentita lastaŭtune dum interlingvistika simpozio en Poznano.", "author": null, "categories": ["Elsendoj"], "audio_links": ["/wp-content/uploads/2012/01/E_elsendo-el-la-23.01.2012.mp3"]}
{"url": "https://pola-retradio.org/2012/01/e_elsendo-el-la-27-01-2012/", "title": "E_elsendo el la 27.01.2012", "published": "2012-01-27 21:14:21+01:00", "content_text": "Podkasto: Ludu en nova fenestro | Elŝutu\n\nNia 90-a E-elsendo ĉe https://pola-retradio.org enhavas apartan alvokon al E-parolantoj lige kun la pasanta hodiaŭ 67-a datreveno de la liberigo de Auschwitz-koncentrejo. Audiĝas kulturkroniko, leterkesta programero kaj la 2-a parto de la seminaria prelego de John Wells pri La koloroj de lumo.", "author": null, "categories": ["Elsendoj"], "audio_links": ["/wp-content/uploads/2012/01/Fw_-E_elsendo-el-27.01.2012.mp3"]}
{"url": "https://pola-retradio.org/2012/01/e_elsendo-el-la-30-01-2012/", "title": "E_elsendo el la 30.01.2012", "published": "2012-01-30 19:17:57+01:00", "content_text": "Podkasto: Ludu en nova fenestro | Elŝutu\n\nNia lasta januara E-programo ĉe https://pola-retradio.org enhavas la 3-an parton de la simpozia prelego de prof. John Wells pri La koloroj de lumo. Ni enrigardas la januarajn numerojn de La Revuo Orienta kaj Esperantolehti. Aŭdiĝas komence scienca bulteno kaj fine kelkaj E-informoj.", "author": null, "categories": ["Elsendoj"], "audio_links": ["/wp-content/uploads/2012/01/E_elsendo-el-la-30.01.2012.mp3"]}
{"url": "https://pola-retradio.org/2012/02/e_elsendo-el-la-03-02-2012/", "title": "E_elsendo el la 03.02.2012", "published": "2012-02-03 17:03:29+01:00", "content_text": "Podkasto: Ludu en nova fenestro | Elŝutu\n\nLa E-elsendon ĉe https://pola-retradio.org inaŭguras kultura programero plene dediĉita al la forpasinta Wisława Szyborska. Sekvas informoj Rekte el Pollando. La leterkesta rendevuo estas la okazo komenti la aktualajn mesaĝojn, sed unuavice retrorigardi al la helpo de radioamikoj en 2011.", "author": null, "categories": ["Elsendoj"], "audio_links": ["/wp-content/uploads/2012/02/E_elsendo-el-la-03.02.2012.mp3"]}
{"url": "https://pola-retradio.org/2012/02/e_elsendo-el-la-06-02-2012/", "title": "E_elsendo el la 06.02.2012", "published": "2012-02-06 16:49:53+01:00", "content_text": "Podkasto: Ludu en nova fenestro | Elŝutu\n\nSciencaj informoj rilatas ĉi-foje ne nur al Pollando sed ankaŭ al la E-komunumo. Ĉe la adreso https://pola-retradio.org ni prezentas krome temojn el la pola gazetaro kaj rakontas fine pri kastoroj en Pollando, ankaŭ laŭ la historia retrorigardo. Muzike akompanas nin Duo Espera.", "author": null, "categories": ["Elsendoj"], "audio_links": ["/wp-content/uploads/2012/02/E_elsendo-el-la-06.02.2012.mp3"]}
{"url": "https://pola-retradio.org/2012/02/e_elsendo-el-la-10-02-2012/", "title": "E_elsendo el la 10.02.2012", "published": "2012-02-10 16:36:57+01:00", "content_text": "Podkasto: Ludu en nova fenestro | Elŝutu\n\nEn la hodiaŭa Leterkesto – https://pola-retradio.org – ni revenas al la demando savi la memoron de esperantistoj pereintaj dum la 2-a mondmilito en la naziaj koncentrejoj kaj mortotendaroj. Komence aŭdiĝas kulturkroniko kaj aktualaj informoj pri E-instruado. Tra ili kante kondukas JoMo.", "author": null, "categories": ["Elsendoj"], "audio_links": ["/wp-content/uploads/2012/02/E_elsendo-el-la-10.02.2012.mp3"]}
{"url": "https://pola-retradio.org/2012/02/e_elsendo-el-la-13-02-2012/", "title": "E_elsendo el la 13.02.2012", "published": "2012-02-13 16:23:01+01:00", "content_text": "Podkasto: Ludu en nova fenestro | Elŝutu\n\nEn nia lunda elsendo speguliĝas la 1-a Monda Tago de Radio proklamita por hodiaŭ fare de Unesko: https://pola-retradio.org . Aldonendas, ke tio okazas en la jaro de la 90-jariĝo de la E-radiofonio. Aŭdiĝas krome sciencaj informoj kaj elektitaj temoj el la pola gazetaro. Kantas Veselin Damjanov.", "author": null, "categories": ["Elsendoj"], "audio_links": ["/wp-content/uploads/2012/02/E_elsendo-el-la-13.02.2012.mp3"]}
{"url": "https://pola-retradio.org/2012/02/e_elsendo-el-la-17-02-2012/", "title": "E_elsendo el la 17.02.2012", "published": "2012-02-17 16:09:40+01:00", "content_text": "Podkasto: Ludu en nova fenestro | Elŝutu\n\nEn la E-elsendo ĉe https://pola-retradio.org Leterkeste ni konfirmas la reagojn de malnovaj kaj novaj aŭskultantoj je niaj E-programoj. Pli frue aŭdiĝas kulturkroniko kaj E-informoj. Ĉi-lastaj rilatas al okazantaj kaj okazontaj eventoj en Parizo, Triesto, Karlovo-Sopot. Kantas Miŝo Zdravev.", "author": null, "categories": ["Elsendoj"], "audio_links": ["/wp-content/uploads/2012/02/E_elsendo-el-la-17.02.2012.mp3"]}
{"url": "https://pola-retradio.org/2012/02/e_elsendo-el-la-20-02-2012/", "title": "E_elsendo el la 20.02.2012", "published": "2012-02-20 19:00:55+01:00", "content_text": "Podkasto: Ludu en nova fenestro | Elŝutu\n\nĈe la adreso https://pola-retradio.org Pola retRadio proponas ĉi-lunde renkontiĝon kun la hungara E-volontulino en Bjalistoko, Zsofia Patoki. Ni ne forgesas pri la aktualaj Semajno de Internacia Amikeco kaj Tago de la Gepatra Lingvo. Komence kiel kutime aŭdiĝas sciencaj informoj.", "author": null, "categories": ["Elsendoj"], "audio_links": ["/wp-content/uploads/2012/02/E_elsendo-el-la-20.02.2012.mp3"]}
{"url": "https://pola-retradio.org/2012/02/e_elsendo-el-la-24-02-2012/", "title": "E_elsendo el la 24.02.2012", "published": "2012-02-24 17:56:35+01:00", "content_text": "Podkasto: Ludu en nova fenestro | Elŝutu\n\nLa vendreda elsendo ĉe https://pola-retradio.org notas la ekuzon de Esperanto en la tradukoservo de Guglo. La kultura kroniko estas vastigita per literaturaĵo, ligita kun la naskiĝdatreveno de Chopin. Fragmento devenas el la libro de Karol Stromenger. Fine ni renkontiĝas en tradicia Leterkesto.", "author": null, "categories": ["Elsendoj"], "audio_links": ["/wp-content/uploads/2012/02/E_elsendo-el-la-24.02.2012.mp3"]}
{"url": "https://pola-retradio.org/2012/02/e_elsendo-el-la-27-02-2012/", "title": "E_elsendo el la 27.02.2012", "published": "2012-02-27 17:38:39+01:00", "content_text": "Podkasto: Ludu en nova fenestro | Elŝutu\n\nKial esperantistoj konu la polan nacian himnon ? Ni klarigas tion marĝene de la 85-jariĝo de tiu patriota pola kanto kun 215-jara historio: https://pola-retradio.org . Komence ni proponas informojn Rekte el Pollando kaj sciencan bultenon. Es-To memorigas konatan polan kanton “Knabineto arbareton”.", "author": null, "categories": ["Elsendoj"], "audio_links": ["/wp-content/uploads/2012/02/Elsendo-el-la-27.02.2012.mp3"]}
{"url": "https://pola-retradio.org/2012/03/e_elsendo-el-la-02-03-2012/", "title": "E_elsendo el la 02.03.2012", "published": "2012-03-02 17:24:25+01:00", "content_text": "Podkasto: Ludu en nova fenestro | Elŝutu\n\nJubilea 100-a E-elsendo ĉe https://pola-retradio.org pere de Leterkesto aparte emfazas jubileajn sentojn, retrorigardas kaj alrigardas i.a. al temoj proponataj por elsendoj. Komence aŭdiĝas mallonga kulturkroniko kaj informo pri nova difino de rilatoj de UEA kun Unesko: konsulta partnereco.", "author": null, "categories": ["Elsendoj"], "audio_links": ["/wp-content/uploads/2012/03/E_elsendo-el-la-02.03.2012.mp3"]}
{"url": "https://pola-retradio.org/2012/03/e_elsendo-el-la-05-03-2012/", "title": "E_elsendo el la 05.03.2012", "published": "2012-03-05 17:02:00+01:00", "content_text": "Podkasto: Ludu en nova fenestro | Elŝutu\n\nLa E-elsendo ĉe https://pola-retradio.org enhavas informojn Rekte el Pollando kaj sciencan bultenon. Hodiaŭ ni proponas literaturaĵon. Per la rakonto de B. Prus „La ŝimo de l’mondo” en la traduko de K. Bein ni subtenas la iniciaton de Hori Y. lukti konkurse per E-sumoo por legi E-literaturon.", "author": null, "categories": ["Elsendoj"], "audio_links": ["/wp-content/uploads/2012/03/Fw_-E_elsendo-el-la-05.03.2012.mp3"]}
{"url": "https://pola-retradio.org/2012/03/e_elsendo-el-la-09-03-2012/", "title": "E_elsendo el la 09.03.2012", "published": "2012-03-09 21:14:17+01:00", "content_text": "Podkasto: Ludu en nova fenestro | Elŝutu\n\nLa vendreda E-elsendo ĉe https://pola-retradio.org enhavas kulturkronikon, sekve aŭdiĝas E-aktualaĵoj (pri MT en CO de UEA Roterdamo en aprilo, favora abonoferto de LPLP antaŭ la fino de aprilo kaj Androjda E-radio). Fine la redakcio renkontiĝas kun siaj aŭskultantoj kaj radioamikoj en Leterkesto.", "author": null, "categories": ["Elsendoj"], "audio_links": ["/wp-content/uploads/2012/03/E_elsendo-el-la-09.03.2012.mp3"]}
{"url": "https://pola-retradio.org/2012/03/e_elsendo-el-la-12-03-2012/", "title": "E_elsendo el la 12.03.2012", "published": "2012-03-12 17:33:36+01:00", "content_text": "Podkasto: Ludu en nova fenestro | Elŝutu\n\nLa 103-a E-elsendo ĉe https://pola-retradio.org enhavas informojn Rekte el Pollando, sekve Sciencan Bultenon. En Trarigardo de la E-gazetaro ni foliumas la lastajn pasintjarajn numerojn de Tempo, Juna Amiko, IPR, L’Esperanto, La Lanterno Azia kaj Nova Vojo. Kante akompanas nin Morice Benin.", "author": null, "categories": ["Elsendoj"], "audio_links": ["/wp-content/uploads/2012/03/E_elsendo-el-la-12.03.2012.mp3"]}
{"url": "https://pola-retradio.org/2012/03/e_elsendo-el-la-16-03-2012/", "title": "E_elsendo el la 16.03.2012", "published": "2012-03-16 17:14:43+01:00", "content_text": "Podkasto: Ludu en nova fenestro | Elŝutu\n\nNia 104 E-elsendo ĉe https://pola-retradio.org proponas kulturkronikon, E-informojn kaj mallongan Leterkeston. Krome ni felietonas pri la jam printempaŭgure revenantaj al Pollando birdoj: i.a. cikonioj, alaŭdoj,vaneloj, gruoj, grizaj anseroj, buteoj, furtulanoj kaj apusoj. Kantas Miŝo Zdravev.", "author": null, "categories": ["Elsendoj"], "audio_links": ["/wp-content/uploads/2012/03/E_elsendo-el-la-16.03.2012.mp3"]}
{"url": "https://pola-retradio.org/2012/03/e_elsendo-el-la-19-03-2012/", "title": "E_elsendo el la 19.03.2012", "published": "2012-03-19 17:02:00+01:00", "content_text": "Podkasto: Ludu en nova fenestro | Elŝutu\n\nLa 105-a E-elsendo de Pola RetRadio ĉe https://pola-retradio.org enhavas informojn Rekte el Pollando kaj sciencan bultenon. Ni prezentas la 1-an parton de la fabelo de Hans Christian Andersen “Cikonioj”. Kantas J. Yvart kanton el sia KD eldonita de Vinilkosmo “Invito por Vojaĝo”.", "author": null, "categories": ["Elsendoj"], "audio_links": ["/wp-content/uploads/2012/03/E_elsendo-el-la-19.03.2012.mp3"]}
{"url": "https://pola-retradio.org/2012/03/e_elsendo-el-la-23-03-2012/", "title": "E_elsendo el la 23.03.2012", "published": "2012-03-23 16:47:20+01:00", "content_text": "Podkasto: Ludu en nova fenestro | Elŝutu\n\nĈe la adeso https://pola-retradio.org la ĉiuvendreda elsendo – ĉi-foje la 106-a – enhavas Leterkeston kun interesaj komentoj de niaj aŭskultantoj. Komence aŭdiĝas kulturkroniko, kiun sekvas E-informoj.", "author": null, "categories": ["Elsendoj"], "audio_links": ["/wp-content/uploads/2012/03/E_elsendo-el-la-23.03.2012.mp3"]}
{"url": "https://pola-retradio.org/2012/03/e_elsendo-el-la-26-03-2012/", "title": "E_elsendo el la 26.03.2012", "published": "2012-03-26 21:22:56+02:00", "content_text": "Podkasto: Ludu en nova fenestro | Elŝutu\n\nLa 107-a plurtema E-elsendo de la Pola retRadio ĉe https://pola-retradio.org enhavas: temojn Rekte el Pollando, felietonon pri homeopatio en Pollando kaj la 2-an parton de H.Ch. Andersen “Cikonioj”. “Printempan sonĝon” kantas Alberta Casey.", "author": null, "categories": ["Elsendoj"], "audio_links": ["/wp-content/uploads/2012/03/E_elsendo-el-la-26.03.2012.mp3"]}
{"url": "https://pola-retradio.org/2012/03/e_elsendo-el-la-30-03-2012/", "title": "E_elsendo el la 30.03.2012", "published": "2012-03-30 21:03:29+02:00", "content_text": "Podkasto: Ludu en nova fenestro | Elŝutu\n\nLa hodiaŭa vendreda E-elsendo de la Pola retRadio ĉe http:// www.pola-retardio.org enhavas la kulturan bultenon kaj E-informojn. Kun profunda bedaŭro la Redakcio adiaŭas la forpasintan Joshi Shemer el Israelo. La programom kompletigas renkontiĝo kun la aŭskultantoj kadre de la ĉiusemajna Leterkesto.", "author": null, "categories": ["Elsendoj"], "audio_links": ["/wp-content/uploads/2012/03/E_elsendo-el-la-30.03.2012.mp3"]}
{"url": "https://pola-retradio.org/2012/04/e_elsendo-el-la-02-04-2012/", "title": "E_elsendo el la 02.04.2012", "published": "2012-04-02 20:50:35+02:00", "content_text": "Podkasto: Ludu en nova fenestro | Elŝutu\n\nLa 109-a E-elsendo ĉe https://pola-retradio.org enhavas temojn Rekte el Pollando kaj sciencan bultenon. Nia felietono estas dediĉita al la Palma Dimanĉo, kiu krom la religia emfazo, ligiĝas en Pollando kun multaj kutimoj. Kantas Asorti, aŭdiĝas krome fragmente du karesmaj, polaj religiaj kantoj.", "author": null, "categories": ["Elsendoj"], "audio_links": ["/wp-content/uploads/2012/04/E_elsendo-el-la-02.04.2012.mp3"]}
{"url": "https://pola-retradio.org/2012/04/e_elsendo-el-la-06-04-2012/", "title": "E_elsendo el la 06.04.2012", "published": "2012-04-06 20:25:08+02:00", "content_text": "Podkasto: Ludu en nova fenestro | Elŝutu\n\nLa E-programo de la 110-a E-elsendo ĉe https://pola-retradio.org enhavas tradicie kulturkronikon, E-informojn kaj Leterkeston. Ĉi-lasta programero i.a. enhavas gravan programan informon pri tio, ke ekde la venonta semajno nia unua E-elsendo aŭdiĝos ĉiumarde. La vendreda restas senŝanĝa.", "author": null, "categories": ["Elsendoj"], "audio_links": ["/wp-content/uploads/2012/04/E_elsendo-el-la-06.04.2012.mp3"]}
{"url": "https://pola-retradio.org/2012/04/e_elsendo-el-la-10-04-2012/", "title": "E_elsendo el la 10.04.2012", "published": "2012-04-10 22:39:30+02:00", "content_text": "Podkasto: Ludu en nova fenestro | Elŝutu\n\nLa 111-a E-elsendo de la Pola retRadio ĉe https://pola-retradio.org enhavas temojn Rekte el Pollando kaj sciencan bultenon. Muzike ni anoncas la plej novan KD-on eldonitan ĉe Vinilkosmo – “Originoj” de Zhou-Mack Mafuila. El la arkivo ni memorigas fine kanton de Vudi.", "author": null, "categories": ["Elsendoj"], "audio_links": ["/wp-content/uploads/2012/04/E_elsendo-el-la-10.04.2012.mp3"]}
{"url": "https://pola-retradio.org/2012/04/e_elsendo-el-la-13-04-2012/", "title": "E_elsendo el la 13.04.2012", "published": "2012-04-13 22:27:06+02:00", "content_text": "Podkasto: Ludu en nova fenestro | Elŝutu\n\nEn la vendreda E_elsendo ĉe https://pola-retradio.org aŭdiĝas kulturkroniko kaj informo pri la maja konferenco en Triesto dediĉita al la temo “Kia estus Eŭropo hodiaŭ, se ne ekzistus EU”, kunorganizita de kelkaj E-organizoj. Fine aŭdiĝas la tradicia programero Leterkesto.", "author": null, "categories": ["Elsendoj"], "audio_links": ["/wp-content/uploads/2012/04/E_elsendo-el-la-13.04.2012.mp3"]}
{"url": "https://pola-retradio.org/2012/04/e_elsendo-el-la-17-04-2012/", "title": "E_elsendo el la 17.04.2012", "published": "2012-04-17 22:13:59+02:00", "content_text": "Podkasto: Ludu en nova fenestro | Elŝutu\n\nLa 113-a E-elsendo de Pola retRadio ĉe https://pola-retradio.org poponas renkontiĝon kun la unua nunjare KD de Vinilkosmo “Originoj” de Zhou-Mack Mafuila ( http://www.vinilkosmo.com/ kaj/aŭ http://www.vinilkosmo-mp3.com/ ). Komence aŭdiĝas la scienca bulteno kaj temoj Rekte el Pollando.", "author": null, "categories": ["Elsendoj"], "audio_links": ["/wp-content/uploads/2012/04/E_elsendo-el-la-17.04.2012.mp3", "http://www.vinilkosmo-mp3.com/"]}
{"url": "https://pola-retradio.org/2012/04/e_elsendo-el-la-20-04-2012/", "title": "E_elsendo el la 20.04.2012", "published": "2012-04-20 21:50:06+02:00", "content_text": "Podkasto: Ludu en nova fenestro | Elŝutu\n\nLa 114-a E-elsendo de Pola retRadio ĉe https://pola-retradio.org proponas aŭskulti kulturkronikon, E-informojn kaj Leterkeston. En la komenco oni referencas al la 69-a datreveno de la eksplodo de ribelo en la varsovia getto pasinta la lastan ĵaŭdon.", "author": null, "categories": ["Elsendoj"], "audio_links": ["/wp-content/uploads/2012/04/E_elsendo-el-la-20.04.2012.mp3"]}
{"url": "https://pola-retradio.org/2012/04/e_elsendo-el-la-24-04-2012/", "title": "E_elsendo el la 24.04.2012", "published": "2012-04-24 02:05:59+02:00", "content_text": "Podkasto: Ludu en nova fenestro | Elŝutu\n\nLa E-elsendo ĉe https://pola-retradio.org proponas temojn rekte el Pollando kaj sciencan bultenon. Novan Lambadon de G. Drigon kaj L. Tomezzoli kantas A. Promonet kaj A. Talpin. En trarigardo de la E-gazetaro estas traktita la 1-a nunjara numero de Kontakto kaj la 2-a de Norvega Esperantisto.", "author": null, "categories": ["Elsendoj"], "audio_links": ["/wp-content/uploads/2012/04/E_elsendo-el-la-24.04.2012.mp3"]}
{"url": "https://pola-retradio.org/2012/04/e_elsendo-el-la-27-04-2012/", "title": "E_elsendo el la 27.04.2012", "published": "2012-04-27 22:48:17+02:00", "content_text": "Podkasto: Ludu en nova fenestro | Elŝutu\n\nLa unua temo de nia E-elsendo ĉe https://pola-retradio.org traktas la temon Babelturo – reference al la fama flandra murtapiŝo, renovigita kaj ekspoziciata nun en la pola Krakovo. Pri Babelturo kantas ankaŭ F. Fonseca. Aŭdiĝas krome E-informoj kaj Leterkesto.", "author": null, "categories": ["Elsendoj"], "audio_links": ["/wp-content/uploads/2012/04/E_elsendo-el-la-27.04.2012.mp3"]}
{"url": "https://pola-retradio.org/2012/05/e_elsendo-el-la-01-05-2012/", "title": "E_elsendo el la 01.05.2012", "published": "2012-05-01 22:34:28+02:00", "content_text": "Podkasto: Ludu en nova fenestro | Elŝutu\n\nEn la 1-an majan programon de la Pola retRadio ĉe https://pola-retradio.org enkondukas majetosa kanto en la plenumo de A. Tomecki. Ni prezentas sciencan bultenon kaj sekve proponas viziti la varsovian Tamka-straton, kie traplektiĝas realo kaj legendo, historio kaj arto….", "author": null, "categories": ["Elsendoj"], "audio_links": ["/wp-content/uploads/2012/05/RetRadio_-01.05.2012.mp3"]}
{"url": "https://pola-retradio.org/2012/05/e_elsendo-el-la-04-05-2012/", "title": "E_elsendo el la 04.05.2012", "published": "2012-05-04 22:17:34+02:00", "content_text": "Podkasto: Ludu en nova fenestro | Elŝutu\n\nLa 118-a E-elsendo ĉe https://pola-retradio.org proponas: minifelietonon pri la Pola flago kaj ĝia festo, krome Leterkeston. Nia antaŭmikrofona gasto Katalin Kovats, renkontita en Roterdamo antaŭsemajne, rememoras E-kurson en Ĉinio kaj rakontas pri la preparoj al la monda skriba KER-ekzameno.", "author": null, "categories": ["Elsendoj"], "audio_links": ["/wp-content/uploads/2012/05/E_elsendo-el-la-04.05.2012.mp3"]}
{"url": "https://pola-retradio.org/2012/05/e_elsendo-el-la-08-05-2012/", "title": "E_elsendo el la 08.05.2012", "published": "2012-05-08 21:42:46+02:00", "content_text": "Podkasto: Ludu en nova fenestro | Elŝutu\n\nLa 119-a E-elsendo de Pola retRadio ĉe https://pola-retradio.org proponas renkontiĝon (per fragmentoj) kun la Esperanto-itala albumo de Rêverie “Revado”, kies ĉefdistribuanto estas Vinilkosmo: http://www.vinilkosmo-mp3.com/ . Komence aŭdiĝas scienca bulteno kaj plenmano da E-aktualaĵoj.", "author": null, "categories": ["Elsendoj"], "audio_links": ["/wp-content/uploads/2012/05/E_elsendo-el-la-08.05.2012.mp3", "http://www.vinilkosmo-mp3.com/"]}
{"url": "https://pola-retradio.org/2012/05/e_elsendo-el-la-11-05-2012/", "title": "E_elsendo el la 11.05.2012", "published": "2012-05-11 20:15:48+02:00", "content_text": "Podkasto: Ludu en nova fenestro | Elŝutu\n\nLa 120-a E-elsendo ĉe la adreso https://pola-retradio.org enhavas emocian sonscenon kun du sonbildoj el la lasta Malferma Tago en la CO, Roterdamo. Komence aŭdiĝas kulturkroniko kaj fine ni proponas renkontiĝon en Leterkesto.", "author": null, "categories": ["Elsendoj"], "audio_links": ["/wp-content/uploads/2012/05/E_elsendo-el-la-11.05.2012.mp3"]}
{"url": "https://pola-retradio.org/2012/05/e_elsendo-el-la-15-05-2012/", "title": "E_elsendo el la 15.05.2012", "published": "2012-05-15 20:03:47+02:00", "content_text": "Podkasto: Ludu en nova fenestro | Elŝutu\n\nLa 121-a E-elsendo ĉe https://pola-retradio.org enhavas interesan informon el Pollando rilatan al E-agado kaj sciencan bultenon. Ni rendevus kun nova E-kanto „Sub la nova suno”. Nia antaŭmikrofona gasto estas Petro Chrdle ĉe kies eldonejo Kava Pech aperis la dramo de Karel Čapek R.U.R., kaj kiu organizas la julian konferencon de OSIEK en Svitavy.", "author": null, "categories": ["Elsendoj"], "audio_links": ["/wp-content/uploads/2012/05/E_elsendo-el-la-15.05.2012.mp3"]}
{"url": "https://pola-retradio.org/2012/05/e_elsendo-el-la-18-05-2012/", "title": "E_elsendo el la 18.05.2012", "published": "2012-05-18 19:46:55+02:00", "content_text": "Podkasto: Ludu en nova fenestro | Elŝutu\n\nLa 122-a E-elsendo de la Pola retRadio ĉe https://pola-retradio.org proponas: informon pri kultura evento ĉirkaŭprenanta la tutan landon: Nokto de muzeoj, kiun nunjare la unuan fojon partoprenas esperantsitoj. Aŭdiĝas krome kroniko de E-eventoj kaj la Redakcio renkontiĝas kun siaj aŭskultantoj kadre de la leterkesta rendevuo.", "author": null, "categories": ["Elsendoj"], "audio_links": ["/wp-content/uploads/2012/05/E_elsendo-el-la-18.05.2012.mp3"]}
{"url": "https://pola-retradio.org/2012/05/e_elsendo-el-la-22-05-2012/", "title": "E_elsendo el la 22.05.2012", "published": "2012-05-22 19:33:52+02:00", "content_text": "Podkasto: Ludu en nova fenestro | Elŝutu\n\nEn la 123-a E-elsendo ĉe https://pola-retradio.org ni interparolas kun Etsuo Miyoshi, kiu lige kun la 125-jariĝo de Esperanto gastis en Pollando. Komence aŭdiĝas scienca bulteno kaj temo Rekte el Pollando. Aŭdiĝas krome du slovakaj kantoj el la KD Kantoj de l’ popolo, eldonita de Kava-Pech en 1993.", "author": null, "categories": ["Elsendoj"], "audio_links": ["/wp-content/uploads/2012/05/E_elsendo-el-la-22.05.2012.mp3"]}
{"url": "https://pola-retradio.org/2012/05/e_elsendo-el-la-25-05-2012/", "title": "E_elsendo el la 25.05.2012", "published": "2012-05-25 21:05:03+02:00", "content_text": "Podkasto: Ludu en nova fenestro | Elŝutu\n\nEn la 124-E-elsendo ĉe https://pola-retradio.org ni prezentas komence la varsovian artgalerion Zachęta. Nia antaŭmikrofona gasto estas la jubileanta 85-jariĝon Mila van der Horst-Kolińska, renkontita dum la lasta Malferma Tago en Roterdamo. La elsendon finas mallonga leterkesta renkontiĝo.", "author": null, "categories": ["Elsendoj"], "audio_links": ["/wp-content/uploads/2012/05/E_elsendo-el-la-25.05.2012.mp3"]}
{"url": "https://pola-retradio.org/2012/05/e_elsendo-el-la-29-05-2012/", "title": "E_elsendo el la 29.05.2012", "published": "2012-05-29 20:51:04+02:00", "content_text": "Podkasto: Ludu en nova fenestro | Elŝutu\n\nEn la 125-a E-programo de la Pola retRadio ĉe https://pola-retradio.org eblas konatiĝi kun interesa enhavo de kelkaj E-gazetoj kaj aŭdi la plej novan E-kanton “Kaptita estas via kor’” ( http://www.youtube.com/watch?v=NpBFhYoXjcM ). Komence aŭdiĝas temo el Pollando kaj scienca bulteno.", "author": null, "categories": ["Elsendoj"], "audio_links": ["/wp-content/uploads/2012/05/E_elsendo-el-la-29.05.2012.mp3"]}
{"url": "https://pola-retradio.org/2012/06/e_elsendo-el-la-01-06-2012/", "title": "E_elsendo el la 01.06.2012", "published": "2012-06-01 20:36:10+02:00", "content_text": "Podkasto: Ludu en nova fenestro | Elŝutu\n\nBildkarto el Pollando kaj E_literaturaĵo rilatas al la hodiaŭa Tago de Infanoj. Gravas E-informoj (UEA en monda terminologia laboro, la premio Cigno pro informado en EU-landoj 2012). Ili kaj fine Leterkesto estas aŭdeblaj ĉe https://pola-retradio.org en la 126-a elsendo de Pola retRadio en E-o.", "author": null, "categories": ["Elsendoj"], "audio_links": ["/wp-content/uploads/2012/06/E_elsendo-el-la-01.06.2012.mp3"]}
{"url": "https://pola-retradio.org/2012/06/e_elsendo-el-la-05-06-2012/", "title": "E_elsendo el la 05.06.2012", "published": "2012-06-05 23:43:18+02:00", "content_text": "Podkasto: Ludu en nova fenestro | Elŝutu\n\nKion signifos en Varsovio la nomo Veturilo? Kie en Pollando eblas lerni E-on universitatnivele, sed rete? Jen la ĉeftemoj de la lunda E-elsendo ĉe https://pola-retradio.org . Aŭdiĝas krome scienca bulteno, temo el Pollando kaj aktualaĵo pri IKUE-kongreso. Kantas Flavio Fonseca kaj Beltono.", "author": null, "categories": ["Elsendoj"], "audio_links": ["/wp-content/uploads/2012/06/E_elsendo-el-la-05.06.2012.mp3"]}
{"url": "https://pola-retradio.org/2012/06/e_elsendo-el-la-08-06-2012/", "title": "E_elsendo el la 08.06.2012", "published": "2012-06-08 23:30:43+02:00", "content_text": "Podkasto: Ludu en nova fenestro | Elŝutu\n\nVarsovio sojle de la hodiaŭa, vendreda inaŭguro de la piedpilk­ista EURO 2012, la 2-a parto de rakonto de Lokomotivo Jaemon, fine Leterkesto jen la enhavo de la 128-a E-elsendo de la varsovia Pola retRadio. Pri Bela Rozo kantas Flavio Fonseca. Ĉio ĉi aŭdeblas ĉe: https://pola-retradio.org .", "author": null, "categories": ["Elsendoj"], "audio_links": ["/wp-content/uploads/2012/06/E_elsendo-el-la-08.06.2012.mp3"]}
{"url": "https://pola-retradio.org/2012/06/e_elsendo-el-la-12-06-2012/", "title": "E_elsendo el la 12.06.2012", "published": "2012-06-12 18:18:17+02:00", "content_text": "Podkasto: Ludu en nova fenestro | Elŝutu\n\nNia interparolo kun K. Kovats ligas al la monda KER-ekzameno. Per Saluto el Varsovio ni omaĝas la 155-an naskiĝdatrevenon de A. Grabowski. Temo el Pollando referencas al la daŭranta EURO 2012. Ĉio ĉi kaj la scienca bulteno konsistigas la enhavon de la 129-a E-elsendo ĉe https://pola-retradio.org .", "author": null, "categories": ["Elsendoj"], "audio_links": ["/wp-content/uploads/2012/06/E_elsendo-el-la-12.06.2012.mp3"]}
{"url": "https://pola-retradio.org/2012/06/e_elsendo-el-la-15-06-2012/", "title": "E_elsendo el la 15.06.2012", "published": "2012-06-15 18:02:45+02:00", "content_text": "Podkasto: Ludu en nova fenestro | Elŝutu\n\nPri la varsoviaj busoj kun la ŝildo ESPERANTO ni parolas komence de nia E-elsendo ĉe https://pola-retradio.org . Sekvas korskua rakonto de Lokomitivo Jaemon el la rakonto de HORI Jasuo. Fine atendas ĉiujn radioemikojn leterkesta rendevuo. Ĉio ĉi kadre de la 130-a E-elsendo de la Pola retRadio.", "author": null, "categories": ["Elsendoj"], "audio_links": ["/wp-content/uploads/2012/06/E_elsendo-el-la-15.06.2012.mp3"]}
{"url": "https://pola-retradio.org/2012/06/e_elsendo-el-la-19-06-2012/", "title": "E_elsendo el la 19.06.2012", "published": "2012-06-19 17:49:38+02:00", "content_text": "Podkasto: Ludu en nova fenestro | Elŝutu\n\nĈiam pli proksima la 96-a UK en Hanojo estas la temo de nia interparolo kun KKS, Clay Magelhães. Du porokazajn kantojn plenumas Ramona van Dalsem kaj Georgo Handzlik. Krome ĉe https://pola-retradio.org en la 131-a E-elsendo de Pola retRadio aŭdiĝas temo el Pollando kaj scienca bulteno.", "author": null, "categories": ["Elsendoj"], "audio_links": ["/wp-content/uploads/2012/06/E_elsendo-el-la-19.06.2012.mp3"]}
{"url": "https://pola-retradio.org/2012/06/e_elsendo-el-la-22-06-2012/", "title": "E_elsendo el la 22.06.2012", "published": "2012-06-22 18:50:02+02:00", "content_text": "Podkasto: Ludu en nova fenestro | Elŝutu\n\nLa esperantista partopreno en Rio +20, inkluzive de la citita sonmesaĝo de Rafael Zerbetto el lia videofilmo estas la ĉeftemo de la 132-a E-elsendo de Pola retRadio. Ĉe https://pola-retradio.org aŭdiĝas krome Bildkarto el Pollando, la 4-parto de la rakonto “Iitate, mia revo” kaj mallonga Leterkesta renkontiĝo.", "author": null, "categories": ["Elsendoj"], "audio_links": ["/wp-content/uploads/2012/06/E_elsendo-el-la-22.06.2012.mp3"]}
{"url": "https://pola-retradio.org/2012/06/e_elsendo-el-la-26-06-2012/", "title": "E_elsendo el la 26.06.2012", "published": "2012-06-26 18:34:45+02:00", "content_text": "Podkasto: Ludu en nova fenestro | Elŝutu\n\nLa ĉefheroo de la 133-a E-elsendo de Pola retRadio ĉe https://pola-retradio.org estas ETERNE RIMA, kiun ni prezentas per lia plej nova KD “Taglibro de Brutulo” eldonita de Vinilkosmo. Krome ni proponas sciencan bultenon, temon el Pollando kaj informon pri la ĵus eldonita Jarlibro 2012 de UEA.", "author": null, "categories": ["Elsendoj"], "audio_links": ["/wp-content/uploads/2012/06/E_elsendo-el-la-26.06.2012-1.mp3"]}
{"url": "https://pola-retradio.org/2012/06/e_elsendo-el-la-29-06-2012/", "title": "E_elsendo el la 29.06.2012", "published": "2012-06-29 18:11:23+02:00", "content_text": "Podkasto: Ludu en nova fenestro | Elŝutu\n\nPri la Varsoviaj Sirenetoj ni parolas komence de nia 134-a E-elsendo kadre de “Bildkarto el Pollando”. Audiĝas krome la lasta fragmento de la rakonto de HORI Jasuo „Iitate, mia revo” kaj krome E-informoj kaj la leterkesta rendevuo. Ĉio ĉi ĉe: https://pola-retradio.org .", "author": null, "categories": ["Elsendoj"], "audio_links": ["/wp-content/uploads/2012/06/E_elsendo-el-la-29.06.2012.mp3"]}
{"url": "https://pola-retradio.org/2012/07/e_elsendo-el-la-03-07-2012/", "title": "E_elsendo el la 03.07.2012", "published": "2012-07-03 20:23:15+02:00", "content_text": "Podkasto: Ludu en nova fenestro | Elŝutu\n\nUnualoke estas menciinda la 1-a parto de la rememora prelego de d-ro U. Lins lige kun la vizitoj en la CO de UEA ĉe la strato Nieuwe Binnenweg en Roterdamo. En la 135a E-elsendo de Pola retRadio ĉe https://pola-retradio.org krome aŭdiĝas temoj Rekte el Pollando kaj Scienca bulteno.", "author": null, "categories": ["Elsendoj"], "audio_links": ["/wp-content/uploads/2012/07/E_elsendo-el-la-03.07.2012.mp3"]}
{"url": "https://pola-retradio.org/2012/07/e_elsendo-el-la-06-07-2012/", "title": "E_elsendo el la 06.07.2012", "published": "2012-07-06 20:08:05+02:00", "content_text": "Podkasto: Ludu en nova fenestro | Elŝutu\n\nKomence ni omaĝas la memoron de la Patro de la E-poezio, Antoni Grabowski. Krome en la 136-a elsendo de la Pola retRadio ĉe https://pola-retradio.org aŭdiĝas E-informoj. Fine la Redakcio invitas la radioamikojn renkontiĝi en Leterkesto. Kante akompanas nin Manuel kaj Remigiusz Kossakowski.", "author": null, "categories": ["Elsendoj"], "audio_links": ["/wp-content/uploads/2012/07/E_elsendo-el-la-06.07.2012.mp3"]}
{"url": "https://pola-retradio.org/2012/07/e_elsendo-el-la-10-07-2012/", "title": "E_elsendo el la 10.07.2012", "published": "2012-07-10 19:24:26+02:00", "content_text": "Podkasto: Ludu en nova fenestro | Elŝutu\n\nAparte rekomendinda estas ĉi-marde la 2-a parto de la prelego de d-ro Ulrich Lins pri rememoroj kaj eventoj el la 50-jara historio de la CO ĉe la sama adreso en Roterdamo. Komence ĉe https://pola-retradio.org aŭdiĝas temo el Pollando kaj scienca bulteno. En la 137-a E-elsendo kantas Andrzej Tomecki.", "author": null, "categories": ["Elsendoj"], "audio_links": ["/wp-content/uploads/2012/07/E_elsendo-el-la-10.07.2012.mp3"]}
{"url": "https://pola-retradio.org/2012/07/e_elsendo-el-la-13-07-2012/", "title": "E_elsendo el la 13.07.2012", "published": "2012-07-13 02:12:21+02:00", "content_text": "Podkasto: Ludu en nova fenestro | Elŝutu\n\nAntoni Grabowski – lige kun liaj junia-julia datrevenoj – estas la ĉeftemo de la 138-a E-elsendo ĉe la adreso: https://pola-retradio.org . Aŭdiĝas la 2-a parto de la porokaza felietono el Pola Esperantisto (3/2012). Krome radioarkivaĵo el 1959. En la fino – mallonga Leterkesta programero.", "author": null, "categories": ["Elsendoj"], "audio_links": ["/wp-content/uploads/2012/07/E_elsendo-el-la-13.07.2012.mp3"]}
{"url": "https://pola-retradio.org/2012/07/e_elsendo-el-la-17-07-2012/", "title": "E_elsendo el la 17.07.2012", "published": "2012-07-17 01:59:18+02:00", "content_text": "Podkasto: Ludu en nova fenestro | Elŝutu\n\nĈi-marde aŭdiĝas jam la 3-a parto de la prelego de d-ro Ulrich Lins rememore al homoj kaj eventoj en la 50-jara historio de la CO ĉe la sama adreso en Roterdamo. Komence ĉe https://pola-retradio.org aŭdiĝas temoj el Pollando kaj scienca bulteno. En 139-a E-elsendo kantas Ramona van Dalsem.", "author": null, "categories": ["Elsendoj"], "audio_links": ["/wp-content/uploads/2012/07/E_elsendo-el-la-17.07.2012.mp3"]}
{"url": "https://pola-retradio.org/2012/07/e_elsendo-el-la-20-07-2012/", "title": "E_elsendo el la 20.07.2012", "published": "2012-07-20 01:46:36+02:00", "content_text": "Podkasto: Ludu en nova fenestro | Elŝutu\n\nLa fortreso MODLIN estas la temo de nia nunsemajna Bildkarto el Pollando, nun nova flughaveno. Krome ĉe la adreso https://pola-retradio.org aŭdiĝas la tradicia Leterkesta programero. En la jam 140-a E-elsendo de la Pola retRadio kantas Dirce Sales „La estonto estas nun”", "author": null, "categories": ["Elsendoj"], "audio_links": ["/wp-content/uploads/2012/07/E_elsendo-el-la-20.07.2012.mp3"]}
{"url": "https://pola-retradio.org/2012/07/e_elsendo-el-la-24-07-2012/", "title": "E_elsendo el la 24.07.2012", "published": "2012-07-24 01:32:44+02:00", "content_text": "Podkasto: Ludu en nova fenestro | Elŝutu\n\nLa 141-a E-elsendo de Pola retRadio omaĝas per rememora arkivaĵo la ĵus forpasintan polan E-agantinon, aktorinon, Jadwiga Gibczyńska. Aŭdiĝas la 4-a kaj la lasta parto de la festparolado de d-ro Ulrich Lins dum la printempa MT. Komence ĉe https://pola-retradio.org aŭdiĝas temoj el Pollando.", "author": null, "categories": ["Elsendoj"], "audio_links": ["/wp-content/uploads/2012/07/E_elsendo-el-la-24.07.2012.mp3"]}
{"url": "https://pola-retradio.org/2012/07/e_elsendo-el-la-27-07-2012/", "title": "E_elsendo el la 27.07.2012", "published": "2012-07-27 20:35:01+02:00", "content_text": "Podkasto: Ludu en nova fenestro | Elŝutu\n\nEsperanto 125-jara, jen la ĉefvefto de nia 142-a elsendo. Nia gasto estas R. Haupethal, kun kiu ni interparolas pri la simpozio kaj ekspozicio de la Ŝtata Bavara Biblioteko. Leterkeste ni informas pri la planitaj renkontiĝoj kun geaŭskultantoj dum la Hanoja UK. Ĉio ĉi ĉe https://pola-retradio.org .", "author": null, "categories": ["Elsendoj"], "audio_links": ["/wp-content/uploads/2012/07/E_elsendo-el-la-27.07.2012.mp3"]}
{"url": "https://pola-retradio.org/2012/07/e_elsendo-el-la-28-07-2012/", "title": "E_elsendo el la 28.07.2012", "published": "2012-07-28 19:04:54+02:00", "content_text": "Podkasto: Ludu en nova fenestro | Elŝutu\n\nLa 1-a raporto el Hanojo, kie okazas la 97a UK de UEA enhavas retrorigardon al kelkaj elementoj de la finiĝinta labora kaj interkona tago, antaŭanta ĉiun Universalan Kongreson. Ĝi estas aŭdebla en la 143-a E-elsendo ĉe la adreso: https://pola-retradio.org .", "author": null, "categories": ["Elsendoj"], "audio_links": ["/wp-content/uploads/2012/07/E_elsendo-el-la-28.07.2012_b.mp3"]}
{"url": "https://pola-retradio.org/2012/07/e_elsendo-el-la-30-07-2012/", "title": "E_elsendo el la 30.07.2012", "published": "2012-07-30 18:52:23+02:00", "content_text": "Podkasto: Ludu en nova fenestro | Elŝutu\n\nLa raporto pri la 97-a UK rilatas unuavice al la dimanĉa Solena Inaŭguro. Kadre de ĝi aŭdiĝas la enkondukaj vortoj de Mark Fettes, la reĝisoro de la kongresa temo. Kelkvorte ni rilatas al la daŭranta lunda programo. Ĉio ĉi en la 144-a E-elsendo ĉe https://pola-retradio.org .", "author": null, "categories": ["Elsendoj"], "audio_links": ["/wp-content/uploads/2012/07/E_elsendo-el-la-30.07.2012.mp3"]}
{"url": "https://pola-retradio.org/2012/07/e_elsendo-el-la-31-07-2012/", "title": "E_elsendo el la 31.07.2012", "published": "2012-07-31 18:40:53+02:00", "content_text": "Podkasto: Ludu en nova fenestro | Elŝutu\n\nLa 145-a E-elsendo enhavas laŭvican kongresan raporton alrigarde al aktualaj kongresprogrameroj kun fragmenta cito el la bankeda tosta mesaĝo de H. Tonkin honore al UEA. Reference al la dimanĉa tago ni prezentas i.a. siluetojn de du novaj Honoraj Membroj. Ĉio ĉi ĉe https://pola-retradio.org .", "author": null, "categories": ["Elsendoj"], "audio_links": ["/wp-content/uploads/2012/07/E_elsendo-el-la-31.07.2012.mp3"]}
{"url": "https://pola-retradio.org/2012/08/e_elsendo-el-la-02-08-2012/", "title": "E_elsendo el la 02.08.2012", "published": "2012-08-02 21:54:55+02:00", "content_text": "Podkasto: Ludu en nova fenestro | Elŝutu\n\nVjetnam-rilataj programeroj kadre de la 97-a UK en Hanojo estas la temo de nia laŭvica sonraporto el la nunjara kongresurbo. Tiu ĉi programero estas aŭskultebla ĉe la adreso: https://pola-retradio.org .", "author": null, "categories": ["Elsendoj"], "audio_links": ["/wp-content/uploads/2012/08/E_elsendo-el-la-02.08.2012.mp3"]}
{"url": "https://pola-retradio.org/2012/08/e_elsendo-el-la-06-08-2012/", "title": "E_elsendo el la 06.08.2012", "published": "2012-08-06 21:40:56+02:00", "content_text": "Podkasto: Ludu en nova fenestro | Elŝutu\n\nHodiaŭ ni referencas al la 67-a datreveno de atombomba atako kontraŭ Hiroŝimon, i.a. informante pri “Pli sciu pri Hirosima”. La 97-a UK finiĝinta lastsabate en Hanojo speguliĝas per la kongresa raporto de la Ĝenerala Sekretario de UEA. Ĉio en la 147-a E-elsendo ĉe: https://pola-retradio.org .", "author": null, "categories": ["Elsendoj"], "audio_links": ["/wp-content/uploads/2012/08/E_elsendo-el-la-06.08.2012.mp3"]}
{"url": "https://pola-retradio.org/2012/08/e_elsendo-el-la-07-08-2012/", "title": "E_elsendo el la 07.08.2012", "published": "2012-08-07 21:24:50+02:00", "content_text": "Podkasto: Ludu en nova fenestro | Elŝutu\n\nEn nia 148-a E-elsendo la ĉefa sondokumento estas interparolo kun la reĝisoro de la kongresa temo Mark Fettes, kiu prezentas ankaŭ la kongresan rezolucion. Komence ni informas krome pri la nomoj de la kongresaj salonegoj, omaĝantaj elstarajn esperantistojn de la 97-a UK. Ĉio ĉi ĉe: https://pola-retradio.org .", "author": null, "categories": ["Elsendoj"], "audio_links": ["/wp-content/uploads/2012/08/E_elsendo-el-la-07.08.2012.mp3"]}
{"url": "https://pola-retradio.org/2012/08/e_elsendo-el-la-10-08-2012/", "title": "E_elsendo el la 10.08.2012", "published": "2012-08-10 21:24:34+02:00", "content_text": "Podkasto: Ludu en nova fenestro | Elŝutu\n\nLa nunsemajna Bildkarto el Pollando rilatas al vjetnamoj en Pollando, la plej multnombra grupo de eksterlandanoj. En la ĉiuvendreda Leterkesto unuavice ni konfirmas la reagojn je la dumkongresaj raportoj el la Hanoja UK. Ĉio ĉi en la 149-a E-elsendo de Pola retRadio ĉe https://pola-retradio.org .", "author": null, "categories": ["Elsendoj"], "audio_links": ["/wp-content/uploads/2012/08/E_elsendo-el-la-10.08.2012.mp3"]}
{"url": "https://pola-retradio.org/2012/08/e_elsendo-el-la-14-08-2012/", "title": "E_elsendo el la 14.08.2012", "published": "2012-08-14 20:56:01+02:00", "content_text": "Podkasto: Ludu en nova fenestro | Elŝutu\n\nScienca bulteno kaj literatura programero konsisitigas la enhavon de la 150-a E-elsendo ĉe http:/www.pola-/retradio.org . En la 71-a datreveno de la martira morto de Maksymilian Maria Kolbe ni prezentas fragmenton de la libro „La Dia Avarulo” de J. Dobraczyński en la E-traduko de B. Monkiewicz.", "author": null, "categories": ["Elsendoj"], "audio_links": ["/wp-content/uploads/2012/08/E_elendo-el-la-14.08.2012.mp3"]}
{"url": "https://pola-retradio.org/2012/08/e_elsendo-el-la-17-08-2012/", "title": "E_elsendo el la 17.08.2012", "published": "2012-08-17 18:38:21+02:00", "content_text": "Podkasto: Ludu en nova fenestro | Elŝutu\n\nLa hodiaŭa Bildkarto el Pollando memorigas la regionon de la apudvarsovia Wołomin, kiu gravis ankaŭ kuntekste de la pola-bolŝevista milito 1920. Krome la 151-a E-elsendo de Pola retRadio proponas E-informojn kaj leterkestan rendevuon ĉe https://pola-retradio.org .", "author": null, "categories": ["Elsendoj"], "audio_links": ["/wp-content/uploads/2012/08/E_elsendo-el-la-17.08.2012.mp3"]}
{"url": "https://pola-retradio.org/2012/08/e_elsendo-el-la-21-08-2012/", "title": "E_elsendo el la 21.08.2012", "published": "2012-08-21 18:11:19+02:00", "content_text": "Podkasto: Ludu en nova fenestro | Elŝutu\n\nPopulareco de la varsoviaj bicikloluejoj VETURILO speguliĝas en Temo el Pollando. Ni ligas al la Informa Seminario dum la Hanoja UK, kie kadre de la temo Rilati kun instancoj, estis prezentita kaj diskutita la kazo de Mazara del Vallo. Ĉio en la 152-a E-elsendo ĉe: https://pola-retradio.org .", "author": null, "categories": ["Elsendoj"], "audio_links": ["/wp-content/uploads/2012/08/E_elsendo-el-la-17.08.2012-1.mp3"]}
{"url": "https://pola-retradio.org/2012/08/e_elsendo-el-la-24-08-2012/", "title": "E_elsendo el la 24.08.2012", "published": "2012-08-24 17:57:52+02:00", "content_text": "Podkasto: Ludu en nova fenestro | Elŝutu\n\nInterparolo kun Alessandro Perna el la LKK de la 79-a rekte el la E-Kongreso en Italio en Mazara del Vallo kaj bildkarto el Pollando dediĉita al la pola Częstochowa konsistigas la enhavon de la 153-a E-elsendo de la Pola retRadio ĉe https://pola-retradio.org .", "author": null, "categories": ["Elsendoj"], "audio_links": ["/wp-content/uploads/2012/08/E_elsendo-el-la-24.08.2012.mp3"]}
{"url": "https://pola-retradio.org/2012/08/e_elsendo-el-la-28-08-2012/", "title": "E_elsendo el la 28.08.2012", "published": "2012-08-28 17:44:59+02:00", "content_text": "Podkasto: Ludu en nova fenestro | Elŝutu\n\nLa ĉefatenton en 154-a E-elsendo ni donas al sumigo de seminario „Sed homoj kaj homoj…” dum la itala E-Kongreso en Mazara del Vallo. Krome ni proponas la unuan retrorigardon al la turisma somero en Pollando kaj sciencan informon, senditan de Rangel Gotardi. Ĉio ĉe http:// www.pola-retradio.org .", "author": null, "categories": ["Elsendoj"], "audio_links": ["/wp-content/uploads/2012/08/E_elsendo-el-la-28.08.2012.mp3"]}
{"url": "https://pola-retradio.org/2012/08/e_elsendo-el-la-31-08-2012/", "title": "E_elsendo el la 31.08.2012", "published": "2012-08-31 02:52:05+02:00", "content_text": "Podkasto: Ludu en nova fenestro | Elŝutu\n\nPlebiscito por 7 novaj mirlokoj en Pollando, E-aktualaĵoj rilate la superajn kursojn kaj Leterkesto estas la temoj de la 155-a E-elsendo ĉe https://pola-retradio.org . En Leterkesto ni referencas i.a. per sondokumentoj al E-kongreso en Mazara del Vallo.", "author": null, "categories": ["Elsendoj"], "audio_links": ["/wp-content/uploads/2012/08/E_elsendo-el-la-31.08.2012.mp3"]}
{"url": "https://pola-retradio.org/2012/09/e_elsendo-el-la-04-09-2012/", "title": "E_elsendo el la 04.09.2012", "published": "2012-09-04 02:32:54+02:00", "content_text": "Podkasto: Ludu en nova fenestro | Elŝutu\n\nLa 33-a SUS de AIS en Varsovio speguliĝas per mallongaj interparoloj kun H. M. Maizen kaj R. Fössmeier. En la elsendo ni referencas al Metodika Seminario en Mazara del Vallo gastigante ĝian gvidantinon K. Kovats. Komence ĉe https://pola-retradio.org aŭdiĝas temoj el la pola gazetaro.", "author": null, "categories": ["Elsendoj"], "audio_links": ["/wp-content/uploads/2012/09/E_elsendo-el-la-04.09.2012.mp3"]}
{"url": "https://pola-retradio.org/2012/09/e_elsendo-el-la-07-09-2012/", "title": "E_elsendo el la 07.09.2012", "published": "2012-09-07 02:14:34+02:00", "content_text": "Podkasto: Ludu en nova fenestro | Elŝutu\n\nLa gotika grenstapleja komplekso en Grudziądz – difinata nun unu el 7 novaj mirlokoj de Pollando – estas la temo de nia komenca Bildkarto el Pollando. Ni memorigas pri datoj informtaŭgaj kiel la 21a kaj 26a de septembro. Fine en nia 157a E-elsendo ĉe https://pola-retradio.org aŭdiĝas Leterkesto.", "author": null, "categories": ["Elsendoj"], "audio_links": ["/wp-content/uploads/2012/09/E_elsendo-el-la-07.09.2012.mp3"]}
{"url": "https://pola-retradio.org/2012/09/e_elsendo-el-la-11-09-2012/", "title": "E_elsendo el la 11.09.2012", "published": "2012-09-11 21:12:34+02:00", "content_text": "Podkasto: Ludu en nova fenestro | Elŝutu\n\nHodiaŭ Monique Arnaud rakontas i.a. pri siaj impresoj el la metodika seminario dum la sicilia E-kongreso. En la elsendo kantas esperante la virtuala japana kantistino HATSUNE Miku. En la 158a programo ĉe https://pola-retradio.org aŭdiĝas komence temoj el la pola gazetaro kaj scienca bulteno. La permeso afiŝi la kanton de Hatsune Miku estis afable provizita fare de sinjoro HAYASI Kaneyuki (en la japana lingvo).", "author": null, "categories": ["Elsendoj"], "audio_links": ["/wp-content/uploads/2012/09/E_elsendo-el-la-11.09.2012.mp3"]}
{"url": "https://pola-retradio.org/2012/09/e_elsendo-el-la-14-09-2012/", "title": "E_elsendo el la 14.09.2012", "published": "2012-09-14 20:56:35+02:00", "content_text": "Podkasto: Ludu en nova fenestro | Elŝutu\n\nPaulo Sergio Viana, nia aŭskultanto el Brazilo renkontita en Sicilio estas gasto de nia ĉi-semajna leterkesta rendevuo. En la programo aŭdiĝas E-informoj, la komenca Bildkarto el Pollando priskribas ravan kaj vizitindan Kaveron Paradizo. Ĉio ĉi en la 159a E-elsendo ĉe: https://pola-retradio.org .", "author": null, "categories": ["Elsendoj"], "audio_links": ["/wp-content/uploads/2012/09/E_elsendo-el-la-14.09.2012.mp3"]}
{"url": "https://pola-retradio.org/2012/09/e_elsendo-el-la-18-09-2012/", "title": "E_elsendo el la 18.09.2012", "published": "2012-09-18 17:03:05+02:00", "content_text": "Podkasto: Ludu en nova fenestro | Elŝutu\n\nTrarigardo de la E-gazetaro kun atento al tiuj periodaĵoj, kiuj raportas diversfacete pri la Hanoja UK estas la E-rilata programero de la 160a E-elsendo. Ni informas ankaŭ pri nova kampanjo de Vinilkosmo. Komence ĉe https://pola-retradio.org aŭdiĝas temoj el la pola gazetaro kaj scienca bulteno.", "author": null, "categories": ["Elsendoj"], "audio_links": ["/wp-content/uploads/2012/09/E_elsendo-el-la-18.09.2012.mp3"]}
{"url": "https://pola-retradio.org/2012/09/e_elsendo-el-la-21-09-2012/", "title": "E_elsendo el la 21.09.2012", "published": "2012-09-21 16:48:53+02:00", "content_text": "Podkasto: Ludu en nova fenestro | Elŝutu\n\nLa 161a E-elsendo unualoke omaĝas la memoron de Zofia Banet-Fornal per sondokumento el la 1993 rilata al ŝiaj historiaj esploroj. Bildkarto el Pollando prezentas ĉe https://pola-retradio.org la Muelejan Insulon en Bydgoszcz. Lige kun la hodiaŭa Tago de Paco en la fino kantas R. van Dalsem.", "author": null, "categories": ["Elsendoj"], "audio_links": ["/wp-content/uploads/2012/09/E_elsendo-el-la-21.09.2012.mp3"]}
{"url": "https://pola-retradio.org/2012/09/e_elsendo-el-la-25-09-2012/", "title": "E_elsendo el la 25.09.2012", "published": "2012-09-25 16:34:53+02:00", "content_text": "Podkasto: Ludu en nova fenestro | Elŝutu\n\nLa interparolantoj de la 162-a E-elsendo estas I. kaj R. Colling el Brazilo renkontitaj en ARKONES. Muzike prezentiĝas ĉe: https://pola-retradio.org la koncertantaj dum la aranĝo: duopo Ĵele, Georgo Handzlik, JoMo kaj Anjo Amika. Komence aŭdiĝas temoj el la pola gazetaro kaj scienca bulteno.", "author": null, "categories": ["Elsendoj"], "audio_links": ["/wp-content/uploads/2012/09/E_elsendo-el-la-25.09.2012.mp3"]}
{"url": "https://pola-retradio.org/2012/09/e_elsendo-el-la-28-09-2012/", "title": "E_elsendo el la 28.09.2012", "published": "2012-09-28 21:18:00+02:00", "content_text": "Podkasto: Ludu en nova fenestro | Elŝutu\n\nLa 163a E-elsendo de Pola RetRadio en Leterkesto respegulas la reagojn je la forpaso de Zofia Banet-Fornal. La Bildkarto el Pollando kaj E-informoj referencas ĉe https://pola-retradio.org al la Imperiestra Kastelo en Poznano, la tieaj interlingvistikaj studoj kaj la 28-a ARKONES.", "author": null, "categories": ["Elsendoj"], "audio_links": ["/wp-content/uploads/2012/09/E_elsendo-el-la-28.09.2012.mp3"]}
{"url": "https://pola-retradio.org/2012/10/e_elsendo-el-la-02-10-2012/", "title": "E_elsendo el la 02.10.2012", "published": "2012-10-02 18:51:19+02:00", "content_text": "Podkasto: Ludu en nova fenestro | Elŝutu\n\nLa 1a parto de interparolo kun Carmen Malia, akompane de maltaj kantoj estas la ĉeftemo de nia 164-a elsendo ĉe https://pola-retradio.org . Komence aŭdiĝas temoj el la pola gazetaro kaj scienca bulteno. Ni memorigas la subtenan kampanjon de Vinilkosmo informante pri la preparata okcitana KD.", "author": null, "categories": ["Elsendoj"], "audio_links": ["/wp-content/uploads/2012/10/E_elsendo-el-la-02.10.2012.mp3"]}
{"url": "https://pola-retradio.org/2012/10/e_elsendo-el-la-05-10-2012/", "title": "E_elsendo el la 05.10.2012", "published": "2012-10-05 18:37:56+02:00", "content_text": "Podkasto: Ludu en nova fenestro | Elŝutu\n\nE-informoj, revizito en la loko Paczków, al kiu invitas Gabi, kaj la leterkesta renkontiĝo konsistigas la enhavon de la 165-E-elsendo de Varsovia Pola retRadio ĉe la adreso – https://pola-retradio.org .", "author": null, "categories": ["Elsendoj"], "audio_links": ["/wp-content/uploads/2012/10/E_elsendo-el-la-05.10.2012.mp3"]}
{"url": "https://pola-retradio.org/2012/10/e_elsendo-el-la-09-10-2012/", "title": "E_elsendo el la 09.10.2012", "published": "2012-10-09 18:24:23+02:00", "content_text": "Podkasto: Ludu en nova fenestro | Elŝutu\n\nTemo el Pollando, scienca bulteno kaj la 2-a parto de interparolo kun Carmen Malia el Malto kun fragmento de lia tradukaĵo el la malta lingvo konsistigas la 166-an E-elsendon de Pola retRadio ĉe https://pola-retradio.org .  En la hodiaŭa elsendo kantas Magnus (Elektronika Kompilo, Vinilkosmo).", "author": null, "categories": ["Elsendoj"], "audio_links": ["/wp-content/uploads/2012/10/E_elsendo-el-la-09.10.2012.mp3"]}
{"url": "https://pola-retradio.org/2012/10/e_elsendo-el-la-12-10-2012/", "title": "E_elsendo el la 12.10.2012", "published": "2012-10-12 18:09:22+02:00", "content_text": "Podkasto: Ludu en nova fenestro | Elŝutu\n\nE-informoj, felietono reinvitanta al Pollando, al la loko Szczytno kaj krome leterkesta rendevuo konsistigas la enhavon de la 167-a E-elsendo de la Pola Retradio. Ĝi estas aŭdebla pere de la adreso – https://pola-retradio.org .", "author": null, "categories": ["Elsendoj"], "audio_links": ["/wp-content/uploads/2012/10/E_elsendo-el-la-12.10.2012.mp3"]}
{"url": "https://pola-retradio.org/2012/10/e_elsendo-el-la-16-10-2012/", "title": "E_elsendo el la 16.10.2012", "published": "2012-10-16 17:54:10+02:00", "content_text": "Podkasto: Ludu en nova fenestro | Elŝutu\n\nAktualaĵoj, temoj el la pola gazetaro, scienca bulteno kaj interparolo kun Luis Serrano Perez pri la 20a Internacia E-Semajno en Cambrils, Hispanio (06-13.10.2012) estas la temoj de la 168-a E-elsendo de la Pola RetRadio ĉe la adreso: https://pola-retradio.org .", "author": null, "categories": ["Elsendoj"], "audio_links": ["/wp-content/uploads/2012/10/E_elsendo-el-la-16.10.2012.mp3"]}
{"url": "https://pola-retradio.org/2012/10/e_elsendo-el-la-19-10-2012/", "title": "E_elsendo el la 19.10.2012", "published": "2012-10-19 17:41:04+02:00", "content_text": "Podkasto: Ludu en nova fenestro | Elŝutu\n\nE-informoj, unualoke pri la lastmerkreda E-evento en la pola Senato, bildkarto el Pollando pri la Karpatia Trojo kaj la interparolo kun Tonjo del Barrio, kiel aŭskultanto de la E-elsendoj de Pola RetRadio kadre de Leterkesto estas aŭdeblaj en la 169-a E-elsendo ĉe https://pola-retradio.org .", "author": null, "categories": ["Elsendoj"], "audio_links": ["/wp-content/uploads/2012/10/E_elsendo-el-la-19.10.2012.mp3"]}
{"url": "https://pola-retradio.org/2012/10/e_elsendo-el-la-23-10-2012/", "title": "E_elsendo el la 23.10.2012", "published": "2012-10-23 17:26:24+02:00", "content_text": "Podkasto: Ludu en nova fenestro | Elŝutu\n\nInterparolo kun Mark Fettes pri UEA-strategio kaj lia persona vizio kiel prezidanto-kandidato aŭdiĝas en la 170-a E-elsendo de la varsovia Pola Retradio – https://pola-retradio.org . Komence troviĝas: aktualaĵoj, temoj el la pola gazetaro kaj scienca bulteno. Kantas Jandwiga Dzięgielewska.", "author": null, "categories": ["Elsendoj"], "audio_links": ["/wp-content/uploads/2012/10/E_elsendo-el-la-23.10.2012.mp3"]}
{"url": "https://pola-retradio.org/2012/10/e_elsendo-el-la-26-10-2012/", "title": "E_elsendo el la 26.10.2012", "published": "2012-10-26 16:21:04+02:00", "content_text": "Podkasto: Ludu en nova fenestro | Elŝutu\n\nPri vizitinda Kastelo Czocha ni rakontas komence de la 171-a E-elsendo de la Pola RetRadio ( https://pola-retradio.org ). Sekvas E-informoj kaj Leterkesto kun reagoj je la laste venintaj leteroj de niaj aŭskultantoj. Muzike ni referencas al la brazila KD – “Tom Jobim en Esperanto”.", "author": null, "categories": ["Elsendoj"], "audio_links": ["/wp-content/uploads/2012/10/E_elsendo-el-la-26.10.2012.mp3"]}
{"url": "https://pola-retradio.org/2012/10/e_elsendo-el-la-30-10-2012/", "title": "E_elsendo el la 30.10.2012", "published": "2012-10-30 20:44:21+01:00", "content_text": "Podkasto: Ludu en nova fenestro | Elŝutu\n\nInterparolo pri interesa varsovia konferenco estas la temo de interparolo kun la partopreninta ĝin Adonis Saliba el Brazilo. Komence de la 172-a E-elsendo de Pola Retradio ĉe: https://pola-retradio.org aŭdiĝas aktualaĵoj, temoj el la pola gazetaro kaj scienca bulteno. Kantas Joel de Castro.", "author": null, "categories": ["Elsendoj"], "audio_links": ["/wp-content/uploads/2012/10/E_elsendo-el-la-30.10.2012.mp3"]}
{"url": "https://pola-retradio.org/2012/11/e_elsendo-el-la-02-11-2012/", "title": "E_elsendo el la 02.11.2012", "published": "2012-11-02 20:25:11+01:00", "content_text": "Podkasto: Ludu en nova fenestro | Elŝutu\n\nLa komenco de novembro kutime direktas pensojn al la forpasintaj familianoj, konatoj – la paŝojn al tombejoj. Porokaza felietono aŭdiĝas komence de la 173-a E-elsendo ĉe https://pola-retradio.org . Sekvas E-informoj kaj nunsemajna Leterkesto kun opinioj kaj pritaksoj de niaj geauskultantoj.", "author": null, "categories": ["Elsendoj"], "audio_links": ["/wp-content/uploads/2012/11/E_elsendo-el-la-02.11.2012.mp3"]}
{"url": "https://pola-retradio.org/2012/11/e_elsendo-el-la-06-11-2012/", "title": "E_elsendo el la 06.11.2012", "published": "2012-11-06 20:12:54+01:00", "content_text": "Podkasto: Ludu en nova fenestro | Elŝutu\n\nLaborinspire ni interparolas kun la prezidanto de Esperanto-France, Axel Rousseau. Komence de la 174-a varsovia E-elsendo ĉe https://pola-retradio.org ni proponas aktualaĵojn, temojn el la pola gazetaro kaj sciencan bultenon. Kantas Duoble Unu sian kanton “Bonŝancon” el la KD “Senlimiĝis”.", "author": null, "categories": ["Elsendoj"], "audio_links": ["/wp-content/uploads/2012/11/E_elsendo-el-la-06.11.2012.mp3"]}
{"url": "https://pola-retradio.org/2012/11/e_elsendo-el-la-09-11-2012/", "title": "E_elsendo el la 09.11.2012", "published": "2012-11-09 19:55:38+01:00", "content_text": "Podkasto: Ludu en nova fenestro | Elŝutu\n\nBildkarto el Pollando pri la loko Stary Browar kaj informo pri Festivalo de I. J. Paderewski en Kalifornio referencas i.a. malrekte al la festota Tago de Sendependeco, la 11-an de novembro. Krome en la 175-a E-elsendo ĉe https://pola-retradio.org audiĝas E-informoj kaj Leterkesto.", "author": null, "categories": ["Elsendoj"], "audio_links": ["/wp-content/uploads/2012/11/E_elsendo-el-la-09.11.2012.mp3"]}
{"url": "https://pola-retradio.org/2012/11/e_elsendo-el-la-13-11-2012/", "title": "E_elsendo el la 13.11.2012", "published": "2012-11-13 21:33:14+01:00", "content_text": "Podkasto: Ludu en nova fenestro | Elŝutu\n\nKadre de la ĉiumarda E-elsendo ni prezentas la unuan KD-on de Vinilkosmo aperigitan kadre de Promeskampanjo. Temas pri “Okcitanio” de Patric. Komence de la 176-a programo ĉe https://pola-retradio.org aŭdiĝas aktualaĵoj, temoj el la pola gazetaro kaj scienca bulteno.", "author": null, "categories": ["Elsendoj"], "audio_links": ["/wp-content/uploads/2012/11/E_elsendo-el-la-13.11.2012.mp3"]}
{"url": "https://pola-retradio.org/2012/11/e_elsendo-el-la-16-11-2012/", "title": "E_elsendo el la 16.11.2012", "published": "2012-11-16 21:16:36+01:00", "content_text": "Podkasto: Ludu en nova fenestro | Elŝutu\n\nSierpc kaj ĝia Muzeo de Mazovia Kamparo speguliĝas en la nunsemajna Bildkarto el Pollando. Sekvas E-informoj kaj leterkesto, al kiu propravoĉe kontribuas la ĉina aŭskultanto, Trezoro. Ni prezentas en la 177a E-elsendo ĉe https://pola-retradio.org ankaŭ la plej novan E-kanton de M. Domaszewicz.", "author": null, "categories": ["Elsendoj"], "audio_links": ["/wp-content/uploads/2012/11/E_elsendo-el-la-16.11.2012.mp3"]}
{"url": "https://pola-retradio.org/2012/11/e_elsendo-el-la-20-11-2012/", "title": "E_elsendo el la 20.11.2012", "published": "2012-11-20 20:55:04+01:00", "content_text": "Podkasto: Ludu en nova fenestro | Elŝutu\n\nProksimiĝas Zamenhof-Tagoj i.a. en Pollando. Ni informas pri planataj festoj en Bjalistoko kaj en Bydgoszcz. Komence de la 179a E-elsendo audiĝas aktualaĵoj kaj temoj el la pola gazetaro. Ĉe https://pola-retradio.org sian unuan sciencan felietonom prezentas Tomasz Miller. Kantas Georgo Handzlik.", "author": null, "categories": ["Elsendoj"], "audio_links": ["/wp-content/uploads/2012/11/E_elsendo-el-la-20.11.2012.mp3"]}
{"url": "https://pola-retradio.org/2012/11/e_elsendo-el-la-23-11-2012/", "title": "E_elsendo el la 23.11.2012", "published": "2012-11-23 20:39:22+01:00", "content_text": "Podkasto: Ludu en nova fenestro | Elŝutu\n\nLa gasto de nia Leterkesta rendevuo en la 180-a E-programo de Pola RetRadio ĉe https://pola-retradio.org estas brazila aŭskultanto, Adonis Saliba. Krome mi prezentas la reĝan kastelon Bobolice kaj sciigas E-informojn.", "author": null, "categories": ["Elsendoj"], "audio_links": ["/wp-content/uploads/2012/11/E_elsendo-el-la-23.11.2012.mp3"]}
{"url": "https://pola-retradio.org/2012/11/e_elsendo-el-la-27-11-2012/", "title": "E_elsendo el la 27.11.2012", "published": "2012-11-27 20:20:15+01:00", "content_text": "Podkasto: Ludu en nova fenestro | Elŝutu\n\nAktualaĵoj, temoj el la pola gazetaro kaj scienca bulteno okupas la ĉeflokon en nia 181-a E-elsendo ĉe https://pola-retradio.org . Nia antaŭmikrofona gasto estas Mateusz Kempisty, juna varsovia esperantisto kaj nia kunlaboranto.", "author": null, "categories": ["Elsendoj"], "audio_links": ["/wp-content/uploads/2012/11/E_elsendo-el-la-27.11.2012.mp3"]}
{"url": "https://pola-retradio.org/2012/11/e_elsendo-el-la-30-11-2012/", "title": "E_elsendo el la 30.11.2012", "published": "2012-11-30 20:00:28+01:00", "content_text": "Podkasto: Ludu en nova fenestro | Elŝutu\n\nEn Berlino komenciĝas hodiaŭ la Internacia Korczak-Festivalo. Pri tio ni parolas informe komence ĉe https://pola-retradio.org . Sekve estas prezentita unu el la novaj vidindaĵoj de Pollando, kiu estas la Mielkuka Muzeo en Toruń. Aŭdiĝas E-informoj. Fine estas la okazo renkontiĝi kadre de Leterkesto.", "author": null, "categories": ["Elsendoj"], "audio_links": ["/wp-content/uploads/2012/11/E_elsendo-el-la-30.11.2012.mp3"]}
{"url": "https://pola-retradio.org/2012/12/e_elsendo-el-la-04-12-2012/", "title": "E_elsendo el la 04.12.2012", "published": "2012-12-04 01:28:37+01:00", "content_text": "Podkasto: Ludu en nova fenestro | Elŝutu\n\nZamenhof-Tago en Varsovio, aktualaĵoj, temoj el la pola gazetaro kaj scienca bulteno jen programeroj aŭdiĝantaj komence de la 182 E-elsendo ĉe https://pola-retradio.org . Kelkan atenton ni donas al vegetarismo en Pollando. Muzike akompanas nin per siaj E-kantoj JoMo kaj Ramona van Dalsem.", "author": null, "categories": ["Elsendoj"], "audio_links": ["/wp-content/uploads/2012/12/E_elsendo-el-la-04.12.2012.mp3"]}
{"url": "https://pola-retradio.org/2012/12/e_elsendo-el-la-07-12-2012/", "title": "E_elsendo el la 07.12.2012", "published": "2012-12-07 01:12:50+01:00", "content_text": "Podkasto: Ludu en nova fenestro | Elŝutu\n\nKastelo de Pomeriaj Princoj en Szczecin (la nordokcienta Pollando) estas la nunsemajna vidindaĵo, kiun ni prezentas komence de la vendreda elsendo. Sekve ĉe https://pola-retradio.org aŭdiĝas E-informoj kaj iom ampleksa leterkesta rendevuo. Ĉio ĉi jam en la 183-a E-elsendo de Pola retRadio.", "author": null, "categories": ["Elsendoj"], "audio_links": ["/wp-content/uploads/2012/12/E_elsendo-el-la-07.12.2012.mp3"]}
{"url": "https://pola-retradio.org/2012/12/e_elsendo-el-la-11-12-2012/", "title": "E_elsendo el la 11.12.2012", "published": "2012-12-11 21:11:26+01:00", "content_text": "Podkasto: Ludu en nova fenestro | Elŝutu\n\nProf. Humphrey Tonkin estas antaŭmikrofona gasto de la 184-a E-elsendo ĉe: https://pola-retradio.org . La interparolo referencas al lia prelego dum Malferma Tago en la Centra Oficejo de UEA. Komence aŭdiĝas aktualaĵoj, temoj el la pola gazetaro kaj scienca bulteno. Kantas Ĵomart kaj Nataŝa.", "author": null, "categories": ["Elsendoj"], "audio_links": ["/wp-content/uploads/2012/12/E_elsendo-el-la-11.12.2012.mp3"]}
{"url": "https://pola-retradio.org/2012/12/e_elsendo-el-la-14-12-2012/", "title": "E_elsendo el la 14.12.2012", "published": "2012-12-14 20:52:25+01:00", "content_text": "Podkasto: Ludu en nova fenestro | Elŝutu\n\nNia ĉi-semajna vidindaĵo de Pollando estas la postindustria kvartalo de Lodzo, Księży Młyn. Krome en la 185-a E-elsendo ĉe https://pola-retradio.org aŭdiĝas E-informoj kaj Leterkesto. La kanto Zamenhof devenas el la disko Esperanto; la kanton Homarano plenumas Alejandro Cosavella.", "author": null, "categories": ["Elsendoj"], "audio_links": ["/wp-content/uploads/2012/12/E_elsendo-el-la-14.12.2012.mp3"]}
{"url": "https://pola-retradio.org/2012/12/e_elsendo-el-la-18-12-2012/", "title": "E_elsendo el la 18.12.2012", "published": "2012-12-18 20:36:37+01:00", "content_text": "Podkasto: Ludu en nova fenestro | Elŝutu\n\nEn la marda E-elsendo el Varsovio aŭdiĝas interparolo kun A. Korĵenkov pri liaj zamenhofologiaj laboroj, ĉi-jare dediĉitaj al Marko Zamenhof. Komence aŭdeblas ĉe https://pola-retradio.org aktualaĵoj, temoj el la pola gazetaro kaj scienca bulteno. Ni informas pri la projekto “Kredu Kristnaskon”.", "author": null, "categories": ["Elsendoj"], "audio_links": ["/wp-content/uploads/2012/12/E_elsendo-el-la-18.12.2012.mp3"]}
{"url": "https://pola-retradio.org/2012/12/e_elsendo-el-la-21-12-2012/", "title": "E_elsendo el la 21.12.2012", "published": "2012-12-21 21:24:28+01:00", "content_text": "Podkasto: Ludu en nova fenestro | Elŝutu\n\nVizito en la Kapelo de s-ta Triunuo en Lublin inaŭguras la 187-an E-elsendon ĉe http:/www.pola-retradio.org. Sekvas E-informoj kaj Leterkesto. La tutan elsendon riĉigas multaj porokazaj (Advento kaj Kristnasko) muzikaj citaĵoj i.a. el polaj adventaj kantoj, la kantogrupo KTP kaj Ralph Glomp.", "author": null, "categories": ["Elsendoj"], "audio_links": ["/wp-content/uploads/2013/11/E_elsendo-el-la-21.12.2012.mp3"]}
{"url": "https://pola-retradio.org/2012/12/e_elsendo-el-la-25-12-2012/", "title": "E_elsendo el la 25.12.2012", "published": "2012-12-25 21:08:33+01:00", "content_text": "Podkasto: Ludu en nova fenestro | Elŝutu\n\nLa Kristnaska etoso plenigas la tutan 188-an E-elsendon ĉe https://pola-retradio.org . Unue ni prezentas felietonon pri polaj kristnaskaj kripetoj. Sekvas ero pri pastro Jan Twardowski kun specimena traduko de liaj kvar versaĵoj. Muzike ni ĉerpas el polaj kaj alilandaj kristnaskaj kantoj en E-o.", "author": null, "categories": ["Elsendoj"], "audio_links": ["/wp-content/uploads/2013/11/E_elsendo-el-25.12.2012.mp3"]}
{"url": "https://pola-retradio.org/2012/12/e_elsendo-el-la-28-12-2012/", "title": "E_elsendo el la 28.12.2012", "published": "2012-12-28 20:32:11+01:00", "content_text": "Podkasto: Ludu en nova fenestro | Elŝutu\n\nLa 189-an E-elsendon inaŭguras vizita enrigardo en polajn muzeajn horloĝajn kolektojn. Ja temas pri la lasta en 2012 varsovia programo. Aŭdiĝas krome E-informoj kaj bondezira Leterkesto kun kelkaj statistikaj retrorigardoj.", "author": null, "categories": ["Elsendoj"], "audio_links": ["/wp-content/uploads/2013/11/E_elsendo-el-la-28.12.2012.mp3"]}
