url,title,published,author,categories,audio_links
https://www.monato.be/2023/012832.php?p,Kamparanoj en urboj,2023-01-01T00:00:00,XU Jinming,"Aktuale,ĈINIO,Moderna vivo",
https://www.monato.be/2023/012967.php?p,Pliiĝas lokaj altteknologiaj entreprenoj,2023-01-01T00:00:00,Juan Carlos MONTERO MEDINA,"Aktuale,KUBO,Scienco",
https://www.monato.be/2023/012990.php?p,Homoj kaj Canis lupus,2023-01-01T00:00:00,LAST,"Aktuale,BESTOJ,Moderna vivo",
https://www.monato.be/2023/013051.php?p,Polenado,2023-01-01T00:00:00,Julius HAUSER,"Aktuale,NATURO,Moderna vivo",
https://www.monato.be/2023/013106.php?p,Diana Abgar: la unua ambasadorino de la mondo,2023-01-01T00:00:00,Lida ELBAKJAN,"Aktuale,ARMENIO,Historio",
https://www.monato.be/2023/013159.php?p,Nova plago inter junuloj,2023-01-01T00:00:00,Giovanni BIANCHINI,"Aktuale,PORNOGRAFIO,Moderna vivo",
https://www.monato.be/2023/013161.php?p,Ĉu facilas esti najbaro de potenca urbo?,2023-01-01T00:00:00,Frédéric DüE,"Aktuale,GERMANIO,Faras bruon, gajnas monon",
https://www.monato.be/2023/013206.php?p,Ĉu maŝintradukado anstataŭos tradukistojn?,2023-01-01T00:00:00,Filip IVANčIć,"Aktuale,AKTUALE,Lingvo",
https://www.monato.be/2023/013210.php?p,Defio por la senegala kunordiganto,2023-01-01T00:00:00,Julius HAUSER,"Aktuale,LIBIO,El diplomatia vidpunkto",
https://www.monato.be/2023/013218.php?p,Bestoj kaj la origino de lingvaĵo,2023-01-01T00:00:00,Garbhan MACAOIDH,"Aktuale,OPINIO,Sciencistaj teorioj",
https://www.monato.be/2023/013219.php?p,La plurmiljaraĝa elama linia skribo fine malĉifriĝis,2023-01-01T00:00:00,Giovanni BIANCHINI,"Aktuale,ITALIO/IRANO,Lingvo",
https://www.monato.be/2023/013224.php?p,Elstara muzikensemblo honoriĝas,2023-01-01T00:00:00,Garbhan MACAOIDH,"Aktuale,MUZIKO,Arto",
https://www.monato.be/2023/013230.php?p,Ĉu Koreio malaperos?,2023-01-01T00:00:00,CHO Sung Ho,"Aktuale,SOCIO,Moderna vivo",
https://www.monato.be/2023/013234.php?p,Rilatoj kun la mondo kaj kun la najbaroj,2023-01-01T00:00:00,Leonardo ARAYA,"Aktuale,ĈILIO,Ekonomio",
https://www.monato.be/2023/013235.php?p,"Komplotteorioj, dietsuplementoj kaj ekstrema dekstro",2023-01-01T00:00:00,Ed HEIL,"Aktuale,USONO,POLITIKO",
https://www.monato.be/2023/013238.php?p,Nitrogen-krizo en Nederlando,2023-01-01T00:00:00,Bert DE WIT,"Aktuale,AKTUALE,Scienco",
https://www.monato.be/2023/013239.php?p,La granda malkovro de Grakliani en Kartvelio,2023-01-01T00:00:00,Tea TURMANIDZE,"Aktuale,ARKEOLOGIO,Scienco",
https://www.monato.be/2023/013241.php?p,Ekonomia kresko draste malaltiĝos,2023-01-01T00:00:00,Evgeni GEORGIEV,"Aktuale,ORIENT-EŬROPO,Ekonomio",
https://www.monato.be/2023/013242.php?p,Najbara vidpunkto,2023-01-01T00:00:00,Daniel ACOSTA,"Aktuale,#LULA2022,Politiko",
https://www.monato.be/2023/013251.php?p,"Netanjahu, denove",2023-01-01T00:00:00,Nican CVI KOHEN,"Aktuale,ISRAELO,Politiko",
https://www.monato.be/2023/013162.php?p,"Klimatŝanĝo, marbordaj inundoj kaj eventualaj solvoj",2023-02-01T00:00:00,Ali Aulia GHOZALI,"Aktuale,ESTONTECO,Medio",
https://www.monato.be/2023/013179.php?p,"Matematika inspiro, sed mallerta satiro",2023-02-01T00:00:00,Edmund GRIMLEY EVANS,"Aktuale,Kion oni satiras?",
https://www.monato.be/2023/013214.php?p,Ĉu ŝanĝo de landlimoj? Apenaŭ.,2023-02-01T00:00:00,Julius HAUSER,"Aktuale,AFRIKO,El diplomatia vidpunkto",
https://www.monato.be/2023/013220.php?p,"Ju pli da vitaminoj, des pli bone. Ĉu?",2023-02-01T00:00:00,Cristina CASELLA,"Aktuale,NUTRADO,Scienco",
https://www.monato.be/2023/013237.php?p,De revo al realo,2023-02-01T00:00:00,Jezer DORANTE,"Aktuale,VENEZUELO,Politiko",
https://www.monato.be/2023/013240.php?p,Ĉu zebrofiŝoj kuracos neŭrologiajn malsanojn?,2023-02-01T00:00:00,Juan Carlos MONTERO MEDINA,"Aktuale,KUBO,Scienco",
https://www.monato.be/2023/013243.php?p,La mistera tria viro,2023-02-01T00:00:00,Garbhan MACAOIDH,"Aktuale,ESEO,Scienco",
https://www.monato.be/2023/013244.php?p,Ne tute mortis la antikva egipta lingvo,2023-02-01T00:00:00,Michał ŁABENDA,"Aktuale,EGIPTIO,Lingvo",
https://www.monato.be/2023/013250.php?p,Armenaj skribiloj kun semoj,2023-02-01T00:00:00,Lida ELBAKJAN,"Aktuale,EKOLOGIO,Moderna vivo",
https://www.monato.be/2023/013258.php?p,Bronza mano prilumas la praeŭskan lingvon,2023-02-01T00:00:00,Albert CLARET,"Aktuale,EŬSKIO,Lingvo",
https://www.monato.be/2023/013259.php?p,Venezuelaj infanoj en panama ĝangalo,2023-02-01T00:00:00,Jezer DORANTE,"Aktuale,MIGRADO,Moderna vivo",
https://www.monato.be/2023/013261.php?p,Transpasi Manikon per boatoj,2023-02-01T00:00:00,Bardhyl SELIMI,"Aktuale,MIGRADO,Moderna vivo",
https://www.monato.be/2023/013262.php?p,Kataro: ruĝa karto,2023-02-01T00:00:00,Tommaso MELACOTTE,"Aktuale,FUTBALO,Ekonomio",
https://www.monato.be/2023/013263.php?p,Malliberejo pro ekocido,2023-02-01T00:00:00,pp,"Aktuale,JURO,Medio",
https://www.monato.be/2023/013264.php?p,Novaj sunpaneloj sen PFAS,2023-02-01T00:00:00,Bert DE WIT,"Aktuale,ENERGIO,Medio",
https://www.monato.be/2023/013266.php?p,Ĉesigu tuj la pafadon!,2023-02-01T00:00:00,Tommaso MELACOTTE,"Aktuale,MILITO EN UKRAINIO,Moderna vivo",
https://www.monato.be/2023/013271.php?p,Leteroj el Moskvo,2023-02-01T00:00:00,A. A.,"Aktuale,TAGLIBRO DE L' MILITO",
https://www.monato.be/2023/013272.php?p,Ĉu televido prosperas kaj fiaskas?,2023-02-01T00:00:00,LAST,"Aktuale,BALTIO,Politiko",
https://www.monato.be/2023/013273.php?p,Fanatikula voĉdonado,2023-02-01T00:00:00,Marcionilo VASCONCELOS,"Aktuale,#LULA2022,Politiko",
https://www.monato.be/2023/012931.php?p,"Pupteatro beletra, unuvoĉa",2023-03-01T00:00:00,Stanislavo BELOV,"Aktuale,Leteroj longaj, edifaj, tedaj",
https://www.monato.be/2023/013126.php?p,Tragedia rakonto,2023-03-01T00:00:00,Anna LöWENSTEIN,"Aktuale,La monstro edukas sin mem",
https://www.monato.be/2023/013199.php?p,Materia kaj spirita entoj,2023-03-01T00:00:00,Nikita PIMENOV,"Aktuale,KULTURO,Filozofio",
https://www.monato.be/2023/013202.php?p,Por ekzameniĝi sen problemoj,2023-03-01T00:00:00,Renato CORSETTI,"Aktuale,Paroli Esperanton bone",
https://www.monato.be/2023/013216.php?p,Ĉu demografia ŝanĝo kondukos al unuiĝo?,2023-03-01T00:00:00,Garbhan MACAOIDH,"Aktuale,IRLANDO,Politiko",
https://www.monato.be/2023/013223.php?p,"Maks, Lora kaj Roland",2023-03-01T00:00:00,Julian MODEST,"Aktuale,RAKONTO,Literaturo",
https://www.monato.be/2023/013255.php?p,Naturismo kaj Esperanto: komuneco de destinoj,2023-03-01T00:00:00,Patrick CHEVALIER,"Aktuale,ESEO,Historio",
https://www.monato.be/2023/013267.php?p,Revivigi indiĝenajn lingvojn,2023-03-01T00:00:00,Jezer DORANTE,"Aktuale,VENEZUELO,Lingvo",
https://www.monato.be/2023/013269.php?p,Milito kaj arto,2023-03-01T00:00:00,CHO Sung Ho,"Aktuale,MUZIKO,Arto",
https://www.monato.be/2023/013277.php?p,Teruraĵo kontraŭ Abe Shinzo malfermis la skatolon de Pandoro,2023-03-01T00:00:00,HATACHI Toshiko,"Aktuale,JAPANIO,Moderna vivo",
https://www.monato.be/2023/013278.php?p,Pliiĝis la kultivado de opio,2023-03-01T00:00:00,Evgeni GEORGIEV,"Aktuale,AFGANIO,Moderna vivo",
https://www.monato.be/2023/013281.php?p,Pentristo de la nigro,2023-03-01T00:00:00,Renée TRIOLLE,"Aktuale,PENTRARTO,Arto",
https://www.monato.be/2023/013284.php?p,Teritoriaj disputoj foriĝis. Kaj nun?,2023-03-01T00:00:00,Leonardo ARAYA,"Aktuale,ĈILIO/BOLIVIO/PERUO,Politiko",
https://www.monato.be/2023/013285.php?p,Kurboriĉa vojo al demokratio,2023-03-01T00:00:00,Julius HAUSER,"Aktuale,D. R. KONGO,El diplomatia vidpunkto",
https://www.monato.be/2023/013286.php?p,Olaf Scholz kaj Wirecard: la forgesema kanceliero,2023-03-01T00:00:00,Martin PTASINSKI,"Aktuale,GERMANIO,Ekonomio",
https://www.monato.be/2023/012010.php?p,Fascino de etaj insuloj,2023-04-01T00:00:00,Garbhan MACAOIDH,"Aktuale,NATURO,La skotlandaj insuloj",
https://www.monato.be/2023/012031.php?p,Nova modo plivastiĝas,2023-04-01T00:00:00,Roberto PIGRO,"Aktuale,LUDOJ,Moderna vivo",
https://www.monato.be/2023/013034.php?p,Jen antologia omaĝo!,2023-04-01T00:00:00,Fernando PITA,"Aktuale,Plej elstara",
https://www.monato.be/2023/013245.php?p,Ĉu la plej granda akvofalo estas submara?,2023-04-01T00:00:00,Juan Carlos MONTERO MEDINA,"Aktuale,NATURFENOMENOJ,Medio",
https://www.monato.be/2023/013252.php?p,"La hispana en Ameriko: apartaĵoj, unikeco, identeco",2023-04-01T00:00:00,Leonardo ARAYA,"Aktuale,OPINIO,Ksenofobio",
https://www.monato.be/2023/013268.php?p,Venezuelo kaj Ĉinio kunlaboris,2023-04-01T00:00:00,Jezer DORANTE,"Aktuale,SATELITOJ,Scienco",
https://www.monato.be/2023/013280.php?p,Omaĝo al la svedo Arne Karlsson,2023-04-01T00:00:00,Renate kaj Walter KLAG,"Aktuale,AŬSTRIO,Moderna vivo",
https://www.monato.be/2023/013282.php?p,Fuĝantoj bonvenaj kaj ne bonvenaj,2023-04-01T00:00:00,Werner FUß,"Aktuale,MIGRADO,Moderna vivo",
https://www.monato.be/2023/013283.php?p,Historia disputo,2023-04-01T00:00:00,Jezer DORANTE,"Aktuale,VENEZUELO/GUJANO,Politiko",
https://www.monato.be/2023/013298.php?p,Aviadilaj 5G-aparatoj: novaĵoj por eŭropaj vojaĝantoj,2023-04-01T00:00:00,Paolo OMODEI-ZORINI,"Aktuale,AKTUALE,Scienco",
https://www.monato.be/2023/013304.php?p,Militaj tagoj vide de interne,2023-04-01T00:00:00,Diccon MASTERMAN,"Aktuale,D. R. KONGO,Politiko",
https://www.monato.be/2023/013305.php?p,Klimatŝanĝiĝo kaj incendioj detruis sudan Ĉilion,2023-04-01T00:00:00,Leonardo ARAYA,"Aktuale,SEKECO,Medio",
https://www.monato.be/2023/013306.php?p,Kial la subteno por Ukrainio ne estas ĉiea?,2023-04-01T00:00:00,Michał ŁABENDA,"Aktuale,RUSA INVADO,El diplomatia vidpunkto",
https://www.monato.be/2023/013309.php?p,Ŝtormo pro reformo,2023-04-01T00:00:00,Nican CVI COHEN,"Aktuale,ISRAELO,Politiko",
https://www.monato.be/2023/013088.php?p,"Post Babelo estu lingvo monda, sed kulture eŭropa",2023-05-01T00:00:00,Renato CORSETTI,"Aktuale,Tragoloj kaj durioj",
https://www.monato.be/2023/013181.php?p,Tolerema Esperanto-movado,2023-05-01T00:00:00,Renato CORSETTI,"Aktuale,Klasika Esperanto",
https://www.monato.be/2023/013213.php?p,Amuza disputado solvita,2023-05-01T00:00:00,Julius HAUSER,"Aktuale,PACO,El diplomatia vidpunkto",
https://www.monato.be/2023/013247.php?p,La bahaa kredo: vojo al unueco kaj paco,2023-05-01T00:00:00,Bernhard WESTERHOFF,"Aktuale,RELIGIOJ,Spirita vivo",
https://www.monato.be/2023/013249.php?p,Ĉu unika priskribo de lesba rilato?,2023-05-01T00:00:00,Bert DE WIT,"Aktuale,Kresko de ekstremismo",
https://www.monato.be/2023/013253.php?p,Ne universala (2),2023-05-01T00:00:00,Alberto GARCíA FUMERO,Aktuale,
https://www.monato.be/2023/013257.php?p,Infanlibro pri diverseco,2023-05-01T00:00:00,Kirilo BROSCH,"Aktuale,Klara senpeka lingvaĵo",
https://www.monato.be/2023/013270.php?p,Admirinda laboro,2023-05-01T00:00:00,Leandro ABRAHãO,Aktuale,
https://www.monato.be/2023/013274.php?p,Verne ne ŝtelis,2023-05-01T00:00:00,István ERTL,Aktuale,
https://www.monato.be/2023/013300.php?p,Ebla respondo al niaplaneda krizo pri nesala akvo,2023-05-01T00:00:00,Juan Carlos Montero MEDINA,"Aktuale,AKVA KRIZO,Medio",
https://www.monato.be/2023/013303.php?p,Kiel la mondo reale funkcias,2023-05-01T00:00:00,Roland ROTSAERT,"Aktuale,VIDATE SCIENCISTE,Medio",
https://www.monato.be/2023/013308.php?p,Italio kaj ĝia lingva mozaiko,2023-05-01T00:00:00,Tommaso MELACOTTE,"Aktuale,INTERVJUO,Lingvo",
https://www.monato.be/2023/013310.php?p,Kio estas oblomovismo?,2023-05-01T00:00:00,Nikita PIMENOV,"Aktuale,ESEO,Literaturo",
https://www.monato.be/2023/013311.php?p,Apologio pri mia vivo,2023-05-01T00:00:00,Garbhan MACAOIDH,"Aktuale,ESEO,Lingvo",
https://www.monato.be/2023/013312.php?p,Ĉu orient-afrikaj ĝemeloj kuniĝos?,2023-05-01T00:00:00,Frédéric DüE,"Aktuale,RUANDO/BURUNDO,Politiko",
https://www.monato.be/2023/013316.php?p,Eŭropa premio por aŭstra vilaĝo,2023-05-01T00:00:00,Julius HAUSER,"Aktuale,KONKURSO,Moderna vivo",
https://www.monato.be/2023/013317.php?p,Ĉu novtipa komercado?,2023-05-01T00:00:00,Alexander MIKISHEV,"Aktuale,UKRAINA MILITO,Moderna vivo,RUSIA INVADO",
https://www.monato.be/2023/013318.php?p,Novaj metro- kaj akvo-vojoj,2023-05-01T00:00:00,Renate kaj Walter KLAG,"Aktuale,VIENO,Moderna vivo",
https://www.monato.be/2023/013319.php?p,"Dankon al Julius Hauser, sed ne nur",2023-05-01T00:00:00,Pierre GROLLEMUND,Aktuale,
https://www.monato.be/2023/013320.php?p,"Roger Martin du Gard, literaturisto kaj pacifisto",2023-05-01T00:00:00,Renée TRIOLLE,"Aktuale,ESEO,Literaturo,ESEOO",
https://www.monato.be/2023/013321.php?p,Kia tribismo?,2023-05-01T00:00:00,Renato CORSETTI,Aktuale,
https://www.monato.be/2023/013323.php?p,Nekutima internacia virina tago,2023-05-01T00:00:00,Tea TURMANIDZE,"Aktuale,KARTVELIO,Politiko",
https://www.monato.be/2023/013265.php?p,Pollando postulas kompenson de Germanio,2023-06-01T00:00:00,Dawid KOZUB,"Aktuale,DUA MONDMILITO,Moderna vivo",
https://www.monato.be/2023/013313.php?p,Tra la sonĝoj,2023-06-01T00:00:00,Antônio CAVALCANTE,"Aktuale,MUZIKO,Arto",
https://www.monato.be/2023/013315.php?p,La milito de Vadim Sidur,2023-06-01T00:00:00,Aleksej SALOMATOV,"Aktuale,SKULPTADO,Arto",
https://www.monato.be/2023/013322.php?p,La triangulo de Kolĥido,2023-06-01T00:00:00,Tea TURMANIDZE,"Aktuale,UNESKO,Medio",
https://www.monato.be/2023/013324.php?p,Maljuniĝas la loĝantaro,2023-06-01T00:00:00,Alice LIU,"Aktuale,ĈINIO,Moderna vivo",
https://www.monato.be/2023/013325.php?p,Detektivromanon vi ne ricevos,2023-06-01T00:00:00,Nikita PIMENOV,"Aktuale,Kion sentas aŭtismaj homoj",
https://www.monato.be/2023/013326.php?p,Pri la Unuiga Eklezio,2023-06-01T00:00:00,Gerrit BERVELING,"Aktuale,REAGO,Kunlabore kun pluraj religioj",
https://www.monato.be/2023/013327.php?p,Boko Haram kaj ĝia financado,2023-06-01T00:00:00,Massimo RIPANI,"Aktuale,NIĜERIO,Politiko",
https://www.monato.be/2023/013328.php?p,Nia prioritato? La protektado de la nederlanda lingvo.,2023-06-01T00:00:00,Filip IVANčIć,"Aktuale,INTERVJUO,Lingvo",
https://www.monato.be/2023/013329.php?p,"La sorĉa, aktuala lingvaĵo de Poezio progresigu la mondon",2023-06-01T00:00:00,Bruna MILANI,"Aktuale,OPINIO,Iluzio",
https://www.monato.be/2023/013331.php?p,"Sep kaŭzoj, pro kiuj ŝanĝiĝas la nuntempa mondo",2023-06-01T00:00:00,Julius HAUSER,"Aktuale,RUSIA INVADO,Politiko",
https://www.monato.be/2023/013333.php?p,Kontraŭmensoga faktokontrolado,2023-06-01T00:00:00,Michał ŁABENDA,"Aktuale,RUSIA INVADO,El diplomatia vidpunkto",
https://www.monato.be/2023/013335.php?p,Intervjuo kun Mikaelo Bronŝtejn,2023-06-01T00:00:00,Aleksej SALOMATOV,"Aktuale,KANTOJ,Arto",
https://www.monato.be/2023/013337.php?p,Ĉu Hispanio peros pacprocezon?,2023-06-01T00:00:00,Javier ALCALDE,"Aktuale,KOLOMBIO,Politiko",
https://www.monato.be/2023/013246.php?p,Finfine nia unua esperanttema komikso!,2023-07-01T00:00:00,Fernando PITA,"Aktuale,Respeguli nian kulturon",
https://www.monato.be/2023/013314.php?p,Pensoj pri La Majstro kaj Margarita,2023-07-01T00:00:00,Nikita PIMENOV,"Aktuale,ESEO,Literaturo",
https://www.monato.be/2023/013332.php?p,Nova espero por italoj per Elly Schlein,2023-07-01T00:00:00,Federico GOBBO,"Aktuale,OPINIO,Postpandemia situacio",
https://www.monato.be/2023/013336.php?p,Nukleaj submarŝipoj varmigas la oceanon,2023-07-01T00:00:00,Julius HAUSER,"Aktuale,PACIFIKO,El diplomatia vidpunkto",
https://www.monato.be/2023/013338.php?p,"Projekto minita, pingveno savita",2023-07-01T00:00:00,Leonardo ARAYA,"Aktuale,ĈILIO,Politiko",
https://www.monato.be/2023/013339.php?p,"Geografie proksimaj, socie malproksimaj",2023-07-01T00:00:00,Ivo DURWAEL,"Aktuale,BELGIO,Politiko",
https://www.monato.be/2023/013345.php?p,Granda kelta trezoro,2023-07-01T00:00:00,Renate kaj Walter KLAG,"Aktuale,MONEROJ,Hobio",
https://www.monato.be/2023/013347.php?p,Giganta arkeo de Noa,2023-07-01T00:00:00,Garbhan MACAOIDH,"Aktuale,ARTAĴOJ,Moderna vivo",
https://www.monato.be/2023/013348.php?p,Kvar monatojn en Atlantiko,2023-07-01T00:00:00,LAST,"Aktuale,MARVOJAĜOJ,Moderna vivo",
https://www.monato.be/2023/013349.php?p,Juĝi buĉadon de civiluloj en milito,2023-07-01T00:00:00,CHO Sung Ho,"Aktuale,KOREIO-VJETNAMIO,Moderna vivo",
https://www.monato.be/2023/013350.php?p,La plej malnova libro presita per metaltipoj,2023-07-01T00:00:00,CHO Sung Ho,"Aktuale,EKSPOZICIO,Historio",
https://www.monato.be/2023/013351.php?p,Novtipaj veturiloj plibonigos vivkvaliton kaj medion,2023-07-01T00:00:00,Paolo OMODEI-ZORINI,"Aktuale,AKTUALE,Scienco",
https://www.monato.be/2023/013340.php?p,Ĉu toleremo progresas?,2023-08-01T00:00:00,Maksat KUDAJBERGEN,"Aktuale,SAUDA ARABIO,Politiko",
https://www.monato.be/2023/013341.php?p,Diplomatia miraklo sen daŭrigo,2023-08-01T00:00:00,Julius HAUSER,"Aktuale,PROKSIM-ORIENTO,El diplomatia vidpunkto",
https://www.monato.be/2023/013342.php?p,La vendisto de feliĉo,2023-08-01T00:00:00,Julian MODEST,"Aktuale,RAKONTO,Literaturo",
https://www.monato.be/2023/013343.php?p,Erevano-Carrara  manoj de amikeco,2023-08-01T00:00:00,Lida ELBAKJAN,"Aktuale,URBO-ĜEMELIĜO,Moderna vivo",
https://www.monato.be/2023/013344.php?p,Bahaa vojo al paco,2023-08-01T00:00:00,Paul DESAILLY,Aktuale,
https://www.monato.be/2023/013346.php?p,Roger Martin du Gard,2023-08-01T00:00:00,Thierry TAILHADES,Aktuale,
https://www.monato.be/2023/013354.php?p,Paca strebo al paco,2023-08-01T00:00:00,Leonardo ARAYA,"Aktuale,LATIN-AMERIKO,Politiko",
https://www.monato.be/2023/013356.php?p,Surdula lernejo sen signolingvo,2023-08-01T00:00:00,HATACHI Toshiko,"Aktuale,JAPANIO,Moderna vivo",
https://www.monato.be/2023/013357.php?p,Kiom da vero pri mRNA-vakcinoj kontraŭ kancero?,2023-08-01T00:00:00,Stefano MOROSO,"Aktuale,AKTUALE,Scienco",
https://www.monato.be/2023/013361.php?p,La filmfestivalo en ekzilo,2023-08-01T00:00:00,Aleksej SALOMATOV,"Aktuale,DOKUMENTA KINO,Arto",
https://www.monato.be/2023/013362.php?p,Rifuĝado en necerteco kaj malespero,2023-08-01T00:00:00,Intervjuis,"Aktuale,Massimo RIPANI,Politiko,D. R. KONGO",
https://www.monato.be/2023/013363.php?p,Ŝanceliĝanta demokratio,2023-08-01T00:00:00,Gabriel OLúBùNMI ÒSHó-DAVIES,"Aktuale,NIĜERIO,Politiko",
https://www.monato.be/2023/013364.php?p,Über den Wolken,2023-08-01T00:00:00,Peter SCHUNDA,Aktuale,
https://www.monato.be/2023/013365.php?p,La naturo sorĉas sed ne ŝercas,2023-08-01T00:00:00,Cristina CASELLA,"Aktuale,OPINIO,Mondvarmiĝo",
https://www.monato.be/2023/013366.php?p,Sezono de fragoj,2023-08-01T00:00:00,Renate kaj Walter KLAG,"Aktuale,AŬSTRIO,Moderna vivo",
https://www.monato.be/2023/013367.php?p,Majaa fervojo: kunlaboro surrela,2023-08-01T00:00:00,Juan Carlos MONTERO MEDINA,"Aktuale,KUBO-MEKSIKO,Moderna vivo",
https://www.monato.be/2023/013369.php?p,Sauda Arabio pretigis seĝon por Sirio,2023-08-01T00:00:00,Maksat KUDAJBERGEN,"Aktuale,PROKSIM-ORIENTO,Politiko",
https://www.monato.be/2023/013371.php?p,Furoras rostaĵo en Zibo,2023-08-01T00:00:00,Alice LIU,"Aktuale,ĈINIO,Moderna vivo",
https://www.monato.be/2023/013374.php?p,Sanmarina ĉefministro vizitas Havanon,2023-08-01T00:00:00,Juan Carlos MONTERO MEDINA,"Aktuale,KUBO,Politiko",
https://www.monato.be/2023/013376.php?p,Civila kuraĝo,2023-08-01T00:00:00,Benoît PHILIPPE,Aktuale,
https://www.monato.be/2023/013377.php?p,Ne fakgrupo,2023-08-01T00:00:00,Ineke Emmelkamp,Aktuale,
https://www.monato.be/2023/013379.php?p,Najbaroj sur la sama ŝipo,2023-08-01T00:00:00,CHO Sung Ho,"Aktuale,PACIFIKO,Politiko",
https://www.monato.be/2023/013380.php?p,La fenomeno de tutmondaj migradoj,2023-08-01T00:00:00,Nikita PIMENOV,"Aktuale,TUTMONDIĜO,Iluzio",
https://www.monato.be/2023/013381.php?p,Pintkunvena monato,2023-08-01T00:00:00,Julius HAUSER,"Aktuale,INTERNACIAJ RILATOJ,Politiko",
https://www.monato.be/2023/013279.php?p,Studo pri vortfarado en Esperanto,2023-10-01T00:00:00,Jouko LINDSTEDT,"Aktuale,Priskriba, ne preskriba",
https://www.monato.be/2023/013297.php?p,Bona komenco – bonkora esenco,2023-10-01T00:00:00,Anna kaj Mati PENTUS,Aktuale,
https://www.monato.be/2023/013299.php?p,Ŝtataneco sen ŝtato,2023-10-01T00:00:00,CHO Sung Ho,"Aktuale,ESEO,Historio",
https://www.monato.be/2023/013359.php?p,Estanteco kaj estonteco de la interslava lingvo,2023-10-01T00:00:00,Filip IVANčIć,"Aktuale,SLAVIDAJ LINGVOJ,Lingvo",
https://www.monato.be/2023/013360.php?p,"Alma, la mondo antaŭ la hejma sojlo",2023-10-01T00:00:00,Guido BRANDENBURG,Aktuale,
https://www.monato.be/2023/013378.php?p,Iniciatoj kontraŭ klimatŝanĝiĝo,2023-10-01T00:00:00,Juan Carlos Montero MEDINA,"Aktuale,KUBO,Medio",
https://www.monato.be/2023/013382.php?p,La apuda lernejo inspiras,2023-10-01T00:00:00,Stefan MACGILL,"Aktuale,VIVO,Moderna vivo",
https://www.monato.be/2023/013383.php?p,Mielo kaj absinto,2023-10-01T00:00:00,Garvan MAKAJ',"Aktuale,RAKONTO,Literaturo",
https://www.monato.be/2023/013385.php?p,Petrol-kompanio pli poluas ol produktas,2023-10-01T00:00:00,Jezer DORANTE,"Aktuale,VENEZUELO,Medio",
https://www.monato.be/2023/013386.php?p,Kompreni migradon,2023-10-01T00:00:00,Brian MOON,Aktuale,
https://www.monato.be/2023/013389.php?p,Misgvida titolo,2023-10-01T00:00:00,Ian Fantom,Aktuale,
https://www.monato.be/2023/013393.php?p,Survoje al nova parlamento,2023-10-01T00:00:00,Bert DE WIT,"Aktuale,NEDERLANDO,Politiko",
https://www.monato.be/2023/013395.php?p,Signolingvo,2023-10-01T00:00:00,Federico GOBBO,Aktuale,
https://www.monato.be/2023/013396.php?p,Signolingvo (2),2023-10-01T00:00:00,Detlef KARTHAUS,Aktuale,
https://www.monato.be/2023/013397.php?p,Ĉu nesimetria konflikto?,2023-10-01T00:00:00,Julius HAUSER,"Aktuale,MALIO,El diplomatia vidpunkto",
https://www.monato.be/2023/013399.php?p,El danĝera vivo ĵurnalista,2023-10-01T00:00:00,Intervjuis,"Aktuale,Massimo RIPANI,Politiko,MEKSIKO/PALESTINO",
https://www.monato.be/2023/013401.php?p,Signolingvo (3),2023-10-01T00:00:00,Brian MOON,Aktuale,
https://www.monato.be/2023/013402.php?p,Maltrankviliga leĝo,2023-10-01T00:00:00,Nican CVI KOHEN,"Aktuale,ISRAELO,Politiko",
https://www.monato.be/2023/013431.php?p,Nepoj kaj avinoj,2023-10-30T00:00:00,XU Jinming,"Aktuale,ĈINIO,Moderna vivo",
https://www.monato.be/2023/013387.php?p,Ĉu la plej malbona lando por vivi?,2023-11-01T00:00:00,Andrey BOCHKAREV,"Aktuale,RUSIO,Vivnivelo kaj sekureco",
https://www.monato.be/2023/013388.php?p,Spioni kaj esti spionata,2023-11-01T00:00:00,Carlo MINNAJA,"Aktuale,Timiga aventuro",
https://www.monato.be/2023/013390.php?p,Brutala liberigo de pasinteco,2023-11-01T00:00:00,Alexander MIKISHEV,"Aktuale,Nur naŭ rakontoj",
https://www.monato.be/2023/013392.php?p,Manĝi bone kaj sin trejni sekure,2023-11-01T00:00:00,ŜIBATA Satomi,"Aktuale,DIABETO,Scienco",
https://www.monato.be/2023/013398.php?p,Nehavebla daŭra paco,2023-11-01T00:00:00,Maksat KUDAJBERGEN,"Aktuale,SUDANO,Politiko",
https://www.monato.be/2023/013406.php?p,"Ne legu tiun libron en trajno, metroo aŭ buso!",2023-11-01T00:00:00,Fernando PITA,"Aktuale,Teksto vere flua kaj glata",
https://www.monato.be/2023/013407.php?p,Ĉu etika bankado eblas? Persona rakonto pri bankfraŭdo,2023-11-01T00:00:00,Xavi ALCALDE,"Aktuale,ESEO,Ekonomio",
https://www.monato.be/2023/013417.php?p,Pollando kaj Koreio pliamikiĝas per armiloj,2023-11-01T00:00:00,CHO Sung Ho,"Aktuale,INTERNACIAJ RILATOJ,Politiko",
https://www.monato.be/2023/013420.php?p,Pinochet ne pravigas la invadon en Ukrainion,2023-11-01T00:00:00,Leonardo ARAYA,"Aktuale,ESEO,Politiko",
https://www.monato.be/2023/013422.php?p,Pristudi la planedon Merkuro sur kipraj montoj,2023-11-01T00:00:00,Roberto PIGRO,"Aktuale,ITALIO/KIPRO,Scienco",
https://www.monato.be/2023/013423.php?p,BRICS kaj G20: Kompleksa mozaiko de internaciaj rilatoj,2023-11-01T00:00:00,Julius HAUSER,"Aktuale,INTERNACIAJ RILATOJ,El diplomatia vidpunkto",
https://www.monato.be/2023/013426.php?p,Politiko frostigas la voĉdonantojn,2023-11-01T00:00:00,Christian FABOSSOU,"Aktuale,NOV-KALEDONIO,Politiko",
https://www.monato.be/2023/013427.php?p,"Ambasadaj eraroj, kiuj rompas efikon",2023-11-01T00:00:00,Maksat KUDAJBERGEN,"Aktuale,BRICS,Ekonomio",
https://www.monato.be/2023/013330.php?p,Interesa sentokaoso,2023-12-01T00:00:00,Antônio CAVALCANTE,"Aktuale,MUZIKO,Arto",
https://www.monato.be/2023/013372.php?p,Maltrafita eblo,2023-12-01T00:00:00,Jezer DORANTE,"Aktuale,VENEZUELO,Politiko",
https://www.monato.be/2023/013375.php?p,Parkuro en Kubo,2023-12-01T00:00:00,Juan Carlos MONTERO MEDINA,"Aktuale,SPORTO,Moderna vivo",
https://www.monato.be/2023/013394.php?p,Pardonpetoj pro sklavigo,2023-12-01T00:00:00,Bert DE WIT,"Aktuale,Sklavigo: pasinta aŭ ne?",
https://www.monato.be/2023/013404.php?p,Pliiĝis la nombro de eksterlandaj vizitantoj,2023-12-01T00:00:00,Bardhyl SELIMI,"Aktuale,ALBANIO,Turismo",
https://www.monato.be/2023/013408.php?p,Ĉu etika bankado eblas? (2),2023-12-01T00:00:00,Roland ROTSAERT,"Aktuale,FINANCO,Ekonomio",
https://www.monato.be/2023/013412.php?p,Intrigo de la pasintaj elektoj,2023-12-01T00:00:00,Andrey BOCHKAREV,"Aktuale,TURKIO,Politiko",
https://www.monato.be/2023/013415.php?p,Polemikaj linioj dividas la maron,2023-12-01T00:00:00,Bardhyl SELIMI,"Aktuale,ALBANIO/GREKIO,Politiko",
https://www.monato.be/2023/013418.php?p,Irano reduktis la produktadon de riĉigita uranio,2023-12-01T00:00:00,Evgeni GEORGIEV,"Aktuale,IAEA,Politiko",
https://www.monato.be/2023/013424.php?p,Ŝipo de Hundertwasser,2023-12-01T00:00:00,Renate kaj Walter KLAG,"Aktuale,MARVETURADO,Turismo",
https://www.monato.be/2023/013432.php?p,Perdi la kuraĝon instrui,2023-12-01T00:00:00,CHO Sung Ho,"Aktuale,KOREIO,Moderna vivo",
https://www.monato.be/2023/013433.php?p,PDF-libro: bela sed ne oportuna,2023-12-01T00:00:00,LIU Xiaozhe (Solis),"Aktuale,BITLIBROJ,Komputado",
https://www.monato.be/2023/013437.php?p,Ĉu ankaŭ Niĝerio spertos puĉon?,2023-12-01T00:00:00,Gabriel OLUBUNMI ÒSHó-DAVIES,"Aktuale,AFRIKO,Politiko",
https://www.monato.be/2023/013443.php?p,Al kiu Dio preĝas Kiril?,2023-12-01T00:00:00,Alberto GARCíA FUMERO,"Aktuale,OPINIO,Devigo",
